{"skills": ["git", "css", "agile", "reactjs", "html", "linux", "full stack development", "ubuntu", "bitbucket", "mysql", "oracle", "project management", "jquery", "sql", "magento", "stack", "javascript", "apache", "database", "database design", "couchdb", "laravel", "nginx", "mvc", "bootstrap", "docker", "object oriented", "lifecycle", "php", "backend development", "mongodb", "centos", "management", "aws", "restful"], "fulltext": "Hoang Minh Dung\nE-mail: itmanvn07@gmail.com \u00a7 Website: itmanvn07.com \u00a7 Phone: VN:\n+84967217522\nThai: +6618271941\nBinh Thanh district, Ho Chi Minh city\nPROFESSIONAL SUMMARY\n- Object Oriented PHP Developer\n- Project management and supervisory experience, Scrum, Agile\n- Linux server managament\n- PHP, Node.js, MVC, Git / Subversion toolset, Docker, Drush, Drupal console\n- CMS: Drupal 7, Drupal 8, Magento 1.9\n- Framework: Yii , CodeIgniter, Laravel, Zend, Nodejs(exrepss)\n- Database: Database design, MS SQL, My SQL, Oracle, MongoDB\n- Front-end: Jquery, HTML, CSS, Reactjs, Bootstrap\n- Tools: Photosop, Netbean, Sublimetext, Smartgit,..\n- Others: AWS EC2, Restful API, Linux, Amazon API, Digital Ocean, Facebook APIs, Google APIs\nWORK EXPERIENCE\nAleph Labs, BangKok\n2017 \u2014 Present\nSenior Full Stack Developer\n- Participating in the full development lifecycle, including architecture, design,\ndevelopment.\n- Developed mock server used Node.js\n- Work with third-parties involved with application development\n- Mainly using Drupal 8 to developed websites (Using Views, custom module, custom\ntheme, Restful API , ..)\n- Used Drush, Docker, GIT, Bitbucket\n- Used agile and scrum methodologies to develop Drupal applications.\n- Setup Ubuntu, CentOS server, Nginx, Apache, PHP, MySQL...\n- Support Junior team members \nDBIZ Group, Ho Chi Minh\n2014 \u2014 2016\nPHP Team Leader\n- Created and developed new site capabilities and features\n- Work on Drupal, Magento, Laravel front and back end development, along with\ntheming.\n- Developed and maintained websites based on Drupal, Magento and Laravel\n- Worked with Google API, Facebook API\n- Coordinate with project manager to estimate.\n- Setup Ubuntu, Centos server as well as Memcache, Nginx, Apache, ...\n- Code review \nSutrixMedia, Ho Chi Minh\n2011 \u2014 2013\nHoang Minh Dung\n1\nSoftware Engineering\nEDUCATION\nUniversity of Information Technology (Vietnam National University)\nPHP developer\n- Created coding for websites\n- Wrote code in Drupal , Magento , Zend Framework, CodeIgniter,\nJavaScript, HTML, MySql, Couchdb\n- Worked with Facebook API to login, gather user informantion,.\n- Wrote stored procedure, view, function in PL/SQl Oracle\n- Maintained developed websites \nINTERESTS\nFootball, Billiards\nHoang Minh Dung\n2", "educations": [{"id": 4468, "gpa": null, "major": "K\u1ef9 thu\u1eadt ph\u1ea7n m\u1ec1m", "school": "University of Information Technology (Vietnam National University)", "diploma": "Bachelors", "end_time": null, "conf_score": 0.773087465715418, "start_time": null, "picklist_major": "IT - Hardware/Networking", "major_categories": "M\u00e1y t\u00ednh v\u00e0 c\u00f4ng ngh\u1ec7 th\u00f4ng tin", "major_categories_detail": "M\u00e1y t\u00ednh"}], "experiences": [{"id": 14887, "detail": "- Participating in the full development lifecycle, including architecture, design, development.\n- Developed mock server used Node.js - Work with third-parties involved with application development\n- Mainly using Drupal 8 to developed websites (Using Views, custom module, custom theme, Restful API , ..) - Used Drush, Docker, GIT, Bitbucket - Used agile and scrum methodologies to develop Drupal applications.\n- Setup Ubuntu, CentOS server, Nginx, Apache, PHP, MySQL... - Support Junior team members", "company": "Aleph Labs", "end_time": "2023-04-13T00:00:00Z", "industry": "Other", "position": "Senior Full Stack Developer", "conf_score": 0.9149979763506044, "start_time": "2017-01-01T00:00:00Z"}, {"id": 14888, "detail": "- Created and developed new site capabilities and features\n- Work on Drupal, Magento, Laravel front and back end development, along with theming.\n- Developed and maintained websites based on Drupal, Magento and Laravel - Worked with Google API, Facebook API - Coordinate with project manager to estimate.\n- Setup Ubuntu, Centos server as well as Memcache, Nginx, Apache, ... - Code review", "company": "DBIZ Group", "end_time": "2016-01-31T00:00:00Z", "industry": "Other", "position": "PHP Team Leader", "conf_score": 0.9166396554468658, "start_time": "2014-01-01T00:00:00Z"}, {"id": 14889, "detail": "- Created coding for websites\n- Wrote code in Drupal , Magento , Zend Framework, CodeIgniter, JavaScript, HTML, MySql, Couchdb - Worked with Facebook API to login, gather user informantion,.\n- Wrote stored procedure, view, function in PL/SQl Oracle - Maintained developed websites", "company": "SutrixMedia", "end_time": "2013-01-31T00:00:00Z", "industry": "Other", "position": "PHP developer", "conf_score": 0.8397249037156924, "start_time": "2011-01-01T00:00:00Z"}], "address": "Binh Thanh district, Ho Chi Minh city"}