{"skills": ["angular", "java", "mssql", "management", "studio", "excel", "redux", "entity framework", "git", "svn", "sell", "typescript", "android", "ionic", "asp", "website development", "sql", "jira", "visual studio", "bug fixing", "testing", "communication skill", "uiautomator", "database", "angular 2", "database design", "cell phone", "teamwork", "bootstrap", "m sql server", "mysql", "jquery"], "fulltext": "Nguyen Nhut Thanh\nAngular  Developer\nDate of birth:\n August,7 1993\nGender:  Male\nPhone:  0985493463\nEmail:  nhutthanh0893@gmail.com\nAddress:\n Go vap district, Ho Chi Minh city , VietNam\nWebsite:  https://www.facebook.com/nhutthanh.nguyen.54\nOBJECTIVE\nNow, I'm working as a web developer. Within 2 years of experience in Front End + .Net. I can use Redux,\nAngular2, ASP.NET.. website programming\nEDUCATION\nOct 2011 - July 2015\nCuu Long University\nInformation Technology\nGPA: 7.46 / 10\nWORK EXPERIENCE\nFebruary-2018 - Now\nSmartlog Vietnam logistics solution corporation\nAngular developer\nMain responsibilities:  \n- Code Angular2, 4\n- Nodejs Loopback , Api, MySql.\n- Using Android studio, Visual Studio Code\nVNNGIT Company Limited\nDecember 2016 -\nDeveloper\nFebruary-2018\nMain responsibilities:  \n- Code Angular2, Redux, Svelte .  \n- Learning Angular2, Redux, Node Js\n- Using Android studio, Visual Studio Code\nMarch 2016 - December 2016\nSieu Viet Company Limited\nDeveloper\n- Programming website design. \n- Website design based on ASP.NET MVC5, MSSQL\n- Support S.E.O for the company's website.\n- Programming ERD and CMR  \n- Website design work management associated with work management\nsoftware on the basis of Visual Basic \n - Integrate website interact with customer's ERD software.\nLanguage\nEnglish, Vietnamese\nComputer\nWord, Excel, Powerpoint\nPersonal skills\n- Organizational skills \n- Communication skills \n- Group skill\nOther skills\n- Use Git, Android Studio, Visual Studio, Jira, Scrum, visual code..\nSKILLS\nINTERESTS\nI like soccer, music..\nADDITIONAL INFORMATION\n- Programming on the basic Java, Testing Android application software using UIAutomator,\n- Basic Android programming.,\n- Website programming on the basis of ASP.NET MVC5 basic.\n- Ability to work in a team and adapt to a good working environment.\n- Relative English. Relative presentation skills.\n- Programming of Visual Basic, ERP software\n- Using MS SQL Server. \n- Angular 2, Nodejs, Redux\nPROJECTS\nZDEAL\n(March 2016 - December 2016)\nCustomer\nProduct of Company\nDescription\nReal Estate Website.\nTeam size\n3\nMy position\nDeveloper\nMy responsibilities\n- Design database\n- Develop website using ASP.NET MVC5 and SQL. \n- Bug Fixing.\nTechnologies used\n- Visual Studio 2015, MSSQL\n- ASP.NET MVC5\n- Git\n- Entity Framework\nVNNG-SWAP-EZ\n(December 2016 - February-2018)\nCustomer\nProduct of Company\nDescription\nAn Ecommerce platform to support people buy, sell and exchange (Cell phone,\nTablet,..).\nTeam size\n8\nMy position\nDeveloper\nMy responsibilities\n+ Create and develop new features, fix bugs.\n+ Develop website using Angular2, Redux, JQuery,.\n+ Front-end website using bootstrap,sematic UI.\n+ Teamwork. Using Git deploy code.\n+ Bug Fixing.\nTechnologies used\nAngular 2 \nNodeJs \nGIT\nRedux.\nSEM\n(February-2018 - Now)\nCustomer\nProduct of Company\nDescription\nLogistics Express\nTeam size\n6\nMy position\nDeveloper\nMy responsibilities\n+ Create and develop new features, fix bugs. \n+ Develop platform using Angular4, TypeScript, Nodejs and MySql.\n+ Build mobile app using Ionic2,3. \n+ Teamwork, Using SVN deploy code.\n+ Bug Fixing.\nTechnologies used\nAngular 4\nNodeJs loopback\nSVN\nIONIC 2,3\nMYSQL\n\u00a9 topcv.vn", "educations": [{"id": 4471, "gpa": "7.46", "major": "C\u00f4ng ngh\u1ec7 th\u00f4ng tin", "school": "Cuu Long University", "diploma": "Bachelors", "end_time": "2015-07-01T00:00:00Z", "conf_score": 0.8413267261986577, "start_time": "2011-10-01T00:00:00Z", "picklist_major": "IT - Hardware/Networking", "major_categories": "M\u00e1y t\u00ednh v\u00e0 c\u00f4ng ngh\u1ec7 th\u00f4ng tin", "major_categories_detail": "C\u00f4ng ngh\u1ec7 th\u00f4ng tin"}], "experiences": [{"id": 14895, "detail": "ain responsibilities:\n- Code Angular2, 4 - Nodejs Loopback , Api, MySql. - Using Android studio, Visual Studio Code", "company": "Smartlog Vietnam logistics solution corporation", "end_time": "2023-04-13T00:00:00Z", "industry": "Transportation & Logistics", "position": "Angular developer", "conf_score": 0.9283402044765778, "start_time": "2018-02-01T00:00:00Z"}, {"id": 14897, "detail": "ain responsibilities:\n- Code Angular2, Redux, Svelte . - Learning Angular2, Redux, Node Js - Using Android studio, Visual Studio Code", "company": "VNNGIT Company Limited", "end_time": "2018-01-31T00:00:00Z", "industry": "High Technology", "position": "Developer", "conf_score": 0.8734832502047997, "start_time": "2016-12-01T00:00:00Z"}, {"id": 14900, "detail": "- Programming website design.\n- Website design based on ASP.NET MVC5, MSSQL - Support S.E.O for the company's website.\n- Programming ERD and CMR - Website design work management associated with work management software on the basis of Visual Basic - Integrate website interact with customer's ERD software.", "company": "Sieu Viet Company Limited", "end_time": "2016-12-31T00:00:00Z", "industry": "Other", "position": "Developer", "conf_score": 0.9257372771525854, "start_time": "2016-03-01T00:00:00Z"}], "address": "Go vap district, Ho Chi Minh city , Vietnam"}