{"skills": ["stack", "responsive", "budgeting", "graphql", "cloud", "sales", "mongodb", "sidekiq", "postgresql", "cloud storage", "elasticsearch", "rail", "redis", "ruby", "rspec", "google cloud", "google cloud storage", "algorithm", "design pattern", "restful", "oop", "github", "oauth", "sales activities", "reactjs", "chai", "database", "memcached", "database design", "mocha", "full stack development", "bootstrap", "jquery"], "fulltext": "Th\u00e0nh Hu\u1ef3nh Ki\u1ebfn \nRuby on Rails developer \nGithub hkthanh89 \nLinkedin hkthanh \nStackoverflow thanh \nSKILLS \n-Experience building products with RoR. \n-Experience writing tests. \n-Experience designing and developing RESTful APIs, caching, database design to \nimprove performance. \n-Familiarity with refactoring and code review processes to maintain code quality \nstandards. \n-Understanding of OOP, some design patterns, scalings. \nEXPERIENCE \nRoR developer, MySQUAR; HCM City, Vietnam \u2014 Apr 2016\u2014Nov 2018 \n\u2756MyChat: Social application built solely for Myanmar \n-Develop APIs and write tests using OAuth, RoR, ReactJS, PostgreSQL, Elasticsearch, \nRSpec, FactoryGirl, Sidekiq, Memcached, Redis. \n\u2756Photo/Audio Server: A server serves for uploading/resize photos, audios \n-Develop uploading audios api, help the team write tests for all APIs using NodeJS, \nExpress, Mocha, Chai, Sinon, Google Cloud Storage. \n\u2756MingalarbarMorning: News website built solely for Myanmar \n-Develop APIs using NodeJS, Express, PostgreSQL, GraphQL. \nRoR developer, FreeRangeTechnology; HCM City, Vietnam \u2014 May 2014\u2014Feb 2016 \n\u2756GPDQ: Uber-like app help people making appointment with doctors. \n-Develop APIs using RoR, PostgreSQL, Google distance services, Sidekiq. \n\u2756Hellobacsi: Health news website for Vietnamese \n-Full stack development using RoR, PostgreSQL, Bootstrap, Responsive Web. \n\u2756Fightclub: Football Betting website \n-Full stack development using RoR, PostgreSQL, BackboneJS, Responsive Web, \nSidekiq. \nRoR developer, Nexle Corporation; HCM City, Vietnam \u2014 Aug 2013\u2014Apr 2014 \n\u2756ProfitPlanner: A budgeting and forecasting program that uses complex algorithms to \nsimplify the calculation of financial and sales activity targets \n-Full stack development using RoR, PostgreSQL, Bootstrap, jQuery, S3, Sidekiq. \n\u2756Dealhits & DealhitsBiz: Location-based social mobile shopping applications for \nshoppers, restaurants and retailers to engage and interact directly \n-Full stack development using RoR, MongoDB, Elasticsearch, Bootstrap, jQuery, S3, \nSidekiq. \nRoR developer, Freelancer \u2014 Feb 2013\u2014Jul 2013 \n\u2756Work on freelance projects developed by RoR, PostgreSQL, FactoryGirl, RSpec, \njQuery. \nSIDE PROJECTS \n-URL Preview API written in Go. \n-Online Test System written in RoR. \nEDUCATION \nHoa Sen University, Vietnam \u2014 Bachelor of Information Technology, 2013", "educations": [{"id": 4473, "gpa": null, "major": "C\u00f4ng ngh\u1ec7 th\u00f4ng tin", "school": "Hoa Sen University", "diploma": "Bachelors", "end_time": "2013-01-01T00:00:00Z", "conf_score": 0.9575520321939274, "start_time": null, "picklist_major": "IT - Hardware/Networking", "major_categories": "M\u00e1y t\u00ednh v\u00e0 c\u00f4ng ngh\u1ec7 th\u00f4ng tin", "major_categories_detail": "C\u00f4ng ngh\u1ec7 th\u00f4ng tin"}], "experiences": [{"id": 14894, "detail": "\u2756MyChat: Social application built solely for Myanmar -Develop APIs and write tests using OAuth, RoR, ReactJS, PostgreSQL, Elasticsearch, RSpec, FactoryGirl, Sidekiq, Memcached, Redis. \u2756Photo/Audio Server: A server serves for uploading/resize photos, audios\n-Develop uploading audios api, help the team write tests for all APIs using NodeJS, Express, Mocha, Chai, Sinon, Google Cloud Storage. \u2756MingalarbarMorning: News website built solely for Myanmar -Develop APIs using NodeJS, Express, PostgreSQL, GraphQL.", "company": "MySQUAR", "end_time": "2018-11-30T00:00:00Z", "industry": "Other", "position": "RoR developer", "conf_score": 0.9162385206282713, "start_time": "2016-04-01T00:00:00Z"}, {"id": 14896, "detail": "\u2756GPDQ: Uber-like app help people making appointment with doctors.\n-Develop APIs using RoR, PostgreSQL, Google distance services, Sidekiq. \u2756Hellobacsi: Health news website for Vietnamese -Full stack development using RoR, PostgreSQL, Bootstrap, Responsive Web. \u2756Fightclub: Football Betting website\n-Full stack development using RoR, PostgreSQL, BackboneJS, Responsive Web, Sidekiq.", "company": "FreeRangeTechnology", "end_time": "2016-02-29T00:00:00Z", "industry": "High Technology", "position": "RoR developer", "conf_score": 0.9162385206282713, "start_time": "2014-05-01T00:00:00Z"}, {"id": 14899, "detail": "\u2756ProfitPlanner: A budgeting and forecasting program that uses complex algorithms to simplify the calculation of financial and sales activity targets\n-Full stack development using RoR, PostgreSQL, Bootstrap, jQuery, S3, Sidekiq. \u2756Dealhits & DealhitsBiz: Location-based social mobile shopping applications for shoppers, restaurants and retailers to engage and interact directly\n-Full stack development using RoR, MongoDB, Elasticsearch, Bootstrap, jQuery, S3, Sidekiq.", "company": "Nexle Corporation", "end_time": "2014-04-30T00:00:00Z", "industry": "Other", "position": "RoR developer", "conf_score": 0.9162385206282713, "start_time": "2013-08-01T00:00:00Z"}, {"id": 14902, "detail": "\u2756Work on freelance projects developed by RoR, PostgreSQL, FactoryGirl, RSpec, jQuery.", "company": "Nexle Corporation", "end_time": "2013-07-31T00:00:00Z", "industry": "Other", "position": "RoR developer, Freelancer", "conf_score": 0.6925429707670153, "start_time": "2013-02-01T00:00:00Z"}], "address": null}