{"skills": ["sonar", "scala", "java", "microservices", "css", "json", "git", "agile", "window server 2008", "algorithm", "maven", "svn", "tomcat", "structure", "j2ee", "html", "linux", "design pattern", "mysql", "oracle", "security", "nosql", "mssql", "selenium", "cassandra", "management information system", "elasticsearch", "window server", "written communication", "oop", "protocol", "spring boot", "xml", "mvc", "docker", "creative thinking", "hibernate", "rest", "gradle", "mongodb", "spring", "postgresql", "management", "data structure", "restful", "problem solving"], "fulltext": "Hai Nguyen \nAim to become a technical leader by \ncontinuously acquiring different  \ndevelopment frameworks and technologies \nWork Experience \n11/2014 \u2013 present \nHo Chi Minh, VN \nSenior Java Developer \nLaudert Vietnam Co., Ltd. \nResponsibilities & Accomplishments \nActing team leader, performing code review and daily \nverbal reporting to Germany team. Continuously \nreleased high quality features and fix bugs to Germany \nteam. \n6/2013 \u2013 8/2014 \nHo Chi Minh, VN \nSenior Java Developer  \nKMS Technology, Inc. \nResponsibilities & Accomplishments \nMaintaining a big data processing system. \n2/2011 \u2013 5/2013 \nHo Chi Minh, VN \nSenior Java Developer  \nITFarm AS \nResponsibilities & Accomplishments \nLeading a team of four, providing solutions for technical \nissues to the team and daily verbal reporting to Norway \nteam, providing IT Help Desk for production server.  \nContinuously released high quality features and fixed \nbugs for the website kompetansebors.no. \n10/2007 \u2013 6/2010 \nHo Chi Minh, VN \nSenior Java Developer  \nCOA Vietnam Co., Ltd. \nResponsibilities & Accomplishments \nSuccessfully maintained an internal HRM portal.  \nEducation \n2002 \u2013 2007 \nBachelor of Science in Information Technology \nUniversity of Natural Sciences \n2004 \u2013 2005 \nDiploma in Information Systems Management \nAptech \n2005 \u2013 2006 \nHigher Diploma in Software Engineering \nAptech \nSkills & Competences \nCode review\nCreative thinking\nProblem solving\nGoal oriented\nTeam work\nVerbal and written\ncommunication in English\nAnalytical skill\nOnsite Assignment \nThe UK (2 months), Norway (1 month), Germany (1 \nmonth) \nTechnical Skills \nJava, J2EE, Scala, Hibernate, Microservices, Restful, \nSpring (AOP, Security, MVC & Integration, Batch), Spring \nboot, Wicket, HTML/CSS/JS, REST, SOAP, JSON, XML, UX \nDesign. \nOOP, DBMS, Data structures, algorithms, programming \nprinciples, web protocols, etc. \nGit, SVN, Maven, Gradle, Docker, Tomcat, Selenium, \nSonar, automated tests \nMySQL, PostgreSQL, Oracle, MSSQL, NoSQL (MongoDB, \nCassandra, Elasticsearch) \nHai Nguyen \nAim to become a technical leader by \ncontinuously acquiring different  \ndevelopment frameworks and technologies \nLinux, Windows Server 2008 R2 \nAchievements & Certificates \nGeneral English in Australia (2010) \nIELTS 7.0 \nInterests \nReading, AI, Software Agile Development, Table Tennis, \nDesign Pattern.  ", "educations": [{"id": 4484, "gpa": null, "major": "C\u00f4ng ngh\u1ec7 th\u00f4ng tin", "school": "University of Natural Sciences", "diploma": "Bachelors", "end_time": "2007-01-01T00:00:00Z", "conf_score": 0.8775597701276474, "start_time": "2002-01-01T00:00:00Z", "picklist_major": "IT - Hardware/Networking", "major_categories": "M\u00e1y t\u00ednh v\u00e0 c\u00f4ng ngh\u1ec7 th\u00f4ng tin", "major_categories_detail": "C\u00f4ng ngh\u1ec7 th\u00f4ng tin"}], "experiences": [{"id": 14938, "detail": "Responsibilities & Accomplishments Acting team leader, performing code review and daily verbal reporting to Germany team. Continuously released high quality features and fix bugs to Germany team.", "company": "Laudert Vietnam Co., Ltd.", "end_time": "2023-04-13T00:00:00Z", "industry": "Other", "position": "Senior Java Developer", "conf_score": 0.9283402044765778, "start_time": "2014-11-01T00:00:00Z"}, {"id": 14939, "detail": "Responsibilities & Accomplishments Maintaining a big data processing system.", "company": "KMS Technology, Inc.", "end_time": "2014-08-31T00:00:00Z", "industry": "High Technology", "position": "Senior Java Developer", "conf_score": 0.9436608569184953, "start_time": "2013-06-01T00:00:00Z"}, {"id": 14940, "detail": "Responsibilities & Accomplishments Leading a team of four, providing solutions for technical issues to the team and daily verbal reporting to Norway team, providing IT Help Desk for production server.\nContinuously released high quality features and fixed bugs for the website kompetansebors.no.", "company": "ITFarm AS", "end_time": "2013-05-31T00:00:00Z", "industry": "Other", "position": "Senior Java Developer", "conf_score": 0.9283402044765778, "start_time": "2011-02-01T00:00:00Z"}, {"id": 14941, "detail": "Responsibilities & Accomplishments Successfully maintained an internal HRM portal.", "company": "COA Vietnam Co., Ltd.", "end_time": "2010-06-30T00:00:00Z", "industry": "Other", "position": "Senior Java Developer", "conf_score": 0.9512303155325736, "start_time": "2007-10-01T00:00:00Z"}], "address": null}