{"skills": ["css3", "wordpress", "responsive", "javascript", "search engine", "frontend development", "jquery", "vuejs", "git", "svn", "html5", "bem", "search", "maintenance", "trello", "website development", "css", "ecmascript", "jira", "le", "github", "bug fixing", "testing", "reactjs", "woocommerce", "magento", "bitbucket", "php", "agile", "html"], "fulltext": "My Tran \n--- Front-end developer --- \nProfile \nA hardworking, reliable and dedicated experience web developer, with 6+ years of agency \nexperience in Ho Chi Minh city, VietNam. \nWant to find a place that I can contribute and develop my careers. \nTechnical Skills \nJavascript:\nEcmascript 6 \nLibrary: \nVuejs, Jquery \nWeb UI: \nHtml5, Css3, Sass, Less, Bem \nVersion Control: \nGit, GitHub, BitBucket, GitLabs, Svn \nTools: \nJira, Confluence, Trello \nCMS: \nWordpress, Magento, Magnolia \nOthers: \nSearch engine optimisation, Accessibility \nCareer History \nEmbrace-it - PHP Developer                                                                 October 2018 - present \nPart of an team working on Wordpress project \nTechnology: Worpress, Woocommerce, Jquery \nEkino - Experience Frontend Developer                                      January 2017 - November 2018 \nPart of an team working on multiple projects:  \n-\nGlencore: http://www.glencore.com \n-\nHenner: https://particuliers.henner.com \nUsing a wide range of front-end technologies: Jquery, Vuejs \nCreating reusable web components featuring. \nTake part in the company\u2019s training course (Reactjs, Testing ...) \nCodespot - Frontend Developer                                                      February 2012 - August 2016 \nPart of an agile team creating Wordpress themes that sold on themeforest \n-\nCreating template from Psd \n-\nCreating wordpress theme from template \n-\nBug fixing and maintenance \n-\nSupport clients \nTechnology: Html, Css, Photoshop, Jquery, Wordpress, WooCommerce \nPortfolio \nhttp://www.glencore.com/ \nhttps://particuliers.henner.com/ \nhttps://themeforest.net/item/woocommerce-supermarket-theme-gomarket/7049228?s_rank=11 \nhttps://themeforest.net/item/jewelry-responsive-wordpress-theme/17298856?s_rank=12 \nhttps://themeforest.net/item/woocommerce-wordpress-theme-techgostore/5954407?s_rank=13 \nhttp://wpdance.com/ \nEducation \n2012: Graduated with honors at The Ho Chi Minh city University of Transport. \nFreecodecamp course \nScrimba course \nPersonal details \nFullname:\nTran Thi Xuan My \nDate of birth: \n05/01/1988 \nMobile phone: \n(84+) 902 593 118 \nEmail: \nxuanmypt@gmail.com \nSkype: \npocapt \nMy working moto: \n\u201cLess is More\u201d \nPowered by TCPDF (www.tcpdf.org)", "educations": [{"id": 4485, "gpa": null, "major": null, "school": "The Ho Chi Minh city University of Transport", "diploma": "Bachelors", "end_time": "2012-01-01T00:00:00Z", "conf_score": 0.8086621310791741, "start_time": null, "picklist_major": "Other", "major_categories": "", "major_categories_detail": ""}], "experiences": [{"id": 14942, "detail": "art of an team working on Wordpress project\nTechnology: Worpress, Woocommerce, Jquery", "company": "Embrace", "end_time": "2023-04-13T00:00:00Z", "industry": "Other", "position": "PHP Developer", "conf_score": 0.9125776658202421, "start_time": "2018-10-01T00:00:00Z"}, {"id": 14943, "detail": "Part of an team working on multiple projects:\n- Glencore: http://www.glencore.com\n- Henner: https://particuliers.henner.com\nUsing a wide range of front-end technologies: Jquery, Vuejs Creating reusable web components featuring.\nTake part in the company\u2019s training course (Reactjs, Testing ...)", "company": "Ekino", "end_time": "2018-11-30T00:00:00Z", "industry": "Other", "position": "Frontend Developer", "conf_score": 0.9060923567537197, "start_time": "2017-01-01T00:00:00Z"}, {"id": 14946, "detail": "Part of an agile team creating Wordpress themes that sold on themeforest\n- Creating template from Psd - Creating wordpress theme from template\n- Bug fixing and maintenance\n- Support clients\nTechnology: Html, Css, Photoshop, Jquery, Wordpress, WooCommerce", "company": "Codespot", "end_time": "2016-08-31T00:00:00Z", "industry": "High Technology", "position": "Frontend Developer", "conf_score": 0.9174648511369632, "start_time": "2012-02-01T00:00:00Z"}], "address": null}