{"skills": ["stack", "sc", "angular", "css3", "operation system", "database schema", "java", "json", "babel", "javascript", "bootstrap", "es6", "data format", "risks", "management", "redux", "java core", "spring boot", "object oriented", "vuejs", "hard working", "html5", "structure", "analysis", "requirejs", "typescript", "spring", "react native", "redux saga", "redux thunk", "asp", "website development", "sql", "restful", "signalr", "oop", "css", "grunt", "software development", "testing", "mvc", "reactjs", "system design", "twitter", "database", "python", "gulp", "angularjs", "operations management", "material ui", "mysql", "jquery"], "fulltext": "PROFILE\nExtremely motivated to constantly develop my skills and grow\nprofessionally. As an ambitious and hard-working individual, I handle\nmultiple tasks on a daily basis competently, working well under the\npressure. More than 4 years working on online industry as a web\ndeveloper, I've learned & got experiences at web development\nenvironments, program languages, database, and management operation\nsystem. I'm confident in my ability to come up with interesting ideas for\nproject. \nNGUYEN NHUT TRINH\nWEB DEVELOPER\nCONTACT\n01656 033 621 \n0356 033 621 \nSKYPE: MRNHUTTRINH \nEXPERIENCE\nFULL STACK WEB DEVELOPER \nPositioin: 70% Frontend - 30% Backend\nFREELANCE TEAM | OCT 2017 - JUN 2018 (2 PROJECTS) \nAnalyze requirements, research and develop new features. \nDesign new features base on exist structure system.\nDesign mockup, database schema and write specification\ndocument for team members do their works. \nDevelop web application with JAVA, Javascript, ReactJs and\nMaterial UI \nDevelop RESTful API providing JSON data format for mobile and\nweb application. \nExploit web system \nTracking performance, improve connection speed, customize sql\nstatement to improve query database performance \nCo-worker, support team member when they're getting stuck. \nFULL STACK WEB DEVELOPER \nPositioin: 70% Frontend - 30% Backend \nTMA SOLUTIONS  | JAN 2015 - SEP 2018 (+4 PROJECTS) \nAnalyze requirements, research and develop new features.\nDevelop web application with JAVA, NodeJS, Websocket,\nExpressJS, Jesmine, Babel, Springboot, Python, Javascript,\nTypescript, ReactJs and Material UI, Bootstrap, Jquery,\nPostgres, RedShift. \nResearch and develop new components/company coding\nlibrary using new technologies \nAssist Team Leader to estimate development related tasks,\ndesign the database schema and identify risks \nProvide support to Software Development Engineer to\nmaintain and extend existing development software and\nactivities. \n Support to create test plans and scripts, carry out bugs\ntesting, identify defects and fix them where they were\ndiscovered or required. \nDevelop RESTful API providing JSON data format for\nmobile and web application. \nCo-worker, support team member when they're getting\nstuck. \nMRNHUTTRINH@GMAIL.COM \nWWW.GITHUB.COM/MRNHUTTRINH \nBRIEF PROFESSIONAL SKILLS\nREACTJS (redux-saga, redux-thunk) \nANGULARJS \nVUEJS \nREACT-NATIVE \nJAVASCRIPT/ES6 \nTYPESCRIPT \nHTML5/CSS3 \nSCSS/SASS \nWEBPACK/BABEL \nUX/UI \nOOP \nNODE JS \nJAVA \nPYTHON \nPOSTGRES \nREDSHIFT \nSQL SERVER \nENGLISH \nMANAGEMENT \nANALYSIS\nSOCIAL MEDIA\nTWITTER: @MRNHUTTRINH \nFACEBOOK: /MRNHUTTRINH \nFULL STACK WEB DEVELOPER \nPositioin: 70% Frontend - 30% Backend \nKIEN NHAN JSC  | JUL 2013 - DEC 2014 (2 PROJECTS) \nAnalyze requirements, research and develop new features. \nDevelop web application with .NET, MVC5 , SignalR,  Javascript,\nAngularJS, Bootstrap, Jquery, SQLSERVER.\nCo-worker, support team member when they're getting stuck. \nSKILLS \nOBJECT-ORIENTED PROGRAMMING (OOP)                              4/5 \nFRONT END                                                                                  4/5 \nJAVASCRIPT (ES5, ES6, COMMONJS, REQUIREJS) \nTYPESCRIPT \nHTML5/CSS3/SCSS \nWEBPACK, GULP, GRUNT, BABEL \nSOCKETIO, WEBSOCKET \nJQUERY, REACTJS, REDUX, ANGULAR, VUEJS \nUI DESIGN: BOOTSTRAP, PURE CSS, MATERIAL UI, FLAT UI \nBACK END                                                                                     4/5 \nJAVA (CORE, SPRING BOOT) \nASP.NET (MVC) \nNODEJS \nPYTHON\nDATABASE                                                                                    4/5 \nPOSTGRES, REDSHIFT, MYSQL, SQL SERVER \nCOMMUNICATION                                                INTERMEDIATE \nENGLISH \nOTHER SKILL                                                                               4/5 \nLEAD  ANALYTIC\nEDUCATION \nOPEN UNIVERSITY | 2009 - 2013 \nCOMPUTER SCIENTIST\nPowered by TCPDF (www.tcpdf.org)", "educations": [{"id": 4509, "gpa": null, "major": "Khoa h\u1ecdc m\u00e1y t\u00ednh", "school": "OPEN UNIVERSITY", "diploma": "Bachelors", "end_time": "2013-01-01T00:00:00Z", "conf_score": 0.9387061771431047, "start_time": "2009-01-01T00:00:00Z", "picklist_major": "IT - Hardware/Networking", "major_categories": "M\u00e1y t\u00ednh v\u00e0 c\u00f4ng ngh\u1ec7 th\u00f4ng tin", "major_categories_detail": "M\u00e1y t\u00ednh"}], "experiences": [{"id": 15041, "detail": "(+4 PROJECTS) Analyze requirements, research and develop new features.\nDevelop web application with JAVA, NodeJS, Websocket, ExpressJS, Jesmine, Babel, Springboot, Python, Javascript, Typescript, ReactJs and Material UI, Bootstrap, Jquery, Postgres, RedShift. Research and develop new components/company coding library using new technologies\nAssist Team Leader to estimate development related tasks, design the database schema and identify risks\nProvide support to Software Development Engineer to maintain and extend existing development software and activities.\nSupport to create test plans and scripts, carry out bugs testing, identify defects and fix them where they were discovered or required.\nDevelop RESTful API providing JSON data format for mobile and web application.\nCo-worker, support team member when they're getting stuck.", "company": "TMA SOLUTIONS", "end_time": "2018-09-30T00:00:00Z", "industry": "High Technology", "position": "WEB DEVELOPER", "conf_score": 0.8711662964611804, "start_time": "2015-01-01T00:00:00Z"}, {"id": 15042, "detail": "(2 PROJECTS) Analyze requirements, research and develop new features.\nDesign new features base on exist structure system.\nDesign mockup, database schema and write specification document for team members do their works.\nDevelop web application with JAVA, Javascript, ReactJs and\nMaterial UI Develop RESTful API providing JSON data format for mobile and web application.\nExploit web system\nTracking performance, improve connection speed, customize sql statement to improve query database performance\nCo-worker, support team member when they're getting stuck.", "company": "FREELANCE TEAM", "end_time": "2018-06-30T00:00:00Z", "industry": "Other", "position": "FULL STACK WEB DEVELOPER", "conf_score": 0.8620665934094431, "start_time": "2017-10-01T00:00:00Z"}, {"id": 15043, "detail": "(2 PROJECTS) Analyze requirements, research and develop new features.\nDevelop web application with .NET, MVC5 , SignalR, Javascript, AngularJS, Bootstrap, Jquery, SQLSERVER. Co-worker, support team member when they're getting stuck.", "company": "KIEN NHAN JSC", "end_time": "2014-12-31T00:00:00Z", "industry": "Other", "position": "WEB DEVELOPER", "conf_score": 0.8620665934094431, "start_time": "2013-07-01T00:00:00Z"}], "address": null}