{"skills": ["postman", "task management", "java", "marketing", "javascript", "c#", "management", "studio", "vba", "blockchain", "self learning", "git", "svn", "analysis", "project management", "investments", "mobile platform", "maintenance", "sql", "css", "visual studio", "inventory management", "software development", "mvc", "unity", "oracle", "database", "teamwork", "analyst", "nec", "bootstrap", "mssql", "html"], "fulltext": "My Curriculum Vitae \nPROFILE \nFull Name: \n Dinh Ngoc Bac. \nGender: \n Male. \nBirthday: \n 04/09/1993. \nMarital Status: Single. \nNationality: \nVietnamese. \nAddress:            1368/11 Phuoc Kien - Nha Be \u2013 Ho Chi Minh City. \nPhone Number:    0969781201. \nEmail:                    Backaka93@gmail.com \nEDUCATION BACKGROUND \n\uf0b7 Graduate bachelor of computer science at FPT - Greenwich University in July 2016. \nDESCRIPTION \n\uf0b7 I have 2 years of practical software development experience. I can work under high \npressure and willing to learn new programming languages as required by the project.  \n\uf0b7 A good team player to effectively work in a dedicated team. \n\uf0b7 Trying to learn as much as possible and do my best to accomplish my task. \n\uf0b7 Having good opportunities to get promotion in my job. \n\uf0b7 My goal is to become a project manager. \nSKILLS \n\uf0b7 Experience with winform, web form, web api. \n\uf0b7 Back end:  2 years\u2019 experience with C#, vb.net, vb6, vba. \n\uf0b7 Front end: basic knowledge html, css, bootstrap\u2026 \n\uf0b7 Database: 2 years\u2019 experience with sql server and oracle. \n\uf0b7 Tool: Visual Studio, sql server, oracle sql developer , postman\u2026 \n\uf0b7 Experience working with svn, git. \n\uf0b7 Teamwork, Task management, Self-learning skill. \nLANGUAGE \n\uf0b7 English: communication.\nEXPERIENCE \n\uf0d8 Time: 08/2016 \u2013 12/2016 \nSoftware Developer at FPT-Software Company (HCM city) \nProject Name: NICHIRIN. \nProject Description: Develop application create Tool to log/manage timesheet \nof employee. \nResponsibilities: \n\uf0fc Study and analysis requirement from customer. \n\uf0fc Create functionalities follow by PM\u2019s requirement. \nTechnologies Used:  \n\uf0fc C # \n\uf0fc Mssql \n\uf0d8 Time: 01/2017 \u2013 04/2017 \nSoftware Developer at FPT-Software Company (HCM city) \nProject Name: MARUKAMI. \nProject Description:  \nMigration multi-projects from VB6 to VB.NET. \n Responsibilities: \n\uf0fc Study and analyst document of vb6. \n\uf0fc Create user control to function in vb.net. \n\uf0fc Migration vb6 to vb.net and test function. \nTechnologies Used:  \n\uf0fc Vb6, vb.net \n\uf0fc Mssql \n\uf0d8 Time: 05/2017 \u2013 11/2017 \nSoftware Developer at FPT-Software Company (HCM city) \nProject Name: CPD_ODC. \nProject Description:  \nBuild the store's inventory management system. \n Responsibilities:  \n\uf0fc Study and analysis requirement from customer. \n\uf0fc Meeting and discuss with customer. \n\uf0fc Create detail design document from basic design document of customer. \n\uf0fc Create stored procedure. \n\uf0fc Build five screens based on detailed design document. \nTechnologies Used:  \n\uf0fc C# (client) \n\uf0fc Java (server) \n\uf0fc Oracle (database) \n\uf0d8 Time: 01/2018 \u2013 04/2018 \nSoftware Developer at Nichietsu Company (HCM city) \nProject Name: Migration (Onsite at customer's company : NEC company). \nProject Description:  \nMigration vb6 to vb.net. \n Responsibilities:  \n\uf0fc Meeting and discuss with customer. \n\uf0fc Fix bug and define pattern. \n\uf0fc Migration vb6 to vb.net and test function. \nTechnologies Used:  \n\uf0fc Vb6, vb.net \n\uf0fc Mssql \n\uf0d8 Time: 05/2018 \u2013 07/2018 \nSoftware Developer at Nichietsu Company (HCM city) \nProject Name: Ewallet. \nProject Description:  \nBuild system virtual currency investment based on the multi \nlevel marketing model (MLM). \n Responsibilities:  \n\uf0fc Analysis requirement from customer. \n\uf0fc Meeting and discuss with customer. \n\uf0fc Research api blockchain. \n\uf0fc Create function get api block chain and handle to display. \nTechnologies Used:  \n\uf0fc C # (web mvc) \n\uf0fc Javascript \n\uf0fc Mssql \n\uf0d8 Time: 07/2018 \u2013 08/2018 \nSoftware Developer at Nichietsu Company (HCM city) \nProject Name: Gyoumu and Kytech. \nProject Description:  \nThese are the two production line management projects in a \nfactory. \n Responsibilities:  \n\uf0fc Meeting and receive requests from customers. \n\uf0fc Maintenance, bug fixes and upgrade the system. \nTechnologies Used:  \n\uf0fc C # (web service of project gyoumu) \n\uf0fc Vb.net (winform of project kytech) \n\uf0fc Mssql \n\uf0d8 Time: 08/2018 \u2013 present \nSoftware Developer at Nichietsu Company (HCM city) \nProject Name:Ipad. \nProject Description:  \nBuild warehouse management running on the mobile platform. \n Responsibilities:  \n\uf0fc Analysis requirement. \n\uf0fc Write api function, design UI with Unity. \n\uf0fc Handling logic for each screen. \n\uf0fc Support member in team \nTechnologies Used:  \n\uf0fc C # \n\uf0fc Unity for design UI \n\uf0fc Mssql  \nHOBBY: \nI really like football\u2026 It is a part of my life. \nDinh Ngoc Bac \nPowered by TCPDF (www.tcpdf.org)", "educations": [{"id": 4519, "gpa": null, "major": "Khoa h\u1ecdc m\u00e1y t\u00ednh", "school": "FPT - Greenwich University", "diploma": "Bachelors", "end_time": "2016-07-01T00:00:00Z", "conf_score": 0.8556839241168921, "start_time": null, "picklist_major": "IT - Hardware/Networking", "major_categories": "M\u00e1y t\u00ednh v\u00e0 c\u00f4ng ngh\u1ec7 th\u00f4ng tin", "major_categories_detail": "M\u00e1y t\u00ednh"}], "experiences": [{"id": 15089, "detail": "(HCM city)\nProject Name: Migration (Onsite at customer's company : NEC company).\nProject Description: Migration vb6 to vb.net.\nResponsibilities: Meeting and discuss with customer.\nFix bug and define pattern.\nMigration vb6 to vb.net and test function.\nTechnologies Used: Vb6, vb.net\nMssql", "company": "Nichietsu Company", "end_time": "2018-04-30T00:00:00Z", "industry": "Other", "position": "Software Developer", "conf_score": 0.9142206543796373, "start_time": "2018-01-01T00:00:00Z"}, {"id": 15091, "detail": "HCM city)\nProject Name: NICHIRIN. Project Description: Develop application create Tool to log/manage timesheet of employee.\nResponsibilities: Study and analysis requirement from customer.\nCreate functionalities follow by PM\u2019s requirement.\nTechnologies Used: C # Mssql", "company": "FPT - Software Company", "end_time": "2016-12-31T00:00:00Z", "industry": "High Technology", "position": "Software Developer", "conf_score": 0.9142206543796373, "start_time": "2016-08-01T00:00:00Z"}], "address": "1368/11 Phuoc Kien - Nha Be \u2013 Ho Chi Minh City"}