{"skills": ["aws", "automation", "security system", "javascript", "legacy system", "apache", "c#", "ams", "excel", "security", "postgresql", "object oriented", "ubuntu", "rail", "ruby", "android", "maintenance", "field astronomy", "algorithm", "sql", "css", "design pattern", "mechanical engineering", "object oriented software", "system software", "software development", "business logic", "backend development", "revenue streams", "math", "back off", "problem solving", "php", "mysql"], "fulltext": "TR\u1ea6N \u0110\u00ccNH PH\u00da \nADDRESS : 14/13/55 Th\u00e2n Nh\u00e2n Trung street, 13rd ward, T\u00e2n B\u00ecnh district, H\u1ed3 Ch\u00ed Minh city, Vietnam \nEMAIL : tran.dinh.phu.tb@gmail.com \nSKYPE ID : tran.dinh.phu.tb (available 8:00-17:00 GMT+7) \nPHONE NUMBER : +84908078123 (available 8:00-22:00 GMT+7) \nFullstack/ backend developer \nPROFILE \n\u2022 I consider myself as a deep learner with knowledge of multiple fields, an out-of-the-box \nthinker, and a wannabe inventor. \n\u2022 Whoever has me on their team has a distinct advantage of a guy who solve hard problem, \nand archive things their competitor cannot do in time that matters, or at all. \n\u2022 Make impossible things possible, that's what I do. \nEXPERIENCES \nPure Projects: SOFTWARE ENGINEER \nProject Pure system (legacy): Dec 2015 \u2013 now \n* Description: develop and maintain current software system of Pure. It contains various web apps, \niOS app, Android app, and NAS. \n* Greatest achievement: Create Modularize Initiative: turn various parts in the apps into modules. \nTurning a 5 persons team from full-time maintenance jobs to part-time maintenance, part-time \ndeveloping new features, thus increase value to customer. \n* 2nd greatest achievement: become de facto leader by popular vote \nProject Rebuild Pure system: Dec 2015 \u2013 now \n- First attempt: build system by Ruby on Rails \n+ Greatest achievement: combine all business logic and automation of the old system into a single \nsource code \n- Second attempt: build system by .NET \n+ Greatest achievement: create a new security system that allow fine control over what user can \nand cannot do in the system \nProject Safety App: Dec 2015 \u2013 now \n* Greatest Achievement: First solo app to be used in production. I am to sole developer, analyzer \nand customer service staff. \nPage 1 of 4 \nArakrama.com: FREELANCE SOFTWARE DEVELOPER/ FOUNDER \nApr 2015 \u2013 Sep 2015 \n* Description: try to start an app development firm by myself. \n* Greatest achievement: Know my limit and back off before losing too much. \nORO: SOFTWARE ENGINEER \nZAC team member: Mar 2014 \u2013 Mar 2015 \n* Description: develop and maintain ZAC: an ERP software solution \n* Greatest achievement: build data processor that is based on custom logic, with optimum \nperformance. Solution is used company wide. \nFoneclay team member: Mar 2014 \u2013 Mar 2015 \n* Description: Build and maintain phone template app \n* Greatest achievement: \nTime to market is 1 week for a whole template suit: main page, lock screen, alarm app, phone \nscreen, a mini game... Teach team member how to do it. \nFuuexpress .com:  FOUNDER \nJan 2010 \u2013 Jan 2012 \n* Description: a shipping service from US based stores to VN. \n* Greatest achievement: had long term customers and reliable revenue stream. Greatest financial \nsuccess up till now. \nSKILL SET \nOn the job training \n\u2022 Ruby on Rails \n\u2022 Visual Basic (from legacy system) \n\u2022 native Javascript, various Javascript libraries \n\u2022 CSS \n\u2022 SQL Server, MySQL, PostgreSQL \n\u2022 Object-oriented programming \n\u2022 Functional programming \n\u2022 Procedural programming \n\u2022 Ubuntu, Apache \n\u2022 AWS (EC2, S3) \nSelf-taught \nPage 2 of 4 \n\u2022  PHP  \u2022  C# \nBooks read \n\u2022 The Art of Readable Code \n\u2022 Why Programs Fail \u2013 A Guide to Systematic Debugging \n\u2022 Code Complete 2 \n\u2022 Conceptual Blockbusting \u2013 A Pleasurable Guide to Better Problem Solving \n\u2022 Facts and Fallacies of Software Engineering \n\u2022 Software Project Survival Guide \n\u2022 Object Oriented Software Construction \n\u2022 Design Patterns \n\u2022 Refactoring - Improving the Design of Existing Code \n\u2022 JavaScript: The Good Parts \n\u2022 Algorithms \n\u2022 ...dozens more... \nEnglish skill \n\u2022 TOEIC 915/990 score \n\u2022 Good reading, listening, speaking and writing skills \nFORMER EDUCATION \nPost and Telecommunication Institute of Technology (Vietnam) \nMajor: Telecommunication \nRelevant course modules: \n\u2022 Computer architecture \n\u2022 Computer network \n\u2022 Basic C programming \n\u2022 Digital signal processing \n\u2022 Technical math \nNguy\u1ec5n Th\u01b0\u1ee3ng Hi\u1ec1n high school (Vietnam) \n\u2022 Pass university admission test with 25/30 score \nNg\u00f4 S\u0129 Li\u00ean junior high school (Vietnam) \n\u2022 Pass high school admission test with 57.5/62 score \nINTERESTS \n\u2022 Learning other fields: astronomy, mechanical engineering, construction, energy, biology, \nphilosophy, history, geography... \n\u2022 Movies, music and video games, anything tech related. \nPage 3 of 4 \n\u2022 Traveling/ riding bike alone \nCOMPUTER SKILLS \n\u2022 MS office: Word, Excel, PowerPoint \n\u2022 Assemble and install a PC from parts \n\u2022 Troubleshooting common PC errors \nREFERENCE \n\u2022 I\u2019m happy to supply these on request \nPage 4 of 4 \nPowered by TCPDF (www.tcpdf.org)", "educations": [{"id": 4520, "gpa": null, "major": "Telecommunication", "school": "Post and Telecommunication Institute of Technology (Vietnam)", "diploma": "Other", "end_time": null, "conf_score": 0.8200222051861836, "start_time": null, "picklist_major": "Other", "major_categories": "", "major_categories_detail": ""}], "experiences": [{"id": 15090, "detail": "* Description: develop and maintain current software system of Pure. It contains various web apps,\niOS app, Android app, and NAS. * Greatest achievement: Create Modularize Initiative: turn various parts in the apps into modules.\nTurning a 5 persons team from full-time maintenance jobs to part-time maintenance, part-time developing new features, thus increase value to customer.\n* 2nd greatest achievement: become de facto leader by popular vote\nProject Rebuild Pure system: Dec 2015 - now\n- First attempt: build system by Ruby on Rails + Greatest achievement: combine all business logic and automation of the old system into a single source code\n- Second attempt: build system by .NET + Greatest achievement: create a new security system that allow fine control over what user can and cannot do in the system", "company": null, "end_time": "2023-04-13T00:00:00Z", "industry": "Other", "position": "SOFTWARE ENGINEER", "conf_score": 0.6925429707670153, "start_time": "2015-12-01T00:00:00Z"}, {"id": 15092, "detail": "EVELOPER/ FOUNDER Apr 2015 - Sep 2015 * Description: try to start an app development firm by myself.\n* Greatest achievement: K", "company": "Arakrama.com", "end_time": "2015-09-30T00:00:00Z", "industry": "Other", "position": "FREELANCE SOFTWARE DEVELOPER/ FOUNDER", "conf_score": 0.7884599018354467, "start_time": "2015-04-01T00:00:00Z"}, {"id": 15093, "detail": "* Description: develop and maintain ZAC: an ERP software solution\n* Greatest achievement: build data processor that is based on custom logic, with optimum performance. Solution is used company wide.", "company": "ORO", "end_time": "2015-03-31T00:00:00Z", "industry": "Other", "position": "SOFTWARE ENGINEER", "conf_score": 0.7932069450071494, "start_time": "2014-03-01T00:00:00Z"}, {"id": 15094, "detail": "* Description: a shipping service from US based stores to VN. * Greatest achievement: had long term customers and reliable revenue stream. Greatest financial success up till now.", "company": "Fuuexpress .com", "end_time": "2012-01-31T00:00:00Z", "industry": "Other", "position": "FOUNDER", "conf_score": 0.9542271074073599, "start_time": "2010-01-01T00:00:00Z"}], "address": "14/13/55 Th\u00e2n Nh\u00e2n Trung street, 13rd ward, T\u00e2n B\u00ecnh district, H\u1ed3 Ch\u00ed Minh city, Vietnam"}