{"skills": ["team management", "css", "lot management", "firebase", "visualization", "ant", "html", "reactjs", "mysql", "oracle", "redux", "unit test", "sql", "le", "jest", "database", "business intelligence", "bootstrap", "data visualization", "teamwork", "pentaho", "postgresql", "management", "communication skill"], "fulltext": "\uf19d\n EDUCATION\nHO CHI MINH UNIVERSITY OF TECHNOLOGY\nOCT 2013 - AUG 2017\nMajor: Software Technology\nEngineer's degree\n\uf0b1 EXPERIENCE\nTMA STUDENT DEVELOPMENT CENTER\nJULY 2016 - SEP 2016\nINTERN\n- Project: Visualization data with Pentaho.\n- Project Description : Got Data from parking lot database. The goal of project is\nmanage time pf employees\n-Industry : Parking lot Management\n-Team size : 5\n- Skill set Utilized : HTML, CSS, Bootstrap, SQL Server 2014, mySQL, Community\nDashboard Editor (Pentaho Community)\n-Responsibilities : Designed components for dashboard\n-Duration : 3 months\nKMS TECHNOLOGY VIETNAM\nMAR 2017 - PRESENT\nSOFTWARE ENGINNER\nMar 2017 - May 2017\n-Project : NgayTho Bet \n-Project Description : Build web application for user to bet football matches\n-Industry: Entertaiment\n-Team size : 10\n- Skill set Utilized : Srping boot, postgreSQL, Thymeleaf\n-Responsibilities : Designed UI  and create controller to get data  for betting matches\n-Duration : 2 months\nJun 2017 - Aug 2017\n-Project : Competency framework\n-Project Description : build web application for user to evaluate ability of employees\n-Team size: 3\n- Skill set Utilized : Reactjs, firebase, lodash, ant library\n-Responsibilities : Design components and get data from firebase to create question and\nassessment, request for assessment\n-Duration : 2 months\nSep 2017 - Dec 2017\n-Project : Izenda Professional Service\n-Project Description : migrate data from version 6 to version 7\n-Industry : Business intelligence\n-Team size : 4\n-Skill set Utilized : mySQL, posgreSQL, SQL server, oracle\n-Responsibilities: migrate data for client and support customer to migrate data\n-Duration : 3 months\nJan 2018 - Present\n-Project : HotSchedules\n-Description : build web application to manage inventory for Hotschedules\nTHANH CONG LE\n DEVELOPER\n\uf073OCT 23, 1995\n\uf007 Male\n\uf095 0974908350\n\uf199 thanhcong.dev@gmail.com\n\uf04123/5/15 TA16, ward 12, Ho Chi\nMinh city\n\uf129 skype:thanhcong.2310\nOBJECTIVE\n-Use my knowledge to build the\ngood product for community.\n-Find out the place to develop\nprogramming skills.\n-To have good opportunities to get\npromotion in my job.\nSKILLS\nCommunication\nIndependent\nTeamwork\nLogical thinking and creative\nReading\nINTERESTS\nTravel\nMusic\n -Industry : Restaurant management & hospitality\n-Project team size: 100+\n-Team size : 13\n -Skill set Utilized : reactjs, redux, reselect, redux observable, ImmutableJS, jest , enzyme \n-Responsibilities: design components and call API to get data for components, write unit test\n -Duration : 9 months\n\uf0f6 CERTIFICATIONS\nSoft-skills certification.\n2015\nTOEIC : 525\n2016\nEngineer's degree\n2017\n\uf0c0 ACTIVITIES\nKMS TECHNOLOGY VIETNAM\nMAR 2017 - PRESENT\nParticipant\n-Top 10 KMS of humans episode 1.\n-The face of KMS Next 2018 (fresher training program).\n-Member of acoustic KMS band.\n-Organizer KMS Hackathon 2018.\n-Volunteer trip in Da Nang 2018\n\u00a9 topcv.vn\nPowered by TCPDF (www.tcpdf.org)", "educations": [{"id": 4523, "gpa": null, "major": "Software Technology", "school": "HO CHI MINH UNIVERSITY OF TECHNOLOGY", "diploma": "Engineer", "end_time": "2017-08-01T00:00:00Z", "conf_score": 0.8122306558073306, "start_time": "2013-10-01T00:00:00Z", "picklist_major": "Other", "major_categories": "", "major_categories_detail": ""}], "experiences": [{"id": 15097, "detail": "-Project : NgayTho Bet -Project Description : Build web application for user to bet football matches\n-Industry: Entertaiment -Team size : 10 - Skill set Utilized : Srping boot, postgreSQL, Thymeleaf -Responsibilities : Designed UI and create controller to get data for betting matches\n-Duration : 2 months", "company": "KMS TECHNOLOGY VIETNAM", "end_time": "2023-04-13T00:00:00Z", "industry": "High Technology", "position": "SOFTWARE ENGINNER", "conf_score": 0.8934970860255722, "start_time": "2017-03-01T00:00:00Z"}, {"id": 15099, "detail": "- Project: Visualization data with Pentaho. - Project Description : Got Data from parking lot database. The goal of project is manage time pf employees\n-Industry : Parking lot Management -Team size : 5 - Skill set Utilized : HTML, CSS, Bootstrap, SQL Server 2014, mySQL, Community Dashboard Editor (Pentaho Community) -Responsibilities : Designed components for dashboard\n-Duration : 3 months", "company": "TMA STUDENT DEVELOPMENT CENTER", "end_time": "2016-09-30T00:00:00Z", "industry": "High Technology", "position": "INTERN", "conf_score": 0.9171087048027518, "start_time": "2016-07-01T00:00:00Z"}], "address": "23/5/15 Ta16, ward 12, Ho Chi Minh city"}