{"skills": ["regression", "java", "automation", "automation testing", "selenium", "c#", "system monitoring", "network monitoring", "sales", "java language", "selenium ide", "toad", "object oriented", "regression testing", "virtual box", "android", "maintenance", "business analyst", "desktop", "cmmi", "transaction database", "iso", "mantis", "regression test", "business rule", "software development", "testing", "communication skill", "quality assurance", "training users", "oracle", "database", "clarify", "process development", "teamwork", "analyst", "software development methodology", "manual testing", "window server", "problem solving", "mssql"], "fulltext": "ALEX NGUYEN \n1 \nNGUY\u1ec4N \u0110\u1eb6NG VI\u1ebeT V\u0102N (ALEX NGUYEN) \n\uf0b7 \nBirthday: Jun 19, 1993 \n\uf0b7 \nAddress: 146/59/11 Vu Tung, Ward 2, Binh Thanh District, Ho Chi Minh City \n\uf0b7 \nPhone: (+84)-909-143-941  \n\uf0b7 \nEmail: nguyendangvietvan@gmail.com \n\uf0b7 \nSkype: vannguyen196 \nSummary \n\uf0b7 \nThree years\u2019 experience on Manual and Automation testing on Web, Desktop application. \n\uf0b7 \nSolid understanding of defect development life cycle.  \n\uf0b7 \nGood knowledge in object oriented programming and databases transaction. \n\uf0b7 \nExcellent teamwork and communication skills. \n\uf0b7 \nExperience about working oversea (Korea, Greece, Taiwan). \n\uf0b7 \nManual Testing: \no \nTakes the responsibility to create test case and test plan, prepare test environment, \ncontrolling defect life cycle and experience on onsite support for UAT and Roll-Out the \nsystem. \no \nEstimate effort, define schedule, assign daily task and control testing status. \no \nTraining for new team member, strong skill in problem solving, \no \nCommunicate and adapt with new environment and technology quickly. \n\uf0b7 \nAutomation Testing: \no \nExperience in Object Oriented Programming with Java and C# and always tries to \ndevelop tool to support the testing. \no \nTakes the responsibility to creating and updating test scripts, maintain framework, \nexecute the regression test, analyze and report the testing result. \nWork Experience \nI. \nQuality Assurance \u2013 TSB VIETNAM CO. LTD (Jun 2016 - current) \n\uf0b7 \nTotal Soft Bank Ltd, Ho Chi Minh City, Vietnam. The Production Company provides IT solutions \nin Port Logistics and Maritime industry. \n1. \nCATOS for Wan Hai Line Terminal (Kaohsiung, Taichung) \n2. \nCATOS for Thessaloniki Port Authority. \nALEX NGUYEN \n2 \nRole: SQA/ On-site supporter \n\uf0b7 \nBuild Test Scenario, Test Case documents. \n\uf0b7 \nCheck issues, verify and deploy new releases onto UAT environment. \n\uf0b7 \nIntegration Test between CATOS and TML system \n\uf0b7 \nWork on-site with Project Managers, Business Analyst and Development Team of Korea. \n\uf0b7 \nWork directly with end-user in Taiwan/Greece and provide workaround solutions. \n\uf0b7 \nTechnical support, troubleshoot, solve problem and explain CATOS\u2019s business rules for end-\nuser during UAT. \n\uf0b7 \nSupport super user-training, create manual guideline documents \n\uf0b7 \nSupport offsite, remote to user workstation for checking error on UAT database. \n3. \nCATOS maintenance for Spain Clients (MSC Valencia Terminal) \nRole: SQA/ Off-site Supporter \nManual: \n\uf0b7 \nMonitored issues on Mantis bug tracking tool and kept track of working progress with \ndevelopment team.  \n\uf0b7 \nCoordinated with development team to reproduce issue and clarify scope of testing. \n\uf0b7 \nBuilt Test documentation: test scenarios and test cases based on issue requirement. \n\uf0b7 \nClarify user requirements, database modification for new Change Request. \n\uf0b7 \nUpdate new patch files and deploy environment. \nAutomation: \n\uf0b7 \nUse Coded UI tool to run Regression testing. \n\uf0b7 \nDebug modify and verify scripts base on test cases. \n\uf0b7 \nDefine, implement, and analyze metrics to determine test effectiveness and the overall \nquality of software. \n\uf0b7 \nReport and manage bugs found while testing. \n\uf0b7 \nControl quality output for every single release. \nII. \nQuality Assurance \u2013 Play Fury Vietnam Ltd (Jan 2016 \u2013 May 2016) \n\uf0b7 \nPlay Fury Vietnam Ltd. The Production Company provides games mobile, token services, healthy \nsolutions\u2026 of Singapore. \nALEX NGUYEN \n3 \n1. \nMobile Doctor \u2013 Nightingales (Start-up) \nRole: QA Engineer \n\uf0b7 \nDesign and run Test Cases. \n\uf0b7 \nReport bugs to Mantis. \n\uf0b7 \nDiscuss with Manager about change functions, update features, UI\u2026 \n\uf0b7 \nTransfer with Developers to make sure them understand clearly new/change requirements. \n\uf0b7 \nCheck responsible UI of Nightingales website. \n\uf0b7 \nFunctional test Android app, Braintree/Dashboard web. \nTechnical Skills  \n\uf0b7 \nProgramming languages: C#, Java.  \n\uf0b7 \nAutomation tools: Coded UI, Selenium IDE.  \n\uf0b7 \nDatabase: Oracle, MSSQL.  \n\uf0b7 \nOther tools: Virtual Box, VMware, StarTeam, Toad Oracle, Window Server\u2026  \n\uf0b7 \nSoftware development methodologies: Waterfall, Scrum. \n\uf0b7 \nSoftware development process: ISO, CMMI \nSoft Skills \n\uf0b7 \nProblem solving \n\uf0b7 \nOrganizing communication \n\uf0b7 \nSelf-confidence, creative \n\uf0b7 \nWork well under high pressure \n\uf0b7 \nCoaching co-worker teamwork \nEducation \nVan Lang University, Ho Chi Minh city, Viet Nam (Sep 2011 \u2013 Mar 2016) \nMajor: Software Engineering \nProjects: \n\uf0b7 \nOct 2015 \u2013 Mar 2016: Lunch Booking System \n\uf0b7 \nMar 2015 \u2013 Sep 2015: Network Monitoring System \n\uf0b7 \nMar 2014 \u2013 Jun 2014: Point Of Sale System  \nALEX NGUYEN \n4 \nAward Certificates \n\uf0b7 \n2012:   Introduction Software Engineering of CMU \nIntroduction to Network of CMU \n\uf0b7 \n2013:   Application Development Practice of CMU \n\uf0b7 \n2018:   Introduction to Containerisation of J&S MARITIME .LTD \nPowered by TCPDF (www.tcpdf.org)", "educations": [{"id": 4527, "gpa": null, "major": null, "school": "Van Lang University", "diploma": "Bachelors", "end_time": "2016-03-01T00:00:00Z", "conf_score": 0.7151136457677363, "start_time": "2011-09-01T00:00:00Z", "picklist_major": "Other", "major_categories": "", "major_categories_detail": ""}], "experiences": [{"id": 15116, "detail": ") Total Soft Bank Ltd, Ho Chi Minh City, Vietnam. The Production Company provides IT solutions in Port Logistics and Maritime industry.\n1. CATOS for Wan Hai Line Terminal (Kaohsiung, Taichung) 2.", "company": "TSB VIETNAM CO. LTD", "end_time": "2023-04-13T00:00:00Z", "industry": "Other", "position": "Quality Assurance", "conf_score": 0.8986425279419377, "start_time": "2016-06-01T00:00:00Z"}, {"id": 15118, "detail": "Production Company provides games mobile, token services, healthy solutions... of Singapore. Mobile Doctor - Nightingales (Start-up)", "company": "Play Fury Vietnam Ltd", "end_time": "2016-05-31T00:00:00Z", "industry": "Other", "position": "Mobile Doctor - Nightingales", "conf_score": 0.7691555689841614, "start_time": "2016-01-01T00:00:00Z"}], "address": "146/59/11 Vu Tung, Ward 2, Binh Thanh District, Ho Chi Minh City"}