{"skills": ["scala", "linux", "docker", "tomcat", "java", "sonar", "json", "cassandra", "selenium", "mongodb", "management", "rest", "xml", "security", "postgresql", "spring boot", "git", "elasticsearch", "j2ee", "svn", "structure", "spring", "microservices", "mysql", "data structure", "window server 2008", "nosql", "design pattern", "restful", "css", "oop", "gradle", "written communication", "maven", "mvc", "oracle", "protocol", "hibernate", "creative thinking", "management information system", "window server", "problem solving", "agile", "mssql", "html"], "fulltext": "Hai Nguyen\nAim to become a technical leader by\ncontinuously acquiring different \ndevelopment frameworks and technologies\nHo Chi Minh City, Vietnam\nWork Experience\n11/2014 \u2013 present\nHo Chi Minh, VN\nSenior Java Developer\nLaudert Vietnam Co., Ltd.\nResponsibilities & Accomplishments\nActing team leader, performing code review and daily \nverbal reporting to Germany team. Continuously \nreleased high quality features and fix bugs to Germany \nteam.\n6/2013 \u2013 8/2014\nHo Chi Minh, VN\nSenior Java Developer \nKMS Technology, Inc.\nResponsibilities & Accomplishments\nMaintaining a big data processing system.\n2/2011 \u2013 5/2013\nHo Chi Minh, VN\nSenior Java Developer \nITFarm AS\nResponsibilities & Accomplishments\nLeading a team of four, providing solutions for technical \nissues to the team and daily verbal reporting to Norway \nteam, providing IT Help Desk for production server.  \nContinuously released high quality features and fixed \nbugs for the website kompetansebors.no.\n10/2007 \u2013 6/2010\nHo Chi Minh, VN\nSenior Java Developer \nCOA Vietnam Co., Ltd.\nResponsibilities & Accomplishments\nSuccessfully maintained an internal HRM portal. \n2004 \u2013 2005\nDiploma in Information Systems Management\nAptech\n2005 \u2013 2006\nHigher Diploma in Software Engineering\nAptech\nSkills & Competences\nAnalytical skill\nVerbal and written \ncommunication in English\nTeam work\nGoal oriented\nProblem solving\nCreative thinking\nCode review\nOnsite Assignment\nThe UK (2 months), Norway (1 month), Germany (1 \nmonth)\nTechnical Skills\nJava, J2EE, Scala, Hibernate, Microservices, Restful, \nSpring (AOP, Security, MVC & Integration, Batch), Spring \nboot, Wicket, HTML/CSS/JS, REST, SOAP, JSON, XML, UX \nDesign.\nOOP, DBMS, Data structures, programming principles, \nweb protocols, etc.\nGit, SVN, Maven, Gradle, Docker, Tomcat, Selenium, \nSonar, automated tests\nEducation\n2002 \u2013 2007\nBachelor of Science in Information Technology\nUniversity of Natural Sciences\nHai Nguyen\nhainq1902@gmail.com\n(+84)-909-505-582\nHo Chi Minh City, Vietnam\nAim to become a technical leader by\ncontinuously acquiring different \ndevelopment frameworks and technologies\nMySQL, PostgreSQL, Oracle, MSSQL, NoSQL (MongoDB, \nCassandra, Elasticsearch)\nLinux, Windows Server 2008 R2\nAchievements & Certificates\nGeneral English in Australia (2010)\nIELTS 7.0\nInterests\nReading, AI, Software Agile Development, Table Tennis, \nDesign Pattern. ", "educations": [{"id": 4526, "gpa": null, "major": "C\u00f4ng ngh\u1ec7 th\u00f4ng tin", "school": "University of Natural Sciences", "diploma": "Bachelors", "end_time": "2007-01-01T00:00:00Z", "conf_score": 0.8331203744046224, "start_time": "2002-01-01T00:00:00Z", "picklist_major": "IT - Hardware/Networking", "major_categories": "M\u00e1y t\u00ednh v\u00e0 c\u00f4ng ngh\u1ec7 th\u00f4ng tin", "major_categories_detail": "C\u00f4ng ngh\u1ec7 th\u00f4ng tin"}], "experiences": [{"id": 15106, "detail": "Responsibilities & Accomplishments Acting team leader, performing code review and daily verbal reporting to Germany team. Continuously released high quality features and fix bugs to Germany team.", "company": "Laudert Vietnam Co., Ltd.", "end_time": "2023-04-13T00:00:00Z", "industry": "Other", "position": "Senior Java Developer", "conf_score": 0.9283402044765778, "start_time": "2014-11-01T00:00:00Z"}, {"id": 15107, "detail": "Responsibilities & Accomplishments Maintaining a big data processing system.", "company": "KMS Technology, Inc.", "end_time": "2014-08-31T00:00:00Z", "industry": "High Technology", "position": "Senior Java Developer", "conf_score": 0.9166535282364164, "start_time": "2013-06-01T00:00:00Z"}, {"id": 15108, "detail": "Responsibilities & Accomplishments Leading a team of four, providing solutions for technical issues to the team and daily verbal reporting to Norway team, providing IT Help Desk for production server.\nContinuously released high quality features and fixed bugs for the website kompetansebors.no.", "company": "ITFarm AS", "end_time": "2013-05-31T00:00:00Z", "industry": "Other", "position": "Senior Java Developer", "conf_score": 0.9283402044765778, "start_time": "2011-02-01T00:00:00Z"}, {"id": 15109, "detail": "Responsibilities & Accomplishments Successfully maintained an internal HRM portal.", "company": "COA Vietnam Co., Ltd.", "end_time": "2010-06-30T00:00:00Z", "industry": "Other", "position": "Senior Java Developer", "conf_score": 0.9125776658202421, "start_time": "2007-10-01T00:00:00Z"}], "address": "Ho Chi Minh City, Vietnam"}