{"skills": ["linux", "hyperledger", "docker", "stellar", "data intensive application", "c++", "javascript", "p2p application", "p2p", "risks", "cryptography", "blockchain", "gerrit", "git", "analysis", "solidity", "maintenance", "linux system", "algorithm", "distributed ledger", "jira", "ddos attack", "sybil attack", "github", "software development", "bug fixing", "system design", "magento", "ethereum", "application layer", "agile", "protocol"], "fulltext": " Luu Xuan Trong \nDate of birth: \nDec 23, 1992 \nGender: \nMale \nPhone:  01244245999 \nEmail: \ntronglx2312@gmail.com \nGithub account: \nTronglx \nAddress: \nHanoi, Vietnam \nOBJECTIVE \nTake advantages of software development skills, experience and understanding of software development to become a \nprofessional developer and bring a lot value to Customers. \nEDUCATION \nSep 2010 - Sep 2015 \nHanoi University of science and technology \nMajor: HEDSPI, Information \nsystem \nWORK EXPERIENCE \nFeb 2018 \u2013 Present \nKaopiz Software Company \nDeveloper \nMain responsibilities: \n- Research blockchain technology and apply to developing information \nsystem. \nMay 2016 \u2013 Feb 2018 \nFPT Software Company  \nDeveloper \nMain responsibilities: \n- Automotive system development. \n- Communicate with customer, make task list, schedule and make plan \nfor do it. \n- Analysis and design system. Make high level design, low level design \ndocument. \n- Coding and review code of other members. \n- Study and using advanced technology for system. \n- Using QT/QML and C++ skills for system development. \nOct 2015 \u2013 Apr 2016 \nOcean software Viet Nam Company \nDeveloper \nMain responsibilities: \n- E-commerce system development and maintenance. \n- Using magento CMS to manage content. \nSKILLS \nLanguage \nEnglish: TOEIC 600. Japanese: Equivalent to N3. \nOS \nWindow, linux system. \nTools \nOffice tools, Jira tool, gerrit, git, docker. \nProgramming skills \n C/C++, Go, JavaScript, Solidity, web3.js, truffle framework. \nBlockchain background \n Having knowledge of Blockchain ecosystem, how blockchain works, consensus \nalgorithms (PoW, PoS, PoA ...), Dapp application, p2p protocol, distributed ledger \ntechnology, lightning network, sidechain, how to create transaction, how to transmit \ntransaction to network. \n Having knowledge of cryptographic, asymmetric crytographic principle, how to create \nhierarchical deterministic (HD) wallet, how to sign transaction, how the ECDSA \nalgorithm works, how to verify signature. \nKnow risks from some type attack as 51% attack, double-spending, Sybil attack, \nDDoS attacks, repay attack, Attacks on cryptography and ways of protection.  \nHaving an experience in ICO project (in development period) base on stellar platform \nand ethereum platform. \nCan design data intensive applications guarantee reliable, scalable, and maintainable. I \ncan design transaction having atomicity, consistency, isolation and durability. \nINTERESTS \nI like football, music and e-sport. \nPROJECTS \nKaopiz Software Company  \n(Feb 2018 \u2013 Present) \nTeam \nBlockchain R&D team \nDescription \n- Research blockchain technology. \n- Find out solution applying blockchain technology to solve real world problem.  \nMy position \nDeveloper \n My responsibilities \n- Research blockchain technology. \n- Development. \n- Analysis and design prototype system applying blockchain technology. \n Technologies used \n- Ethereum platform, Hyperledger Fabric platform, stellar platform, docker, go language, \nsolidity language, node.js, truffle framework. \nFPT Global Automotive  \n(Apr 2016 \u2013 Feb 2018) \nCustomer  Korea \nDescription \n- Application layer in embedded system for car. \n- Support 5 product lines using electric, petrol and hybrid. \n- Using open source library as persistence ... \n- Using agile software development. \nTeam size \n30 \nMy position \nDeveloper, person in charge for home application and user profile manager application. \nMy responsibilities \n- Analysis and design \n- Development \n- Review code \n- Optimize code \n- Bug Fixing \nTechnologies used \n- QT 5.4, C++ \n- Open Embedded \nPowered by TCPDF (www.tcpdf.org)", "educations": [{"id": 4528, "gpa": null, "major": "H\u1ec7 th\u1ed1ng th\u00f4ng tin", "school": "Hanoi University of science and technology", "diploma": "Bachelors", "end_time": "2015-09-01T00:00:00Z", "conf_score": 0.7897513794629749, "start_time": "2010-09-01T00:00:00Z", "picklist_major": "IT - Hardware/Networking", "major_categories": "M\u00e1y t\u00ednh v\u00e0 c\u00f4ng ngh\u1ec7 th\u00f4ng tin", "major_categories_detail": "M\u00e1y t\u00ednh"}], "experiences": [{"id": 15117, "detail": "Main responsibilities:\n- Research blockchain technology and apply to developing information system.", "company": "Kaopiz Software Company", "end_time": "2023-04-13T00:00:00Z", "industry": "High Technology", "position": "Developer", "conf_score": 0.9142206543796373, "start_time": "2018-02-01T00:00:00Z"}, {"id": 15119, "detail": "Main responsibilities:\n- Automotive system development.\n- Communicate with customer, make task list, schedule and make plan for do it.\n- Analysis and design system. Make high level design, low level design document.\n- Coding and review code of other members.\n- Study and using advanced technology for system.\n- Using QT/QML and C++ skills for system development.", "company": "FPT Software Company", "end_time": "2018-02-28T00:00:00Z", "industry": "High Technology", "position": "Developer", "conf_score": 0.9125776658202421, "start_time": "2016-05-01T00:00:00Z"}, {"id": 15120, "detail": "Main responsibilities:\n- E-commerce system development and maintenance.\n- Using magento CMS to manage content.", "company": "Ocean software Viet Nam Company", "end_time": "2016-04-30T00:00:00Z", "industry": "High Technology", "position": "Developer", "conf_score": 0.9142206543796373, "start_time": "2015-10-01T00:00:00Z"}], "address": "Hanoi, Vietnam"}