{"skills": ["management tool", "studio", "git", "aes encryption", "agile", "github", "administration", "dependency injection", "vcs", "credential", "svn", "firebase", "jira", "objective c", "linux", "encryption", "memory management", "design pattern", "azure", "signalr", "wordpress", "mysql", "bitbucket", "mvp", "io", "sqlite", "leadership skill", "class", "task management", "rxjava", "microsoft", "marketing", "sql", "le", "visual studio", "sell", "sales", "scripting", "microsoft azure", "sql database", "javascript", "payment", "devops", "oop", "swift", "database", "atlassian jira", "mvvm", "xctest", "xamarin", "groovy", "rxswift", "laravel", "mvc", "google map", "map sdk", "cloud", "workflow", "jenkins", "event management", "php", "backend development", "android", "rest", "angularjs", "socket io", "postgresql", "management", "scrum master", "gitlab", "restful", "asp"], "fulltext": "DUY NGUYEN \nMobile Developer - Agile & Atlassian Certified Professional \nFull name: Nguyen Bao Duy \nDate of birth: October 2nd, 1992 \nGender: Male \nNationality: Viet Nam \nPortfolio: duynb.com \nWORK EXPERIENCES \nBeesightsoft (Jun '14 - Jul '18) \nSCRUM Master | iOS Specialist | .NET Ninja \nStarted as a Junior Developer, work across 20+ outsource projects in \nElance/Upwork and other clients \nDepth knowledge on basic and advanced programming techniques: REST \nAPIs, threading, memory management, DI, Clean Architecture ... \nLeverage as an iOS Team Leader, training/coaching/mentoring team \nmember from junior level \nGrowth and scale up team in both size and quality \nTask management, planning the development path for team member \nJoin in technical R&D department to get ahead of new technologies and \napplying/spreading across team: Functional Reactive Programming... \nCollaborate to setup CI/CD pipelines \nBeing trained as a Scrum Master, in charge and responsible to apply a \nlightweight Agile process, together with ecosystem of tools & frameworks, to \nhelp organization shift from traditional Waterfall to Agile to gain maximize \nproductivity \nUtilizing Atlassian product line: Jira, Confluence to all of departments: \nengineering, marketing, operation.... \nUpwork (Aug '17 \u2013 Present) \nProfessional Freelancer \nFocus on DevOps and Jira & Confluence Administrator  \nTop rated Freelancer  \n100% customer satisfaction \nPROJECT \nONLINELEDSTORE \nJira, Confluence server custom complex workflow and integration setup for \ne-commerce SME \nClient: United States \nRole: Jira & Confluence Administator \nSkills: Linux | Jira Customization | Jira REST API | Confluence REST \nAPI \nLength: 3 Months \nALLEN KKL-LURZEN.CH \nImplement custom workflow functions using ScriptRunner, mainly focus on \ntask/subtasks creation, complex workflow cycle development. Writing script \nusing Groovy, apply to specific workflow for specific use cases. Working with \nconditions, validators, post-functions, REST Endpoints \nClient: Switzerland \nRole: Jira Scripting \nSkills: Groovy Scripting | ScriptRunner | MyGroovy | Jira REST API \nLength:  \nMIGRATION SERVER TO CLOUD \nPerform migration client's self-hosted Jira & Confluence to Cloud, without \nany loss. The self-hosted Jira instance have 1000+ users and 120+ projects, \nConfluence have 160+ spaces with over 15GB of attachments. \nClient:  \nRole: Jira Administrator \nSkills: Linux | Jira & Confluence Migration & Troubleshooting \nLength: Less Than 24 Hours \nMLQPLUS TRUSTED LEADER \nA practical and interactive learning program designed to equip users with the \nskills and tools required for effective leadership. Access leadership content, \nresources and inspiration. Key features include: Learn: complete the Trusted \nLeader Program - 5 core modules designed by leadership experts covering a \nwide range of topics including foundations of effective leadership, coaching \nand communication, transactional leadership skills, transformational \nleadership skills and emotional intelligence. Interact: learn through a mix of \nbite-sized information, engaging visuals and interactive content to get the \nmost of out each module. Access tools: access to worksheets, tip sheets and \nadditional resources that can be downloaded right to your device or shared \nwith others. Test your knowledge: track your progress through leadership \nquizzes and surveys. \nClient: Australia \nRole: Developer \nSkills: IOS | Android | Mobile Offline | Subscription IAP \nLength: 3 Months \nYUKITOMO \nSkiers and snowboarders, have you ever experienced getting lost or losing \nyour friends in the mountains? Yukitomo helps you to find and locate your \nfriends in realtime. Never get lost ! \nClient: Singapore \nRole: Technical Leader \nSkills: IOS Native | Google Maps API | Firebase Realtime Chat | \nRealtime Geocoding \nLength: 5 Months \nOKADABOOKS \nThe mobile online bookstore & the marketplace for writer to publish their \nbook onto. Mobile apps are focused on reading experience. System is \noptimized for high performance & allow publisher controls their books as \nwell. \nClient: Okadabooks \nRole: Technical Leader \nSkills: IOS Native | Swift | EPub Reader SDK | AES Encryption \nLength: 6 Months \nABAKUS \nA pocket-based financial management tool which stored your personal \nincome and tax expenses along with all the receipts and cost based \nexpenses associated with every property you own, allowing you to see your \nestimated annual tax return and the financial position of your portfolio at \nany time throughout the year, at just the touch of a button. \nClient: Australia \nRole: Technical Leader \nSkills: IOS Native | Offline Caching | Cross-Platform Subscription IAP \nLength: 4 Months \nSIM LIBRARY \nMobile apps facilitate Singapore Institute of Management on room book \nmanagement, schedule management, loans & requests management, events \nmanagement (Workshops | Talks | Activities). The apps connect to various \nend-points (RESTful | SOAP | Legacy) to utilize large set of data through on \nSingle Sign-On securiy mechanism. \nClient: Singapore \nRole: Technical Leader \nSkills: IOS Native | SOAP | SSO | Javascript | WordPress \nLength: 3 Months \nOVVY \nOvvy is the easiest way to find, compare and engage reliable Service \nProviders. Merchants can also showcase their skills effectively be notified of \njobs they are interested in doing. \nClient: Singapore \nRole: Technical Leader \nSkills: IOS Native | Chat | Socket.IO | Paypal Mobile SDK | Push \nNotification \nLength: 5 Months \nSOCIALOOP \nSocial network apps connect people together, hosting activities, checkin, \nhobbies, or just update their mood. All in one. \nClient: Singapore \nRole: Technical Leader \nSkills: IOS Native | Chat | XMPP Framework | Google Maps SDK | \nGoogle Maps API | Push Notification \nLength: 5 Months \nATOMS \nAre you looking for a way you can do more to help those in need? ATOMs is \na modern way to spend time and money on other people. Thanks to this \napp, you can boost your own happiness by improving the lives of other \nhuman beings. Research shows this is much more effective than buying \nmore things for yourself. \nClient: Singapore \nRole: Technical Leader \nSkills: ASP.NET Web API | Azure | SignalR | Android | IOS | \nAngularJS | Paypal SDK \nLength: 4 Months \nBILLBY \nBillby is the world first pocket based bill payment platform, giving you \ngreater control over paying and managing your bills. \nClient: Australia \nRole: Technical Leader \nSkills: Android | IOS | Amazon | SendGrid Email SDK | QR | \nPHP/Laravel | MySql \nLength: 4 Months \nFITACCESS \nFitAccess connect clients and trainers to get more traning together instantly. \nYou can be a client who want to be trained and get fit, also be a trainer to \nprovide a class for others. More than getting in shape, we are connnecting \npeople. Get out of your room and do some training. \nClient: Australia \nRole: Technical Leader \nSkills: IOS Native | Amazon | Chat XMPP | Stripe SDK | Push \nNotification \nLength: 6 Months \nAVB \nSearching for clubs/bars/restaurants around you. See who have checked in \nand getting around with them instantly. \nClient: New Zealand \nRole: Scrum Master \nSkills: IOS Native | RxSwift MVVM | Android Native | RxJava | \nASP.NET Web API | Google Maps API | SignalR | RealmDB \nLength: 3 Months \nAXCRO \nEscrow-based shopping platform to gain consumer confidence whe \npurchasing service packages that are provided in parts over a period. This \nproduct will also serve as an additional platform to increase the sales of \nservice provider by providing an alternative payment guaranteed platform. \nClient: Singapore \nRole: Scrum Master \nSkills: IOS Native | Android Native | Google Maps API | Google Civic \nInformation API | PHP/Laravel | MySql \nLength: 3 Months \nSAYSWE \nVoting and plege platform for everyone to join and share their own opinions \nabout the election around the world. \nClient: United States \nRole: Scrum Master \nSkills: IOS Native | Google Maps API | Stripe | PHP/Laravel | MySql \nLength: 3 Months \nTACKO \nLove to travel, but want to make money with benefit ? Tacko gives you \nmany chances to buy and sell your items with other peoples when you are \ntravelling around. \nClient: Singapore \nRole: Scrum Master \nSkills: IOS Native | RxSwift MVVM | Google Maps API | Stripe | \nPaypal | PHP/Laravel | MySql \nLength: 5 Months \nSOCIASTA \nSociasta aims to connect people who are having the same activity or feeling \nthe same emotions around the world. \nClient: Pakistan \nRole: Scrum Master \nSkills: IOS Native | Google Maps API | KML Files | PHP/Laravel | \nMySql \nLength: 3 Months \nHELLOMOJO \nCapture Everything. Anywhere. Anytime. Hello Mojo's documenting app will \ngive you that extra peace of mind when you need it most. \nClient: New Zealand \nRole: Scrum Master | Backend Developer \nSkills: IOS Native | Google Maps API | ASP.Net | Microsoft Azure | \n.NET WebAPI 2 \nLength: 2 Months \nEDUCATION \n2010-2015 \nUniversity of Information Technology - Vietnam National University HCMC \nBachelor of Engineering \nCERTIFICATES \n2011: Microsoft Server 2008 System Administrator - MCITP-SA Nhat Nghe \nEducation JSC \n2014:  Best Member of the Year - Beesightsoft \n2015: Best Team Leader of the Year - Beesightsoft \n2016: Most Active Support of the Year - Beesightsoft \n2017: PSM I | Professional Scrum Master I - Scrum.org \nDemonstrated a fundamental level of Scrum mastery, proving an \nunderstanding of Scrum as described in the Scrum Guide and the concepts \nof applying Scrum. \n2017: CSPO | CERTIFIED Scrum Product Owner - ScrumAlliance.org \nLearn the foundation of Scrum and the scope of the Certified Scrum Product \nOwner's role from the best minds in Scrum. \nDemonstrate to employers and peers your attainment of core Scrum \nknowledge. \nExpand your career opportunities by staying relevant and marketable across \nall industry sectors adopting Agile practices. \nEngage with a community of recognized Scrum experts who are committed \nto continuous improvement. \n2018: ACP-JSW | ACP-300 | Atlassian Certified in Agile Development with \nJira Software - Atlassian.com \nThe Agile Development with Jira Software (ACP-JSW) credential builds on \nthe professional's existing agile skills, with a focus on optimizing the power \nof Jira Software for their development teams. This credential is for scrum \nmasters, project leads and board administrators. \n2018: AC-JPA | ACP-600 | Atlassian Certified in Jira Project Administration - \nAtlassian.com \nCapable Project Administrators are essential to the optimal functioning of \nJira Software in large organizations. Certified Jira Project Administrators are \nthe power users who know how to configure projects and boards, customize \nworkflows and manage... \nPROFESSIONAL SKILLS \nDatabase \nSQL Server, Postgresql, MySql, Sqlite, Realm \nIDE & Tools \nVisual Studio, Xamarin Studio, XCode, Visual Studio Code, Sublime Text \nVCS / DVCS \nSVN, Git Bash, Bitbucket | GitHub | GitLab, Git Flow | GitHub Flow | GitLab \nFlow, Git Submodule | Subtree \nCI & Build Tools \nJenkins | Code quality (swiftlint, PEP8) | xcodebuild (iOS), xctest (iOS) \nALM \nAtlassian JIRA, Atlassian Confluence, ChatOps (HipChat | Slack) \nFramework \nXamarin | iOS (Objective-C/Swift) | RxSwift | ASP.NET (MVC/Web API/Core) \n| NodeJS \nArchitecture \nOOP/SOLID/DRY | Design Patterns | IoC/Dependency Injection | \nMVC/MVP/MVVM/Clean Architecture | Functional Reactive Programming ", "educations": [{"id": 4533, "gpa": null, "major": "Engineering", "school": "University of Information Technology - Vietnam National University HCMC", "diploma": "Bachelors", "end_time": "2015-01-01T00:00:00Z", "conf_score": 0.8141298764232529, "start_time": "2010-01-01T00:00:00Z", "picklist_major": "Other", "major_categories": "", "major_categories_detail": ""}], "experiences": [{"id": 15130, "detail": "Focus on DevOps and Jira & Confluence Administrator Top rated Freelancer 100% customer satisfaction", "company": "Upwork", "end_time": "2023-04-13T00:00:00Z", "industry": "Other", "position": "Professional Freelancer", "conf_score": 0.830738895005311, "start_time": "2017-08-13T00:00:00Z"}, {"id": 15131, "detail": "Started as a Junior Developer, work across 20+ outsource projects in\nElance/Upwork and other clients\nDepth knowledge on basic and advanced programming techniques: REST APIs, threading, memory management, DI, Clean Architecture ... Leverage as an iOS Team Leader, training/coaching/mentoring team member from junior level\nGrowth and scale up team in both size and quality\nTask management, planning the development path for team member\nJoin in technical R&D department to get ahead of new technologies and applying/spreading across team: Functional Reactive Programming... Collaborate to setup CI/CD pipelines\nBeing trained as a Scrum Master, in charge and responsible to apply a lightweight Agile process, together with ecosystem of tools & frameworks, to help organization shift from traditional Waterfall to Agile to gain maximize productivity\nUtilizing Atlassian product line: Jira, Confluence to all of departments: engineering, marketing, operation....", "company": "Beesightsoft", "end_time": "2018-07-31T00:00:00Z", "industry": "Other", "position": "SCRUM Master | iOS Specialist | .NET Ninja", "conf_score": 0.830738895005311, "start_time": "2014-06-13T00:00:00Z"}], "address": null}