{"skills": ["cocoapods", "core data", "payment", "c++", "json", "ams", "cloud", "c#", "management", "unit test", "io", "git", "svn", "analysis", "index", "computer science education", "swift", "multitasking", "android", "uikit", "search", "core animation", "restful", "oop", "jira", "mvvm", "software development", "mvc", "objective c", "twitter", "process development", "navigation", "teamwork", "redmine", "io sdk"], "fulltext": "huynhtrannhuthao@gmail.com \n0966 38 43 47 \nnhuthao077 \nSoftware Engineer \nTanBinh District, Ho Chi Minh \nA software engineer with 5 years of experience in software development, including 2.5 years working as an iOS Developer. I understand the \nimportance of creating highly readable and easily maintainable source code. I am constantly enhancing knowledge and experience while \ngaining access to the latest technology. \nHuynh Tran Nhu Thao \nSKILLS  HIGHLIGHTS \nCocoapods \nSwift  \nObjective C    \nxCode \nCore Data \nCore Animation \nPush Notification \nRx-Swift  MVC  MVVM  OOP \nGit/SVN  Jira/Redmine  C++  C# \n2.5 years of full cycle development work experience with iOS \napplications. Fluency in Swift/Objective-C. \nKnowledge of and experience with OOP principles, MVC, \nMVVM programming \nExperience with iOS frameworks such as UIKit, Core Data, \nCore Animation .. \nFamiliar with network programming, RESTful API, JSON, Push \nNotification. \nExperience with Rx-Swift, Facebook iOS SDK, Zenrin Map, \nPayment. \nAbility to work under high pressure, multitasking and \norganizational skills. \nA good attitude and a desire to learn. \nWORK EXPERIENCE \niOS Developer \nCloud Nine Solutions \n11/2016 \u2013 Present \nHo Chi Minh \nAchievements/Tasks \n- Performed in an iOS developer: analyze requirements, \ndevelop design documents, coding & review code, unit \ntest, build and release to customer. \n- Practice in an iOS Lead developer role: support and \ncoach the iOS development team including junior \nengineers, provide timelines and estimates, \ncommunication between team and vendors. \n- Research new technologies require in project. \n- Meeting and consulting with customer. \n- Ability to learn quickly and work under high pressure. \n- Improve teamwork and independent working skills. \nC++/C# Developer \nGlobal Cybersoft VietNam \n01/2014 \u2013 10/2016 \nHo Chi Minh \nAchievements/Tasks \n- Knowledge of software development process. \n- Performed in a C++/C# developer role on window \napplication: analyze requirements, develop design \ndocuments, coding & review code, writing test \nspecification & test. \n- Improve analysis skills, coding skills, teamwork skills. \n- Ability to learn quickly and work under high pressure. \nIOS ATTENDED PROJECTS \nItsmo Delivery (06/2018 \u2013 Present) \n- Itsmo Delivery project build an application launch in Japan to help \nshippers manage status of luggages need to delivery. The application has \nthe following main functions: allows user register delivery luggages at \nspecific time (AM, 12-14h, 14-16h..) and specific address, then display \npin on the map. User can change status when delivery to \ncomplete/absence. It also helps user search address on map. \nAkly (02/2018 \u2013 05/2018) \n- Akly project build an iOS application launch in Qatar. This application \nallows user orders foods, Akly then delivers the foods. It has on demand \nand subscription meal plans. It also has advanced weight management \nsoftware and Body Mass Index calculator that will then suggest to user \nthe best plans to archive them goals \nItsumoNavi (12/2018 \u2013 02/2018) \n- ItsumoNavi app project build an application for both Android and iOS \nlaunch in Japan.\ufffd This is a navigation application corresponding to \nvarious moving means. This application provides user the detail transit \nguidance and voice guidance like car navigation. \nFlashAir (11/2016 \u2013 05/2018) \n- FlashAir project build an application for both Android and iOS. User can \nquickly and easily connect, download all the images and documents on \nwireless of FlashAir memory card. This application support multiple \nlanguages (21 languages). It also supports user to share images via \nFacebook, Twitter.. \nEDUCATION \nComputer Science \nUniversity of Information Technology \n09/2009 \u2013 12/2013 \n6.94 \nINTERESTS \nMusic  Badminton  Traveling ", "educations": [{"id": 4534, "gpa": "6.94", "major": "Khoa h\u1ecdc m\u00e1y t\u00ednh", "school": "University of Information Technology", "diploma": "Bachelors", "end_time": "2013-12-01T00:00:00Z", "conf_score": 0.8263227818945743, "start_time": "2009-09-01T00:00:00Z", "picklist_major": "IT - Hardware/Networking", "major_categories": "M\u00e1y t\u00ednh v\u00e0 c\u00f4ng ngh\u1ec7 th\u00f4ng tin", "major_categories_detail": "M\u00e1y t\u00ednh"}], "experiences": [{"id": 15132, "detail": "Ho Chi Minh Achievements/Tasks - Performed in an iOS developer: analyze requirements, develop design documents, coding & review code, unit test, build and release to customer.\n- Practice in an iOS Lead developer role: support and coach the iOS development team including junior engineers, provide timelines and estimates, communication between team and vendors.\n- Research new technologies require in project.\n- Meeting and consulting with customer.\n- Ability to learn quickly and work under high pressure.\n- Improve teamwork and independent working skills.", "company": "Cloud Nine Solutions", "end_time": "2023-04-13T00:00:00Z", "industry": "High Technology", "position": "iOS Developer", "conf_score": 0.9283402044765778, "start_time": "2016-11-01T00:00:00Z"}, {"id": 15134, "detail": "Ho Chi Minh Achievements/Tasks - Knowledge of software development process.\n- Performed in a C++/C# developer role on window application: analyze requirements, develop design documents, coding & review code, writing test specification & test.\n- Improve analysis skills, coding skills, teamwork skills.\n- Ability to learn quickly and work under high pressure.", "company": "Global Cybersoft VietNam", "end_time": "2016-10-31T00:00:00Z", "industry": "High Technology", "position": "C++/C# Developer", "conf_score": 0.9100663510833302, "start_time": "2014-01-01T00:00:00Z"}], "address": "Tanbinh District, Ho Chi Minh"}