{"skills": ["search", "continuous integration", "microservices", "git", "agile", "kafka", "can", "reactjs", "full stack development", "redis", "search engine", "design pattern", "mysql", "kubernetes", "redux", "continuous delivery", "jquery", "sell", "elasticsearch", "stack", "javascript", "oop", "devops", "payment", "database", "database design", "commodities", "laravel", "nginx", "bootstrap", "docker", "jenkins", "php", "software development", "mongodb", "saas", "management", "buy"], "fulltext": "Nguy\u1ec5n S\u01a1n T\u00f9ng\nFull Stack Developer & DevOps\n\uf0e0 sontung0@gmail.com\n \uf095 0378.476.116\n \uf041 H\u00e0 N\u1ed9i, Vi\u1ec7t Nam\nH\u1ecd t\u00ean\nNguy\u1ec5n S\u01a1n T\u00f9ng\nNg\u00e0y sinh\n23/12/1987\nGi\u1edbi t\u00ednh\nNam\nNguy\u00ean qu\u00e1n\nNg\u00f4 Gia T\u1ef1, H\u1ea3i An, H\u1ea3i Ph\u00f2ng\nTH\u00d4NG TIN C\u00c1 NH\u00c2N\nK\u1ef8 N\u0102NG\nN\u1eafm v\u1eefng ki\u1ebfn th\u1ee9c v\u1ec1 PHP v\u1edbi c\u00e1c framework Laravel, CodeIgniter\nN\u1eafm v\u1eefng ki\u1ebfn th\u1ee9c v\u1ec1 Javascript, React, Redux, jQuery, Bootstrap\nN\u1eafm v\u1eefng ki\u1ebfn th\u1ee9c v\u1ec1 MySQL, Indexing, Optimization for high performance\nN\u1eafm v\u1eefng ki\u1ebfn th\u1ee9c v\u1ec1 OOP, Design patterns, Clean code\nN\u1eafm v\u1eefng ki\u1ebfn th\u1ee9c v\u1ec1 Database Design & Optimization\nC\u00f3 kinh nghi\u1ec7m ph\u00e1t tri\u1ec3n h\u1ec7 th\u1ed1ng theo m\u00f4 h\u00ecnh Microservices\nC\u00f3 ki\u1ebfn th\u1ee9c v\u1ec1 Continuous Integration (CI), Continuous Delivery (CD)\nC\u00f3 kinh nghi\u1ec7m l\u00e0m vi\u1ec7c v\u1edbi Jenkins\nC\u00f3 kinh nghi\u1ec7m l\u00e0m vi\u1ec7c v\u1edbi Kubernetes\nC\u00f3 kinh nghi\u1ec7m l\u00e0m vi\u1ec7c v\u1edbi Docker (developing and deploying application)\nC\u00f3 kinh nghi\u1ec7m l\u00e0m vi\u1ec7c v\u1edbi database system nh\u01b0 MongoDB, Redis.\nC\u00f3 kinh nghi\u1ec7m l\u00e0m vi\u1ec7c v\u1edbi search engine nh\u01b0 Elasticsearch.\nC\u00f3 kinh nghi\u1ec7m l\u00e0m vi\u1ec7c v\u1edbi messaging system nh\u01b0 Kafka.\nC\u00f3 kinh nghi\u1ec7m l\u00e0m vi\u1ec7c v\u1edbi Nginx.\nC\u00f3 kinh nghi\u1ec7m l\u00e0m vi\u1ec7c v\u00e0 t\u00edch h\u1ee3p v\u1edbi c\u00e1c h\u1ec7 th\u1ed1ng payment gateway (Onepay, NganLuong, BaoKim ...)\nFriendly v\u1edbi c\u00f4ng c\u1ee5 qu\u1ea3n l\u00fd version GIT\nFriendly v\u1edbi m\u00f4 h\u00ecnh ph\u00e1t tri\u1ec3n ph\u1ea7n m\u1ec1m theo Agile/Scrum\nVelacorp\n2017 - Now\nTeam Leader & DevOps\nTr\u00e1ch nhi\u1ec7m ch\u00ednh:\n- Develop, deploy & maintain c\u00e1c d\u1ef1 \u00e1n c\u1ee7a c\u00f4ng ty\n- Build & design ki\u1ebfn tr\u00fac h\u1ec7 th\u1ed1ng\n- T\u00ecm hi\u1ec3u c\u00f4ng ngh\u1ec7 m\u1edbi ph\u1ee5c v\u1ee5 nhu c\u1ea7u d\u1ef1 \u00e1n\n- Review code\n- H\u1ed7 tr\u1ee3 v\u00e0 \u0111\u00e0o t\u1ea1o c\u00e1c b\u1ea1n junior developer\nNTQ Solution\n2016 -  2017\nDeveloper\nTr\u00e1ch nhi\u1ec7m ch\u00ednh:\n- X\u1eady d\u1ef1ng, ph\u00e1t tri\u1ec3n c\u00e1c d\u1ef1 \u00e1n cho kh\u00e1ch h\u00e0ng Nh\u1eadt\nNencer Jsc.\nDeveloper & Team Leader\nKINH NGHI\u1ec6M L\u00c0M VI\u1ec6C\n2012 - 2016\nTr\u00e1ch nhi\u1ec7m ch\u00ednh:\n- Develop, deploy & maintain c\u00e1c d\u1ef1 \u00e1n c\u1ee7a c\u00f4ng ty\n- Build & design ki\u1ebfn tr\u00fac h\u1ec7 th\u1ed1ng\n- T\u00ecm hi\u1ec3u c\u00f4ng ngh\u1ec7 m\u1edbi ph\u1ee5c v\u1ee5 nhu c\u1ea7u d\u1ef1 \u00e1n\nPurchasing Management\nSystem\n11/2018 - Now\nH\u1ec7 th\u1ed1ng qu\u00e1n l\u00fd mua h\u00e0ng tr\u1ef1c tuy\u1ebfn\nM\u00f4 t\u1ea3: \u0110\u00e2y l\u00e0 h\u1ec7 th\u1ed1ng cung c\u1ea5p gi\u1ea3i ph\u00e1p ph\u1ea7n m\u1ec1m cho c\u00e1c c\u00f4ng ty ho\u1ea1t\n\u0111\u1ed9ng trong l\u0129nh v\u1ef1c B2B gi\u00fap qu\u1ea3n l\u00fd vi\u1ec7c mua h\u00e0ng ph\u1ee5c cho c\u00e1c \u0111\u01a1n h\u00e0ng\nc\u1ee7a kh\u00e1ch.\nK\u1ef9 thu\u1eadt: H\u1ec7 th\u1ed1ng \u0111\u01b0\u1ee3c thi\u1ebft k\u1ebf theo m\u00f4 h\u00ecnh SAAS, c\u00f3 th\u1ec3 t\u1ea1o ra c\u00e1c\ntenant c\u00f3 th\u1ec3 setup v\u00e0 ho\u1ea1t \u0111\u1ed9ng \u0111\u1ed9c l\u1eadp. \nC\u00f4ng ngh\u1ec7: PHP, MySQL, Elasticsearch, Redis, Kafka, Kubernetes, Nginx,\nJenkins, ReactJs\nVai tr\u00f2 trong d\u1ef1 \u00e1n: Team Leader & DevOps\nLogistic Management System\n08/2018 - 11/2018\nH\u1ec7 th\u1ed1ng qu\u00e1n l\u00fd h\u00e0ng h\u00f3a, kho b\u00e3i, v\u1eadn chuy\u1ec3n\nM\u00f4 t\u1ea3: \u0110\u00e2y l\u00e0 h\u1ec7 th\u1ed1ng cung c\u1ea5p gi\u1ea3i ph\u00e1p ph\u1ea7n m\u1ec1m cho c\u00e1c c\u00f4ng ty ho\u1ea1t\n\u0111\u1ed9ng trong l\u0129nh v\u1ef1c B2B gi\u00fap qu\u1ea3n l\u00fd h\u00e0ng h\u00f3a, kho b\u00e3i, v\u1eadn chuy\u1ec3n.\nK\u1ef9 thu\u1eadt: H\u1ec7 th\u1ed1ng \u0111\u01b0\u1ee3c thi\u1ebft k\u1ebf theo m\u00f4 h\u00ecnh SAAS, c\u00f3 th\u1ec3 t\u1ea1o ra c\u00e1c\ntenant c\u00f3 th\u1ec3 setup v\u00e0 ho\u1ea1t \u0111\u1ed9ng \u0111\u1ed9c l\u1eadp. \nC\u00f4ng ngh\u1ec7: PHP, MySQL, Elasticsearch, Redis, Kafka, Docker, Nginx,\nJenkins, ReactJs\nVai tr\u00f2 trong d\u1ef1 \u00e1n: Team Leader & DevOps\nGlobal Order System\n2017 - 2018\nH\u1ec7 th\u1ed1ng nh\u1eadp h\u00e0ng t\u1eeb c\u00e1c site th\u01b0\u01a1ng m\u1ea1i \u0111i\u1ec7n t\u1eed n\u01b0\u1edbc ngo\u00e0i (taobao,\n1688...)\nM\u00f4 t\u1ea3: \u0110\u00e2y l\u00e0 h\u1ec7 th\u1ed1ng cung c\u1ea5p d\u1ecbch v\u1ee5 trung gian nh\u1eadp h\u00e0ng t\u1eeb c\u00e1c site\nth\u01b0\u01a1ng m\u1ea1i \u0111i\u1ec7n t\u01b0 l\u1edbn \u1edf n\u01b0\u1edbc ngo\u00e0i. Gi\u00fap kh\u00e1ch h\u00e0ng c\u00f3 th\u1ec3 d\u1ec5 d\u00e0ng\norder h\u00e0ng tr\u1ef1c ti\u1ebfp t\u1eeb c\u00e1c site \u0111\u00f3 1 c\u00e1ch nhanh g\u1ecdn v\u00e0 \u0111\u01a1n gi\u1ea3n.\nC\u00f4ng ngh\u1ec7: PHP, MySQL, MongoDB, Redis, Docker, Nginx, Jenkins\nVai tr\u00f2 trong d\u1ef1 \u00e1n: Team Leader\nCard Shopping\n2016 - 2016\nH\u1ec7 th\u1ed1ng b\u00e1n th\u1ebb c\u00e0o tr\u1ef1c tuy\u1ebfn\nM\u00f4 t\u1ea3: \u0110\u00e2y l\u00e0 h\u1ec7 th\u1ed1ng cung c\u1ea5p gi\u1ea3i ph\u00e1p ph\u1ea7n m\u1ec1m cho ch\u1ee7 shop bu\u1ed1n\nb\u00e1n th\u1ebb tr\u1ef1c tuy\u1ebfn. Kh\u00e1ch h\u00e0ng c\u00f3 th\u1ec3 thanh to\u00e1n \u0111\u01a1n h\u00e0ng th\u00f4ng qua c\u00e1c\nc\u1ed5ng thanh to\u00e1n tr\u1ef1c tuy\u1ebfn trong v\u00e0 ngo\u00e0i n\u01b0\u1edbc. Ch\u1ee7 shop c\u00f3 th\u1ec3 t\u1ea1o kho\nth\u1ebb ri\u00eang ho\u1eb7c l\u1ea5y th\u1ebb t\u1eeb c\u00e1c nh\u00e0 cung c\u1ea5p.\nK\u1ef9 thu\u1eadt: H\u1ec7 th\u1ed1ng \u0111\u01b0\u1ee3c thi\u1ebft k\u1ebf theo m\u00f4 h\u00ecnh SAAS, c\u00f3 th\u1ec3 t\u1ea1o ra c\u00e1c\ntenant c\u00f3 th\u1ec3 setup v\u00e0 ho\u1ea1t \u0111\u1ed9ng \u0111\u1ed9c l\u1eadp. \nC\u00f4ng ngh\u1ec7: PHP, MySQL, Redis, Nginx\nVai tr\u00f2 trong d\u1ef1 \u00e1n: Developer\nC\u00c1C D\u1ef0 \u00c1N CH\u00cdNH \u0110\u00c3 THAM GIA\n\u0110\u1ea1i H\u1ecdc H\u00e0ng H\u1ea3i Vi\u1ec7t Nam\n2006 - 2011\nChuy\u00ean ng\u00e0nh C\u00f4ng Tr\u00ecnh Th\u1ee7y\nH\u1eccC V\u1ea4N\n\u00a9 topcv.vn", "educations": [{"id": 4548, "gpa": null, "major": "C\u00f4ng ngh\u1ec7 truy\u1ec1n th\u00f4ng", "school": "\u0110\u1ea1i H\u1ecdc H\u00e0ng H\u1ea3i Vi\u1ec7t Nam", "diploma": "Bachelors", "end_time": "2011-01-01T00:00:00Z", "conf_score": 0.9169645786863446, "start_time": "2006-01-01T00:00:00Z", "picklist_major": "Advertising/Promotion/PR", "major_categories": "B\u00e1o ch\u00ed v\u00e0 th\u00f4ng tin", "major_categories_detail": "B\u00e1o ch\u00ed v\u00e0 truy\u1ec1n th\u00f4ng"}], "experiences": [{"id": 15162, "detail": "Tr\u00e1ch nhi\u1ec7m ch\u00ednh:\n- Develop, deploy & maintain c\u00e1c d\u1ef1 \u00e1n c\u1ee7a c\u00f4ng ty\n- Build & design ki\u1ebfn tr\u00fac h\u1ec7 th\u1ed1ng\n- T\u00ecm hi\u1ec3u c\u00f4ng ngh\u1ec7 m\u1edbi ph\u1ee5c v\u1ee5 nhu c\u1ea7u d\u1ef1 \u00e1n\n- Review code\n- H\u1ed7 tr\u1ee3 v\u00e0 \u0111\u00e0o t\u1ea1o c\u00e1c b\u1ea1n junior developer", "company": "Velacorp", "end_time": "2023-04-13T00:00:00Z", "industry": "Other", "position": "Team Leader & DevOps", "conf_score": 0.9086575725185376, "start_time": "2017-01-01T00:00:00Z"}, {"id": 15163, "detail": "Tr\u00e1ch nhi\u1ec7m ch\u00ednh:\n- X\u1eady d\u1ef1ng, ph\u00e1t tri\u1ec3n c\u00e1c d\u1ef1 \u00e1n cho kh\u00e1ch h\u00e0ng Nh\u1eadt", "company": "NTQ Solution", "end_time": "2017-01-31T00:00:00Z", "industry": "High Technology", "position": "Developer", "conf_score": 0.9086575725185376, "start_time": "2016-01-01T00:00:00Z"}, {"id": 15164, "detail": "Tr\u00e1ch nhi\u1ec7m ch\u00ednh:\n- Develop, deploy & maintain c\u00e1c d\u1ef1 \u00e1n c\u1ee7a c\u00f4ng ty\n- Build & design ki\u1ebfn tr\u00fac h\u1ec7 th\u1ed1ng\n- T\u00ecm hi\u1ec3u c\u00f4ng ngh\u1ec7 m\u1edbi ph\u1ee5c v\u1ee5 nhu c\u1ea7u d\u1ef1 \u00e1n", "company": "Nencer Jsc.", "end_time": "2016-01-31T00:00:00Z", "industry": "Other", "position": "Developer & Team Leader", "conf_score": 0.9086575725185376, "start_time": "2012-01-01T00:00:00Z"}], "address": "Ng\u00f4 Gia T\u1ef1, H\u1ea3i An, H\u1ea3i Ph\u00f2ng"}