{"skills": ["kafka", "aws", "fluentd", "docker", "load balancing", "marketing", "automation", "analytics", "cloudformation", "tcp", "apache", "lighttpd", "management", "gitlab", "grafana", "kubernetes", "routing protocol", "filebeat", "elasticsearch", "new relic", "devops", "analysis", "ipv6", "terraform", "rabbitmq", "syslog", "search", "ansible", "zabbix", "nginx", "high availability", "system design", "protocol", "jenkins", "datadog", "networking", "python", "kibana", "puppet", "rackspace", "mysql", "logstash"], "fulltext": "   H\u1ed2 NG\u1eccC THI\u1ec6N \nEmail: thienngho@gmail.com \nSkype: thienngho \nTel: +84902981606 \nSUMMARY \nSenior System/DevOps Engineer with more than 8 years of experience.\nExpertise includes networking, high availability, load balancing, and distributed\nsystems, \u2026 \nEMPLOYMENT HISTORY \n08/2017 - Present \nDevOps Engineer at Wizeline \n-\nImplement and manage infrastructure for Global Content API project \nUse CloudFormation to provision AWS services \n-\nBuild and deploy Ascend Credit Pay system with Terraform and Jenkins  \n10/2014 \u2013 07/2017 \nSenior System Engineer at Lazada Group \n-\nOperate and manage Lazada Group infrastructure (Rackspace, AWS,\non-premises Data Centers) \n-\nDesign and implement technologies for new Data Centers \n-\nMigrate Lazada platform from Rackspace to new Data Centers across\nSoutheast Asia \n-\nManage Centralized Logging System based on ELK/Graylog2 \n-\nBuild and operate Logistic Management System on AWS \n-\nCollaborate with different teams to develop, integrate various systems\nand applications \n10/2010 \u2013 09/2014 \nSenior System Engineer at VNG Corp \n-\nLaunch, operate, maintain game system \n-\nDesign and implement new landing pages architecture \n-\nOptimize and monitor landing pages and forum \n-\nOperate and maintain static content delivery system \n-\nBuild real time logging system for marketing analysis project \n03/2010 \u2013 09/2010 \nSystem Engineer at TMA Solutions \nAvaya DevConnect Project \n-\nResearch and develop SIP applications \nESCS Core Verification Project \n-\nConfigure and verify IPv6 on CS1000 system. \n-\nDevelop Nortel Test Plans (IPv6, IP Line Enhancements) \nKNOWLEDGE \n-\nTCP/IP, routing protocols, iptables \n-\nProgramming Languages: Bash, Python \n-\nAWS, RabbitMQ, Kafka, Docker, Kubernetes, Jenkins, Gitlab, MySQL \n-\nWeb servers: Apache, Nginx, Lighttpd \n-\nAutomation Tools: Puppet, Ansible, Terraform, Packer, CloudFormation \n-\nMonitoring Tools: Zabbix, Icinga2, Grafana, New Relic, Datadog \n-\nLog processing: Logstash, Fluentd, Filebeat, Syslog-ng \n-\nSearch and analytics: Elasticsearch, Kibana, Graylog2 \nEDUCATION \n2012 \u2013 2014 \nPosts and Telecommunications Institute of Technology \u2013 HCMC \nMaster of Science in Information System \n2005 \u2013 2009 \nPosts and Telecommunications Institute of Technology \u2013 HCMC \nEngineer of Science in Information Technology \nPowered by TCPDF (www.tcpdf.org)", "educations": [{"id": 4550, "gpa": null, "major": "H\u1ec7 th\u1ed1ng th\u00f4ng tin", "school": "Posts and Telecommunications Institute of Technology - HCMC", "diploma": "Masters", "end_time": "2014-01-01T00:00:00Z", "conf_score": 0.917841109432358, "start_time": "2012-01-01T00:00:00Z", "picklist_major": "IT - Hardware/Networking", "major_categories": "M\u00e1y t\u00ednh v\u00e0 c\u00f4ng ngh\u1ec7 th\u00f4ng tin", "major_categories_detail": "M\u00e1y t\u00ednh"}, {"id": 4551, "gpa": null, "major": "C\u00f4ng ngh\u1ec7 th\u00f4ng tin", "school": "Posts and Telecommunications Institute of Technology - HCMC", "diploma": "Engineer", "end_time": "2009-01-01T00:00:00Z", "conf_score": 0.917841109432358, "start_time": "2005-01-01T00:00:00Z", "picklist_major": "IT - Hardware/Networking", "major_categories": "M\u00e1y t\u00ednh v\u00e0 c\u00f4ng ngh\u1ec7 th\u00f4ng tin", "major_categories_detail": "C\u00f4ng ngh\u1ec7 th\u00f4ng tin"}], "experiences": [{"id": 15166, "detail": "- Implement and manage infrastructure for Global Content API project\nUse CloudFormation to provision AWS services\n- Build and deploy Ascend Credit Pay system with Terraform and Jenkins", "company": "Wizeline", "end_time": "2023-04-13T00:00:00Z", "industry": "Other", "position": "DevOps Engineer", "conf_score": 0.9142206543796373, "start_time": "2017-08-01T00:00:00Z"}, {"id": 15168, "detail": "- Operate and manage Lazada Group infrastructure (Rackspace, AWS, on-premises Data Centers) - Design and implement technologies for new Data Centers - Migrate Lazada platform from Rackspace to new Data Centers across\nSoutheast Asia - Manage Centralized Logging System based on ELK/Graylog2 - Build and operate Logistic Management System on AWS - Collaborate with different teams to develop, integrate various systems and applications", "company": "Lazada Group", "end_time": "2017-07-31T00:00:00Z", "industry": "High Technology", "position": "Senior System Engineer", "conf_score": 0.9175172730272324, "start_time": "2014-10-01T00:00:00Z"}, {"id": 15170, "detail": "- Launch, operate, maintain game system\n- Design and implement new landing pages architecture\nOptimize and monitor landing pages and forum\nOperate and maintain static content delivery system\nBuild real time logging system for marketing analysis project\n- - -", "company": "VNG Corp", "end_time": "2014-09-30T00:00:00Z", "industry": "Other", "position": "Senior System Engineer", "conf_score": 0.9175172730272324, "start_time": "2010-10-01T00:00:00Z"}, {"id": 15172, "detail": "Avaya DevConnect Project - Research and develop SIP applications\nESCS Core Verification Project - Configure and verify IPv6 on CS1000 system.\n- Develop Nortel Test Plans (IPv6, IP Line Enhancements)", "company": "TMA Solutions", "end_time": "2010-09-30T00:00:00Z", "industry": "High Technology", "position": "System Engineer", "conf_score": 0.9142206543796373, "start_time": "2010-03-01T00:00:00Z"}], "address": null}