{"skills": ["search", "java", "css", "git", "json", "c++", "svn", "spring cloud", "desktop", "tomcat", "html", "reactjs", "j2ee", "linux", "provisioning", "pyramid", "ajax", "spring mvc", "using sap", "ubuntu", "mysql", "java core", "tool support", "oracle", "log4j", "security", "microsoft visio", "eauthentication", "jquery", "angular", "apache http server", "window operating system", "microsoft", "mobile device", "jboss", "sql", "procurement", "sell", "sap development", "c#", "strut", "javascript", "pki", "payment", "apache solr", "apache", "database", "window xp", "ubuntu linux", "spring boot", "jsp", "mobile platform", "xml", "nginx", "aws", "mvc", "docker", "cloud", "enterprise", "hibernate", "jenkins", "security solution", "operating system", "software development", "problem solving skill", "user management", "spring", "postgresql", "management", "jrun", "restful", "problem solving"], "fulltext": "Full name: Dau Ngoc Nhat \nTechnical Lead \nEmail: xxx@gmail.com \nMobile number: +84 xxxxxx567 \nNhat has gained the SAP Hybris certificate and has over 10 years of experience in software development \nincluding experience with complex SAP Hybris framework projects, enterprise web technology of Java (J2EE), \nand web java frameworks: Spring (Spring MVC, Spring Boot, Spring Cloud), Struts (1,2), Tapestry. He also \nhas solid knowledge in Java core (J2SE), JavaScript, HTML, XML and experience working with many database \nsystems, application servers.  \nMoreover, Nhat has strong problem solving skills and experience in researching and applying new \ntechnologies. He is also a good team member. \nNhat has the following qualifications: \nSAP Hybris Core Certified Developer, SAP Hybris Commerce Certified Developer. \nTechnical Skills \nLanguages \n: Java, C#, C++ (Visual C++), JavaScript, XML, HTML, CSS, Angular, ReactJs. \nDatabases                    : Oracle, SQL Server, MySQL, PostgresSQL. \nTools \n: Eclipse, Microsoft Visio, iReport, Docker. \nFrameworks \n: SAP Hybris, Spring (Spring MVC, Spring Boot, Spring Cloud), Struts (1,2), Tapestry, \nLiferay, Hibernate, iBatis, Velocity, Apache Solr, Axis2, Jasper Report, Quartz, Log4J. \nWeb Servers \n: Apache Http Server, Nginx, IIS. \nApplication Servers \n: Tomcat Server, JBoss, Oracle Weblogic. \nOperating Systems \n: Windows, Linux, Mac OS. \nEducation \n2001-2006: University of Natural Sciences, Ho Chi Minh City, Vietnam _ Bachelor of Information Technology. \nCareer Summary \nDec 2017 \u2013 Present \nV-key, HCMC, Vietnam \u2013 Senior Software Engineer \nJun 2012 \u2013 Dec 2017 \nSequent Asia IT (SAI Digital), HCMC, Vietnam - Senior Java developer, \nTechnical Lead \nSep 2011 \u2013 May 2012 \nPyramid Consulting VN, HCMC, Vietnam - Senior Java developer \nDec 2008 \u2013 Jun 2011 \nNetBlue VN, HCMC, Vietnam - Senior Java developer \nMar 2008 \u2013 Nov 2008 \nOfficience, HCMC, Vietnam - Software developer \nOct 2006 \u2013 Feb 2008 \nFCGV, HCMC, Vietnam - Software engineer \nProfessional Experience \nOrganization:   V-key \nProject: Server Components \nRole: Senior Software Engineer \nProject Description \nV-key builds V-OS app is embedded in mobile devices so that it can protect required \nmobile applications. And V-key based on V-OS in order to provide security solutions \n(OTP, PKI, eKYC) for organizations (banks, governments).  \nNhat works in server components (authentication, provisioning, secured messaging, \neKYC dashboard, \u2026) of V-Key solutions. Main tasks: fix bugs, resolve client\u2019s issues, \nimplement and research enhancements, new components and features for company\u2019s \nproduct, deploy server components to many different environments (application \nservers, databases), and go to customer\u2019s place (data center) for troubleshoot, \nresolve production issues. \nProject Team Size \n10 \nSkill Set  \nJava/J2EE, Spring (Spring MVC, Spring Boot, Spring Cloud), ReactJs, Git, Jenkins, \nLinux, Mac OS, Apache Http server, Nginx, Apache Tomcat, Jboss, Oracle Weblogic, \nDocker, Oracle, SQL server, MySQL. \nOrganization:  Sequent Asia IT (Sai Digital) \nProject: Beauty Garage \nRole: Technical Leader \nProject Description \nBuild e-commerce solution for Beauty Garage client using SAP Hybris platform \n(www.beautygarage.jp). \nThis e-commerce is for spa industry and integrates with SAP ERP. It also has another \nsite (Eyelash Garage) for making beauty with glasses. \nNhat does technical lead tasks: technical support, review code, assign tasks for \nmembers, estimate, research, implement complex tasks in the project and SAP ERP \nintegration. \nProject Team Size \n25 \nSkill Set  \nJava/J2EE, Spring, SAP Hybris, Apache Solr, Git, Jenkins, Linux, Apache Http server, \nApache Tomcat, AWS, MySQL. \nOrganization:  Sequent Asia IT (Sai Digital) \nProject: Razer \nRole: Technical Leader \nProject Description \nBuild e-commerce solution for Razer client using SAP Hybris platform. \nFocus in integration between Hybris and SAP ERP. Using Data Hub technology of \nHybris. \nProject Team Size \n25 \nSkill Set  \nJava/J2EE, Spring Integration, Restful web services, Hybris (Data hub, order \nprocess), Git, Linux. \nOrganization:  Sequent Asia IT \nProject: AIL \nRole: Senior Developer \nProject Description \nArvind Limited (formerly Arvind Mills) is a textile manufacturer and \nthe flagship company of the Arvind Group. It is India's largest denim \nmanufacturer apart from being world\u2019s fourth-largest producer and exporter of denim. \nNow Arvind want to leverage Hybris platform\u2019s capability to build an Omnichannel \nsolution for their e-commerce business.  \nProject Team Size \n20 \nSkill Set  \nJava/J2EE, Spring (MVC) Framework, Hybris (ASM, CSCockpit, payment gateway, \nOCC), JQuery, Git, Message queue. \nOrganization:  Sequent Asia IT \nProject: Essilor \nRole: Senior Developer \nProject Description \nEssilor has requested that SAI develop a Hybris B2C portal/website for their \ncustomer: Provision. \nProvision wants to provide Australian Eye Care Professionals (ECPs) with an online \nchannel to sell their products \nKey tasks include build solr search, customize checkout process, customize cart, \ncustomize price and tax, implement all email features, build order management \nmodule, and generate receipts and reports. \nProject Team Size \n6-10 \nSkill Set  \nJava/J2EE, Spring (MVC) Framework, Hybris (Search, Price, Tax, Checkout process, \nEmailing, Order process), Apache Solr, Velocity, JQuery, SVN. \nOrganization:  Sequent Asia IT \nProject: Bookworld \nRole: Senior Developer \nProject Description \nBookworld wishes to move their current sites (www.bookworld.com.au \nand www.angusandrobertson.com.au) over into Hybris.  \nThere has been a platform RFP performed, where Hybris was chosen as the platform \nof choice. \nKey tasks include implementing new features in CS Cockpit, customizing CS Cockpit to \nsupport to sites, customize Order tab in CS cockpit, implement searching (product, \ncustomer, order) and voucher functionality in CS cockpit. Implement some features on \nstorefront and export invoice for web site. \nProject Team Size \n6-10 \nSkill Set  \nHybris (CS Cockpit, Storefront UI), Java/J2EE, Spring MVC Framework, Jasper Report, \nGIT. \nOrganization:  Sequent Asia IT \nProject: Target \nRole: Senior Developer \nProject Description \nTarget is a chain of discount stores that are about 95,000 to 135,000 square feet \n(12,000 m\u00b2) and carry hard lines, soft lines (clothing), and a limited amount of groceries, \nmostly non-perishable. Target has their shopping on line site (PC + Mobile platform) \nbased on another framework and now Target wants to port their shopping on line site \ninto Hybris. \nNhat implements and customizes some features for CS Cockpit and data models. \n(www.target.com.au)  \nProject Team  \n6-10 \nSkill Set  \nHybris (Core, CsCockpit), Oracle, Java/J2EE, Git. \nOrganization:  Sequent Asia IT \nProject: EBD \nRole: Senior Developer \nProject Description \nEnable you to configure Buying Organizations, users, suppliers, and \nMarket Site information. A host is any entity that provides procurement \nservices to other companies. An enterprise typically corresponds to a single \ncompany, or business. Enterprises receive procurement services from hosts. \nAn enterprise can contain one or more Buying Organizations \nResponsibilities: enhance, modify and explore the system. \nProject Team Size \n5 \nSkill Set  \nJava, Servlet/JSP, SQL Server, JRun, Windows. \nOrganization:  Sequent Asia IT \nProject: Exxon Mobil  \nRole: Senior Developer \nProject Description \nExxonMobil is a web portal which is operating as a billing engine to calculate the fee for \ncustomers who have used \u2018ExxonMobil\u2019 card to spend petrol/diesel allowance in a period \nof time in a month. \nThe system automatically uploads transaction files then calculate the \ndiscount/interest/fee\u2026  for each card and send an alert email/SMS to each customer so \nthey can go to their banks then pay for all their transactions during that time. \nProject Team Size  \n10 \nSkill Set \nJava, Spring, Hibernate, Jasper report, SQL Server, Eclipse, Tomcat, \nWindows 7 \nOrganization: Pyramid Consulting \nProject: ANP PRS \nRole: Senior Developer \nProject Description \nPress Release System helps journalist to create and publish press online \nProject Team Size  \n5 \nSkill Set  \nEJB3, Spring, Hibernate, Restful API, Oracle, PostgreSQL, JQuery, Ajax, Linux (Ubuntu). \nOrganization: Pyramid Consulting  \nProject: Belga Dashboard \nRole: Senior Developer \nProject Description  \n Build a portal manages internal applications in Belga corporation. \nProject Team Size  \n8 \nSkill Set  \nSpring, Hibernate, Web service, Oracle, Apache Tomcat, Google API, Linux (Ubuntu). \nOrganization:  Netblue VN \nProject: Admodus \u2013 TrafficKing \nRole: Developer \nProject Description  \nTrafficKing: system manages and configures advertisers, publishers; sets up relationship  \n( ads  of  advertiser  will  be  served  by  what  publisher)  between advertiser and \npublisher. \nAdmodus: system processes and tracks ad requests in real: decides what \nad is displayed at a certain time in a specific publisher\u2019s web site, renders it \nand collects user action data. \nProject Team Size  \n20 \nSkill Set  \nJava, Servlet, Tapestry, Spring, Velocity, MySQL, Eclipse, Apache Tomcat, Windows XP, \nLinux. \nOrganization:  Netblue Vietnam \nProject: SMP (SavingsMarketPlace) \nRole: Developer \nProject Description:  System has a web site delivers relevant savings in the form of coupons and \ndiscounts to their members. Moreover, it sends email with brand name offers and \nsavings tips to its members and has campaigns to advertise, collect customer\u2019s \nconsumption tendency data. \nProject Team Size:  \n15 \nSkill Set:  \nJava, Spring, Hibernate, Struts, JavaScript, Ajax, JQuery, HTML, CSS, \nMySQL, Eclipse, Apache Tomcat, Windows XP, Linux. \nOrganization:  Officience \nProject: TBE \nRole: Developer \nProject Description:  Is a Transaction Business Engine:  supports  client  communicating  with company easily \nthrough a web system, include the following modules: project &  project  template  \nmanagement,  user  &  group  management,  chat  module, project searching engine & \norder project on line. \nProject Team Size:  \n10 \nSkill Set:  \nJava, Struts2, Spring (Acegi), Hibernate, JavaScript, Ajax, JQuery, JSON, MySQL, Eclipse, \nApache Tomcat, Windows XP, Linux. \nOrganization:  FCGV \nProject: Cox iNav \nRole: Developer \nProject Description:  Provide employees a desktop environment that helps them to access \ninformation and support tools more quickly and easily, improves the call handling \nprocess, creates a \u201cvirtual\u201d service  and  support  environment  that allows them to offer \ncustomers the local \u201cfeel\u201d from a \u201cglobal\u201d rep to further enhance customer service. \nCreate an environment where the desktop transformation will be employee \nfriendly and will become accepted by all employees. \nProject Team Size:  \n20 \nSkill Set:  \nJava, BEA Weblogic, Jacada Framework, Portal, JSP, Web Service, Page Flow \nArchitecture, JavaScript, Ajax, Oracle, Windows XP. ", "educations": [{"id": 4563, "gpa": null, "major": "C\u00f4ng ngh\u1ec7 th\u00f4ng tin", "school": "University of Natural Sciences", "diploma": "Bachelors", "end_time": "2006-01-01T00:00:00Z", "conf_score": 0.9116797220560419, "start_time": "2001-01-01T00:00:00Z", "picklist_major": "IT - Hardware/Networking", "major_categories": "M\u00e1y t\u00ednh v\u00e0 c\u00f4ng ngh\u1ec7 th\u00f4ng tin", "major_categories_detail": "C\u00f4ng ngh\u1ec7 th\u00f4ng tin"}], "experiences": [{"id": 15198, "detail": "", "company": "V - key", "end_time": "2023-04-13T00:00:00Z", "industry": "Other", "position": null, "conf_score": 0.7255079258306127, "start_time": "2017-12-01T00:00:00Z"}, {"id": 15199, "detail": "", "company": "Sequent Asia IT (SAI Digital),", "end_time": "2017-12-31T00:00:00Z", "industry": "High Technology", "position": "Senior Java developer,\nTechnical Lead", "conf_score": 0.8336597938982235, "start_time": "2012-06-01T00:00:00Z"}, {"id": 15201, "detail": "", "company": "Pyramid Consulting VN", "end_time": "2012-05-31T00:00:00Z", "industry": "Other", "position": null, "conf_score": 0.7513082139105881, "start_time": "2011-09-01T00:00:00Z"}, {"id": 15203, "detail": "", "company": "NetBlue VN", "end_time": "2011-06-30T00:00:00Z", "industry": "Other", "position": "Senior Java developer", "conf_score": 0.8336597938982235, "start_time": "2008-12-01T00:00:00Z"}, {"id": 15204, "detail": "", "company": "Officience", "end_time": "2008-11-30T00:00:00Z", "industry": "High Technology", "position": null, "conf_score": 0.703054895247018, "start_time": "2008-03-01T00:00:00Z"}, {"id": 15205, "detail": "", "company": "FCGV", "end_time": "2008-02-29T00:00:00Z", "industry": "Other", "position": "Software engineer", "conf_score": 0.9050765977702602, "start_time": "2006-10-01T00:00:00Z"}], "address": null}