{"skills": ["team management", "git", "java", "c++", "github", "objective c", "python", "jira", "parcel", "design pattern", "arc", "io", "peer to peer", "project management", "le", "javascript", "swift", "database", "mvvm", "banking", "io sdk", "google map", "map sdk", "software development", "multithreading", "viper", "xcode", "management", "trello", "restful"], "fulltext": "Anh Son Le\nPassionate iOS Developer & Software\nCreator\niOS Developer, Mobile Team Leader\nEMDDI JSC\nResponsibility\niOS Developer - Mobile Team Leader\nIs the key member from the beginning of the start-up company, responsible\nfor iOS application development and mobile team management with 4\nmembers.\nAs a member of a startup, besides undertaking iOS application\ndevelopment, I also have many other roles including ensuring process and\nconvenience, working with partners and customers.\nReal iOS Developer\nVMODEV JSC\nResponsibility\niOS Developer\nBe a member of a great team, makes amazing applications and software for\nEuropean - American and Singapore customers.\nFresher & Junior iOS Developer\nFIWI JSC - VIETIS JSC\nResponsibility\niOS Developer\nParticipate in outsourcing software with Japanese and Vietnamese\ncustomers.\nExperience\n2016 -\npresent\n2015 -\n2016\n2014 -\n2015\nUniversity of Engineering and Technology - Vietnam\nNational University, Hanoi\nMajor: Faculty of Information Technology (Honors Program)\nGPA: 3.33\nFamiliar with: Facebook SDK, Google Maps SDK, Google Maps Services,\nWebSocket, WebRTC, ...\nStrong knowledge of iOS SDK: Autolayout, ARC, CoreLocation,\nBackground Fetch, Multithreading.\nUse MVVM, CleanSwift, VIPER architecture pattern to create legible, easy-\nto-maintain projects.\nProfessional in Git, Trello, Jira to project management.\nHave good thinking about UI-UX. I can use Sketch, Adobe AI/XD to make\nnot bad design.\nEducation\n2013-06 -\n2017-06\niOS Development Skill\nPersonal Info\nAddress\nHanoi, Vietnam\nPhone\n+84 888 484549\nE-mail\nleanhson.uet@gmail.com\nDate of birth\n1995-02-27\nGitHub\nhttps://github.com/sonla58\nLinkedIn\nwww.linkedin.com/in/anhsonleawesom\ne\nProgramming Languages\nSwift\nObjective C\nJavaScript/C++\nPython/Java\nSoftware\nXcode\nSublime, VSCode\nGit, Source Tree\nJira, Trello\nActivities\n2018\nTop 3 Nhan Tai Dat Viet (Vietnamese\nTalents) in the field of information\ntechnology\n2018\nWinner of VPBank Hackathon\n(Fintech)\nEMDDI JSC\nEmddi - Emddi Driver mobile app for iOS\nDescription\nAn online car/taxi/bike dispatching platform.\nEmddi App: https://itunes.apple.com/vn/app/emddi/id1270094982?\nl=vi&mt=8\nEmddi Driver App: https://itunes.apple.com/vn/app/emddi-\ndriver/id1270094804?l=vi&mt=8\nPosition\niOS Developer, project manager.\nTechnologies\nResponsibilities\nXcode, Swift 3/4\n\u2022\nDesign pattern: MVVM\n\u2022\nBackground fetch, Background tasks, CoreLocation,...\n\u2022\nGoogle Maps SDK, WebSocket, ...\n\u2022\nRestful API\n\u2022\nRealm Database\n\u2022\nResearch technology and develop product.\n\u2022\nUI/UX Designer.\n\u2022\nBuild native iOS app for customer and driver.\n\u2022\nResearch and build EMDDI SDK Framework to integrated into the\nbanking or e-wallet system.\n\u2022\nManage and distribute product in AppStore.\n\u2022\nVMODEV JSC\nPayload Parcels\nDescription\nMobile app and web platform providing peer-to-peer delivery/courier\nservice.\nhttps://itunes.apple.com/us/app/payload-parcels/id1146163938?mt=8\nPosition\niOS Developer\nTechnologies\nXcode, Swift 2/3\nDesign pattern: MVVM\nRestful API\nRealm Database\nResponsibilities\nResearch technology and develop product.\nBuild native iOS app.\nSome Projects\n2016 -\npresent\n2016\nPowered by TCPDF (www.tcpdf.org)", "educations": [{"id": 4562, "gpa": "3.33", "major": "C\u00f4ng ngh\u1ec7 th\u00f4ng tin", "school": "University of Engineering and Technology - Vietnam National University,", "diploma": "Bachelors", "end_time": null, "conf_score": 0.7215300996230176, "start_time": null, "picklist_major": "IT - Hardware/Networking", "major_categories": "M\u00e1y t\u00ednh v\u00e0 c\u00f4ng ngh\u1ec7 th\u00f4ng tin", "major_categories_detail": "C\u00f4ng ngh\u1ec7 th\u00f4ng tin"}], "experiences": [{"id": 15197, "detail": "Is the key member from the beginning of the start-up company, responsible for iOS application development and mobile team management with 4 members.\nAs a member of a startup, besides undertaking iOS application development, I also have many other roles including ensuring process and convenience, working with partners and customers.\n20", "company": "EMDDI JSC", "end_time": "2023-04-13T00:00:00Z", "industry": "Other", "position": "iOS Developer, Mobile Team Leader", "conf_score": 0.9410315679366841, "start_time": "2016-01-01T00:00:00Z"}, {"id": 15200, "detail": "Be a member of a great team, makes amazing applications and software for\nEuropean - American and Singapore customers.", "company": "VMODEV JSC", "end_time": "2016-01-31T00:00:00Z", "industry": "Other", "position": "Real iOS Developer", "conf_score": 0.887486929561425, "start_time": "2015-01-01T00:00:00Z"}, {"id": 15202, "detail": "Participate in outsourcing software with Japanese and Vietnamese customers.", "company": "FIWI JSC - VIETIS JSC", "end_time": "2015-01-31T00:00:00Z", "industry": "Other", "position": "Fresher & Junior iOS Developer", "conf_score": 0.9303495280662989, "start_time": "2014-01-01T00:00:00Z"}], "address": "Hanoi, Vietnam"}