{"skills": ["xcode", "online game", "vega", "studio", "cryptography", "streaming", "java", "c++", "testing", "vba", "internet", "objective c", "power designer", "ajax", "encryption", "pyramid", "mysql", "oracle", "io", "security", "eauthentication", "rational", "android tv", "microsoft", "adapting", "sql", "uml", "visual studio", "c#", "html5", "macos", "javascript", "payment", "swift", "database", "actionscript", "xml", "live streaming", "cobol", "microsoft visual studio", "cocos2d", "php", "teamwork", "android", "live video streaming", "postgresql", "crystal report", "kotlin", "asp"], "fulltext": "Curriculum Vitae \nPERSONAL INFORMATION \n\uf0b7 Name: Nguyen Hoang Son   \n\uf0b7 Birthday: July 16th, 1986  \n\uf0b7 Sex: Male \nAddress: 136 Ho Tung Mau street,  \n        Bac Tu Liem district, Hanoi \nQUALIFICATION \nUniversity of Science, Vietnam National University - Ho Chi Minh City \n\uf0b7 Program: Bachelor of Science \n\uf0b7 Major: Information Technology \n\uf0b7 Rank: Very good \n\uf0b7 Major GPA: 8.22/10 \n\uf0b7 General GPA: 7.79/10 \n\uf0b7 Thesis: Building e-paper system with Rich Interaction Application  \n            technology ( Silverlight ). Point: 9.30/10 (A+) \n\uf0b7 Year of Graduation: 9/2008 \nFOREIGN LANGUAGE \nJapanese : get Certificate Japanese Language Proficiency (N3) in 2010 \nEnglish: get Certificate TOEIC 750 in 2011 \nSMM: get FPT\u2019s Certificate middle manager in 2014 \nMiniMBA: get FPT\u2019s Certificate mini MBA in 2015 \nSKILL \nProgramming Language \n\uf0b7 Expert : Objective-C, Swift, Android, Java, Kotlin \n  C/C++ , C#, ASP.NET, PHP \n\uf0b7 Known: VB.NET, Javascript, Actionscript, VBA, \n               Assembly, HTML5 \nOther techniques \n\uf0b7 Cocos2d (game engine for iphone/ipad) \n\uf0b7 Ajax, Web Service, XML, ADO.NET, Crystal Report \n\uf0b7 Testing, Encryption, Security, Cryptography, Authentication \n\uf0b7 Silverlight \n\uf0b7 Adobe Flex \n\uf0b7 RUP, UML \n\uf0b7 Flash \n\uf0b7 Framework, SDK \n\uf0b7 Live streaming video, music \n\uf0b7 Core reader book pdf, epub3 \nSoft skill \n\uf0b7 Teamwork \n\uf0b7 Managing project \n\uf0b7 Ability to communicate and present seminar \n\uf0b7 High responsibility for work \n\uf0b7 Researching fast new technology \n\uf0b7 Adapting oneself to new surroundings \nPlatforms \n\uf0b7 MacOS, Linix, Ubunti, Window \n\uf0b7 iPhone, iPad, AppleTV \n\uf0b7 Android devices, set top box, smartTV \n\uf0b7 Symbian \n\uf0b7 Pocket PC \n\uf0b7 Mobile phone (J2ME) \n\uf0b7  Website core service \nDatabase \n\uf0b7 SQL Server \n\uf0b7 Oracle \n\uf0b7 MS Access \n\uf0b7 MySQL \n\uf0b7 SQLLite \nTools \n\uf0b7 Xcode  \n\uf0b7 CocosBuilder  \n\uf0b7 Eclipse, Android Studio  \n\uf0b7 Microsoft Visual Studio \n\uf0b7 NetBean \n\uf0b7 Carbide C++ \n\uf0b7 SQLServer  \n\uf0b7 PostgreSQL \n\uf0b7  Flex Builder \n\uf0b7 Flash Developer \n\uf0b7 Rational Rose  \n\uf0b7 Macromedia Dreamweaver  \n\uf0b7 Zend Studio  \n\uf0b7 Aptana \n\uf0b7 Power Designer \n\uf0b7 Microsoft Expression Blend \nSCHOLARSHIP \n\uf0b7 The scholarship (money) from University with the support of Pyramid \n  Consulting Vietnam Company in 11/2007 \n\uf0b7 The scholarship (bridge engineer training course at Yokohama and Tokyo)        \n  from ISB company with the support of AOTS (Association for Overseas  \n  Technical Scholarship) organization of Japan government from 11/2009 to  \n  11/2010 \n\uf0b7 One of the 3 best developers in IVC company, 2009  \n\uf0b7 One of the 5 best managers in Vega company, 2016 \nEXPERIENCE \n\uf0b7 6/2007-8/2007: Training in Ho Chi Minh FPT Telecom Corporation \n                           Position:  Web programmer (ASP.NET) \n\uf0b7 8/2008-10/2009: ISB Vietnam Company Limited (Japan) at Ho Chi Minh city \n                           Position:  Junior developer \n\uf0b7 11/2009-11/2010: Yokohama training center and ISB Vietnam Company  \n                              Limited (Japan) at Tokyo. \n                              Position: Trainee - Team leader.  \n   I joined in the bridge engineer course of        \n                                             AOTS  (Association for Overseas Technical   \n                                             Scholarship) organization of Japan government   \n                                             This course included in Japanese and Cobol  \n                                             language. \n\uf0b7 11/2010-6/2011: ISB Vietnam Company Limited (Japan) at Ho Chi Minh city \n                            Position:  Team Leader. \n\uf0b7 7/2011-11/2012: ISB Vietnam Company Limited (Japan) at Hanoi city \n                            Position:  Project manager. \n\uf0b7 12/2012-12/2013: CNC Company (VietNam) at Hanoi city \n                            Position:  iOS-android developer. \n\uf0b7 1/2014-now: Vega Corporation (VietNam) at Hanoi city \n                            Position:  Project manager. \nREFERENCE \n\uf0b7 Product 1: Developed company \u2018s website: \nhttp://www.isb-vietnam.com.vn/home \n- Role: web ASP.net developer \n- Timeline: from 4/2009 to 10/2009 \n- Team: 5 ASP.net developer, 2 QC, 1 team leader \n\uf0b7 Product 2: developed and managed android-iOS iSpreader project \n- Role: Project Manager, developer android \n- Timeline: from 7/2011 to 11/2011.  \n- Team: 3 android developers, 3 iOS developers, 1 QC, 1 project manager.   \n- Status: Apps removed in Apple Store and Google Play for stopping service \n- Reference: iSpreader program that was aired on VTC1 television channel   \nhttps://www.youtube.com/watch?feature=player_embedded&v=yMCjXlLDXhk \n\uf0b7 Product 3: developed and managed website-android-iOS Timbox-UBox \nproject \n- Role: Project Manager, ios developer \n- Timline: from 2/2012-2/2013 \n- Team: 3 android developers, 3 iOS developers, 3 website developers, 3 QC, 1 \nproject manager \n- Status:  Apps removed in Apple Store and Google Play for stopping service. \n- Reference: https://tinhte.vn/threads/danh-gia-ubox-ung-dung-chat-dua-tren-\nso-thich-theo-phong-cach-meme.2182923/ \n\uf0b7 Product 4: developed and managed android-iOS ClipTV project \n- Role: Project Manager \n- Timeline: from 2/2014-now \n- Team: 2 android developers, 2 iOS developers, 3 QC, 1 project manager \n- Status:  Live in store. \n- Reference:  \nAndroid app: \nhttps://play.google.com/store/apps/details?id=vn.com.vega.clipvn \nAndroid TV app: \nhttps://play.google.com/store/apps/details?id=com.vgbm.clip.tv \niOS app: \nhttps://itunes.apple.com/vn/app/clip-tv-truy\u1ec1n-h\u00ecnh-\ninternet/id785998054?l=vi&mt=8 \n\uf0b7 Product 5: developed and managed android-iOS Nhac.vn project \n- Role: Project Manager \n- Timeline: from 1/2015-now \n- Team: 2 android developers, 2 iOS developers, 2 QC, 1 project manager \n- Status:  Live in store. \n- Reference:  \nAndroid app:  \nhttps://play.google.com/store/apps/details?id=co.dudo.acmobm \nAndroid TV app: \nhttps://play.google.com/store/apps/details?id=abmi.punug.tevi \niOS app: \nhttps://itunes.apple.com/vn/app/nhac-vn-\u00e2m-nh\u1ea1c-mang-c\u1ea3m-\nx\u00fac/id1214215216?l=vi&mt=8 \n\uf0b7 Product 6: developed and managed website-android-iOS Waka project \n- Role: Project Manager \n- Timeline: from 6/2014-now \n- Team: 2 android developers, 2 iOS developers, 2 QC, 1 project manager \n- Status:  Live in store. \n- Reference:  \nWebsite: \nhttps://waka.vn/ \nAndroid app:  \nhttps://play.google.com/store/apps/details?id=co.dudo.acmobm \niOS app: \nhttps://itunes.apple.com/vn/app/waka-4-0-ebook-\naudiobook/id929027521?l=vi&mt=8 \n\uf0b7 Product 7: Build SDK for manage user and payment in online games. \n- Role: ios-android developer \n- Timeline: from 8/2015-now \n- Team: 1 developer \n- Status:  Live service. \n- Reference:  \nWebsite: \nhttps://billing.vegaid.vn/dang-nhap-vao-game/ \n\uf0b7 Product 8: Build core reader. \n- Role: ios-android developer \n- Timeline: from 3/2017-now \n- Team: 1 developer \n- Status:  Live service. \n- Reference:  \nCore reader in app: \nhttps://play.google.com/store/apps/details?id=co.dudo.acmobm \nINTEREST \n\uf0b7 Sport: Football, volleyball, basketball, swimming \n\uf0b7 Music: play drum and piano \n\uf0b7 Other: reading, travelling, film ", "educations": [{"id": 4571, "gpa": "8.22", "major": "C\u00f4ng ngh\u1ec7 th\u00f4ng tin", "school": "University of Science, Vietnam National University - Ho Chi Minh City", "diploma": "Bachelors", "end_time": "2008-09-01T00:00:00Z", "conf_score": 0.82110427202728, "start_time": null, "picklist_major": "IT - Hardware/Networking", "major_categories": "M\u00e1y t\u00ednh v\u00e0 c\u00f4ng ngh\u1ec7 th\u00f4ng tin", "major_categories_detail": "C\u00f4ng ngh\u1ec7 th\u00f4ng tin"}], "experiences": [{"id": 15223, "detail": "eam: 1 developer\n- Status: Live service.\n- Reference: Website: https://billing.vegaid.vn/dang-nhap-vao-game/", "company": null, "end_time": "2023-04-13T00:00:00Z", "industry": "Other", "position": "ios - android developer", "conf_score": 0.6981244904084882, "start_time": "2015-08-01T00:00:00Z"}, {"id": 15224, "detail": "t Hanoi city\nPosition: Pr", "company": "Vega Corporation (VietNam)", "end_time": "2023-04-13T00:00:00Z", "industry": "Other", "position": "Project manager", "conf_score": 0.9297015892355367, "start_time": "2014-01-01T00:00:00Z"}, {"id": 15227, "detail": "VietNam) at Hanoi city\nPosition: iO", "company": "CNC Company", "end_time": "2013-12-31T00:00:00Z", "industry": "Other", "position": "iOS - android developer", "conf_score": 0.9331571384331322, "start_time": "2012-12-01T00:00:00Z"}, {"id": 15230, "detail": "t Hanoi city\nPosition: Pr", "company": "ISB Vietnam Company Limited (Japan)", "end_time": "2012-11-30T00:00:00Z", "industry": "Other", "position": "Project manager.", "conf_score": 0.7719992418950035, "start_time": "2011-07-01T00:00:00Z"}, {"id": 15233, "detail": "t Ho Chi Minh city\nPosition: Te", "company": "ISB Vietnam Company Limited (Japan)", "end_time": "2011-06-30T00:00:00Z", "industry": "Other", "position": "Team Leader.", "conf_score": 0.7719992418950035, "start_time": "2010-11-01T00:00:00Z"}, {"id": 15235, "detail": "I joined in the bridge engineer course of\nAOTS (Association for Overseas Technical Scholarship) organization of Japan government\nThis course included in Japanese and Cobol language.", "company": "Yokohama training center and ISB Vietnam Company Limited (Japan)", "end_time": "2010-11-30T00:00:00Z", "industry": "Other", "position": "Trainee - Team leader", "conf_score": 0.9331571384331322, "start_time": "2009-11-01T00:00:00Z"}, {"id": 15237, "detail": "t Ho Chi Minh city\nPosition: Ju", "company": "ISB Vietnam Company Limited (Japan)", "end_time": "2009-10-31T00:00:00Z", "industry": "Other", "position": "Junior developer", "conf_score": 0.8055899374688004, "start_time": "2008-08-01T00:00:00Z"}, {"id": 15239, "detail": "", "company": "Ho Chi Minh FPT Telecom Corporation", "end_time": "2007-08-31T00:00:00Z", "industry": "High Technology", "position": "Web programmer", "conf_score": 0.935361301389243, "start_time": "2007-06-01T00:00:00Z"}], "address": "136 Ho Tung Mau street, Bac Tu Liem district, Hanoi"}