{"skills": ["stack", "angular", "css3", "wordpress", "javascript", "graphql", "cloud", "es6", "bootstrap", "mongodb", "redux", "heroku", "io", "postgresql", "jquery", "git", "html5", "typescript", "react native", "medium", "codeigniter", "google cloud", "sql", "restful", "laravel", "socket io", "database", "bitbucket", "php", "mysql", "html", "google map"], "fulltext": "NGUY\u1ec4N THI\u00caN QUANG\nFull Stack PHP/NodeJS Website\nDate of birth:\n 25/09/1994\nGender:  Nam\nPhone:  0395736236\nEmail:  dongthoigian4@gmail.com\nAddress:\n Ho Chi Minh city, Vietnam\nTARGET\nBecome a website developer professional. Understand more about software in any software field and upgrade\nskills coding.\nEDICATION\nOctuber, 2013 - May, 2016\nOPEN UNIVESITY\nSpecialized: Software Computer\nGPA: 7.0/10\nWORK EXPERIENCE\nFebruary, 2016 - Currently\nTQ DESIGN\nFull Stack PHP/HTML developer\nKnow more about UX-UI, advanced Javascript ES5, ES6 and PHP\nframework, CMS. All most website built and building at company about\nreal estate and website design\nWebsite: http://melosagarden.com.vn, http://diamondlotus.vn\nAugust, 2016 - Currently\nLT COPORATION\nFull stack PHP, Nodejs, HTML developer.\nAt LT Corporation, we are building all most applications about website\nexchange trade coins virtual, Web Application, Server PHP using\nRestful API and Graph QL.\nWebsite: All website, Web Applications is internal.\nExample: http://www.bitarbipro.com  ( need account internal to login )\nPROGRAMMING SKILLS\n3 Year Full Stack Website Developer Nodejs / PHP:\n1. Nodejs, Express JS, Socket IO\n2. PHP7, Codeigniter, Laravel, Wordpress, Open Card.\n3. Css3, Javascript, typescript, jQuery, HTML5, Bootstrap 3 v\u00e0 4, React/Redux, React Native, Angular 6/7\n4. Database: MySQL, SQL Server, SQL lite, No SQL, PostGresQL, MongoDB. \n5. Google Cloud, Amazon Web Services (EC3), Git, Bitbucket, Firbase, Heroku.\n6. RestFul API and GraphQL\n7. Adobe Photoshop, Adobe illustrator, Adobe Lightroom\n8. Facebook Developer, Google Developer, Google MAP API\nExperiences: SEO On Page and SEO Off Page.Upgrade experiences website designer UX-UI, Animations\nCanvas, SVG, Charts HTML, Three JS, HTML5 MAP, Media.\nNguyen Thien Quang\nPhone:  0395736236\nEmail: dongthoigian4@gmail.com\nCONTACT\n\u00a9 topcv.vn\nPowered by TCPDF (www.tcpdf.org)", "educations": [{"id": 4565, "gpa": "7.0", "major": "Bi\u1ec3u di\u1ec5n nh\u1ea1c c\u1ee5 ph\u01b0\u01a1ng t\u00e2y", "school": "OPEN UNIVESITY", "diploma": "Other", "end_time": "2016-05-01T00:00:00Z", "conf_score": 0.917841109432358, "start_time": "2013-01-01T00:00:00Z", "picklist_major": "Art/Design", "major_categories": "Ngh\u1ec7 thu\u1eadt", "major_categories_detail": "Ngh\u1ec7 thu\u1eadt tr\u00ecnh di\u1ec5n"}], "experiences": [{"id": 15213, "detail": ". At LT Corporation, we are building all most applications about website exchange trade coins virtual, Web Application, Server PHP using\nRestful API and Graph QL. Website: All website, Web Applications is internal.\nExample: http://www.bitarbipro.com ( need account internal to login )", "company": "LT COPORATION", "end_time": "2023-04-13T00:00:00Z", "industry": "Other", "position": "Full stack PHP, Nodejs, HTML developer", "conf_score": 0.9181269048441778, "start_time": "2016-08-01T00:00:00Z"}, {"id": 15214, "detail": "Know more about UX-UI, advanced Javascript ES5, ES6 and PHP framework, CMS. All most website built and building at company about real estate and website design\nWebsite: http://melosagarden.com.vn, http://diamondlotus.vn", "company": "TQ DESIGN", "end_time": "2023-04-13T00:00:00Z", "industry": "Other", "position": "Full Stack PHP/HTML developer", "conf_score": 0.920031615510459, "start_time": "2016-02-01T00:00:00Z"}], "address": "Ho Chi Minh city, Vietnam"}