{"skills": ["payment", "marketing", "asana", "iot", "futures", "c#", "management", "studio", "gitlab", "event marketing", "io", "tool support", "bluetooth", "git", "work ethic", "firebase", "analysis", "team management", "react native", "medium", "android", "ionic", "trello", "wifi", "sql", "oop", "visual studio", "learning experience", "arduino", "software development", "bug fixing", "testing", "uml", "problem solving skill", "teamwork", "product management", "problem solving", "bitbucket", "m sql server", "agile"], "fulltext": "Nguyen Tuan Anh\nDate of birth\n March 04, 1994\nGender  Male\nPhone\n (+84) 986741436\nEmail  nguyentuananh4394@gmail.com\nAddress\n No 566/29/30 Nguyen Thai Son Street, ward 5,  Go Vap\nDistrict, Ho Chi Minh City\nWebsite  www.linkedin.com/in/nguyentuananhse\nABOUT ME\nApril 2017 - Now\nExecutive in Industry 4.0 Lab at Nguyen Tat Thanh\nUniversity\nExecutive\n- Working time more than 22 months.\n- Join team develop mobile application.Soft skills experience: set\nproblem, working with team, Strong work ethic, research skills,\nself-motivation.\n- Developer some project IOT and business.\n- Participate in building and analyzing for mobile application.\nJuly 2016 - November 2016\nInternship students at Pixa Studio with position Mobile\nAndroid developer.\nInternship\n- Working time 4 months.\n- Experience in company technology.\n- Training skill working with framework. \n- Join team develop two product for company.\n- Have the ability to work under high pressure.\n- Soft skills experience: join software development life cycle, train\nskill using tool support develop software.\n2013 - 2017\nStudent Information technology at Industrial University of Ho\nChi Minh City\nStudent\n- Soft skills experience: leading group discussions, teamwork,\nproblem-solving skills,.\n- The ability to present and training.\n- The ability to programer. \nOBJECTIVE\nPosition of  mobile developer  : \nI want to be a official member of your company. There are many opportunities to grow, improve skill, environment\ngood for future. \n- My goal is mastering the programming skills, improving qualification, complete good training. Cultivate positive\nlearning experience to develop professional skills and life skills to meet the future job.\n- Long-term goals: I want to become project manager and learning higher for research, developer product using in\nlife.\nEDUCATION\nOct 2013 - May 2017\nIndustrial University of Ho Chi Minh City\nMajor: Software Engineer\nGPA: 2.87/4 \nScore 7.2\nACTIVITIES\nMay 2017 - Now\nExecutive in Industry 4.0 Lab at Nguyen Tat Thanh University\nExecutive\nMy position is mobile developer, build frame for application, document,\ntesting and software deployment.\nOct 2018 - Dec 2018\nIntern in TMA Solution\nIntern\nWorking with develop team in course between Industry 4.0 Lab and TMA\nSolution\nMarch 2017 - May 2017\nIntern in Industry 4.0 Lab at Nguyen Tat Thanh University\nIntern\nMy position is mobile application developer on Android\nJune 2015 - July 2015\nNational University Entrance Exam Support Campaign 2015\nMember\nCERTIFICATIONS\n2015\n- Award of excellence in Global capstone design programs, \nco-organized by Kyungwoon University and Industrial university of Ho\nChi Minh city.\n2015\n- English C level.\nHONORS & AWARDS\n2015\n- Award of excellence in Global capstone design programs,co-organized\nby Kyungwoon University.\nSKILLS                                                                                               EXPERIENCE\nIndustry Knowledge\nAndroid Development                                                    2.5 years \nReact native Development                                            1.2 years  \nIonic Development                                                          4 months\nOOP\nUML\nProject Manager\nTools & Technologies\nAndroid Studio                                                            2.5 years\nReact Native                                                               1.2 years\nIonic Flatform                                                               3 months\nXCode                                                                         1 years\nVisual Studio Code                                                     1.2 years\nFirebase\nArduino IDE                                                                5 months\nOther Skills\nGit, GitLab, Bitbucket                          \nAgile, Scrum                                             \nTrello, Asana, Nodejs, IOS                                                                  \nLanguage\nVietnamese                                                                Proficient          \n English                                                                       Medium    \nINTERESTS\nOne of my hobbies is listening to music, especially English songs. I like watching action movie , science fiction. I\nusually play sports such as soccer, badminton, swimming.I love traveling with my friend. Traveling gives  me\npleasure. If help me to see the world, beautiful objects and meet new people.\nPROJECTS\nEbike\n(2018 - 2018)\nCustomer\nNation University of Ho Chi Minh\nDescription\nEbike is application bicycle rental application. User do scan code on bicycle to use\nthem. \nTracking map, report when bicycle broken, payment.\nTeam size\nMore people\nMy position\nMobile Developer\nMy responsibilities\n Develop next version  include: update new design for app and update and develop\nfunction Register, Login, Menu, Scan QR, Login, Report, Validate data, Payment,\nInvite friend.\n- Fix bug.\nTechnologies used\n- React native\nSaigon Co.op\n(2018 - 2018)\nCustomer\nSaigon Coop\nDescription\nSaigon Co.op application was built to provide quick, regular and effective information\nsupport for customers, product management, new product information and\npromotional events\nTeam size\nMore people\nMy position\nMobile Developer\nMy responsibilities\n- Develop new function for customer, update information user.\n- Fix bug\nTechnologies used\n- Android\nLien Doan Lao Dong Ho Chi Minh\n(2018 - 2018)\nCustomer\nLien Doan Lao Dong HCM\nDescription\nThis is project develop for Lien Doan Lao Dong Ho Chi Minh like new sites and have\nfunction display new information, Forum, Library, Chat, Picture, Notification\nTeam size\n1\nMy position\nMobile Developer\nMy responsibilities\n- Develop function: Login, Register, Library, Forum, Picture, Chat, Notification\n- Fix bug\nTechnologies used\n- React Native.\nPizza Italy\n(2018 - 2018)\nCustomer\nItaly Restauran\nDescription\nThis is application for booking pizza online. System develop like Pizza Company,\nPizza Hurt.\nTeam size\n1\nMy position\nMobile Developer\nMy responsibilities\n- Develop function: Login, Register, List pizza, Pizza custom, Order.\n- Fix bug\n- Testing\nTechnologies used\n- React Native.\nNEST MT\n(2018 - 2018)\nCustomer\nCPM Vietnam\nDescription\nSales management application on the phone. Main function are manager list\nproduct, event marketing, calculate purchase transactions, seller management\nTeam size\nMore people\nMy position\nMobile Developer\nMy responsibilities\n- Develop function: Checkin today, Promotion and Event, Report Activation, Visibility\ncampaign, Notification.\n- Fix bug\n- Testing\nTechnologies used\n- Android\nIlyra - Agriculture\n(2017 - 2018)\nCustomer\nNguyen Tat Thanh University\nDescription\nIlyra is IOT project include software and hardware. Focus develop IOT device and\nsoftware on Web and SmartPhone using in agriculture. Control device, display\nsensor data, build system schedule auto.\nTeam size\n1\nMy position\nMobile Developer\nMy responsibilities\n- Analysis and design.\n- Testing\n- Fix bug.\n- Develop mobile application display data from device, control device, create\nschedule and presenter all information object working in hardware.\n- In application use have QR Code, Socketio, Notification.\nTechnologies used\n- Android Studio\n- React native\n- Socketio\n- QR Code\nApplication \" Vui Hoc Tu Vung\" for Android - University Project\n(2016 - 2017)\nCustomer\nEvery one\nDescription\nLearn vocabulary english, user input result after see image on application\nTeam size\n1\nMy position\nMobile Developer, Design\nMy responsibilities\n- Analysis and design\n- Development\n- Review code \n- Bug Fixing\nTechnologies used\n- Android\nSmart Kettle - University Project\n(2016 - 2017)\nCustomer\nFaculty Of Infomation Technology\nDescription\nProduct using sensor tracking status device after display for user. System may be\nauto control sensor action. User can control system by phone\nTeam size\n1\nMy position\nDeveloper, Build circuit\nMy responsibilities\n- Analysis and design\n- Develop function: display information sensor from sensor device on kettle, control\nand schedule for device Kettle.\n- Bug fixing\n- Testing\nTechnologies used\n- Android , Android 6.0\n- Arduino program\n- Kit Wifi ESP8266 Node MCU\n- Firebase\nSmart car - University Project\n(2015 - 2016)\nCustomer\nIndustrial University of Ho Chi Minh city and Kyungwoon University\nDescription\nSmart car build on arduino circuit , control by phone use through bluetooth, voice\ncontrol\nTeam size\n2\nMy position\nDeveloper, Build circuit\nMy responsibilities\n- Analysis and design\n- Testing\n- Bug fixing\nTechnologies used\n- Android, Android 5.1.1\n- Arduino program\n- Arduino Mega circuit\nGenealogy management software - University Project\n(2015 - 2016)\nCustomer\nFaculty Of Infomation Technology\nDescription\nGenealogy management software in a family line\n( Demo )\nTeam size\n1\nMy position\nDeveloper\nMy responsibilities\n- Analysis and design\n- Developer\n- Review code\n- Bug Fixing\nTechnologies used\n- C#\n- MS SQL Server 2008 R2\n\u00a9 topcv.vn", "educations": [{"id": 4575, "gpa": null, "major": "C\u00f4ng ngh\u1ec7 th\u00f4ng tin", "school": "Industrial University of Ho Chi Minh City", "diploma": "Bachelors", "end_time": "2017-01-01T00:00:00Z", "conf_score": 0.9542271074073599, "start_time": "2013-01-01T00:00:00Z", "picklist_major": "IT - Hardware/Networking", "major_categories": "M\u00e1y t\u00ednh v\u00e0 c\u00f4ng ngh\u1ec7 th\u00f4ng tin", "major_categories_detail": "C\u00f4ng ngh\u1ec7 th\u00f4ng tin"}, {"id": 4577, "gpa": "2.87", "major": "Software Engineer", "school": "Industrial University of Ho Chi Minh City", "diploma": "Bachelors", "end_time": "2017-05-01T00:00:00Z", "conf_score": 0.8413267261986577, "start_time": "2013-10-01T00:00:00Z", "picklist_major": "Other", "major_categories": "", "major_categories_detail": ""}], "experiences": [{"id": 15253, "detail": "- Working time more than 22 months.\n- Join team develop mobile application.Soft skills experience: set problem, working with team, Strong work ethic, research skills, self-motivation.\n- Developer some project IOT and business.\n- Participate in building and analyzing for mobile application.", "company": "Industry 4.0 Lab at Nguyen Tat Thanh University", "end_time": "2023-04-13T00:00:00Z", "industry": "Education", "position": "Executive", "conf_score": 0.8864912488904257, "start_time": "2017-04-01T00:00:00Z"}, {"id": 15255, "detail": ". Internship - Working time 4 months.\n- Experience in company technology.\n- Training skill working with framework.\n- Join team develop two product for company.\n- Have the ability to work under high pressure.\n- Soft skills experience: join software development life cycle, train skill using tool support develop software.", "company": "Pixa Studio", "end_time": "2016-11-30T00:00:00Z", "industry": "Other", "position": "Mobile Android developer", "conf_score": 0.9311204050450419, "start_time": "2016-07-01T00:00:00Z"}], "address": "No 566/29/30 Nguyen Thai Son Street, ward 5, Go Vap District, Ho Chi Minh City"}