{"skills": ["linux", "unix", "angular", "css3", "voip system", "malware", "responsive", "javascript", "virtual keyboard", "implementation", "management", "banking", "unit test", "jquery", "git", "finance", "svn", "html5", "typescript", "ruby", "wealth management", "insurance", "kendo ui", "voip", "css", "oop", "le", "testing", "mvc", "database", "database design", "angularjs", "php", "mysql", "extjs", "html"], "fulltext": "LE VIET HOAN \nAddress: Thu Duc house, Phuoc Binh, District 9, Ho Chi Minh city  \nPhone: 0973 49 43 40 \nSkype: hoan.le90 \nEmail: viet_hoan_as@yahoo.com \nDate of birth: April 04,1990 \nProfile \nSenior Frontend with +6years experience and +2years fullstack developer. Love to work \nwith cutting edge technology such as Angular 2+, typescript \u2026 in English environment \nwhere members communicate in English. \nExperience \nSenior Frontend, NashTech \u2014 2/2016\u2013Present \n- Join in all required phases from plaining, estimation, developing the \nimplementation, testing for web and App in banking, finance, wealth management, \ninsurance fields \n- Write reusable and testable code in AngularJs and Angular 2+  \n- Lead a small team of 3 members \n- Communicated directly with clients to determine web site content \n- Technologies: AngularJs, Angular 2+, Jquery, Html, Css, Unit test, highchart \nJunior/Senior Frontend, OPSWAT-USS; 9/2014\u20131/2016 \n- Developing responsive website which allows user can upload file and scan to \nprevent any malware \n- Customize highchart and build charts with Morrisjs \n- Write Japanese and Korean virtual keyboard by Extjs \n- Technologies: Html, JavaScript, Jquery, AngluarJs, Extjs. \nJunior Fullstack, Vidaltek;10/2013 \u2013 8/2014 \n- Developing website where customers can control and manage their items, pallets, \nshipments \n- Design database, query profiling and optimization \n- Build layout form psd file, implement functions  \n- Technologies: PHP \u2013 OOP \u2013 MVC, MySql, Html, Css, Jquery, JavaScript, \nboostrap, Kendo UI, SVN \nFresher/Junior, TMA solution; 3/2012 \u2013 10/2013 \n- Convert psd to html \n- Deploy VOIP system, network and modify database \n- Writing script for automate testing \n- Technologies: HTML, JavaScript, cucumber, ruby, SVN, Linux, Vxwork \nEducation \n2008 \u2013 2011: Student at University of Science Ho Chi Minh City  \n2017: TOEIC 900. 2018: IELTS 6.5 \nSkills \nAngularJS \nAngular 2+ \nJquery \nHTML5, CSS3 \nHTML, CSS/SASS \nBoostrap \nUnit test  \nGit \nNodeJs \nMySql \nPHP \nRegex, lodash \nUnix/ Linux \n - Have a high sense of responsibility \u2028 \n - Be willing to work overtime due to urgent tasks \u2028 \nPowered by TCPDF (www.tcpdf.org)", "educations": [{"id": 4576, "gpa": null, "major": null, "school": "University of Science Ho Chi Minh City", "diploma": "Bachelors", "end_time": "2017-01-01T00:00:00Z", "conf_score": 0.7517466292705735, "start_time": "2011-01-01T00:00:00Z", "picklist_major": "Other", "major_categories": "", "major_categories_detail": ""}], "experiences": [{"id": 15252, "detail": "Join in all required phases from plaining, estimation, developing the implementation, testing for web and App in banking, finance, wealth management, insurance fields\n- Write reusable and testable code in AngularJs and Angular 2+ - Lead a small team of 3 members\n- Communicated directly with clients to determine web site content\n- Technologies: AngularJs, Angular 2+, Jquery, Html, Css, Unit test, highchart", "company": "NashTech", "end_time": "2023-04-13T00:00:00Z", "industry": "High Technology", "position": "Senior Frontend", "conf_score": 0.9171087048027518, "start_time": "2016-02-01T00:00:00Z"}, {"id": 15254, "detail": "eveloping responsive website which allows user can upload file and scan to prevent any malware\n- Customize highchart and build charts with Morrisjs - Write Japanese and Korean virtual keyboard by Extjs - Technologies: Html, JavaScript, Jquery, AngluarJs, Extjs.", "company": "OPSWAT - USS", "end_time": "2016-01-31T00:00:00Z", "industry": "Other", "position": "Junior/Senior Frontend", "conf_score": 0.9171087048027518, "start_time": "2014-09-01T00:00:00Z"}, {"id": 15256, "detail": "- Developing website where customers can control and manage their items, pallets, shipments\n- Design database, query profiling and optimization\n- Build layout form psd file, implement functions\n- Technologies: PHP - OOP - MVC, MySql, Html, Css, Jquery, JavaScript, boostrap, Kendo UI, SVN", "company": "Vidaltek", "end_time": "2014-08-31T00:00:00Z", "industry": "Other", "position": "Junior Fullstack", "conf_score": 0.9007656797693221, "start_time": "2013-10-01T00:00:00Z"}, {"id": 15257, "detail": "- Convert psd to html\n- Deploy VOIP system, network and modify database\n- Writing script for automate testing\n- Technologies: HTML, JavaScript, cucumber, ruby, SVN, Linux, Vxwork", "company": "TMA solution", "end_time": "2013-10-31T00:00:00Z", "industry": "High Technology", "position": "Fresher/Junior", "conf_score": 0.9377739652680532, "start_time": "2012-03-01T00:00:00Z"}], "address": "Thu Duc house, Phuoc Binh, District 9, Ho Chi Minh city"}