{"skills": ["linux", "css3", "docker", "symfony", "automation", "automation testing", "javascript", "phpstorm", "apache", "selenium", "unit test", "git", "plesk", "html", "codeigniter", "recruitment", "nginx", "php", "css", "jira", "codeception", "testing", "reactjs", "laravel", "database", "behat", "redmine", "angularjs", "bootstrap", "mysql", "jquery"], "fulltext": "02/01/1983 Male\nTran Minh Quan\nSenior PHP Developer\n//OBJECTIVE\nCreate excellent product for the client\n//WORK EXPERIENCE\nEkino Viet Nam\nMarch 2015 - Present\nSenior PHP Developer\nResponsibility : Build website for French market\nScubism\nJan 2011 - Dec 2014\nPHP Developer\nResponsibility : Build website for Japanese market\nWebis\nJuly 2010 - Dec 2010\nPHP Developer\nResponsibility : Build website for Korean Client\n//PROJECTS\nChannel (2017 - 2018)\nCustomer\nFrench company\nDescription https://www.chanel.com\nTeam size\n2\nMy position\nSenior PHP Developer\nMy responsibilities\nDo project task from client (using jira)\nTechnologies used\n- Framework : Oro Ecommerce (based on Symfony)\n- Development Environment: Docker\n- Testing : selenium automation testing, behat test\n- Version Control : git\nSalam (2017 - 2018)\nCustomer\nFrench customer\nDescription https://salamadvisor.com\nTeam size\n1\nMy position\nSenior PHP Developer\nMy responsibilities\nDo project task from client (using jira)\nTechnologies used\n- Framework : Laravel\n- Development Environment: LAMP, Docker\n- Version Control : git\nCarmignac (2016 - 2017)\nCustomer\nFrench company\nDescription https://www.carmignac.com/en_US\nTeam size\n7\nMy position\nSenior PHP Developer\nMy responsibilities\nDo project task from client (using jira)\nTechnologies used\n- Framework : Symfony, Drupal, ReactJS\n- Development Environment: LAMP, Docker, Vagrant, Nginx\n- Testing : automation testing, behat test, unit test\n- Version Control : git\nAutomation testing (2013 - 2014)\nCustomer\nCompany own project\nDescription\nBuild automation testing for all web project\nTeam size\n4\nMy position\nPHP Developer\nMy responsibilities\nDo project task (using redmine)\nTechnologies used\n- Codeception : http://codeception.com/\n- Selenium Automation testing : http://www.seleniumhq.org/\n- Local development: Vagrant\n- Version Control : git\nSide Project (2017 - 2017)\nCustomer\nNo customer\nDescription\nSide project :\n- https://mytutorials.xyz/ (for writting blog/tutorials)\n- https://myworkpro.net/ (for writting CV and recruitment)\nTeam size\n1\nMy position\nSenior PHP Developer\nMy responsibilities\nDo own project\nTechnologies used\n- Webserver : plesk\n- Backend framework : Laravel, Codeigniter\n- Frontend : AngularJS\n//SKILLS\nFontEnd: HTML, CSS, CSS3, Javascript, Jquery,\nBootstrap, ReactJS, AngularJS\nBackend Framework: Laravel, Symfony,\nCodeigniter\nDevelopment Environment: Linux, Apache,\nNginx, Vagrant, Docker\nDatabase: mySQL, PosgreSQL, Eloquent,\nDoctrine\nOther: git, composer, testing, vim, phpstorm\n//EDUCATION\nFeb 2005 - Nov 2008\nAptech Da Nang\nDiploma: Higher Diploma in Software\nEngineering\nJan 2010 - Dec 2014\nHo Chi Minh University of Science\n//INTERESTS\n- Football\n- Badminton\n- Writing tutorials/blog", "educations": [{"id": 4590, "gpa": null, "major": "K\u1ef9 thu\u1eadt ph\u1ea7n m\u1ec1m", "school": "Aptech Da Nang", "diploma": "Other", "end_time": "2008-11-01T00:00:00Z", "conf_score": 0.9054589156856725, "start_time": "2005-02-01T00:00:00Z", "picklist_major": "IT - Hardware/Networking", "major_categories": "M\u00e1y t\u00ednh v\u00e0 c\u00f4ng ngh\u1ec7 th\u00f4ng tin", "major_categories_detail": "M\u00e1y t\u00ednh"}, {"id": 4592, "gpa": null, "major": null, "school": "Ho Chi Minh University of Science", "diploma": "Bachelors", "end_time": "2014-12-01T00:00:00Z", "conf_score": 0.7411424838253973, "start_time": "2010-01-01T00:00:00Z", "picklist_major": "Other", "major_categories": "", "major_categories_detail": ""}], "experiences": [{"id": 15324, "detail": "Responsibility : Build website for French market", "company": "Ekino Viet Nam", "end_time": "2023-04-13T00:00:00Z", "industry": "Other", "position": "Senior PHP Developer", "conf_score": 0.7897513794629749, "start_time": "2015-03-01T00:00:00Z"}, {"id": 15326, "detail": "Responsibility : Build website for Japanese market", "company": "Scubism", "end_time": "2014-12-31T00:00:00Z", "industry": "Other", "position": "PHP Developer", "conf_score": 0.8691690065894404, "start_time": "2011-01-01T00:00:00Z"}, {"id": 15328, "detail": "Responsibility : Build website for Korean Client", "company": "Webis", "end_time": "2010-12-31T00:00:00Z", "industry": "Other", "position": "PHP Developer", "conf_score": 0.7897513794629749, "start_time": "2010-07-01T00:00:00Z"}], "address": null}