{"skills": ["git", "analysis", "jira", "html", "full stack development", "css3", "wordpress", "jquery", "cakephp", "angular", "le", "magento", "stack", "html5", "responsive", "javascript", "oop", "excel", "webpack", "sc", "laravel", "bootstrap", "docker", "usage data", "php", "angularjs", "grunt", "vuejs", "data structure"], "fulltext": "Nguy\u1ec5n V\u0103n H\u1ea3i\nL\u1eadp tr\u00ecnh PHP Fullstack\nNg\u00e0y sinh:\n 28/11/1988\nGi\u1edbi t\u00ednh:\n Nam\n\u0110i\u1ec7n tho\u1ea1i:\n 0966345234\nEmail:  warlock.info@gmail.com\n\u0110\u1ecba ch\u1ec9:\n Thanh Ho\u00e1\nM\u1ee4C TI\u00caU NGH\u1ec0 NGHI\u1ec6P\n- C\u00f3 h\u01a1n 7 n\u0103m kinh nghi\u1ec7m l\u00e0m vi\u1ec7c v\u1edbi php. Am hi\u1ec3u thu\u1eadt to\u00e1n, c\u1ea5u tr\u00fac d\u1eef li\u1ec7u. S\u1eed d\u1ee5ng ph\u00e2n t\u00edch thi\u1ebft k\u1ebf\nh\u1ec7 th\u1ed1ng \u0111\u1ec3 ph\u00e2n t\u00edch b\u00e0i to\u00e1n. Bi\u1ebft v\u1ec1 ph\u00e2n t\u00edch thi\u1ebft k\u1ebfh\u01b0\u1edbng \u0111\u1ed1i t\u01b0\u1ee3ng.\n- Full stack developer (AngularJS/Vuejs/Nodejs/PHP, Javascript, jQuery, HTML)\n- Front-end: CSS3, Less, scss, grunt, webpack, HTML5, AngularJs, Vuejs, Nodejs, JavaScript, jQuery, Bootstrap, Responsive.\n- Back-end: Ki\u1ebfn th\u1ee9c t\u1ed1t v\u1ec1 OOP, Design Patterns\n- Frameworks: Angular js, Laravel, CI, Cake, Wordpress, Magento\n- Git & Jira & Docker.\n- Ti\u1ebfng anh \u0111\u1ecdc vi\u1ebft.\n- Th\u00edch b\u00f3ng \u0111\u00e1.\n- C\u00f3 ni\u1ec1m \u0111am m\u00ea, kh\u00e1m ph\u00e1, h\u1ecdc h\u1ecfi c\u00f4ng ngh\u1ec7 m\u1edbi. S\u1eb5n s\u00e0ng chuy\u1ec3n \u0111\u1ed5i c\u00f4ng ngh\u1ec7, ng\u00f4n ng\u1eef m\u1edbi.\n- C\u00f3 t\u00ednh c\u1ea7u ti\u1ebfn cao.\n- C\u00f3 tinh th\u1ea7n tr\u00e1ch nhi\u1ec7m trong c\u00f4ng vi\u1ec7c.\nH\u1eccC V\u1ea4N\n10/2010 - 05/2014\nC\u00f4ng ngh\u1ec7 th\u00f4ng tin H\u1eefu Ngh\u1ecb Vi\u1ec7t H\u00e0n\nChuy\u00ean ng\u00e0nh: L\u1eadp tr\u00ecnh\nT\u1ed1t nghi\u1ec7p lo\u1ea1i kh\u00e1, \u0111i\u1ec3m trung b\u00ecnh 8.0\nKINH NGHI\u1ec6M L\u00c0M VI\u1ec6C\n07/2015 - Hi\u1ec7n t\u1ea1i\nC\u00f4ng ty TwentyCI Vietnam\n- Key member Magento\n- Technical\n- Backend & Frontend\n- Build API\n- Working with Docker, Vuejs, Nodejs, Angular 1, 2 & 4\n- Build website with Wordpress\n06/2013 - 06/2015\nC\u00f4ng ty OnlineBiz Soft\n- Build website with Magento\n- Build website use cakephp\n- Build website with Laravel\n06/2011 - 05/2013\nC\u00f4ng ty Service One Global\n- Key member\n- Build website use CI\n- Build website with wordpress, Joomla\n- H\u1ecdc b\u1ed5ng 2 k\u1ef3\nGI\u1ea2I TH\u01af\u1edeNG\n2011\nTin h\u1ecdc v\u0103n ph\u00f2ng TOPCV\n- S\u1eed d\u1ee5ng th\u00e0nh th\u1ea1o c\u00e1c c\u00f4ng c\u1ee5 Word, Excel, Power Point\nTi\u1ebfng Anh\n- \u0110\u1ecdc vi\u1ebft\nC\u00c1C K\u1ef8 N\u0102NG\nS\u1ede TH\u00cdCH\n- Th\u00edch Code\n- \u0110\u00e1 b\u00f3ng - Tham gia ho\u1ea1t \u0111\u1ed9ng \u0111\u00e1 b\u00f3ng c\u1ee7a c\u00f4ng ty h\u00e0ng tu\u1ea7n\n\u00a9 topcv.vn", "educations": [{"id": 4610, "gpa": "8.0", "major": "L\u1eadp tr\u00ecnh", "school": "C\u00f4ng ngh\u1ec7 th\u00f4ng tin H\u1eefu Ngh\u1ecb Vi\u1ec7t H\u00e0n", "diploma": "Other", "end_time": "2014-05-01T00:00:00Z", "conf_score": 0.9047872701227911, "start_time": "2010-10-01T00:00:00Z", "picklist_major": "Other", "major_categories": "", "major_categories_detail": ""}], "experiences": [{"id": 15400, "detail": "- Technical - Backend & Frontend - Build API - Working with Docker, Vuejs, Nodejs, Angular 1, 2 & 4 - Build website with Wordpress", "company": "C\u00f4ng ty TwentyCI Vietnam", "end_time": "2023-04-13T00:00:00Z", "industry": "Other", "position": "Key member Magento", "conf_score": 0.9257372771525854, "start_time": "2015-07-01T00:00:00Z"}, {"id": 15402, "detail": "- Build website with Magento - Build website use cakephp\n- Build website with Laravel", "company": "C\u00f4ng ty OnlineBiz Soft", "end_time": "2015-06-30T00:00:00Z", "industry": "Other", "position": null, "conf_score": 0.8086621310791741, "start_time": "2013-06-01T00:00:00Z"}, {"id": 15404, "detail": "- Build website use CI - Build website with wordpress, Joomla", "company": "C\u00f4ng ty Service One Global", "end_time": "2013-05-31T00:00:00Z", "industry": "Other", "position": "Key member", "conf_score": 0.9308575567370121, "start_time": "2011-06-01T00:00:00Z"}], "address": "Thanh Ho\u00e1"}