{"skills": ["management tool", "sybase", "networking", "recruiting", "management", "salesforce", "java", "git", "ruby", "agile", "microservices", "css", "c++", "maven", "jira", "tomcat", "ant", "bpm", "j2ee", "resource management system", "html", "linux", "configuration management", "process development", "process management", "spring mvc", "mysql", "human resources", "kubernetes", "security", "jquery", "mssql", "marketing", "sql", "c#", "spring security", "oop", "payment", "javascript", "make decision", "apache", "database", "spring boot", "jsp", "mockito", "groovy", "wcf", "openshift", "message broker", "osgi", "cache", "mvc", "docker", "object oriented", "enterprise", "workflow", "jenkins", "hibernate", "php", "software development", "rail", "junit", "asset management", "hadoop", "multithreading", "spring", "maintenance", "postgresql", "orm", "configuration management tool", "aws", "restful", "business process management"], "fulltext": "Hoang Tran \n\u25cf 5 years of software development experience \n\u25cf Experience in Object Oriented Programming \n\u25cf Basic knowledge about Agile Development process such as SCRUM \n\u25cf Basic knowledge about other OOP languages such as C++, PHP, Ruby on Rails \n\u25cf Basic knowledge about networking \nTECHNOLOGY XP \n\u25cf Programming language: \n\u25cb Java \n\u25a0 J2EE, Web Service \n\u25a0 JSP, Servlet, GWT \n\u25a0 Junit \n\u25a0 Hadoop, Hive, Spark \n\u25a0 Multithreading \n\u25cb C/C++, PHP, Ruby on Rails \n\u25cf IDE tools: Eclipse, Intellij \n\u25cf Application/Web servers: Apache Tomcat \n\u25cf Database: MSSQL, Postgresql, MySQL, Sybase  \n\u25cf Platform: Windows, Linux \n\u25cf Configuration management tools: Subversion, Git  \n\u25cf Bug management tool: JIRA \n\u25cf Build tools: Ant, Maven \nWORK EXPERIENCE \nSenior Software Engineer - Vietnam \nAt Alipay (Alibaba) Vietnam company \n2015 \u2013 PRESENT \nSoftware Engineer Developer \u2013 Vietnam \nAt TMA Solutions company \n2013 - 2015 \nPROJECTS \nProject 1: Payment (2018 \u2013 Present) \n\u25cf Description: In this project, we design workflow and make configuration to integrate \nmultiple services to process customer payment transaction \n\u25cf Position: Senior Software Developer \n\u25cf Technologies: \n\u2212 Java, Groovy, Velocity \n\u2212 Distributed Cache, Message Broker  \n\u2212 jBPM, MicroServices \n\u2212 Dynamic Container ( OSGi) \nProject 2: eWorkflow (2017 \u2013 2018) \n\u25cf Description: this is about all POC projects connecting BPM (Business Process \nManagement) with ECM (Enterprise Content Management) to provide an enterprise \nsolution \n\u25cf Position: Senior Software Developer \n\u25cf Technologies: \n\u2212 Camunda, Activiti, SalesForce \n\u2212 Alfresco, CMIS \n\u2212 Spring Boot (Restful API) \n\u2212 Angular2 \n\u2212 AWS, Jenkins  \n\u2212 Docker, Shell Scripts  \n\u2212 Openshift, Kubernetes \nProject 3: DMP (2016 \u2013 2017) \n\u25cf Description: Create report where all information related to game traffic is calculated \nand summarized to help marketing team make decision easily. \n\u25cf Position: Senior Software Developer \n\u25cf Technologies: \n\u2212 MySQL \n\u2212 BigData, Hadoop, Hive, Spark.  \n\u2212 Java (OOP, Multihreading,...)  \n\u2212 Ant \n\u2212 Jquery, Javascript, HTML, CSS \nProject 4: Mornitoring System (Jun 2015 \u2013 2016) \n\u25cf Description: Involved in building up a website which helps monitor production of the \ncompany. \n\u25cf Position: Senior Software Developer \n\u25cf Technologies: \n\u2212 Postgres SQL \n\u2212 Spring MVC, Spring Core, Spring Security. \n\u2212 Hibernate ORM \n\u2212 Jquery, Javascript, HTML, CSS \nProject 5: GBST \u2013 Composer Back Office (Sep 2014 \u2013 Jun 2015) \n\u25cf Description: Developing Composer Back Office System. \n\u25cf Position: Software Developer \n\u25cf Technologies: \n\u2212 Power Builder \n\u2212 SQL Server \n\u2212 Sybase SQL \n\u2212 Management tool : Mashups \nProject 6: GBST \u2013 Front Office (Jun 2014 \u2013 Sep 2014) \n\u25cf Description: Developing Front Office System. \n\u25cf Position: Software Developer \n\u25cf Technologies: \n\u2212 Java Hibernate, Spring \n\u2212 GWT \n\u2212 PostgreSQL \nProject 7: MAINPAC EAM (Feb 2014 \u2013 Jun 2014) \n\u25cf Description: this is a best of breed, easy-to-use maintenance and asset management \nsystem that is both customizable and scalable to enable any organization to improve \ntheir Return on Assets (ROA), maximize Operational Effectiveness and optimize \nmaintenance and operations costs. \n\u25cf Position: Software Developer \n\u25cf Technologies: \n\u2212 C# \n\u2212 WSO2 \n\u2212 WCF Web Service \nProject 8: Human Resources Management System (Aug 2013 \u2013 Feb 2014) \n\u25cf Description: This is a web-based system which offers stand- alone personnel tracking, \napplicant tracking, recruiting, performance reviews, goal management, absence \nmanagement. \n\u25cf Position: Software Developer \n\u25cf Technologies: \n\u2212 Java \n\u2212 PostgreSQL. \n\u2212 JPA, Hibernate. \n\u2212 Spring (Spring Core, Spring Integration). \n\u2212 JUnit, Mockito. \nEDUCATION & TRAINING \n2009 \u2013 2013 \nBachelor Degree in Computer Science \nHo Chi Minh University of Technology \nLANGUAGES \nVietnamese (Native)  \nEnglish (Upper-intermediate) ", "educations": [{"id": 4620, "gpa": null, "major": "Khoa h\u1ecdc m\u00e1y t\u00ednh", "school": "Ho Chi Minh University of Technology", "diploma": "Bachelors", "end_time": "2013-01-01T00:00:00Z", "conf_score": 0.7851615749618549, "start_time": "2009-01-01T00:00:00Z", "picklist_major": "IT - Hardware/Networking", "major_categories": "M\u00e1y t\u00ednh v\u00e0 c\u00f4ng ngh\u1ec7 th\u00f4ng tin", "major_categories_detail": "M\u00e1y t\u00ednh"}], "experiences": [{"id": 15443, "detail": "", "company": "Alipay (Alibaba) Vietnam company", "end_time": "2023-04-13T00:00:00Z", "industry": "Other", "position": "Senior Software Engineer", "conf_score": 0.9116549045398735, "start_time": "2015-01-01T00:00:00Z"}, {"id": 15445, "detail": "", "company": "TMA Solutions company", "end_time": "2015-01-31T00:00:00Z", "industry": "High Technology", "position": "Software Engineer Developer", "conf_score": 0.9262131294573884, "start_time": "2013-01-01T00:00:00Z"}], "address": null}