{"skills": ["stack", "aws", "helm", "angular", "docker", "javascript", "implementation", "cloud", "cli", "kobiton", "c#", "cloud service", "aws iam", "management", "travis ci", "window 8", "io", "kubernetes", "entity framework", "elasticsearch", "git", "linq", "devops", "cloudwatch", "design thinking", "docker compose", "configuration management tool", "azure devops", "ansible", "phone call", "ssh", "asp", "ecs", "management tool", "nginx", "sql", "signalr", "ssl", "oop", "css", "nunit", "configuration management", "software development", "mvc", "sftp", "elastic stack", "process development", "window phone", "jenkins", "python", "rundeck", "teamwork", "creative thinking", "kibana", "azure", "api gateway", "package manager", "aws ec", "circle ci", "mobile cloud", "html", "logstash"], "fulltext": "EMPLOYMENT HISTORY\nDevOps Engineer\nKobiton\nMay 2017 - Now\nBuild, maintain and scale Kobiton system\n.NET Software Developer\nKMS Technology\nMar 2017 - Apr 2017\nAttend KMS Next Program, gain TOP 1 of \nthe .NET team\n.NET Software Developer\n  University of IT\nJun 2016 - Feb 2017\nComplete graduation project: Merchandise \ntransportation system Shipping Easy\n  .NET Software Developer Intern\nGlobal CyberSoft\nMar 2016 - Jun 2016\nResearch techniques for Web-Based \nApplication: ASP.NET MVC, Entity \nFramework, NUnit, Log4Net, etc\nWindows/Windows Phone Developer\nFreelancer\nJan 2014 - Mar 2016\nDevelop applications on Windows Phone \n8/8.1 and Windows 8.1/10\nBao Tran\nSenior DevOps Engineer\nOBJECTIVE\nSeeking a position as a Senior \nDevOps Engineer so that I can make \nuse of my acquired knowledge and \nreal experience in the application \ndevelopment process.\nPROJECTS\nCONTACT\nKOBITON | DevOps\nKOBITON\nDescription: \nKobiton is a mobile cloud service which offers mobile \nsimulation service on web and mobile lab management for \nenterprises.\nKey skills:\nAWS | CI/CD | Ansible | Docker | Kubernetes | Helm | \nDocker Compose | Mkdocs | Elastic Stack | Bash Script |  \nPython | DevOps Integration | Nginx\nExperience: - Work with AWS (IAM, EC2, S3, RDS, Route 53, ECS, EKS,\n  SQS, Elastic Transcoder, Direct Connect, CloudWatch)\n- Implement CI/CD system using Jenkins, Travis CI, Rundeck\n- Work with Ansible as a configuration management tool\n- Work with Docker and Kubernetes to deploy, scale,\n  and manage containerized application\n- Work with Helm as a package manager to manage\n  Kubernetes application\n- Design, build and maintain Kobiton On-Premise Solution\n  based on Docker Compose\n- Build On-Premise Installation Guideline using Mkdocs\n- Work with Elastic Stack (Elasticsearch, Kibana, Logstash) to\n  centralize logs in the operation process\n- Build tools using Python, Bash Script for different purposes\n- Lead a small team (3 members) to integrate Kobiton with\n  the other CI systems (Jenkins, Travis CI, Circle CI, \u2026) \n- Setup and configure Nginx to manage web servers,\n  serve static websites and apply SSL certificate\nDuration: \n24 months\n168/35 Nguyen Cu Trinh Street, \nNguyen Cu Trinh Ward, District 1, \nHo Chi Minh City\nAddress\n+84 972 998 128\nPhone number\nbaotn166@gmail.com\nEmail\ntnbao166\nSkype\nhttps://goo.gl/ePiBJh\nUpwork\nEDUCATION\nUniversity of Information \nTechnology\n\u2014\u2014\u2014\nVietnam National University\nHCMC\nSample Azure DevOps Pipeline | DevOps\nFREELANCER\nDescription: \nBuild a sample pipeline that will build and deploy a .NET \nCore Console Application to Amazon Container Service \n(ECS)\nKey skills:\nC# | .NET Core Console Application | Azure DevOps | \nAWS ECS | AWS ECR | Bash Script\nExperience: - Define AWS architecture and resources\n- Create a sample \"Hello World\" .NET Core Application\n- Write scripts to deploy an application to ECS using awscli\n- Build a pipeline to build and deploy the application\n- Document the project implementation\nDuration: \n1 week\nSKILLS\nC#/LINQ OOP\nAWS CI/CD\n.NET CORE\nGIT\nFile Monitoring Tool | DevOps\nFREELANCER\nDescription: \nThis is an application that will check whether SFTP files \nwere delivered on time. If not, an email will be sent and a \nphone call will be made via Twilio.\nKey skills:\nC# | .NET Core Web API | .NET Core Console \nApplication | AWS SQS | AWS API Gateway | SSH.NET | \nTwilio\nExperience: - Use Twilio as a call gateway to make phone call\n- Create an endpoint to generate a voice message\n- Create a webhook and deploy to AWS API Gateway to get\n  call statuses\n- Use AWS SQS to handle call statuses between the\n  webhook and the file monitoring tool\nDuration: \n36 hours\nCaaS DBMS\nSOFT SKILLS\nFast research\nTeamwork\nEnglish\nCommunication\nCreative thinking\nDesign\nJenkins Pipeline for app deployment | DevOps\nFREELANCER\nDescription: \nBuild Jenkins Pipeline (using shared library) to build, test, \ndeploy Angular 5 and Node Express API to AWS Elastic \nContainer Service\nKey skills:\nJenkins | S3 | CloudFront | AWS EC2 | AWS ECS | AWS \nECR | Node.js | Express API | AWS CLI | Bash Script\nExperience: - Merge 2 separated repositories (api and frontend) into 1\n  repository called apps (monorepo)\n- Write script to build and deploy frontend to S3 and\n  configure S3 to serve static website (CloudFront)\n- Write script to build and deploy api to ECS\n- Integrate Jenkins with ECR to push application images\n- Build Jenkins Pipeline to build and deploy the application\n  to ECS\nDuration: \n1 week\nLeadership\nHOBBIES\nShipping Easy | Backend\nTHESIS\nDescription: \nThis is a graduation project, full name: Merchandise \ntransportation system Shipping Easy. This project looks like \nGrab Delivery.\nKey skills:\nC# | ASP.NET 5 | Entity Framework 5 | LINQ | SQL Server \n| SignalR | One Signal | HTML | CSS | JavaScript\nExperience: - Build a website for store to input order\n- Build an API for iOS app (shipper and receiver) to ship/\n  receive products\n- Build a real-time server using SignalR for shipper location \n  tracking\nDuration: \n8 months", "educations": [{"id": 4615, "gpa": null, "major": null, "school": "N\nUniversity of Information \nTechnology\n\u2014\u2014\u2014\nVietnam National Univers", "diploma": "Bachelors", "end_time": null, "conf_score": 0.7719791825437639, "start_time": null, "picklist_major": "Other", "major_categories": "", "major_categories_detail": ""}, {"id": 4614, "gpa": null, "major": ".NET Software Developer", "school": "University of IT", "diploma": "Bachelors", "end_time": "2017-02-01T00:00:00Z", "conf_score": 0.9142206543796373, "start_time": "2016-06-01T00:00:00Z", "picklist_major": "Other", "major_categories": "", "major_categories_detail": ""}], "experiences": [{"id": 15414, "detail": "Build, maintain and scale Kobiton system", "company": "Kobiton", "end_time": "2023-04-13T00:00:00Z", "industry": "Other", "position": "DevOps Engineer", "conf_score": 0.9142206543796373, "start_time": "2017-05-01T00:00:00Z"}, {"id": 15415, "detail": "Attend KMS Next Program, gain TOP 1 of the .NET team", "company": "KMS Technology", "end_time": "2017-04-30T00:00:00Z", "industry": "High Technology", "position": ".NET Software Developer", "conf_score": 0.8275107295019075, "start_time": "2017-03-01T00:00:00Z"}, {"id": 15416, "detail": "Research techniques for Web-Based Application: ASP.NET MVC, Entity Framework, NUnit, Log4Net, etc", "company": "Global CyberSoft", "end_time": "2016-06-30T00:00:00Z", "industry": "High Technology", "position": ".NET Software Developer Intern", "conf_score": 0.8275107295019075, "start_time": "2016-03-01T00:00:00Z"}, {"id": 15417, "detail": "Develop applications on Windows Phone 8/8.1 and Windows 8.1/10", "company": "Global CyberSoft", "end_time": "2016-03-31T00:00:00Z", "industry": "High Technology", "position": "Windows/Windows Phone Developer\nFreelancer", "conf_score": 0.6981244904084882, "start_time": "2014-01-01T00:00:00Z"}], "address": "168/35 Nguyen Cu Trinh Street, Nguyen Cu Trinh Ward, District 1, Ho Chi Minh City"}