{"skills": ["memcached", "ethereum", "neo4j", "github", "window server 2003", "structure", "reactjs", "cryptocurrency", "redis", "azure", "mysql", "human resources", "kubernetes", "security", "bower", "jquery", "javascript framework", "mssql", "microsoft", "swagger", "c#", "elasticsearch", "magento", "microsoft azure", "window server", "stack", "javascript", "website development", "blockchain", "positive attitude", "rabbitmq", "asp", "laravel", "docker", "cloud", "jwt", "rethinkdb", "php", "software development", "mariadb", "problem solving skill", "high availability", "centos", "google cloud", "hyperledger", "aws", "communication skill", "problem solving"], "fulltext": "Solutions Architect \u2013 Technology Leader \nPersonal details \nFullname \nNguy\u1ec5n T\u1ea1 Quang \u0110\u1ee9c \nDate of Birth \n14/01/1989 \nGender \nMale \nMarital Status \nMarried \nCurrent address \n190A group 26, Thanh Luong quarter, Hai Ba Trung district, Hanoi \nTelephone \n090 211 0788 \nEmail \nducntq@gmail.com \nGithub \nGithub.com/ducntq  \nEducation & Research \nYear \nInstitutions \nCourses \n2006-2009 \nFPT Aptech \nInternational Programmer \n2015 \nAmazon Web Services \nAWS Certified Developer \nWork experiences \nFrom \n01/2018 \nTo \nNow \nCompany \nNami Corporation \nProjects \nNami Trade, Nami Binary Options, Nami Today, Nami Assistant, Nami \nLabs, Nami Exchange \nJob Title \nTechnical Leader, Head of Tech \nJob Description \nIn charge of overseeing progress and technical problems of projects. \nManage human resources and take charge of all technical problems, \nincluding technology stacks, infrastructure (Google Cloud, Microsoft \nAzure) \nFrom \n10/2017 \nTo \n01/2018 \nCompany \niApps Singapore \nProjects \nActiveSG, Slide, Confidential project \nJob Title \nSenior PHP Developer, Software Architect \nJob Description \nDevelop line of credit solution for from manufacturer, distributor to \nretailer for FMCG industry in Singapore, Vietnam and Indonesia. \nDevelop cryptocurrency exchange platform for Singapore. Utilize \ncryptocurrency to remittance. \nFrom \n12/2014 \nTo \n10/2017 \nCompany \nCodeForce Vina \nProjects \nReSales Online, PropQ, PropExtra \nJob Title \nSenior PHP Developer, Software Architect \nJob Description \nMaintain ReSales-Online.com. \nDevelop new platform PropQ for real estates for Europe market and \nVietnam market, based on Laravel 5, NodeJS, Amazon Web Services. \nWork with Spanish team to arrange tasks and progresses. \nFrom \n08/2014 \nCompany \nTiki \nProjects \nTiki.vn \nTo \n12/2017 \nJob Title \nSenior PHP Developer, Technical advisor \nJob Description \nDevelop new platform for Tiki to replace the old platform (based on old \nMagento). The new platform will have high availability, highly scalable, \nmodular and well documented. \nFrom \n05/2014 \nTo \n10/2014 \nCompany \nDai Viet Software (Dai Viet Group) \nProjects \nInternal web app, new social project \nJob Title \nSenior Web Developer, Technical Advisor, Team Leader \nJob Description \nPlan the structure of web application, advise team members with \ntechnical issues. Research and apply new technologies/solutions to \nsolve problems. Supervise code quality. \nFrom \n05/2013 \nTo \n05/2014 \nCompany \nAPL Solutions \nProjects \nZo2 Framework, NodeDesk \nJob Title \nSenior Developer \nJob Description \nDevelop a template framework for Joomla, named Zo2 Framework. \nDevelop open source projects for internal and external use. \nFrom \n12/2009 \nTo \n05/2013 \nCompany \nVC Corp \u2013 Vietnam Communation Corporation \nProjects \nKenh14.vn, NewCMS, Afamily.vn, GenK.vn\u2026 \nJob Title \nJunior Developer \nJob Description \nSupervise and develop kenh14.vn and other websites. Develop \nwebsites that can handle big load. \nFrontend developing, develop website application (One Page App) with \njavascript frameworks. Research new technology and apply to current \nprojects. \nSkills \nOther Skills \nLanguage \nEnglish (Business Fluent) \nSoft skill \nWork in group, positive attitude, communication skills, problem-solving \nskills, flexibility & adaptability, work under pressure \nNotable projects \n1. \nFrom \n01/2018 \nTo \nNow \nProject Name \nNami Trade, Nami Exchange, Nami Today, Nami Assistant, Nami \nLabs \nProject size \nMembers \n12 \nPosition \nTech Lead, Head of Tech \nProgramming \nlanguages \nNodeJS, PHP \nTechnologies \nEthereum Smartcontract, Hyperledger, Kubernetes, Docker, MySQL, \nRedis, memcached \n2. \nFrom \n10/2017 \nTo \n01/2018 \nProject Name \nSlide, Active SG, iApps Confidential Project \nProject size \nMembers \n12 \nPosition \nSenior Developer, Software Architect \nProgramming \nlanguages \nPHP 7, NodeJS \nTechnologies \nDocker, Amazon Web Services, PHP 7 FPM, MySQL (MariaDB), \nMemcached, RabbitMQ, ExpressJS, Bower, Swagger, Blockchain, HSM \n(Hardware Security Module), Mircro-services, JWT, ElasticSearch, \nRethinkDB \n3. \nFrom \n05/2014 \nProject Name \nResales-Online, PropQ, PropExtra \nProject size \nMembers \n10 \nPosition \nSenior Developer, Software Architect \nTo \n10/2017 \nProgramming \nlanguages \nPHP 5.5, PHP 7, NodeJS \nTechnologies \nDocker, Amazon Web Services, PHP 5.6 & PHP 7 FPM, MySQL \n(MariaDB), Memcached, Laravel 5, ReactJS, RabbitMQ \n4. \nFrom \n8/2014 \nTo \n12/2014 \nProject Name \nTiki.vn new platform \nProject size \nMembers \n15 \nPosition \nSenior Developer \nProgramming \nlanguages \nPHP \nTechnologies \nPhalconPHP, MySQL (MariaDB), Memcached, Redis, RabbitMQ, Neo4J, \nNodeJS \n5. \nFrom \n05/2014 \nTo \n10/2014 \nProject Name \nNew Music Social Network (Work in Progress) \nProject size \nMembers \n10 \nPosition \nTechnical advisor, Team leader \nProgramming \nlanguages \nPHP 5.5 \nTechnologies \nCentOS 6, PHP 5.5 FPM, MySQL (MariaDB), Memcached, jQuery, Yii 2 \nFramework, RabbitMQ, Neo4J, NodeJS \n6. \nFrom \n05/2013 \nTo \n02/2014 \nProject Name \nZo2 Framework \nProject size \nMembers  \nPosition \nLead developer \nProgramming \nlanguages \nPHP 5.2 to 5.5 \nTechnologies \nJoomla, PHP, MySQL \n7. \nFrom \n06/2010 \nTo \n07/2012 \nProject Name \nKenh14.vn \nProject size \n Members \n2 \nPosition \nProgrammer \nProgramming \nlanguages \nASP.NET C# \nTechnologies \nWindows Server 2003, MSSQL Server 2005, .Net Framework 2.0, \nMemcached \nExpected job & work location \nExpected profession \nPHP/NodeJS Developer, Cloud Solutions Architect \nGoal \nSoftware Architect \nReferences \nFull name: Lewis Woodley \nJob title: Director at CodeForce Vina \nContact: Available upon request \nFull name: Sam Koh \nJob title: CTO at iApps Singapore \nContact: Available upon request ", "educations": [{"id": 4621, "gpa": null, "major": "C\u00f4ng ngh\u1ec7 d\u1ea7u kh\u00ed v\u00e0 khai th\u00e1c d\u1ea7u", "school": "FPT Aptech", "diploma": "Other", "end_time": "2009-01-01T00:00:00Z", "conf_score": 0.8182390264226094, "start_time": "2006-01-01T00:00:00Z", "picklist_major": "Technical", "major_categories": "C\u00f4ng ngh\u1ec7 k\u1ef9 thu\u1eadt", "major_categories_detail": "C\u00f4ng ngh\u1ec7 d\u1ea7u kh\u00ed v\u00e0 khai th\u00e1c"}], "experiences": [{"id": 15442, "detail": "Job Description In charge of overseeing progress and technical problems of projects.\nManage human resources and take charge of all technical problems, including technology stacks, infrastructure (Google Cloud, Microsoft Azure)", "company": "Nami Corporation", "end_time": "2023-04-13T00:00:00Z", "industry": "Other", "position": "Technical Leader, Head of Tech", "conf_score": 0.9467744242056596, "start_time": "2018-01-01T00:00:00Z"}, {"id": 15444, "detail": "Job Description Develop line of credit solution for from manufacturer, distributor to retailer for FMCG industry in Singapore, Vietnam and Indonesia. Develop cryptocurrency exchange platform for Singapore. Utilize cryptocurrency to remittance.", "company": "iApps Singapore", "end_time": "2018-01-31T00:00:00Z", "industry": "Other", "position": "Senior PHP Developer, Software Architect", "conf_score": 0.9169645786863446, "start_time": "2017-10-01T00:00:00Z"}, {"id": 15446, "detail": "Job Description Maintain ReSales-Online.com. Develop new platform PropQ for real estates for Europe market and\nVietnam market, based on Laravel 5, NodeJS, Amazon Web Services. Work with Spanish team to arrange tasks and progresses.\nFrom 08", "company": "CodeForce Vina", "end_time": "2017-10-31T00:00:00Z", "industry": "High Technology", "position": "Senior PHP Developer, Software Architect", "conf_score": 0.8102286400108711, "start_time": "2014-12-01T00:00:00Z"}, {"id": 15447, "detail": "", "company": "Tiki", "end_time": "2014-12-31T00:00:00Z", "industry": "High Technology", "position": null, "conf_score": 0.7255079258306127, "start_time": "2014-08-01T00:00:00Z"}], "address": "190a group 26, Thanh Luong quarter, Hai Ba Trung district, Hanoi"}