{"skills": ["kobiton", "koa", "uikit", "ruby", "testing", "cloud system", "objective c", "html", "reactjs", "rss", "linux", "mysql", "redux", "io", "sqlite", "iphone sdk", "javascript", "material ui", "swift", "mobile testing", "mobile cloud", "cloud", "php", "android", "gulp", "rail", "centos", "postgresql", "sequelize", "restful"], "fulltext": "RESUME \nFull name: V\u0168 M\u1ea0NH H\u00d9NG (male).                         Birthday: 18/03/1982 \nMobile: 0907.582.526                                                    Email: vuhung246@gmail.com  \nEDUCATION/QUALIFICATIONS \nBachelor of Information Technology (2000-2005). \nAWARDS/ACHIEVEMENTS \nv \nOne of  the top four students during studying at the University of Van Lang \n(2000 - 2005). \nv \nTop the list of successful candidates in University entry examination of Van \nLang university in year 2000.  \nv \nVery good student award of the University of Van Lang for the year 2001. \nTIMELINE \n- \n2005: Graduate Van Lang university. \n- \n2005 - 2006: Worked at K&G(http://www.kng.vn) company as developer in Ho Chi \nMinh city. \n- \n2006 - 2011: Went to Japan and worked at VTM(http://vtm.co.jp) company as \nmobile(Brew, iPhone, Android) developer in Kawasaki. \n- \n2011 - 2017: Comeback Viet Nam and started up with Kawasoft company. \n- \n2017 - 2018: Work at KMS Technology as senior software engineer. \nTECHNICAL SKILLS \nLevel (1..5). 1: Begin \u2013 5: Expert \nTechnology \nTime (years) \nLevel \n(1..5) \niOS, UIKit, CoreData, CoreLocation, CoreMedia... \n10 \n4.5 \nObjective C \n8 \n4.5 \nSwift  3  4 \nAndroid  2  3 \nFrontend: ReactJS, ReactNative, Electron, Redux, \nMaterial-UI, Webpack, Gulp... \n2  3.5 \nBackend: Node.js, Koa, Express, Sequelize, Bluebird, \nWebSocket... \n2  3 \nLinux (RedHat, CentOS) \n3 \nWORK EXPERIENCE \nKobiton   ( https://kobiton.com ) \n- Type: Mobile Cloud System. \n- Description: Kobiton is a mobile testing platform that accelerates delivery and \ntesting of mobile apps by offering manual and automated testing on real devices, \nin the cloud or on-premise. \n- Technology: Javascript, Koa, Sequelize, PostgreSQL, iOS, Android, WebDriver, \nAppium, Socket, DevTunnel...  \n- Time: 7/2017 \u2013 05/2018 \n- Number of member: 20 \nOneMusic   ( http://bit.ly/2wq2NLA ) \n- Type: iOS Application. \n- Description: OneMusic is a music player and equalizer for iOS. \n- Technology: iOS, Obj-C, SQLite, CoreData, StoreKit, CoreMedia, etc. \n- Time: 8 months (10/2016 \u2013 05/2017) \n- Number of member: 4 \nAirTrunk   ( https://itunes.apple.com/jp/app/id1139644380 ) \n- Type: iPhone Application. \n- Description: Managed mobile application to manage warehouse in Japan market. \n- Technology: iOS & Android, Swift, UIKit, RestFul API, PHP, MySQL, etc. \n- Time: 5 months (03/2016 \u2013 8/2016) \n- Number of member: 4 \nSiteViewer   ( http://www.renacentia.com/ja/product/siteviewer.html ) \n- Type: iPhone Application. \n- Description: SiteViewer is a special RSS reader/browser which optimizes \nwebpage for maximum readability on the iPhone/iPod Touch. \n- Technology: iOS, SQLite, CoreData, PHP, MySQL, etc. \n- Time: 8 months (02/2010 \u2013 10/2010) \n- Number of member: 3 \niCollector  \n- \nType: iPhone Application \n- \nDescription: iCollector is an application for the iPhone that utilizes the GPS \nsystem and allows you to locate and collect items that can be used in other \ngames at Aeria Games, or can be sold/bought for iCP. \n- \nTechnology: iPhone SDK, PHP and mySQL. \n- \nTime: 7 months (1/2009 \u2013 7/2009) \n- \nNumber of member: 3 \nMobile GPS Symtem \n- \nType: Mobile Web Application \n- \nDescription: Is an application allow you to track, monitoring and surveillance the \ncurrent position of the mobile phone. \n- \nTechnology: Ruby (Rails framework), mySQL \n- \nTime: 6 months  (6/2007 \u2013 12/2007) \n- \nNumber of member: 5 \nWalk&Run  \n- \nType: Brew Application \n- \nDescription: Is an application for KDDI\u2019s mobile phones that utilizes the GPS \nsystem to monitoring your jogging. \n- \nTechnology: Brew SDK \n- \nTime: 5 months  (12/2008 \u2013 04/2008) \n- \nNumber of member: 4 \nREFERENCE \n- Google Play: https://play.google.com/store/apps/developer?id=VuManhHung \nPowered by TCPDF (www.tcpdf.org)", "educations": [{"id": 4629, "gpa": null, "major": null, "school": "Van Lang university", "diploma": "Bachelors", "end_time": "2005-01-01T00:00:00Z", "conf_score": 0.7275132206498556, "start_time": null, "picklist_major": "Other", "major_categories": "", "major_categories_detail": ""}], "experiences": [{"id": 15466, "detail": "", "company": "KMS Technology", "end_time": "2018-01-31T00:00:00Z", "industry": "High Technology", "position": "senior software engineer", "conf_score": 0.7897513794629749, "start_time": "2017-01-01T00:00:00Z"}, {"id": 15468, "detail": "", "company": "Nam", "end_time": "2017-01-31T00:00:00Z", "industry": "Other", "position": "Comeback", "conf_score": 0.8225550773200425, "start_time": "2011-01-01T00:00:00Z"}, {"id": 15470, "detail": "AirTrunk ( https://itunes.apple.com/jp/app/id1139644380 ) - Type: iPhone Application. - Description: Managed mobile application to manage warehouse in Japan market.\n- Technology: iOS & Android, Swift, UIKit, RestFul API, PHP, MySQL, etc.\n- Time: 5 month", "company": "AirTrunk", "end_time": "2016-08-31T00:00:00Z", "industry": "Other", "position": null, "conf_score": 0.7691063532983916, "start_time": "2016-03-01T00:00:00Z"}, {"id": 15471, "detail": ": Went to Japan and worked at", "company": "VTM(http://vtm.co.jp) company", "end_time": "2011-01-31T00:00:00Z", "industry": "Other", "position": "mobile", "conf_score": 0.8363126073448006, "start_time": "2006-01-01T00:00:00Z"}, {"id": 15472, "detail": "", "company": "K&G", "end_time": "2006-01-31T00:00:00Z", "industry": "Other", "position": "developer", "conf_score": 0.8983591205089074, "start_time": "2005-01-01T00:00:00Z"}], "address": null}