{"skills": ["linux", "vmware vsphere", "docker", "apache spark", "apache", "eauthentication", "unit test", "scikit learn", "git", "devops", "access point", "visualization", "switch", "ethernet", "google cloud", "django", "nifi", "testing", "clustering", "jenkins", "class", "lms", "management information system", "correlation", "analyzing data", "fluentd", "data analytics", "wing", "marketing", "automation testing", "javascript", "cloud", "google cloud platform", "automation test", "svn", "rabbitmq", "restful", "le", "hadoop", "testng", "bigquery", "data management", "information management", "mocha", "robot", "xpath", "analytics", "apache hadoop", "management", "flask", "jupyter", "bluetooth", "elasticsearch", "scipy", "protractor", "robot framework", "chai", "database", "pytest", "matplotlib", "window server", "html", "tcl", "automation", "selenium", "machine learning", "blockchain", "postgresql", "structure", "data visualization", "file system", "numpy", "process development", "python", "networking", "weka", "kibana", "swagger", "mysql"], "fulltext": "Khiem TA \nEmail: khiem2991@gmail.com \nPhone: +84 94455 4578. \nSkype ID: khiem291. \nYear of birth: 1991. \nAddress: Tan Phu District, Ho Chi Minh City, Vietnam. \nNationality: Vietnamese. \nPROFILE SUMMARY: \nHas 4+ years experience with Python programming and data analytics. \nCore Responsibilities: collecting, storing, processing, and analyzing data generated from \ndatabase. Research, design, implement and validate machine learning models. API design \nand expose API backend. \nInterests research: Big data, Blockchain, Large scale system. \nPROFESSIONAL SKILLS \nStorage and data analytic: Hadoop, Apache Spark. \nMessage management: AMQP (RabbitMQ), MQTT (Google pub/sub). \nData visualization: Kibana, Matplotlib. \nProgramming languages: proficient with Python, Javascript on Node Js. \nDatabase: MySQL, PostgreSQL, ElasticSearch, BigQuery. \nPlatforms: Linux, Window server, Google cloud platform. \nDevOps tools: Docker, Jenkins, VMWare Vsphere. \nSource code version control: Git, SVN. \nAutomation test libraries: Robot-framework, Pytest, Selenium, Sikuli. \nNetworking: MCSA, CCNA. \nWeb technologies: HTML; ExpressJs/ Flask/ Django/ Connexion framework; Swagger \ndocument (OAS). \nTools and related technologies: Nifi, Fluentd, Jupyter, KNIME, Weka, SciPy (Numpy, \nPandas, ...), Scikit-learn ... \n1 \nEXPERIENCE \nJune 2018 - now \nFPT Software, High tech park Ho Chi Minh. \nSenior software engineer \n- Develop web backend expose API with Flask/Django framework, driven \nby Swagger. \n- Create source code structure, API design. \n- Develop unit test and integrate with CI/CD (Jenkins). \n- Data preprocessing. \n- Optimize import data file with large size to database. \nData management, a project for the purpose of managing data import \ninto the database system (PostgreSQL) and the authentication of the \ndata access. \nOct 2017 - June 2018 \n(8 months) \nCCSS startup, Tan Binh district. \nData scientist \n- Collecting data from sensors in BTS (Base transceiver station) by Nifi \nand push to Hadoop file system. \n- Solve data analytic problems in telecommunication with Spark: \nElectricity, Air conditioner statistics description, clustering station based \nalarm, correlation between temperature and air conditioner. \n- Visualization data analytic results with Kibana, Google spreadsheet, \nMatplotlib. \n- Expose RESTful API analytic service with javascript on NodeJs. \nINAProject, a system analytic Big data for telecommunication \ninfrastructure. \nMay 2015 - Aug 2017 \n(2 years 4 months) \nTerralogic Company, Quang Trung Software Park. \nSenior Automation test Engineer \n- Process development & improvement automation scripts. \n- Propose web automation testing strategies. \n- Estimate and monitor schedule/progress. \n2 \n- Develop automation testing use Python, Selenium, XPath.Sikuli, \nTestNG, Protractor, Selenium, WebdriverIO, Mocha, Chai, Allure. \nWiNG managed family of Access Points, controllers provide a \ncentralized distribution of high performance, resilient wireless and data \nservices to remote locations with the scalability. \nMPact, a platform for Mobile Marketing, shopping is centered on \ncustomer needs. Base on Bluetooth 4.0 Low Energy technologies. \nSep 2013 - Apr 2015 \n(1 years 8 months) \nArrive Technologies, ETown Cong hoa. \nVerification engineer. \n- Preview software/hardware specification & design documents. \n- Manual/auto test by using scripts tcl, python. \n- Define verification plan, coverage plan based on Chip functionality, \nstandard and application. \n- Verify Chip at system level following standards as ITU, MEF, IEEE. \nCalypso, a switch solution which supports new telecom technologies: \nCarrier Ethernet Y1731, OAM MPLS-TP CCM, LB, LT, DM, LM.  \nEDUCATION \n2006 - 2009 \nLe Khiet gift high school. \n2009 - 2013 \nUniversity of Sciences Ho Chi Minh, VN National University. \nBSc, Faculty of Electronic and Telecommunication. \nHonor class. Rank: Distinction \n2016 - 2018 \nBach Khoa University, Ho Chi Minh, VN National University. \nMaster's course, \nManagement Information Systems. \n3 \nACHIEVEMENT AND AWARDS \n2015 \n2014 \n2011 \n2009 \nTerralogic, SNAP award for excellence contribution & innovation. \nEnglish (intermediate): TOEIC 650. \nWon the second prize contest win technology in Ispace. \nLight Dreams Scholarship of Tuoi tre newspaper. \nREFERENCES \nEmployer \nQuan Phi, \nProject manager. \nTerralogic company, Quang Trung software park. \nProfessor Linh Truong,  \nDirector of INALab, CCSS company \nFaculty of Informatics, TU Wien, Austria. \n4 \nPowered by TCPDF (www.tcpdf.org)", "educations": [{"id": 4637, "gpa": null, "major": "H\u1ec7 th\u1ed1ng th\u00f4ng tin qu\u1ea3n l\u00fd", "school": "Bach Khoa University", "diploma": "Masters", "end_time": "2018-01-01T00:00:00Z", "conf_score": 0.8037355716910508, "start_time": "2016-01-01T00:00:00Z", "picklist_major": "Administrative/Clerical", "major_categories": "Kinh doanh v\u00e0 qu\u1ea3n l\u00fd", "major_categories_detail": "Qu\u1ea3n tr\u1ecb \u2013 Qu\u1ea3n l\u00fd"}, {"id": 4634, "gpa": null, "major": null, "school": "Le Khiet gift high school", "diploma": "Other", "end_time": "2009-01-01T00:00:00Z", "conf_score": 0.703054895247018, "start_time": "2006-01-01T00:00:00Z", "picklist_major": "Other", "major_categories": "", "major_categories_detail": ""}, {"id": 4636, "gpa": null, "major": "Kinh t\u1ebf c\u00f4ng nghi\u1ec7p", "school": "University of Sciences Ho Chi Minh, VN National University", "diploma": "Bachelors", "end_time": "2013-01-01T00:00:00Z", "conf_score": 0.8217317150898273, "start_time": "2009-01-01T00:00:00Z", "picklist_major": "Technical", "major_categories": "C\u00f4ng ngh\u1ec7 k\u1ef9 thu\u1eadt", "major_categories_detail": "Qu\u1ea3n l\u00fd c\u00f4ng nghi\u1ec7p"}], "experiences": [{"id": 15493, "detail": "- Develop web backend expose API with Flask/Django framework, driven by Swagger. - Create source code structure, API design.\n- Develop unit test and integrate with CI/CD (Jenkins). - Data preprocessing.\n- Optimize import data file with large size to database.\nData management, a project for the purpose of managing data import into the database system (PostgreSQL) and the authentication of the data access.", "company": "FPT Software, High tech", "end_time": "2023-04-13T00:00:00Z", "industry": "High Technology", "position": "Senior software engineer", "conf_score": 0.9538370608867096, "start_time": "2018-06-01T00:00:00Z"}, {"id": 15495, "detail": "- Collecting data from sensors in BTS (Base transceiver station) by Nifi and push to Hadoop file system.\n- Solve data analytic problems in telecommunication with Spark: Electricity, Air conditioner statistics description, clustering station based alarm, correlation between temperature and air conditioner.\n- Visualization data analytic results with Kibana, Google spreadsheet,\nMatplotlib. - Expose RESTful API analytic service with javascript on NodeJs. INAProject, a system analytic Big data for telecommunication infrastructure.", "company": "CCSS startup", "end_time": "2018-06-30T00:00:00Z", "industry": "Other", "position": "Data scientist", "conf_score": 0.9548326025449371, "start_time": "2017-10-01T00:00:00Z"}, {"id": 15497, "detail": "- Process development & improvement automation scripts.\n- Propose web automation testing strategies.\n- Estimate and monitor schedule/progress.\n- Develop automation testing use Python, Selenium, XPath.Sikuli, TestNG, Protractor, Selenium, WebdriverIO, Mocha, Chai, Allure. WiNG managed family of Access Points, controllers provide a centralized distribution of high performance, resilient wireless and data services to remote locations with the scalability.\nMPact, a platform for Mobile Marketing, shopping is centered on customer needs. Base on Bluetooth 4.0 Low Energy technologies.", "company": "Terralogic Company, Quang Trung Software Park", "end_time": "2017-08-31T00:00:00Z", "industry": "High Technology", "position": "Senior Automation test Engineer", "conf_score": 0.9283402044765778, "start_time": "2015-05-01T00:00:00Z"}, {"id": 15499, "detail": ". - Preview software/hardware specification & design documents.\n- Manual/auto test by using scripts tcl, python.\n- Define verification plan, coverage plan based on Chip functionality, standard and application.\n- Verify Chip at system level following standards as ITU, MEF, IEEE. Calypso, a switch solution which supports new telecom technologies:\nCarrier Ethernet Y1731, OAM MPLS-TP CCM, LB, LT, DM, LM.", "company": "Arrive Technologies, ETown Cong hoa", "end_time": "2015-04-30T00:00:00Z", "industry": "High Technology", "position": "Verification engineer", "conf_score": 0.8948419004195385, "start_time": "2013-09-01T00:00:00Z"}], "address": "Tan Phu District, Ho Chi Minh City, Vietnam"}