{"skills": ["java", "agile", "singleton", "tomcat", "process development", "reactjs", "database schema", "redis", "design pattern", "mysql", "oracle", "jquery", "oop", "javascript", "ibm", "database", "database design", "spring boot", "jsp", "groovy", "observer", "cache", "bootstrap", "docker", "cloud", "hibernate", "teamwork", "angularjs", "spring", "jms", "management", "aws", "restful"], "fulltext": "S\u01a0N, L\u00ca H\u1eeeU \nPrinciple Java Developer \nMobile : 0975 026 373 \nEmail   : freetrend.it.sonle@gmail.com \nSummary Experiences \n- \nHave more than 8 years in Java development \n- \nAbility to work in English environment. \n- \nAbility to work independent or teamwork. \n- \nAbility to get requirement, analysic and design database schema. \n- \nAbility to build, package and deploy to cloud server. \n- \nHave strong knowledge about OOP concept. \n- \nExperience in Design Pattern : Singleton, Factory, Builder, Observer,\u2026 \n- \nHave strong in designing report using Jasper Report, native query. \n- \nAbility to research and learn new technologies. \nSkill \n- \nJava, Spring Framework, Hibernate \n- \nJavascript, Jquery, Angularjs, ReactJS \n- \nRestful Service \n- \nMysql, Redis cache \n- \nTomcat, Jenkin, Docker, AWS \n- \nVert.x, JMS \nEducation \n- \nHutech University of Technology : 2005 - 2010 \nEmployment History \nS3 Corporation \n02/2018 \u2013 now \nProject \nGrid Value \nDescription \nManaging devices system, intergrate with Netcool IBM \nproduct \nAgile development process \nResponsibilities Designe, implement and maintain API \nGuilding and support team members \nContacting and discussing with German team to find out \nsolution \nTechniques \nJava, Spring, Restful, DB2 \nNetcool IBM \nAuto-deploy with Jenkin, Docker \nWebsphere Application Server \nSimple Solution Taipan VietNam \n04/2014 \u2013 11/2016 \nProject \nVMS system \nDescription \nManaging volunteers for Seagame 2015 seasion at Singapore. \nResponsibilities Develop and maintain modules : training, logistic, profile, \nbroadcast, event, report. \nTechniques \nJava,Spring Boot, Jsp, Bootstrap, Vert.x, Mysql, Jasper \nReport \nSuccess Software Service \n03/2013 \u2013 04/2014 \nProject  JBilling \nDescription \nManaging about retailing business \nResponsibilities Develop, customize, maintain functionalities \nTechniques \nJava, Hibernate, Grails, Mysql, SOAP Service, Groovy.  \nFreetrend Industrial Limited \n08/2010 \u2013 03/2013 \nProject \nNikeId, CBD Nike Quotes, Model Warehouse, HR \nManagement \nDescription \nAll the projects support for producing management of factory. \nResponsibilities Developing and maintain. \nTechniques \nJava, Echo Web Framework, Spring, Hibernate, Oracle DB, \nJasper report. \nPowered by TCPDF (www.tcpdf.org)", "educations": [{"id": 4643, "gpa": null, "major": null, "school": "Hutech University of Technology", "diploma": "Bachelors", "end_time": "2010-01-01T00:00:00Z", "conf_score": 0.7275132206498556, "start_time": "2005-01-01T00:00:00Z", "picklist_major": "Other", "major_categories": "", "major_categories_detail": ""}], "experiences": [{"id": 15522, "detail": "", "company": "S3 Corporation", "end_time": "2023-04-13T00:00:00Z", "industry": "Other", "position": "Project Grid Value", "conf_score": 0.9084342349063116, "start_time": "2018-02-01T00:00:00Z"}, {"id": 15523, "detail": "Project VMS system\nDescription Managing volunteers for Seagame 2015 seasion at Singapore. Responsibilities Develop and maintain modules : training, logistic, profile, broadcast, event, report.\nTechniques Java,Spring Boot, Jsp, Bootstrap, Vert.x, Mysql, Jasper Report", "company": "Simple Solution Taipan VietNam", "end_time": "2016-11-30T00:00:00Z", "industry": "High Technology", "position": null, "conf_score": 0.7507320409926004, "start_time": "2014-04-01T00:00:00Z"}, {"id": 15524, "detail": "Project JBilling Description Managing about retailing business\nResponsibilities Develop, customize, maintain functionalities\nTechniques Java, Hibernate, Grails, Mysql, SOAP Service, Groovy.", "company": "Success Software Service", "end_time": "2014-04-30T00:00:00Z", "industry": "High Technology", "position": null, "conf_score": 0.7507320409926004, "start_time": "2013-03-01T00:00:00Z"}, {"id": 15525, "detail": "Project NikeId, CBD Nike Quotes, Model Warehouse, HR Management Description All the projects support for producing management of factory.\nResponsibilities Developing and maintain.\nTechniques Java, Echo Web Framework, Spring, Hibernate, Oracle DB, Jasper report.", "company": "Freetrend Industrial Limited", "end_time": "2013-03-31T00:00:00Z", "industry": "Other", "position": null, "conf_score": 0.7507320409926004, "start_time": "2010-08-01T00:00:00Z"}], "address": null}