{"skills": ["project tracking", "java", "spring cloud", "jira", "bpm", "j2ee", "parcel", "ubuntu", "security", "jquery", "unix", "dataflow", "activemq", "elasticsearch", "management information system", "macos", "virtual machine", "javascript", "bug fixing", "devops", "sps", "banking", "spring boot", "ams", "docker", "cloud", "operation system", "operating system", "information management", "java virtual machine", "identity", "spring", "centos", "postgresql", "management", "trello", "communication skill"], "fulltext": "Tung Nguyen \nOBJECTIVE \nI have worked with Java, its frameworks and Microservice Architecture for 3 years. Absolutely, it is so \nattracted to me so that I would like to continue learning in depth and investigate more Java Virtual \nMachine and Operation System comprehensively. Beside the hard skills, I am improving the soft \nskills such as communication skills, explainmination skills and leadship qualities. \nTherefore I am looking for a professional and internal environment where I can maximize my \ncontribution  and accumulate more experience to become a Java Technical Architecture next 4 \nyears. \nWORK EXPERIENCE \nMay 2016 - Present\nSwiss Post Solution \nJava Developer \n- Maintain Web-Services, Web-Applications serving Post Logistic of\nSwitzerland and implement the change requests. \n- Research new technology and architecture for software team. \n- Developing the platform serving for all projects in SPS Vietnam and\nSPS Global. \n- Work with technical architect to finalize low level design and report what\ninvestigating new technology for him \n- Use JIRA, Trello project tracking. \nFeb 2016 - May 2016\nTMA Solutions \nJava Developer \n- Develop Web-Application managing a list of UNIX command line and\nexecuting them automatically. \nPROJECTS \nCentralize Document Input Processing Platform \n(Jan 2017 - Current) \nCustomer \nSwiss Post Solution Global \nDescription \n- The main business of Swiss Post is Digital Data Processing. Therefore, they \nwould like an centralize system handling the different documents and be \nscalable, high securities.  \nTeam size \n12 \nMy position \nOne of three key members \n- Work with technical architect to finalize the low level design \nMy responsibilities \n- Discuss with IT department of customer to finalize the integration mechanism \n- Development \n- Bug Fixing \n- Java 8 programing language \n- Spring Boot, Spring Data JPA/Elasticsearch, Spring Integration, Spring Cloud \nConfig, Spring Cloud Dataflow \nTechnologies used \n- ActiveMQ, Elasticsearch, PostgreSQL \n- Docker \n- WSO2 products: API Manager, Identity Server \n- Inubit BPM \nPost Logistic System \n(May 2016 - Dec 2016) \nCustomer \nPost Logistic Switzerland \nDescription \n- Post Logistic Switzerland digitalizes the parcel information and submit to the \nsystem. It validates, classifies and deliveries these information to the \ncorrespond Webhooks. \nTeam size \n6 \nMy position \nJava developer \nMy responsibilities \n- Develop change requests from customer. \n- Java 8 programing language \nTechnologies used \n- Spring boot, Spring Data JPA \n- Docker \n- Elasticsearch, PostgreSQL \nGenband Loadline Up \n(Feb 2016 - May 2016) \nCustomer \nInternal Team TMA \nDescription \n- This web-application help the devops in managing the list of UNIX command \nline and executing them automatically \nTeam size \n3 \nMy position \nJava developer \nMy responsibilities \n- Development. \n- Optimize code \n- Bug Fixing \n- Java programing language \nTechnologies used \n- J2EE \n- jQuery \nCERTIFICATIONS \n2016 \nJava Developer Certification from University of Science, HCMC \nEDUCATION \nSep 2013 - May 2016 \nBanking University, HCMC \nMajor: Management Information System \nSKILLS \nProgramming \nJava, JavaScript \nOperating System \nMacOS, Windows, Ubuntu, Centos \nLanguage \nEnglish \nINTERESTS \nI prefer investigating new technology that relevant Microservice Architecture and reading about computer \nprograming and architectures.  \nREFERENCES \nMobile: 0901299856 - Mr. Dung: Team leader ", "educations": [{"id": 4662, "gpa": null, "major": "Qu\u1ea3n l\u00fd th\u00f4ng tin", "school": "Banking University, HCMC", "diploma": "Bachelors", "end_time": "2016-05-01T00:00:00Z", "conf_score": 0.9192536033612259, "start_time": "2013-09-01T00:00:00Z", "picklist_major": "Administrative/Clerical", "major_categories": "B\u00e1o ch\u00ed v\u00e0 th\u00f4ng tin", "major_categories_detail": "Th\u00f4ng tin \u2013 Th\u01b0 vi\u1ec7n"}], "experiences": [{"id": 15588, "detail": "- Maintain Web-Services, Web-Applications serving Post Logistic of\nSwitzerland and implement the change requests.\n- Research new technology and architecture for software team.\n- Developing the platform serving for all projects in SPS Vietnam and\nSPS Global. - Work with technical architect to finalize low level design and report what investigating new technology for him\n- Use JIRA, Trello project tracking.", "company": "Swiss Post Solution", "end_time": "2023-04-13T00:00:00Z", "industry": "Transportation & Logistics", "position": "Java Developer", "conf_score": 0.9166535282364164, "start_time": "2016-05-01T00:00:00Z"}, {"id": 15590, "detail": "- Develop Web-Application managing a list of UNIX command line and executing them automatically.", "company": "TMA Solutions", "end_time": "2016-05-31T00:00:00Z", "industry": "High Technology", "position": "Java Developer", "conf_score": 0.9283402044765778, "start_time": "2016-02-01T00:00:00Z"}], "address": null}