{"skills": ["strut", "payment", "java", "marketing", "c++", "javascript", "xml", "management", "talend", "ant", "rsa", "etl", "j2ee", "svn", "project management", "bugzilla", "spring", "ajax", "spring mvc", "mysql", "email marketing", "visual source safe", "asp", "encryption", "php", "mvc", "oracle", "database", "hibernate", "crystal report", "mssql"], "fulltext": "CURRICULUM VITAE \nAcademic Degree Obtained \nYear \nUniversity \nSubject \n2005 \nHCMC University of Information technology \nSoftware Engineering \nWork \nYear \nOccupation \nCompany \nLocation \n2005-01/2006 \nIT / Report Mobifone \nMM 18 Truong Son Ward 14, District \n10, Ho Chi Minh City \n2006-01/ 2008 \nProgrammer DAMI \n24/3B Cay Tram, Ward 8, Go Vap \nDistrict, Ho Chi Minh City \n06/2008-present Programmer BTM Global Consulting VN \nSBI Building, Quang Trung Software \nPark \nDistrict 12, Ho Chi Minh City \nLanguage Skills \nVietnamese \nMother tongue \nEnglish \nIntermediate \nTechnical Skills \nLevel \nKnowledge/Skills \nProfessional \n\u2022   MSSQL \n\u2022   Oracle DB \n\u2022   Java \nGood  \u2022    PHP  \u2022    MySQL  \u2022    AJAX \nModerate \n\u2022   Java: Struts, Hibernate, Spring MVC \n\u2022   C/C++ \n\u2022   .Net: VB, ASP \n\u2022   Javascript \nSpecific Technologies \nLevel \nKnowledge/Skills \nProfessional \n\u2022   Java J2EE \n\u2022   Oracle Framework \n\u2022   Weblogic \n\u2022   Shell Script \n\u2022   Derby Database. \nOther Skills \nLevel \nKnowledge/Skills \nGood \n\u2022   Version control software: SVN, CVS \n\u2022   Version control software: Visual Source Safe \n\u2022   Bug tracker software: Bugzilla \n\u2022   Design tools: MS Visio \n\u2022   ETL tools: Infomatica, RETL, Talend \u2026 \n\u2022   Source Code Performance Tuning \n\u2022   Oracle hint \n\u2022   Time management \n\u2022   Project management \nProjects \nName \nType \nMy role \nCompany \nPAYLESS/STAPLES  CampingWorld \n\u2022   Xstore/Xcenter/Xadmin \n\u2022   Integrate with thirdparty \n\u2022   ANT build \n\u2022   Payment intergration \n\u2022 Marketing email (Email \nreceipt) \nTechnical lead \nBTM Global \nDeckers \n\u2022   ORPOS, BO, CO \n\u2022   Spring MVC \n\u2022   Web services \n\u2022   Transact XML \n\u2022   Credit in transaction. \n\u2022   RSA encryption service \n\u2022   AD \nProgramer  Manager \nBTM Global \nNEXCOM/ Gander \nMountain \n\u2022   J2EE \n\u2022   Spring MVC \n\u2022   Java web service \n\u2022   Weblogic \n\u2022   LDAP \n\u2022   ProC++ \n\u2022   Auto Deployment tools \nProgrammer \nBTM Global Consulting \nVN \nN\u2019Compass \n\u2022   Google Web Toolkit \n\u2022   Hibernate \nProgrammer \nBTM Global Consulting \nVN \nERP \n\u2022   MSSQL \n\u2022   Visual Basic \n\u2022   Crystal Report \nProgrammer  Dami \nOthers \n\u2022 PROD support (HLZ, \nPEI, Pacsun) \nLead/Programmer \nBTM Global \nHobbies \n\u2022   Movies \n\u2022   Badminton \n\u2022   Reading book ", "educations": [{"id": 4667, "gpa": null, "major": "K\u1ef9 thu\u1eadt ph\u1ea7n m\u1ec1m", "school": "HCMC University of Information technology", "diploma": "Bachelors", "end_time": "2005-01-01T00:00:00Z", "conf_score": 0.7656888128988677, "start_time": null, "picklist_major": "IT - Hardware/Networking", "major_categories": "M\u00e1y t\u00ednh v\u00e0 c\u00f4ng ngh\u1ec7 th\u00f4ng tin", "major_categories_detail": "M\u00e1y t\u00ednh"}], "experiences": [{"id": 15603, "detail": "BI Building, Quang Trung Software Park District 12, Ho Chi Minh City", "company": "BTM Global Consulting VN", "end_time": "2023-04-13T00:00:00Z", "industry": "Other", "position": "Programmer", "conf_score": 0.9007656883663064, "start_time": "2008-06-01T00:00:00Z"}, {"id": 15604, "detail": "4/3B Cay Tram, Ward 8, Go Vap District, Ho Chi Minh City", "company": "DAMI", "end_time": "2008-01-31T00:00:00Z", "industry": "Other", "position": "Programmer", "conf_score": 0.9007656883663064, "start_time": "2006-01-01T00:00:00Z"}, {"id": 15605, "detail": "M 18 Truong Son Ward 14, District 10, Ho Chi Minh City", "company": "Mobifone", "end_time": "2006-01-31T00:00:00Z", "industry": "Other", "position": "IT / Report", "conf_score": 0.7551834254203837, "start_time": "2005-01-01T00:00:00Z"}], "address": ", Go Vap\n"}