{"skills": ["css", "git", "ruby", "lead a team", "html", "ubuntu", "mysql", "symfony", "wordpress", "dash", "marketing", "coffeescript", "javascript", "website development", "database", "database design", "protocol", "mobile application", "codeigniter", "ams", "php", "rail", "angularjs", "vuejs", "centos", "online shopping"], "fulltext": " Experience\n(\nRuby on Rails\n08/2016 - Current\nEvolable Asia\n Use Ruby on Rails, AngularJS, VueJS, CoffeeScript to develop B-Dash systems (A system built to\nmanage marketing data in a comprehensive and consistent way).\n Deploy, maintain and upgrade new projects\u2019 features.\n\u2220\nPHP\n11/2014 - 07/2016\nOgilvyOne\n Use Drupal, Symfony and Wordpress to develop websites for a number of top MNC clients including\nUnilever, Nestle, FrieslandCampina, etc.\n Ensure all websites and programs to be technically optimized and run properly.\n Deploy, maintain and upgrade new projects\u2019 features.\n Build internal systems and protocols to ensure content optimisation and high-quality user experience\nacross all platforms including websites, mobile, social, video, blogs, retail portals etc.\n\u2220\nRuby on Rails\n04/2013 - 11/2014\nZIGExN VeNtura\n Lead a team of 5 members on ShopZIGExN project.\n Used Ruby on Rails to develops job seeking (Arubaito-ex.jp) and online shopping tools for Japanese\nmarket.\n Deployed, maintained and implemented new projects\u2019 features.\n Provide high performance, manageable server for web application, mobile application using Ruby on\nRails.\n Setup and configured server (Centos, Ubuntu).\n Design database and architecture for the project.\n\u2220\nPHP& Html/Css\n2011 - 2013\nDigicom Corp\n Converted PSD to HTML & CSS (including javascripts).\n Created and developed websites using PHP & MySQL and other PHP frameworks such as Yii,\nOpencart, Codeigniter and Wordpress.\n\u2220\n Education\n*\nBachelor of IT\n2008 - 2012\nSaigon University\nCao Thang Technical College\n Best Thesis Award for students from Information & Technology faculty\n\u22c6\nTran Minh Tuan\nJob: Web Developer\nApply Position: Ruby on Rails Developer\nDate of birth: 01/01/1990\nI am passionate about using technology to create products and services that\nimprove people\u2019s lives and bring practical value to the community.\n Social Contacts\n /trantuanckc\n trantuanckc\n (+84) 094.640.2200\n trantuanckc@gmail.com\n!\n\"\n#\n$\n%\n&\n Skills\nRuby on Rails 85%\nPHP 65%\nHTML/CSS & Javascript (AngularJS, VueJS, CoffeeScript) 80%\nServer (Ubuntu/Centos) 65%\nGIT 90%\n'\nPowered by TCPDF (www.tcpdf.org)", "educations": [{"id": 4672, "gpa": null, "major": null, "school": "Saigon University\nCao Thang Technical College", "diploma": "Bachelors", "end_time": "2012-01-01T00:00:00Z", "conf_score": 0.8937074928385723, "start_time": "2008-01-01T00:00:00Z", "picklist_major": "Other", "major_categories": "", "major_categories_detail": ""}], "experiences": [{"id": 15618, "detail": "Use Ruby on Rails, AngularJS, VueJS, CoffeeScript to develop B-Dash systems (A system built to manage marketing data in a comprehensive and consistent way).\nDeploy, maintain and upgrade new projects\u2019 features.\n\u2220", "company": "Evolable Asia", "end_time": "2023-04-13T00:00:00Z", "industry": "Other", "position": null, "conf_score": 0.7721324597176661, "start_time": "2016-08-01T00:00:00Z"}, {"id": 15620, "detail": "Use Drupal, Symfony and Wordpress to develop websites for a number of top MNC clients including\nUnilever, Nestle, FrieslandCampina, etc.\nEnsure all websites and programs to be technically optimized and run properly.\nDeploy, maintain and upgrade new projects\u2019 features.\nBuild internal systems and protocols to ensure content optimisation and high-quality user experience across all platforms including websites, mobile, social, video, blogs, retail portals etc.\n\u2220", "company": "OgilvyOne", "end_time": "2016-07-31T00:00:00Z", "industry": "Other", "position": "PHP", "conf_score": 0.7707675877424722, "start_time": "2014-11-01T00:00:00Z"}, {"id": 15622, "detail": "Lead a team of 5 members on ShopZIGExN project.\nUsed Ruby on Rails to develops job seeking (Arubaito-ex.jp) and online shopping tools for Japanese market.\nDeployed, maintained and implemented new projects\u2019 features.\nProvide high performance, manageable server for web application, mobile application using Ruby on\nRails. Setup and configured server (Centos, Ubuntu). Design database and architecture for the project.\n\u2220", "company": "ZIGExN VeNtura", "end_time": "2014-11-30T00:00:00Z", "industry": "Other", "position": "Ruby on Rails", "conf_score": 0.7707675877424722, "start_time": "2013-04-01T00:00:00Z"}, {"id": 15624, "detail": "Converted PSD to HTML & CSS (including javascripts).\nCreated and developed websites using PHP & MySQL and other PHP frameworks such as Yii, Opencart, Codeigniter and Wordpress. \u2220", "company": "Digicom Corp", "end_time": "2013-01-31T00:00:00Z", "industry": "Other", "position": "PHP& Html/Css", "conf_score": 0.8044357220536977, "start_time": "2011-01-01T00:00:00Z"}], "address": null}