{"skills": ["linux", "sc", "angular", "css3", "load balancing", "symfony", "mongo", "json", "javascript", "mongodb", "management", "unit test", "robot", "business analysis", "git", "svn", "html5", "analysis", "structure", "website development", "le", "software development", "bug fixing", "testing", "uml", "database", "redmine", "mocha", "angularjs", "bitbucket", "php", "agile", "mysql", "jquery"], "fulltext": " Nguyen Le  \nWeb Developer \n PERSONAL INFORMATION  \n       Full name:             Le Cao Nguyen  \nDate of birth: \nJuly 20, 1992 \nGender: \n Male \nPhone: \n 0965.465.883 \nEmail: \n caonguyenle007@gmail.com \nAddress: \n          Thu Duc District, Ho Chi Minh City, Viet Nam \nCAREER OBJECTIVE \n\u25a0 Short-term goal: \n   - I want to takes a lot of difference positions of software development. \n   - Improve my English skills. \n\u25a0 Long-term goal: \n - I want to be a master of web development within 5 years and become a trainer. \nEDUCATION \nSep 2010 - Feb 2015 \nHCMC University of Technology and Education \nMajor: Information Technology. \nGPA: 7.39 \nEXPERIENCE  \nRECORD \nAug 2018 \u2013 Present \n\u25c6  Company: FPT Software HCM. \n\u25c6  Project Overview: This project allow the customer can send goods from USA to \nVietnam via plane.  \n\u25c6  Main Position: Senior Software Engineer, Sub-Leader \n\u25c6  Main responsibilities: \n- Refactor backend source code using NodeJS language. \n- Fix performance issues related to how to query data using NodeJS and Mongo DB. \n- Implement new feature (using NodeJS and AngularJS) and fix bug. \n- Create API for mobile using. \n- Support training members using technical related to NodeJS and Angular. \n- Review source code of member, merge source and deploy to the server for testing. \n- Analyze current business and suggest to PM betters things. \n\u25c6  Experience gained: \n- Improve skill about define Mongo DB database and how to query with big records \nwithout performance issues. \n- Improve review code skill. \n- Improve communicate with team member skill, especially how to explain my ideal or \nsolution to other members. \n- Improve business analysis skill. \n- New experience working with report and control tasks. \n\u25c6  Company: FPT Software HCM. \n\u25c6  Project Overview: This project is a small social network (like Facebook) use only for \na company. \n\u25c6  Main Position: Senior Software Engineer. \nApr 2018 \u2013 Jul 2018 \n\u25c6  Main responsibilities: \n- Create the template base on the UI/UX of designer using AngularJS language. \n- Create and run unit test. \n- Integrate API with backend team. \n- Analyze REQs. \n- Support review code from other members. \n- Testing and bug fixing. \n\u25c6  Experience gained: \n- Experience working with the first customer in the EU (Switzerland). \n- Experience working with the development use Scrum Agile model. \n- Improve business analysis skill. \n- Improve review code skill. \n- Experience working with design use typography and taxonomy techniques. \n- Experience with create unit test using AngularJS. \n\u25c6  Company: FPT Software HCM. \n\u25c6  Project Overview: Create an application allow the customer can take interesting \npictures when they are on the flight and share to the social networks. \n\u25c6  Main Position: Senior Software Engineer. \nDec 2017 \u2013 Mar 2018 \n\u25c6  Main responsibilities: \n- Refactor current backend source code. \n- Implement new features and fix bug of the system. (Both of Backend and Front-end). \n- Implement API for mobile using. \n- Support deploy server. \n\u25c6  Experience gained: \n- How to create a backend structure use NodeJS language can be used for both of web \nand mobile. \n- How to create template base on UI/UX of designer. (Zeplin and Invision) \n- Experience practice with new language: Angular 5 \n\u25c6  Company: TMA Solutions \n\u25c6  Project Overview: This project related to multimedia with Robot activity. We are \ndevelop and deploy to actual robot. \n\u25c6  Main Position: Software Engineer \n\u25c6  Main responsibilities: \n   - Support the customer investigate solutions to resolve some processing related \non single thread of JavaScript. \n   - Receive Basic Design, analysis REQs, create estimation and transfer REQs to \nteam members. \n   - Coding base on detail design, create and run UT test code. \nApr 2017 \u2013  Nov 2017 \n   - Setup environment for development and testing. \n   - Support team members investigate source code and new REQs. \n   - Support review code of team member. \n   - Weekly and daily report status to the managers. \n\u25c6  Experience gained: \n   - Basic knowledge about load balancing technical. \n   - How to use Child process in NodeJS. \n   - Analyze basic document from the customer, confirm ideal, and transfer to team \nmembers. \n   - How to make Q&A effectively. \n   - How to create estimation. \nNov 2016 \u2013 Apr 2017 \n\u25c6  Company: TMA Solutions \n\u25c6  Project Overview: This project related to Robot activity. We are develop and deploy \nto actual robot. \n\u25c6  Main position: Software Engineer \n\u25c6  Main responsibilities: \n   - Read document, investigate source code about a system. \n   - Coding new feature base on existing source code. \n   - Report status to Leader. \n\u25c6  Experience gained: \n   - The way to maintain a project. \n   - NodeJS and AngularJS programming language. \n   - Asynchronous technical. \nApr 2015 - Nov 2016 \n\u25c6  Company: TMA Solutions \n\u25c6  Project overview:  \n   - All projects are belong to Japan\u2019s E-commerce website. \n\u25c6  Main position: Software Engineer. \n\u25c6  Main responsibilities: \n - Receive idea from the customer, create detail design. \n - Coding, run unit test, feature test base on detail design. \n - Coding new feature of product. \n - Report status to Leader. \n\u25c6   Experience gained: \n    - PHP programming language. \n    - The way to apply knowledge at the school to actual project. \n    - The way to create detail design base on ideal of the customer. \n    - The way to create manual UT test case. \n    - The way to run System test, opening bug processing, fix bug processing. \n    - The way to use Redmine, SVN, and Bitbucket. \nSKILLS  AND PRACTICES \nFE programming \nlanguage \nHTML5, CSS3, JQuery, AngularJS, Angular, SCSS \nBE programming \nlanguage \nPHP (Eccube framework base on Symfony 2), NodeJS (Express framework) \nDatabase \nMySQL, pgAdmin, MongoDB \nSource code \nmanagement \nGit, Bitbucket, SVN \nEnvironment \nWindows, Linux \nOther \nJSON, UML, Vagrant, Mocha (NodeJS testing framework) \nLanguages \nVietnamese (Native), English (Advanced), Japanese (Advanced) \nPowered by TCPDF (www.tcpdf.org)", "educations": [{"id": 4679, "gpa": "7.39", "major": "C\u00f4ng ngh\u1ec7 th\u00f4ng tin", "school": "HCMC University of Technology and Education", "diploma": "Bachelors", "end_time": "2015-02-01T00:00:00Z", "conf_score": 0.8413267261986577, "start_time": "2010-09-01T00:00:00Z", "picklist_major": "IT - Hardware/Networking", "major_categories": "M\u00e1y t\u00ednh v\u00e0 c\u00f4ng ngh\u1ec7 th\u00f4ng tin", "major_categories_detail": "C\u00f4ng ngh\u1ec7 th\u00f4ng tin"}], "experiences": [{"id": 15640, "detail": "Main responsibilities:\n- Refactor backend source code using NodeJS language.\n- Fix performance issues related to how to query data using NodeJS and Mongo DB. - Implement new feature (using NodeJS and AngularJS) and fix bug.\n- Create API for mobile using.\n- Support training members using technical related to NodeJS and Angular. - Review source code of member, merge source and deploy to the server for testing.\n- Analyze current business and suggest to PM betters things.\n\u25c6 Experience gained:\n- Improve skill about define Mongo DB database and how to query with big records without performance issues.\n- Improve review code skill.\n- Improve communicate with team member skill, especially how to explain my ideal or solution to other members.\n- Improve business analysis skill.\n- New experience working with report and control tasks.\n- How to make Q&A effectively.\n- How to create estimation.", "company": "FPT Software HCM.", "end_time": "2023-04-13T00:00:00Z", "industry": "High Technology", "position": "Senior Software Engineer, Sub - Leader", "conf_score": 0.8275150454715341, "start_time": "2018-08-01T00:00:00Z"}, {"id": 15641, "detail": "\u25c6 Main responsibilities:\n- Read document, investigate source code about a system.\n- Coding new feature base on existing source code.\n- Report status to Leader. \u25c6 Experience gained:\n- The way to maintain a project.\n- NodeJS and AngularJS programming language.\n- Asynchronous technical.", "company": "TMA Solutions", "end_time": "2017-04-30T00:00:00Z", "industry": "High Technology", "position": "Software Engineer", "conf_score": 0.9236936009479224, "start_time": "2016-11-01T00:00:00Z"}], "address": "Thu Duc District, Ho Chi Minh City, Viet Nam"}