{"skills": ["linux", "rxswift", "xpath", "tomcat", "c++", "ams", "apache", "cocos2d", "xml", "studio", "io", "sql database", "cornerstone", "ubuntu", "git", "svn", "firebase", "mvp", "swift", "ubuntu linux", "search", "viper", "xslt", "firebase crashlytics", "design pattern", "sql", "oop", "jira", "visual studio", "mvvm", "crashlytics", "testflight", "gitkraken", "arduino", "mvc", "microsoft", "objective c", "uml", "unity", "database", "cocoa", "pascal", "networking", "xcode", "streaming", "mac o x", "sqlite", "html"], "fulltext": "CURRICULUM VITAE \nHO\u00c0NG H\u00d9NG C\u01af\u1edcNG \nI. PERSONAL DETAILS \nFull name: \nHO\u00c0NG H\u00d9NG C\u01af\u1edcNG \nGender: \nMale \nDate of birth: \n24th April 1986 \nNationality: \nVietnamese \nContact address: \n108/72 Nguyen Trai St. \u2013 Thanh Xuan \nDistrict \u2013 Hanoi City \nEmail: \nchickchick.ce@gmail.com \nSkype:  chick.chik \nTel: \n0329573998 \nII. CARRER OBJECTIVES \nI seek challenging opportunitues where I can fully use my skills and experiences for the success \nof the organization. \nI am seeking a company here I can grow professionally and personally. \nTo make great applications for many users from over the world. \nTo satisfy the passion with technology. \nIII. TECHNICAL SKILLS \nCategories \nKnowledge/Skills \nLanguages \n* Objective C/ Cocoa (expert with experience more than 7 years) \n* Swift   \nPlatforms \n* Windows \n* DOS \n* Mac OS X \n* Linux (Ubuntu)  \nDatabase \n* SQL Server \n* SQLite \n* CoreData \n* Realm \nTools \n* Xcode  \n* Eclipse \n* Visual Studio \n* Dev C++ \n* Borland C++ 5.02 \n* QT Creator \n* Turbo Pascal/Free Pascal \n* SmartSVN, CornerStone, GitKraken \nDesign Pattern \n* OOP, MVC, MVP, MVVM, VIPER, VIP \nOther \n* SVN, GIT \n* CocoaPod \n* Fabric, Crashlytics, TestFlight \n* UML \n* Apache Tomcat 5.5 \n* Microsoft Office, Open Office \n* XML, XSD, XSLT, Xpath \n* Photoshop, Lightroom \nIV. EDUCATION AND QUALIFICATIONS \nYear \nOccupation \nUniversity \nLocation \n2007 \u2013 \n2011 \nStudent \nFPT University, \nFalcuty of Software \nEngineering. \nDec/11: Get FE \ncertificate, by VITEC. \nDetech building, No.8 Ton That \nThuyet St, Cau Giay District, \nHanoi City. \nV. LANGUAGE SKILLS \nVietnamese: \nMother tongue \nEnglish: \n\u2022 TOEFL 503/650 (Exam at the \nUniversity)  \n\u2022 Fluent for comunication \nJapanese: \nN4 (2014) \nVI. WORK HISTORY \nTime  Company  Title \nJun 2010 \u2013 Jan 2011 \nFsoft \nIntern \n2011 - 2012 \nTinhvan Outsourcing \npartime as ios \ndeveloper \nJan 2012 \u2013 Oct 2018 \nSETA Asia (change to name is CO-WELL \nAsia) \nSenior ios developer \n& ios leader \nOct 2018 \u2013 Now \nAnPSoft \nios developer & \nproject lead \nVII. RELEVANT PROJECTS \nNo  Project  Name \nDescription \nRole \nCore Technical &  Tools \n1 \nEBook \nebook reading app \nios developer \nPDF reader \nSvn \nJira \n2 \nFoster \nAn application which can \nhelp devices transfer data \nvia audio \nios developer \nAudio \nC \nFSK-Arduino \nWebCache \n3 \nGohan \nAn ios project with \ncontain 10 small cooking \ngames.  \nios developer \nCocos2d, Cocos2dx \nSvn \n4 \nAKM \nKaraoke app which can \ndisplay lyric to TV and \ngenegate score after sing \nios developer  CoreGraphic \nC++ karaoke lib \nASIHTTPRequest \nSvn \n5 \nHotei \nA puzzle game \nios developer \nUnity \nIntegrate Social networking to unity project \nsvn \n6 \nScore App \nApp for golf player which \ncan calculate score and \nsyncronize score to server \n(also working when \noffline) \nios developer \nCoreData \nASIHTTPRequest \nSvn \nJenkin \n7 \nKuilima \nApp for pregnant women \nios developer \nSqlite \nCalendar \nASIHTTPRequest \nsvn \n8 \nAlarm \nAlarm app which user \nhave to finish a mini game \nto turn off alarm \nios lead \nRealm \nAFNetworking \nCocos2dx \nItunes library connect \nLocal PushNotification \nIn-App purhcase \nsvn \n9 \nMeema \nDate App which user can \nstreaming audio and video \nios developer \nAFNetworking \nJSONModel \nAudio & Video streaming \nCocoaPod \nGit, cocoapod \n10 \nChe Tube \nVideo play & Live stream \ngame AOE \nios developer \nFirebase \nAdmob, Facebook Audience Network \nYoutube player \nHTML SWAP \nGit, cocoapod \nios developer \nfor maintain \nAFNetworking, FMDB, Mansory, \nAdobeMobileSDK, Fabric, Crashlytic, \ncocoapod \n11 \nTsutayaTV \nWatch and manage \nmovies from Tsutaya \nsystem.  \nRxSwift, Snapkit, Alamofire, Firebase, \nCrashlytics, git, cocoapod \nios developer \n& Project \nleader \n12 \nKTown \nUtility application for \nsearch services near us. \nSame as \u201cFoody\u201d app but \nhas lots of services (food, \nrestaurant, atm, \u2026) \nVIII. HOBBIES AND ACTIVITIES \nI prefer to spend free time to study new things and coding. I like traveling with my friend on \nweekend. I also like photography. I have uploaded some photos at: https://500px.com/hhc . I \nusually spend 1 to 2 hours for football or running after work twice a week. Cinema is also a nice \nplace to be with friends & family at weekends. Sometime I like to stay alone in my room and \nlisten to music. ", "educations": [{"id": 4691, "gpa": null, "major": "K\u1ef9 thu\u1eadt ph\u1ea7n m\u1ec1m", "school": "FPT University", "diploma": "Bachelors", "end_time": "2011-12-13T00:00:00Z", "conf_score": 0.7932270159829526, "start_time": "2011-01-01T00:00:00Z", "picklist_major": "IT - Hardware/Networking", "major_categories": "M\u00e1y t\u00ednh v\u00e0 c\u00f4ng ngh\u1ec7 th\u00f4ng tin", "major_categories_detail": "M\u00e1y t\u00ednh"}], "experiences": [{"id": 15683, "detail": "", "company": "AnPSoft", "end_time": "2023-04-13T00:00:00Z", "industry": "Other", "position": "ios developer & project lead", "conf_score": 0.8691690065894404, "start_time": "2018-10-01T00:00:00Z"}, {"id": 15685, "detail": "", "company": "CO - WELL Asia", "end_time": "2018-10-31T00:00:00Z", "industry": "Other", "position": "Senior ios developer & ios leader", "conf_score": 0.7761728190039863, "start_time": "2012-01-01T00:00:00Z"}, {"id": 15686, "detail": "", "company": "Fsoft", "end_time": "2011-01-31T00:00:00Z", "industry": "Other", "position": "Intern", "conf_score": 0.9050765977702602, "start_time": "2010-06-01T00:00:00Z"}], "address": "108/72 Nguyen Trai St. - Thanh Xuan District - Hanoi City"}