{"skills": ["tensorflow", "core data", "lead others", "wordpress", "cloud service", "sales", "mongodb", "rest", "service layer", "test driven development", "git", "html5", "ease", "microservices", "spring mvc", "search", "nosql", "mobx", "website development", "warehousing", "recruiting", "testing", "objective c", "jsp", "angularjs", "lstm", "aws", "sonar", "java", "marketing", "data analytics", "json", "c++", "responsive", "tcp", "cloud", "business skill", "enterprise", "human resources", "etl", "finance", "svn", "firebase", "redis", "medium", "ionic", "maintenance", "cordova", "algorithm", "restful", "le", "ibm", "twitter", "ocr", "mssql", "payment", "analytics", "multi tenant", "mobile device", "management", "io", "bluetooth", "union", "performance testing", "react native", "swift", "short term investments", "insurance", "saas", "css", "aws beanstalk", "maven", "database", "cocoa", "data warehousing", "hibernate", "tcp connection", "people management", "bootstrap", "flutter", "css3", "lte", "neural network", "machine learning", "studio", "event marketing", "project execution", "structure", "investments", "spring", "android", "log4j", "software development", "mvc", "reactjs", "python", "networking", "weka", "jquery"], "fulltext": "THO NGUYEN \nFPT-Software Solutions Architect \nEmail:   \nthont.vnn@gmail.com \nSkype :   thont.vn \nMobile:  \n+84586148724 (VN)  \nLinkedIn:  \nhttps://www.linkedin.com/in/thont/   \nSummary \nSolutions architecture with a passion for transforming business challenges into successful, innovative \nand profitable technology solutions. Skilled communicator and fast-learner with the ability to \nunderstand, translate, and mediate between both the business- and technology-sides of a given \ninitiative.  Extensive experience in the development of enterprise applications including mobile and web \napplications, Big Data / Analytics, SaaS, Multitenant, Microservices, and B2B integrations. \nMy top skills and knowledge  \n\u2022 \nPeople Management - Building \u201cEffective & Efficient\u201d large scale engineering teams. I have built \nteams of 20+ who can be very effective at producing high quality platform releases. \n\u2022 \nProcesses \u2013 Understanding and creating product life cycle end-to-end processes across cross \nfunctional teams (e.g. think beyond scrum team) \n\u2022 \nArchitectures:  SaaS, Multi-tenant, Microservices, Data Warehousing \n\u2022 \nProgramming Frameworks / Languages \u2013 NodeJS, Express, Swift, Cocoa Pod, Java, Flutter, \nC/C++, Python, Tensorflow. \n\u2022 \nBackend Technologies \u2013 ETL tools, Mongodb,  REST, AWS \n\u2022 \nTesting \u2013 Production monitoring, load / performance testing.  Think about product life cycle level \ntesting strategy. \nMy Education \n\u2022 \nGraduated from SaiGon University in 2011  \n\u2022 \nUDACITY : Design of Computer Programs (self-study)  \n\u2022 \nUDACITY : LSTM Networks (self-study) \n\u2022 \nUDACITY : Neural Networks (General) (self-study) \n\u2022 \nUDACITY : Responsive Web Design Fundamental (self-study) \nBooks I loved:  \n- \nThe Passionate Developer,  \n- \nPragmatic Thinking and Learning,  \n- \nClean Code, Code complete, Test-Driven Development,  \n- \nProductive Projects and Teams,  \n- \nThe Mythical Man-Month: Essays on Software Engineering \nMy working experience  \nCompanies I did \nFPT SOFTWARE \nMar 2016 - Current \nSolutions Architect  \nA solution architect is responsible for the design of one or more applications or services within an \norganization and is typically part of a solution development team. I must have a balanced mix of \ntechnical and business skills, and will often work with an enterprise architect for strategic direction. \n\u00a7 \nFinding the best tech solution among all possible to solve the existing business problems. \n\u00a7 \n Describing the structure, characteristics, behavior, and other aspects of software to project \nstakeholders. \n\u00a7 \nDefining features, phases, and solution requirements. \n\u00a7 \nProviding specifications according to which the solution is identified, managed, and delivered \n\u00a7 \nProvided executive oversight for all projects under the Program managed to ensure smooth \nproject execution, to ensure delivery of quality software products, and to ensure clients are \nsatisfied with the work that projects are doing \n\u00a7 \nProvided active supports to Project Managers in implementing projects \nHARVEYNASH- NASHTECH  \nAug 2014 \u2013 Mar 2016 \nSenior Mobile developer / Team leader \nI\u2019s last title during his tenure at HarveryNash from Aug/2014 to Mar/2016 Responsibility as an SSE \nincludes (but not limited to the following):  \n\u00a7 \nHandle the entire software development life cycle, end to end \n\u00a7 \nLead others, or others look to you for guidance. \n\u00a7 \nI can self manage your projects supports to Project Managers in implementing projects \n\u00a7 \nManaged resources, staffing, skill sets transferring, and recruiting of the Program \n\u00a7 \nParticipated in pre-sales meetings and marketing events when necessary \n\u00a7 \nBuild prototypes at tech scoping stage of projects  \nFPT-TELECOM \nAug 2010 \u2013 Aug 2014 \niOS Team leader \nincludes (but not limited to the following):  \n\u00a7 \nEstimated template for Coding/Testing, Coding Check Sheet document, Review Check Sheet \ndocument\u2026 \n\u00a7 \nManaged tasks for iOS team to study and develop customer\u2019s application. \n\u00a7 \nReview iOS members\u2019 source code. \n\u00a7 \nCreate task and assign task for member Check and review code of finish task \n\u00a7 \nMain coding (implement feature and fix issues) \nProjects I did \nSPRYNKL  \nPosition : Solutions architect  \nDomain: Human resources Social network, Machine Learning \nTeam Size: 8 \nProject Description:  HR AI solution for employers to improve employee experience and be more \ncompetitive with talent retention. \nResponsibilities: \n\u00a7 \nWork with developers to design algorithms and flowcharts \n\u00a7 \nProduce clean, efficient code based on specifications \n\u00a7 \nIntegrate software components and third-party programs \n\u00a7 \nVerify and deploy programs and systems \n\u00a7 \nTroubleshoot, debug and upgrade existing software \n\u00a7 \nGather and evaluate user feedback \n\u00a7 \nRecommend and execute improvements \n\u00a7 \nCreate technical documentation for reference and reporting \n\u00a7 \nBuild CI/CD systems base on Sonar, Jenkin and Aws Beanstalk \n\u00a7 \nDesign sys and Build Infrastructure \n\u00a7 \nCoding \n\u00a7 \nDeploy  \nTechnologies:  \n\u00a7 \nFront-end: Wordpress, ReactJs \n\u00a7 \nMobile: Xcode, iOS Fundamental, iOS Application development, Notification, Objective-C, \nREST-full service, WebKit, Caching , lazy loading, machine-learning ( apple )  \n\u00a7 \nReact Native with MobX, React nativegation \n\u00a7 \nBack-end: Microservices, Nodejs, Express, REST, Python, AWS \n\u00a7 \nStanfore(CoreNLP), \nMachine \nLearning(Weka, \nTensorflow), \nSpelling \ncorrect(Jazzy), \nOcropus(text attraction) \nIPOS \nPosition: Solutions architect  \nDomain: Finance, Insurrance, Machine Learning \nTeam Size: 16 \nProject Description:  \n\u00a7 \niPOS is an iPad application support insurance process is faster and more convenient, The \ninsurance salesman uses iPOS to advise and compile insurance. \n\u00a7 \niPOS System provide suggestions for insurer list of persons should/shouldn\u2019t  \n\u00a7 \niPOS System can find/Get person information from many sourcesiPOS System allows the \ncensors to work faster by diagnostics and automatic \nResponsibilities: \n\u00a7 \nStudied customer\u2019s business, customer\u2019s application. \n\u00a7 \nDesign structure for new features, database structure. \n\u00a7 \nTraining members: setup environment development, learning fundamental about structure \nmodel, developing \n\u00a7 \nReview Check Sheet document\u2026 \n\u00a7 \nReview source code. \n\u00a7 \nCoding \n\u00a7 \nCreate task and communication with IBM to Deploy and maintain application   \nTechnologies:  \n\u00a7 \nFront-end: JSP, AngularJS, JQuery, HTML5, CSS.  \n\u00a7 \nMobile: Xcode, iOS Fundamental, iOS Application development, Notification, Objective-C, \nREST-full service, WebKit, Core data, Cocoa pod, cocoa control , caching , lazy loading, \nmachine-learning ( apple ) \n\u00a7 \nMobile: Hybrid cordova  app base on IONIC  \n\u00a7 \nBack-end: Java, Spring, Spring MVC, REST Service, Hibernate, JSON, Maven, Log4J, MSSQL, \nAWS, NLP, Python \n\u00a7 \nStanfore(CoreNLP), Spelling correct(Jazzy), Ocropus(text attraction) \nIRECRUIT \nPosition: Solutions architect  \nDomain: Finance, Insurrance, Machine Learning \nTeam Size: 16 \nProject Description:  \n\u00a7 \nAIA-iRecurit is an iPad application. Search for the candidate, View candidate details, Make a \nmeeting, Monitor progress of their use, Arrange interviews, Receive & accept the offer, On-\nboarding, Give feedback, Support online and offline mode, sync data  \nResponsibilities: \n\u00a7 \nStudied customer\u2019s business, customer\u2019s application. \n\u00a7 \nDesign structure for new features, database structure. \n\u00a7 \nTraining members: setup environment development, learning fundamental about structure \nmodel, developing \n\u00a7 \nReview Check Sheet document\u2026 \n\u00a7 \nReview source code. \n\u00a7 \nCoding \n\u00a7 \nCreate task and communication with IBM to Deploy and maintain application   \nTechnologies:  \n\u00a7 \nFront-end: JSP, AngularJS, JQuery, HTML5, CSS.  \n\u00a7 \nMobile: Xcode, iOS Fundamental, iOS Application development, Notification, Objective-C, \nREST-full service, WebKit, Core data, Cocoa pod, cocoa control , caching , lazy loading, \nmachine-learning ( apple ) \n\u00a7 \nBack-end: Java, Spring, Spring MVC, REST Service, Hibernate, JSON, Maven, Log4J, MSSQL, \nAWS, NLP, Python \nCAPITASTAR \nPosition: Solutions architect  \nDomain:  Business, ML \nTeam Size: 16 \nProject Description:  \n\u00a7 \nCapitaStar is a multi-mall, multi-store card-less rewards / customer loyalty program by \nCapitaLand. Star$ is the loyalty point which is redeemable for Capita-Vouchers or other \npromotion gifts from time to time. The CapitaStar member can download the CapitaStar mobile \napp from Google Play or App Store. \nResponsibilities: \n\u00a7 \nWorked with customer to plan the training course. \n\u00a7 \nDesign mockup application structure, database structure. \n\u00a7 \nDeveloped mockup iOS application. \n\u00a7 \nCoding \n\u00a7 \nTraining iOS members: setup environment development, learning iOS Fundamental, \ndeveloping iOS Application\u2026 \n\u00a7 \nSupported iOS members for their homework/exam project. \n\u00a7 \nStudied customer\u2019s business, customer\u2019s application. \n\u00a7 \nWorked with customer to create documents for RD phase: Requirement Confirm Point (RCP) \ntemplate, Effected Source Code template for Modify/Create Screen, Estimated template for \nCoding/Testing, Coding Check Sheet document, \n\u00a7 \nReview Check Sheet document\u2026 \n\u00a7 \nManaged tasks for iOS team to study and develop customer\u2019s application. \n\u00a7 \nReview iOS members\u2019 source code. \n\u00a7 \nDeveloped common/utility/library/base source code. \nTechnologies:  \n\u00a7 \nFront-end: JSP, AngularJS, JQuery, HTML5, CSS. \n\u00a7 \nMobile: Xcode, iOS Fundamental, iOS Application development, Notification, Swift, Firebase, \nREST-full service, WebKit, Core data, Cocoa pod, cocoa control , caching , lazy loading \n\u00a7 \nBack-end: Java, Spring, Spring MVC, RESTful Service, Hibernate, JSON, Maven, Hibernate, \nOCR, LSTM \nNEW UNION \nPosition:  iOS Teamleader  \nDomain:  Business \nTeam Size: 6 \nProject Description:  \n\u00a7 \nNew Union is Singapore's largest Business Financing Platform where local businesses seeking \nshort-term financing connect with individuals and businesses seeking short-term investments. \nResponsibilities: \n\u00a7 \nWorked with my team to analyze requirement about features, UI/UX design. \n\u00a7 \nDesign application structure, database structure. \n\u00a7 \nDesign a networking client to communicate with many Restful/Cloud services. \n\u00a7 \nEncountered to implement many complex animations for UI transition, image loading. \n\u00a7 \nImplemented login, rating and sharing by using Social Network (Facebook, Twitter). \n\u00a7 \nHad challenge with performance, worked with Memory Monitor (a tool in Android Studio) to \nmeasure and optimize memory. \n\u00a7 \nBuild and deploy app to apple store  \nTechnologies:  \n\u00a7 \nFront-end: Wordpress. \n\u00a7 \nMobile: Xcode, iOS Fundamental, iOS Application development, Notification, Swift, Firebase, \nREST-full service, WebKit, Core data, Cocoa pod, cocoa control , caching , lazy loading \n\u00a7 \nBack-end: Java, Spring, Spring MVC, RESTful Service, Hibernate, JSON, Maven, Hibernate \nMAY MAY \nPosition: iOS Teamleader \nDomain: eEommerce, Business \nTeam Size: 4 \nProject Description:  \n\u00a7 \nMayMay app is a Ecargo\u2019s ecommerce product that assist you shop on the go with your mobile \nand/or tablet in the most convenient & fastest manner. You can access exclusive promotions & \ndeals for mobile customers only after installing MayMay app. The auto push notification feature \nwill make sure you won't miss any surprising or limited deals. \nResponsibilities: \n\u00a7 \nWorked with my team to analyze requirement about features, UI/UX design. \n\u00a7 \nDesign application structure, database structure. \n\u00a7 \nTransfer knowledge, business to members. \n\u00a7 \nTechnical Design, developing new features, as well as enhancing and maintaining app. \n\u00a7 \nSupported iOS members for their homework/exam project. \n\u00a7 \nStudied customer\u2019s business, customer\u2019s application. \n\u00a7 \nWorked with customer to create documents for RD phase: Requirement Confirm Point (RCP) \ntemplate, Effected Source Code template for Modify/Create Screen, \n\u00a7 \nEstimated template for Coding/Testing, Coding Check Sheet document, \n\u00a7 \nReview Check Sheet document\u2026 \n\u00a7 \nManaged tasks for iOS team to study and develop customer\u2019s application \nTechnologies:  \n\u00a7 \nMobile : Xcode, iOS Fundamental, iOS Application development, Git, Bootstrap, AngularJs, \nNodeJs, MongoDB, Media Layer, Notification, Core Services Layer, Swift, REST-full service, \nWebKit, Core data, Cocoa pod, cocoa control , caching , lazy loading... \nLG WATCH MANAGER \nPosition: iOS Teamleader \nDomain: eEommerce, Business \nTeam Size: 8 \nProject Description:  \n\u00a7 \nLG Watch Manager connects watch with your iOS mobile device (phones and others). While \nconnected, you can manage watch and installed LG Watch\u2019s apps via LG Watch Manager and \nuse features of the mobile device on the watch. \nResponsibilities: \n\u00a7 \nDesign application structure, database structure \n\u00a7 \nDeveloping new features, as well as enhancing and maintaining app  \n\u00a7 \nEstimated template for Coding/Testing, Coding Check Sheet document \n\u00a7 \nWorked with customer to create documents for RD phase: Requirement Confirm Point (RCP) \ntemplate, Effected Source Code template for Modify/Create Screen \n\u00a7 \nEstimated template for Coding/Testing, Coding Check Sheet document, \n\u00a7 \nManaged tasks for iOS team to study and develop customer\u2019s application. \n\u00a7 \nReview iOS members\u2019 source code \n\u00a7 \nCreate task and assign task for member Check and review code of finish task \nTechnologies:  \n\u00a7 \nMobile : Xcode, iOS Fundamental, iOS Application development, Git, Notification, Core \nServices Layer, Objective-C, REST-full service, WebKit, Core Bluetooth, Bluetooth Manager \nframework, iOS private framework, mDNS (Bonjour service), Core data, Bluetooth LTE and \nbluetooh classic, Local and remote storage \nFPT MOBIPAY \nPosition: iOS Teamleader \nDomain:  Finance, Business \nTeam Size: 8 \nProject Description:  \n\u00a7 \nFPT MobiPay \u2013 is an app Customer bill payments of the services provided as FPT, FPT \nTelecom net, TV FPT and FPT hosting... With features such as assigning employees \nchargeable Employees can search chargeable contract, directions for chargeable staff, update \nall the clients ... \nResponsibilities: \n\u00a7 \nWrite document details design, Technical Proposal document ... \n\u00a7 \nCoding \n\u00a7 \nDesign, developing new features, as well as enhancing and maintaining apap  \n\u00a7 \nEstimated template for Coding/Testing, Coding Check Sheet document,  \n\u00a7 \nReview Check Sheet document\u2026 \n\u00a7 \nManaged tasks for iOS team to study and develop customer\u2019s application. \n\u00a7 \nReview iOS members\u2019 source code \n\u00a7 \nCreate task and assign task for member Check and review code of finish task \n\u00a7 \nDeploy app to FPT store (enterprises plan) \nTechnologies:  \n\u00a7 \nMobile : Xcode, iOS Fundamental, iOS Application development, Git, Media Layer, Notification, \nCore Services Layer Objective C, REST-full service, Using lib, Framework, Google services, \nMap Kit, Work with 3rd software (TPBankMpost), build static lib.. (IOS) Auto layout, size \nClasses... \nFPT TICKET \nPosition: iOS developer \nDomain:  Finance, Business \nTeam Size: 8 \nProject Description:  \n\u00a7 \nMobile Ticket (FPT Ticket) is an app management the ticket system of incident can help users \ncreate, update, an overview of the status of each queue ticket, which will ease the management \nand handling of ticket in the shortest time.... \nResponsibilities: \n\u00a7 \nEstimated template for Coding/Testing, Coding Check Sheet document,  \n\u00a7 \nReport progress to team leader daily. \n\u00a7 \nDevelopment Complete the assigned task and research new technology Development web as \nrequired \nTechnologies:  \n\u00a7 \nMobile : Xcode, iOS Fundamental, iOS Application development, Git, SVN Objective-C, REST-\nfull service, Core Services Layer, Local storage, http connection, mDNS, UTP/TCP connection  \nHI-FPT \nPosition: iOS developer \nDomain:  Finance, Business \nTeam Size: 8 \nProject Description:  \n\u00a7 \nFPT Hi-FPT app report information worker group Deployment / Maintenance by date (contract \nnumber is assigned, the contract finishes and outstanding number of contracts). See list of \noutstanding contracts. Search and update ticket information, Search for customers, view \ncustomer status, number of connections. Allow MAC reset, reset passwords, open IPTV \nstreams, kill the session. Report indicators deployment and maintenance services ADSL / FTTx \n(default within 1 month). Hi-FPT is a tool for check network by mobile device management and \nhandling of ticket in the shortest time \nResponsibilities: \n\u00a7 \nCoding, Fix bug \n\u00a7 \nReport progress to team leader daily. \nTechnologies:  \n\u00a7 \nMobile : Xcode, iOS Fundamental, iOS Application development, Git, SVN Objective-C, REST-\nfull service, Core Services Layer, Local storage, http connection, mDNS, UTP/TCP connection  \nFPT- FGO \nPosition :  Web Developer \nDomain:  Game \nTeam Size: 80 \nProject Description:  \n\u00a7 \nFPT FGO is game portal by FPT company  \nResponsibilities: \n\u00a7 \nReport progress to team leader daily. \n\u00a7 \nCoding, Fix bug \nTechnologies:  \nNodeJs, Express/CompoundJS FrameworkImpactJSJavascript, Impact Engine, Contruc2 Framework, \nJSON, HTML5, CSS3. NoSQL: MongoDB, Redis DB \nTHANK YOU FOR YOUR READING! \nPowered by TCPDF (www.tcpdf.org)", "educations": [{"id": 4715, "gpa": null, "major": "K\u1ef9 thu\u1eadt x\u00e2y d\u1ef1ng c\u00f4ng tr\u00ecnh bi\u1ec3n", "school": "SaiGon University", "diploma": "Bachelors", "end_time": "2011-01-01T00:00:00Z", "conf_score": 0.7859050974591417, "start_time": null, "picklist_major": "Civil/Construction", "major_categories": "Ki\u1ebfn tr\u00fac v\u00e0 x\u00e2y d\u1ef1ng", "major_categories_detail": "X\u00e2y d\u1ef1ng"}], "experiences": [{"id": 15769, "detail": "A solution architect is responsible for the design of one or more applications or services within an organization and is typically part of a solution development team. I must have a balanced mix of technical and business skills, and will often work with an enterprise architect for strategic direction.\n\u00a7 Finding the best tech solution among all possible to solve the existing business problems.\n\u00a7 Describing the structure, characteristics, behavior, and other aspects of software to project stakeholders.\n\u00a7 Defining features, phases, and solution requirements.\n\u00a7 Providing specifications according to which the solution is identified, managed, and delivered\n\u00a7 Provided executive oversight for all projects under the Program managed to ensure smooth project execution, to ensure delivery of quality software products, and to ensure clients are satisfied with the work that projects are doing\n\u00a7 Provided active supports to Project Managers in implementing projects", "company": "FPT SOFTWARE", "end_time": "2023-04-13T00:00:00Z", "industry": "High Technology", "position": "Solutions Architect", "conf_score": 0.8986425279419377, "start_time": "2016-03-01T00:00:00Z"}, {"id": 15773, "detail": "I\u2019s last title during his tenure at H", "company": "HARVEYNASH - NASHTECH", "end_time": "2016-03-31T00:00:00Z", "industry": "High Technology", "position": "Senior Mobile developer / Team leader", "conf_score": 0.8967290006738793, "start_time": "2014-08-01T00:00:00Z"}, {"id": 15776, "detail": "ncludes (but not limited to the following):\n\u00a7 Estimated template for Coding/Testing, Coding Check Sheet document, Review Check Sheet document...\n\u00a7 Managed tasks for iOS team to study and develop customer\u2019s application.\n\u00a7 Review iOS members\u2019 source code.\n\u00a7 Create task and assign task for member Check and review code of finish task\n\u00a7 Main coding (implement feature and fix issues)", "company": "FPT - TELECOM", "end_time": "2014-08-31T00:00:00Z", "industry": "High Technology", "position": "iOS Team leader", "conf_score": 0.8986425279419377, "start_time": "2010-08-01T00:00:00Z"}], "address": null}