{"skills": ["linux", "stack", "aws", "tdd", "scala", "css3", "docker", "graphite", "angular", "symfony", "java", "marketing", "marketo", "mongo", "c++", "java technology", "javascript", "bootstrap", "management", "grafana", "heroku", "salesforce", "spring boot", "frontend development", "test driven development", "html5", "redis", "typescript", "spring", "rabbitmq", "bpm", "mysql", "nginx", "website development", "django", "jira", "inventory management", "le", "software development", "mvc", "golang", "backend development", "jenkins", "google chart", "teamwork", "python", "tizen", "networking", "prometheus", "jasmine", "mocha", "full stack development", "angularjs", "php", "agile", "mssql", "jquery", "google map"], "fulltext": "LE HUYNH NGOC THUY\nkate.le0248@gmail.com\nCONTACT\n6/6F, Street 12, Binh An\nWard, District 2\n(+84)-126-745-8802\nINTRODUCTION\nI'm passionate about building a better world through software development. Interested in new technology, trying to\nimprove myself everyday as technologies are improving. In my opinion, my greatest abilities are my thirst for\nknowledge and my persistence. I believe in people's potential. I think that a team can accomplish almost everything\nwith open-mindedness and a can-do attitude.\nQUALIFICATIONS\nCertifications:\n- Diploma Degree in Software Engineering (FPT Aptech) \n- Bachelor of Information Technology Degree (RMIT University) \nImportant Skills:\n- Best technical skills: Javascript (AngularJS, jQuery, NodeJS), Java, Spring-boot, Golang, Docker, MySQL, Linux, LAMP\n- Best soft skills: Absorb new things, Teamwork, Self-discipline, Organize\nOther technical skills:\n- Agile, Test Driven Development, Domain Driven Development\n- HTML5, CSS3, Bootstrap\n- Jenkins (CI, CD), AWS, Heroku\n- Typescript, Python, Django, C, C++, Sails\nWORK EXPERIENCE\nMyStar-Japan (in Tokyo, Japan)\nJan 2014 \u2014 Jul 2014\nWeb Developer (Mobile - Intern)\nAt MyStar-Japan, I work as a full-stack developer\n- Technologies: AngularJS, jQuery Mobile and PHP (Chamilo framework - a framework that built especially for online\ncourses)\nWebsite: http://www.mystar-japan.biz/\nBeachhead marketing\nJul 2014 \u2014 May 2015\nFullstack Developer\nAt Beachhead Marketing, I work as a full-stack developer\n- Technologies: Marketo, Salesforce, NodeJS, Valilla JS, jQuery, D3.js\nApiumtech\nMay 2015 \u2014 Jun 2017\nLE HUYNH NGOC THUY\n1\nFullstack Developer\n- At Apiumtech, I work as a full-stack engineer\n- Methodologies: Agile, TDD and DDD\n- Technologies: AngularJS, NodeJS, Python, Django, Mongo, Docker, PHP, Java, Scala, MSSQL, MySQL, Jenkins...\n- Website: http://apiumhub.com\nLazada Group\nJuly 2017 \u2014 Present\nSenior Developer\nAt Lazada Group, I work as a backend engineer\nLogistic team:\n- Develop logistic services\n- Technologies: Golang, Docker, Kubernete, RabbitMQ, Redis\nInternal tool team:\n- Develop internal ticketing system. Jira like, allow submitting and processing everyday business issue. Is used by 60+\nbusiness units inside Alibaba corp.\n- Technologies: Java, Spring-boot, Alicloud (for logging), MySQL, MyBatis, BPMS...\nHands-on experience during working time: prometheus, grafana, graphite, message queue, redis...\nEDUCATION\nSoftware Engineer Diploma\nAug 2008 \u2014 Oct 2010\nFPT Aptech\nBachelor of Information Technology\nFeb 2011 \u2014 Feb 2015\nRMIT University Vietnam\nPROJECTS\nCaliCargo\n- Website development with orders & inventory management system.\n- Designed by Webflow tool.\n- Using Yii Framework & AngularJS.\n- My role: Back-end Developer\n- URL: http://calicargo.com/\nKashiwanoha\n- A web-based application that shows user their health statistics (using data from wearables)\n- Use PHP (Chamilo frameword), Angular JS and Bootstrap\n- My contribution: display graph from given data (using Google Chart API), get data from API, build a mobile web\napplication base on given API and UI design.\nForce Manager\nLE HUYNH NGOC THUY\n2\n- Front-end development using AngularJS\n- Javascript MVC\n- Graph manipulation (Plot.js and Google Chart)\n- Jasmine\nAXA Manager\n- AngularJS, NodeJS, MSSQL Server, Docker\n- Javascript MVC, Jasmine, Sinon, Mocha\nRareConnect\n- PHP (Symfony), MySQL, Docker \n- Google Map API, Google Place API\nFalabella\n- Samsung Gear S2 application\n- HTML5, CSS3, JQuery, Tizen\nCl3ver\n- Dashboard management system with workspaces, projects inside workspaces, presentation inside projects,\nresource sharing between users...\n- NodeJS 4.3.2, Typescipt, AngularJS\n- MySQL, Nginx, Docker, Docker Networking, Mocha, Sinon, Jasmine, Electron\n- Microservice, API Authorization, File Upload, PDF file manipulation\nVOLUNTEER\nRMIT Student Ambassador (1 year)\n- Introduce about RMIT IT program with highschool students\n- Be a tour guide for high school students and their parents who are invited to RMIT \nAIESEC Team Member (1 year)\n- Help the marketing department of AIESEC RMIT launch projects\nINTERESTS\n- Book, Movie, Yoga, Charity\nREFERENCES\nReferences available upon request.\nLE HUYNH NGOC THUY\n3", "educations": [{"id": 4720, "gpa": null, "major": "Software Engineer", "school": "FPT Aptech", "diploma": "Other", "end_time": "2010-10-01T00:00:00Z", "conf_score": 0.9210088910403198, "start_time": "2008-08-01T00:00:00Z", "picklist_major": "Other", "major_categories": "", "major_categories_detail": ""}, {"id": 4717, "gpa": null, "major": "K\u1ef9 thu\u1eadt ph\u1ea7n m\u1ec1m", "school": "FPT Aptech", "diploma": "Bachelors", "end_time": null, "conf_score": 0.8673821186853424, "start_time": null, "picklist_major": "IT - Hardware/Networking", "major_categories": "M\u00e1y t\u00ednh v\u00e0 c\u00f4ng ngh\u1ec7 th\u00f4ng tin", "major_categories_detail": "M\u00e1y t\u00ednh"}, {"id": 4718, "gpa": null, "major": "C\u00f4ng ngh\u1ec7 th\u00f4ng tin", "school": "RMIT University", "diploma": "Bachelors", "end_time": null, "conf_score": 0.8363846157740997, "start_time": null, "picklist_major": "IT - Hardware/Networking", "major_categories": "M\u00e1y t\u00ednh v\u00e0 c\u00f4ng ngh\u1ec7 th\u00f4ng tin", "major_categories_detail": "C\u00f4ng ngh\u1ec7 th\u00f4ng tin"}, {"id": 4722, "gpa": null, "major": "C\u00f4ng ngh\u1ec7 th\u00f4ng tin", "school": "RMIT University Vietnam", "diploma": "Bachelors", "end_time": "2015-02-01T00:00:00Z", "conf_score": 0.8298522713442309, "start_time": "2011-02-01T00:00:00Z", "picklist_major": "IT - Hardware/Networking", "major_categories": "M\u00e1y t\u00ednh v\u00e0 c\u00f4ng ngh\u1ec7 th\u00f4ng tin", "major_categories_detail": "C\u00f4ng ngh\u1ec7 th\u00f4ng tin"}], "experiences": [{"id": 15768, "detail": "end engineer\nLogistic team:\n- Develop logistic services\n- Technologies: Golang, Docker, Kubernete, RabbitMQ, Redis Internal tool team:\n- Develop internal ticketing system. Jira like, allow submitting and processing everyday business issue. Is used by 60+ business units inside Alibaba corp.\n- Technologies: Java, Spring-boot, Alicloud (for logging), MySQL, MyBatis, BPMS... Hands-on experience during working time: prometheus, grafana, graphite, message queue, redis...", "company": "Lazada Group", "end_time": "2023-04-13T00:00:00Z", "industry": "High Technology", "position": "Senior Developer", "conf_score": 0.9082763938556836, "start_time": "2017-07-01T00:00:00Z"}, {"id": 15774, "detail": "- At Apiumtech, I work as a full-stack engineer\n- Methodologies: Agile, TDD and DDD - Technologies: AngularJS, NodeJS, Python, Django, Mongo, Docker, PHP, Java, Scala, MSSQL, MySQL, Jenkins... - Website: http://apiumhub.com", "company": "Apiumtech", "end_time": "2017-06-30T00:00:00Z", "industry": "High Technology", "position": "Fullstack Developer", "conf_score": 0.9142206543796373, "start_time": "2015-05-01T00:00:00Z"}, {"id": 15777, "detail": "Technologies: Marketo, Salesforce, NodeJS, Valilla JS, jQuery, D3.js", "company": "Beachhead marketing", "end_time": "2015-05-31T00:00:00Z", "industry": "Other", "position": "Fullstack Developer", "conf_score": 0.9245502357684101, "start_time": "2014-07-01T00:00:00Z"}, {"id": 15780, "detail": "apan, I work as a full-stack developer\n- Technologies: AngularJS, jQuery Mobile and PHP (Chamilo framework - a framework that built especially for online courses)\nWebsite: http://www.mystar-japan.biz/", "company": "Star", "end_time": "2014-07-31T00:00:00Z", "industry": "Other", "position": "Web Developer (Mobile - Intern)", "conf_score": 0.9082763938556836, "start_time": "2014-01-01T00:00:00Z"}], "address": "6/6f, Street 12, Binh An Ward, District 2"}