{"skills": ["search", "machine learning", "ethereum", "diffie hellman", "cryptography", "microservices", "elliptic curve cryptography", "github", "kafka", "golang", "python", "firebase", "data warehouse", "elliptic curve", "redis", "search engine", "mysql", "io", "docker compose", "program debugging", "cnn", "time tracking", "database", "nats", "cloud service", "ams", "docker", "cloud", "jenkins", "sphinx", "android", "rest", "business analyst", "bitcoin", "analyst", "hadoop", "mongodb", "apns", "google cloud platform", "google cloud", "kera"], "fulltext": "559 Ho\u00e0ng Sa, Qu\u1eadn 3, TPHCM\n0784907915\nmrthien30@gmail.com\n\ufffd github.com/thien1212381\nPhuoc Thien Lam\nI love data, want to work with a highly scalable system and big data, I have 2+ years of experience building a system\nwith Golang, Nodejs language, deploying services, building a data pipeline. I am looking for working at creative and\nmore challenging environments.\nSummary Summary    \n02/2017 - now\n08/2016 - 12/2016\n08/2016 - 02/2017\nBackend & System Leader\nSkylab Technology Cooperation\n+ REST API and CMS website with Golang, Nodejs, Python\n    - Store and Manage user information system\n    - Trip Social network system: friends, followers, plans, and trips.\n    - Book Social Network System: user, books (users want to share and find)\n    - Food Social Network System: user, sharing food images with location\n+ Building Real-time tracking location system with Nodejs and MongoDB\n+ Building Real-time chat system with Nodejs, SocketIO, and MongoDB\n+ Pushing notification with Firebase, APNS-P8\n+ Working with the Search engine: Sphinx, Solr\n+ Researching Elliptic curve cryptography, Ethereum, and Bitcoin core to generate ETH, BTC wallets from random,\nbuild encrypt end-to-end system (Elliptic curve Diffie Hellman)\n+ Building Microservices with Golang (use gRPC - Protobuf) to store transactions, and store tokens of addresses in\nEthereum Network\n+ Building notification system for new transaction of subscribed address in ETH, BTC, LTC, DOGE Network.\n+ Working the message queue: Kafka, NATS, Redis\n+ Deploying services in Amazon Cloud Services (EC2) and Google Cloud Platform  with docker and docker-compose\n+ Building the CI/CD system for automatically deploying Golang services, and building Android - IOS Applications with\nJenkins\n+ Building Recommendation books system from friends. (base on user-user and user-book)\n+ Crawling book information from Tiki.\n+ Crawling food images from Instagram, Google.\n+ Crawling food location from Foody.\n+ Database: Postgres, Mysql, Mongodb\n+ Recognizing food images (CNN model with Keras framework)\nData Engineer\nGrokking Data Engineer Course\n+ Building Data Pipeline to Data warehouse for an e-commerce startup. (using Kafka, Hadoop, Spark). Data from two\nsources: one is from real-time event data, two is from the production database (Postgres)\n+ Visualizing data for business analyst from Data warehouse (Reports)\n+ Building Real-time monitoring dashboard: active users, trending video ... (using Nodejs, SocketIO, and Redis)\nJunior Machine Learning Engineer\nWork experience\nWork experience    \n https://www.visualcv.com/-llpfdyel8u\nGoodia Viet Nam\n+ Social Listening from pages in Instagram\n+ Analyst user influence by calculating the score of some keywords in social. (base on Tf-IDF).\n2012 - 2016\nBachelor of Information Technology\nHo Chi Minh University of Science - HCMUS\nEducation Education    \nHadoop, Spark, Pig, Hive\nDatabase\nDeploy system\nGolang\nNodejs\nPython\nDebugging\nPrograming skills\nPrograming skills    \nReading Science Books, especially about Physical, Universal\nHobby Hobby    \n https://www.visualcv.com/-llpfdyel8u", "educations": [{"id": 4711, "gpa": null, "major": "C\u00f4ng ngh\u1ec7 th\u00f4ng tin", "school": "Ho Chi Minh University of Science - HCMUS", "diploma": "Bachelors", "end_time": "2016-01-01T00:00:00Z", "conf_score": 0.8141298764232529, "start_time": "2012-01-01T00:00:00Z", "picklist_major": "IT - Hardware/Networking", "major_categories": "M\u00e1y t\u00ednh v\u00e0 c\u00f4ng ngh\u1ec7 th\u00f4ng tin", "major_categories_detail": "C\u00f4ng ngh\u1ec7 th\u00f4ng tin"}], "experiences": [{"id": 15757, "detail": "+ REST API and CMS website with Golang, Nodejs, Python - Store and Manage user information system\n- Trip Social network system: friends, followers, plans, and trips.\n- Book Social Network System: user, books (users want to share and find)\n- Food Social Network System: user, sharing food images with location\n+ Building Real-time tracking location system with Nodejs and MongoDB + Building Real-time chat system with Nodejs, SocketIO, and MongoDB + Pushing notification with Firebase, APNS-P8 + Working with the Search engine: Sphinx, Solr + Researching Elliptic curve cryptography, Ethereum, and Bitcoin core to generate ETH, BTC wallets from random, build encrypt end-to-end system (Elliptic curve Diffie Hellman) + Building Microservices with Golang (use gRPC - Protobuf) to store transactions, and store tokens of addresses in\nEthereum Network + Building notification system for new transaction of subscribed address in ETH, BTC, LTC, DOGE Network. + Working the message queue: Kafka, NATS, Redis + Deploying services in Amazon Cloud Services (EC2) and Google Cloud Platform with docker and docker-compose\n+ Building the CI/CD system for automatically deploying Golang services, and building Android - IOS Applications with\nJenkins + Building Recommendation books system from friends. (base on user-user and user-book)\n+ Crawling book information from Tiki. + Crawling food images from Instagram, Google. + Crawling food location from Foody. + Database: Postgres, Mysql, Mongodb + Recognizing food images (CNN model with Keras framework)", "company": "Skylab Technology Cooperation", "end_time": "2023-04-13T00:00:00Z", "industry": "High Technology", "position": "Backend & System Leader", "conf_score": 0.9071692562673327, "start_time": "2017-02-01T00:00:00Z"}, {"id": 15758, "detail": "+ Social Listening from pages in Instagram + Analyst user influence by calculating the score of some keywords in social. (base on Tf-IDF).", "company": "Goodia Viet Nam", "end_time": "2017-02-28T00:00:00Z", "industry": "Other", "position": "Junior Machine Learning Engineer", "conf_score": 0.8986425279419377, "start_time": "2016-08-01T00:00:00Z"}], "address": "559 Ho\u00e0ng Sa, Qu\u1eadn 3, Tphcm"}