{"skills": ["networking", "phonegap", "css", "agile", "analysis", "ionic", "structure", "reactjs", "html", "full stack development", "bidding", "mysql", "symfony", "wordpress", "javascript framework", "project management", "jquery", "angular", "marketing", "marketing strategy", "stack", "javascript", "material ui", "swift", "protocol", "elearning", "crm", "laravel", "bootstrap", "reds", "teamwork", "php", "backend development", "business analyst", "problem solving skill", "analyst", "maintenance", "management", "medium", "restful", "problem solving"], "fulltext": "Hung Pham\nProduct Lead\n\uf0e0 hungphambms@gmail.com\n \uf095 0938.068.100\n \uf041 Ho Chi Minh, Vietnam\nADDITIONAL INFORMATION\nI worked for a startup company in Singapore. After that, I worked in all three countries - Singapore, Indonesia and\nMalaysia - to support this project. During this time, I learned a lot about teamwork, problem solving and product\nthinking.\nExperienced Project Manager with a demonstrated history of working in the information technology and services\nindustry. Skilled Angular, NodeJs, Hybrid Mobile App, Agile Methodologies. \nStrong program and project management professional with a Technology Information focused in Computer\nSystems Networking and Telecommunications from University Of Science Ho Chi Minh City.\nINTERESTS\nBeing technically minded, I enjoy reading science fiction which allows me to exercise the creative parts of my\nthought processes, which in turn develops my problem solving skills. When I have freetime, I research new\ntechnology, new design style and learn more marketing strategy.\nUniversity Of Science Ho Chi\nMinh City\nOct 2010 - May 2014\nMajor: Software Engineer\nGPA: 9.3/10\nEDUCATION\nFull Stack Developer\nSep 2013 - Sep 2015\nSocial Interactive Company Limited\nResponsible for working closely with customers, business analysts, solution\nengineers, team members and leadership to understand business\nrequirements that drive the analysis and design of quality technical solutions\nacross multiple projects.\nProject Manager\nSep 2015 - Mar 2016\nSocial Interactive Company Limited\nResponsible for working closely with customers, business analysts, solution\nengineers, team members and leadership to understand business\nrequirements that drive the analysis and design of quality technical solutions\nacross multiple projects.\nFull Stack Developer\nMar 2016 - 2017\nThe Agency Viet Nam\nI develop the applications and program website for client. I received the\ninformation and templates from the designer team, then to develop the\napplications, softwares or websites for my company.\nEXPERIENCE\nSenior Product Engineer\nMar 2017 - Present\nAnyMind Group\n- The primary responsibility of this position will be developing new features\nof our website, as well as maintaining existing features.\n- Develop web-based applications and enhancements that meet user\nrequirements and follow design standards\n- Analyze problems as assigned, and provide a structured solution\nSoin CRM\nNov 2015 - Nov 2015\nPosition: Backend Developer\nSoin CRM is our own product. It helps small and medium companies\nmanage their client's information and their business. By using Soin CRM,\ncompanies can be sure each request will be served, each quotation will be\nfollowed, each contract will be tracked and each invoice will be managed.\n- Organize the system structure and data\n- Assign tasks to members\n- Build API for mobile applications\nTechnology: PHP/MySQL (Yii framework), jQuery, Bootstrap\nMore Rewardz\nJan 2015 - Jan 2016\nProject Manager\nmoreREWARDZ.com was founded by Welson Ang in 2015. Wanting to help\nSME's come up with business solutions to cope with the rapidly growing\nmobile market is the main reason moreREWARDZ.com was formed. \nLink: http://morerewardz.com/\n- Organize the system structure and data \n- Assign tasks to members \n- Build API for mobile applications\n- Contact with customer to get requirements\nTechnology: PHP/MySQL (Yii framework), jQuery, Bootstrap, Phonegap,\nAngular 1\nFisher Price Vietnam\nSep 2014 - Sep 2015\nProject Manager\nFisher Price Vietnam is multi-platform for business. Include: Website\nApplication, Mobile Application. This project help company manage products\nand events for.\nLink: https://phuongnga.com/\n- Organize the system structure and data \n- Assign tasks to members \n- Build API for mobile applications\n- Contact with customer to get requirements\nTechnology: PHP/MySQL (Yii framework), jQuery, Bootstrap\nLocal Tutors\nJan 2014 - Jan 2015\nProject Manager\nLocal Tutors is an eLearning system. It helps students find appropriate\nteachers for subjects they want to learn.We help LocalTutors company on\nplanning,designing, programming an maintenance.\nLink: http://localturors.ca/\nMY PROJECTS\n- Organize the system structure and data \n- Assign tasks to members \n- Contact with customer to get requirements\nTechnology: PHP/MySQL (Yii framework), jQuery, Bootstrap\nMTCM Tracker\nDec 2013 - Jan 2014\nFullstack Developer\nWe built this ERP solutions to help MTC manage their teachers, students,\nclasses, courses, grades, semesters, ... With our solutions, they can run\ntheir business smoother and more efficiently.\nLink: http://massagetherapycollege.com/\n- Organize the system structure and data \n- Assign tasks to members\nTechnology: PHP/MySQL, jQuery, Bootstrap\nTechnology: PHP/MySQL (Yii framework), jQuery, Bootstrap\nBeauty Bid\nJan 2014 - Jan 2015\nFullstack Developer\nBeauty Bid is a bidding flatform. Customers and Providers can meet together\nat Beauty Bid.We built the whole flatform for a US client.We help them\nplanning, designing, programming, data entry and maintenance.\nLink: http://beautybid.com/\n- Organize the system structure and data \n- Assign tasks to members\nTechnology: PHP/MySQL (Yii framework), jQuery, Bootstrap\nApplication Platform\nSep 2014 - Dev 2017\nProject Manager\nCreate an app effortlessly with our platform for your brand. Big apps idea\ngives you full control from functionality to aesthetic and your app will be\nunique and exclusive to your brand.\nLink: http://viviapps.com/\n- Organize the system structure and data\n- Assign tasks to members\n- Build API for mobile applications\n- Contact with customer to get requirements\nTechnology: PHP/MySQL (Yii framework), Bootstrap, Phonegap, Angular\nWyndham Garden Ph\u00fa Qu\u1ed1c\nMar 2017 - May 2017\niOS Developer\nApplying Wyndham Garden Phu Quoc provides an overview, impression,\nand lively on the Wyndham Garden Resort in Phu Quoc Island. The\napplication will help you understand Wyndham Garden Phu Quoc, the\npioneer real estate project for the style of \"Private Villas\" in Vietnam.\nLink: https://itunes.apple.com/us/app/wyndham-garden-ph%C3%BA-\nqu%E1%BB%91c/id1267244792?mt=8\nTechnology: Swift 3\nTopaz Twins\nMay 2017 - Sep 2017\nWebsite Developer\nIt is a challenge to make applications for buildings that do not exist\u2026 yet.\nBut it\u2019s a challenge that we willingly accept and conquer.Our website brings\nthe impressive Topaz Twins building \u2013 the soon-to-be new symbol of\nmetropolitan Bien Hoa City \u2013 to life, in all its greatness and glory.\nLink: http://topaztwins.com/\n- Build HTML / CSS for frontend\n- Build backend with Wordpress CMS\nTechnology: PHP/MySQL (Wordpress), jQuery, Bootstrap\nRed Bean - ezPark\nFeb 2017 - July 2018\nFull Stack Developer\nThe Red Bean Technology Solution Co\nProvides to the customers of the solution of the ezPark tool, make the\nmaximum performance with the logical cost, fit with the use of the user use\nand support support in the active protocol information and community\ncommunity.\n @me: \n- Technical support for all members\n- Build structure and define best practise for project\nTechnologo: NodeJS, Angular\nAdAsia Digital Platform for\nPublishers\nMay 2018 - Present\nWebsite Developer\nAdAsia Digital Platform is the one-stop solution for marketers, advertisers\nand publishers. \nPowered by AI, this innovative platform brings the best of modern marketing\nonto a single dashboard. AdAsia Digital Platform integrates the best\nsolutions from across the advertising technology stack: real-time buying\ntools, social targeting, as well as data and ad verification partners.\n @me: \n - The primary responsibility of this position will be developing new features\nof our website, as well as maintaining existing features.\n- Develop web-based applications and enhancements that meet user\nrequirements and follow design standards\n- Analyze problems as assigned, and provide a structured solution\nTechnologo: Angular 6, Material UI\nAgile Methodologies\nRESTful WebServices\nPHP / MySQL\nSymfony Framework\nLaravel Framework\nJavascript\nAngular JS\nNode JS\nSKILLS\nReact JS\nIonic Framework\njQuery\nWordPress\nHTML / CSS\n\u00a9 topcv.vn", "educations": [{"id": 4712, "gpa": null, "major": "M\u1ea1ng m\u00e1y t\u00ednh v\u00e0 truy\u1ec1n th\u00f4ng d\u1eef li\u1ec7u", "school": "University Of Science Ho Chi Minh City", "diploma": "Bachelors", "end_time": null, "conf_score": 0.8300731565898793, "start_time": null, "picklist_major": "IT - Hardware/Networking", "major_categories": "M\u00e1y t\u00ednh v\u00e0 c\u00f4ng ngh\u1ec7 th\u00f4ng tin", "major_categories_detail": "M\u00e1y t\u00ednh"}, {"id": 4713, "gpa": "9.3", "major": "Software Engineer", "school": "University Of Science Ho Chi Minh City", "diploma": "Bachelors", "end_time": "2014-05-01T00:00:00Z", "conf_score": 0.8418756527141341, "start_time": "2010-10-01T00:00:00Z", "picklist_major": "Other", "major_categories": "", "major_categories_detail": ""}], "experiences": [{"id": 15759, "detail": "- The primary responsibility of this position will be developing new features of our website, as well as maintaining existing features.\n- Develop web-based applications and enhancements that meet user requirements and follow design standards\n- Analyze problems as assigned, and provide a structured solution", "company": "AnyMind Group", "end_time": "2023-04-13T00:00:00Z", "industry": "Other", "position": "Senior Product Engineer", "conf_score": 0.9171087048027518, "start_time": "2017-03-01T00:00:00Z"}, {"id": 15760, "detail": "I develop the applications and program website for client. I received the information and templates from the designer team, then to develop the applications, softwares or websites for my company.", "company": "The Agency Viet Nam", "end_time": "2017-01-31T00:00:00Z", "industry": "Other", "position": "Full Stack Developer", "conf_score": 0.9171087048027518, "start_time": "2016-03-01T00:00:00Z"}, {"id": 15761, "detail": "Responsible for working closely with customers, business analysts, solution engineers, team members and leadership to understand business requirements that drive the analysis and design of quality technical solutions across multiple projects.", "company": "Social Interactive Company Limited", "end_time": "2016-03-31T00:00:00Z", "industry": "Other", "position": "Project Manager", "conf_score": 0.9253303199186127, "start_time": "2015-09-01T00:00:00Z"}, {"id": 15762, "detail": "Responsible for working closely with customers, business analysts, solution engineers, team members and leadership to understand business requirements that drive the analysis and design of quality technical solutions across multiple projects.", "company": "Social Interactive Company Limited", "end_time": "2015-09-30T00:00:00Z", "industry": "Other", "position": "Full Stack Developer", "conf_score": 0.9171087048027518, "start_time": "2013-09-01T00:00:00Z"}], "address": "Ho Chi Minh, Vietnam"}