{"skills": ["memcached", "search", "sourcetree", "git", "css", "html", "reactjs", "redis", "amp", "css3", "mysql", "bitbucket", "redux", "jquery", "mobx", "marketing", "sales", "html5", "javascript", "payment", "apache", "database", "sc", "nginx", "laravel", "bootstrap", "restful", "jenkins", "frontend development", "php", "teamwork", "gulp", "sphinx", "data structure", "gitlab", "redmine"], "fulltext": "Tr\u1ea7n Thanh \u0110\u1ea1m\nFullStack/ReactJs Developer\n 415/25 Truong Chinh street, Tan\nBinh district, HCM City\n ttdam92@outlook.com\nDropouts\nCONTACT\n\uf015\n\uf003\nEDUCATION\nInformation Technology\nTay Do University| 10/ 2010 - 06/ 2012\n 0939 071 958\n Bac Lieu\n 01/06/1992\n linkedin.com/in/henrytran92\n Single\n HCM City\n- Develop, upgrade and maintain company's e-commerce website\n- Integrated Bagasus Logistics API\n- Execute landing pages for sales event\n- Communicate with other developers to find solutions and resolve problems.\n- Report to Team Leader\nLanguages and Techs:\n+ Website developed based on Prestashop CMS\n+ Front-end: Javascript, jQuery, Bootstrap, CSS3, HTML5\n+ Back-end: PHP (Prestashop CMS), MySQL, Memcached, RESTful API\n+ Source Control: Git/Gitlab\nTake care project https://www.sosanhgia.com\n- Work directly to the Director to make plans and develop features\n- Communicate with other developers to find solutions and resolve problems.\n- Create task schedules and report to the Director\n- Research and make suggestions (Functioning, Layout, UX)\n- Integrated Google AMP, Structured data for better SEO.\n- Optimize backend and frontend code for high performance, SEOs and high\nEXPERIENCES\nPHP Developer\nPhuc Hai, LTD| 02/ 2016 - 11/ 2016\nSenior PHP Developer\nKeycap JSC| 12/ 2016 - 04/ 2018\n\uf095\n\uf041\n\uf073\n\uf0e1\n\uf184\n\uf1b6\nSKILLS\nPHP\nJavascript\nCSS3/SASS/LESS\nMySQL\nApache, Nginx,\nLunix\nReactJS/Redux\nRedis, Elastic\nsearch\nTeamwork\nLANGUAGES\nEnglish\nWorking knowledge\nINTERESTS\nMusic, Book, Travel, Movie, Manga\nranked Google PageSpeed\nLanguages and Techs:\n+ Front-end: HTML, Javascript/jQuery/Gulp, CSS/SCSS\n+ Back-end: Phalcon PHP\n+ Database: MySQL, Sphinx\n+ Source control: Bitbucket, SourceTree\n- Develop Login/Payment gateway for web game\n- Create, integrate & maintain API for game\n- Support other teams (Product team, Marketing team)\n- Work directly to Director/Team leader to make plant and develop new features\nLanguages & techs:\n- PHP and PHP Frameworks (Laravel, Zend)\n- MySQL, Elastic search, Redis\n- CSS/SCSS\n- ReactJS, Redux, Js, jQuery\n- Git/Bitbucket, Sourcetree, Jenkins, Redmine...\n- Take care, develop new version for frontend project of giig.asia - a influencer\nplatform.\n- Convert static layouts design on Figma to cool application.\n- We (my team) meeting every morning to reporting task progress, share ideas\nand discuss to resolve problems.\nLanguages & techs:\n- ReactJs, Mobx, Mobx State Tree, Webpack\n- HTML5/CSS3/SCSS/Bootstrap\nFullStack Developer\nMySquar Limited| 05/ 2018 - 11/ 2018\nSenior Frontend Developer\nTicketBox Co Ltd| 11/ 2018 - Present", "educations": [{"id": 4714, "gpa": null, "major": "C\u00f4ng ngh\u1ec7 th\u00f4ng tin", "school": "Tay Do University", "diploma": "Bachelors", "end_time": "2012-06-01T00:00:00Z", "conf_score": 0.8087261703987104, "start_time": "2010-10-01T00:00:00Z", "picklist_major": "IT - Hardware/Networking", "major_categories": "M\u00e1y t\u00ednh v\u00e0 c\u00f4ng ngh\u1ec7 th\u00f4ng tin", "major_categories_detail": "C\u00f4ng ngh\u1ec7 th\u00f4ng tin"}], "experiences": [{"id": 15763, "detail": "- Take care, develop new version for frontend project of giig.asia - a influencer platform.\n- Convert static layouts design on Figma to cool application.\n- We (my team) meeting every morning to reporting task progress, share ideas and discuss to resolve problems.\nLanguages & techs:\n- ReactJs, Mobx, Mobx State Tree, Webpack - HTML5/CSS3/SCSS/Bootstrap", "company": "TicketBox Co Ltd", "end_time": "2023-04-13T00:00:00Z", "industry": "Other", "position": "Senior Frontend Developer", "conf_score": 0.902768374209996, "start_time": "2018-11-01T00:00:00Z"}, {"id": 15764, "detail": "- Develop Login/Payment gateway for web game\n- Create, integrate & maintain API for game\n- Support other teams (Product team, Marketing team)\n- Work directly to Director/Team leader to make plant and develop new features\nLanguages & techs:\n- PHP and PHP Frameworks (Laravel, Zend) - MySQL, Elastic search, Redis - CSS/SCSS - ReactJS, Redux, Js, jQuery", "company": "MySquar Limited", "end_time": "2018-11-30T00:00:00Z", "industry": "Other", "position": "FullStack Developer", "conf_score": 0.902768374209996, "start_time": "2018-05-01T00:00:00Z"}, {"id": 15765, "detail": "Take care project https://www.sosanhgia.com\n- Work directly to the Director to make plans and develop features\n- Communicate with other developers to find solutions and resolve problems.\n- Create task schedules and report to the Director - Research and make suggestions (Functioning, Layout, UX) - Integrated Google AMP, Structured data for better SEO. - Optimize backend and frontend code for high performance, SEOs and high\nMusic, Book, Travel, Movie, Manga ranked Google PageSpeed Languages and Techs: + Front-end: HTML, Javascript/jQuery/Gulp, CSS/SCSS + Back-end: Phalcon PHP + Database: MySQL, Sphinx + Source control: Bitbucket, SourceTree", "company": "Keycap JSC", "end_time": "2018-04-30T00:00:00Z", "industry": "Other", "position": "Senior PHP Developer", "conf_score": 0.902768374209996, "start_time": "2016-12-01T00:00:00Z"}, {"id": 15766, "detail": "- Develop, upgrade and maintain company's e-commerce website\n- Integrated Bagasus Logistics API - Execute landing pages for sales event\n- Communicate with other developers to find solutions and resolve problems.\n- Report to Team Leader PH Languages and Techs: + Website developed based on Prestashop CMS + Front-end: Javascript, jQuery, Bootstrap, CSS3, HTML5 + Back-end: PHP (Prestashop CMS), MySQL, Memcached, RESTful API + Source Control: Git/Gitlab", "company": "Phuc Hai, LTD", "end_time": "2016-11-30T00:00:00Z", "industry": "Other", "position": "PHP Developer", "conf_score": 0.902768374209996, "start_time": "2016-02-01T00:00:00Z"}], "address": "415/25 Truong Chinh street, Tan Binh district, Hcm City"}