{"skills": ["search", "behat", "phpunit", "css", "c++", "testing", "extjs", "credential", "structure", "reactjs", "html", "linux", "redis", "search engine", "ubuntu", "mysql", "symfony", "android sdk", "jquery", "san", "mssql", "swagger", "unit test", "sql", "le", "c#", "elasticsearch", "macos", "javascript", "payment", "rabbitmq", "sencha touch", "laravel", "bootstrap", "docker", "restful", "php", "android", "angularjs", "identity", "mongodb", "linq", "centos", "maintenance", "management", "cordova", "asp"], "fulltext": "GIA HOANG NGUYEN \nBlock A3 - Room 17.16 - Dat Gia Apartment, Cay Keo Street, Tam Phu Ward, Thu Duc \nDistrict, HCM City \ndev.hoanggia@gmail.com - 0988 300 782 \nSenior PHP Developer\nI love my job, code and responsibility. I\u2019m excited to learn new something. \nI usually research and development as:  \n- Basic knowledge of program language  \n- Try read and do a lot of projects \n- Improve English \nEnvironments \nWindow, Linux (Centos, Ubuntu), MacOS, Docker \nProgramming \nPHP, C/C++/C#, HTML, CSS, ASP.NET, JavaScript, jQuery, \nAngularJs, ExtJs, MySQL, No-SQL (Mongodb)  \nProfessional Experience \nSenior PHP Developer\nAug 2016 \u2013 Present \nTiki - 52 Ut Tich, Tan Binh, HCM \nResponsibility: Improve new feature, maintenance the API service, fix the bug. Leader \nmyself to complete the task \nSelected projects include\u2026  \n\u25cfPayment service: Connect to all gateway payment, execute and save all transaction \n-\nConnect payment gateway (Cybersource, 123pay, Momo, Zalopay, Onepay) \n-\nDevelop API by design \n-\nMaintain and upgrade feature structure \n-\nTesting by Unit test/Function test \n-\nDevelop worker async data to other system \n-\nTechnology: Laravel,PHP , MySQL, RESTful, PHPUnit \n\u25cfTala: Supply data for all Platform via API  \n-\nMaintain and develop API \n-\nIntegration with orther service \n-\nDevelop feature function at frontend and backend \n-\nTechnology: Phalcon, PHP, RabbmitMQ, Redis, MySQL, MongoDB, \nElasticsearch \nSenior PHP Developer\nDec 2015 \u2013 Aug 2016  \nZinio - Flemington Tower, Le Dai Hanh St, District 11, HCM \nSelected projects include\u2026  \n\u25cfIdentity service, Catalog service, Ecommerce service: Micro Service ecosystem, \nsupply data to all Platform \n-\nBuild the API through Micro Sevice ecosystem \n-\nDevelop Search Engine \n-\nImprove system\u2019s performance \n-\nMaintain and ensure that the system is not downtime \n-\nTesting by Unit test/Function test \n-\nWrite documentation for API \n-\nTechnology: Symfony 2.8, MySQL, PHPUnit, Behat, RabbitMq, Redis, \nElacticsearch, Swagger \nPHP Developer\nAug 2014 \u2013 Dec 2015 \nCCIntegration Inc -  55-57 Nguyen Van Giai St, DaKao, District 1, HCM \nSelected projects include\u2026  \n\u25cfMobile App Hybrid: Supply report, forecast \n-\nData analytic \n-\nBuild the API to supply data for reporting \n-\nTechnology: Android Sdk, Cordova, Sencha touch \n\u25cfSPIDER: Production and warehouse management system for CCIntegration store \nin San Jose, CA, US \n-\nBuild the Front-end base on AngularJs \n-\nCreate widget and upgrade project structure \n-\nDevelop async processing and multi-thread to create report data  \n-\nTechnology: Symfony, AngularJs, ExtJs, MySQL, MongoDB, Bootstrap, \nRabbitMq \nPHP Developer\n  Feb 2014 \u2013 Jul 2014  \nMox Deals  -  35 Ton Duc Thang St, District 1, HCM \nSelected projects include\u2026  \n\u25cfMox.vn: Website mox.vn \n-\nDevelop ecommerce by Shopware \n-\nDevelop frontend \n-\nDevelop new function on backend \n-\nConnect API from giaohangnhanh.vn and maintain this function \n-\nTechnology: PHP, Shopware, ExtJs, MySQL \nPHP Developer\nSep 2011 \u2013 Feb 2014 \nOnlinE Solution Co. Ltd  - 18 Street, Hiep Binh Chanh, Thu Duc, HCM \nSelected projects include\u2026  \n\u25cfBoat management: \n-\nDevelop feature fuction \n-\nDevelop frontend by design \n-\nTechnology: Asp.net, C#, Linq, MsSQL, jQuery \n\u25cfHanam.com.vn: ecommerce website \n-\nDevelop feature fuction \n-\nDevelop frontend by design \n-\nDevelop function in backend \n-\nConvert PSD to HTML \n-\nTechnology: PHP, Tomato cart, MySQL, ExtJs \n-\nEducation & Credentials  \nSoftware Engineering - Faculty of Information Technology  \nHo Chi Minh City University of Food Industry \nSep 2008 \u2013 Sep 2011 \nCourse \nDuong Minh Language School \nReactJs on Lynda.com ", "educations": [{"id": 4726, "gpa": null, "major": "C\u00f4ng ngh\u1ec7 th\u00f4ng tin", "school": "Ho Chi Minh City University of Food Industry", "diploma": "Bachelors", "end_time": "2011-09-01T00:00:00Z", "conf_score": 0.8089896898335842, "start_time": "2008-09-01T00:00:00Z", "picklist_major": "IT - Hardware/Networking", "major_categories": "M\u00e1y t\u00ednh v\u00e0 c\u00f4ng ngh\u1ec7 th\u00f4ng tin", "major_categories_detail": "C\u00f4ng ngh\u1ec7 th\u00f4ng tin"}], "experiences": [{"id": 15800, "detail": "- 52 Ut Tich, Tan Binh, HCM Responsibility: Improve new feature, maintenance the API service, fix the bug. Leader myself to complete the task\nSelected projects include...\n\u25cfPayment service: Connect to all gateway payment, execute and save all transaction\n- Connect payment gateway (Cybersource, 123pay, Momo, Zalopay, Onepay) - Develop API by design\n- Maintain and upgrade feature structure\n- Testing by Unit test/Function test\n- Develop worker async data to other system\n- Technology: Laravel,PHP , MySQL, RESTful, PHPUnit \u25cfTala: Supply data for all Platform via API - Maintain and develop API - Integration with orther service\n- Develop feature function at frontend and backend\n- Technology: Phalcon, PHP, RabbmitMQ, Redis, MySQL, MongoDB, Elasticsearch", "company": "Tiki", "end_time": "2023-04-13T00:00:00Z", "industry": "High Technology", "position": "Senior PHP Developer", "conf_score": 0.8433865074357395, "start_time": "2016-08-01T00:00:00Z"}, {"id": 15801, "detail": "- Flemington Tower, Le Dai Hanh St, District 11, HCM Selected projects include...\n\u25cfIdentity service, Catalog service, Ecommerce service: Micro Service ecosystem, supply data to all Platform - Build the API through Micro Sevice ecosystem\n- Develop Search Engine - Improve system\u2019s performance\n- Maintain and ensure that the system is not downtime\n- Testing by Unit test/Function test\n- Write documentation for API - Technology: Symfony 2.8, MySQL, PHPUnit, Behat, RabbitMq, Redis,", "company": "Zinio", "end_time": "2016-08-31T00:00:00Z", "industry": "Other", "position": "Senior PHP Developer", "conf_score": 0.892504248099113, "start_time": "2015-12-01T00:00:00Z"}, {"id": 15802, "detail": "- 55-57 Nguyen Van Giai St, DaKao, District 1, HCM Selected projects include...\n\u25cfMobile App Hybrid: Supply report, forecast\n- Data analytic\n- Build the API to supply data for reporting\n- Technology: Android Sdk, Cordova, Sencha touch\n\u25cfSPIDER: Production and warehouse management system for CCIntegration store in San Jose, CA, US - Build the Front-end base on AngularJs - Create widget and upgrade project structure\n- Develop async processing and multi-thread to create report data\n- Technology: Symfony, AngularJs, ExtJs, MySQL, MongoDB, Bootstrap, RabbitMq", "company": "CCIntegration Inc", "end_time": "2015-12-31T00:00:00Z", "industry": "Other", "position": "PHP Developer", "conf_score": 0.9142206543796373, "start_time": "2014-08-01T00:00:00Z"}, {"id": 15803, "detail": "- 35 Ton Duc Thang St, District 1, HCM Selected projects include...\n\u25cfMox.vn: Website mox.vn\n- Develop ecommerce by Shopware - Develop frontend\n- Develop new function on backend\n- Connect API from giaohangnhanh.vn and maintain this function\n- Technology: PHP, Shopware, ExtJs, MySQL", "company": "Mox Deals", "end_time": "2014-07-31T00:00:00Z", "industry": "Other", "position": "PHP Developer", "conf_score": 0.9125776658202421, "start_time": "2014-02-01T00:00:00Z"}, {"id": 15804, "detail": "- 18 Street, Hiep Binh Chanh, Thu Duc, HCM Selected projects include...\n\u25cfBoat management:\n- Develop feature fuction\n- Develop frontend by design\n- Technology: Asp.net, C#, Linq, MsSQL, jQuery \u25cfHanam.com.vn: ecommerce website\n- Develop feature fuction\n- Develop frontend by design\n- Develop function in backend\n- Convert PSD to HTML - Technology: PHP, Tomato cart, MySQL, ExtJs", "company": "OnlinE Solution Co. Ltd", "end_time": "2014-02-28T00:00:00Z", "industry": "High Technology", "position": "PHP Developer", "conf_score": 0.9125776658202421, "start_time": "2011-09-01T00:00:00Z"}], "address": "Block A3 - Room 17.16 - Dat Gia Apartment, Cay Keo Street, Tam Phu Ward, Thu Duc District, Hcm City"}