{"skills": ["sc", "angular", "internet", "java", "wordpress", "javascript", "ams", "es6", "management", "restful webservices", "frontend development", "object oriented", "git", "svn", "html", "typescript", "css", "restful", "grunt", "webpack", "le", "github", "testing", "reactjs", "online education", "angular 2", "gulp", "jasmine", "angularjs", "bootstrap", "jquery"], "fulltext": "Tran Quoc Huy\nFRONTEND DEVELOPER\n0983 688 845 \nhuy.pkc@gmail.com \nlinkedin.com/in/huypkc \n115/9 Le Trong Tan,  \nTan Phu, TP.HCM \nhttps://github.com/huypkc \nprofile\nPhone \nEmail \nLinkedln \nAddress \nGithub\nskills\nFocus and analyze\nWork with team or \nalone well\nGood in English\nGood responsibility\nSelf-study\nTypescript, Javascript \nES5/ES6 \nAngular 1/2, ReactJS \nCSS/SCSS \nVersion control tools: \nGit, SVN\nUsing package and \ntask manager tools: \nWebpack, Grunt, \nGulp...\nTesting: Jasmine\nHaving knowledge \nabout backend: Java, \nNodeJS\nI have a good command of programming, object \noriented programming, computer architechture \nand i am good in English. In addition, I am active \nand enthusiastic. I am willing to learn and do \nwhat takes to get a job done well even under \npressure or on far mission.\nabout\nMusic, Movie, Sport, Motorbike, Travelling \nand Photography\nhobbies \nGood bachelor degree for falculty of electronic and \ntelecomunication\neducation\nUNIVERSITY OF SCIENCE\n2010-2014\nTran Quoc Huy\nFRONTEND DEVELOPER\nImplement an education project that convert flash \nfiles to HTML files. \n- Familiar with HTML, Javascript, CSS, SVG and \nanimation. \nManage source code.\nFix bugs for a movie platform like Netflix. \n- Familiar with HTML, Javascript, Jquery, CSS.  \nexperience\nFpt software | Fresher\n2014-2016\nTake part in implement feature for an online \neducation platform which provides portals to \norganizations, so they can train theirs staffs well. \n- Use AngularJS, Angular Material, Angular \nbootstrap, SCSS, Gulp, Grunt, Webpack. \nImplement landing page for SEO. \n- Use AngularJS, ES5, typescript, Integrate with \nWordpress. \nImplement an pet project to demo. \n- Use Angular 2, typescript, D3 with SVG.  \nGO1 | Frontend Developer\n2016-1/2018\nExperienced Frontend Developer with a demonstrated\nhistory of working in the internet industry. Skilled in\nHTML, Javascript, CSS, Angular, React, RESTful\nWebServices. Strong engineering professional with a\nBachelor\u2019s Degree focused in programming from HCM\nUniversity of Science. \nCreate an admin page for carpark system. \n-  Use Angular 6, SCSS Typescript, Observable, \nRestful, Intergrate with client's backend. Work \ndirectly with client.  \nCreate a Project and Staff Management system. \n- Use Angular 6, SCSS, Typescript, Observable, \nRestful. Work directly with client. \nUser Experience Researchers \n| Frontend Developer\n5/2018\nPowered by TCPDF (www.tcpdf.org)", "educations": [{"id": 4733, "gpa": null, "major": "Kinh t\u1ebf c\u00f4ng nghi\u1ec7p", "school": "UNIVERSITY OF SCIENCE", "diploma": "Bachelors", "end_time": "2014-01-01T00:00:00Z", "conf_score": 0.8816606736829975, "start_time": "2010-01-01T00:00:00Z", "picklist_major": "Technical", "major_categories": "C\u00f4ng ngh\u1ec7 k\u1ef9 thu\u1eadt", "major_categories_detail": "Qu\u1ea3n l\u00fd c\u00f4ng nghi\u1ec7p"}], "experiences": [{"id": 15834, "detail": "Take part in implement feature for an online education platform which provides portals to organizations, so they can train theirs staffs well.\n- Use AngularJS, Angular Material, Angular bootstrap, SCSS, Gulp, Grunt, Webpack. Implement landing page for SEO. - Use AngularJS, ES5, typescript, Integrate with\nWordpress. Implement an pet project to demo.\n- Use Angular 2, typescript, D3 with SVG.", "company": "GO1", "end_time": "2018-01-31T00:00:00Z", "industry": "Other", "position": "Frontend Developer", "conf_score": 0.9313320685594104, "start_time": "2016-01-01T00:00:00Z"}, {"id": 15837, "detail": "Implement an education project that convert flash files to HTML files.\n- Familiar with HTML, Javascript, CSS, SVG and animation.\nManage source code.\nFix bugs for a movie platform like Netflix. - Familiar with HTML, Javascript, Jquery, CSS.", "company": "Fpt software", "end_time": "2016-01-31T00:00:00Z", "industry": "High Technology", "position": "Fresher", "conf_score": 0.9154503444304597, "start_time": "2014-01-01T00:00:00Z"}], "address": "115/9 Le Trong Tan, Tan Phu, Tp.hcm"}