{"skills": ["search", "studio", "java", "css", "git", "c++", "maven", "svn", "internet", "jira", "teamcity", "structure", "html", "redis", "design pattern", "ubuntu", "mysql", "java core", "tool support", "io", "snmp", "swagger", "sql", "visual studio", "sell", "c#", "oop", "javascript", "swift", "mvvm", "protocol", "rabbitmq", "xml", "mvc", "restful", "hibernate", "php", "mariadb", "problem solving skill", "spring", "jms", "management", "asp", "data structure", "eclipse ide", "problem solving"], "fulltext": "1 \nR\u00c9SUM\u00c9  \nDANG PHUOC BINH \nPERSONAL INFORMATION  \nBirthday: February 25th, 1990 \nGender: Male \nAddress:  285/3/9 Vo Thi Sau, Phu Dong commune, Nhon Trach district,  Dong Nai \nprovide \nPhone number: +84768103435 \nE-mail: dpbinh252@gmail.com \nSkype: dpbinh252 \nTECHNICAL SKILLS \n\u2022 I have studied C++/C#/PHP/VB.Net/Java/Sql languages in university \n\u2022 Have solid fundamental of OOP, MVC, MVVM, Java core, extended stuffs \nsuch as XML. \n\u2022 Experience in data structure and design patterns. \n\u2022 Experience in Maven, Spring, Hibernate, Redis, RabbitMQ. \n\u2022 Experience in SQL Server, MySQL. \n\u2022 Experience with various skills like Html, Css, Javascript  \nWORK SKILLS  \n\u2022 English: Be able to communicate with the others via chat, email. \n\u2022 Be familiar with develop tools such as Jira, Crucible and Confluence, teamcity. \n\u2022 Be familiar with Eclipse IDE, Intellij, Visual Studio, SVN and GIT. \n\u2022 Be comfortable with Ubuntu OS \nWORK HISTORY \n\u2022 Java developer \u2013 Contentnet ( January 2018 Present ) \n\u2022 Support tool developer - Vietinbank bank ( December 2015 \u2013 December 2017 ) \n\u2022 Java developer \u2013 TMA Solution ( November 2013 \u2013 December 2015 ) \n2 \nPROJECTS ATTEENDED \nDESCRIPTION \nTECHNOLOGIES \nAMS ( TMA Solution ) \n(This is a single project I have worked for 2 years) \nIt combines 2 parts a client and a server to manage \nstatus, upgrade software of the Network Element (NE) \nsuch as GPON, ISAM and their relatives via SNMP \nprotocol. \nMy duties is fix bugs and develop new feature for \nBackup/Restore and Software Management component. \nBackup/restore respond for backup and restore NE \nsoftware and information for that NE, Software \nmanagement respond for install or uninstall NE Software \non NE. \n- \nJava \n- \nHibernate \n- \nSpring \n- \nMySQL/MariaDB \n- \nJMX \n- \nJMS \n- \nEclipse RCP \nPortable Thermal Print without Driver ( Vietinbank ) \nCombine 2 parts runtime service and UI \nApplication. \nRuntime Service is a service on window, it will \nwaiting and receive command via socket connection, then \ntranslate that command to hexacode and send it to thermal \nprinter. \nUI application is a UI interface to interact with user \nto get data and build command and send to Service via \nsocket connection. We have so many UI application like \nSEC Printer, Receipt Voucher Printer \u2026.  \n- \nC# \n- \nWindow Service \n- \nWPF \n- \nMVVM \n- \nLog4Net \nCapture Lync Message System ( Vietinbank ) \nCombine 3 parts client runtime service, center \nserver and administrator web interface. \nClient is a runtime background application that will \ncapture Lync message and attach file and then stored in \nlocal temp, the temp file was encoded, and all temp data \nwill be send to server at next login. \nServer get data from client and store it along with \nthat sent user. The message will be filter to find out bad \nmessage and report it. \nAdministrator monitoring by web interface, can \nfilter by time, search by content and get restore old file \nwhich was sent. \n- \nC# \n- \nASP.NET MVC5 \n- \nLog4Net \n- \nMVVM \n- \nSQL Server \n3 \nSell Support App on IOS ( Vietinbank) \nApp combines 2 parts iOS client app and web \nservice server. \nIOS app is an application (iPad) support for sell \ndepartment, show sell information, file, achiverments\u2026 \nall data is stored in local which will be sync when device \nget connected to network. \nWeb Service is a Restful service to provide data for \niOS client application. \n- \nSwift 2 \n- \nC# \n- \nASP.NET MVC5 \n- \nSQL Server \nVideofly.vn  ( Contentnet ) \nThe video sharing platform, separated videos by \ncategories and genres, the system can auto crawl suitable \nvideos from the internet, and user can upload heavy video \nto this system. \n- \nJava \n- \nSpring \n- \nMySql \n- \nHibernate \n- \nRabbitMQ \n- \nRedis \n- \nSwagger \nEDUCATION \n\u2022 Engineer\u2019s degree in Information Technology Department in University Of \nScience, 2008 \u2013 2013.  \n\u2022 Major: Software Engineering \nMYSELF \n\u2022 I\u2019m willing to learn every technologies and process. \n\u2022 Target: Complete myself via working. That means I can manage time and \nassigned tasks effectively. Thus, I would improve the solving problems skill. \n\u2022 I\u2019m responsibility and enthusiastic person.  \nPowered by TCPDF (www.tcpdf.org)", "educations": [{"id": 4739, "gpa": null, "major": "C\u00f4ng ngh\u1ec7 th\u00f4ng tin", "school": "University Of Science", "diploma": "Engineer", "end_time": "2013-01-01T00:00:00Z", "conf_score": 0.8162640198969072, "start_time": "2008-01-01T00:00:00Z", "picklist_major": "IT - Hardware/Networking", "major_categories": "M\u00e1y t\u00ednh v\u00e0 c\u00f4ng ngh\u1ec7 th\u00f4ng tin", "major_categories_detail": "C\u00f4ng ngh\u1ec7 th\u00f4ng tin"}], "experiences": [{"id": 15845, "detail": "", "company": "Contentnet", "end_time": "2023-04-13T00:00:00Z", "industry": "Other", "position": "Java developer", "conf_score": 0.7551834254203837, "start_time": "2018-01-01T00:00:00Z"}, {"id": 15847, "detail": "", "company": "Vietinbank bank", "end_time": "2017-12-31T00:00:00Z", "industry": "Banking", "position": "Support tool developer", "conf_score": 0.9050765977702602, "start_time": "2015-12-01T00:00:00Z"}, {"id": 15848, "detail": "", "company": "TMA Solution", "end_time": "2015-12-31T00:00:00Z", "industry": "High Technology", "position": "Java developer", "conf_score": 0.9050765977702602, "start_time": "2013-11-01T00:00:00Z"}], "address": "285/3/9 Vo Thi Sau, Phu Dong commune, Nhon Trach district, Dong Nai"}