{"skills": ["studio", "c++", "testing", "analysis", "automation", "automation test", "python", "project management software", "desktop", "automation testing", "project management", "api testing", "selenium", "visual studio", "c#", "devops", "zephyr", "business requirement", "object oriented", "docker", "lifecycle", "software development", "business analyst", "problem solving skill", "analyst", "hp", "management", "restful", "problem solving"], "fulltext": "Curriculum Vitae \nName \nBUI DUC VIET \nNationality \nVIET NAM \nDate of Birth \n1990/08/17 \nGender \nMale \nAddress \n370 TO KY , TAN CHANH HIEP Ward, \nDistrict 12, HCM City, VIET NAM \nTelephone \n076 884 92 93 \nE-mail \nbuiducviet.90@gmail.com  \nSummary \nSix years\u2019 experience in software industry as test engineer in both manual and automation. Involved in \nmany phases of typical Software Development Lifecycle such as analyzing business requirements, \ntesting, researching and training new technologies. \nWorking Experience \n2012-Now: LogiGear \nProjects: \n- \nTest Architect: automation test tool which used to test desktop app, mobile app and \nweb app. Able to integrate with test manager tools such as TFS, Zephyr and HP Quality \nCenter. \n- \nTA4VS: automation test tool which integrated with Visual Studio and TFS ecosystem. \nUsing Coded UI technique. \nRole:  \n- \nSenior Test Engineer (manual and automation), DevOps. \nResponsibilities: \n- \nPlaying role as key member. Joining review and analyzing requirement.  \n- \nPlanning and managing testing tasks of member. \n- \nProviding solution for automation testing and solving automation issue. \n- \nTraining member. \n- \nInvolve in building and managing CI/CD process. \nAwards: \n- \nTop/star employee. \n- \nEmployee of the Year 2013. \n2012: University \nProject:  \n- \nE-Health System (capstone project): provides a solution to apply IT to manage business \nprocesses of Tan Binh hospital. Customer Anh Quan Company (www.edusoft.net.vn). \nRole: Business Analyst, Test Leader. \nEducation Background \nVan Lang University: \nStudied Carnegie Mellon University (CMU) program at Information Technology faculty, Van Lang \nUniversity. Graduated July, 2012. \nCertificates from Carnegie Mellon University. \n- \nFundamentals of Computing 1 \n- \nIntroduction To Software Engineering \n- \nIntroduction to Computer Networks and Communication \n- \nFundamentals of Computing 2 \n- \nObject Oriented Programming-C++ \n- \nRequirement Engineering \n- \nSoftware Project Management \n- \nComputer Science for Practicing Engineers \n- \nSoftware Testing \n- \nSoftware Measurement and Analysis \n- \nApplication Development Practices \nAwards:  \n- \nBoeing Scholarship for CMU program. \n- \nVan Lang University Scholarship. \nSkill \nManagement skill \n- \nGood manage and training team member. \n- \nGood understanding in software development life cycle (Scrum). \nProgramming skill \n- \nFamiliar with Python and C# programming language. \n- \nFamiliar with API testing (RESTFul and SOAP). \n- \nExperienced with Selenium WebDriver. \n- \nExperienced with setting up and using Docker. \n- \nHave deep knowledge in integrating with external system (TFS, VSTS, QC and Zephyr). \nSoft skill \n- \nQuick learning \n- \nPresentation skill \n- \nListening skill \n- \nProblem solving \n- \nSelf-motivated ", "educations": [{"id": 4746, "gpa": null, "major": "C\u00f4ng ngh\u1ec7 th\u00f4ng tin", "school": "Carnegie Mellon University", "diploma": "Bachelors", "end_time": "2012-07-01T00:00:00Z", "conf_score": 0.8702898102044851, "start_time": null, "picklist_major": "IT - Hardware/Networking", "major_categories": "M\u00e1y t\u00ednh v\u00e0 c\u00f4ng ngh\u1ec7 th\u00f4ng tin", "major_categories_detail": "C\u00f4ng ngh\u1ec7 th\u00f4ng tin"}], "experiences": [{"id": 15883, "detail": "rojects:\n- Test Architect: automation test tool which used to test desktop app, mobile app and web app. Able to integrate with test manager tools such as TFS, Zephyr and HP Quality Center. - TA4VS: automation test tool which integrated with Visual Studio and TFS ecosystem.\nUsing Coded UI technique.\nRole: - Se Responsibilities: - Playing role as key member. Joining review and analyzing requirement.\n- Planning and managing testing tasks of member.\n- Providing solution for automation testing and solving automation issue.\n- Training member.\n- Involve in building and managing CI/CD process.\nAwards: - Top/star employee.\n- Employee of the Year 2013.", "company": "LogiGear", "end_time": "2023-04-13T00:00:00Z", "industry": "Other", "position": "Senior Test Engineer (", "conf_score": 0.8575748913651169, "start_time": "2012-01-01T00:00:00Z"}], "address": "370 To Ky , Tan Chanh Hiep Ward, District 12, Hcm City, Viet Nam"}