{"skills": ["java", "css", "json", "svn", "singleton", "tomcat", "html", "ajax", "spring mvc", "design pattern", "synchronization", "mysql", "swing", "jquery", "sql", "c#", "javascript", "strut", "apache solr", "digital signature", "query performance", "apache", "database", "spring boot", "jsp", "index", "xml", "javafx", "mvc", "bootstrap", "hibernate", "php", "teamwork", "android", "tester", "jsf", "spring", "postgresql", "management", "asp", "restful", "problem solving"], "fulltext": "Nguyen Van Nhan \nDate of birth: 20/08/1994  \nGender: Male \nPhone: 0962 62 67 24 \nEmail: nhannguyen1494z@gmail.com \nSkype: nhannguyen1494 \nAddress: Ho Chi Minh, Vietnam \nWORK EXPERIENCE \nJuly 2016 - Current \nNewSaigonSoft \nPosition: Java Developer \nWork description: Participated in building and developing company's products in the field of \nElectronic Government. \nProjects have joined: \n\u2022 NeoDoc (Document management software and work profile) \n- Project description: Maintained and customized existing modules and add new modules. \n- Project scale: 6-8 people worked in 18 months. \n- Responsibilities: Developer to implement code of modules based on design document \nprovided by customer and coordinate with the tester to test. Optimize SQL Server query \nperformance \u2013 Statistics, Joins and Index Tuning. Fix bugs by the customer feedback. \n- Technologies: Liferay, Frimefaces, HTML, CSS, Javascript, Jquery, Ajax, Postgres SQL, \nTomcat, Apache Solr. \n\u2022 UserSupportSystem \n- Project description: The building and development of software in the field of logistics for \ncustomers. Include: Digital signature, Notifications, Data synchronization, Control data from the \nscanner & printer. \n- Project scale: 1 person worked in 2 months. \n- Responsibilities: Developer to implement code of modules based on design document \nprovided by customer and coordinate with the tester to test. Fixed bugs by the customer \nfeedback. \n- Technologies: Liferay , Websocket, Primeface, Postgres SQL, Tomcat, JavaFX. \n\u2022 DataDumpSystem \n- Project description: Dumped data from old version (old software other) to new version (new \nsoftware) for customer. \n- Project scale: 2 people worked in 1.5 months. \n- Responsibilities: Developer do building of modules based on old database provided by \ncustomer with design document and coordinate with the tester to test. Fixed bugs by the \ncustomer feedback. \n- Technologies: Liferay, Primeface, Postgres SQL, MySql, SQLServer, Tomcat. \n\u2022 NeoCalendar \n- Project description: Maintained and customized existing modules and add new modules. \n- Project scale: 4-6 people worked in 6 months. \n- Responsibilities: Developer to implement code of modules based on design document \nprovided by customer and coordinate with the examiner to test. Fixed bugs by the customer \nfeedback. \n- Technologies: Liferay , Frimefaces, HTML, CSS, Javascript, Jquery, Ajax, Postgres SQL, \nTomcat. \nJan 2016 \u2013 Mar 2016 \nFPT-SOFTWARE DA NANG \n- Position: INTERNSHIP STUDENT (JAVA). \n- Responsibilities: Web application development. \n- Accomplishments: Attained profound knowledge about Java, Jsp&Servlet, MVC, SQL, \nBootstrap, Struts1.0.  Analysed application functions.  Reported on daily tasks to the manager \n- Projects (Mockprojects): FastFood Order, Car Management, Nursery School Management \n(Module: People). \nSKILLS \n\u2022 Proficient Java EE technologies and frameworks include Liferay Portal, Primefaces, JSF, \nSwing, JavaFX, WebSocket, and basic Struts 1.x/2.x, JSP/Servlet, Spring (Spring MVC, Spring \nBoot), Hibernate. \n\u2022 Solid knowledge in web technologies: HTML, CSS, Javascript, Jquery, Ajax, Bootstrap. \n\u2022 Experience with databases: PostgreSQL, SQL Server, My SQL. \n\u2022 Report: Jasper report, xDocReport, Apache POI. \n\u2022 Version control: SVN. \n\u2022 Basic use with RESTful/SOAP web service, JSON, XML. \n\u2022 Good understanding some design patterns as Singleton Pattern, Factory Pattern, Prototype \nPattern... \n\u2022 Other programming languages can use: Java/Android, C#/Asp.net, PHP, C. \n\u2022 English: Basic communication, good reading and writing ability. \nOther skills:  \n\u2022 \nCapable of teamwork or work independently in high pressure. \n\u2022 \nHas strong logic thinking and problem solving methods. \n\u2022 \nGood time management and teamwork skills. \n\u2022 \nAbility to adapt quickly to change \nEDUCATION \nSep 2012 \u2013 June 2016 \nQuy Nhon University \n  Major: Information technology. \n  Graduated in 2016 ", "educations": [{"id": 4765, "gpa": null, "major": "C\u00f4ng ngh\u1ec7 th\u00f4ng tin", "school": "Quy Nhon University", "diploma": "Bachelors", "end_time": "2016-06-01T00:00:00Z", "conf_score": 0.9119894974954739, "start_time": "2012-09-01T00:00:00Z", "picklist_major": "IT - Hardware/Networking", "major_categories": "M\u00e1y t\u00ednh v\u00e0 c\u00f4ng ngh\u1ec7 th\u00f4ng tin", "major_categories_detail": "C\u00f4ng ngh\u1ec7 th\u00f4ng tin"}], "experiences": [{"id": 15938, "detail": "Work description: Participated in building and developing company's products in the field of\nElectronic Government. Projects have joined:\n\u2022 NeoDoc (Document management software and work profile)\n- Project description: Maintained and customized existing modules and add new modules.\n- Project scale: 6-8 people worked in 18 months.\n- Responsibilities: Developer to implement code of modules based on design document provided by customer and coordinate with the tester to test. Optimize SQL Server query performance - Statistics, Joins and Index Tuning. Fix bugs by the customer feedback.\n- Technologies: Liferay, Frimefaces, HTML, CSS, Javascript, Jquery, Ajax, Postgres SQL, Tomcat, Apache Solr. \u2022 UserSupportSystem - Project description: The building and development of software in the field of logistics for customers. Include: Digital signature, Notifications, Data synchronization, Control data from the scanner & printer.\n- Project scale: 1 person worked in 2 months.\n- Responsibilities: Developer to implement code of modules based on design document provided by customer and coordinate with the tester to test. Fixed bugs by the customer feedback.\n- Technologies: Liferay , Websocket, Primeface, Postgres SQL, Tomcat, JavaFX. \u2022 DataDumpSystem - Project description: Dumped data from old version (old software other) to new version (new software) for customer.\n- Project scale: 2 people worked in 1.5 months.\n- Responsibilities: Developer do building of modules based on old database provided by customer with design document and coordinate with the tester to test. Fixed bugs by the customer feedback.\n- Technologies: Liferay, Primeface, Postgres SQL, MySql, SQLServer, Tomcat. \u2022 NeoCalendar - Project description: Maintained and customized existing modules and add new modules.", "company": "NewSaigonSoft", "end_time": "2023-04-13T00:00:00Z", "industry": "Other", "position": "Java Developer", "conf_score": 0.9317965926091344, "start_time": "2016-07-01T00:00:00Z"}, {"id": 15940, "detail": "- Responsibilities: Web application development.\n- Accomplishments: Attained profound knowledge about Java, Jsp&Servlet, MVC, SQL, Bootstrap, Struts1.0. Analysed application functions. Reported on daily tasks to the manager\n- Projects (Mockprojects", "company": "FPT - SOFTWARE DA NANG", "end_time": "2016-03-31T00:00:00Z", "industry": "High Technology", "position": "Developer", "conf_score": 0.8971789259804579, "start_time": "2016-01-01T00:00:00Z"}], "address": "Ho Chi Minh, Vietnam"}