{"skills": ["css", "git", "ruby", "automation", "svn", "automation test", "firebase", "jira", "html", "reactjs", "google cloud function", "process management", "ubuntu", "mysql", "azure", "wordpress", "es6", "redux", "security", "cloud function", "nosql", "azure devops", "unit test", "sql", "bug fixing", "devops", "apollo", "database", "analytics", "positive attitude", "mobile application", "hr analytics", "ams", "cloud", "heroku", "rail", "graphql", "mongodb", "maintenance", "management", "google cloud", "trello", "owl"], "fulltext": "1 / 4\nTO THANH THUONG\nSenior ReactJS Developer\n\uf076Phone: 0986335807\n\uf076Email: thuongthanhto@gmail.com\n\uf076Skype: live:thuongthanhto\n\uf076Birthday: 29/05/1995\nSUMMARY\n\uf076I have more than 2 years of experience in ReactJS, and work on many technologies. I \nalways aspire to discover new knowledge. I can adapt quickly to new technology. I am \nhappy to work in a close team environment. I always apply a positive attitude to every task I \nundertake.\n\uf076I have knowledge about Frontend, Backend and DevOps\n\uf076I have the ability to research new technologies quickly and apply them to projects.\nTECHNICAL SKILLS\n\uf076Programming Technology: \n\u2022\nFrontend: React, Redux, GraphQL, HTML, CSS, ES6, Flow\n\u2022\nBackend: Nodejs (Loopback and Express), Google Cloud Functions, GraphQL\n\u2022\nDatabase: NoSQL (MongoDB, Firebase), SQL (MS SQL, MySQL)\n\u2022\nDevOps: Azure Clouds, Google Cloud Functions, Heroku.\n\u2022\nOther skill: Unit Test, Automation Test.\n\uf076Programming Tools: Git, Visual Code, SVN, Trello, Jira, Slack, Skype.\n\uf076Platforms: Ubuntu and Window.\nEDUCATION, PROFESSIONAL CERTIFICATION AND WORKING\n\uf076Study at University Information Technology (UIT) HCMC (2013 \u2013 2017).\n\uf076Certification GST rank A of FPT Software HCMC.\n2 / 4\n\uf076Certification Fresher of FPT Software HCMC\n\uf076ReactJS Developer at FPT Software from 5-2016 to 5-2018 (Job rank: Level 3/5)\n\uf076Currently, I am working at Golden Owl Company with role is ReactJS Developer\nPROFESSIONAL EXPERIENCE \nDecember 2018 \u2013 Now\nReactJS Developer\nProject: Zetya\nProject Description: \nIt is a plugin of wordpress help manage user.\nIndustry Domain: Management.\nResponsibilities: \n    Write Unit Test.\nTeam size: 8 members \nTechnologies used: ReactJS, Ruby on rail\nOct 2018 \u2013 December 2018\nReactJS Developer\nProject: Libra\nProject Description: \nIt is a website help manage Interview candiates and simplify the interview process.\nIndustry Domain: Interview process management.\nResponsibilities: \n    Coding new feature, maintain, write Unit Test and Automation Test .\nTeam size: 3 members \nTechnologies used: ReactJS, Redux, Apollo GraphQL, Google Cloud Funcions\nJun 2018 \u2013 Oct 2018\nReactJS Developer\nProject: Tab-group\nProject Description: \nBooking hotel and review trip travel\nIndustry Domain: Hotel and Travel\nResponsibilities: \n     Coding new feature \n3 / 4\nTeam size: 5 members \nTechnologies used: NodeJS, ReactJS, Redux\nJan 2018\n  \u2013 May 2018\nFullStack Developer\nProject: HDA\nProject Description: \nHDA is a web have function same with grab and uber. It is a mobile application and web \nplatform handle booking car.\nIndustry Domain: Booking car\nResponsibilities: \n    Coding new feature \nTeam size: 10 members \nTechnologies used: Express, ReactJS, Redux\nOct\n  2017 \u2013 \n Dec 2017\nReactJS Developer\nProject: Surroundview\nProject Description: \nHRDigital's surround-view is a mobile application and web platform that enables consistent \nanonymous feedback exchange and HR analytics. It supports employees in their personal \nand professional development, thus maximizing their contribution to organizational change \nand corporate success. Surround-view utilizes state-of-the-art security technology and a \ncloud-based architecture.\nIndustry Domain: Web working with feedback\nResponsibilities: \n- Coding (Front-end)\n- Maintenance & Bug fixing. \nTeam size: 5 members \nTechnologies used: .NET WebAPI, ReactJS, Redux\nMay\n  2016 \u2013 \n Oct\n  2017 \nReactJS Developer\nProject: BrainStore\nProject Description: \n4 / 4\nProject help to maintenance and develop new features for a website of customer. This \nwebsite help user on user creating topics, ideas and setting up relevant meetings to discuss \nabout these topics and ideas. It also helps user on store/edit document online and share \nacross user within Cooperate \nIndustry Domain: Web management \nResponsibilities: \n- Coding (Front-end)\n- Maintenance & Bug fixing. \nTeam size: 3 members \nTechnologies used: .NET WebAPI, ReactJS, Redux", "educations": [{"id": 4766, "gpa": null, "major": null, "school": "University Information Technology (UIT)", "diploma": "Bachelors", "end_time": "2017-01-01T00:00:00Z", "conf_score": 0.7451550827626201, "start_time": "2013-01-01T00:00:00Z", "picklist_major": "Other", "major_categories": "", "major_categories_detail": ""}], "experiences": [{"id": 15939, "detail": "", "company": "Golden Owl Company", "end_time": "2023-12-31T00:00:00Z", "industry": "Other", "position": "ReactJS Developer", "conf_score": 0.7544028141321215, "start_time": "2023-04-01T00:00:00Z"}, {"id": 15941, "detail": "Project: Zetya Project Description: It is a plugin of wordpress help manage user.\nIndustry Domain: Management. Responsibilities: Write Unit Test. Team size: 8 members\nTechnologies used: ReactJS, Ruby on rail", "company": null, "end_time": "2023-04-13T00:00:00Z", "industry": "Other", "position": "ReactJS Developer", "conf_score": 0.6981244904084882, "start_time": "2018-12-01T00:00:00Z"}, {"id": 15942, "detail": "Project Description: HDA is a web have function same with grab and uber. It is a mobile application and web platform handle booking car.\nIndustry Domain: Booking car\nResponsibilities: Coding new feature", "company": "HDA", "end_time": "2018-05-31T00:00:00Z", "industry": "Other", "position": "FullStack Developer", "conf_score": 0.83162404355802, "start_time": "2018-01-01T00:00:00Z"}, {"id": 15943, "detail": "b rank: Level 3/5) Curr", "company": "FPT Software", "end_time": "2018-05-31T00:00:00Z", "industry": "High Technology", "position": "ReactJS Developer", "conf_score": 0.7715988181426042, "start_time": "2016-05-01T00:00:00Z"}, {"id": 15944, "detail": "Project: Surroundview Project Description: HRDigital's surround-view is a mobile application and web platform that enables consistent anonymous feedback exchange and HR analytics. It supports employees in their personal and professional development, thus maximizing their contribution to organizational change and corporate success. Surround-view utilizes state-of-the-art security technology and a cloud-based architecture.\nIndustry Domain: Web working with feedback\nResponsibilities: - Coding (Front-end) - Maintenance & Bug fixing.\nTeam size: 5 members\nTechnologies used: .NET WebAPI, ReactJS, Redux", "company": "HDA", "end_time": "2017-12-31T00:00:00Z", "industry": "Other", "position": "ReactJS Developer", "conf_score": 0.6981244904084882, "start_time": "2017-10-01T00:00:00Z"}], "address": null}