{"skills": ["angular", "responsive", "javascript", "c#", "sales", "mobile device", "management", "studio", "excel", "gitlab", "safety management", "frontend development", "sql database", "entity framework", "power bi embedded", "jquery", "git", "svn", "linq", "project management", "ajax", "database development", "asp", "desktop", "website development", "sql", "css", "visual studio", "microsoft visual studio", "microsoft", "mvc", "database", "angular 2", "product management", "swagger", "bootstrap", "mssql", "html", "google map"], "fulltext": "PERSONAL INFORMATION \nName: Tu Truong Anh \nDate of birth: March 29, 1988 \nGender: Male \nNationality: Vietnam \nEmail:  \nPhone:  \nSUMMARY \nPrimary skills \n\u2022 Have nearly 3 years of experience in .NET MVC, .NET Core Framework \n\u2022 Have 2 years of experience in Angular 2-3-4-5-6 \n\u2022 Have good experience in Power BI report. \n\u2022 Have extensive experience in Web development \n\u2022 Have extensive experience in Application development \n\u2022 Have good experience in SQL Database  \nEDUCATION \n2001 \u2013 2013: Aptech Certified Computer Professional, CNC Aptech - Ho Chi Minh City.  \n2014 \u2013 2016: BSc (Hons) Computing programme, London School of Commerce \u2013 London.  \nDecember 2018: BI Reporting Certification of Microsoft \nLANGUAGES \nVietnamese: Native language \nEnglish: Fluently \nEMPLOYMENT HISTORY \nFebruary 2018 to current time: NOIS CO., LTD. \nEXPERIENCE \nNovember 2016 to December 2017: 5STARS Software Solution, Company Software Engineer \nFebruary 2018 to the current time:  NOIS Co., Company Software Engineer \nPROJECTS \nDMS (Distributor Management System)  \nProject Description \nThis is a website application designed for the management of sale employees. It can \nsynchronize data between mobile devices to server. A sale-man can get data every \nmorning to start working and synchronize data to the server at end of the day. \nTechnology \n\u2022 Asp.net Webform \n\u2022 Google maps API.  \n\u2022 SQL server \n\u2022 JavaScript, JQuery, Ajax, CSS, , Bootstrap \nEnvironment \n\u2022 Visual Studio IDE \n\u2022 SQL database server. \n\u2022 SVN Source Control System. \nSCC Management \nProject Description \nThis is a web application that provides functionalities of product management, \npromotion management and order management. \nTechnology \n\u2022 Asp.net Webform \n\u2022 .Net framework 4.6 \n\u2022 Google maps API.  \n\u2022 JavaScript, JQuery, Ajax, CSS, Swagger, Bootstrap, Angular JS \nEnvironment \n\u2022 Visual Studio IDE \n\u2022 SQL database server.  \n\u2022 SVN Source Control System. \nVadodara Municipal Corporation (VMC App) \nProject Description \nThis is a project that combines web application and mobile application. It was \ndesigned mainly for Vadodara citizens. It provides many features like zoo, plant \ngarden, heritages information. By using app, user also can submit complaints, \nreports of services in Vadodara, or ask for an urgent help from hotline number.  The \nproject has mobile application and web portal for normal users and an admin portal \nfor admins to manage application data. \nTechnology \n\u2022 .NET Core 2.0 \n\u2022 Entity Framework, LinQ \n\u2022 SQL server \n\u2022 Angular 5 \n\u2022 JavaScript, JQuery, Ajax, CSS, Swagger, Bootstrap \nEnvironment \n\u2022 Visual Studio IDE \n\u2022 Visual Studio Code \n\u2022 SQL database server. \n\u2022 Gitlab Source Control System. \nMaxell \u2013 Flight Safety Management  \nProject Description \nMaxell is a project for flight safety management of Snokcoot Airlines.  \nTechnology \n\u2022 .NET Core 2.0, LinQ \n\u2022 Sharepoint List, Microsoft Flow \n\u2022 Angular 6 \n\u2022 JavaScript, JQuery, Ajax, CSS, Swagger, Bootstrap \nEnvironment \n\u2022 Visual Studio IDE \n\u2022 Visual Studio Code \n\u2022 Microsoft Sharepoint \n\u2022 Gitlab Source Control System. \nAlythex \nProject Description \nAlythex application is an application that developed to embed Power BI report as \nwell as to manage the report data source. From the admin side, an admin can \nmodify the data and this data will be displayed in the report in client portal. This \nproject has combined .Net Core API and Angular 4 Framework to manage for both \nadmin site and client side.  \nTechnology \n\u2022 .NET Core 2.0 \n\u2022 Entity Framework, LinQ \n\u2022 SQL server \n\u2022 Angular 5 \n\u2022 JavaScript, JQuery, Ajax, CSS, Swagger, Bootstrap \nEnvironment \n\u2022 Visual Studio IDE \n\u2022 Visual Studio Code \n\u2022 SQL database server. \n\u2022 Gitlab Source Control System. \n\u2022 Power BI desktop \nPower BI Embedded \nProject Description \nThis is an application that embedded a power BI report in a website. The report data \nis connected from SQL server database and excel files, and it can automatically \nrefresh periodically through Power BI gateway. \nTechnology \n\u2022 Asp.Net MVC 4.0  \n\u2022 SQL server \n\u2022 Power BI Service \n\u2022 Power BI Data gateway \n\u2022 JavaScript, CSS, Bootstrap \nEnvironment \n\u2022 Visual Studio IDE \n\u2022 Visual Studio Code  \n\u2022 SQL database server. \n\u2022 Power BI Desktop \n\u2022 Gitlab Source Control System. \nSKILLS/CERTIFICATIONS/PROGRAMMING LANGUAGES \nProgramming \n\u2022 C# .NET Core, .NET MVC, Web API, Entity Framework \n\u2022 Database programming with MSSQL. \n\u2022 Front-end development with Bootstrap, Angular 4-5, JavaScript, jQuery, Ajax, \nResponsive, Html 5, CSS 3 \nSoftware, IDE tools \n\u2022 Microsoft Visual Studio \n\u2022 Microsoft Visual Studio Code \n\u2022 SVN/Git system  \nForeign languages \n\u2022 English skills:  \n+ Good at reading, writing, speaking,  \n+ Average good at listening \n OTHER SKILLS \n\u2022 Have a good logic and research skill. \n\u2022 Strong team work spirit. \n\u2022 Work well unsupervised as directed of under pressure. \n\u2022 Adapt to work in environment easily. \n\u2022 Be able to analyze and resolve problem. \n\u2022 Being able to self-managed tasks assigned. ", "educations": [{"id": 4796, "gpa": null, "major": "Computing", "school": "London School of Commerce - London", "diploma": "Bachelors", "end_time": "2018-12-01T00:00:00Z", "conf_score": 0.7761728190039863, "start_time": "2016-01-01T00:00:00Z", "picklist_major": "Other", "major_categories": "", "major_categories_detail": ""}], "experiences": [{"id": 16084, "detail": "", "company": "NOIS CO., LTD.", "end_time": "2023-04-13T00:00:00Z", "industry": "Other", "position": null, "conf_score": 0.8086621310791741, "start_time": "2018-02-01T00:00:00Z"}, {"id": 16085, "detail": "", "company": "5STARS Software Solution", "end_time": "2017-12-31T00:00:00Z", "industry": "High Technology", "position": null, "conf_score": 0.8068873668007818, "start_time": "2016-11-01T00:00:00Z"}], "address": null}