{"skills": ["linux", "tdd", "payment", "backbone", "marketing", "responsive", "javascript", "cloud", "selenium", "database management", "mongodb", "bootstrap", "contact point", "management", "dojo", "heroku", "postgresql", "kubernetes", "io", "git", "html5", "bdd", "rail", "redis", "sell", "ruby", "html", "microservices", "operating system", "medium", "database management system", "search", "android", "verbal communication", "ecs", "nosql", "rspec", "algorithm", "sql", "centos", "css", "bitbucket", "linode", "github", "software development", "testing", "reactjs", "communication skill", "database", "magento", "database design", "csv", "assembla", "angularjs", "srs", "php", "capistrano", "agile", "mysql", "propulsion", "jquery"], "fulltext": "Anna Bldg, 2nd floor, QTSC, HCM City, Vietnam \nTel: +0908461533 \nDOB: May 30, 1984 \nFN: Nguyen Thi Thuy \nEmail: thuynt04@gmail.com \nThuy Nguyen \nSr. Ruby on Rails Developer \nSUMMARY \n\u25cf\nHas 10 years in programming, and greater than 7 years in Ruby on Rails programming \n\u25cf\nUsed to plan and manage medium and small projects using Scrum/Agile software\ndevelopment \n\u25cf\nResponsibility: \n\u25cb\nResponsibilities on project start up as: setup environments, deployment, layout\ndesign, Database design. \n\u25cb\nReview codes and support junior members \n\u25cb\nKey contact point for any technical issue in team. \n\u25cb\nBuild and develop back-end, api for mobile app. \n\u25cb\nSkills with NoSQL(MongoDB, Redis), Caching, Payment, Scale/performance \n\u25cb\nStrong with Rails testing (Rspec, Feature Specs, Cucumber) \n\u25cb\nBuild\nweb\napp\nwith HTML5 animation, backbonejs, jQueryMobile, bootstrap,\nfoundation, angularjs. \n\u25cb\nDeploy to cloud servers such as Heroku, Capistrano to EC2, Kubernetes to gloud. \n\u25cb\nTools: Assembla, Trellor, Github, Bitbucket \n\u25cb\nProject lead: has management skill \nTECHNICAL SKILLS \n\u25cf\nProgramming Languages: Ruby \n\u25cf\nFrameworks/ Platforms: Ruby on Rails, Angularjs, Backbonejs, Bootstraps, foundation,\nhtml5 animation, jQueryMobile, \n\u25cf\nDatabase\nManagement\nSystems:\nPostgresql,\nMySql,\nMySql\nCluster,\nSQL,\nNoSQL(MongoDB, Redis). \n\u25cf\nTDD, BDD: RSpec 2, Selenium\u2026 \n\u25cf\nDeployment: Heroku, EC2, Kubernetes \n\u25cf\nKnowledge: Reactjs, Nodejs, Microservices \n\u25cf\nOperating Systems: Mac, Linux \u2013 CentOS \n\u25cf\nIDEs: Atom, Sublime Text, ... \nTools or Tools source control: Subversion, Git \nForeign Languages: English \nSoft Skills: Communication \nProcess: Agile and Scrum \n\u25cf\n\u25cf\n\u25cf\n\u25cf\nPRIOR WORKING EXPERIENCE \nTerralogic Ltd.. \nSenior Ruby on Rails, Project Lead \nMay 2017 - present: \n\u25cf\nDescription: Blurb Project is a self-publishing and marketing platform, from US. Blurb\u2019s\nplatform makes it easy to design, publish, promote, and sell professional-quality printed\nbooks and ebooks. This project is microservice, I have been working on ROR in Blurby\nplatform and some other javascript services.  \n\u25cf Responsibilities:  \n\u25cb\nBe a key performance of whole Ruby On rails team works \n\u25cb\nSolve the technical issue and support others \n\u25cb\nWeekly standing up report by verbal communication with US client. \n\u25cb\nRole: Project lead \n\u25cf Technologies: \n\u25cb\nRails 3, Rspec test, Deploy EC 2  \nBeside I have joined to other project to make deploy project to gloud by Kubernetes and do\ntasks in Magento Project. \nMar  2016 \u2013 April 2017: (Terralogic Ltd..) \nProject: Game for Rockyou \n\u25cf\nDescription:\nRockYou is an interactive media company that owns and partners with\ndozens of game titles across Facebook, web and mobile. This project is to enhance 2\ngames \u201cDragons of Atlantis\u201d and \u201cThe Godfather: Five Families\u201d using Ruby on Rails. \n\u25cf Responsibilities: \n\u25cb\nBe a key performance of whole Ruby on Rails team works. \n\u25cb\nBe in charge of enhancing features on existing game using Rails 2 (Dragons of\nAtlantis) and Rails 3(The Godfather: Five families). \n\u25cb\nResponsible for supporting in production deployment. \n\u25cb\nAnalyze requirements from customer and transfer to offshore team. \n\u25cb\nSolve the technical issue and support others \n\u25cb\nRole: Project lead \n\u25cf Accomplishments:  \n\u25cb\nSome new features are in production. \n\u25cf\nTechnologies:  Rails 2, Rails 3, Rspec test , Deploy EC2 \nFree Range Technology Ltd.. \n      June 2013 - Feb 2016 (3 years 8 months) \nSr. Ruby on Rails Developer  \n     There are projects which I worked: \nTele7jeux Project game \nDuration: 6 months \n\u25cf\nDescription:\nThis is a kind of mobile game, includes games: puzzle, memory, logical,\nmystery word, word search puzzle game. \n\u25cf Responsibilities:  \n\u25cb\nParse csv file to import into mysql by complex algorithms. \n\u25cb\nBuild CMS to manage Challenge, Game \n\u25cb\nBuild api for game \n\u25cb\nCollect customer's requirements \n\u25cb\nEstimate and detailed plan for development tasks \n\u25cb\nRole as team leader on project \n\u25cf Accomplishments:  \n\u25cb\nThe game was released by May 2012 \n\u25cf\nTechnologies:  ruby, ruby on rails 3, deploy EC2, delay job \nVarsity Project \nDuration: 20 months \n\u25cf\nDescription: This app supports users view and feedback about school\u2019s events of US\u2019s\nstates. \n\u25cf Responsibilities:  \n\u25cb\nBuild CMS manage brand, event, school, state .. \n\u25cb\nBuild api for mobile app \n\u25cb\nBuild responsive web \n\u25cb\nCollect customer's requirements \n\u25cb\nEstimate and detailed plan for development tasks \n\u25cb\nMain key members of development \n\u25cf Accomplishments:  \n\u25cb\nThis app has first release by December 2012 and continue develop when have \nany new features \n\u25cf\nTechnologies:  ruby, rails 3, deploy EC2, backbonejs, jQuerymobile ... \nFitfox Project \nDuration: 4 months \n\u25cf\nDescription: This app manage competitions, entrants can join competition and get step,\ndistance from health app to know who's winner. \n\u25cf Responsibilities:  \n\u25cb\nBuild api, and CMS for mobile app \n\u25cb\nCollect customer's requirements \n\u25cb\nEstimate and detailed plan for development tasks \n\u25cb\nRole as team leader of project \n\u25cf Accomplishments:  \n\u25cb\nThe app has last release by June 2015 \n\u25cf\nTechnologies:  ruby, rails 4, rspec, deploy by capistrano on Linode server. \nDoctor App Project \nDuration: 12 months \n\u25cf\nDescription: This app use for patients book appointment with a doctor. To book doctor,\napp support users find the available doctors, select doctor to make an appointment,\npayment for doctor through paypal or judopay. \n\u25cf Responsibilities:  \n\u25cb\nBuild CMS, api for iOS, Android app \n\u25cb\nEstimate and detailed plan for development tasks \n\u25cb\nMain key members of development \n\u25cf Accomplishments:  \n\u25cb\nThis app has first release by November, 2015 \n\u25cf\nTechnologies:  Rails 4, Deploy on EC2 \nHJ Voting app\n\u25cf\nThis app is used for students can vote school's poll. \n\u25cf\nSchool's admin can manage polls. He/she can view the result of voting poll, edit school \ninfo ... Each of school's students can vote these polls. \nProgramming: Rails 4.2, Angularjs, deploy on EC2 \n\u25cf\nSoftware Engineer at Tech Propulsion Labs\nJanuary 2012 - June 2013 (1 year 6 months) Developer at Tech Propulsion Labs \nThere are projects which I worked: \n     MyBulle:\nMyBulle is sharing media site \n+ Team size: 6 \n+ Technology:PHP, HTML, CSS , Dojo, Backbone + In-House Technology: Tonido API \n      MightyBrace \nCreated by an orthodontist for orthodontists, Mighty Brace is an engaging and effective \nway to teach patients proper oral hygiene techniques and dietary guidelines. Gameplay \nand direct messaging features foster patient community, bolster learning and provide \ndoctors with a simple way to monitor, encourage and document compliance. \nProgramming: Rails 3, Jquery, deploy on EC2 \n     Educake \nEducake tracks students grades against their individual goals based on The Common \nCore State Standards. \nProgramming: Rails 3, Jquery, deploy on EC2 \n   Teamzoom\nManage live games show for schools: for registering competitions between schools with \nfree or fee... \nProgramming: Rails 3, Jquery, deploy on EC2 \nSoftware Engineer at LARION Computing Ltd. \nSeptember 2009 - September 2011 (2 years 1 month)  \nEDUCATION \n\u25cf\nComputer Software Engineering, HCMC University of Technology and Education,\nVietnam. \nCERTIFICATION & TRAINING \n\u25cf\nTraining certifications for software testing and development ", "educations": [{"id": 4793, "gpa": null, "major": "Bi\u1ec3u di\u1ec5n nh\u1ea1c c\u1ee5 ph\u01b0\u01a1ng t\u00e2y", "school": "HCMC University of Technology and Education", "diploma": "Bachelors", "end_time": null, "conf_score": 0.8171095713648631, "start_time": null, "picklist_major": "Art/Design", "major_categories": "Ngh\u1ec7 thu\u1eadt", "major_categories_detail": "Ngh\u1ec7 thu\u1eadt tr\u00ecnh di\u1ec5n"}], "experiences": [{"id": 16070, "detail": ": \u25cf Description: Blurb Project is a self-publishing and marketing platform, from US. Blurb\u2019s platform makes it easy to design, publish, promote, and sell professional-quality printed books and ebooks. This project is microservice, I have been working on ROR in Blurby platform and some other javascript services.\n\u25cf Responsibilities: \u25cb Be a key performance of whole Ruby On rails team works\n\u25cb Solve the technical issue and support others\n\u25cb Weekly standing up report by verbal communication with US client.\n\u25cb Role: Proj", "company": "Terralogic Ltd..", "end_time": "2023-04-13T00:00:00Z", "industry": "Other", "position": "Senior Ruby on Rails, Project Lead", "conf_score": 0.8054900200249374, "start_time": "2017-05-01T00:00:00Z"}, {"id": 16073, "detail": ") Project: Game for Rockyou \u25cf Description: RockYou is an interactive media company that owns and partners with dozens of game titles across Facebook, web and mobile. This project is to enhance 2 games \u201cDragons of Atlantis\u201d and \u201cThe Godfather: Five Families\u201d using Ruby on Rails. \u25cf Responsibilities: \u25cb Be a key performance of whole Ruby on Rails team works.", "company": "Terralogic Ltd..", "end_time": "2017-04-30T00:00:00Z", "industry": "Other", "position": null, "conf_score": 0.7017163682865227, "start_time": "2016-03-01T00:00:00Z"}, {"id": 16076, "detail": "Free Range Technology Ltd.. June 2013 - Feb 2016 (3 years 8 months)\nSr. Ruby on Rails Developer There are projects which I worked:\nTele7jeux Project game\nDuration: 6 months\n\u25cf Description: This is a kind of mobile game, includes games: puzzle, memory, logical, mystery word, word search puzzle game.\n\u25cf Responsibi Varsity Project Duration: 20 months\n\u25cf Description: This app supports users view and feedback about school\u2019s events of US\u2019s states.\n\u25cf Responsibilities: \u25cb Build CMS manage brand, event, school, state .. \u25cb Build api for mobile app", "company": "Free Range Technology Ltd..", "end_time": "2016-02-29T00:00:00Z", "industry": "High Technology", "position": "Project lead", "conf_score": 0.8261452705797093, "start_time": "2013-06-01T00:00:00Z"}, {"id": 16078, "detail": "There are projects which I worked:\nMyBulle: MyBulle is sharing media site\n+ Team size: 6 + Technology:PHP, HTML, CSS , Dojo, Backbone + In-House Technology: Tonido API MightyBrace Created by an orthodontist for orthodontists, Mighty Brace is an engaging and effective way to teach patients proper oral hygiene techniques and dietary guidelines. Gameplay and direct messaging features foster patient community, bolster learning and provide doctors with a simple way to monitor, encourage and document compliance.\nProgramming: Rails 3, Jquery, deploy on EC2 Educake Educake tracks students grades against their individual goals based on The Common Core State Standards. Programming: Rails 3, Jquery, deploy on EC2 Teamzoom Manage live games show for schools: for registering competitions between schools with free or fee...\nProgramming: Rails 3, Jquery, deploy on EC2", "company": "Tech Propulsion Labs", "end_time": "2013-06-30T00:00:00Z", "industry": "High Technology", "position": "Software Engineer", "conf_score": 0.9359065521434904, "start_time": "2012-01-01T00:00:00Z"}, {"id": 16081, "detail": "", "company": "LARION Computing Ltd.", "end_time": "2011-09-30T00:00:00Z", "industry": "Other", "position": "Software Engineer", "conf_score": 0.9264139694127339, "start_time": "2009-09-01T00:00:00Z"}], "address": "Anna Bldg, 2nd floor, Qtsc, Hcm City, Vietnam"}