{"skills": ["toad", "studio", "mobile payment", "java", "css", "microservices", "analysis", "algorithm", "svn", "internet", "java technology", "tomcat", "structure", "j2ee", "html", "linux", "ajax", "design pattern", "java core", "oracle", "log4j", "security", "eauthentication", "jquery", "database development", "crystal report", "sql", "uml", "netbeans", "visual studio", "object oriented design", "strut", "javascript", "payment", "apache", "database", "banking", "jdbc", "spring boot", "jsp", "object oriented", "workflow", "hibernate", "ood", "rest", "jms", "spring", "msql", "management", "data structure", "communication skill", "online banking", "problem solving"], "fulltext": "NGUYEN HUYNH TUONG HOAN \nAddress:  \nPhone: \nEmail: \nPersonal information: \nFirst Name: \nHOAN \nLast Name: \nNGUYEN HUYNH TUONG \nBirth: \n14 \u2013 November \u2013 1985 \nSex:  Male \nMarital Status: \nMarried \nProfessional Summary: \n\u25cf\nWorked on a lot of large projects regarding banking and securities.  \n\u25cf\nImplemented various web-based (10+ years) and windows based (4+ years) \napplications. \n\u25cf\nHas 10+ years in Java/JEE development, 4+ years in .NET development, 5+ years in \nOracle PL/SQL development. \nTechnical Summary: \nJava Technologies:  \nJava Core,  Java Security, JDBC, Socket and RMI, JSP, Servlet, \nJMS, JSTL,... \nJEE  Frameworks/ \nLibraries: \nSpring, Hibernate, Struts (3+ years), Log4J,... \nTools: \nSVN,  Eclipse, NetBeans, Visual Studio, Toad for Oracle, PLSQL \nDeveloper,... \nPlatforms: \nLinux, Windows \nDatabases: \nOracle,  MSQL \nApplication Servers: \nApache Tomcat \nDesign skills: \nOOA (Object Oriented Analysis) & OOD (Object Oriented \nDesign), Design patterns, and UML. \nOthers: \nWeb services (SOAP, REST), HTML, CSS, Ajax, JavaScript, \nOracle PL/SQL, Jasper Report, Crystal Report,... \nWork Experience: \nAug  2013 \u2013 Present: Ho Chi Minh City Development Bank (HDBank) \u2013 Ho Chi Minh \nCity, Vietnam. \nPosition: Senior developer \nTasks/ Achievements: \n\u25cf\nHDBank Internet Banking:  \n\u25aa\nMaintained and developed new components, functionalities, both back-end \nand front-end to existing systems: 2FA Authentication, Payments, ... \n\u25aa\nDeveloped gateways for tax payment, customs tax payment, mobile \nrecharge/ TopUp,...  \n\u25aa\nUsed technologies: J2EE, Socket, HTML, CSS, Jquery, JCE, Oracle \nPL/SQL,... \n\u25cf\nHDBank Mobile Banking: \n\u25aa\nDesigned Framework, Database, Workflows used at the back-end. \n\u25aa\nUsed technologies: Spring Boot, RestAPI, Microservices. \n\u25cf\nInterbank electronic payment system \u2013 The State Bank Of Viet Nam (SBV) \n\u25aa\nReceive/send transactions files from/to SBV. \n\u25aa\nImport/ export transactions to/ from Core Banking system. \n\u25aa\nDeveloped web-based applications for monitoring. \n\u25aa\nUsed technologies: Java, .NET, Crystal Report, Oracle,... \n\u25cf\nHDBank Card Management: \n\u25aa\nDeveloped a web-based application for daily report/ reconciliation with \nNAPAS (Vietnam National Payment Services): Receive/ import \ntransactions report from Napas, compare with data in system and \nexport/send the result to NAPAS. \n\u25aa\nDeveloped/ Maintained the IBFT Gateway between NAPAS vs HDBank. \n\u25aa\nUsed technologies: Java, Tomcat, Oracle... \n\u25cf\nHDBank \u2013 Disbursement settlement system: \n\u25aa\nContacted directly with the partners (MoneyGram, EMQ, Transfast,...) to \ncollect requirements. \n\u25aa\nDesigned framework, database and system. \n\u25aa\nDeveloped application to get settlement files, parse and import into the \ndatabase, generate settlement result files and send to the partners \nautomatically. \n\u25aa\nDeveloped web-based applications for monitoring. \n\u25aa\nUsed technologies: Java, Quartz Scheduler, Oracle, SOAP, PGP,...  \n\u25cf\nHDBank \u2013 e-Wallet Gateways: \n\u25aa\nDeveloped gateways between HDBank and some e-Wallet partners: \nWebMoney, VNPTPay, Payoo,... \n\u25aa\nDeveloped auto reconciliation application. \n\u25aa\nUsed technologies: Java, Quartz Scheduler, REST, SOAP, Oracle,... \n\u25cf\nDeveloped some internal banking projects: Services fee auto charging, SMS OTP \ngateway, Auto-scheduler application,... \nApril 2011 \u2013 Aug 2013: DAI A Commercial Join Stock Bank (DaiABank) \u2013 Bien Hoa City, \nDong Nai Province, Vietnam. \nPosition: Senior developer \nTasks/ Achievements: \n\u25cf\nWorked in Banking Applications Development Team with 4 other members.  \n\u25cf\nMaintained and developed Internet Banking product.  \n\u25cf\nDeveloped some internal banking projects. \nUsed technologies:  Java, JSP, Servlet, Jasper Report, Tomcat, Javascript/Ajax, HTML, \nJquery, CSS, Visual Studio, Crystal Report, Oracle, MSQL. \nApril 2008 \u2013 March  2011: UNICOM Software  -  Ho Chi Minh  City, Vietnam. \nPosition: Developer  \nTasks/ Achievements: \n\u25cf\nWorked in Securities Online Trading Team with 5 other members. \n\u25cf\nDeveloped and deployed securities online banking product. \n\u25cf\nParticipated in some company\u2019s outsourced software projects. \nUsed technologies: Java, Spring, Hibernate, Struts, Jasper Report, Tomcat, Javascript/Ajax, \nHTML, Jquery, CSS, Oracle. \nEducation: \n\u25cf\nStudiedBachelorofEngineeringatFacultyofInformationTechnology-HoChi\nMinh City University of Technology from 2003, graduated in 2008. \nKey skills and Competencies \n\u25cf\nGood programming ability. \n\u25cf\nStrong core Java development experience. \n\u25cf\nStrong knowledge of Data Structures and Algorithms. \n\u25cf\nMore experiences with using and applying Design Patterns. \n\u25cf\nGoodattroubleshooting,problem-solving,searchingontheInternettofindsolutions\nin a little time. \n\u25cf\nAbility to develop applications by using .NET. \n\u25cf\nHas experience in Oracle database development.  \n\u25cf\nAbility to react quickly to shifting priorities and meet deadlines. \n\u25cf\nAbility to work under pressure, effectively independently or as part of a team. \n\u25cf\nGood communication skills, both verbal and written. \n\u25cf\nHas intermediate English level. ", "educations": [{"id": 4815, "gpa": null, "major": "InformationTechnology", "school": "HoChi Minh City University of Technology", "diploma": "Bachelors", "end_time": "2008-01-01T00:00:00Z", "conf_score": 0.8450779038219529, "start_time": "2003-01-01T00:00:00Z", "picklist_major": "Other", "major_categories": "", "major_categories_detail": ""}], "experiences": [{"id": 16120, "detail": "Tasks/ Achievements: \u25cf HDBank Internet Banking: \u25aa Maintained and developed new components, functionalities, both back-end and front-end to existing systems: 2FA Authentication, Payments, ...", "company": "Ho Chi Minh City Development Bank (HDBank)", "end_time": "2023-04-13T00:00:00Z", "industry": "Banking", "position": "Senior developer", "conf_score": 0.9166396554468658, "start_time": "2013-08-01T00:00:00Z"}, {"id": 16121, "detail": "Banking Applications Development Team with 4 other members.\n\u25cf Maintained and developed Internet Banking product.\n\u25cf Developed some internal banking projects.\nUsed technologies: Java, JSP, Servlet, Jasper Report, Tomcat, Javascript/Ajax, HTML, Jquery, CSS, Visual Studio, Crystal Report, Oracle, MSQL.", "company": "HDBank", "end_time": "2013-08-31T00:00:00Z", "industry": "Banking", "position": "Senior developer", "conf_score": 0.8435101270496153, "start_time": "2011-04-01T00:00:00Z"}, {"id": 16122, "detail": "Tasks/ Achievements: \u25cf Worked in Securities Online Trading Team with 5 other members.\n\u25cf Developed and deployed securities online banking product.\n\u25cf Participated in some company\u2019s outsourced software projects.\nUsed technologies: Java, Spring, Hibernate, Struts, Jasper Report, Tomcat, Javascript/Ajax, HTML, Jquery, CSS, Oracle.", "company": "UNICOM Software", "end_time": "2011-03-31T00:00:00Z", "industry": "High Technology", "position": "Developer", "conf_score": 0.9166396554468658, "start_time": "2008-04-01T00:00:00Z"}], "address": null}