{"skills": ["linux", "aws", "digital marketing", "groovy", "marketing", "javascript", "customer relationship management", "cloud", "technical analysis", "mongodb", "bootstrap", "management", "written communication skill", "search engine", "gitlab", "unit test", "postgresql", "sql database", "jquery", "ubuntu", "new relic", "analysis", "ple", "rail", "orientdb", "redis", "ruby", "sell", "index", "operating system", "ubuntu linux", "elearning", "search", "sql", "written communication", "jira", "phabricator", "github", "software development", "communication skill", "system design", "backend development", "database", "learning path", "cisco", "window operating system", "php", "milestone planning", "agile", "mysql", "html", "relationship management"], "fulltext": "Curriculum Vitae \n Nitish Shrikant Gangal \n B-902, Empire Square, Next to Auto \n Cluster, Mumbai Pune Highway, \n Chinchwad, Pune \u2013 411019 \nMobile:  \nEmail:  \nProfile Summary \n\u2022 \nWorking as a Technical Lead at BricTech Softwares Pvt. Ltd. (Unit of Prohaktiv Inc.), \nPune since last around 3 years \n\u2022 \nEarlier worked as Lead Engineer and Associate Technical Lead at Amura Marketing \nTechnologies, Pune and Harbinger Systems Pvt. Ltd., Pune respectively \n\u2022 \nTotal of 8 years of experience mainly on Ruby on Rails, Node.JS and Groovy on Grails, \nJavaScript, Bootstrap, MySql, PostGreSQL, AWS, MongoDb, OrientDb etc. \n\u2022 \nGood Experience in No-SQL databases as well as AWS cloud deployment and use of \ntheir related services like s3, SNS etc. \n\u2022 \nExcellent in almost all the aspects of Software Development. Having good experience \nwith Agile methodology of Software Development \n\u2022 \nWorked on Linux Platform (Ubuntu) \n\u2022 \nHaving good experience in requirement gathering, requirement and technical analysis, \ncustomer communication, technical architecture, leading and mentoring team etc. along \nwith core development experience \n\u2022 \nHolds US B1 visa. \nTechnical Summary \n\u2022 \nProgramming Languages: Ruby, Groovy, Javascript, PHP \n\u2022 \nFrameworks: Rails3.2 & 4, Grails, Node.Js, Compound.Js, Rspecs, Cucumber, Sails JS \n\u2022 \nDatabases: OrientDb, Redis, Postgres, MySql, MongoDb \n\u2022 \nOperating Systems: Windows, Cent OS, Ubuntu (Linux) \n\u2022 \nOther tools and technologies: GitHub, Gitlab, Code Climate, New Relic, Phabricator \nProject Experience Summary   \nProject \n: \n Deluxe eChecks  \nTechnologies \n: \n Rails 4, Ruby 2.2.2, Javascript, Jquery, Bootstrap \n Sublime, Atom, code climate, New Relic, GitHub, \nTools \n: \n Jira \nDatabase \n: \n MySQL, MemCache \nProject Duration \n: \n April 2016 \u2013 Till date \n1 \nProject Profile \n: \nDeluxe eChecks is web based application developed for convenient use of paperless checks. \nThis system enables user to send out the paperless checks through email to their payees. This \nhelps payees to print and deposit these checks to their respective accounts either through \nthe application or depositing in person in the bank. \nMy Contribution: \n\u2022 \nWorking as a Technical Lead for eChecks \n\u2022 \nHandling team of 6 developers including few junior developers \n\u2022 \nTechnical analysis as well as requirement gathering and analysis \n\u2022 \nTechnically mentoring the team and reviewing their codes \n\u2022 \nInvolved in architecture and system design. \n\u2022 \nResearch, analysis and development of various features and deployment \n\u2022 \nInvolved in client communication, requirement gathering and analysis as well as \ndesigning functional flow of various modules and completing the technical analysis \nand design \n\u2022 \nInvolved in Sprint planning as well as milestone planning \n\u2022 \nVisited onsite office at US during one of our major release and worked from there for \nalmost around 6 months upon client invitation. \nProject \n: \nSell.do  \nTechnologies \n: \nRails 3.2, Javascript, Jquery \nSublime, code climate, New Relic, GitHub, \nTools  :  Jira \nDatabase \n: \nMongoDb, Redis \nProject Duration \n: \nDec 2015 \u2013 March 2016 \nProject Profile \n: \nSell.do is a platform for enhancing digital marketing. Currently, it is focused on the Real Estate \ndomain. It is basically Customer relationship management application with various extra \nordinary features. \nMy Contribution: \n\u2022 \nWorked as a Product Lead and Team Lead for Sell.do \n\u2022 \nTechnical analysis as well as requirement gathering and analysis \n\u2022 \nTechnically mentoring the team and reviewing their codes \n\u2022 \nInvolved in architecture and system design. \n\u2022 \nResearch, analysis and development of various features and deployment \n\u2022 \nInvolved in client communication, requirement gathering and analysis as well as \ndesigning functional flow of various modules and completing the technical analysis \nand design \n2 \nProject  :  MentorString \nTechnologies \n: \nRails 3.2 and 4.1, Node.js, Javascript, Jquery, Solr \nSublime, code climate, New Relic, GitHub, GitLab, \nTools  :  Jira \nDatabase \n: \nPostgres, OrientDb, Redis \nProject Duration \n: \nJuly 2013 \u2013 Nov 2015 \nProject Profile \n: \nMentorString is a virtual mentoring and collaboration platform where employees of \norganizations can build their connections with other individuals of various skills and allows them \nto build their own network based on their interests and skills. Also, this application enables \norganization to keep track of the skills and interests of individuals and perform certain activities \nfor their improvement. \nMy Contribution: \n\u2022 \nInvolved in complete architecture and design of the application from the scratch \n\u2022 \nTechnical analysis as well as requirement gathering and analysis \n\u2022 \nTechnically mentoring the team and reviewing their codes \n\u2022 \nAWS setup as well as setup of their related services like SNS, S3 etc. \n\u2022 \nUsing node for real-time notification and chat. \n\u2022 \nInvolved in architecture and system design. \n\u2022 \nCombined Code-base owner \n\u2022 \nInitial POC (string diagram) and estimates for winning the project \n\u2022 \nResearch, analysis and development of various features and deployment \n\u2022 \nInvolved in client communication, requirement gathering and analysis as well as \ndesigning functional flow of various modules and completing the technical analysis \nand design \nProject \n: \nCisco Services Career Connection \nNode.JS, Compound.Js, jQuery, \nTechnologies  :  JavaScript \nTools \n: \nEcllipse, GitHub \nDatabase  :  MongoDb \nProject Duration \n: \nNovember 2012 \u2013 June 2013 \nProject Profile \n: \nCisco Services Career Connection (CSSC) is a web based application for employees of an \norganization where they can undergo various training programs and training courses. They can \ntrack their own progress and contribute to various other training programs. \nMy Contribution: \n\u2022 \nMainly involved in technical design, analysis, research activities and development \n\u2022 \nWorked as core developer for a module called as Learning Plan \n3 \n\u2022 \nEffectively worked on client side as well as backend development \n\u2022 \nAlso, worked on various other modules like Learning Paths, Site setup etc \n\u2022 \nOwned development as well as completion of unit test cases \n\u2022 \nInvolved in requirement understanding, analysis and weekly client calls and \nstatus calls \n\u2022 \nOwned complete deployment on internal test environment \n\u2022 \nHelped and mentored junior development team and conducted various \ntraining programs for them \nProject \n: \nCiscoPLE  \nGroovy on Grails, Node.Js, jQuery, JavaScript, \nTechnologies  :  Solr \nTools \n: \nEcllipse, GitHub, STS \nDatabase  :  MySQL \nProject Duration \n: \nNovember 2011 \u2013 November 2012 \nProject Profile \n: \nWe as a global eLearning organization developed a cloud based learning hub. Cisco wanted an \nePUB 3.0 reader to display their content with features like annotations, search etc which aid in \nlearning to be integrated with the hub. \nMy Contribution: \n\u2022 \nWorked as a key developer in developing the EkitServer \n\u2022 \nOwned complete deployment on internal environment as well as on \nProduction environment after Go-Live \n\u2022 \nWorked for various POCs, analysis and research items \n\u2022 \nCompletely owned the Service Oriented integration of Ekit Server with PLE portal \n\u2022 \nSelected as a Support Engineer and worked with client team at Cisco, Bangalore \nfor around 5 months \n\u2022 \nWas actively involved in CCS and Annotation Server design and development \n\u2022 \nDeveloped a search engine which indexes all the HTML contents of Epub 3.0 \nand its integration with Ekit Server \nEducational Qualification Summary \nYear of \nQualification \nUniversity/ Board \nPassing \nPercentage \nB.E (Computer) \nPune University \n2011 \n72% \nH.S.C \nMaharashtra State Board \n2007 \n86.67% \nS.S.C \nMaharashtra State Board \n2005 \n86.53% \n4 \nAchievements \n\u2022 \nI was selected as Support Engineer to work with client team at Cisco, Bangalore \nfor around 5 months and received various customer appreciations \n\u2022 \neChecks client invited me onsite and I worked from Client Location at US for around 6 \nmonths \n\u2022 \nReceived \u201cDistinguished Contributor\u201d award for 4 times \n\u2022 \nWon \u201cExcellence in Software Development\u201d award in 2014 \n\u2022 \nAttended various trainings in various colleges as Trainer and Speaker \nQualities \n\u2022 \nGood Leadership qualities \n\u2022 \nStrong grasping skills and logical abilities \n\u2022 \nInteractive and flexible attitude \n\u2022 \nStrong verbal as well as written communication skills \n\u2022 \nQuick learner and excellent team player, ability to meet tight deadlines \nand work under pressure \n\u2022 \nStrong coding skills and technical abilities \nPersonal Details \n\u2022 Date of birth \n: 7th September 1989 \n\u2022 Nationality \n: Indian \n\u2022 Languages Known \n: English, Hindi and Marathi \n\u2022 Father\u2019s Name: Shrikant Murlidhar Gangal \n: B-209, Empire Square, Next to Auto Cluster, Chinchwad, \n\u2022 Address \nPune - 411019 \n\u2022  \n5 ", "educations": [{"id": 4812, "gpa": null, "major": "Computer", "school": "Pune University", "diploma": "Bachelors", "end_time": "2011-01-01T00:00:00Z", "conf_score": 0.8925449324309898, "start_time": "2007-01-01T00:00:00Z", "picklist_major": "Other", "major_categories": "", "major_categories_detail": ""}], "experiences": [{"id": 16118, "detail": "Project Profile : We as a global eLearning organization developed a cloud based learning hub. Cisco wanted an\nePUB 3.0 reader to display their content with features like annotations, search etc which aid in learning to be integrated with the hub.\nMy Contribution: \u2022 Worked as a key developer in developing the EkitServer \u2022 Owned complete deployment on internal environment as well as on\nProduction environment after Go-Live \u2022 Worked for various POCs, analysis and research items\n\u2022 Completely owned the Service Oriented integration of Ekit Server with PLE portal\n\u2022 Selected as a Su", "company": null, "end_time": "2012-11-30T00:00:00Z", "industry": "Other", "position": "Support Engineer", "conf_score": 0.6925429707670153, "start_time": "2011-11-01T00:00:00Z"}], "address": "B - 902, Empire Square, Next to Auto\nCluster, Mumbai Pune Highway,\nChinchwad, Pune - 411019"}