{"skills": ["linux", "stack", "sc", "angular", "css3", "workflow", "learning activity", "java", "call center", "secure communication", "wordpress", "javascript", "jruby", "bootstrap", "sales", "eauthentication", "mongodb", "rational", "management", "java language", "e learning", "risks", "search engine", "ant", "security", "frontend development", "elasticsearch", "ubuntu", "git", "svn", "html5", "project management", "requirejs", "redis", "spring", "ajax", "business requirement", "configuration management tool", "ubuntu linux", "search", "spring security", "management tool", "cache", "desktop", "nginx", "centos", "sql", "configuration management", "e learning system", "ejb", "file management", "window 2003", "microsoft", "reactjs", "uml", "modem", "oracle", "database", "jsp", "hibernate", "angularjs", "crystal report", "mysql", "jquery"], "fulltext": "RESUME \nTUONG_VIET_CHU - Java - \nFor Client \nPage 1 of 8 \nSenior Fullstack Engineer \nTuong Viet Chu \nI'm a software engineer with more than 9 years of experience \non Java language, AngularJs, Angular 5. I love to deliver \nworking software written with clean code and deliver projects \non time with high quality. I'm good both in development sites \nfrom scratch and in working on existing systems which need \nsome improvement. I worked in all levels of development, from \nthe front end to the back end, and I'm be able to work with end \nusers to understand business requirements and in identifying \nnew data needs and delivery mechanisms. I\u2019m able to react \nquickly and smoothly to changes \nSkills \n\u2022 Bachelors degree (BS) in Information Technology of Natural Science HCM \ncity \n\u2022 Backend: Java, Spring(SpringCore, SpringMVC, Spring Security, \nSpringData, SpringBoot, JPA, Hibernate) \n\u2022 Frontend: AngularJS/Angular 5, RequireJS, CSS3/HTML5, Flex layout, \nLESS, SASS, Bootstrap framework, jQuery, Joomla, Wordpress, can work \nwith ReactJS \n\u2022 Search Engine: ElasticSearch \n\u2022 Cache: Redis \n\u2022 Scale: Mongodb, ElasticSearch \n\u2022 LoadBalancing: Nginx \n\u2022 Linux: Ubuntu, Centos, can use command-line \n\u2022 Familiarity with databases: MySQL, Oracle, MongoDB. \n\u2022 Configuration Management Tools:  Subversion, Git \nRelevant Work Experience  \nDeveloper                                                       March 2018- Present \nELCA VietNam \nProject: SIEL   \nProject Description: \nThe main features of Siel Project are manage \nperson, group, document, workspace, task and \nnotification. User can view and edit, search on \nRESUME \nTUONG_VIET_CHU - Java - \nFor Client \ndocument on spaces, assign tasks to groups or \nspecific person, receive the notification when task \ncoming. \nGroup are organized by multiple level tree, grant \nrights access on document, task, or person   \nTasks are manage by states , the sequences of \nstate are defined and notification when each state \nchanged. \nDocument use Alfresco software, that is content \nand file management, through multiple open APIs, \nit is easy to integrate and extend for needs \nIndustry: \nPerson and Document Management \nProject Team Size: \n4 \nRole(s): \nSenior Full-stack Java Developer \nSkill Set Utilized: \nAngular 5, Java 8, SpringMVC,SCSS /CSS3, \nHTML5, Flex layout \nResponsibilities: \nBuild root core SIEL project from scratch, receive \nspecification from Switzerland and implementing \nusecase stories for each Spring \nAssignment  Duration  \n11 months  \nDeveloper                                                       Jan 2017- May 2018 \nZilla Company \nProject: Zillable.com   \nProject Description: \nZillable\u2122 is the world\u2019s first team collaboration \nnetwork for innovation-on-demand, where teams \ncan make work and innovation happen. As a \nsecured communication and collaboration hub, \nZillable provides an intelligent network that \nbridges minds and workflows for teams of any \nsize - from 10 to 100,000. With Zillable, you can \nchat, get things done, and never forget a thing. \nFor more information, visit www.zillable.com and \ntry it for free! \nPage 2 of 8 \nRESUME \nTUONG_VIET_CHU - Java - \nFor Client \nPage 3 of 8 \nZillable helps you and your team get all of your \nwork and communication into one place, \neliminating information silos created by today\u2019s \n\u201can-app-for-that\u201d culture. By putting everything in \none place, on one platform, and making it easier \nto share, we make collaboration - and, ultimately, \ninnovation - possible. And in a world where it\u2019s \nessential that companies continue to constantly \ninnovate or risk obsoletion, that\u2019s invaluable. \nIndustry: \nSocial network \nProject Team Size: \n8 \nRole(s): \nSenior Front End Developer \nSkill Set Utilized: \nAnguarJS, RequireJS, Angular 5, Linux, CSS3, \nHTML5, Wordpress. \nResponsibilities: \nDevelop front end (AngularJS , CSS3/HTML5, \njQuery) for Zillable suit requirements \nDeploy the blog site of Zillable by using \nWordpress \nAssignment  Duration  \n12 months  \nDeveloper                                                       Mark 2014- Jan 2017 \nZilla Company \nProject: Zillable.com   \nProject Description: \nZillable\u2122 is the world\u2019s first team collaboration \nnetwork for innovation-on-demand, where teams \ncan make work and innovation happen. As a \nsecured communication and collaboration hub, \nZillable provides an intelligent network that \nbridges minds and workflows for teams of any \nsize - from 10 to 100,000. With Zillable, you can \nchat, get things done, and never forget a thing. \nFor more information, visit www.zillable.com and \ntry it for free! \nRESUME \nTUONG_VIET_CHU - Java - \nFor Client \nPage 4 of 8 \nZillable helps you and your team get all of your \nwork and communication into one place, \neliminating information silos created by today\u2019s \n\u201can-app-for-that\u201d culture. By putting everything in \none place, on one platform, and making it easier \nto share, we make collaboration - and, ultimately, \ninnovation - possible. And in a world where it\u2019s \nessential that companies continue to constantly \ninnovate or risk obsoletion, that\u2019s invaluable. \nIndustry: \nSocial network \nProject Team Size: \n10 \nRole(s): \nSenior Backend Java Developer \nSkill Set Utilized: \nJava, SpringMVC framework, MongoDB, \nElasticSearch, Redis, AnguarJS, RequireJS, \nLinux, Joomla, CSS3, HTML5 \nResponsibilities: \nDevelop front end (AngularJS , CSS3/HTML5, \njQuery) for Zillable \nTranslate product requirements into technical \nsolutions \nDesign APIs and implement them using Spring \nFramework \nAssignment  Duration  \n36 months  \nDeveloper                                                       October 2010- Mark 2014 \nKMS technology \nProject: HMS   \nProject Description: \n- Health center system project is developed in \njava platform. Main aim of this project is to \nimplement a online software application for \nmaintaining drugs information, patients \ninformation, nurse information and doctors \ninformation in a single application. \nRESUME \nTUONG_VIET_CHU - Java - \nFor Client \nPage 5 of 8 \n- This system will reduce manual work for \nmaintaining records in files. Using this system \ndata is maintained in database and data retrieving \nand updating in easy process and old data can be \neasily retrieved. Doctors and patients can view \nthis data from anywhere which will save time. This \napplication is also useful for pharmacist to inquire \nabout the drugs and update information about \ndrugs to database. \nIndustry: \nHealthCare System \nProject Team Size: \n8 \nRole(s):  Developer \nSkill Set Utilized: \nJava, SpringMVC framework, \nJRuby,ElastichSearch, EJB \nResponsibilities: \nWork with team members to analyze business \nrequirements analyze business requirements \nImplementing features base on requirements from \ncustomer \nAssignment  Duration  \n18 months  \nDeveloper                                                       September 2009- October 2010 \nCSC Viet Nam , HCM city \nProject: RWD uLearn\u2122   \nProject Description: \nRWD uLearn\u2122  is an e-learning system. The \nmain mission of RWD uLearn\u2122 is : enable \norganization to easily catalog learning activities \nand provide the mechanism to report on the \nprogress at multiple levels. RWD uLearn\u2122 allows \nRESUME \nTUONG_VIET_CHU - Java - \nFor Client \nPage 6 of 8 \norganizations to organize their learning activities \nand even enable the sale of content to their \nvendors and/or customers  \nIndustry: \ne-Learning System \nProject Team Size: \n14 \nRole(s):  Developer \nSkill Set Utilized: \nJava, LDAP Integration , Spring Framework 2.5, \nOracle,SQL Server, SVN,iReport,Jasper \nReport,JFreeChart,Ant,JSP/Servlet,MultiThread \nResponsibilities: \nImplementing the modules below: LDAP \nIntegration,Authentication and \nAuthorization,Design Inline Report, Crystal Report \nand Jasper Report,Modify Ant build,Develop \nInstallation Wizard Tool,Clear Database Tool. \nAssignment  Duration  \n11 months  \nDeveloper                                                       July 2009- September 2009 \nCSC Viet Nam , HCM city \nProject: ECM Import tool \nProject Description: \nDevelop an ECM Import Tool that imports \ndocuments in multiple types of format into the \nECM FileNet System \nIndustry: \nContent Management \nProject Team Size: \n5 \nRole(s):  Developer \nSkill Set Utilized: \nJava, FileNet System, Spring Framework 2.5, \nDB2, Windows 2003/XP/2000, SVN \nRESUME \nTUONG_VIET_CHU - Java - \nFor Client \nPage 7 of 8 \nResponsibilities: \nImplementing the modules below: ECM Service \nRequest,Authentication and \nAuthorization,Monitoring \nAssignment  Duration  \n2 months  \nDeveloper                                                       August  2008- July 2009 \nCSC Viet Nam , HCM city \nProject: Cox - iNav \nProject Description: \nProvide employees a desktop environment that \nhelps them to access information and support \ntools more quickly and easily, improves the call \nhandling process, creates a \u201cvirtual\u201d service and \nsupport environment that allows them to offer \ncustomers the local \u201cfeel\u201d from a \u201cglobal\u201d rep to \nfurther enhance customer service.  \nCreate an environment where the desktop \ntransformation will be employee friendly and will \nbecome accepted by all employees. \nIndustry: \nCall Center - Telecom \nProject Team Size: \n20 \nRole(s):  Developer \nSkill Set Utilized: \nWindows XP, Microsoft Office, Java, JSP, \nJavaScript, Ajax, Oracle, BEA Weblogic Portal, \nJacada Framework, Portal, Weblogic Workshop, \nRational Rose UML, Web services \nResponsibilities: \nImplementing the modules below:Modem \nAdd,Modem Swap,Search User,Implement \nIservNotes in iNav and some features in \nadministrator system.These features allow the \nuser interact with exist system by webservice. \nRESUME \nTUONG_VIET_CHU - Java - \nFor Client \nPage 8 of 8 \nAssignment  Duration  \n11 months \nDeveloper                                                       Octorber 2007- August  2008 \nCSC Viet Nam , HCM city \nProject:Milstone \nProject Description: \nDrawing any chart include 2-D and 3-D  \nIndustry:  Manufacture \nProject Team Size: \n10 \nRole(s):  Developer \nSkill Set Utilized: \nJava Application \nResponsibilities: \n- Researching new features and integrating into \nproject \n- Research the jfreechart open source \nAssignment  Duration  \n10 months \nEducation: \n- \nBachelor of Information Technology , University of Nature Vietnam  \n(September 2007) ", "educations": [{"id": 4833, "gpa": null, "major": "C\u00f4ng ngh\u1ec7 th\u00f4ng tin", "school": "University of Nature Vietnam", "diploma": "Bachelors", "end_time": "2007-09-01T00:00:00Z", "conf_score": 0.9162385206282713, "start_time": null, "picklist_major": "IT - Hardware/Networking", "major_categories": "M\u00e1y t\u00ednh v\u00e0 c\u00f4ng ngh\u1ec7 th\u00f4ng tin", "major_categories_detail": "C\u00f4ng ngh\u1ec7 th\u00f4ng tin"}], "experiences": [{"id": 16181, "detail": "Project: SIEL Project Description: The main features of Siel Project are manage person, group, document, workspace, task and notification. User can view and edit, search on", "company": "ELCA VietNam", "end_time": "2023-04-13T00:00:00Z", "industry": "Other", "position": "Developer", "conf_score": 0.902768374209996, "start_time": "2018-03-01T00:00:00Z"}, {"id": 16182, "detail": "ay 2018 Zilla Company Project: Zillable.com Project Description: ZillableTM is the world\u2019s first team collaboration network for innovation-on-demand, where teams can make work and innovation happen. As a secured communication and collaboration hub,\nZillable provides an intelligent network that bridges minds and workflows for teams of any size - from 10 to 100,000. With Zillable, you can chat, get things done, and never forget a thing.\nFor more information, visit www.zillable.com and try it for free!", "company": "Zilla Company", "end_time": "2018-05-31T00:00:00Z", "industry": "Other", "position": "Senior Full - stack Java Developer", "conf_score": 0.7838211195073319, "start_time": "2017-01-01T00:00:00Z"}, {"id": 16183, "detail": "Developer Mark 2014- Jan 2017 Zilla Company Project: Zillable.com Project Description: ZillableTM is the world\u2019s first team collaboration network for innovation-on-demand, where teams can make work and innovation happen. As a secured communication and collaboration hub,\nZillable provides an intelligent network that bridges minds and workflows for teams of any size - from 10 to 100,000. With Zillable, you can chat, get things done, and never forget a thing.\nFor more information, visit www.zi", "company": "Zilla Company", "end_time": "2017-01-31T00:00:00Z", "industry": "Other", "position": "Senior Front End Developer", "conf_score": 0.7838211195073319, "start_time": "2014-01-01T00:00:00Z"}, {"id": 16184, "detail": "Developer October 2010- Mark 2014 KMS technology\nProject: HMS Project Description: - Health center system project is developed in java platform. Main aim of this project is to implement a online software application for maintaining drugs information, patients information, nurse information and doctors information in a single application.", "company": "KMS technology", "end_time": "2014-01-31T00:00:00Z", "industry": "High Technology", "position": "Senior Backend Java Developer", "conf_score": 0.8250393958691945, "start_time": "2010-10-01T00:00:00Z"}, {"id": 16185, "detail": "Developer September 2009- October 2010 CSC Viet Nam , HCM city\nProject: RWD uLearnTM Project Description: RWD uLearnTM is an e-learning system. The main mission of RWD uLearnTM is : enable organization to easily catalog learning activities and provide the mechanism to report on the progress at multiple levels. RWD uLearnTM allows", "company": "CSC Viet Nam", "end_time": "2010-10-31T00:00:00Z", "industry": "Other", "position": "Developer", "conf_score": 0.7973044649015945, "start_time": "2009-09-01T00:00:00Z"}], "address": null}