{"skills": ["memcached", "xcode", "terraform", "streaming", "java", "c++", "kafka", "database management", "golang", "python", "flask", "redis", "information exchange", "mysql", "kubernetes", "database management system", "django", "making decision", "marketing", "elasticsearch", "stack", "javascript", "live streaming", "lua", "swift", "database", "load balancing", "digital marketing", "rabbitmq", "erlang", "nginx", "codeigniter", "react native", "cache", "flutter", "docker", "video marketing", "ansible", "cloud", "video on demand", "php", "cdn", "system design", "live video streaming", "mongodb", "postgresql", "management", "restful"], "fulltext": "Operations \n- Terraform, Ansible, Docker, \nKubernetes \nForeign Languages \n- English \nSoft Skills \n- Time management \n- Communication \n- Active Listening \n- Decision making \nSKILLS \nProgramming Languages \n- C/C++, Golang, Python, Lua, Java, \nSwift, Javascript \nFrameworks/ Platforms \n- Django, Play Framework, Xcode, \nNodeJS,  Flutter, React native \n- RabbitMQ, Kafka, Elasticsearch \nDatabase Management Systems \n- MySQL, PostgreSQL, Mongodb \nCache servers \n- Nginx, Varnish, Memcached, Redis \nPham Phu Tho \nBorn: 27/10/1992 \nPhone: 0985275620 \nEmail: ppt.phutho@gmail.com \nAddress: 100/2A Mieu Go Xoai Street, Binh Tan District, Ho Chi Minh City, VietNam \nSUMMARY \nA developer with 5 years of experience in open source technologies. I love technology, like \nnew things. Every year, I always have target learn a new language. This year will be Erlang \nwith model actor. Which creates the successful of whatsapp. \nEXPERIENCES \nUiza Company\n09/2018 - Now \nProject: ott-agent-cdn-worker \nProject Description: Worker of cdn agent \n01/2019 - Now \nPosition: Software Engineer \nLanguages: Golang, Bash script \nResponsibilities:  \n- Resolve issue to caching and control cache \n- Design and refactor infra to optimize cost in cloud \n- Optimize nginx, implement layer cache and purge cache not scan full disk \nProject: ott-agent-worker \nProject Description: Worker live transcoding \n09/2018 - Now \nPosition: Software Engineer \nLanguages: Golang, bash script \nResponsibilities:  \n- Control and integration process between in stacks \n- Calculator and optimize resources \n- Develop api to integration with services in system \n- Design model cluster processing scalable  \n- Resolve issue interprocess communications \nQueenb Joint Stock Company \n04/2015 - 04/2018 \nProject: Webinaris.com \nProject Description: Webinar platform \n- Digital Marketing \n- Live streaming \n- Video on Demand \n01/2018 - 04/2018 \nPosition: Leader \nLanguages: Python, Bash script \nFrameworks/ Platforms: Flask \nResponsibilities:  \n- R&D load balancing and scalable systems \n- Lead mobile teams \nTeam size: 6 \n05/2017 - 08/2017 \nProject: Piepme.com \nProject Description: Information exchange platform \nPosition: Developer \nLanguages: Swift, Javascript \nFrameworks/ Platforms: Xcode, Nodejs \nResponsibilities:  \n-Develop restful api \n- Pair Program calling mobile \n- Layout and build feature in mobile app \nTeam size: 10 \n01/2016 - 04/2016 \nProject: Smooveo.com \nProject Description: Video marketing platform \n- Video streaming \n- Generator video player template \nPosition: Developer \nLanguages: Php, Javascript \nFrameworks/ Platforms: Codeigniter \nResponsibilities:  \n- R&D packager to video streaming \n- Develop video player from setting template \nTeam size: 7 \nDongA CS Company \n03/2014 - 03/2015 \nProject: E-government platform \nPosition: Java developer \nProject Description: E-government ecosystem \nResponsibilities:  \n- Get requirements from customer \n- Develop feature \nEDUCATION \nHochiminh City Institute Of Applied Science & Technology\n2010 to 2013 \nPowered by TCPDF (www.tcpdf.org)", "educations": [{"id": 4841, "gpa": null, "major": null, "school": "Hochiminh City Institute Of Applied Science & Technology", "diploma": "Other", "end_time": "2013-01-01T00:00:00Z", "conf_score": 0.6925429707670153, "start_time": "2010-01-01T00:00:00Z", "picklist_major": "Other", "major_categories": "", "major_categories_detail": ""}], "experiences": [{"id": 16207, "detail": "ages: Golang, Bash script\nResponsibilities: - Resolve issue to caching and control cache\n- Design and refactor infra to optimize cost in cloud\n- Optimize nginx, implement layer cache and purge cache not scan full disk", "company": "Uiza Company", "end_time": "2023-04-13T00:00:00Z", "industry": "Other", "position": "Software Engineer", "conf_score": 0.8934970860255722, "start_time": "2018-09-01T00:00:00Z"}, {"id": 16209, "detail": "Languages: Python, Bash script\nFrameworks/ Platforms: Flask Responsibilities: - R&D load balancing and scalable systems\n- Lead mobile teams\nTeam size: 6", "company": "Queenb Joint Stock Company", "end_time": "2018-04-30T00:00:00Z", "industry": "Other", "position": "Leader", "conf_score": 0.6925429707670153, "start_time": "2018-01-01T00:00:00Z"}, {"id": 16211, "detail": "Project: Webinaris.com Project Description: Webinar platform\n- Digital Marketing - Live streaming\n- Video on Demand", "company": "Queenb Joint Stock Company", "end_time": "2018-04-30T00:00:00Z", "industry": "Other", "position": null, "conf_score": 0.7507320409926004, "start_time": "2015-04-01T00:00:00Z"}, {"id": 16213, "detail": "Languages: Swift, Javascript Frameworks/ Platforms: Xcode, Nodejs Responsibilities: -Develop restful api\n- Pair Program calling mobile\n- Layout and build feature in mobile app\nTeam size: 10", "company": "Piepme.com", "end_time": "2017-08-31T00:00:00Z", "industry": "Other", "position": "Developer", "conf_score": 0.9351238254697116, "start_time": "2017-05-01T00:00:00Z"}, {"id": 16214, "detail": "Languages: Php, Javascript Frameworks/ Platforms: Codeigniter Responsibilities: - R&D packager to video streaming\n- Develop video player from setting template\nTeam size: 7", "company": "Smooveo.com", "end_time": "2016-04-30T00:00:00Z", "industry": "Other", "position": "Developer", "conf_score": 0.9058589202434705, "start_time": "2016-01-01T00:00:00Z"}, {"id": 16215, "detail": "roject Description: E-government ecosystem\nResponsibilities: - Get requirements from customer\n- Develop feature", "company": "DongA CS Company", "end_time": "2015-03-31T00:00:00Z", "industry": "Other", "position": "Java developer", "conf_score": 0.8333560154692181, "start_time": "2014-03-01T00:00:00Z"}], "address": "100/2a Mieu Go Xoai Street, Binh Tan District, Ho Chi Minh City, Vietnam"}