{"skills": ["sourcetree", "java", "java technology", "c++", "json", "solution design", "javascript", "implementation", "c#", "database management", "xml", "rest", "management", "studio", "text message", "io", "bluetooth", "svn", "structure", "html5", "index", "operating system", "mysql", "swift", "database management system", "android", "trello", "maintenance", "rss", "sql", "restful", "jira", "visual studio", "mvvm", "crashlytics", "microsoft visual studio", "github", "bug fixing", "phonegap", "microsoft", "objective c", "system design", "twitter", "database", "window phone", "cocoa", "omniture", "python", "navigation", "mac o x", "sqlite", "mapbox", "protocol", "google map"], "fulltext": "Hanh Vo \nSenior Mobile Developer  \nI have about 8 years of experience with iOS Android and Windows Phone \nplatform. I can work well in team or independently. I really want to make \ngreat mobile apps and challenge myself with difficult problems. I believe \nthat we can do anything if we really want. I love the adventurous feeling \nwhen playing with some interesting technology. I want to find an attractive \ncompany to work and satisfy my programming passion.  \nTECHNICAL SKILLS  \n\u2022Development Platform: iOS, Android, Windows Phone. \n\u2022Programming Languages: Swift, Objective-C, Java, C#, C++, Python \n\u2022Development Tools: Xcode, Android Studio, Microsoft Visual Studio, \nMicrosoft  Expression Blend, SourceTree, Slack, Trello, Jira. \n\u2022Database Management Systems: MySQL, SQLite. \n\u2022Operating Systems: Mac OS X, iOS, Android, Windows Phone \n\u2022Foreign Languages: English. \nEDUCATION \n\u2022University of Sciences \u2013 BS in Software Engineering. \nPROFESSIONAL EXPERIENCE  \n\u2022iOS \n\u2022Android \n\u2022WindowPhone \nGITHUB  https://github.com/alda07 \nHACKERANK   https://www.hackerrank.com/alda_vo?hr_r=1 \nhanh.vo.programmer@gmail.com\n(+84)938087598\nACHIEVEMENTS \nI. Impression Projects \n1. Copilot (IPAD)  \n\u2022Description: DirectTV is an American direct broadcast satellite service \nprovider and broadcaster . As of July 2015, it is a subsidiary of AT&T. It \nsupplies solution for the entertainment service. COPILOT is \napplication to watch TV on IPAD.  \n\u2022Team Size: 10  \n\u2022Responsibilities:  \n-Research solution  \n-Maintenance and upgrade new features.  \n-Functional, Omniture and Crashlytics bugs fix.  \n-Support team to handle issues.  \n-Tools and Technologies: Objective-C, Xcode, Crashlytic, Omniture, \nJson, Jira,SVN.  \n\u2022Reference: https://itunes.apple.com/us/app/directv-app-for-ipad/ \nid421547368?mt=8  \n\u2022For company: Contractor developer for AT&T (FPT client) \n2. VoiceMap  \n\u2022Description: VoiceMap\u2019s audio walks, cycles and drives are produced \nby insightful local storytellers, including journalists, podcasters, \nfilmmakers, novelists, and tour guides. In 2015, VoiceMap become top \none traveling application in South Africa. \n\u2022Team Size: 1 \n\u2022Responsibilities:  \n-Research solution.  \n-Development features.  \n-Fixing bugs. \n\u2022Tools and Technologies: Objective-C, Xcode, JSON, Restful API, \nMapbox, Audio handling, Github, AFNetworking. \n\u2022Reference: https://itunes.apple.com/us/app/voicemap-city-tours/ \nid852027939?mt=8   \n\u2022For company: SUGAR VENTURES. \nII. Achievements at SUGAR :  http://www.sugar.sg/ \n1.MeetDrinks  \n\u2022Description:  \nMeetDrinks is a social meet-up application that brings people \ncloser together over a mutual appreciation for bespoke drinks and \nelegant conversations. Simply put, our app matches compatible \nurbanites in the same area to meet for drinks. Unlike other dating \napps, by removing the chat and focusing on people meeting up, \nMeetDrinks bridges digital socializing with the real world of dating.  \n\u2022Responsibilities:  \n-Research solution.  \n-Development features.  \n-Fix bugs \n\u2022Team Size: 1. \n\u2022Tools and Technologies: Swift, Xcode, JSON, Rest API, Github, \nAFNetworking, Web socket. \n\u2022Reference: https://itunes.apple.com/vn/app/meetdrinks-h\u1eb9n-h\u00f2-\n\u0111\u00fang-ng \u01b0\u1edd i/id1227336799?mt=8  \n2. Dropfoods \n\u2022Description:  \nDropfoods is the premiere vending machine chain in Vietnam \nstarted by Singapore's successful venture builder, Sugar Ventures. \nDropfoods app is an application to make from simply purchasing \nyour favorite snacks to paying bills at our Dropfoods vending \nmachines a whole lot easier. \n\u2022Responsibilities:  \n-Research solution.  \n-Development features.  \n-Fix bugs. \n\u2022Team Size: 1. \n\u2022Tools and Technologies: Java, Android Studio, JSON, Rest API, \nGithub. \n\u2022Reference: https://play.google.com/store/apps/details?\nid=sugar.dropfood \nIII. At SYNOVA (http://www.synova-solutions.com)\n1.Camera Plugin for PhoneGap \n\u2022Description:  \nWriting a plugin makes a bridge to connect between Objective C \nand PhoneGap.  \n\u2022Team Size: 1 . \n\u2022Responsibilities:  \n-Research solution.  \n-Development features. \n-Create library for frontend team. \n\u2022Tools and Technologies: Objective-C, Xcode, Javascript, Phonegap, \nSVN.  \n\u2022Reference: http://www.easyrecrue.com/?lc=en_GB  \n2. Pressing Box \n\u2022Description: This application is laundry service for French customer. \n\u2022Team Size: 2. \n\u2022Responsibilities:  \n-Research solution.  \n-Structure application and define web service.  \n-Development features.  \n-Support team to handle issues or hard technical points. \n\u2022Tools and Technologies: Objective-C, Xcode, JSON, SVN \n\u2022Reference: https://itunes.apple.com/au/artist/pressing-box/\nid965722693  \nIV. At FPT (https://www.fpt-software.com) \nResearch projects (Internal Project)  \n\u2756 Core Bluetooth plugin for Hybrid application using HTML5 and \nPhoneGap technology.  \n\u2022Description: This is plugin use as the bridge connecting between the \nnative IOS code and PhoneGap project.  \n\u2022Team Size: 1.  \n\u2022Responsibilities: Research solution and implementation core \nBluetooth library. \n\u2756  MQTT Messenger (iOS)  \n\u2022Description: This is an iOS application using MQTT protocol to transfer \nmessage. The messenger app allow user to send text message, picture \nor voice message with a lot of cool emoticon. This project receive  good \nfeedback from DirectTV USA. \n\u2022Team Size: 3. \n\u2022Responsibilities:  \n-Research solution.  \n-Design system, implementation features.  \n-Support team to handle issue and technique.  \nV. At VITALIFY (http://www.vitalify.asia/vn/) \n1. Barcode Kanojo (is closed)  \n\u2022Description: This is iOS application. Kanojo is a girl model. The first \nuser scans the product\u2019s barcode and generates a Kanojo. This user \ncan buy some gift (shirt, glasses, flower...) for this Kanojo. When the \nsecond user scans the barcode of the first one, he can add this Kanojo \nis a friend.  \n\u2022Team Size: 3  \n\u2022Responsibilities:  \n-Working with document to code features.  \n-Fix bugs occurred in coding.  \n-Report to team leader.  \n\u2022Tools and Technologies: Xcode, Versions, Objective-C, ASIHTTP \nRequest, Facebook API, Twitter API, JSON, Barcode.  \n\u2022Reference: https://www.youtube.com/watch?v=F_gQ9wBFBK8 \n2. Love App  \n\u2022Description: This is a social network application on iOS platform. \nThrough this application we can connect to another one. This \napplication helps them find more friends.  \n\u2022Team Size: 3  \n\u2022Responsibilities:  \n-Working with documents to code features. \n-Fix bugs occurred in coding.  \n-Report project to team leader.  \n\u2022Tools and Technologies: Xcode, Cocoa Rest Client, Versions, \nObjective-C, ASIHTTPRequest, Facebook API, Twitter API, JSON. \n\u2022Reference Link: https://itunes.apple.com/jp/app/sign-sain-\nbyutifasshonmedia/id554606249?mt=8 \nVI. At TMA (http://www.tmasolutions.com) \n1.\nmVYP (mobile Visual Yellow Pages)  \n\u2022Description: Visual Yellow Pages, a mobile navigation application \ndeveloped by TMA Mobile Solutions, in Saigon Tourist Coach in Seat \nHandbook. \n\u2022Team Size: 4  \n\u2022Responsibilities:  \n-Research solution, coding, designing, fix bugs.  \n-Report project to team leader.  \n\u2022Tools and Technologies: C#, Window phone, XML, Silverlight, MVVM, \nGoogle map API, Json.  \n\u2022Reference: https://www.facebook.com/tmamobilesolutions/photos/a.\n673456059337810/673456062671143/?type=3&theater \nVII. At University (https://en.hcmus.edu.vn) \n1. Mass-mailing (Part time)  \n\u2022Description:  \nNow it is used at https://www.ascolotus.com/en/index.htm  \n\u2022Team Size: 1 \n\n\u2022Responsibilities: Research solution, coding, designing, fix bugs.  \n\u2022Tools and Technologies: C#, WPF, SQL, Elastic mail API.  \n2. Virtual Teacher. (Thesis - get 9.5 marks)  \n\u2022Description: It gets the idea from https://www.rosettastone.com.  \n\u2022Team Size: 2. \n\u2022Responsibilities: Research solution, coding, designing, fix bugs.  \n\u2022Tools and Technologies: C#, WPF, XML.  \nWorking progress : \n2011 \u2013 2012: Window phone Developer at TMA Solution. \n2012 \u2013 2013:  iOS developer at Vitalify Asia. \n2013 \u2013 2014: Contractor Developer for Direct TV AT&T (FPT client).\n2014 - 2015: Senior iOS Developer at Synova Solution. \n2015 - 2019: Senior Mobile Developer at Sugar Ventures. \nPowered by TCPDF (www.tcpdf.org)", "educations": [{"id": 4847, "gpa": null, "major": "K\u1ef9 thu\u1eadt ph\u1ea7n m\u1ec1m", "school": "University of Sciences", "diploma": "Bachelors", "end_time": null, "conf_score": 0.795966882854041, "start_time": null, "picklist_major": "IT - Hardware/Networking", "major_categories": "M\u00e1y t\u00ednh v\u00e0 c\u00f4ng ngh\u1ec7 th\u00f4ng tin", "major_categories_detail": "M\u00e1y t\u00ednh"}], "experiences": [{"id": 16228, "detail": "", "company": "Sugar Ventures", "end_time": "2019-01-31T00:00:00Z", "industry": "Other", "position": "Senior Mobile Developer", "conf_score": 0.9050765977702602, "start_time": "2015-01-01T00:00:00Z"}, {"id": 16229, "detail": "", "company": "Synova Solution", "end_time": "2015-01-31T00:00:00Z", "industry": "High Technology", "position": "Senior iOS Developer", "conf_score": 0.9050765977702602, "start_time": "2014-01-01T00:00:00Z"}, {"id": 16230, "detail": "", "company": "Direct TV AT&T (FPT client).", "end_time": "2014-01-31T00:00:00Z", "industry": "High Technology", "position": "Contractor Developer", "conf_score": 0.7761728190039863, "start_time": "2013-01-01T00:00:00Z"}, {"id": 16231, "detail": "", "company": "Vitalify Asia", "end_time": "2013-01-31T00:00:00Z", "industry": "Other", "position": "iOS developer", "conf_score": 0.8540987761626926, "start_time": "2012-01-01T00:00:00Z"}, {"id": 16232, "detail": "", "company": "TMA Solution", "end_time": "2012-01-31T00:00:00Z", "industry": "High Technology", "position": "Window phone Developer", "conf_score": 0.7897513794629749, "start_time": "2011-01-01T00:00:00Z"}], "address": null}