{"skills": ["linux", "internet", "java", "mongo", "analytics", "json", "javascript", "cloud", "jdbc", "c#", "bootstrap", "flask", "management", "banking", "object oriented", "object oriented programming", "material design", "j2ee", "html5", "structure", "analysis", "live streaming", "html", "spring", "education technology", "database development", "android", "maintenance", "domain name", "data structure", "asp", "javascript framework", "vod", "linux system", "website development", "sql", "css", "oauth", "software development", "testing", "mvc", "google analytics", "oracle", "database", "navigation", "python", "gson", "nec", "jsp", "streaming", "sqlite", "vast", "php", "jquery"], "fulltext": "DAO DUY VINH \nAddress \n: 64/8 Nguyen Phuc Chu Street. , Ward 15, Tan Binh \nDistrict , HCMC \nMobile phone : 0988-397-501 \nEmail : vinhvs7@gmail.com \nPERSONAL INFORMATION \nDate of birth \n: 28 Jan 1988 \nSex \n: Male \nNationality \n: Vietnamese \nSKILLS \n\u2022 \n.NET \n\u2022 \nJava \n\u2022 \nWeb Dev \n\u2022 \nSQL DB \n\u2022 \nOracle DB \n\u2022 \nJS, HTM, CSS \nWORK HISTORY \n05. 2018 - PRESENT \nSUTRIX SOLUTIONS \n.Net Developer \nProject and position \nTechnical and skill \nProject description: Internet city website CMS. \nMy responsibilities: Dev function and Maintenance.  \nSitecore 9v2, C#, .Net \nframework 4.7, SQL Server, \nMVC \nProject description: UWP application to manage clients \nand introduce products package for sellers. \nMy responsibilities: Dev function and Maintenance. \nUWP, C#, .NetCore, SQLite \nDAO DUY VINH \n2 \n05. 2016 - 05. 2018 \nNEC VIETNAM L.T.D \n.Net Developer \nProject and position \nTechnical and skill \nProject description: Application window form for \nJapanese Banking account service  \nMy responsibilities: Create Detail Design, Create test \ncase, Dev, Review and Maintenance.  \nC#, .Net framework 4.6, SQL \nServer, MVC \nJava Web Developer \nProject and position \nTechnical and skill \nProject description: Web Official Business document for \nJapanese company ( ex: settlement business trip \ndocument ) \nMy responsibilities: Create Detail Design, Create test \ncase, Dev, Review and Maintenance. \nJava, spring framework, Oracle \nDB, Bootstrap 2, HTML, CSS \n08. 2013 \u2013 04.2016 \nFPT TELECOM \u2013 RESEARCH AND DEVELOPMENT \nCENTER \nSystem  \nProject and position \nTechnical and skill \nManage the system of wowza live streaming output & \nresource input with FFMPEG.  \nLinux system, Wowza, FFMPEG \nResearch flash & HTML5 player \nGrind Player Player \nWeb Developer \nDAO DUY VINH \n3 \nProject and position \nTechnical and skill \nPr\u1ecdect description: Website selling the domain name, \nhosting, server services. \nC#, .Net framework 3.5, SQL \nServer, MVC \nProject description: Develop web fptplay.net and web \nIDFptplay by using Python language with Flask \nframework. Fptplay is a website for users in watching \nlive broadcasting programs on TV with many diversified \nchannels, hot movies, gameshow and videos.  \nMy responsibilities: All layout frontend and python \nbackend. \nPython, Flask framework, \ngoogle analytics, Mongo DB, \nVAST 2.0, Oauth 2.0, Bootstrap \n2, Jquery, HTML, CSS \nProject description: Develop wep/wap Mobifone TV using \nPHP with Yii framework. \nMy responsibilities: front end & back end for Live TV, \nVOD and purchase package. \nPHP, Yii Framework, javascript, \nJquery, HTML, CSS \nAndroid app Developer \nProject and position \nTechnical and skills \nProject description: NhacSo app for users in listening \nmusic online and offline. Management of user\u2019s \ninformation, behavior and habits to discover songs. \nMy responsibilities: Layout and code for Browse screen \nto show collection, My Cloud screen to manage user\u2019s \ninformation, songs and playlists of users. \nEclipse editor, Material Design, \nSupport Design, Appcompat \nv7, widget, JSON, GSON, \nMulti-Thread, Animations and \nmany android UI/UX libraries. \nProject description: Hi FPT app, this app for users used \ninternet FPT to view details in user\u2019s contract. User can \nview your internet upload and download speed, postage, \nand report problems from internet. \nMy responsibilities: Layout and code Home screen, \nmenu navigation, list report screen and push notification. \n2012 \u2013 2013 \nDIGIPAY LTD  \nWeb Developer \nDAO DUY VINH \n4 \nProject description: Build up website for selling phone card online. \nMy role: Design layout front end & bootstrap 2, Purchase order.  \nEDUCATION \n2008 \u2013 2012 \nHO CHI MINH CITY UNIVERSITY OF FOREIGN LANGUAGES \u2013 \nINFORMATION TECHNOLOGY (HUFLIT) \nMajor \n: College Information Technology \nEducation Level \n: The Degree of Associate \n2010 \u2013 2012 \nNATIONAL INSTITUTE OF INFORMATION TECHNOLOGY (NIIT) \nMajor \n: Software Engineering \nEducation Level \n: Professional Diploma in Information Technology \nMarks/ GPA  \n: 3.25/4 Excellent. \nQuarter Details \nQuarter \nDetails \nObject Oriented Programing \n: OOPS Using C#, Windows Applications using \n.NET Framework 2.0. \nOpen Source Applications and Data \nStructure \n: Introduction to Linux, Java Programming \nLanguage. \nData-centric Application \nDevelopment \n: Introduction to Web Content Development, \nDatabase Application using ADO.NET & JDBC. \nWeb Applications Design & \nDevelopment \n: Object Oriented Analysis & Design, Web \nApplication using ASP.NET and MVC. \nWeb Component Development using \nJ2EE Platform \n: Application for the J2EE Platform, Web Component \nDevelopment with Servlet and JSP. \nDevelopment using .NET Framework \nand QA \n: Application Development using .NET Framework, \nUnderstanding Software Testing. \nINTERESTS \nHigh tech, mobile, motorcycle, photography, fashion, travel, music, gym\u2026 \nPowered by TCPDF (www.tcpdf.org)", "educations": [{"id": 4849, "gpa": null, "major": "C\u00f4ng ngh\u1ec7 th\u00f4ng tin", "school": "HO CHI MINH CITY UNIVERSITY OF FOREIGN LANGUAGES - INFORMATION TECHNOLOGY (HUFLIT)", "diploma": "Bachelors", "end_time": "2012-01-01T00:00:00Z", "conf_score": 0.7551834254203837, "start_time": "2008-01-01T00:00:00Z", "picklist_major": "IT - Hardware/Networking", "major_categories": "M\u00e1y t\u00ednh v\u00e0 c\u00f4ng ngh\u1ec7 th\u00f4ng tin", "major_categories_detail": "C\u00f4ng ngh\u1ec7 th\u00f4ng tin"}, {"id": 4850, "gpa": "3.25", "major": "K\u1ef9 thu\u1eadt ph\u1ea7n m\u1ec1m", "school": "NATIONAL INSTITUTE OF INFORMATION TECHNOLOGY (NIIT)", "diploma": "Other", "end_time": "2012-01-01T00:00:00Z", "conf_score": 0.8008305582352203, "start_time": "2010-01-01T00:00:00Z", "picklist_major": "IT - Hardware/Networking", "major_categories": "M\u00e1y t\u00ednh v\u00e0 c\u00f4ng ngh\u1ec7 th\u00f4ng tin", "major_categories_detail": "M\u00e1y t\u00ednh"}], "experiences": [{"id": 16236, "detail": "- Project and position\nTechnical and skill\nProject description: Internet city website CMS. My responsibilities: Dev function and Maintenance. Sitecore 9v2, C#, .Net framework 4.7, SQL Server, MVC Project description: UWP application to manage clients and introduce products package for sellers.\nMy responsibilities: Dev function and Maintenance. UWP, C#, .NetCore, SQLite", "company": "SUTRIX SOLUTIONS", "end_time": "2023-04-13T00:00:00Z", "industry": "High Technology", "position": ".Net Developer", "conf_score": 0.7930238043945285, "start_time": "2018-05-01T00:00:00Z"}, {"id": 16237, "detail": "", "company": "DIGIPAY LTD", "end_time": "2013-01-31T00:00:00Z", "industry": "Other", "position": "Web Developer", "conf_score": 0.9260889292191576, "start_time": "2012-01-01T00:00:00Z"}], "address": "64/8 Nguyen Phuc Chu Street. , Ward 15, Tan Binh District , Hcmc"}