{"skills": ["linux", "stack", "css3", "docker", "storage server", "responsive", "javascript", "sales", "mongodb", "search engine", "gitlab", "karma", "gitlab ci", "unit test", "frontend development", "storage service", "mongoose", "git", "elasticsearch", "html5", "redis", "microservices", "search", "css", "restful", "grunt", "webpack", "bower", "le", "unit testing", "github", "testing", "reactjs", "npm", "hacking", "chai", "python", "mocha", "full stack development", "angularjs", "agile", "html"], "fulltext": "Phan Dang Dien\nSOFTWARE ENGINEER\nHanoi, Vietnam\n\uf092  phandd\nSum mary\nCurrently Full Stack Javascript developer at open source company Linagora. 2+ years experience specializing in Javascript. Super nerd who loves\nLinux and enjoys to customize all of development environment. Interested in trying, learning new technologies, tools, devising a better method\nfor challenging tasks. English lover and music enthusiast.\nWork Experience\nOECSolution\nHanoi, Vietnam\nSOFTWARE ENGINEER\nJan. 2017 - Jun. 2017\n\u2022 Front-end Developer, take part in building an awesome beautiful responsive HTML/CSS template, which ended up has almost 2K sales on\nThemeforest market.\nLinagora Open Source Organization\nHanoi, Vietnam\nJAVASCRIPT FULL STACK DEVELOPER\nAug. 2017 - now\n\u2022 Working, contributing to open-source community.\n\u2022 Take part in designing multi-services system, building Restful API for a collaborative platform (OpenPaas).\n\u2022 Developing frontend modular applications.\n\u2022 Integrating multiple microservices (Search engine, mail servers, DAV servers, storage service...) to a collaborative platform.\n\u2022 Implementing unit test, integration test.\n\u2022 Developing major, minor open-source modules to integrate with collaborative platform.\n\u2022 Deploying, setting up CI/CD for microservices.\nAreas of Expertise\nEnvironments\nLinux, Node.js, Modern browsers\nFrameworks/Libraries\nAngularJs, ExpressJs, ReduxJs, ReactJs, Mongoose, SocketIO\nProgramming languages\nJavascript, Python\nDomain-specific languages\nHTML5, CSS3\nDevelopment tools\nGit, Docker, Grunt, Webpack, Gitlab CI/CD, npm, bower, LESS, Pug\nTesting\nUnit test, integration test, Karma, Mocha, Sinon, Chai\nDatabases\nMongoDB, Redis\nSearch Engines\nElasticsearch\nDevelopment Methodologies\nAgile/Scrum\nLanguages\nEnglish (advanced), Vietnamese\nPor tfolio\nOpen-source projects: https://github.com/phandd\nEdu cation\nVNUA (Vietnam National University of Agriculture)\nHanoi, Vietnam\nB.S. IN INFORMATION AND TECHNOLOGY\nMar. 2013 - Aug. 2017\nHonors & Awards\n2016\nTop 6 excellent projects, Hack-a-farm agriculture innovation hackathon by YSEALI\nHanoi\nMAY 6, 2019\nPHAN DANG DIEN \u00b7 R\u00c9SUM\u00c9\n1", "educations": [{"id": 4853, "gpa": null, "major": "C\u00f4ng ngh\u1ec7 th\u00f4ng tin", "school": "VNUA (Vietnam National University of Agriculture)", "diploma": "Bachelors", "end_time": "2017-08-01T00:00:00Z", "conf_score": 0.8501320270971695, "start_time": "2013-03-01T00:00:00Z", "picklist_major": "IT - Hardware/Networking", "major_categories": "M\u00e1y t\u00ednh v\u00e0 c\u00f4ng ngh\u1ec7 th\u00f4ng tin", "major_categories_detail": "C\u00f4ng ngh\u1ec7 th\u00f4ng tin"}], "experiences": [{"id": 16253, "detail": ". 2+ years experience specializing in Javascript. Super nerd who loves\nLinux and enjoys to customize all of development environment. Interested in trying, learning new technologies, tools, devising a better method for challenging tasks. English lover and music enthusiast.", "company": "open source company Linagora", "end_time": "2023-12-31T00:00:00Z", "industry": "Other", "position": "Full Stack Javascript developer", "conf_score": 0.8257906557987156, "start_time": "2023-04-01T00:00:00Z"}, {"id": 16255, "detail": "\u2022 Working, contributing to open-source community.\n\u2022 Take part in designing multi-services system, building Restful API for a collaborative platform (OpenPaas). \u2022 Developing frontend modular applications.\n\u2022 Integrating multiple microservices (Search engine, mail servers, DAV servers, storage service...) to a collaborative platform.\n\u2022 Implementing unit test, integration test.\n\u2022 Developing major, minor open-source modules to integrate with collaborative platform.\n\u2022 Deploying, setting up CI/CD for microservices.", "company": "Linagora Open Source Organization", "end_time": "2023-04-13T00:00:00Z", "industry": "Other", "position": "JAVASCRIPT FULL STACK DEVELOPER", "conf_score": 0.8437224420742124, "start_time": "2017-08-01T00:00:00Z"}, {"id": 16257, "detail": "\u2022 Front-end Developer, take part in building an awesome beautiful responsive HTML/CSS template, which ended up has almost 2K sales on\nThemeforest market.", "company": "OECSolution", "end_time": "2017-06-30T00:00:00Z", "industry": "High Technology", "position": "SOFTWARE ENGINEER", "conf_score": 0.9133023876707873, "start_time": "2017-01-01T00:00:00Z"}], "address": "Hanoi, Vietnam"}