{"skills": ["continuous integration", "networking", "docker swarm", "terraform", "git", "microservices", "c++", "testing", "github", "raid", "svn", "hard disk", "python", "jira", "tomcat", "teamcity", "virtualizations", "linux", "gerrit", "virtualization", "system software", "rancher", "mysql", "oracle", "cloud infrastructure", "mesos", "bugzilla", "scripting", "devops", "cloudformation", "apache", "database", "cisco", "nagios", "dns", "dhcp", "groovy", "grafana", "development testing", "openldap", "ansible", "docker", "cloud", "workflow", "jenkins", "kvm", "php", "cba", "hypervisor", "bash scripting", "sap hana", "prometheus", "management", "hudson", "aws", "gitlab", "proxy"], "fulltext": "86 Binh Thoi Street, District 11,\nHo Chi Minh city, Vietnam\nE-mail: qkhai20@gmail.com\nWebsite: https://www.linkedin.com/in/khai-\nduong-444b2b7b/\nPhone: (084) 916-734436\nPROFESSIONAL SUMMARY\nDedicated to optimization, an experienced DevOps Engineer understands the\ncombination of operations and development to quickly deliver code to customers.\nPassionate and skilled in DevOps, Linux, developing software systems.\nSkills:\nCloud: AWS \nSCM: Git (Gerrit, GitHub), SVN.\nCI/CD: TeamCity, Jenkins, Hudson. \nInfrastructure as Code: Cloudformation, Ansible, Terraform.\nContainer and virtualization: Docker Engine, XEM, KVM, VMware.\nCluster manager: Rancher, Mesos, Marathon, Zookeeper, Docker Swarm.\nScripting: Bash, Python, Groovy\nMonitoring: Nagios, Telegraf, Prometheus,  Grafana\nOthers: JIRA, Confluence, Slack, Microservices, Pair and Mod programming.\nCORE QUALIFICATIONS\nMonitoring, supporting and developing software systems in Python, investigating and\ntroubleshooting issues.\nAssembling platforms and frameworks to automate business processes.\nResearch/Integration new tools/technologies such as Mesos, Marathon, Zookeeper,\nDocker that will enhance their efficiency.\nBuild and improve team processes and workflow to maximize efficiency and\nproductivity.\nQUALIFICATIONS\nAWS (Acloud.guru)\nDocker (Pluralsight)\nTerraform (Pluralsight)\nCCNA (Cisco, VNPro)\nGit Essential Training (Lynda)\nPython (Lynda)\nWORK EXPERIENCE\nTyme Digital (CBA)\n02/01/2019 \u2014 Present\nSenior DevOps Engineer\nCreate / Implemented CI/CD process using TeamCity for the global development\nteam, allowing for dozens of code updates per hour with zero downtime\nActively manage, improve, and monitor cloud infrastructure on AWS, EC2, S3 and so\non, including backups, patches, and scaling.\nWrote Cloudformation and Ansible playbook to deploy, configure, and manage\nservers.\nD\u01b0\u01a1ng Quang Kh\u1ea3i\n1\nAutomated build and deployment using TeamCity to reduce human error and speed up\nproduction processes.\nSAP Lab Vietnam\nSep 2015 \u2014 31/01/2018\nDevOps Engineer\nDuty:\nThe SAP HANA Database DevOps team manages the infrastructure for the HANA\nproduct.\nSupports continuous integration of C++ coding into the SAP HANA.\nSophisticated automated testing facilities and advanced release management\nsystems.\nMajor components are Git, Gerrit, Jenkins, Bugzilla, Mesos, Marathon, Zookeeper with\ncustom-tailored extensions in conjunction with in-house developed software.\nInvestigating and troubleshooting issues for automating testing framework.\nGBST - HCM city (TMA's Project)\nJan 2015 \u2014 Sep 2015\nDevOps Engineer\nDuty:\nInstalling and maintaining for CI systems, Oracle database.\nScripting: Powershell, Groovy, Bash.\nMonitoring and troubleshooting issue. \nCross-team support for reviewing, and building/ testing code. \nTMA Solutions - HCM city\nAug 2014 \u2014 Aug 2015\nSenior System Administrator\nDuty:\nManagement internal services: DNS, DHCP, Routing, SVN, GIT, CVS, Jenkins, Op\nOpenLDAP, Proxy.\nDesign server hard disk layout with multi-type RAID & LVM support.\nInstalling and maintaining the Hypervisor (Proxmox, KVM). \nScripting: Bash.\nInstall and maintain services: Gitlab, Apache, Mysql, PHP, mail system and LDAP,\nDC etc.\nOperate backup & restore tasks.\nAotea Global Services - HCM city\nJanuary 2013 \u2014 Aug 2014\nSystem Administrator\nDuty:\nInstalling and maintaining services on AWS (EC2, IAM, S3 etc...).\nResearch new technologies/tools.\nInstall and maintain Mail server (ZCS 8), web servers (Apache2, Apache-tomcat 7).\nHelpdesk.\nEDUCATION\nSystem Administrator and\nNetworking\n2006 \u2014 2010\nNIIT School\nLinux, Opensource services, Databases, Networking and so on\nCCNA\nJan 2013 \u2014 Jul 2013\nVNPro Center\nBasic networking\nD\u01b0\u01a1ng Quang Kh\u1ea3i\n2\nREFERENCES\nMs. Trang, Senior DevOps at SAP.\nEmail: trang.nguyen02@sap.com\nPhone: +84 916960833\nMr Dinh Van An - Project Manager at TMA\nEmail: vanan15@gmail.com\nTel: +1 (510) 698-2509\nINTERESTS\nPlaying football, swimming, traveling and outdoor activities.\nD\u01b0\u01a1ng Quang Kh\u1ea3i\n3\nPowered by TCPDF (www.tcpdf.org)", "educations": [{"id": 4886, "gpa": null, "major": "Networking", "school": "NIIT School", "diploma": "Other", "end_time": "2010-01-01T00:00:00Z", "conf_score": 0.7696199437739497, "start_time": "2006-01-01T00:00:00Z", "picklist_major": "Other", "major_categories": "", "major_categories_detail": ""}], "experiences": [{"id": 16386, "detail": "Create / Implemented CI/CD process using TeamCity for the global development team, allowing for dozens of code updates per hour with zero downtime\nActively manage, improve, and monitor cloud infrastructure on AWS, EC2, S3 and so on, including backups, patches, and scaling.\nWrote Cloudformation and Ansible playbook to deploy, configure, and manage servers.\nAutomated build and deployment using TeamCity to reduce human error and speed up production processes.", "company": "Tyme Digital (CBA)", "end_time": "2023-04-13T00:00:00Z", "industry": "High Technology", "position": "Senior DevOps Engineer", "conf_score": 0.9073650100896279, "start_time": "2019-01-02T00:00:00Z"}, {"id": 16387, "detail": "Duty: The SAP HANA Database DevOps team manages the infrastructure for the HANA product.\nSupports continuous integration of C++ coding into the SAP HANA. Sophisticated automated testing facilities and advanced release management systems.\nMajor components are Git, Gerrit, Jenkins, Bugzilla, Mesos, Marathon, Zookeeper with custom-tailored extensions in conjunction with in-house developed software.\nInvestigating and troubleshooting issues for automating testing framework.", "company": "SAP Lab Vietnam", "end_time": "2018-01-31T00:00:00Z", "industry": "Other", "position": "DevOps Engineer", "conf_score": 0.9125776658202421, "start_time": "2015-09-01T00:00:00Z"}, {"id": 16388, "detail": "Duty: Installing and maintaining for CI systems, Oracle database.\nScripting: Powershell, Groovy, Bash. Monitoring and troubleshooting issue.\nCross-team support for reviewing, and building/ testing code.", "company": "GBST -", "end_time": "2015-09-30T00:00:00Z", "industry": "Other", "position": "DevOps Engineer", "conf_score": 0.8839503315308961, "start_time": "2015-01-01T00:00:00Z"}, {"id": 16389, "detail": "Duty: Management internal services: DNS, DHCP, Routing, SVN, GIT, CVS, Jenkins, Op OpenLDAP, Proxy. Design server hard disk layout with multi-type RAID & LVM support.\nInstalling and maintaining the Hypervisor (Proxmox, KVM). Scripting: Bash. Install and maintain services: Gitlab, Apache, Mysql, PHP, mail system and LDAP, DC etc.\nOperate backup & restore tasks.", "company": "TMA Solutions - HCM city", "end_time": "2015-08-31T00:00:00Z", "industry": "High Technology", "position": "Senior System Administrator", "conf_score": 0.8531877442427502, "start_time": "2014-08-01T00:00:00Z"}, {"id": 16390, "detail": "Duty: Installing and maintaining services on AWS (EC2, IAM, S3 etc...).\nResearch new technologies/tools.\nInstall and maintain Mail server (ZCS 8), web servers (Apache2, Apache-tomcat 7). Helpdesk.", "company": "Aotea Global Services - HCM city", "end_time": "2014-08-31T00:00:00Z", "industry": "Other", "position": "System Administrator", "conf_score": 0.8531877442427502, "start_time": "2013-01-01T00:00:00Z"}, {"id": 16391, "detail": "Linux, Opensource services, Databases, Networking and so on", "company": null, "end_time": "2010-01-31T00:00:00Z", "industry": "Other", "position": "System Administrator and", "conf_score": 0.7588694396088908, "start_time": "2006-01-01T00:00:00Z"}], "address": "86 Binh Thoi Street, District 11, Ho Chi Minh city, Vietnam"}