{"skills": ["phaserjs", "css", "testing", "analysis", "html", "reactjs", "cryptocurrency", "linux", "full stack development", "redis", "ubuntu", "mysql", "io", "dash", "amazon elasticsearch service", "online version", "orm", "sql", "c#", "elasticsearch", "window server", "stack", "deepstream", "responsive", "javascript", "oop", "bug fixing", "amazon ec2", "load balancing", "wcf", "laravel", "nginx", "mvc", "bootstrap", "window server 2016", "php", "android", "rest", "angularjs", "socket io", "graphql", "mongodb", "vuejs", "management", "sequelize", "aws", "asp"], "fulltext": "Nguyen Minh Quan\nDate of birth: October 09th, 1993\nPhone: 0986 857 348\nEmail:  nmquan.dev@gmail.com\nAddress: HCMC, Vietnam\nUniversity of Science\n08/2011 - 07/2015\nEDUCATION\nSoftware Engineering\nFABA TECHONOLOGY CO.,LTD\n09/2017 - Present\nGLOBAL CYBERSOFT JSC\n02/2017 - 08/2017\nSMARTFUN JSC\n03/2015 - 02/2017\nWORK EXPERIENCE\nSenior Full-stack developer\n* Main responsibilities:\n- Leading a developer team.\n- Solving project problems.\n- Building project architecture.\n- Building a lending system that works with Coinbase cryptocurrency wallet using the Laravel PHP framework. \n- Working with many cool technologies and frameworks including Nodejs, Vue JS, MongoDB, Redis,\nDeepStream,\u2026 in a project of Crypto-Portfolio.\n-  Training team members.\n- Setting up an environment for testing and deployment.\n.Net Developer\n* Main responsibilities:\n- Studying many experiences in Programming Window Application. \n- Working with WCF Service and WonderwareSystem. \n- Making Application with WPF Control.\n- Setting up an environment for testing and deployment.\nFull-stack developer\n* Main responsibilities:\n- Working with Angularjs, Bootstrap to design Responsive Web. \n- Designing the architecture and building adatabase system for mobile applications. \n- Working with Node.js and Socket.io to build Realtime Back-end systems for game Champion-dash of Redbull\nVietnam. \n- Working with ASP.NET MVC and WEB API 2 to build a back-end system for the mobile app and company\nproducts.\n- Setting up an environment for testing and deployment.\nJavascript Excellent\nTECHNICAL SKILLS\nOBJECTIVE\nBeing a Technical Architect in 5 years.\nNodeJS Excellent\nLaravel Good\nOOP Good\nC# Good\nMySQL/SQL Servver\nGood\nReactJS Fair\nVueJS Fair\nMongoDB Fair\nHTML/CSS Fair\nLinux Fair\nHIGH-LIGHT PROJECTS\nFABA TECHONOLOGY CO.,LTD\n(01/2019 - 03/2019)\nCustomer OKXE.VN\nDescription\n- This is an online buying and selling used cars trading platform.\nTeam size\n6\nMy position\nTechnical leader\nMy responsibilities\n- Building base code for the project.\n- Analyzing and designing project system.\n- Solving project problems.\n- Development.\n- Reviewing & Optimizing code.\n- Bug fixing.\n- Researching new technologies and training team members.\n- Setting up an environment for testing and deployment.\nTechnologies used\n- Back-End: Rest API, NodeJS, Express JS, Socket.IO, Sequlelize ORM,\nElasticsearch, S3 AWS\n- Front-End: ReactJS, Bootstrap 4.\n- Server: AWS EC2, Amazon Elasticsearch Service.\n- Link: https://okxe.vn/\nFABA TECHONOLOGY CO.,LTD\n(05/2018 - 11/2018)\nCustomer\nRX Logistic\nDescription\nThis is a human management, internal and international order management\nsystem. \nTeam size\n8\nMy position\nFull-Stack Developer\n- Managing team members.\n- Analyzing and designing project system.\n- Solving project problems.\nMy responsibilities\n- Development.\n- Reviewing & Optimizing code.\n- Bug fixing.\n- Researching new technologies and training team members.\n- Setting up an environment for testing and deployment.\n- Setting up the product load balancing.\nTechnologies used\n- Back-End: NodeJS, Express JS, Socket.IO, MongoDB, GraphQL\n- Front-End: ReactJS, Bootstrap 4.\n- Server: Ubuntu Nginx\n- Link: https://dragonship.vn/\nFABA TECHONOLOGY CO.,LTD\n(11/2017 - 04/2018)\nCustomer\n Company product\nDescription\nCrypto-Portfolio for trader\nTeam size\n4\nMy position\nFull-Stack Developer\nMy responsibilities\n- Building base code for the project.\n- Analyzing and designing project system.\n- Development.\n- Reviewing & Optimizing code.\n- Bug fixing.\n- Researching new technologies.\n- Setting up an environment for testing and deployment.\nTechnologies used\n- Back-End: NodeJS, Express JS, MongoDB, Redis, Deepstream\n- Front-End: VueJS, Bootstrap 4 and Element UI\n- Server: Ubuntu Nginx\n- Link: https://marketee.io/\nGLOBAL CYBERSOFT JSC\n(02/2017 - 08/2017)\nCustomer\nCSCADA - Macau\nDescription\nBuilding the metro management system between Macau and Taipa Island.\nTeam size\n12\nMy position\n.Net Developer\nMy responsibilities\n- Analyzing and designing project system.\n- Development.\n- Reviewing & Optimizing code.\n- Bug Fixing.\n- Setting up an environment for testing.\nTechnologies used\n- C#, WPF, Devexpress, Wonderware Software\n- Server: Windows Server 2016\nSMARTFUN JSC\n(5/2016 - 2/2017)\nCustomer\nPersonal Customer\nDescription\nANALYSIS AND MODELING OF STOCK DATA\nTeam size\n4\nMy position\nProject Leader\nMy responsibilities\n- Leading project team.\n- Analyzing and designing project system.\n- Development.\n- Reviewing & Optimizing code.\n- Bug Fixing.\n- Setting up an environment for testing.\nTechnologies used\n- Back-End: NodeJS Express JS, MySQL, Sequelize ORM, GraphQL\n- Front-End: ReactJS, TradingView Chart\n- Server: Ubuntu\nSMARTFUN JSC\n(1/2016 - 4/2016)\nCustomer\nRedbull Vietnam\nDescription\nBuilding the online version - Champion Dash game.\nTeam size\n4\nMy position\nBack-End Leader\nMy responsibilities\n- Leading project team.\n- Analyzing and designing project system.\n- Development.\n- Reviewing & Optimizing code.\n- Bug Fixing.\n- Setting up an environment for testing.\nTechnologies used\n- Back-End: NodeJS Express JS, MySQL, Sequelize ORM, Rest API\n- Front-End: PhaserJS\n- Server: Ubuntu\nSMARTFUN JSC\n(6/2015 - 12/2015)\nCustomer\nCompany product\nDescription\nBuilding an mobie app to learn Japanese. The user can choose any subject on app\nspecially baseing on the user's location.\nTeam size\n6\nMy position\nBack-End Engineer\nMy responsibilities\n- Analyzing and designing project system.\n- Development.\n- Reviewing &  Optimizing code.\n- Bug Fixing.\n- Setting up an environment for testing.\nTechnologies used\n- Back-End: C#, ASP.NET WebAPI 2, SQL Server\n- Front-End: Android App\n- Server: Ubuntu\nREFERENCES\nMr. Nguyen Thanh Hung\nPosition: Project Manager\nPhone: 0984033338\nEmail: hungnt@fabatechnology.com\nMr. Nguyen Huynh Xuan Phuong\nPosition: Co-Founder\nPhone: 0918890197\nEmail: phuongnhx@fabatechnology.com", "educations": [{"id": 4887, "gpa": null, "major": "K\u1ef9 thu\u1eadt ph\u1ea7n m\u1ec1m", "school": "University of Science", "diploma": "Bachelors", "end_time": "2015-07-01T00:00:00Z", "conf_score": 0.9120881284138798, "start_time": "2011-08-01T00:00:00Z", "picklist_major": "IT - Hardware/Networking", "major_categories": "M\u00e1y t\u00ednh v\u00e0 c\u00f4ng ngh\u1ec7 th\u00f4ng tin", "major_categories_detail": "M\u00e1y t\u00ednh"}], "experiences": [{"id": 16392, "detail": "Main responsibilities:\n- Leading a developer team.\n- Solving project problems.\n- Building project architecture.\n- Building a lending system that works with Coinbase cryptocurrency wallet using the Laravel PHP framework.\n- Working with many cool technologies and frameworks including Nodejs, Vue JS, MongoDB, Redis, DeepStream,... in a project of Crypto-Portfolio. - Training team members.\n- Setting up an environment for testing and deployment.", "company": "FABA TECHONOLOGY CO.,LTD", "end_time": "2023-04-13T00:00:00Z", "industry": "High Technology", "position": "Senior Full - stack developer", "conf_score": 0.9542271074073599, "start_time": "2017-09-01T00:00:00Z"}, {"id": 16393, "detail": "* Main responsibilities:\n- Studying many experiences in Programming Window Application. - Working with WCF Service and WonderwareSystem. - Making Application with WPF Control. - Setting up an environment for testing and deployment.", "company": "GLOBAL CYBERSOFT JSC", "end_time": "2017-08-31T00:00:00Z", "industry": "High Technology", "position": ".Net Developer", "conf_score": 0.9093145317413721, "start_time": "2017-02-01T00:00:00Z"}, {"id": 16394, "detail": "Main responsibilities:\n- Working with Angularjs, Bootstrap to design Responsive Web. - Designing the architecture and building adatabase system for mobile applications.\n- Working with Node.js and Socket.io to build Realtime Back-end systems for game Champion-dash of Redbull Vietnam. - Working with ASP.NET MVC and WEB API 2 to build a back-end system for the mobile app and company products.\n- Setting up an environment for testing and deployment.", "company": "SMARTFUN JSC", "end_time": "2017-02-28T00:00:00Z", "industry": "High Technology", "position": "Full - stack developer", "conf_score": 0.9542271074073599, "start_time": "2015-03-01T00:00:00Z"}], "address": "Hcmc, Vietnam"}