{"skills": ["css3", "symfony", "tomcat", "java", "wordpress", "json", "jboss", "c++", "javascript", "futures", "apache", "java language", "management", "studio", "unit test", "object oriented", "git", "finance", "dom", "svn", "html5", "html", "spring", "ajax", "operating system", "configuration management tool", "management tool", "unified modeling language", "nginx", "sql", "css", "restful", "oop", "configuration management", "jira", "visual studio", "ejb", "microsoft visual studio", "software development", "microsoft", "language modeling", "uml", "laravel", "oracle", "database", "microsoft visio", "hibernate", "macos", "window operating system", "php", "m sql server", "mysql", "jquery"], "fulltext": "PERSONAL DETAILS \n\uf0b7 Name  \nNGUY\u1ec4N M\u1ea0NH B\u00c1O \n\uf0b7 Nationality  \nVietnamese \n\uf0b7 Date of Birth  July, 13th 1993 \n\uf0b7 Sex \n\uf0b7 Marital status \n\uf0b7 Phone No. \n\uf0b7 Email \nEDUCATIONAL BACKGROUND \n\uf0b7 2013 \u2013 2018  Student at Information Technology & Communication University. \n\uf0b7 2018 Graduated from Information Technology & Communication University. \nPROFESSIONAL SUMMARY \n\uf0b7 2 years of experience in professional software development  \n\uf0b7 3 years of experience in object oriented programming. \n\uf0b7 1 years experience in Java \n\uf0b7 2 year experience in PHP ( develop php: wordpress, framework zend, laravel, \ncodeigniter\u2026) \n\uf0b7 Having knowledge in coding, developing program . \n\uf0b7 Having much experience in many field of business. (because I worked in many role: saler, \ntrading staff, PR staff..) \n\uf0b7 Very good soft skills: working in group,leading skill, presentation and communication. \n\uf0b7 Can work well under pressure and new environment. \n\uf0b7 Can study new technique quickly. \n\uf0b7 Interest in future more than present . \n\uf0b7 Having good English skill(Toeic 600 in Fsoft interner Toeic). \nTECHNIQUE \n\uf0b7 Databases etc: MS SQL Server, My SQL, Oracle, ODI \n\uf0b7 Main Programming Language: Java (JavaEE), ajax, json \n\uf0b7 Other Programming Languages: PHP,C++, C, HTML, Css \nNguyen Manh Bao \u2019s CV \n1\n\uf0b7 Programming Tools: Eclipse, NetBean, Visual Studio, Microsoft Visio, PHP Storm, \nJdeveloper, visul code. \n\uf0b7 App server / Middleware: Apache, Tomcat, Jboss, Nginx, Weblogic \n\uf0b7 Framework:  struts1,spring ,JPA, hibernate, EJB, symfony (PHP), Oracle ADF \n\uf0b7 Configuration Management tools: SVN, git \n\uf0b7 OOAD/OOP: Object Oriented Programming (OOP), Unified Modeling Language (UML) \n\uf0b7 Other: Working with Restful webservice \nOPERATING SYSTEMS \nWindows, MacOS \nPROFESSIONAL EXPERIENCE \nWORK EXPERIENCE \nJuly 2017 \u2013 Now \nPosition \nJava Developer: Julior coder, code lead \nOrganization \nFPT SOFTWARE \nJob description \n\uf0d6 Coding modules for Ministry of Finance project \n\uf0d6 Coding API for facebook workpace,.. \n\uf0d6 Coding plugin for system Jira \n\uf0d6 Coding ajax, json \n\uf0d6 Unitest \n\uf0d6 Guide and support other member \n\uf0d6 Study and fix requirement \n\uf0d6 Fix bug \n\uf0d6 Scraping data from partner websites \n\uf0d6 Checking and fix bug on Aladdin server \n\uf0d6 Study and clear requirement with request's owner \n\uf0d6 Create new feature \n\uf0d6 Review code \n\uf0d6 Validate script tag to display ads \nNguyen Manh Bao \u2019s CV \n2\n\uf0d6 Create project dashboard and break development task \nPROJECT LIST \nFPT SOFTWARE \nJuly 2017 \u2013 Present \nPosition :  Java Developer: Junior java dev, team lead. \nProject Description \nProject Description:  \n\uf0b7 This is a big project of Honda, the purpose is synchronize the price \nof all product. \n\uf0b7 This is a big system, the purpose is manage employee\u2026 \nResponsibilities: \n\uf0b7 Coding 24 module categories of product \n\uf0b7 Making manual unit test \n\uf0b7 Fix bug or change code as customer\u2019s requirement \n\uf0b7 Analyze requirement and give suggestion if needed \n\uf0b7 Guide  and support  \nTechnologies Used: \n\uf0b7 Oracle ADF, ODI \n\uf0b7 EJB \n\uf0b7 Mysql  \nTeam size:  20 people  \nEXP \nPosition :  Software Engineer \nAugust 2015 \u2013 June 2017 \nNguyen Manh Bao \u2019s CV \n3\nProject Description \nEXP Description:  \n\uf0b7 EXP is a company to manage develop website on CMS: wordpress \nand Frameworks: zend, laravel, codeigniter.  \n\uf0b7 It provide report about impressions, clicks, revenue... to other \nbusiness team in Geniee \n\uf0b7 It give analytic and forecast to customer about each adsource, \nzone.. \nResponsibilities: \n\uf0b7 Scraping data for server \n\uf0b7 Tracking server's data and fix if problem happen \n\uf0b7 Develope new feature of web server \n\uf0b7 Make unit test \n\uf0b7 Validate ads tag \n\uf0b7 Review code and support  \nTechnologies Used: \n\uf0b7 HTML5, CSS3, JavaScript (jQuery) \n\uf0b7 PHP(Symfony) \n\uf0b7 HTML DOM \nTeam size:  7 people  \nINTERESTS  \nSport: Football, swim, basketball, volleyball \nMusic: Vietnamese, Korean, English. \nNguyen Manh Bao \u2019s CV \n4", "educations": [{"id": 4896, "gpa": null, "major": null, "school": "Information Technology & Communication University", "diploma": "Bachelors", "end_time": "2018-01-01T00:00:00Z", "conf_score": 0.7130919161122453, "start_time": "2013-01-01T00:00:00Z", "picklist_major": "Other", "major_categories": "", "major_categories_detail": ""}], "experiences": [{"id": 16421, "detail": "Job description\nCoding modules for Ministry of Finance project\nCoding API for facebook workpace,..\nCoding plugin for system Jira Coding ajax, json\nUnitest Guide and support other member\nStudy and fix requirement\nFix bug\nScraping data from partner websites\nChecking and fix bug on Aladdin server\nStudy and clear requirement with request's owner\nCreate new feature\nReview code\nValidate script tag to display ads", "company": "FPT SOFTWARE", "end_time": "2023-04-13T00:00:00Z", "industry": "High Technology", "position": "Java Developer: Julior coder, code lead", "conf_score": 0.928250740886282, "start_time": "2017-07-01T00:00:00Z"}], "address": null}