{"skills": ["stack", "xpath", "java", "javascript", "c#", "git", "linq", "spring", "ajax", "spring mvc", "maintenance", "asp", "website development", "sql", "restful", "jira", "mvc", "communication skill", "database", "problem solving skill", "sql query", "problem solving", "full stack development", "jquery"], "fulltext": "Nguyen Tan An\nPhone: \nPhone: 0767416418\nEmail: \nEmail: tanannguyen@gmail.com\nAddress: \nAddress: 37 Ton Duc Thang\nBASIC BASIC\nINFORMATION INFORMATION\n: Birthday Birthday 24/06/1989\n:\nNationality\nLocal Vietnamese\n:\nJob title\nFull Stack Developer\n:\nJob level\nExperienced (non-manager)\n:\nExperiences\n6 Year(s)\n: Gender Gender Male\n: Maritality Maritality Single\n* More than 6 years of experience in .net web developer.\n* Excellent knowledge of C#, ASP.NET, .NET, VB.NET, JavaScript, T-SQL, jQuery, LINQ,\nTortoiseSVN, GIT, JIRA, etc..\n* Knowledge of browser-compatibility issues.\n* Knowledge with Retailer project.\n* Quickly researching new technologies and tools.\n* Good communication skills.\n* Effective problem-solving skills.\n* Working carefully and having experience in working under high pressure.\nOBJECTIVE OBJECTIVE\n09/2012 - now\nCOMPANY :\nSpiraledge, Inc\nPOSITION :\nFull Stack Developer\nDESCRIPTION :\n* Implement Crawling tool data using C#, xpath, SQL server to compare price.\n* Develop new web services using C# and ASP.NET MVC. \n* Maintenance web services using VB Script, Javascripts, Ajax. \n* Design and develop several browsers for database interface that include internal tools,\nreport modules, customer service applications, etc. \n* Offer technical support to existing web service.\nEXPERIENCES EXPERIENCES\n* Created SQL queries and stored procedures using SQL server 2008, 2014.\n* Tested applications for best functionality.\n* Performed maintenance for entire .NET software.\n* Develop web and API using Java, Spring MVC.\n* Work with Shopify project using Restful API.\nSCHOOL NAME :\nBinh Duong University\nTIME :\n09/2007 - 11/2011\nDEGREE :\nCollege\nMAJOR :\nSoftware Engineer\nEDUCATION EDUCATION\nLANGUAGE LANGUAGE English English Intermediate\nAps.net Mvc\nMS SQL Server\nJava\nJavascript\nJquery Ajax\nSKILLS SKILLS\nPowered by TCPDF (www.tcpdf.org)", "educations": [{"id": 4897, "gpa": null, "major": "Software Engineer", "school": "Binh Duong University", "diploma": "Bachelors", "end_time": "2011-11-01T00:00:00Z", "conf_score": 0.9368576369411793, "start_time": "2007-09-01T00:00:00Z", "picklist_major": "Other", "major_categories": "", "major_categories_detail": ""}], "experiences": [{"id": 16422, "detail": "DESCRIPTION : * Implement Crawling tool data using C#, xpath, SQL server to compare price.\n* Develop new web services using C# and ASP.NET MVC. * Maintenance web services using VB Script, Javascripts, Ajax. * Design and develop several browsers for database interface that include internal tools, report modules, customer service applications, etc.\n* Offer technical support to existing web service.\n* Created SQL queries and stored procedures using SQL server 2008, 2014. * Tested applications for best functionality.\n* Performed maintenance for entire .NET software.\n* Develop web and API using Java, Spring MVC. * Work with Shopify project using Restful API.", "company": "Spiraledge, Inc", "end_time": "2023-04-13T00:00:00Z", "industry": "Other", "position": "Full Stack Developer", "conf_score": 0.9114124613063752, "start_time": "2012-09-01T00:00:00Z"}], "address": "37 Ton Duc Thang"}