{"skills": ["angular", "css3", "payment", "html", "java", "crm", "wordpress", "responsive", "javascript", "coffeescript", "manage member", "cloud", "es6", "jdbc", "mongodb", "sales", "bootstrap", "management", "mobile project", "excel", "redux", "heroku", "io", "frontend development", "cakephp", "mongoose", "vuejs", "object oriented", "git", "svn", "firebase", "analysis", "leasing", "structure", "typescript", "html5", "sell", "ajax", "react native", "medium", "redux saga", "android", "ionic", "data structure", "asp", "desktop", "google cloud", "website development", "algorithm", "sql", "grunt", "le", "github", "software development", "reactjs", "npm", "socket io", "database", "teamwork", "gulp", "phpmyadmin", "problem solving", "php", "mysql", "jquery"], "fulltext": "CURRICULUM VITAE of NGUY\u1ec4N QU\u1ed0C  TH\u1ecc \nPERSIONAL DETAILS \nDate of Birth: December 27, 1991 \nINTRODUCTION \nIT passion since childhood, favorite front-end and be trained in a \ngood environment, to try and learn new technology, I want to work as a \nfront-end web developer. I give my endurance & passion to reach \nsuccess. Beautiful and high technology animations are my goal, always \nkeeping can-do attitude to figure out the way to survive and walk through \ndifficulties. The customer satisfaction is the glory that I seek!I want to \nlearn the new technology and experience to improve themselves.  \nPROFESSIONAL EXPERIENCE \n1. Twin Real Estate Solutions [4/2018 - Now] as FRONT-END mobile \napp. \nTwin is an application software company about CRM for real estate, \nproviding information on buying and selling real estate and Solutions for \nreal estate. \nMajor technologies: Ionic 3, React Native, VueJS ... \nTwin is Partner with Google Cloud in Vietnam \nMore information about Twin \n- I have more project mobile: React Native, Ionic 3\u2026 \n- Knowledge about: Firebase, Native code, build app ios/android... \n2. PRIME LABO [3/2017 \u2013 4/2018] as FRONT-END DEVELOPER.  \nPrime-Labo is a Japanese offshore programming company. It \nspecializes in providing software development services such as \ndeveloping business systems and telephony applications, primarily \nfocusing on Web systems for Japanese customers. \n- I have skill about:  Nodejs,  mongodb, webpack... \n- Knowledge about : canvas, vector . \nhave the ability to build a private website with nodejs, mongodb, \nreactjs and redux-saga  heroku server:  https://quoctho-\nreactjs.herokuapp.com \n3. Officience [1/2015 \u2013 2/2017] as FRONT-END \nDEVELOPER.Officience is a State-Of-The-Art French provider of \nbusiness performance services which has pioneered the outsourcing \nindustry in Vietnam. \n- I have skill about HTML 5, CSS3 and code Javascript. \n- Knowledge Basic about : redux, reactJS, react-native \n- Knowledge of Responsive Web design. \n- Can use SASS, LESS and Bootstrap framework. \n- GruntJS and Gulp for Front-end project setup. \n- Have experience about Email template. \n- Can use GIT, SVN. \n- Have experience about, Wordpress and Magento2. \nAlso be able to work under high pressure, good sense of teamwork \nand high responsibility, being technically confident, flexibility, \nproblem-solving ability. \nSOME PROJECT: \na. HOUSEMAP: technology solutions for real estate services, Help \nusers more easily, conveniently and quickly in (buying, selling, leasing \nand leasing) real estate, helping the market develop transparently, \nAccurate and reliable information. \n- link Android \n- link ios \nThis is a large system built in a year. with many features such as: \nConnect real estate supply and demand, sale/rent real estate, find real \nestate on maps, find routes, chat... \nApp is created by React Native with the interface of native base, \ngenerate component with ignite, and redux saga and map. \nb. SKL: SonKim Land's customer application. \n- link Android \n- link ios \n App provided information about projects, introduce new projects, \npromotions grateful to customers, can deposit and payment notifications \nin batches. \nApp is created by Ionic 3 Framework, works on both ios / android and \nensures performance. \nc. Insight-mind: Use canvas and vectors to create images and \neffects on them. Players can add, delete, edit text and images. change \ncolor, size. \nIt was built by CakePHP to retrieve database, snap-svg render \n(canvas, vector) and Socket-IO . \n https://insight-mind.com (an.hoang.user@gmail.com/123456). \nd. Enecolor: The system analyzes the results after the user \nanswers the questions. \nBack-end is used CakePHP and some other technology serves for \nthe analysis. \nFront-end uses ReactJS, Redux ensures highest performance \n http://13.112.48.85/top (staging). \ne. Monoprix [https://www.monoprix.fr] :  Monoprix supermarket \nis a large system of France, the main task of this project is a convert \npsd to html(template mail). They send PSD and PPTX files, required \ncut image from PSD which they prescribed. After conversion into HTML, \nthe next step is to conduct tests on the Browser(Firefox,Chrome) and the \nmail system(Gmail, Yahoo, Outlook).Eventually resubmit html files and \nfolders needed for the customer. \nf. TROPIXA: an ecommerce website selling fashion, housewares. \nBuilds on the framework Magento2, create a new module added \nmagento2. This project is complicated because using Magento2, I feel \nquite interesting with mageto2 structure. But I still have to learn more to \nwork with magento2 Link to page \nhttp://magento2.officience.com/tropixa/(staging). \ng. TESLA: Systems International Bilingual Education in Vietnam, \nbuilds on the framework is based on WordPress. This is an educational \nsite, with pretty nice interface and simple, with the advanced features of \nWordPress. I learned quite a lot about PHP, themes, and how to build a \nWordPress basic themes. Link to page http://tesla.edu.vn/  \nh. WOOMENTUM: This is a PHP based site, a hot Singapore \nstartup. I work as main front-end maintain for this site. This need \nincredibly fast and small changes which teach me how to arrange my \npriority in task. Understand PHP is a requirement to hands-on the front-\nend of this project, I found that PHP essential knowledge (as well as any \nother language) is necessary to become a great front-end engineer. \nBusiness owner feel happy with that fast delivery which helps she deliver \nher message to Singapore\u2019s Women - I\u2019m proud a part of it. Link to page \nhttp://woomentum.com/. \nSKILLS \no ReactJS/ React-Native, Ionic 3, Angular JS \no Redux-saga/Redux \no JQuery/ Javascript(es6)/ typescript \no Nodejs/ Mongoose/ Firebase/ Heroku \no HTML5/ CSS3/ Responsive / Bootstrap / Semantic \n/Coffeescript/ SASS \no Git/ Github/ Adobe PHOTOSHOP \no Npm/ Gulp/ Grunt/ Webpack  \no SQL Server/ MySQL/ phpMyAdmin/Mongodb \nEDUCATION \n* [2015-2016]: Computer center University Of Science Ho Chi Minh \nCity \nintensive education HTML5, CSS3 and JavaScript, learned to \nsolve the problems of layout, animation ... learned many frame work, the \nlibrary for front-end (Bootstrap, animation, gulp ...). \nThis is a good environment for me to practice the basic skills of a \nfront-end programmer, I practiced many projects here. \nCertificate: about Web Programming HTML5, CSS3, JQuery and \nBootstrap \nSubjects studied: \nCreate web pages with HTML5 language \nCustomizable web interface with CSS3 \nResponsive to Media Queries \nHandle with Javascript language website \nUsing jQuery and jQuery Plugin(jQuery UI) \nUsed Bootstrap framework . \n* [2013 \u2013 2015]: National Institute of Information Technology (NIIT)-\nHCM. \nWhich teach me essential skill as a programmer, I found my self fit \nand love programmer job as long as I discover and work on code. \nCertificate:Diploma (Professional Diploma in Information Technology) \nSubjects studied : \n Object-oriented programming using C # \nJava Programming Language  \n Data Structures and Algorithms \n Development of a database application using ADO.NET and \nJDBC \n Develop web applications using ASP.NET 2.0 language \nDevelopment of distributed applications using .NET Framework \ntechnology \nProject In schools (NIIT)-HCM \nLibrary manager \n Management books, Manage members, manage employees \n(allows to add, delete, edit). \n Management login, logout of users, user permissions. Smart \nimport / export inventory from excel \nExperience gained:I learn how hard it is working as a team - and \nfacing real problem of programming in real product.Understand how the \nsystem works. Intervene more on the system fucntion. It\u2019s an awesome \nexperience. \nWeb sell images \nCreate client side applications and web sites that meet customer \nrequirements. \nDevelop, code and test web base software using primarily HTML 5.0, \nPHP, Javascript, and CSS3. \nDesign, develop and deploy mobile applications using and mobile \nversions of web sites. \nexperience gained:Design very carefully, using Html5, Css3, \nJavascript, JQuery, ajax, Bootstrap to design so the pages load speed is \nimproved, there are many other nice effects and smooth, impressive for \nusers. Support on both desktops, tablets and phones. ", "educations": [{"id": 4909, "gpa": null, "major": "C\u00f4ng ngh\u1ec7 th\u00f4ng tin", "school": "National Institute of Information Technology (NIIT)", "diploma": "Other", "end_time": "2015-01-01T00:00:00Z", "conf_score": 0.8715885010081869, "start_time": "2013-01-01T00:00:00Z", "picklist_major": "IT - Hardware/Networking", "major_categories": "M\u00e1y t\u00ednh v\u00e0 c\u00f4ng ngh\u1ec7 th\u00f4ng tin", "major_categories_detail": "C\u00f4ng ngh\u1ec7 th\u00f4ng tin"}, {"id": 4908, "gpa": null, "major": "Khoa h\u1ecdc m\u00e1y t\u00ednh", "school": "University Of Science Ho Chi Minh", "diploma": "Bachelors", "end_time": "2016-01-01T00:00:00Z", "conf_score": 0.8436982530714259, "start_time": "2015-01-01T00:00:00Z", "picklist_major": "IT - Hardware/Networking", "major_categories": "M\u00e1y t\u00ednh v\u00e0 c\u00f4ng ngh\u1ec7 th\u00f4ng tin", "major_categories_detail": "M\u00e1y t\u00ednh"}], "experiences": [{"id": 16466, "detail": "Twin is an application software company about CRM for real estate, providing information on buying and selling real estate and Solutions for real estate.\nMajor technologies: Ionic 3, React Native, VueJS ... Twin is Partner with Google Cloud in Vietnam More information about Twin - I have more project mobile: React Native, Ionic 3... - Knowledge about: Firebase, Native code, build app ios/android...", "company": "Twin Real Estate Solutions", "end_time": "2023-04-13T00:00:00Z", "industry": "High Technology", "position": "FRONT - END mobile app", "conf_score": 0.9206437183501178, "start_time": "2018-04-01T00:00:00Z"}, {"id": 16467, "detail": "Prime-Labo is a Japanese offshore programming company. It specializes in providing software development services such as developing business systems and telephony applications, primarily focusing on Web systems for Japanese customers.\n- I have skill about: Nodejs, mongodb, webpack...\n- Knowledge about : canvas, vector .", "company": "PRIME LABO", "end_time": "2018-04-30T00:00:00Z", "industry": "Other", "position": "FRONT - END DEVELOPER", "conf_score": 0.8275107295019075, "start_time": "2017-03-01T00:00:00Z"}], "address": null}