{"skills": ["continuous integration", "networking", "voip protocol", "terraform", "sonarqube", "git", "c++", "agile", "github", "testing", "ims", "automation", "vmware esxi", "automation test", "python", "zabbix", "virtualizations", "linux", "gerrit", "virtualization", "execution environment", "azure", "voip", "cloud infrastructure", "kanban", "security", "circleci", "window operating system", "openstack", "scripting", "ip multimedia subsystem", "access network", "online education", "devops", "apache", "voip system", "protocol", "load balancing", "cloud service", "wifi", "nginx", "ansible", "docker", "cloud", "rtp", "enterprise", "server load", "jenkins", "debian", "kvm", "php", "operating system", "telecommunication service", "bash scripting", "loggly", "cloud service provider", "maintenance", "network security", "medium", "aws", "gitlab", "haproxy", "proxy"], "fulltext": "NG\u00d4 T\u1ea4N PH\u00c1T \nDOB: \ufffd\ufffd/\ufffd\ufffd/\ufffd\ufffd\ufffd\ufffd | Address: \ufffd\ufffd\ufffd Bui Dinh Tuy, Ward \ufffd\ufffd, Ho Chi Minh City \nMobile: \ufffd\ufffd\ufffd\ufffd\ufffd\ufffd\ufffd\ufffd\ufffd\ufffd | Skype: phat.wu | Email: phat.wu@gmail.com \nSUMMARY \n\u25cf\nMore than 5 years of experience in software application development. \n\u25cf\nMore than \ufffd years of experience as System Engineer for Linux development. \n\u25cf\nMore than \ufffd years of experience as Software Engineer for Networking and \nTelecommunication services development. \n\u25cf\n\ufffd year of experience as DevOps Engineer. \n\u25cf\nExperienced in Agile SCRUM and Kanban methodology. \nKEYS AREAS OF EXPERTISE/STRENGTHS \n\u25cf\nLanguages & Scripting: Bash, Python, NodeJS, PHP \n\u25cf\nCloud Service Provider: AWS, GCP, Azure \n\u25cf\nCloud Infrastructure Open Source: OpenStack \n\u25cf\nContinuous Integration/Continuous Deployment: JenKins, CircleCI, Gitlab \n\u25cf\nOpen Source/\ufffdrd party tool/library: Automation \ufffdAnsible, Terraform\ufffd, \nContainer\ufffdDocker, LXC\ufffd, Monitoring \ufffdELK, Loggly, NewRelic, Zabbix\ufffd, Code \nQuality \ufffdSonarQube\ufffd, Web Server/Load Balancing/Proxy \ufffdApache, NginX, \nHAproxy\ufffd, Notification \ufffdElastAlert\ufffd \n\u25cf\nOperating Systems: Windows, Linux \ufffdRedhat, Debian, OpenSUSE\ufffd \nWORK EXPERIENCE \nPizza Hut Digitial Ventures, United Kingdom \nDevOps Engineer | \ufffd\ufffd/\ufffd\ufffd\ufffd\ufffd \u2013 Now \nProject: Pizza Hut eCommerce Global Platform \n\u25cf\nDevelop and maintain the new Pizza Hut eCommerce Global Platform. \nDuties: \n\u25cf\nDeploy Cloud infrastructure \ufffdAWS\ufffd following Microservice architecture. \n\u25cf\nImplement CI/CD process. \n\u25cf\nCooperate with Development team in local and market offices. \nSkill Set Utilized: \n\u25cf\nBash, Python, NodeJS \n\u25cf\nAWS ecosystem \n\u25cf\nDocker Container \nOpen Source/\ufffdrd party tool \nGit & GitHub \nLinux \n\u25cf\n\u25cf\n\u25cf\nDEK Technologies, Australia \nSoftware Engineer | \ufffd\ufffd/\ufffd\ufffd\ufffd\ufffd \u2013 \ufffd\ufffd/\ufffd\ufffd\ufffd\ufffd \nProject: IMS \ufffdIP Multimedia Subsystem\ufffd \u2013 SBG \ufffdSession Border Gateway\ufffd \n\u25cf\nSBG ensures network security, topology hiding, quality of service, hosted \nNAT/FW traversal, address and port translation \ufffdNAPT\ufffd, transcoding and other \ncritical functions for real time IP streams. \n\u25cf\nSupports encrypted media \ufffdsecure RTP and MSRP\ufffd for unsecure access networks \nlike WiFi. \nDuties: \n\u25cf\nImplement and maintain the installation scripts for automated installation of \nSBG. \n\u25cf\nPractice in Cloud Execution Environment \ufffdCEE\ufffd installation based on OpenStack. \n\u25cf\nDeploy simulator environment with no differences to real target environment. \n\u25cf\nParticipate in many features and requirements of SBG software with good \nquality. \n\u25cf\nSupport other teams to deploy test environment. \nSkill Set Utilized: \n\u25cf\nBash \n\u25cf\nOpenStack \n\u25cf\nNetworking \n\u25cf\nVirtualization \ufffdKVM\ufffd \n\u25cf\nLinux \n\u25cf\nGit & Gerrit \nMiracle Linux Corporation, Japan \nSoftware Engineer | \ufffd\ufffd/\ufffd\ufffd\ufffd\ufffd \u2013 \ufffd\ufffd/\ufffd\ufffd\ufffd\ufffd \nProject: Miracle Zabbix \ufffdZBX\ufffd \n\u25cf\nMonitoring software for Japan. \nDuties: \n\u25cf\nMaintenance \u2013 update based on official Zabbix package. \n\u25cf\nFix bugs and adding new features acting at customers\u2019 requests. \n\u25cf\nTest on multi-platforms. \nSkill Set Utilized: \n\u25cf\nC/C++ \n\u25cf\nZabbix \n\u25cf\nTesting methodologies \nMiracle Linux Corporation, Japan \nSystem Engineer | \ufffd\ufffd/\ufffd\ufffd\ufffd\ufffd \u2013 \ufffd\ufffd/\ufffd\ufffd\ufffd\ufffd \nProject: Miracle Linux - Asianux \n\u25cf\nA unified Linux platform. \nDuties: \n\u25cf\nDevelop and maintain Linux OS based on RedHat Enterprise Linux. \n\u25cf\nDevelop installer - Anaconda acting at customers\u2019 requests. \n\u25cf\nAutomation test on Azure. \n\u25cf\nDocument design specifications, installation instructions, and other \nsystem-related information. \n\u25cf\nResearch new technology to improve current system. \nSkill Set Utilized: \n\u25cf\nBash, Python, PHP \n\u25cf\nLinux \n\u25cf\nAzure \n\u25cf\nDocker Container \n\u25cf\nOpen Source/\ufffdrd party tool \n\u25cf\nVirtualization \ufffdKVM, VMware ESXi\ufffd \n\u25cf\nGit & Gitlab \nUniversal Technology Services, Vietnam \nSystem Engineer | \ufffd\ufffd/\ufffd\ufffd\ufffd\ufffd \u2013 \ufffd\ufffd/\ufffd\ufffd\ufffd\ufffd \nProject: Online Education Platform \n\u25cf\nA platform learning English online via VoIP. \nDuties: \n\u25cf\nDeploy and integrate features into VoIP system. \n\u25cf\nDocument design specifications, installation instructions, and other \nsystem-related information. \n\u25cf\nCommunicate with staff or clients to understand specific system requirements. \nSkill Set Utilized: \n\u25cf\nBash, Python \n\u25cf\nLinux \n\u25cf\nOpen Source/\ufffdrd party tool \n\u25cf\nNetworking \n\u25cf\nVoIP protocols \ufffdSIP, RTP\ufffd \nEDUCATION \nUNIVERSITY OF SCIENCE, HCMC \n\u25cf\nBachelor of Science, Information Technology | \ufffd\ufffd\ufffd\ufffd \u2013 \ufffd\ufffd\ufffd\ufffd \no\nNetworks and Telecommunication \no\nGPA \ufffd.\ufffd \nPowered by TCPDF (www.tcpdf.org)", "educations": [{"id": 4914, "gpa": null, "major": "C\u00f4ng ngh\u1ec7 k\u1ef9 thu\u1eadt v\u1eadt li\u1ec7u x\u00e2y d\u1ef1ng", "school": "UNIVERSITY OF SCIENCE, HCM", "diploma": "Bachelors", "end_time": null, "conf_score": 0.7318217841552522, "start_time": null, "picklist_major": "Technical", "major_categories": "C\u00f4ng ngh\u1ec7 k\u1ef9 thu\u1eadt", "major_categories_detail": "C\u00f4ng ngh\u1ec7 k\u1ef9 thu\u1eadt ki\u1ebfn tr\u00fac v\u00e0 c\u00f4ng tr\u00ecnh x\u00e2y d\u1ef1ng"}], "experiences": [{"id": 16475, "detail": "Project: Pizza Hut eCommerce Global Platform \u25cf Develop and maintain the new Pizza Hut eCommerce Global Platform. Duties: \u25cf Deploy Cloud infrastructure AWS following Microservice architecture.\n\u25cf Implement CI/CD process.\n\u25cf Cooperate with Development team in local and market offices.\nSkill Set Utilized: \u25cf Bash, Python, NodeJS \u25cf AWS ecosystem\nDocker Container Open Source/ rd party tool\nGit & GitHub Linux", "company": "Pizza Hut Digitial Ventures", "end_time": "2023-12-31T00:00:00Z", "industry": "Other", "position": "DevOps Engineer", "conf_score": 0.7837731805150802, "start_time": "2023-04-01T00:00:00Z"}], "address": "Bui Dinh Tuy, Ward , Ho Chi Minh City"}