{"skills": ["google ads", "digital marketing", "sql", "sonar", "java", "git", "marketing", "jira", "oop", "retrofit", "software development", "microsoft", "xml", "maintenance", "soapui", "insurance", "java core"], "fulltext": "\uf19d\n EDUCATION\nTON DUC THANG UNIVERSITY\nOCT 2012 - APR 2016\nMajor: Software Engineer\nDegree: Bachelor's degree\n\uf0f6 SUMMARY\nSINCE 2016\n* 2+ years of working experience in Java software development.\n* 1.5+ years of working experience in WebService: SoapUI, Axis2.\n* 2+ years of working experience in subversion: GIT.\n* 2+ years of working experience in Code Review tool: Jira.\n* Basic knowledge of front end.\n* Basic knowledge of facebook and google ads.\nNGUYEN HUU VINH\nJAVA Developer\n\uf073June 11, 1993\n\uf007 Male\n\uf095 +84906700746\n\uf0b1\nWORK EXPERIENCE\nDXC.TECHNOLOGY - CSC VI\u1ec6T NAM\nDEC 2016 - PRESENT\nAssociate Software Engineer\nI worked on many projects of INTEGRAL.\n- INTEGRAL BASE 05/12/2016 to 16/04/2017:\n \u2022 Fix Admin System defects.  \n \u2022 Sonar qube. \n \u2022 Change System UI.\n- INTEGRAL Phongsavanh Insurance 17/04/2016 to 06/10/2017:\n \u2022 Design Letters base on BRD-Output Document. \n \u2022 Design XML Printing base on Output Documents Mapping. \n \u2022 Design iReport Templates base on Output Documents Templates. \n \u2022 The first ever team implement group WebServices. \n- SOMPO INTEGRAL THAILAND 09/10/2017 to 16/11/2018:\n \u2022 Implement new and fix defects WebServices.\n \u2022 Retrofit many defects CleanUp, Performance from BSIB (Malaysia project) to SIT (Thailand\nproject).\n \u2022 Implement new and fix defects BatchJobs.\n \u2022 Fix defects, improve performance Admin System.\n- SOMPO MAINTENANCE Project 19/11/2018 to present:\n \u2022 Support customer.\n \u2022 Implement change requests.\n \u2022 Fix production bugs.\nSPORTSHOP.VA LIMITED COMPANY\nDEC 2017 - PRESENT\nDirector Digital Marketing\n- Develop content for products, pages.\n- Create and execute marketing work plans.\n- Provide solutions for training and nutrition plans for customers.\n- Knowledge of Facebook and Google ads.\n\uf199 vinh.vasport@gmail.com\n\uf041District 6, HCM City, Vietnam\n\uf129 facebook.com/vinh.hardy\nOBJECTIVE\nSeeking position of a Java Developer\nwhere I would be able to put all\npassion and use the knowledge gained\nin the software development cycle and\ntechnical aptitude.\nSKILLS\nJava Core\nWebService\nOOP\nMicrosoft SQL\nFont End\nDigital Marketing\nINTERESTS\nGym\nNutrition\nTravel\n\uf040\nADDITIONAL INFORMATION\nmanage of Sportshop.vn (fb.com/sportshopzen)\nmanage of VASPORT (fb.com/vasport.vn)\n\u00a9 topcv.vn\nPowered by TCPDF (www.tcpdf.org)", "educations": [{"id": 4918, "gpa": null, "major": "Software Engineer", "school": "TON DUC THANG UNIVERSITY", "diploma": "Bachelors", "end_time": "2016-04-01T00:00:00Z", "conf_score": 0.8413267261986577, "start_time": "2012-10-01T00:00:00Z", "picklist_major": "Other", "major_categories": "", "major_categories_detail": ""}], "experiences": [{"id": 16482, "detail": "- Develop content for products, pages.\n- Create and execute marketing work plans.\n- Provide solutions for training and nutrition plans for customers.\n- Knowledge of Facebook and Google ads.", "company": "SPORTSHOP.VA LIMITED COMPANY", "end_time": "2023-04-13T00:00:00Z", "industry": "Other", "position": "Director Digital Marketing", "conf_score": 0.9522414576104914, "start_time": "2017-12-01T00:00:00Z"}, {"id": 16483, "detail": "\u2022 Implement new and fix defects WebServices. \u2022 Retrofit many defects CleanUp, Performance from BSIB (Malaysia project) to SIT (Thailand project).\n\u2022 Implement new and fix defects BatchJobs. \u2022 Fix defects, improve performance Admin System. - SOMPO MAINTENANCE Project 19", "company": "DXC.TECHNOLOGY - CSC VI\u1ec6T NAM", "end_time": "2023-04-13T00:00:00Z", "industry": "High Technology", "position": "Associate Software Engineer", "conf_score": 0.9023226832672142, "start_time": "2016-12-01T00:00:00Z"}], "address": "district 6, Hcm City, Vietnam"}