{"skills": ["studio", "css", "agile", "extjs", "python", "html", "mysql", "jquery", "angular", "mssql", "microsoft", "accounting", "sql", "visual studio", "program debugging", "c#", "javascript", "database", "accounting softwares", "mvc", "cloud", "reds", "futures", "software development", "asp"], "fulltext": "Ong Nguy\u00ean Ph\u00fa \n.NET Developer \nDate of birth: \n1992 \nGender: \nMale \nAddress: \nTPHCM \nOBJECTIVE \nExcellent team player and content expert with in-depth knowledge of development tools and languages. \nHopeful for a chance to apply 5 + years of experience in developing designs, code; debugging programs to \nreal problems, and adding value to the business. \nKeep improving myself to pursue a successful career in software development where skills in coding, \ntroubleshooting, and analyzing will be useful in the delivery of state-of-the-art software solutions. \nWORK EXPERIENCE \nBig Red Cloud \n(September 2016 - Now) \nCustomer \nBigRedCloud (Ireland) \nDescription \nCloud accounting software for small businesses \nTeam size \n4 \nMy position \nDeveloper \n+ Meeting with customers and teammates to get clear requirement. Improve \nand maintain project. \nMy responsibilities \n+ Delivered new or enhanced developments \n+ Works with team leader to restructure the back-end (replace old tech with \nnew tech) \n+ Apply clean code with the legacy code \nASP.NET Webform - ASP.NET MVC (API) \nTechnologies used \nHTML - CSS - ExtJS 4.1 \nDDD (Domain Driven Design) \nSQL \nPSI \n(September 2013 - September 2016) \nCustomer \nPSI \nDescription \nA healthcare system for managing health status used by both patient and \ndoctor. \nTeam size \n4 \nMy position \nJunior Developer \nMy responsibilities \nFollow team leader to implement new features and fix bugs \nTechnologies used \nASP.NET MVC \nHTML - CSS - Javascript - jQuery \nTECHNOLOGY SUMMARY \nC# \nAdvance \nJavascript  Advance \nExt JS \nAdvance \nHTML, CSS \nIntermediate \nAngular 2+ \nBasic \nPython  Basic \nDevelopment Tools \nVisual Studio 2017, VS Code, Pycharm \nDatabase \nMSSQL Server, MySQL \nMethodologies \nWaterfall Approach, Agile, Scrum Scrumban \nSystems  Windows \nEXPECTATIONS \n+ Be a technical architect in near future in order to build a successful project \n+ Have more challenges to improve \n+ Could show my abilities and get higher promotion in future \nCERTIFICATIONS \n2018 \nMicrosoft Certificate Solution Developer Certifications \nEDUCATION \n2010 - 2014 \nHCMUS - University of Science \nBachelor Degree \nSoftware Engineer \nINTERESTS \nI like to play soccer, hiking, music and games \n\u00a9 topcv.vn ", "educations": [{"id": 4919, "gpa": null, "major": "Software Engineer", "school": "HCMUS - University of Science", "diploma": "Bachelors", "end_time": "2014-01-01T00:00:00Z", "conf_score": 0.7851615749618549, "start_time": "2010-01-01T00:00:00Z", "picklist_major": "Other", "major_categories": "", "major_categories_detail": ""}], "experiences": [{"id": 16484, "detail": "+ Meeting with customers and teammates to get clear requirement. Improve and maintain project.\nMy responsibilities\n+ Delivered new or enhanced developments\n+ Works with team leader to restructure the back-end (replace old tech with new tech)\n+ Apply clean code with the legacy code\nASP.NET Webform - ASP.NET MVC (API) Technologies used\nHTML - CSS - ExtJS 4.1 DDD (Domain Driven Design) SQL PSI (Se", "company": "Big Red Cloud", "end_time": "2023-04-13T00:00:00Z", "industry": "Other", "position": "Developer", "conf_score": 0.7828559450360946, "start_time": "2016-09-01T00:00:00Z"}, {"id": 16486, "detail": "y responsibilities\nFollow team leader to implement new features and fix bugs\nTechnologies used\nASP.NET MVC HTML - CSS - Javascript - jQuery", "company": "Big Red Cloud", "end_time": "2016-09-30T00:00:00Z", "industry": "Other", "position": "Junior Developer", "conf_score": 0.6996816990411938, "start_time": "2013-09-01T00:00:00Z"}], "address": "Tphcm"}