{"skills": ["linux", "aws", "core data", "payment", "java", "concurrency", "c++", "javascript", "tcp", "ams", "cloud", "cloud service", "rest", "udp", "io", "object oriented", "git", "firebase", "react native", "uikit", "swift", "rtmp", "google cloud", "parse server", "design pattern", "restful", "oop", "core graphic", "software development", "objective c", "uml", "unity", "cocoa", "teamwork", "networking", "xcode", "streaming", "php", "mysql"], "fulltext": " Page 1/3 \nVo Minh Thong (Mr.) \nSolution Architecture Mobile \nSummary  \nA software developer for over 7+ years, I have worked on Objective C and Swift based projects \nfor over 6 years and 1 year for manager project. \nI am good at object-oriented and functional programming. I try to learn something new \neveryday. I often try to bring these skills into my daily teamwork. Even though teamwork is a natural \nskill to me, I often find myself doing my own researches at late night to tackle some challenging \nproblems. That\u2019s my way of self-improvement.  \nEducation \nGraduation: \n- \n2010 \u2013 2013: Software Engineer \u2013 University Of Science. \n- \n07/2012: Starting iOS Development \nTechnical Skills \n- \nXcode & Interface Builder \n- \nObjC, Swift, Nodejs, Javascript, PHP \n- \nBuilding to Devices \n- \nDistributing an App (preferably for an app on the App Store) \n- \nFluency with Swift OR Objective-C \n- \nUIKit, Auto Layout \n- \nDebugging in Xcode \n- \nInstruments \n- \nXib\u2019s, Storyboards, Segues and related presentation/transition \n- \nCore Data, Cocoa Touch \n- \nCore Graphics, OpenGL, Metal, GLSL.  \n- \nDesign Patterns Swift/ ObjC \n- \nREST and/or SOAP \n- \nGit, Subversion or other version control \n- \nUnderstanding of Clean Coding Principles \n- \nUnderstanding of SOLID \n- \nThreading and Concurrency \n- \nHave built for both iPhone and iPad, ideally in a universal app \n- \nPayment: Stripe, Braintree, Paybox \n Page 2/3 \nWork Experience \nKobe Kara (10/2013 \u2013 05/2014) \nRole: \niOS Developer \nLearned Skills: \n- \nObjective C, C++ \n- \nOOP, UML \n- \nDistribute the app to Apple Store \n-  MySQL \nProjects: \n- \nBogaca: Out of date \nNexle Corporation (05/2014 \u2013 05/2015) \nRole: \niOS Developer \nLearned Skills: \n- \nObjective C, C++, Swift, Java \n- \nRTMP, RTMPS, TCP, UDP, XMPP, MQTT \n- \nBLE, iBeacon, Sensor Temp. \n- \nGPUImage, CoreData, Restful API. \n- \nWebRTC, Linphone and video streaming, social network technology. \nProjects: \n- \nGayM: Social network application(Out of date) \n- \nBrandMate: Social network and branding application(Out of date) \n- \nTalkLife: Social network application -https://talklife.co/ \n- \nFOND: Dating Online application(Out of date) \n- \nRope Access Hub: Social network application(Out of date) \n- \nXMPP: Make the library chat real time.(Out of date) \nEvizi(05/2015 \u2013 05/2016) \nRole: \niOS Developer \u2013 Senior iOS Developer \nLearned Skills: \n- \nChart, Swift, C \n- \nRemote working, leader iOS \nProjects: \n- \nZUUS: Social network application (out of date) \n- \nEarCrush: Multimedia application(out of date) \nUlab (05/2016 \u2013 03/2017) \nRole: \nSenior iOS Developer \u2013 Leader team iOS  \n Page 3/3 \nLearned Skills: \n- \nAR, AI, C, Unity \n- \nAWS, EC2, AWS S3, Linux. \n- \nOpenCV, OpenGL \n- \nCommunicate with the client and my team to clear requirements and \nbugs. \nProjects: \n- \nWOW Keyboard: Multimedia, Utility and Social networking \napplication(out of date) \n- \nHot Spotting: Combine AI with AR and E-commercial application (out of \ndate) \n- \nKaching: Combine Unity game  with native iOS system(out of date) \n- \nFilm Fans: Booking film online application(out of date) \nMaple Labs (04/2017 \u2013 02/2019) \nRole: \nSolution Architecture- Manager \n Learned Skills: \n- \nDev Ops (starting) \n- \nNodejs, Javascript, C++, C, React Native, PHP \n- \nAWS, EC2, AWS S3, Linux, Google Cloud Service, Firebase, Parse Server \n- \nPayment method: Stripe, Braintree, PayBox. \n- \nExpert Objective C and Master Swift \n- \nOpengl, GLSL Lanugage, Metal, CoreGraphic, Filter video, image and \nAudio. \nProjects: \n- \nWeChain: Social network application -https://we-chain.com/en \n- \nNavily: Find the anchor spot and book berths -https://www.navily.com \n- \nAppBike: Rental car -https://www.app-bike.co.uk/ \n- \nESSONE: News application -http://www.essonne.fr/ \n- \nNoddier: Private delivery application -https://noddier.com/ \n- \nCabsule: List service rental car (out of date) \n- \nInStaShot: Edit video for professor application(out of date) \n- \nGo: Rental car  \n- \nGlobal Icon: Branding network application \n- \nDUDE: Multimedia social network application \n- \nBaoThuaThienHue: News application -http://baothuathienhue.vn/ \n- \nBaoAnGiang: News application -http://baoangiang.com.vn/ \n- \nTinTucMienTay: News application -http://tintucmientay.com.vn/ \n- \nWiz Wallpapers: Entertainment application -https://wizstudio.io/ ", "educations": [{"id": 4924, "gpa": null, "major": "Software Engineer", "school": "University Of Science.", "diploma": "Bachelors", "end_time": "2013-01-01T00:00:00Z", "conf_score": 0.8263227818945743, "start_time": "2010-01-01T00:00:00Z", "picklist_major": "Other", "major_categories": "", "major_categories_detail": ""}], "experiences": [{"id": 16514, "detail": "Learned Skills: - Dev Ops (starting)\n- Nodejs, Javascript, C++, C, React Native, PHP - AWS, EC2, AWS S3, Linux, Google Cloud Service, Firebase, Parse Server - Payment method: Stripe, Braintree, PayBox. - Expert Objective C and Master Swift - Opengl, GLSL Lanugage, Metal, CoreGraphic, Filter video, image and\nAudio. Projects: - WeChain: Social network application -https://we-chain.com/en\n- Navily: Find the anchor spot and book berths -https://www.navily.com\n- AppBike: Rental car -https://www.app-bike.co.uk/\n- ESSONE: News application -http://www.essonne.fr/\n- Noddier: Private delivery application -https://noddier.com/\n- Cabsule: List service rental car (out of date)\n- InStaShot: Edit video for professor application(out of date)\n- Go: Rental car\n- Global Icon: Branding network application\n- DUDE: Multimedia social network application\n- BaoThuaThienHue: News application -http://baothuathienhue.vn/\n- BaoAnGiang: News application -http://baoangiang.com.vn/\n- TinTucMienTay: News application -http://tintucmientay.com.vn/\n- Wiz Wallpapers: Entertainment application -https://wizstudio.io/", "company": "Maple Labs", "end_time": "2019-02-28T00:00:00Z", "industry": "Other", "position": "Solution Architecture - Manager", "conf_score": 0.9112252009722283, "start_time": "2017-04-01T00:00:00Z"}, {"id": 16515, "detail": "Learned Skills: - AR, AI, C, Unity - AWS, EC2, AWS S3, Linux. - OpenCV, OpenGL - Communicate with the client and my team to clear requirements and bugs.\nProjects: - WOW Keyboard: Multimedia, Utility and Social networking application(out of date)\n- Hot Spotting: Combine AI with AR and E-commercial application (out of date)\n- Kaching: Combine Unity game with native iOS system(out of date)\n- Film Fans: Booking film online application(out of date)", "company": "Ulab", "end_time": "2017-03-31T00:00:00Z", "industry": "Other", "position": "Senior iOS Developer - Leader team iOS", "conf_score": 0.8855279524477552, "start_time": "2016-05-01T00:00:00Z"}, {"id": 16516, "detail": "Learned Skills: - Chart, Swift, C - Remote working, leader iOS Projects: - ZUUS: Social network application (out of date)\n- EarCrush: Multimedia application(out of date)", "company": "Evizi", "end_time": "2016-05-31T00:00:00Z", "industry": "Other", "position": "iOS Developer - Senior iOS Developer", "conf_score": 0.8876878364100665, "start_time": "2015-05-01T00:00:00Z"}, {"id": 16517, "detail": "Learned Skills: - Objective C, C++, Swift, Java - RTMP, RTMPS, TCP, UDP, XMPP, MQTT - BLE, iBeacon, Sensor Temp. - GPUImage, CoreData, Restful API. - WebRTC, Linphone and video streaming, social network technology.\nProjects: - GayM: Social network application(Out of date)\n- BrandMate: Social network and branding application(Out of date)\n- TalkLife: Social network application -https://talklife.co/\n- FOND: Dating Online application(Out of date)\n- Rope Access Hub: Social network application(Out of date)\n- XMPP: Make the library chat real time.(Out of date)", "company": "Nexle Corporation", "end_time": "2015-05-31T00:00:00Z", "industry": "Other", "position": "iOS Developer", "conf_score": 0.8855279524477552, "start_time": "2014-05-01T00:00:00Z"}, {"id": 16518, "detail": "Learned Skills: - Objective C, C++ - OOP, UML - Distribute the app to Apple Store - MySQL Projects: - Bogaca: Out of date", "company": "Kobe Kara", "end_time": "2014-05-31T00:00:00Z", "industry": "Other", "position": "iOS Developer", "conf_score": 0.8855279524477552, "start_time": "2013-10-01T00:00:00Z"}], "address": null}