{"skills": ["search", "rspec", "continuous integration", "networking", "git", "css", "ruby", "agile", "extjs", "golang", "html", "linux", "search engine", "mysql", "jquery", "linux system", "javascript", "website development", "database", "mvc", "ansible", "docker", "workflow", "jenkins", "operation system", "php", "rail", "rest", "mongodb", "relational database", "postgresql", "communication skill", "problem solving"], "fulltext": "  X` \nNGUYEN QUOC KIEN \nRUBY ON RAILS, GOLANG DEVELOPER \nCAREER OBJECTIVE \nTo be able to work for an encouraging and stable company that will assist me in developing, \nimproving, and obtaining the necessary skills in order to become the best engineer. \nTECHNICAL: \nExperience with:  \n- Ruby, Golang programming. \n- Ruby On Rails & basic with Sinatra \nframeworks. \n- Relational databases: PostgreSQL, basic \nwith MySQL. \n- Search engine with SOLR. \n- Operations system: Linux and monitor \nserver. \n- Continuous integration: basic about Jenkins, \nansible, Docker. \n- GIT, GIT Workflows. \n- JavaScript, JQuery, HTML, CSS. \n- Web Programming Skills. \n- Web Services: REST Ful API. \n- Design and develop websites by MVC \nmodel. \n- Basic with Docker. \n- Agile/Scrum. \nEXPERIENCE \nWEB DEVELOPER (Ruby on Rails, Golang, PostgreSQL)  \nRuby on Rails Trainee \nC \nApr 2016 to present | LARION Company (current is BESTARION Company) \n- Design, build, and maintain efficient, reusable, and reliable code for an application about \nhealthcare field at USA. \n- Analyze, design and write code base on requirement\u2019s BA and customer. Contribute in \nphases of the development application. \n- Write Unit Code with RSpec gem. \n- Involve to setup environment and release application process. \n- Supporting other members (BA, QC and new comer) and review junior developer\u2019s code. \n- Helping train other members of the team in areas where I have more experience. \n- Perform other technical tasks assigned by the technical lead. \n- Technical: Work with Ruby, Rails, Golang, PostgreSQL, GIT, Linux, Sinatra, Solr, ExtJS, \nbasic with Jenkins, Docker, \u2026 \nJun 2015 to Mar 2016 | ZIGExN VeNtura Company \n- I was trained and completed course about Ruby on Rails at ZIGExN VeNtura Company. \nI work part-time here during the last semester of college.  \n- I involved and built a web applications using Ruby on Rails. It\u2019s related with real estate \nfield at Viet Nam (ChoNha project: chonha.vn). \n- Technical: Basic about Ruby, Rails, MySQL, MongoDB, Docker, crawler web and full-\ntext search with Solr. \nSKLLS \nRuby on rails framework. \nPostgreSQL.  Linux. \nDocker. \nGood at Problem Solving. \nAttentive listening and effective \noral communication skills. \nGolang programing. \nGit, Git workflow. \nGood at Team work. \nSocial activities and team building. \nINTERESTS \nNew technologies \nProblem Solving \nPhysical Activities \nBooks \nCoffee \nTravel \nCONTACT \nABOUT ME \nDate of Birth: Sep 5th, 1993. \nGender: Male. \nBirth Place: Binh Duong. \nENGINEERING DEGREE \n- Graduated from Faculty of Computer \nNetworking and Communications at \nUniversity of Information \nTechnology (UIT - HCM) \u2013 \nVietNam National University \nHCMC. \nCERTIFICATIONS \n- Web Programming with PHP & \nMySQL course at Nhat Nghe \nacademy. \n- VeNer Trainee Ruby on Rails \nProgramming at ZIGExN VeNtura \nCo\u2026, LTD. \nEDUCATION \nAddress: Go Vap District, Ho Chi \nMinh City. \nPhone: 090.509.4138 \nEmail: kiennq0509@gmail.com \nSkype: kiennguyenquoc ", "educations": [{"id": 4922, "gpa": null, "major": "M\u1ea1ng m\u00e1y t\u00ednh v\u00e0 truy\u1ec1n th\u00f4ng d\u1eef li\u1ec7u", "school": "University of Information\nTechnology (UIT - HCM) - \nVietNam National Universi", "diploma": "Engineer", "end_time": null, "conf_score": 0.7090835962781957, "start_time": null, "picklist_major": "IT - Hardware/Networking", "major_categories": "M\u00e1y t\u00ednh v\u00e0 c\u00f4ng ngh\u1ec7 th\u00f4ng tin", "major_categories_detail": "M\u00e1y t\u00ednh"}], "experiences": [{"id": 16503, "detail": "(current is BESTARION Company) - Design, build, and maintain efficient, reusable, and reliable code for an application about healthcare field at USA. - Analyze, design and write code base on requirement\u2019s BA and customer. Contribute in phases of the development application.\n- Write Unit Code with RSpec gem.\n- Involve to setup environment and release application process.\n- Supporting other members (BA, QC and new comer) and review junior developer\u2019s code.\n- Helping train other members of the team in areas where I have more experience.\n- Perform other technical tasks assigned by the technical lead.\n- Technical: Work with Ruby, Rails, Golang, PostgreSQL, GIT, Linux, Sinatra, Solr, ExtJS, basic with Jenkins, Docker, ...", "company": "LARION Company", "end_time": "2023-04-13T00:00:00Z", "industry": "Other", "position": "WEB DEVELOPER", "conf_score": 0.9167205923617493, "start_time": "2016-04-01T00:00:00Z"}, {"id": 16504, "detail": "- I was trained and completed course about Ruby on Rails at ZIGExN VeNtura Company. I work part-time here during the last semester of college.\n- I involved and built a web applications using Ruby on Rails. It\u2019s related with real estate field at Viet Nam (ChoNha project: chonha.vn).\n- Technical: Basic about Ruby, Rails, MySQL, MongoDB, Docker, crawler web and full- text search with Solr.", "company": "ZIGExN VeNtura Company", "end_time": "2016-03-31T00:00:00Z", "industry": "Other", "position": "Ruby on Rails Trainee", "conf_score": 0.9095433078303325, "start_time": "2015-06-01T00:00:00Z"}], "address": "Binh Duong"}