{"skills": ["unix", "openstack service", "docker", "saltstack", "c++", "javascript", "cloud", "mongodb", "eauthentication", "risks", "vega", "flask", "cryptography", "rest", "management", "redux", "security", "enterprise", "git", "svn", "structure", "project management", "cyber security", "data structure", "algorithm", "design pattern", "css", "django", "risk management", "oop", "security risk", "github", "openstack", "oauth", "making decision", "identity", "reactjs", "problem solving skill", "private cloud", "python", "srm", "networking", "project risk management", "identity and access", "problem solving", "angularjs", "mysql", "html"], "fulltext": "Hanoi, Vietnam, +84 \n(+84) 38-990-5280 | kainguyen1509@gmail.com \nhttps://github.com/haintd \nHai Nguyen Trong \nPROFESSIONAL EXPERIENCE \nVEGA CORPORATION, Vietnam | July 2017 \u2013 August 2018 \nSoftware Engineer \n\uf0b7 \nResponsible for designing, planning and implementing the VegaSec project based on the SaltStack open-\nsource, that enables system administrators to deploy and monitor applications of thousands of servers. \n\uf0b7 \nDeveloped a front-end web used to provide a web user-based interface to the VegaSec services. \nVIETTEL CYBER SECURITY, Vietnam | November 2014 \u2013 February 2017 \nSoftware Engineer \n\uf0b7 \nResponsible for designing and implementing an IAM (Identity and Access Management) server, which \nsupports authentication, authorization, and 2-legged OAuth via REST APIs primarily for use by projects in \nthe SIRC (Security Intelligence Response Center) family. \n\uf0b7 \nImplemented captcha and TOTP (Time-Based One-Time Password) modules for the Apereo CAS open-\nsource, which provides enterprise single sign-on service for the web. \n\uf0b7 \nDeveloped front-end web and back-end for the SRM (Security Risk Management) project that used to \nanalyze information, assist decision-making, alert vulnerabilities and threats of thousands of servers. \nBKAV CORPORATION, Vietnam | September 2013 \u2013 November 2014 \nCloud Engineer \n\uf0b7 \nResearched cloud technologies; planned and built private clouds with Openstack. \n\uf0b7 \nDeveloped REST APIs to support web clients communicate with OpenStack services. \nTECHNICAL SKILLS  \n\uf0b7 \nAlgorithms: Good understanding and command of data structures and algorithms. \n\uf0b7 \nLanguages: Proficient in Python, JavaScript. Familiar with C/C++, Go, HTML, CSS, MySQL, Shell script. \n\uf0b7 \nFrameworks/Platforms: Flask, Django, ReactJS/Redux, AngularJS, Webpack, Unix. \n\uf0b7 \nSoftware: OpenStack, Docker, SaltStack, Git, SVN, MySQL, MongoDB. \n\uf0b7 \nOthers: Good understanding of OOP, design patterns and cryptography; have experience in networking. \nEDUCATION \nHUST \u2013 Hanoi University of Science and Technology, Vietnam \nEngineer\u2019s Degree in Software Engineering, July 2013 \n\uf0b7 \nDegree grade: Good \nNON-WORKING ACTIVITIES \n\uf0b7 \nPractice-Python, Practice-JS, Data-Structures-Algorithms: I have created Github repositories to practice \nPython, JavaScript and improve my data structures, algorithms, and problem-solving skills.  \n\uf0b7 \nI also work on some projects. They can be found at my Github profile https://github.com/haintd. \nHanoi, Vietnam, +84 \n(+84) 38-990-5280 ~  kainguyen1509@gmail.com ~ https://github.com/haintd ", "educations": [{"id": 4927, "gpa": null, "major": "K\u1ef9 thu\u1eadt ph\u1ea7n m\u1ec1m", "school": "HUST - Hanoi University of Science and Technology", "diploma": "Engineer", "end_time": "2013-07-01T00:00:00Z", "conf_score": 0.8787962380977831, "start_time": null, "picklist_major": "IT - Hardware/Networking", "major_categories": "M\u00e1y t\u00ednh v\u00e0 c\u00f4ng ngh\u1ec7 th\u00f4ng tin", "major_categories_detail": "M\u00e1y t\u00ednh"}], "experiences": [{"id": 16525, "detail": "Responsible for designing, planning and implementing the VegaSec project based on the SaltStack open- source, that enables system administrators to deploy and monitor applications of thousands of servers.\nDeveloped a front-end web used to provide a web user-based interface to the VegaSec services.", "company": "VEGA CORPORATION", "end_time": "2018-08-31T00:00:00Z", "industry": "Other", "position": "Software Engineer", "conf_score": 0.9351066270204734, "start_time": "2017-07-01T00:00:00Z"}, {"id": 16527, "detail": "Responsible for designing and implementing an IAM (Identity and Access Management) server, which supports authentication, authorization, and 2-legged OAuth via REST APIs primarily for use by projects in the SIRC (Security Intelligence Response Center) family.\nImplemented captcha and TOTP (Time-Based One-Time Password) modules for the Apereo CAS open- source, which provides enterprise single sign-on service for the web.\nDeveloped front-end web and back-end for the SRM (Security Risk Management) project that used to analyze information, assist decision-making, alert vulnerabilities and threats of thousands of servers.", "company": "VIETTEL CYBER SECURITY", "end_time": "2017-02-28T00:00:00Z", "industry": "High Technology", "position": "Software Engineer", "conf_score": 0.9381410507753754, "start_time": "2014-11-01T00:00:00Z"}, {"id": 16529, "detail": "Researched cloud technologies; planned and built private clouds with Openstack. Developed REST APIs to support web clients communicate with OpenStack services.", "company": "BKAV CORPORATION", "end_time": "2014-11-30T00:00:00Z", "industry": "Other", "position": "Cloud Engineer", "conf_score": 0.9381410507753754, "start_time": "2013-09-01T00:00:00Z"}], "address": "Hanoi,"}