{"skills": ["angular", "javascript", "c#", "studio", "excel", "unit test", "sql database", "entity framework", "git", "linq", "svn", "microsoft sql server", "html", "typescript", "asp", "sql", "css", "visual studio", "le", "microsoft visual studio", "microsoft", "mvc", "database", "bootstrap", "microsoft excel"], "fulltext": "Le Thanh Tuan\n.Net Developer\nDate of birth:\n 07/09/1995\nGender:  Male\nPhone:  0979530072\nEmail:  lethanhtuan70995@gmail.com\nAddress:\n244,Man Thien , Ward Tang Nhon Phu  A, District 9,\nTP.HCM\nEDUCATION\n10/2013 - 12/2017\nHO CHI MINH CITY UNIVERSITY OF TECHNOLOGY (HUTECH)\nMajor: Software Technology\nEXPERIENCE\n4/2016 - 4/2017\nHutech University\nBasic, specialized\n- Database: SQL Server. \n- Web technology: HTML, CSS, ASP.NET MVC 5, LINQ, ENTITY\nFRAMEWORK.\n10/2017 - 1/2019\nFPT Software\n-Project(Client): MIROKU JYOHO SERVICE CO., LTD. (MJS)\n- Database: SQL Any Where. \n- Web technology:Typescript, JavaScript,  C#, .Net 4.7,Web Api,\nAngular 4, CSS, HTML, LINQ.\n- UnitTest : writing Unit Test Frontend Kama, Backend .\n- Software: Microsoft SQL Server, Microsoft Visual Studio, Visual Code,\nMicrosoft Word, Microsoft Excel, Tortoise SVN, Git.\n- Knowledge:  Entity Framework, Bootstrap, Stored Procedure.\n1/2019 - Present\nFPT Software\n- Project(Client): ViDA\n- Database: SQL server. \n- Web technology: Typescript, JavaScript, C#, Web Api, Angular 6,\nCSS, HTML, LINQ.\n- UnitTest : Writing Unit Test Frontend Kama, Backend .\n- Software: Microsoft SQL Server, Microsoft Visual Studio, Visual Code,\nMicrosoft Word, Microsoft Excel, Tortoise SVN, Git.\n- Knowledge:  Entity Framework, Bootstrap.\nSTRENGTHS\n- Ability to self\n- learn and adapt to new technologies. \n- Analytical skills. \n- Expertise on database and programming fundamentals. \n- Ability to work effectively in individual and team-oriented environments. \n- Working well under pressure. \n- Detail-oriented, creative, responsible, careful and patient.\n\u00a9 topcv.vn\nPowered by TCPDF (www.tcpdf.org)", "educations": [{"id": 4941, "gpa": null, "major": "Software Technology", "school": "HO CHI MINH CITY UNIVERSITY OF TECHNOLOGY (HUTECH)", "diploma": "Bachelors", "end_time": "2017-12-01T00:00:00Z", "conf_score": 0.9242047582276173, "start_time": "2013-10-01T00:00:00Z", "picklist_major": "Other", "major_categories": "", "major_categories_detail": ""}], "experiences": [{"id": 16564, "detail": "-Project(Client): MIROKU JYOHO SERVICE CO., LTD. (MJS) - Database: SQL Any Where. - Web technology:Typescript, JavaScript, C#, .Net 4.7,Web Api, Angular 4, CSS, HTML, LINQ. - UnitTest : writing Unit Test Frontend Kama, Backend . - Software: Microsoft SQL Server, Microsoft Visual Studio, Visual Code, Microsoft Word, Microsoft Excel, Tortoise SVN, Git. - Knowledge: Entity Framework, Bootstrap, Stored Procedure.", "company": "FPT Software", "end_time": "2019-01-31T00:00:00Z", "industry": "High Technology", "position": null, "conf_score": 0.8086621310791741, "start_time": "2017-10-01T00:00:00Z"}], "address": "244,man Thien , Ward Tang Nhon Phu A, District 9, Tp.hcm"}