{"skills": ["css3", "crm", "javascript", "c#", "database management", "bot", "bootstrap", "e learning", "management", "entity framework", "human resources", "git", "svn", "html5", "database management system", "maintenance", "asp", "sql", "mvc", "entity framework core", "reactjs", "database", "angularjs", "php", "m sql server", "mysql", "jquery"], "fulltext": "Tr\u1ecbnh Minh \u0110\u01b0\u01a1ng  \nPosition: .Net Developer \nPhone: +84977704625 \nEmail: minhduong131196@gmail.com \nSkype: https://join.skype.com/invite/HreTpW7hDx5Z  \nBirthday: 13-11-1996 \nAddress: 108/39/8 Tr\u1ea7n V\u00e2n Quang, Ward 10, T\u00e2n B\u00ecnh District, H\u1ed3 Ch\u00ed Minh  \nOBJECTIVES  \nI\u2019m a developer with over 1 years of experience in C#.NET Technologies. I hope that I can to \ncontribute to your company.  \nI always be learning as much as possible to be a better engineer day after day. \nAcknowledge myself with latest technologies and find out a way to apply at work.  \nI want to go deeply in C# and Database. \nEDUCATION  \n09/2014: Thu Duc College Technology. \nTECHNICAL SKILLS  \n\u27a2 Programming Languages: JavaScript, C#, PHP, HTML5, CSS3. \n\u27a2 Frameworks/Platforms: ASP.NET MVC, Web API, .NET Core, Entity Framework, jQuery, \nBootstrap, ReactJS, AngularJS, NodeJS. \n\u27a2 Database Management Systems: MS SQL Server, MySQL. \n\u27a2 Version Control: Git, SVN. \n\u27a2 English: Read and Write \nWORK EXPERIENCE  \nSNG Software Solutions  \n11/2017 \u2013 4/2019 \nPosition: Junior Developer. \nProjects:  \n1. CXCM System. \n\u27a2 Project Description: A system that operates all operations of company, this is system \nstill being developed. \n\u27a2 Team Size: 4 Members. \n\u27a2 Responsibilities: \no Build functions in the modules: Human Resource, Projects, Business Plan, \nCRM, E-Learning, KPI, Social Network.  \no API for App \no Support to build some functions for Social Network.  \n2. CRM - Murad.  \n\u27a2 Project Description: A system take care of customers, manage orders associated with \ndelivery partners, create monthly target for salesperson, manage inventory. \n\u27a2 Team Size: 3 Members. \n\u27a2 Responsibilities: \no Build modules: CRM, Order.  \no Fix and maintaining modules of system. \no Integration chat bot of Facebook to use to allocate message for salesperson. \n3. CRM - TDA.  \n\u27a2 Project Description: A management and care system for agents, displaying the \ncoverage of agents and competitors, managing construction works and maintaining \nBusiness Signs.. \n\u27a2 Team Size: 2 Members. \n\u27a2 Responsibilities:  \no Build and fix modules of the system. \no API for App \n3T Technology Solutions. \n03/2017 \u2013 09/2017 \nPosition: Fresher. \nTechnologies: PHP, My SQL, Joomla,  OpenCart. \nResponsibilities:  \n\u27a2 Websites maintenance, edit and design UI module, update components and plugins to new \nversion. \n\u27a2 Edit layout, change layout. \n\u27a2 Code UI base on file image designed and apply to website. \n\u27a2 Code plugins crawler to get data from another sites. \nPowered by TCPDF (www.tcpdf.org)", "educations": [{"id": 4942, "gpa": null, "major": null, "school": "Thu Duc College Technology", "diploma": "Colleges", "end_time": "2014-09-01T00:00:00Z", "conf_score": 0.7411424838253973, "start_time": null, "picklist_major": "Other", "major_categories": "", "major_categories_detail": ""}], "experiences": [{"id": 16565, "detail": "Projects: 1. CXCM System. \u27a2 Project Description: A system that operates all operations of company, this is system still being developed.\n\u27a2 Team Size: 4 Members. \u27a2 Responsibilities: o Build functions in the modules: Human Resource, Projects, Business Plan, CRM, E-Learning, KPI, Social Network. o API for App o Support to build some functions for Social Network. 3. CRM - TDA. \u27a2 Project Description: A management and care system for agents, displaying the coverage of agents and competitors, managing construction works and maintaining\nBusiness Signs.. \u27a2 Team Size: 2 Members. \u27a2 Responsibilities: o Build and fix modules of the system. o API for App", "company": "SNG Software Solutions", "end_time": "2019-04-30T00:00:00Z", "industry": "High Technology", "position": "Junior Developer.", "conf_score": 0.862984985617265, "start_time": "2017-11-01T00:00:00Z"}, {"id": 16566, "detail": "Technologies: PHP, My SQL, Joomla, OpenCart. Responsibilities: \u27a2 Websites maintenance, edit and design UI module, update components and plugins to new version.\n\u27a2 Edit layout, change layout.\n\u27a2 Code UI base on file image designed and apply to website.\n\u27a2 Code plugins crawler to get data from another sites.", "company": "3T Technology Solutions.", "end_time": "2017-09-30T00:00:00Z", "industry": "High Technology", "position": "Fresher.", "conf_score": 0.8626919802914558, "start_time": "2017-03-01T00:00:00Z"}], "address": "108/39/8 Tr\u1ea7n V\u00e2n Quang, Ward 10, T\u00e2n B\u00ecnh District, H\u1ed3 Ch\u00ed Minh"}