{"skills": ["security protocol", "microsoft window", "studio", "networking", "cryptography", "streaming", "java", "git", "c++", "phone call", "lte", "clustering", "tcp", "algorithm", "fedora", "finance", "svn", "window server 2003", "tomcat", "structure", "network management", "linux", "redis", "memory management", "mysql development", "ubuntu", "mysql", "java core", "oracle", "security", "peer to peer", "sqlite", "eauthentication", "embedded linux", "database development", "window operating system", "microsoft", "snmp", "unix", "visual studio", "window server", "video server", "peer to peer network", "apache", "database", "protocol", "window xp", "dns", "ubuntu linux", "load balancing", "spring boot", "live streaming", "nginx", "window 7", "rtp", "gateway node", "operating system", "software development", "telecommunication service", "solaris", "application layer", "oracle linux", "centos", "spring", "management", "medium", "directx", "restful"], "fulltext": "Nguyen Huu Ngoc \nLead Software Engineer \nHanoi, Vietnam \n+84 904 962 930 \nngocnguyen.hvn@gmail.com \nhttps://vn.linkedin.com/in/ngocnguyenhuu \nSummary \n\uf0b7 \nSolid experience in developing Audio/Video (A/V) streaming system: Video \nconference, HTTP Live streaming, CCTV Video server, MGW in core network. \n\uf0b7 \nA/V processing and transcoding with DirectX, IPP, FFMPEG, Speex. \n\uf0b7 \nStrong knowledge in telecommunication protocol: H.\ufffd\ufffd\ufffd, H.\ufffd\ufffd8, H.\ufffd\ufffd\ufffd, RTP, RTCP\u2026 \n\uf0b7 \nVery proficient in C/C++ with 10 years experiences. \n\uf0b7 \nAdvance skills in multi thread management, memory control, debugging\u2026 \n\uf0b7 \nFamiliar with many OS platforms : Microsoft Windows (Server), Linux (CentOS, \nWindRiver, Fedora, Oracle Linux), Unix (Solaris 10). \nExperience \nLOTTE HPT \u2013 Hanoi, VN                                                        Sep 2018 \u2013 Present  \nProviding and deploying the core software applications in the field of finance and \nsecurities. \nLead Software Engineer \nDesigned and developed FIX gateway for securities trading solution. \nResearch technology to build web service for current core finance system. \nVP9 \u2013 Hanoi, VN                                                      April 2018 \u2013 September 2018  \nA startup specialized in providing video streaming products and services. Building the \nalgorithm to improve video standards, reducing the bandwidth, making streams more \nreliable, save bandwidth cost and storage cost. \nSenior Software Engineer \nUsing Qt framework to build some GUI for video streaming client side. \nBuilding HTTP Video streaming system to run on Arch Linux ARM device. \nHARVEY NASH \u2013 Hanoi, VN                                                           2016 \u2013 2018 \nA part of Harvey Nash Group specializes in software development, business process \noutsourcing and business transformation to support many global organization to deliver \nthe right technology solutions to support their business needs. \nSenior Software Engineer \nLearned business process and developed/maintained portfolio module in financial \nsystem. \nPage | 2 \nVTTEK CENTER \u2013 Hanoi, VN                                                          2013 \u2013 2016 \nA member of Viettel Group, is the pioneer in researching and developing 3G, 4G LTE, 5G \ntechnologies \nSenior Software Engineer & Assistant Manager \nDeveloped Media Gateway in Mobile Switching Center system, communicate with upper \napplication layer via H.248. \nIntegrated Speex library to remove echo in phone call. \nConfigured hardware, designed solution and developed the library to communicate with \nDSP in ATCA system. \nDeveloped Operating and Managing system for Media Gateway. \nHelped other team fix bug related to C/C++. \nELCOM CORPORATION \u2013 Hanoi, VN                                        2009 \u2013 2013 \nThe leading provider of software and system integration products for \ntelecommunications service providers. \nSoftware Engineer & Solution Designer \nDeveloped Video Conference server side. 2 modules:  Transcoding, mixing multimedia \ndata in Multipoint Processing (MP) module. Creating and managing conference scenario \nin Multipoint Controller (MC) module. \nDeveloped Video Conference client side. Capture and render multimedia data with \nDirectShow, DirectDraw. Transcoding audio, video with IPP, FFMEG and streaming via \nRTP. \nDeveloped Mkv recorder and HTTP live streaming. \nEducation \nHANOI UNIVERSITY OF EDUCATION \u2013 Hanoi, VN              2005 - 2009 \nBachelor of Information Technology \nLearned the signaling processes on H.323 device in Video Conference System. \nResearched and applied H.235 security protocol  for Video Conference System using \nVisual C++. \nSkills \nOperating system \nWindows(Server/7/Embedded) \nLinux \nUnix \nProgramming language & skills \nC/C++(GNU GCC, Visual C++, Qt) \nJava core \nMultithread management \nPage | 3 \nMemory management \nNetwork programiming \nDebugging technique                                                                               \uf06e\uf06e\uf06e\uf06e\uf06e\uf06e\uf06e\uf06e\uf06e\uf06e\uf06e \nDatabase programming \nMySQL (mysqlconnector) \nSQLite  \nOracle (OCCI)                                                                                              \uf06e\uf06e\uf06e\uf06e\uf06e\uf06e\uf06e\uf06e\uf06e\uf06e\uf06e \nRedis                                                                                                              \uf06e\uf06e\uf06e\uf06e\uf06e\uf06e\uf06e\uf06e\uf06e\uf06e\uf06e \nA/V processing \nA/V Codec(H.264, G7xx) \nImage processing \nFFMPEG                                                                                                        \uf06e\uf06e\uf06e\uf06e\uf06e\uf06e\uf06e\uf06e\uf06e\uf06e\uf06e \nDirectX(DirectShow, DirectDraw)                                                        \uf06e\uf06e\uf06e\uf06e\uf06e\uf06e\uf06e\uf06e\uf06e\uf06e\uf06e                                 \nIPP library                                                                                                     \uf06e\uf06e\uf06e\uf06e\uf06e\uf06e\uf06e\uf06e\uf06e\uf06e\uf06e \nWeb service \nRestful (Spring boot) \nLoad balancing (Apache, Tomcat, Nginx)  \nHardware \nA/V Card(AverMedia, USB capture) \nATCA(Emerson, Radisys) \nSoftware version control \nSVN \nGIT \nProject Details \nEVISION CARRIER \u2013 ELCOM                                            06/2009 \u2013 03/2011 \nResearched new library, integrated new hardware and designed solution to improve the \nquality of Video Conference system. \nAccomplishment : \n\uf0b7 \nReduce CPU usage when decoding H.264 using IPP library. \n\uf0b7 \nSuccessfully integrated AverMedia card to adapt with many types of camera with \nDirectShow. \n\uf0b7 \nRecord A/V data from conference to very popular file *.mkv by FFMPEG library. Play \nPage | 4 \nwell with VLC, Media Player Classic. \n\uf0b7 \nDesigned and developed DNS solution, make the system work well via ADSL \nnetwork. \nTechnology : \n\uf0b7 \nC/C++, FFMPEG, IPP, DirectShow. \n\uf0b7 \nWindows XP, Windows 7, Windows Embedded. \n\uf0b7 \nVisual Studio 2003, Visual Studio 2010. \nTeam size: \n\uf0b7 \n5 people. \nEVISION EMBEDED \u2013 ELCOM                                            03/2011 \u2013 06/2011 \nMaking a new conference system module has features of both client and server. \nAccomplishment : \n\uf0b7 \nDesigned the structure of the new module, developed conference scenario. \n\uf0b7 \nSuccessfully integrated server function (making conference, mixing Audio/Video) to \nclient system. \nTechnology : \n\uf0b7 \nC/C++. \n\uf0b7 \nWindows Server 2003. \n\uf0b7 \nVisual Studio 2005. \nTeam size: \n\uf0b7 \n2 people. \nCCTV\u2013 ELCOM                                                                           11/2012 \u2013 02/2013 \nTransmit A/V data from surveillance source to user. User can control camera, \nrecord data to file and replay. \nAccomplishment : \n\uf0b7 \nDeveloped Video Server module, record Audio/Video data and mix to H.264 format, \nbuild *.m3u8 description file for HTTP Live streaming. \n\uf0b7 \nReal-time updating file description to Oracle database with OCCI library. \nTechnology : \n\uf0b7 \nC/C++, FFMPEG, OCCI Oracle. \n\uf0b7 \nLinux (Fedora 18). \n\uf0b7 \nEclipse CDT, SVN. \n\uf0b7 \nSuper Micro server. \nTeam size: \n\uf0b7 \n4 people. \nPage | 5 \nMOBILE SWITCHING CENTER \u2013 VTTEK                       09/2013 \u2013 06/2016 \nBuiding Mobile Switching Center system in mobile core network. \nAccomplishment : \n\uf0b7 \nDeveloped distributed solution for Media gateway module to run on ATCA system.  \n\uf0b7 \nImplemented thread-pool technique to handle thousands concurrent connection. \n\uf0b7 \nIntegrated Speex library to do echo cancellation in phone call. \n\uf0b7 \nReduce transcoding procedure after successfully researched TFO technique. \n\uf0b7 \nIncrease MGW\u2019s performance by transcoding audio via DSP after wrapping Octasic \nAPI to library to communicate. \n\uf0b7 \nDeveloped alarm module by SNMP library so that every Media gateway node could \nraise alarm whenever got incident. \nTechnology : \n\uf0b7 \nC/C++, Net SNMP, Speex , Eclipse CDT. \n\uf0b7 \nLinux (CentOS 6, WindRiver), SVN. \n\uf0b7 \nATCA (Emerson, Radisys). \nTeam size: \n\uf0b7 \n20 people. \nVIDEO STREAMING SYSTEM \u2013 VP9                              04/2018 \u2013 09/2018 \nBuilding distributed Video streaming system run on Arch Linux ARM device. \nAccomplishment : \n\uf0b7 \nDesigned and implemented protocol to make all Streaming node connect to each \nother like Peer to Peer network. \n\uf0b7 \nApplied asymmetric cryptography to encrypt all the messages of protocol. \n\uf0b7 \nCollecting hardware information, update status to Management system by HTTP \nPOST. \n\uf0b7 \nCollecting and control all available IP camera based on ONVIF standard in local \nnetwork. \n\uf0b7 \nBuilding HTTP Video streaming server by Qt C++ to increase performance, can \nstreaming video data base on HTTP request. \nTechnology : \n\uf0b7 \nC/C++, Qt framework, ONVIF. \n\uf0b7 \nLinux (Ubuntu, ARM). \n\uf0b7 \nQt Creator, Git. \nTeam size: \n\uf0b7 \n3 person. \nPage | 6 \nFIX GATEWAY \u2013 LOTTE HPT                                               10/2018 \u2013 01/2019 \nGateway in securities trading solution complies with FIX protocol. \nAccomplishment : \n\uf0b7 \nDeveloped networking module to communicate with internal core system and \noutside securities headquarters via socket TCP/IP. \n\uf0b7 \nResearched FIX protocol to translate internal message to FIX message. \n\uf0b7 \nDefined protocol and export network API for internal core system to communicate \nwith FIX gateway. \nTechnology : \n\uf0b7 \nC/C++, SQLite, Socket. \n\uf0b7 \nLinux (Oracle Linux 6.10). \n\uf0b7 \nNetbean C++, Git. \nTeam size: \n\uf0b7 \n3 person. \nWEBSERVICE RESEARCH \u2013 LOTTE HPT                        03/2019 \u2013 present \nResearch for building web-service to export API from finance core system to \nclient. \nAccomplishment : \n\uf0b7 \nUnderstand Redis persistence, how to programing with C++ and deploying \nsuccessfully clustering prototype. \n\uf0b7 \nLoad balancing knowledge with Apache Tomcat and NGINX. \n\uf0b7 \nSimple CRUD RESTful API with basic authentication based on Java Spring boot. \n\uf0b7 \nUse ZMQ to communicate between web-service and web application. \nTechnology : \n\uf0b7 \nC++, Java, Redis. \n\uf0b7 \nWindows 10, Linux (Oracle Linux 7.5). \n\uf0b7 \nApache, Tomcat, Nginx. \n\uf0b7 \nEclipse, Spring boot, Git. \nTeam size: \n\uf0b7 \n2 person. \nPowered by TCPDF (www.tcpdf.org)", "educations": [{"id": 4973, "gpa": null, "major": "C\u00f4ng ngh\u1ec7 th\u00f4ng tin", "school": "HANOI UNIVERSITY OF EDUCATION", "diploma": "Bachelors", "end_time": "2009-01-01T00:00:00Z", "conf_score": 0.8883152228686, "start_time": "2005-01-01T00:00:00Z", "picklist_major": "IT - Hardware/Networking", "major_categories": "M\u00e1y t\u00ednh v\u00e0 c\u00f4ng ngh\u1ec7 th\u00f4ng tin", "major_categories_detail": "C\u00f4ng ngh\u1ec7 th\u00f4ng tin"}], "experiences": [{"id": 16654, "detail": "Designed and developed FIX gateway for securities trading solution.\nResearch technology to build web service for current core finance system.", "company": "LOTTE HPT", "end_time": "2023-04-13T00:00:00Z", "industry": "Other", "position": "Lead Software Engineer", "conf_score": 0.9390410823591375, "start_time": "2018-09-01T00:00:00Z"}, {"id": 16660, "detail": "A startup specialized in providing video streaming products and services. Building the algorithm to improve video standards, reducing the bandwidth, making streams more reliable, save bandwidth cost and storage cost.", "company": "VP9", "end_time": "2018-09-30T00:00:00Z", "industry": "Other", "position": "Senior Software Engineer", "conf_score": 0.9405553524697083, "start_time": "2018-04-01T00:00:00Z"}, {"id": 16662, "detail": "A part of Harvey Nash Group specializes in software development, business process outsourcing and business transformation to support many global organization to deliver the right technology solutions to support their business needs.", "company": "HARVEY NASH", "end_time": "2018-01-31T00:00:00Z", "industry": "Other", "position": "Senior Software Engineer", "conf_score": 0.8280999941353907, "start_time": "2016-01-01T00:00:00Z"}, {"id": 16663, "detail": "Developed Media Gateway in Mobile Switching Center system, communicate with upper application layer via H.248. Integrated Speex library to remove echo in phone call.\nConfigured hardware, designed solution and developed the library to communicate with\nDSP in ATCA system.\nDeveloped Operating and Managing system for Media Gateway. Helped other team fix bug related to C/C++.", "company": "VTTEK CENTER", "end_time": "2016-01-31T00:00:00Z", "industry": "Other", "position": "Senior Software Engineer & Assistant Manager", "conf_score": 0.9390410823591375, "start_time": "2013-01-01T00:00:00Z"}, {"id": 16664, "detail": "Developed Video Conference server side. 2 modules: Transcoding, mixing multimedia data in Multipoint Processing (MP) module. Creating and managing conference scenario in Multipoint Controller (MC) module.\nDeveloped Video Conference client side. Capture and render multimedia data with\nDirectShow, DirectDraw. Transcoding audio, video with IPP, FFMEG and streaming via\nRTP. Developed Mkv recorder and HTTP live streaming.\nPage | 3 Memory management\nNetwork programiming\nDebugging technique\nDatabase programming\nMySQL (mysqlconnector)\nSQLite Oracle (OCCI) Redis A/V processing\nA/V Codec(H.264, G7xx) Image processing\nFFMPEG DirectX(DirectShow, DirectDraw) IPP library\nWeb service\nRestful (Spring boot)\nLoad balancing (Apache, Tomcat, Nginx) Hardware A/V Card(AverMedia, USB capture)\nATCA(Emerson, Radisys) Software version control\nSVN GIT", "company": "ELCOM CORPORATION", "end_time": "2013-01-31T00:00:00Z", "industry": "Other", "position": "Software Engineer & Solution Designer", "conf_score": 0.9376203118242836, "start_time": "2009-01-01T00:00:00Z"}], "address": "Hanoi, Vietnam"}