{"skills": ["integration testing", "machine learning", "studio", "user acceptance testing", "testing", "github", "administration", "analysis", "algorithm", "tableau", "python", "visualization", "qlik", "rss", "linux", "linear regression", "mai", "matplotlib", "azure", "cfa", "insurance", "data analysis", "non linear regression", "data mining", "unix", "class", "microsoft", "regression", "marketing", "sql", "visual studio", "sql query", "deep learning", "microsoft azure", "scripting", "numpy", "internal audit", "database", "business intelligence", "business requirement", "bioinformatics", "microsoft visual studio", "data visualization", "high dimensional data", "matlab", "business analyst", "analyst", "bokeh", "strategic thinking", "scikit learn", "management", "acceptance testing", "problem solving"], "fulltext": "MAI NGUYEN\nFinal year student in Master of Statistics - Informatics\n\ufffd maingoc303@gmail.com\n\ufffd +32 4 7117 1551/ +84 7 8869 3223\n\ufffd Hasselt, Belgium\n\ufffd  https://www.linkedin.com/in/mai-nguyen-347a1331/ \ufffd  https://github.com/maingoc303\nRESEARCH INTEREST\n\u2022 Data Mining: machine learning and deep learning\n\u2022 Statistical modeling: prediction, classi\ufb01cation and\ninference\n\u2022 Visualization: Business intelligence\n\u2022 Integration and multi-disciplines analysis\nEDUCATION\nMaster of Statistics - Specialized in\nInformatics\nHasselt University\n\ufffd Sep 2017 \u2013 ongoing\nMaster thesis Bioinformatics pipeline for\nMetagenomics in clinical diagnosis\nCERTIFICATIONS\nPassed CFA Level 1\nIELTS 7.5\nTECHNICAL SKILLS\nR Language\nStatistical analysis and modeling, Biocon-\nductor, R Markdown. Data Visualization\nPython\nPandas, Matplotlib, NumPy, Bokeh, Scikit-\nlearn, Programming, Scripting, Biopython\nLinux/ Unix\nMatlab\nStatistical Model, Data Visualization\nSAS\nStatistical Modeling\nSQL Query\nPower BI; Tableau\nMS Of\ufb01ces\nDATA SCIENCE SKILLS\nIntegrity\nProblem Solving\nStrategic thinking\nStatistical modeling\nMachine Learning\nDeep Learning\nData Mining\nHigh Dimensional Data Analysis\nBioconductor\nACADEMIC CONFERENCES\n\u2022 Computational analysis of protein-protein interactions: Sequences, networks\nand diseases - Nov, 2018 - Rome, Italia\n\u2022 Neural guidance molecules in development and disease - Baveno, Italia\nACADEMIC PROJECTS\n\u2022 Statistical modeling: Linear and Non-linear Regression and Longitudinal Data\nAnalysis; Univariate and Multivariate Analysis\n\u2022 Advanced programming: develop algorithm for graph class in python\n\u2022 Data Mining: Develop model for predicting response variable\n\u2022 Omics: Gene expression analysis; High dimensional metabolics data analysis\nWORKING EXPERIENCE\nSenior Business Analyst\nDXC Technology\n\ufffd Aug 2016 \u2013 Sep 2017\n\ufffd Ho Chi Minh City, Vietnam\n\u2022 Performs feasibility analysis, scopes projects, and works with the project man-\nagement team to prioritizes deliveries related to product functionalities.\n\u2022 Preparation of Business Requirement Document (BRD) and translate it into\nfunctional speci\ufb01cations.\n\u2022 Provides analytic support by coordinating data extraction from various databases\nand data interpretation.\n\u2022 Participates in Integration Testing and User Acceptance Testing (UAT) and\nFunctionality Testing\nSenior Data Insight Analyst\nSkoolbo Vietnam\n\ufffd Aug 2015 \u2013 Aug 2016\n\ufffd Ho Chi Minh City, Vietnam\n\u2022 Propose dynamic report for internal management and marketing purposes\n\u2022 Apply Tableau, Power BI, Qlik View to analyze and visualize Data from Database:\nAzure Microsoft, Sharepoint, SQL\n\u2022 Improve data quality, ensure the accuracy of data input\n\u2022 Tracking error and managing ef\ufb01ciency of database\n\u2022 Manage Information System: Microsoft Visual Studio\nFinancial Reporting Analyst\nGlobal Insurance Corporation\n\ufffd Sep 2012 \u2013 Jan 2015\n\ufffd Ho Chi Minh City, Vietnam\n\u2022 Financial Analysis: analyzing expenses, insurance premium, administration ex-\npenses, insurance claims, premium reservation, claims reservation, calculating\n\ufb01nancial ratio.\n\u2022 Financial Planning: based on \ufb01nancial analysis, prepare a \ufb01nancial analyzing,\ndriven-cost factors, compare with benchmark to prepare plan for company.\n\u2022 Financial Controlling: internal audit, receivables controlling, prepare KPI to\nevaluate company\u2019s performance.\n\u2022 Involve in Projects: Insurance Product Pricing (Motor and Healthcare), Busi-\nness Procedure Improvement", "educations": [{"id": 4970, "gpa": null, "major": null, "school": "Hasselt University", "diploma": "Masters", "end_time": "2017-09-01T00:00:00Z", "conf_score": 0.8161732367391693, "start_time": null, "picklist_major": "Other", "major_categories": "", "major_categories_detail": ""}], "experiences": [{"id": 16651, "detail": "Ho Chi Minh City, Vietnam \u2022 Performs feasibility analysis, scopes projects, and works with the project man- agement team to prioritizes deliveries related to product functionalities.\n\u2022 Preparation of Business Requirement Document (BRD) and translate it into functional specifications.\n\u2022 Provides analytic support by coordinating data extraction from various databases and data interpretation.\n\u2022 Participates in Integration Testing and User Acceptance Testing (UAT) and\nFunctionality Testing", "company": "DXC Technology", "end_time": "2017-09-30T00:00:00Z", "industry": "High Technology", "position": "Senior Business Analyst", "conf_score": 0.9522414576104914, "start_time": "2016-08-01T00:00:00Z"}, {"id": 16655, "detail": "Ho Chi Minh City, Vietnam \u2022 Propose dynamic report for internal management and marketing purposes\n\u2022 Apply Tableau, Power BI, Qlik View to analyze and visualize Data from Database: Azure Microsoft, Sharepoint, SQL \u2022 Improve data quality, ensure the accuracy of data input\n\u2022 Tracking error and managing efficiency of database\n\u2022 Manage Information System: Microsoft Visual Studio", "company": "Skoolbo Vietnam", "end_time": "2016-08-31T00:00:00Z", "industry": "Other", "position": "Senior Data Insight Analyst", "conf_score": 0.9542590739672067, "start_time": "2015-08-01T00:00:00Z"}, {"id": 16658, "detail": "Ho Chi Minh City, Vietnam \u2022 Financial Analysis: analyzing expenses, insurance premium, administration ex- penses, insurance claims, premium reservation, claims reservation, calculating financial ratio.\n\u2022 Financial Planning: based on financial analysis, prepare a financial analyzing, driven-cost factors, compare with benchmark to prepare plan for company.\n\u2022 Financial Controlling: internal audit, receivables controlling, prepare KPI to evaluate company\u2019s performance.\n\u2022 Involve in Projects: Insurance Product Pricing (Motor and Healthcare), Busi- ness Procedure Improvement", "company": "Global Insurance Corporation", "end_time": "2015-01-31T00:00:00Z", "industry": "Insurance", "position": "Financial Reporting Analyst", "conf_score": 0.9665185576724751, "start_time": "2012-09-01T00:00:00Z"}], "address": "Hasselt,"}