{"skills": ["java", "c++", "git", "svn", "sleep mode", "uitableview", "uikit", "swift", "android", "design pattern", "sql", "le", "objective c", "business logic", "multithreading", "database", "sqlite", "gcd"], "fulltext": "Nguyen Le Trong Nhan\nIOS DEVELOPER\nEXPERIENCE\nSenior Developer\nVNG CORP\n Apr 2016 - Ongoing\nZalo\nProject description: An OTT product. Support chat, call, and\nsocial network.\nTechnology (Obj-c)\n- Optimize load & save messages flow to improve user experience.\n- Using new design pattern to enhance code performance,\nmake code easy to implement new business and inheritlater.\n- Customize UI with flexible animations, improve UI scrolling\nfaster and smoother.\n- Multithreading for business logic and UI.\n- API & Library: GCD, UIKit, CoreAnimation.\nTSC Music\nProject description: Play Music App\nTechnology (Swift)\n- Use third-party API to load & play music in\nlocal:(Youtubeptify..)\n- Design UI/UX and Create animation for\nSleep Mode.\n- Support many type of UI controllers\n(UITableView, CollectionView, UIPicker..)\nAssociate Software Engineer\nGIANTY COMPANY\n7 Jan 2015 - Apr 2016\nStixChat\nProject description: App Chat app\nUsing face of user make a sticker, an user can edit sticker face\nand share together.\nTechnology (Obj-c)\n- Multi-thread: manage multi-thread to synchronize data,\nbuilding Sticker with user face, and download/upload data.\n- Custom UI, Auto-layout: All of screen in apps are using\nauto layout to support multiscreen. And custom UI,\ndesign a lot of flexible animations.\nFresher Mobile Developer\nFPT SOFTWARE\nJan 2014 - Jan 2015\nLIFE PHILOSOPHY\n*Never put off until tomorrow what you can do today \"\nSKILLS\nObjective-C\nSwift\nDatabase: SQLite, SQL Server\nJava - Android\nC/C++\nGit & SVN\nTeam work\nEnglish Communication\nINTERESTS\nSoccer & Volleyball\nTravalling\nGuitar\nDo charity & Volunteer\nEDUCATION\nSoftware Engineer\nPost and Telecommunication\nInstitute of Technology\nA DAY OF MY LIFE\nGet high with olleybal\nResearch new tech\norread book\nSpend time with Zalo\nSleeping & Dreaming\nabout Home & Children", "educations": [{"id": 4968, "gpa": null, "major": "Software Engineer", "school": "Post and Telecommunication Institute of Technology", "diploma": "Other", "end_time": null, "conf_score": 0.754892152877782, "start_time": null, "picklist_major": "Other", "major_categories": "", "major_categories_detail": ""}], "experiences": [{"id": 16639, "detail": "Zalo Project description: An OTT product. Support chat, call, and social network.\nTechnology (Obj-c) - Optimize load & save messages flow to improve user experience.\n- Using new design pattern to enhance code performance, make code easy to implement new business and inheritlater.\n- Customize UI with flexible animations, improve UI scrolling faster and smoother.\n- Multithreading for business logic and UI. - API & Library: GCD, UIKit, CoreAnimation.", "company": "VNG CORP", "end_time": "2016-12-31T00:00:00Z", "industry": "Other", "position": "Senior Developer", "conf_score": 0.7551834254203837, "start_time": "2016-04-01T00:00:00Z"}, {"id": 16640, "detail": "Software Engineer GIANTY COMPANY 7 Jan 2015 - Apr 2016 StixChat Project description: App Chat app\nUsing face of user make a sticker, an user can edit sticker face and share together.\nTechnology (Obj-c) - Multi-thread: manage multi-thread to synchronize da", "company": "GIANTY COMPANY", "end_time": "2016-04-30T00:00:00Z", "industry": "Other", "position": "Associate Software Engineer", "conf_score": 0.7940963969466314, "start_time": "2015-01-01T00:00:00Z"}, {"id": 16641, "detail": "", "company": "FPT SOFTWARE", "end_time": "2015-01-31T00:00:00Z", "industry": "High Technology", "position": "Fresher Mobile Developer", "conf_score": 0.7551834254203837, "start_time": "2014-01-01T00:00:00Z"}], "address": null}