{"skills": ["studio", "css", "git", "ruby", "json", "database management", "finance", "svn", "reactjs", "html", "linux", "mysql", "azure", "database management system", "jquery", "angular", "window operating system", "visual studio", "public speaking", "sales", "scripting", "scripting language", "javascript", "database", "crm", "enterprise architecture", "xml", "window 7", "cloud", "enterprise", "frontend development", "php", "software development", "teamwork", "operating system", "rail", "analyst", "mongodb", "management", "aws"], "fulltext": "L\u00e2m Ch\u00ednh Ho\u00e0i Nam\nFront-end Developer\nDate of birth:\n Nov 01, 1989\nGender:  Male\nPhone:  0902702322\nEmail:  knight1188@gmail.com\nAddress:\n 43/1C, Th\u00e0nh Th\u00e1i, P.14, Q.10, Ho Chi Minh, Vietnam\nEDUCATION\nOct 2009 - 2012\nAptech University\nMajor: Information Technology\nMain: Software Development\nSUMMARY\n\u2981 A technical architecture (TA) with 2-year experiences at designing and implementing effective technical\nbusiness solutions.\n\u2981 Responsible for handling complex design matters and helping development teams choose tools, platforms,\nand coding standards.  \n\u2981 Solving technical problems, collaborating with the management, selecting the right development\nenvironment, interacting with stakeholders, and making sure projects are completed in time \n\u2981 Translate the requirements created by functional analysts and design it exactly \n\u2981 Propose Finance Solution: E-commerce.  \n\u2981 Core Responsibilities:    \n\u2981 Translate of requirements into a solution vision \n\u2981 Combine guidance from different enterprise architecture viewpoints \n\u2981 Team size: 20 members\nTECHNICAL SKILLS\n\u2981 Programming Languages: PHP, NodeJs\n\u2981 Scripting Languages: HTML, JavaScript, CSS, XML, and JSON.\n\u2981 Database Management Systems: MySQL, MongoDB\n\u2981 Cloud: Amazon AWS, Azure\n\u2981 IDEs: Visual Studio Code\n\u2981 Operating Systems: Windows, Linux\n\u2981 Others: Open source, GIT\n\u2981 Soft Skills: teamwork & self-training skills, public speaking.\nWORK EXPERIENCE\n2017 - 2019\nPresent : DFO GLOBAL\nFRONT-END DEVELOPER\n\u2981\n\u2981 Project Description\nCTRWOW offers a full suite of proven and tested landing pages and\nsales funnels, highly optimized to deliver the most conversions for your\nbusiness.\n- CTRWow is always free for clients of eManage CRM. Save money on\nexpensive developers and build powerful and beautiful websites.\n- Why start from scratch when you can leverage proven, tested, and\nhighly optimized elements and templates that are already driving\nmillions on profit.\n- Every extra second of load time can cost 5-10% off your conversion\nrate. Our funnels are insanely fast, visually stunning, and high-\nperforming across devices.\n- With CTRWOW\u2019s incredible drag-and-drop page builder, you are\nautomatically equipped with an arsenal of highly optimized, top-\nconverting pages and assets that give you an instant leg-up on the\ncompetition\n\u2981 Team size: 10\n\u2981 \u2981  Responsibilities:  \n\u2981 Support Sales Funnel Flow \n\u2981 Create Framework and organize code\n\u2981 Reporting, Coding.\n\u2981 Database: MongoDB\n\u2981 Cloud: AWS, Azure\n\u2981 Language: NodeJS, ReactJs\n\u2981 Source management: GIT, SVN\n\u2981 OS: Windows 7, Linux\nhttps://www.ctrwow.com\n2014 - 2017\nCinQSmile\nFRONT-END DEVELOPER\n\u2981\n\u2981 Project Description\nIt is a unique function of RECOG that you can feel free to convey your\nfeelings of praise to your friends. \nThe \"letter\" that was awarded will also be shared by other members, so\nthat everyone will be paying attention to the activities and contributions\nthat have not been seen until now.\n\u2981 Team size: 20\n\u2981 \u2981  Responsibilities:  \n\u2981 Create Framework and organize code\n\u2981 Reporting, Coding.\n\u2981 Database: Mysql\n\u2981 Cloud: AWS\n\u2981 Language: Ruby on Rails, Angular 4\n\u2981 Source management: GIT\n\u2981 OS: Windows 7, Linux\nhttps://www.recog.works\n2012 - 2014\nNhan Hoa Software\nFRONT-END DEVELOPER\n\u2981\n\u2981 Project Description\nWeb4s.vn\n\u2981 Team size: 8\n\u2981 \u2981  Responsibilities:  \n\u2981 Reporting, Coding.\n\u2981 Database: Mysql\n\u2981 Language: PHP, jQuery, Javascript\n\u2981 Source management: GIT\n\u2981 OS: Windows \nhttps://www.web4s.vn\n\u00a9 topcv.vn\nPowered by TCPDF (www.tcpdf.org)", "educations": [{"id": 4981, "gpa": null, "major": "C\u00f4ng ngh\u1ec7 \u0111i\u1ec7n \u1ea3nh, truy\u1ec1n h\u00ecnh", "school": "Aptech University", "diploma": "Bachelors", "end_time": "2012-01-01T00:00:00Z", "conf_score": 0.9210088910403198, "start_time": "2009-10-01T00:00:00Z", "picklist_major": "Art/Design", "major_categories": "Ngh\u1ec7 thu\u1eadt", "major_categories_detail": "Ngh\u1ec7 thu\u1eadt nghe nh\u00ecn"}], "experiences": [{"id": 16688, "detail": "\u2981 Project Description CTRWOW offers a full suite of proven and tested landing pages and sales funnels, highly optimized to deliver the most conversions for your business.\n- CTRWow is always free for clients of eManage CRM. Save money on expensive developers and build powerful and beautiful websites.\n- Why start from scratch when you can leverage proven, tested, and highly optimized elements and templates that are already driving millions on profit.\n- Every extra second of load time can cost 5-10% off your conversion rate. Our funnels are insanely fast, visually stunning, and high- performing across devices.\n- With CTRWOW\u2019s incredible drag-and-drop page builder, you are automatically equipped with an arsenal of highly optimized, top- converting pages and assets that give you an instant leg-up on the competition\n\u2981 Team size: 10 \u2981 \u2981 Responsibilities: \u2981 Support Sales Funnel Flow \u2981 Create Framework and organize code\n\u2981 Reporting, Coding. \u2981 Database: MongoDB \u2981 Cloud: AWS, Azure \u2981 Language: NodeJS, ReactJs \u2981 Source management: GIT, SVN \u2981 OS: Windows 7, Linux https://www.ctrwow.com", "company": "DFO GLOBAL", "end_time": "2023-04-13T00:00:00Z", "industry": "Other", "position": "FRONT - END DEVELOPER", "conf_score": 0.917841109432358, "start_time": "2019-01-01T00:00:00Z"}, {"id": 16689, "detail": "\u2981 Project Description It is a unique function of RECOG that you can feel free to convey your feelings of praise to your friends.\nThe \"letter\" that was awarded will also be shared by other members, so that everyone will be paying attention to the activities and contributions that have not been seen until now.\n\u2981 Team size: 20 \u2981 \u2981 Responsibilities: \u2981 Create Framework and organize code\n\u2981 Reporting, Coding. \u2981 Database: Mysql \u2981 Cloud: AWS \u2981 Language: Ruby on Rails, Angular 4 \u2981 Source management: GIT \u2981 OS: Windows 7, Linux https://www.recog.works", "company": "CinQSmile", "end_time": "2017-01-31T00:00:00Z", "industry": "Other", "position": "FRONT - END DEVELOPER", "conf_score": 0.9318493695629307, "start_time": "2014-01-01T00:00:00Z"}, {"id": 16690, "detail": "\u2981 Project Description Web4s.vn \u2981 Team size: 8 \u2981 \u2981 Responsibilities: \u2981 Reporting, Coding. \u2981 Database: Mysql \u2981 Language: PHP, jQuery, Javascript \u2981 Source management: GIT \u2981 OS: Windows https://www.web4s.vn", "company": "Nhan Hoa Software", "end_time": "2014-01-31T00:00:00Z", "industry": "High Technology", "position": "FRONT - END DEVELOPER", "conf_score": 0.9275483332904028, "start_time": "2012-01-01T00:00:00Z"}], "address": "43/1c, Th\u00e0nh Th\u00e1i, P.14, Q.10, Ho Chi Minh, Vietnam"}