{"skills": ["search", "studio", "java", "css", "ruby", "agile", "github", "git", "nunit", "extjs", "json", "analysis", "database management", "golang", "jira", "html", "full stack development", "kibana", "search engine", "ubuntu", "mysql", "entity framework", "database management system", "window operating system", "unit test", "sql", "le", "visual studio", "c#", "elasticsearch", "stack", "javascript", "payment", "database", "wcf", "mvc", "workflow", "teamwork", "operating system", "management", "trello", "asp", "java language", "gitlab", "redmine", "problem solving"], "fulltext": "Truong Le Hoang \nPERSONAL INFORMATION \nBirthday \n29/07/1993 \nTelephone (+84) 979777814 \nEmail  \nhoangtl2907@gmail.com \nAddress \n19, D14A Street, Tay Thanh Ward, Tan Phu District, Ho Chi Minh City. \nForeign language(s): English (Toeic Certificate: 795) \nEDUCATION \nUniversity of Information Technology - Vietnam National University, Ho Chi Minh \nCity. \nBachelor of Engineering (BEng), Information System, Advanced Education Program \u2013 \naffiliate program with Oklahoma State University \nTECHNICAL SKILLS \n\u2022 Web programing: RoR, ExtJS \n\u2022 Programing Language: C#, Java, HTML, CSS, Javascript, Ruby, Golang \n\u2022 Development tools: MS Visual Studio, Eclipse, NetBean, VIM editor \n\u2022 Database Management System: SQL Server, MySQL, PosgreSQL \n\u2022 Operating System: Windows, Ubuntu \n\u2022 Search Engines: Elasticsearch, Solr \nWORKING SKILLS \n\u2022 Problem Solving \n\u2022 Agile/ Scrum development framework \n\u2022 Teamwork (JIRA, RedMine, Trello) \n\u2022 GitHub, Gitlab, Git Workflow \n\u2022 Adaptability, willing to learn new technologies \n\u2022 High responsibility \nPROJECTS \n\u2022 Project name: coffee shop management (freelance) \n\u2022 Description: a website for user can view menu, news, event and book table; a website \nmanagement for boss can add/delete/edit drinks, view revenue of each branch; a \npayment application for cashier can calculate bills, print bills and send revenue to \nserver after a day \n\u2022 Responsibilities: \no Back-end, and unit test \no Fix bugs \n\u2022 Technologies:  \no Tool: MS Visual Studio, SQL Server \no Frameworks: ASP.NET WebForm, NUnit, WCF  \n________________________________________ \n\u2022 Thesis project name: Grading tours Airlink \n\u2022 Description: A web service for query ontology, sending JSON and calculate tour \nscore base on answers of user for each question, an application converting MySQL \nto Ontology \n\u2022 Responsibilities:  \no Write code including server and application \no Test and fix bug \n\u2022 Technologies: Eclipse, MySQL, Prot\u00e9g\u00e9 \nEXPERIENCE \n\u2756 Sep 09, 2015 \u2013 Mar 31, 2016: Developer at Global Cybersoft VietNam. \no Project Name: Defects analysis application \no Description: An application that helps users sum up and analyze statistics of \ndefects of products after a productive time \no Responsibilities: \n\u2022 Write code and unit test \n\u2022 Research Elasticsearch \no Technologies: \n\u2022 Tool: MS Visual Studio \n\u2022 DBMS: SQL server \n\u2022 Language: C# \n\u2022 Framework: Entity Framework, NEST, Newtonsoft.Json, NUnit \n\u2756 April 01, 2016 \u2013 July 30, 2016: .Net developer at i3solution. \no Project Name: Hospital management \no Description: A System including a server and a website that helps the hospital \nmanage their patients, helps doctors in documenting \no Responsibilities: \n\u2022 Back-end, and unit test \n\u2022 Fix bugs \no Technologies: \n\u2022 Tool: MS Visual Studio \n\u2022 Language: C# \n\u2022 DBMS: SQL server \n\u2022 Framework: Entity Framework, ASP.NET MVC, WCF, Reporting \nService. \n\u2756 Sep 25, 2016 \u2013 Now: Full-stack developer at LARION \no Project Name: Medical Resources Supply \no Description: A system that allows the hospitals find and buy medical \ninstruments with a reasonable price. It also helps them to manage contracts, \nanalyze their spending and saving opportunities. \no Responsibilities: \n\u2022 Back-end, font-ent, and unit test \n\u2022 Fix bugs \n\u2022 Enhance performance \n\u2022 Team lead \no Technologies: \n\u2022 Tool: PgAdmin, psql, Jenkin, VIM editor, Mysql Workbrench \n\u2022 Language: Ruby (RoR), Golang, Javascript \n\u2022 OS: Ubuntu \n\u2022 DBMS: PotsgreSQL, MySQL \n\u2022 Search Engine: Solr, Elasticsearch \n\u2022 Other: Kibana, Power BI \nHONORS & AWARDS \n\u2756 January 2019:  \no Title: Distinguished Employee of The Year \no Issuer: Larion \n\u2756 January 2019:  \no Title: Distinguished Employee of The Quarter \no Issuer: Larion \n\u2756 January 2018:  \no Title: Distinguished Employee of The Year \no Issuer: Larion \n\u2756 January 2018:  \no Title: Distinguished Employee of The Quarter \no Issuer: Larion ", "educations": [{"id": 4992, "gpa": null, "major": "H\u1ec7 th\u1ed1ng th\u00f4ng tin", "school": "University of Information Technology - Vietnam National University", "diploma": "Bachelors", "end_time": null, "conf_score": 0.7452281415975237, "start_time": null, "picklist_major": "IT - Hardware/Networking", "major_categories": "M\u00e1y t\u00ednh v\u00e0 c\u00f4ng ngh\u1ec7 th\u00f4ng tin", "major_categories_detail": "M\u00e1y t\u00ednh"}], "experiences": [{"id": 16718, "detail": "Project Name: Medical Resources Supply o Description: A system that allows the hospitals find and buy medical instruments with a reasonable price. It also helps them to manage contracts, analyze their spending and saving opportunities. o Responsibilities: \u2022 Back-end, font-ent, and unit test\n\u2022 Fix bugs\n\u2022 Enhance performance\n\u2022 Team lead o Technologies: \u2022 Tool: PgAdmin, psql, Jenkin, VIM editor, Mysql Workbrench \u2022 Language: Ruby (RoR), Golang, Javascript \u2022 OS: Ubuntu \u2022 DBMS: PotsgreSQL, MySQL \u2022 Search Engine: Solr, Elasticsearch \u2022 Other: Kibana, Power BI", "company": "LARION", "end_time": "2023-04-13T00:00:00Z", "industry": "Other", "position": "Full - stack developer", "conf_score": 0.8384022261982151, "start_time": "2016-09-25T00:00:00Z"}, {"id": 16720, "detail": "o Project Name: Hospital management o Description: A System including a server and a website that helps the hospital manage their patients, helps doctors in documenting o Responsibilities: \u2022 Back-end, and unit test\n\u2022 Fix bugs o Technologies: \u2022 Tool: MS Visual Studio \u2022 Language: C# \u2022 DBMS: SQL server\n\u2022 Framework: Entity Framework, ASP.NET MVC, WCF, Reporting Service.", "company": "i3solution.", "end_time": "2016-07-31T00:00:00Z", "industry": "High Technology", "position": ".Net developer", "conf_score": 0.8280054682797672, "start_time": "2016-04-01T00:00:00Z"}, {"id": 16722, "detail": "o Project Name: Defects analysis application o Description: An application that helps users sum up and analyze statistics of defects of products after a productive time o Responsibilities: \u2022 Write code and unit test\n\u2022 Research Elasticsearch o Technologies: \u2022 Tool: MS Visual Studio \u2022 DBMS: SQL server\n\u2022 Language: C# \u2022 Framework: Entity Framework, NEST, Newtonsoft.Json, NUnit", "company": "Global Cybersoft VietNam.", "end_time": "2016-03-31T00:00:00Z", "industry": "High Technology", "position": "Developer", "conf_score": 0.8280054682797672, "start_time": "2015-09-09T00:00:00Z"}], "address": "19, D14a Street, Tay Thanh Ward, Tan Phu District, Ho Chi Minh City"}