{"skills": ["microsoft window", "ssl", "networking", "terraform", "git", "java", "analysis", "automation", "tcp", "internet", "itil", "python", "zabbix", "linux", "redis", "ubuntu", "azure", "mysql", "oracle", "internet protocol", "leadership skill", "linux system", "microsoft", "log management", "sales", "magento", "window server", "apache", "database", "protocol", "dns", "ping", "client server", "nginx", "ansible", "docker", "cloud", "php", "pre sales support", "cdn", "alibaba cloud", "centos", "management", "aws"], "fulltext": "CURRICULUM VITAE \nPERSONAL INFORMATION: \n\uf0a7 Full Name         \n: LUONG VINH THAO. \n\uf0a7 Date of birth  \n: 23/11/1989. \n\uf0a7 Gender               \n: Male.  \n\uf0a7 Status  \n: Single. \n\uf0a7 Address \n: 51 Street 13,Hiep Binh Phuoc, Thu \u0110uc District, HCM \nCity. \n\uf0a7 Phone  \n:  \n\uf0a7 Email  \n:  \nEDUCATION BACKGROUND: \n2012 - 2014 \nUniversit\u00e9 Pierre et Marie Curie\u2013Paris 6, France. \n(French Universities Program - Vietnam National University \nHCMC) \nMaster of Information Technology - Major: Computer Network \n2007 - 2012 \nUniversity of Information Technology, Vietnam National University \nHCM City. \nBachelor of Network and Communication. \nWORKING EXPERIENCES: \n2018 -Now  \nSystem Engineer at Linkbynet VietNam. \n\uf0b7 Level 2 escalation on the incident, problem management on the \nlinux system.  \n\uf0b7 Pre-sale support on cloud (alibabacloud) . \n\uf0b7 Handle the task and dispatch to the team member as technical \nleader. \n\uf0b7 Provide capacity report and incident report analysis for customer. \n\uf0b7 Technical support project manager for client project. \n\uf0b7 Training the L1 team on the cloud (AWS , Alibabacloud), incident \nprocess. \n\uf0b7 Automation code for IaaS (ansible, terraform, git). \n2016-2017 \nSystem Admin at Linkbynet VietNam \n\uf0b7 Deployment servers on cloud AWS, Alicloud for global customer. \n\uf0b7 Deployment hybris, magento, symphony and provide automation \nscript deployment for our client. \n\uf0b7 Onsite support at Singapore for some project. \n11/2015- 2/2016 \nSystem Admin at Linkbynet Canada \n\uf0b7 Provide a training to Montreal technical team about Alibabacloud. \n\uf0b7 Support the customer at Montreal. \n2014\u20132015  \nSystem Admin at Linkbynet VietNam. \n\uf0b7 Handle our client incident following the ITIL process (around \n2000 linux servers). \n\uf0b7 Install, configure and maintain systems and applications. \n\uf0b7 Understand our customer demand and provide a solution based on \ntheir demand. \n\uf0b7 Migration our client server to cloud(Alibaba cloud). \nCERTIFICATION: \nCloud \nACP (Alibaba Cloud Certified Profession). \nSKILLs: \nOS \nMicrosoft Windows Server, Linux(centos ,redhat, ubuntu) \nPrograming \nbash shell, python \nNetworking \nTCP/IP,LAN/WAN , Troubleshooting \nInternet  Protocol \nHTTPS, HTTP, DNS ,SSL/TLS \nSystem \nLog management, Zabbix, Cloud (AWS,Alicloud,Azure), java \ntroubleshooting, git, docker, terraform, ansible  \nWeb  \nApache ,Nginx, Varnish, CDN (Akamai, cloud front) \nApplication \nMagento, Hybris, PHP, \nDatabase \nMySQL, Oracle, Redis, Cloud RDS \nEnglish  Intermediate. \nAWARDS :  \n2017 \nLinkbynet best performance reward \n2014 \nDTS Scholarship for program \u201dDTS young talent\u201d, DTS Telecom. \n2013 \nPUF Scholarship. \nFURTHER DETAILS: \nActivities,  \nCharacter \nSwimming, volleyball, football, ping pong table.  \nTravel and learn new technology. \nSolving the problem and be active. \nPersonal  Skills \nThe ability to work with group. \nSelf-organized , proactive and  prioritize works \nMindset to provide the good service for client. \nAbility to learn and adapt rapidly to changing of work \nLeadership skill for technical lead.  \nDocument and analyzing the document. ", "educations": [{"id": 4998, "gpa": null, "major": "M\u1ea1ng m\u00e1y t\u00ednh v\u00e0 truy\u1ec1n th\u00f4ng d\u1eef li\u1ec7u", "school": "University of Information Technology, Vietnam National University", "diploma": "Bachelors", "end_time": "2012-01-01T00:00:00Z", "conf_score": 0.832512644043128, "start_time": "2007-01-01T00:00:00Z", "picklist_major": "IT - Hardware/Networking", "major_categories": "M\u00e1y t\u00ednh v\u00e0 c\u00f4ng ngh\u1ec7 th\u00f4ng tin", "major_categories_detail": "M\u00e1y t\u00ednh"}, {"id": 4996, "gpa": null, "major": "Computer Network", "school": "Vietnam National University", "diploma": "Masters", "end_time": "2014-01-01T00:00:00Z", "conf_score": 0.8439171044424495, "start_time": "2012-01-01T00:00:00Z", "picklist_major": "Other", "major_categories": "", "major_categories_detail": ""}], "experiences": [{"id": 16732, "detail": "Level 2 escalation on the incident, problem management on the linux system.\nPre-sale support on cloud (alibabacloud) . Handle the task and dispatch to the team member as technical leader.\nProvide capacity report and incident report analysis for customer.\nTechnical support project manager for client project.\nTraining the L1 team on the cloud (AWS , Alibabacloud), incident process.\nAutomation code for IaaS (ansible, terraform, git).", "company": "Linkbynet VietNam.", "end_time": "2023-04-13T00:00:00Z", "industry": "Other", "position": "System Engineer", "conf_score": 0.8914781477911538, "start_time": "2018-01-01T00:00:00Z"}, {"id": 16734, "detail": "eployment servers on cloud AWS, Alicloud for global customer.\nDeployment hybris, magento, symphony and provide automation script deployment for our client.\nOnsite support at Singapore for some project.", "company": "Linkbynet VietNam", "end_time": "2017-01-31T00:00:00Z", "industry": "Other", "position": "System Admin", "conf_score": 0.9027481999492581, "start_time": "2016-01-01T00:00:00Z"}, {"id": 16736, "detail": "Provide a training to Montreal technical team about Alibabacloud. Support the customer at Montreal.", "company": "Linkbynet Canada", "end_time": "2016-02-29T00:00:00Z", "industry": "Other", "position": "System Admin", "conf_score": 0.9257062876052345, "start_time": "2015-11-01T00:00:00Z"}], "address": "51 Street 13,hiep Binh Phuoc, Thu \u0110uc District, Hcm City"}