{"skills": ["linux", "unix", "docker", "crm", "marketing", "c++", "implementation", "c#", "sales", "system monitoring", "xml", "management", "excel", "unit test", "heroku", "postgresql", "enterprise", "ubuntu", "git", "microsoft sql server", "analysis", "structure", "project management", "redis", "sell", "medium", "invoicing", "mrp", "linux shell", "design pattern", "sql", "accounting", "oop", "warehousing", "inventory management", "github", "microsoft", "nltk", "database", "cocoa", "python", "macos", "mysql", "singleton", "openldap"], "fulltext": "DAO DONG DUC \n(+84) 909 13 17 12 \nEmail: blakice12@gmail.com | Skype: blakice12 \nEDUCATION\n2011 - 2017 University of Information Technology, Vietnam National University - Ho Chi Minh \nCity \nCertifications Bachelor of Engineering in Information System \nGPA: 8.14/10 \nTOEIC (ETS): 830/990 \nWORKING EXPERIENCES \n5/2017 - Present Komit Consulting (Odoo Partner) - Team Leader \n6/2016 - 4/2017 Trobz (Odoo Partner) - Technical Consultant \n2/2016 - 5/2017 Younet Media - Research and Development \n8/2015 - 10/2015 Trobz (Odoo Partner) - Intern Developer \nTECHNICAL SKILLS \nProgramming Languages: Python, XML, C#, SQL \nFramework: Odoo: Strong knowledge about native Odoo modules, writing unit test for \nmodules, migrating database by OpenUpgrade to new version \n.NET: Main platform for almost all projects at University \nDatabase: PostgreSQL, MySQL, Redis, Microsoft SQL Server \nOther: OS: Windows, Linux/Unix (Ubuntu / MacOS) \nTools: git, linux shell \nKnowledge of debugging software, especially Python. \nBasic knowledge about Docker, VPS (Digital Ocean, Heroku...). \nDeploy Odoo instances \nOOP - Design Patterns: Singleton, Adapter, Composite, Factory\u2026 \nKnowledge about Hackintosh \nActivities: Open Source: Member of OCA (Odoo Community Association) \nContributes to OCA repositories: Migrations, code review, fixing issues, creating \nnew modules. Github: https://github.com/novawish \n1/3 \nPROJECTS \nYounet Media (https://www.younetmedia.com) - Research and Development \nGraduation thesis project: Key phrases extraction for Social Media Monitoring System \nDescription: Written in Python with NLP (Natural Processing Language) feature: Extract top-mentioned \nwords on Social Media in a period of time to see what is the trend of Vietnamese. \nTools using: nltk, VN tokenizer, boost (C++ library to compile for Python-using), redis (for \nranking words)... \nResult: Defended successfully at university with score 8.1/10 \nTrobz (https://trobz.com) - Odoo Technical Consultant \nALWIN http://www.alwin.com \nA manufacturing company, they produce many kinds of towel and soap dispensers products \nin order to export to America and Europe. \nDescription: Customize MRP (Material Requirements Planning) module to adapt customer\u2019s needs: \n\u25cf\nMulti-step routes for manufacturing \n\u25cf\nRework Manufacturing Orders \n\u25cf\nSpare products \nPuratosGP http://www.puratosgrandplace.com \nThey produce cocoa-based products, they have many stock warehouses throughout Vietnam \nDescription: Main module is Inventory Management, customer has specific needs for stock module: \n\u25cf\nInventory Summary Report: Show all stock movements from all locations \nManuchar https://manuchar.com \nA logistic company, provides warehousing services at harbor. \nDescription: Mostly depends on customized modules: \n\u25cf\nTruck Management \n\u25cf\nIntegration with 3PL, Weighing system \nInternal projects TFA (Company\u2019s Financial Management), TMS (Projects and requirements management), \nBlooming Lotus (creates Odoo modules on Web Interface) \nDescription: Fix bugs and develop new features \nKomit Consulting (https://komit-consulting.com) - Odoo Team Leader \nDRCOM https://www.drcomgroup.com \nMarketing agency specialized in medical communication \n2/3 \nDescription: \n\u25cf\nMain modules: Sales, CRM, Project Management, TImesheet, HR \n\u25cf\nMigration from Odoo Version 6.0 Community to 11.0 Enterprise \n\u25cf\nOpenLDAP Integration \n\u25cf\nDesigning a completely different UI from Odoo \nMain responsibility: \n\u25cf\nAnalysis and implementation \n\u25cf\nManage tasks and allocate to team members \n\u25cf\nCode review and training members \n\u25cf\nQC and Customer support \nBanh Vang https://banhvang.com \nManufacturing company for industrial bakery \nDescription: \n\u25cf\nMain modules: Inventory, Manufacturing, Sales, Purchase. Invoicing \n\u25cf\nCustomize MRP module to adapt factory's production flow \n\u25cf\nSynchronize invoicing data between Odoo and FAST accounting by Excel \nMain responsibility: \n\u25cf\nAnalysis and implementation \n\u25cf\nManage tasks and allocate to team members \n\u25cf\nCode review and support members \n\u25cf\nOrganize customer training sessions \nParasol Co. https://www.parasolco.com \nUS Company sells baby products like diapers, tissues... \nDescrition: \n\u25cf\nMain modules: Sales, Inventory, Purchase \n\u25cf\nIntegration with Shopify e-commerce by 3rd party module \n\u25cf\nIntegration with UPS (delivery service) by 3rd party module \nMain responsibility: \n\u25cf\nAnalysis and implementation \n\u25cf\nWork with 3rd party to customize the connectors \n\u25cf\nCode review and support members \n\u25cf\nQC and support customer \nOutsourced \nProjects \nPartners are mostly European companies: Finland, France. \n\u25cf\nMigration from Odoo 7.0 to 11.0 \n\u25cf\nAnalysis and implementation \n\u25cf\nBugs fixing \n\u25cf\nCode review and QC \nInternal Projects \n\u25cf\nProject management: Ticket management, project development \n\u25cf\nPayroll system: Salary structures for Vietnamese and foreign employees \n\u25cf\nAccounting management: Viettel E-Invoice connector - Using Viettel API to \nintegrate invoicing data between Odoo and Viettel\u2019s e-invoice service \nCompany  activities \n\u25cf\nOrganize experience-sharing sessions about Odoo features and technical knowledge \n\u25cf\nOrganize OCA workshops: Contribute to Odoo Community \n\u25cf\nOrganize Odoo training course for newcomers \n3/3 ", "educations": [{"id": 4994, "gpa": null, "major": null, "school": "University of Information Technology, Vietnam National University -", "diploma": "Bachelors", "end_time": "2017-01-01T00:00:00Z", "conf_score": 0.7275132206498556, "start_time": "2011-01-01T00:00:00Z", "picklist_major": "Other", "major_categories": "", "major_categories_detail": ""}], "experiences": [{"id": 16725, "detail": "", "company": "Komit Consulting (Odoo Partner)", "end_time": "2023-04-13T00:00:00Z", "industry": "High Technology", "position": "Team Leader", "conf_score": 0.7897513794629749, "start_time": "2017-05-01T00:00:00Z"}, {"id": 16726, "detail": "", "company": "Younet Media", "end_time": "2017-05-31T00:00:00Z", "industry": "Other", "position": "Research and Development", "conf_score": 0.8967290006738793, "start_time": "2016-02-01T00:00:00Z"}, {"id": 16727, "detail": "", "company": "Trobz (Odoo Partner)", "end_time": "2017-04-30T00:00:00Z", "industry": "Other", "position": "Technical Consultant", "conf_score": 0.9004514612842877, "start_time": "2016-06-01T00:00:00Z"}, {"id": 16728, "detail": "", "company": "Trobz (Odoo Partner)", "end_time": "2015-10-31T00:00:00Z", "industry": "Other", "position": "Intern Developer", "conf_score": 0.9004514612842877, "start_time": "2015-08-01T00:00:00Z"}], "address": null}