{"skills": ["asana", "studio", "css", "microservices", "java", "svn", "jira", "risks", "html", "system software", "redis", "mysql", "insurance", "oracle", "scrum master", "project management", "sql", "visual studio", "c#", "sql database", "javascript", "database", "mongo", "mantis", "excel", "wcf", "xml", "cache", "mvc", "software development", "risk management", "business analyst", "oauth2", "analyst", "mongodb", "tester", "quality assurance", "management", "trello", "asp", "java language", "problem solving"], "fulltext": "1  \nCURRICULUM VITAE \nPERSONAL DETAILS \n\u25cf \nName  \nNguyen Ngoc Minh \n\u25cf \nNationality  \nVietnamese \n\u25cf \nSex \nMale \n\u25cf \nMarital status     \nMarried \n\u25cf \nPhone  \n0966921253 \n\u25cf \nEmail \nhtm.nguyenminh@gmail.com \nOBJECTIVE \nBecoming a professional project manager \nBringing the best value to customer \n\u2022 \n\u2022 \nPROFESSIONAL SUMMARY \n2014 :  Bachelor of IT \u2013 University of Science Hochiminh City. \n5 years of professional experience as Developer.  \nExperienced in leading team size (10-20 members) and leading multiple team at *the same \ntime (2-3 teams) \nExperienced working in multiple kinds of project: Ha Noi Educational system, Health \nInsurance of Ha Noi\u2026 \nAbility to research new technologies \nGood job pressure \nExperienced in requirements analyst and design functions/user flow. \nGather ideas from end-clients (who are businessman) and then research/suggest and \ndiscuss to define requirements \nCommunicate and report to end-client closely \nProblem solving: Issues from client relates requirements/schedule/cost, issues from end-\nuser relates application functions, issues from team relates resource managements and \nreview rewards/penalty \n\u2022 \n\u2022 \n\u2022 \n\u2022 \n\u2022 \n\u2022 \n\u2022 \n\u2022 \n\u2022 \n\u2022 \nEDUCATION & CERTIFICATIONS \nFrom: 2009 \nTo: 2014 \nUniversity of Science Hochiminh City, Vietnam \nFrom: 12/2018 \nTo: 04/2019 \nDeveloper \u2013 Nhat Cuong company. \nWORK EXPERIENCE  \nFrom: 03/2017 \nTo: present \nCompany: Nhat Cuong Sotfware \nWork as: Scrum Master/ Developer \nFrom: 10/2015 \nTo: 02/2017 \nCompany: Viet Long VLIL Co. \nWork as: Developer/Leader \nFrom: 10/2014 \nTo: 10/2015 \nCompany: Dat Viet Sotfware \nWork as: Developer \n2  \nTECHNOLOGY AND SOFTWARE DEVELOPMENT  SKILLS \nLevel: 1-4 Aware (Basic, need to practice more); 5-7 Knowledgeable (Intermediate, can use it at \nwork); 8-10 Proficient (Advanced, very good to use it at work) \nCompetencies \nLevel \nProgramming Language \nC#, ASP.NET \nProficient, 8/10 \nWindows Form, winservices \nProficient, 8/10 \nJavaScript \nProficient, 8/10 \nHTML, CSS \nProficient, 8/10 \nWeb API, Web services \nProficient, 8/10 \nAccount Kit cho web \nProficient, 7/10 \nProject Management Skills \nProduct Owner \nProficient, 8/10 \nBusiness Analyst \nProficient, 8/10 \nQuality Assurance \nProficient, 8/10  \nUser Flow/Mock up Design \nProficient, 8/10 \nResource management \nProficient, 8/10 \nTime management \nProficient, 8/10 \nRisk management \nProficient, 8/10 \nTechnologies \nParallel programming, .Net Core, OAuth2 \nProficient, 7/10  \nMicroservices \nKnowledgeable, 7/10 \nRedis Cache \nProficient, 7/10 \nDatabases \nMySQL \nProficient, 7/10 \nSQL server \nProficient, 8/10 \nOracle \nProficient, 8/10 \nMongo DB \nProficient, 8/10 \nTools \nJira, Work chat, Mantis \nProficient, 9/10 \nTrello/Asana/Slack \nProficient, 9/10 \nSVN, TFS \nProficient, 9/10 \nOthers \nWindows \nProficient, 8/10 \nProduction Deployment \nKnowledgeable, 7/10 \n3  \nLANGUAGES \nLanguage \nLevel \nNote \nEnglish \nGood \nListening, Speaking, Reading, Writing \nPROJECT LIST \nEducational system  (03/2017 \u2013 7/2019) \nProject  Description: \nEducational system, App PINO \nTeam size \n20 \nResponsibilities: \nTeam Leader/Scrum Master: \n\u2022 \nBuilding Website, Winform, Web Services, Web API \n\u2022 \nManage plan and resource \n\u2022 \nFix bug Data \n\u2022 \nReport to line manager about progress \nProgramming Languages: \nJava Script, ASP.Net, MVC, CSS,HTML, C# \nTools \nVS code, svn , Visual Studio , TFS \nPlatform, server and \ndatabase \nOracle, MongoDB \nUsed technologies: \n Javascript , DevExpress, Parallel Programming, Account Kit cho web, \nOAuth2, Microservices, Redis Cache, Memcache,\u2026. \nL\u2019Fitness (10/2015 to 03/2017) \nProject  Description: \nL\u2019Fitness is a manager software Fitness Center .  \nTeam size \n2 \nResponsibilities: \nProject Manager/Business Analyst \n\u2022 \nBuilding App window form. \n\u2022 \nDesign function and mock-up based on end-clients ideas/requirements \n\u2022 \nManage plan and report progress to clients \nProgramming Languages \nused: \nC# \nTools \nJira, VS code \nPlatform, server and \ndatabase \nSQL, SQL Lite \n4  \nL\u2019Pos (10/2015 to 03/2017) \nProject  Description: \nL\u2019POS is a manager Software Shop, Restaurant \nTeam size \n2 \nResponsibilities: \nLeader: \n\u2022 \nBuilding window form, website \n\u2022 \nDesign function and mock-up based on end-clients ideas/requirements \nProgramming Languages: \nC#,ASP.NET ,JavaScript, CSS \nTools \nVS code \nPlatform, server and \ndatabase \nSQL Server \nBuildCV website (10/2014 to 11/2014) \nProject  Description: \nBuildCV website. \nTeam size \n5 \nResponsibilities: \nProduct Owner \n\u2022 \nBuilding website BuildCV online \nProgramming Languages: \nASP.Net \nPlatform, server and \ndatabase \nMongoDB \nEBH Social insurance project (11/2014 to 10/2015) \nProject  Description: \nEBH Social insurance project \nTeam size \n6 \nResponsibilities: \nProduct Owner \n\u2022 \nDesign Template EBH, Code Farpoint and Test project. \nProgramming Languages: \nFarpoint, excel, XML \nTools  Farpoint \nPlatform, server and \ndatabase \nSQL Server \n5  \nMot Cua Quoc Gia  project (11/2014 to 10/2015) \nProject  Description: \nMot Cua Quoc Gia  project \nTeam size \n4 \nResponsibilities: \nProduct Owner \n\u2022 Building Service ImportExcel and Tester. \nProgramming Languages: ASP.NET,WCF, TestPlan. \nTools \nVisual Studio \nPlatform, server and \ndatabase \nOracle \nPowered by TCPDF (www.tcpdf.org)", "educations": [{"id": 5006, "gpa": null, "major": null, "school": "University of Science Hochiminh City", "diploma": "Bachelors", "end_time": "2014-01-01T00:00:00Z", "conf_score": 0.8689692803656918, "start_time": null, "picklist_major": "Other", "major_categories": "", "major_categories_detail": ""}], "experiences": [{"id": 16758, "detail": "", "company": "Nhat Cuong Sotfware", "end_time": "2023-04-13T00:00:00Z", "industry": "Other", "position": null, "conf_score": 0.739160480183715, "start_time": "2017-03-01T00:00:00Z"}, {"id": 16762, "detail": "Leader/Scrum Master: \u2022 Building Website, Winform, Web Services, Web API \u2022 Manage plan and resource\n\u2022 Fix bug Data \u2022 Report to line manager about progress\nProgramming Languages: Java Script, ASP.Net, MVC, CSS,HTML, C# Tools VS code, svn , Visual Studio , TFS Platform, server and database\nOracle, MongoDB Used technologies:\nJavascript , DevExpress, Parallel Programming, Account Kit cho web,\nOAuth2, Microservices, Redis Cache, Memcache,....", "company": null, "end_time": "2019-07-31T00:00:00Z", "industry": "Other", "position": "Team", "conf_score": 0.6925429707670153, "start_time": "2017-03-01T00:00:00Z"}, {"id": 16766, "detail": "", "company": "Nhat Cuong company", "end_time": "2019-04-30T00:00:00Z", "industry": "Other", "position": "Developer", "conf_score": 0.8544766839910505, "start_time": "2018-12-01T00:00:00Z"}, {"id": 16769, "detail": "\u2022 Building App window form.\n\u2022 Design function and mock-up based on end-clients ideas/requirements\n\u2022 Manage plan and report progress to clients\nProgramming Languages used:\nC# Tools Jira, VS code\nPlatform, server and database\nSQL, SQL Lite", "company": "L\u2019Fitness", "end_time": "2017-03-31T00:00:00Z", "industry": "Other", "position": "Project Manager/Business Analyst", "conf_score": 0.8994817994166205, "start_time": "2015-10-01T00:00:00Z"}, {"id": 16771, "detail": "", "company": "Viet Long VLIL Co.", "end_time": "2017-02-28T00:00:00Z", "industry": "Other", "position": "Scrum Master/ Developer", "conf_score": 0.9085716158340945, "start_time": "2015-10-01T00:00:00Z"}, {"id": 16772, "detail": "TECHNOLOGY AND SOFTWARE DEVELOPMENT SKILLS Level: 1-4 Aware (Basic, need to practice more); 5-7 Knowledgeable (Intermediate, can use it at work); 8-10 Proficient (Advanced, very good to use it at work)\nCompetencies Level Programming Language C#, ASP.NET Proficient, 8/10 Windows Form, winservices\nProficient, 8/10 JavaScript Proficient, 8/10 HTML, CSS Proficient, 8/10 Web API, Web services\nProficient, 8/10 Account Kit cho web\nProficient, 7/10", "company": "Dat Viet Sotfware", "end_time": "2015-10-31T00:00:00Z", "industry": "Other", "position": "Developer", "conf_score": 0.9085716158340945, "start_time": "2014-10-01T00:00:00Z"}, {"id": 16774, "detail": ". Experienced in leading team size (10-20 members) and leading multiple team at *the same time (2-3 teams)\nExperienced working in multiple kinds of project: Ha Noi Educational system, Health Insurance of Ha Noi... Ability to research new technologies\nGood job pressure\nExperienced in requirements analyst and design functions/user flow.\nGather ideas from end-clients (who are businessman) and then research/suggest and discuss to define requirements\nCommunicate and report to end-client closely\nProblem solving: Issues from client relates requirements/schedule/cost, issues from end- user relates application functions, issues from team relates resource managements and review rewards/penalty", "company": null, "end_time": "2014-12-31T00:00:00Z", "industry": "Other", "position": "Developer", "conf_score": 0.8689692803656918, "start_time": "2014-01-01T00:00:00Z"}, {"id": 16775, "detail": "uilding website BuildCV online\nProgramming Languages: ASP.Net Platform, server and database\nMongoDB", "company": "L\u2019Pos", "end_time": "2014-11-30T00:00:00Z", "industry": "Other", "position": "Product Owner", "conf_score": 0.6905021871308187, "start_time": "2014-10-01T00:00:00Z"}], "address": null}