{"skills": ["linux", "postman", "docker", "responsive", "javascript", "multi tenant", "es6", "cli", "management", "redux", "tail", "postgresql", "git", "svn", "devops", "rail", "ruby", "website development", "sql", "css", "software development", "reactjs", "golang", "jenkins", "regular expression", "networking", "problem solving", "process management", "html"], "fulltext": "Nguyen Duy Hao                                                                                  \nSummary \n\uf0b7 \nEager to learn, high sense of responsibility and good communication. \n\uf0b7 \nHaving 2.5 years experienced in software development. \n\uf0b7 \nExperienced in Ruby on Rails, Postgres, Golang, Javascript, HTML/CSS. \n\uf0b7 \nAbility to work independently as well as in a team. \nEmployment \n9/2017 \u2013 3/2019           Web Development  at Larion \n\uf0b7 \nBuild layout, responsive with Javascript, HTML, CSS. \n\uf0b7 \nTrouble shoot issues on production. \n\uf0b7 \nImprove performance script load data. \n\uf0b7 \nTraining, review script optimize performance. \n\uf0b7 \nTraining on job for newbie debug on Chrome Devtools. \n\uf0b7 \nSupport team member trouble shoot problems. \n8/2016 \u2013 8/2017           Web Development  at GMO Runsystem  \n\uf0b7 \nDevelopment web by React, Redux. \n\uf0b7 \nTraining React, Redux for newbie. \nProject and work experience \nHealthcare  (2017)          Fullstack and Devops \n\uf0b7 \nSolving problems related to load data heavy. \n\uf0b7 \nBuild smart tools for teammates to use. \n\uf0b7 \nCheck resources and detect problems on production. \n\uf0b7 \nOverview Linux and OS, Process management. \n\uf0b7 \nOverview architecture multi tenant. \n\uf0b7 \nResponsive and customize web pages by pure JS. \n\uf0b7 \nOptimize script Ruby and SQL. \n                                        Languages/ Technologies:  \n\uf0b7 \nRoR, Golang, Bash, Postgresql, Solr. \n\uf0b7 \nJavascript, HTML, CSS. \neCommerce (2017)        Frontend  \n\uf0b7 \nBuild core for system eCommerce. \n\uf0b7 \nOverview on ES6 and ReactJS/ Redux. \nLanguages/ Technologies: React/Redux, ES6. \nSkills \nPlatforms                       Linux, Windows, Docker. \nEditors                            Emacs, CodePen. \nSoftwares                      Chrome devtools, Postman, postgres cli, Git, SVN, Jenkins. \nOthers                           Have some experience in networking, regular expression, tools \n                                such as: grep, tail, head, screen, sort, cut, df, du, htop, iotop. \nEducation \n2009 \u2013 2014                   University of Technical Education Ho Chi Minh City. \n                                       Major: Information Technology. ", "educations": [{"id": 4995, "gpa": null, "major": "C\u00f4ng ngh\u1ec7 th\u00f4ng tin", "school": "University of Technical Education Ho Chi Minh City", "diploma": "Bachelors", "end_time": "2014-01-01T00:00:00Z", "conf_score": 0.7551834254203837, "start_time": "2009-01-01T00:00:00Z", "picklist_major": "IT - Hardware/Networking", "major_categories": "M\u00e1y t\u00ednh v\u00e0 c\u00f4ng ngh\u1ec7 th\u00f4ng tin", "major_categories_detail": "C\u00f4ng ngh\u1ec7 th\u00f4ng tin"}], "experiences": [{"id": 16729, "detail": "Build layout, responsive with Javascript, HTML, CSS. Trouble shoot issues on production.\nImprove performance script load data.\nTraining, review script optimize performance.\nTraining on job for newbie debug on Chrome Devtools. Support team member trouble shoot problems.", "company": "Larion", "end_time": "2019-03-31T00:00:00Z", "industry": "Other", "position": "Web Development", "conf_score": 0.9181269048441778, "start_time": "2017-09-01T00:00:00Z"}, {"id": 16730, "detail": "Solving problems related to load data heavy.\nBuild smart tools for teammates to use.\nCheck resources and detect problems on production.\nOverview Linux and OS, Process management.\nOverview architecture multi tenant.\nResponsive and customize web pages by pure JS. Optimize script Ruby and SQL. Languages/ Technologies: RoR, Golang, Bash, Postgresql, Solr. Javascript, HTML, CSS.", "company": "Healthcare", "end_time": "2017-12-31T00:00:00Z", "industry": "Other", "position": "Fullstack and Devops", "conf_score": 0.7381413216447057, "start_time": "2017-01-01T00:00:00Z"}, {"id": 16731, "detail": "Development web by React, Redux. Training React, Redux for newbie.", "company": "GMO Runsystem", "end_time": "2017-08-31T00:00:00Z", "industry": "Other", "position": "Web Development", "conf_score": 0.9181269048441778, "start_time": "2016-08-01T00:00:00Z"}], "address": null}