{"skills": ["jwt", "bug fixing", "design pattern", "restful", "mysql", "bitbucket", "database", "software development", "teamwork", "database design", "entity framework", "database development", "maintenance", "management", "sql", "communication skill", "c#", "asp"], "fulltext": "V\u0169 V\u0103n Ti\u1ebfn\nJunior .Net Developer\nSeptember 02, 1991\nMale\n0988971312\nanhtien90@gmail.com\nHo Chi Minh city, Vietnam\nhttps://www.linkedin.com/in/t\nien-vu-2240b0144/\n//WORK EXPERIENCE\nSTS\nJanuary 2018 - Present\nFulltime developer in Saigon Technology - Software\nDevelopment Outsourcing Company\nMain responsibilities:\n- Project maintenance and development\n- Design database and buil RESTful API\n//PROJECTS\nOffice Application (Jan 2018 - Feb 2018)\nCustomer\nIDWF from Singapore\nDescription\n- This is the app that helps people of departments\ncommunicate with each other through website\nTeam size\n4\nMy position\nDeveloper\nMy responsibilities\n- Development\n- Optimize code\n- Bug Fixing\nTechnologies used\n- Asp.net Core 1.0,SQL Server,JWT,Hangfire\nSTS Insider (Mar 2018 - Aug 2018)\nCustomer\nProduct Internal\nDescription\n- This app is product of internal company, help management\ntimesheet of employee.\nTeam size\n4\nMy position\nDeveloper\nMy responsibilities\n- Development\n- Review code\n- Optimize code\n- Bug Fixing\nTechnologies used\n- Asp.net Core 2.0,SQL Server\nKarcher Intranet (September 2018 - Present)\nCustomer\nKarcher Intranet\nDescription\n- This app management employees,news in companies belong to\nKarcher across the globe\nTeam size\n8\nMy position\nDeveloper\nMy responsibilities\n- Design database \n- Development\n- Review code\n- Optimize code\n- Bug Fixing\nTechnologies used\n- Asp.net Core 2.1,MySQL,JWT,Hangfire...\n//SKILL //EDUCATION\n- Programming Languages : C#\n- Frameworks : Entity Framework Code\nfirst,ASP.NET Core\n- Design patterns : Repository pattern, Unit\nOf Work\n- Database managementsystems : SQl Server,My\nSQL\n- Version control : Gitt (Bitbucket service,\ntool: tortoisegit)\n- Language (English) : Read,Write\n- Soft skills : Presentation, teamwork and\ncommunication skills\nOct 2014 - May 2018\nUniversity Of Information Technology\n\u00a9 topcv.vn\nPowered by TCPDF (www.tcpdf.org)", "educations": [{"id": 5024, "gpa": null, "major": null, "school": "University Of Information Technology", "diploma": "Bachelors", "end_time": "2018-05-01T00:00:00Z", "conf_score": 0.7334530749718071, "start_time": "2014-10-01T00:00:00Z", "picklist_major": "Other", "major_categories": "", "major_categories_detail": ""}], "experiences": [{"id": 16822, "detail": "Main responsibilities:\n- Project maintenance and development\n- Design database and buil RESTful API", "company": "Saigon Technology - Software Development Outsourcing Company", "end_time": "2023-04-13T00:00:00Z", "industry": "High Technology", "position": "Fulltime developer", "conf_score": 0.8141298764232529, "start_time": "2018-01-01T00:00:00Z"}], "address": "Ho Chi Minh city, Vietnam"}