{"skills": ["java", "testing", "internet", "spring mvc", "ejb", "mysql", "business rule", "oracle", "redux", "io", "angular", "sql", "clarify", "elasticsearch", "strut", "banking", "rabbitmq", "spring boot", "mobile testing", "react native", "mvc", "ams", "enterprise", "hibernate", "software development", "android", "rest", "spring", "postgresql"], "fulltext": "HOANG XUAN \nHUONG \nBinh Thanh, TP.HCM  \nEDUCATION \n2019 \n  BINH DUONG UNIVERSITY \nMajor: Software Engineer \n2013 \nWORK EXPERIENCE \n2018 \nnow \n2017 \n2018 \n2014 \n2017 \nINNOTECH VIETNAM \nSenior Software Engineer \nProject Name: ACB Banking \nClient From: Vietnam \nDescription: Build application on Internet and Mobile Banking \nTechnical \n-Web Service, Microservice \n-Spring boot,JPA,Elasticsearch,Google API \nServices,RabbitMq -PostgreSQL,MySQL,Oracle \nMain responsibilities: \n- Developing and maintaining the back-end functionality of system. \n- Participating in discussions with clients to clarify what they want. \n- Designing patterns for project if required. \n- Contacting external team to confirm info of requirement. \n- Coding review. \n- Document Service. \nOMART VIETNAM \nSenior Software Engineer \nProject Name: e-commerce \nClient From: Vietnam \nDescription: application for e-commerce, Web,Mobile \nTechnical \n-Web Service \n-Spring boot,JPA,Twilio, Fire Base,Elasticsearch,Google \nAPI Services -My SQL \nMain responsibilities: \n-I am responsible a development REST API backend. \n-Document API for integrate with Front-end Web and Mobile. \n-Testing Service \n-Code review \n-Make sure deliver on time to production. \nCSC VIETNAM (DXC VIETNAM) \nSenior Software Engineer \nProject Name: SAP Portal Java \nClient From: Canada \nDescription: enterprise portal for aircraft manufacturing industry \nTechnical: \n- Web Dynpro Java 7.4 \n2013 \n2014 \n- Hibernate, JPA, EJB \n- DB: Oracle \nMain responsibilities: \n-Upgrade to new version base on available application -\nInteraction and Communication with onshore team \n-Help other members to keep up with the software development progress \n------------------------------------------------------------------------------------- \nProject Name: TLS \nClient From: Singapore \nDescription: Telecoms licensing system of Singapore government \nTechnical: \n-Struts 1,2 \n-IBatis \n-Server: Weblogic \n-DB: Oracle \nMain responsibilities: \n-Development and enhancement from existing \napplication -Maintain application after release. -\nHelp other members fix bug. \n-Working with QC team and report task to project manager. \n------------------------------------------------------------------------------------- \nProject Name: MOH \nClient From: Singapore \nDescription: Ministry of Health Singapore government \nTechnical: \n-Spring Boot Web Service Restfull API, JPA, Hibernate. \n-Angular 1 (front-end) \n-Server: Weblogic \n-DB: Oracle,H2 for dev \nMain responsibilities: \n-Development from Scratch base on requirements from QA. \n-Working with BA,QC to clarify requirement from onshore team. \n-Receive feedback from QC,QA to update requirement, fix bug if needed \n- Review business rules from other member after completed \n- Reporting task to project manager \n------------------------------------------------------------------------------------ \nProject Name: FROG ASIA \nClient From: Malaysia \nDescription: Building Highly Education \nApplication Technical: \n-React Native \n-Redux \n-Run on IOS and Android \ndevice Main responsibilities: \n-Development from Scratch base on requirements \nfrom onshore. -Working directly onshore team to clarify \nrequirements -Report task to onshore leader. \nEWI VIETNAM \nJava Developer \nProject Name: PTUS \nClient From: US \nDescription: enterprise portal for plastic industry \nTechnical \n- Restfull Web Service Spring, MVC \n- Hibernate \n- Sencha Ext JS (front-end) \nMain responsibilities: \n-implement task assigned from team leader. \n-fix bug and remain the existing source. \n-reporting task to leader. \nCERTIFICATIONS \n2014 \nTOEIC Certificate at IIG \n\u00a9 topcv.vn ", "educations": [{"id": 5030, "gpa": null, "major": "Software Engineer", "school": "BINH DUONG UNIVERSITY", "diploma": "Bachelors", "end_time": "2019-01-01T00:00:00Z", "conf_score": 0.9242047582276173, "start_time": "2013-01-01T00:00:00Z", "picklist_major": "Other", "major_categories": "", "major_categories_detail": ""}], "experiences": [{"id": 16839, "detail": "Project Name: ACB Banking Client From: Vietnam Description: Build application on Internet and Mobile Banking Technical -Web Service, Microservice -Spring boot,JPA,Elasticsearch,Google API Services,RabbitMq -PostgreSQL,MySQL,Oracle Main responsibilities:\n- Developing and maintaining the back-end functionality of system.\n- Participating in discussions with clients to clarify what they want.\n- Designing patterns for project if required.\n- Contacting external team to confirm info of requirement.\n- Coding review.\n- Document Service.", "company": "INNOTECH VIETNAM", "end_time": "2023-04-13T00:00:00Z", "industry": "High Technology", "position": "Senior Software Engineer", "conf_score": 0.9174648511369632, "start_time": "2018-01-01T00:00:00Z"}, {"id": 16841, "detail": "Project Name: e-commerce\nClient From: Vietnam Description: application for e-commerce, Web,Mobile Technical -Web Service -Spring boot,JPA,Twilio, Fire Base,Elasticsearch,Google API Services -My SQL Main responsibilities:\n-I am responsible a development REST API backend.\n-Document API for integrate with Front-end Web and Mobile. -Testing Service -Code review\n-Make sure deliver on time to production.", "company": "OMART VIETNAM", "end_time": "2018-01-31T00:00:00Z", "industry": "Other", "position": "Senior Software Engineer", "conf_score": 0.8310701854240083, "start_time": "2017-01-01T00:00:00Z"}, {"id": 16843, "detail": "Project Name: SAP Portal Java Client From: Canada Description: enterprise portal for aircraft manufacturing industry\nTechnical: - Web Dynpro Java 7.4 - Hibernate, JPA, EJB - DB: Oracle Main responsibilities:\n-Upgrade to new version base on available application - Interaction and Communication with onshore team\n-Help other members to keep up with the software development progress\n------------------------------------------------------------------------------------- Project Name: TLS Client From: Singapore Description: Telecoms licensing system of Singapore government\nTechnical: -Struts 1,2 -IBatis -Server: Weblogic -DB: Oracle Main responsibilities:\n-Development and enhancement from existing application -Maintain application after release. - Help other members fix bug.\n-Working with QC team and report task to project manager.\n------------------------------------------------------------------------------------- Project Name: MOH Client From: Singapore Description: Ministry of Health Singapore government\nTechnical: -Spring Boot Web Service Restfull API, JPA, Hibernate. -Angular 1 (front-end)\n-Server: Weblogic -DB: Oracle,H2 for dev\nMain responsibilities:\n-Development from Scratch base on requirements from QA. -Working with BA,QC to clarify requirement from onshore team.\n-Receive feedback from QC,QA to update requirement, fix bug if needed\n- Review business rules from other member after completed\n- Reporting task to project manager\n------------------------------------------------------------------------------------ Project Name: FROG ASIA Client From: Malaysia Description: Building Highly Education Application Technical: -React Native -Redux -Run on IOS and Android device Main responsibilities:\n-Development from Scratch base on requirements from onshore. -Working directly onshore team to clarify requirements -Report task to onshore leader. -implement task assigned from team leader. -fix bug and remain the existing source. -reporting task to leader.", "company": "CSC VIETNAM (DXC VIETNAM)", "end_time": "2017-01-31T00:00:00Z", "industry": "Other", "position": "Senior Software Engineer", "conf_score": 0.9125776658202421, "start_time": "2014-01-01T00:00:00Z"}], "address": "Binh Thanh, Tp.hcm"}