{"skills": ["linux", "phpunit", "freebsd", "docker", "java", "automation", "delphi", "wordpress", "chef", "javascript", "ams", "apache", "circleci", "mongodb", "ftp", "java language", "perl", "management", "excel", "unit test", "postgresql", "security", "salesforce", "scrum master", "ubuntu", "git", "svn", "structure", "devops", "spring", "operating system", "mysql", "ansible", "recruitment", "ecs", "saas", "design pattern", "centos", "jira", "microsoft project", "bamboo", "software development", "camel", "microsoft", "manage database", "database", "smtp", "parsing", "cgi", "networking", "perforce", "software development methodology", "redmine", "bitbucket", "php", "agile", "protocol", "singleton"], "fulltext": "CURRICULUM VITAE \nName: Nguyen Ngoc Lam Anh \nAddress: 208/116 Duong so 5, Binh Hung Hoa, Binh Tan \nTel: 0975 087 878 - Email: lamanh_nguyen@yahoo.com \nEducational Qualifications \n\u2022 2000 - 2005 : Bachelor of Engineering \no Faculty of Information Technology, HCMC University of Technology \nQualifications: \n\u2022 14 years experience with Software Development, including 10 years as a team \nleader or Project Manager. \n\u2022 Experience with software development methodologies: \n\u00a7 Water falls \n\u00a7 Agile/Scrum \n\u2022 Experience with writing Functional Design, Detail Design \n\u2022 Experience with code smell and refactoring code \n\u2022 Knowledge about Design Patterns: Singleton, Factory, Fa\u00e7ade, \u2026 \n\u2022 Knowledge with SaaS (Software as a Service) \nProjects: \n1. 2014 \u2013now (Mulodo Vietnam company) \n\u00a7 Toriaina: \nWriting a Frontend site for assessment system \nOS: Ubuntu \u2013 Language: PHP - Database: postgresql \nPostion: Team Lead \nTeam size: 3-4 members \n\u00a7 CORK: \nWriting EC system \nOS: Ubuntu - Language: PHP with Opencart - Database: Mysql \nPostion: Team Lead and PM \nTeam size: 3 members \n\u00a7 Hamee: \nWriting unit test for Hamee system. \nOS: Centos - Language: PHP (Zend), PHPUnit - Database: Mysql \nPosition: At the beginning, I worked as Project manager to start up a team with 3 \nmembers. From 7/2016 I changed into team lead of team with a purpose to get trust \nby quality from client to extend team. \nTeam size: 6 members \n\u00a7 ROM: \nDevelop ROM system with fanclub management system, CMS system, automation \nseating chart... \nOS: Centos - Language: PHP (CI, Wordpress) - Database: Mysql \nPosition: I was assigned to manage this team to solve many team issues (quality, \nunder estimating, web security, communicating with client) from 10/2015 \u2013 \n7/2016 \nTeam size: 4 members \n\u00a7 Rakuten: \nDevelop a part of Rakuten system with new technology \nLanguage: Java with Camel, Spring, Mule - Database: MongoDB \nPosition: I was assigned to manage this team to re-structure team, work with client \nclosely to solve conflict between team and client from 2/2016 - 7/2016 \nTeam size: 6 members \n\u00a7 HIS: \nDevelop HIS system with flight ticket and hotel booking, rating system \nOS: Ubuntu - Language: PHP with FuelPHP - Database: Mysql \nPosition: I was assigned to manage development team. I had worked with \nJapanese Project Manager to get requirement, support team,... since 4/2014 \nTeam size: 6 members \n2. 2009 \u20132014 (Harvey Nash Vietnam company)  \n\u00a7 EasyCruit of Lumesse ODC: \nMaintain for an online recruitment web site of Europe client. \nOS: Ubuntu - Language: Perl, Mason. - Database: Mysql \nPosition: I was a key member of development team in 2009 and 2010. From 2011 \nI am working as Project manager of development team. \nTeam size: 10 members \n\u00a7 Genus projects: \nSupport build team for deployment, install CentOS, Mysql, PHP, Apache as \nversions of client. \n\u00a7 Bodog ODC: \nDevelop new websites for Bodog client with Scrum. Support Dev Oops team for \ndeployment, write shell script for build automatically. \nOS: CentOS - Language: PHP (LAMP) - Database: Mysql \nPosition: Scrum Master and Technical Lead \nTeam size: 6 members \n3. 3/2009 \u201310/2009 (TMA company) NTTS team: \nWorked as developer in NTTS to develop the website and internal soft phone tool \nfor client (using Java programming). \nSometimes supported Director in the client meeting as Japanese interpreter. \n4. 2006 \u20132009 (Nankai Co. Ltd, Japan) \nSet up web server for the project, develop for inserting a large excel data into \ndatabase, manage, report \u2026 \nConfig mail server, develop for getting and sending mail, making a tree with mails, \nparsing mail content \nOS: Linux - Language: Perl, Javascript - Database: Postgresql 8.3 \nPosition: Developer \nEmployment History \n\u00a7 4/2014 \u2013 now: Mulodo Vietnam \nPosition: Development Project Manager and Team Leader \n\u00a7 10/2009 \u2013 4/2014: Havey Nash Vietnam \nPosition: Developer (10/2009 \u2013 2/2011) \n    And Team Lead and Project Manager (2/2011 \u2013 4/2014) \n\u00a7 3/2009 \u2013 10/2009: TMA Company \nPosition: Developer \n\u00a7 02/2006-01/2009: Nankai Company Co. Ltd \nPosition: Developer \n\u00a7 07/2005-12/2005: Tri Nhan Co. Ltd \nPosition: Developer \nForeign languages skills \n\u00a7 English: Level B2 (2011) of Bulats speaking test and level B1 high (2010) of \nBulats reading and writing test. \n\u00a7 Japanese: N2 (2008). \nComputer Skills \nLanguages: Salesforce, Perl/CGI, Perl/Mason, PHP, Java, Delphi, Javascript \nDevops tool: Vagrant, Chef, Docker, Ansible \nOperating systems: FreeBSD, Ubuntu, Centos, Redhat \nOthers: Apache, FTP, SMTP, NFS\u2026 \nDatabase: Postgresql, MySQL \nBasic knowledge : networking protocol \nOther tools: VMWare, SVN, Git, Bitbucket, Perforce, Devtrack, Microsoft Project, \nJira, Bamboo, Redmine, CI system (CircleCI, Jenskin)\u2026 \nAchievement : \nTeam of the Year 2017 for Hamee team \nTeam lead of the year 2011 of Lumesse ODC. \nCertificate of \u201cLeadership skills\u201d of G&H Managerment Services. \nPowered by TCPDF (www.tcpdf.org)", "educations": [{"id": 5031, "gpa": null, "major": "C\u00f4ng ngh\u1ec7 th\u00f4ng tin", "school": "HCMC University of Technology", "diploma": "Bachelors", "end_time": "2005-01-01T00:00:00Z", "conf_score": 0.7998600002072108, "start_time": "2000-01-01T00:00:00Z", "picklist_major": "IT - Hardware/Networking", "major_categories": "M\u00e1y t\u00ednh v\u00e0 c\u00f4ng ngh\u1ec7 th\u00f4ng tin", "major_categories_detail": "C\u00f4ng ngh\u1ec7 th\u00f4ng tin"}], "experiences": [{"id": 16844, "detail": "", "company": "Mulodo Vietnam", "end_time": "2023-04-13T00:00:00Z", "industry": "Other", "position": "Development Project Manager and Team Leader", "conf_score": 0.9382580848285329, "start_time": "2014-04-01T00:00:00Z"}, {"id": 16845, "detail": "", "company": "Havey Nash Vietnam", "end_time": "2014-04-30T00:00:00Z", "industry": "Other", "position": "Developer", "conf_score": 0.9036845408968811, "start_time": "2009-10-01T00:00:00Z"}, {"id": 16846, "detail": "", "company": "Havey Nash Vietnam", "end_time": "2011-02-28T00:00:00Z", "industry": "Other", "position": "Team Lead and Project Manager", "conf_score": 0.8819881778411802, "start_time": "2011-02-01T00:00:00Z"}, {"id": 16847, "detail": "", "company": "TMA Company", "end_time": "2009-10-31T00:00:00Z", "industry": "Other", "position": null, "conf_score": 0.7607865472558788, "start_time": "2009-03-01T00:00:00Z"}, {"id": 16848, "detail": "", "company": "Nankai Company Co. Ltd", "end_time": "2009-01-31T00:00:00Z", "industry": "Other", "position": "Developer", "conf_score": 0.9404253900297244, "start_time": "2006-02-01T00:00:00Z"}, {"id": 16849, "detail": "", "company": "Tri Nhan Co. Ltd", "end_time": "2005-12-31T00:00:00Z", "industry": "Other", "position": "Developer", "conf_score": 0.9499601525043319, "start_time": "2005-07-01T00:00:00Z"}], "address": "208/116 Duong so 5, Binh Hung Hoa, Binh Tan"}