{"skills": ["rxswift", "angular", "flutter", "internet", "call center", "marketing", "automation", "oauth2", "text to speech", "graphql", "ams", "apache", "cloud", "life insurance", "fastlane", "management", "sequence diagram", "io", "carthage", "hard working", "firebase", "swift", "android", "cordova", "insurance", "class diagram", "memory leak", "mvvm", "network layer", "mvc", "objective c", "communication skill", "system design", "firebase realtime database", "database", "class", "teamwork", "analyst", "firestore", "activity diagram", "mysql"], "fulltext": "Nguyen The Phuong\nIOS Developer\nDate of birth:\n Aug 06, 1996\nGender:  Male\nPhone:\n 0969 345 159\nEmail:  nguyenthephuong2808@gmail.com\nAddress:\n District 2, HCM City, Vietnam\nWebsite:  https://www.linkedin.com/in/thephuongcqt\nOBJECTIVE\nI am a iOS developer with young passion, I am very excited to discovery new technologies and architectures.\nI read technology books and blogs to gain knowledge and become a senior iOS developer as soon as possible. My long-\nterm goal is becoming a solution architect.\nEDUCATION\n9/2014 - 9/2018\nFPT University - Software Engineer\nKey Major: Information system\nGPA: 7.8/10\n- Semester 1, 2: Honorable Student\n- Semester 3: Honorable Student, Top 5 highest grade in the faculty of ICT\n9/2011 - 5/2014\nQuang Trung High School for the Gifted\nFaculty of Mathematics and Computer Science\nWORK EXPERIENCE\n10/2018 - Present\nGNT Viet Nam\niOS developer\n- Develop applications using swift and support other department about iOS\nissues\n- Develop iOS app project and start-up product of company which is\ndescription more detail at below (section Projects)\n3/2017 - 8/2017\nSplus Software JSC (Internship)\nMobile developer internship\n- Working on IOS projects: using Objective-C language \n- Working on cross platform projects: Hybrid application (Apache Cordova)\nHONORS & AWARDS\n2018\nThird prize of the FPT University student research conference.\n2014\nGetting 50% scholarship of FPT University \n- 90/105 GMAT total score in entrance examination of FPT University.\n2014\nFirst prize of the provincial level excellent student contest in informatics.\n2013\nSilver medal in the Olympic competition 30-4 in informatics.\n2013\nThird prize of the provincial level excellent student contest in informatics.\nProgramming Languages &\nFrameworks\n- iOS development using Swift \n- RxSwift, RxCocoa\n- Alamofire, Realm, Kingfisher, Swiftlint, Chart, etc\n- Fastlane, Carthage, etc\n- CoreLocation, GoogleMaps\n- HealthKit\n- Firebase Notification\n- Firebase Real-time database, Firestore \nOther Programming Languages\nI have a little bit knowledge about: Flutter and Cordova\nLanguage English\nSoft Skills\n- Task and time management skills \n- Teamwork skills \n- Communication skills\nSKILLS\nPROJECTS\nFarmi.vn App (E-commerce about fresh food)\n(04/2019 - Present)\nCustomer\nFarmi (subsidiary of GNT)\nDescription\nFarmi is an online grocery shopping application, including two applications:\n- Farmi app: for customer buy a fresh food\n- Rabbit app: for delivery, manager, operator\n- itunes link: https://apple.co/2p1xaSO\nTeam size\n10 members\nMy position\niOS Developer\nMy responsibilities\n- Optimize build time and fix some leak memory bugs\n- Develop new features and new designs for end-user\n- Develop new features to support for marketing team and delivery team\n- Fix bugs\nTechnologies used\n- MVVM with RxSwift\n- Deeplink\n- GraphQL\n- Fastlane, Swiftlint\n- Firebase Realtime database\n- Firebase Notification\n- GoogleMaps\n- Xcode 10, Swift 4\nKenco Support Program (Healthcare app)\n(10/2018 - 4-2019)\nCustomer\nDaido Life Insurance Company\nKenco support program app is a healthcare application integrated with existed system of\nDaido Life insurance company, this app help user can track health data and their insurance\nprogram\nDescription\n- This application tracks health data for user from their smartphone, apple watch, fitbit\nsmartwatch, pulsense smartwatch or google fit smartwatch\n- User can change health tracking device anytime and easy to follow insurance program,\npromotion program from Daido Life Insurance company\n- itunes link: https://apple.co/2Za2ejh\nTeam size\n9 Members\nMy position\niOS Developer\nMy responsibilities\n- Key member in this project\n- Meeting with my team to find the approaches and solutions for application, breakdown the\ntask and estimate time for them\n- Draw sequence diagram for all logical flow of this subsystem\n- Support leader about technical problems, follow task progress of development team and\nraise issues\n- Setup iOS project for 4 environments (DEV, TEST, STAG, PROD)\n- Build the architecture for project based on MVC and mixed with a little bit RxSwift\n- Build Network layer based on Alamofire, Database Layer based on Realm\n- Setup fastlane, swiftlint\n- Fix bugs\n- Support other members in technical and fix ugently bugs for them\nTechnologies used\n- Xcode 10, Swift 4\n- RxSwift, RxRealm\n- Firebase Notification\n- OAuth2\n- Fastlane\nCall-Center on Mobile for Clinic\n(5/2018 - 8/2018)\nCustomer\nFPT University (Capstone project for graduation)\nDescription\n- This is an automation system which allows patient call to clinic to book appointment.\n- The system analyzes patient information from speech to text, then arranges appointment.\n- Last step is answer to patient about appointment information by translate text to speech.\n- More over, our system supports clinic to manage patient information, medical record. We\nalso simulate how to integrate other system to our system.\nTeam size\n4 members for 4 months\nMy position\nTeam Leader/Developer\nMy responsibilities\n- Analyst and design system\n- Find the approaches and solutions for project\n- Research new technologies \n- Draw sequence diagram, activity diagram, component diagram, class diagram, etc\n- Manage tasks and report to supervisor\n- Review code for other member\n- Develop and fix bug\nTechnologies used\n- Google speech to text service\n- FPT text to speech service\n- Paypal/braintree\n- Twilio\n- Firebase Notification\n- Real-time database (Cloud Firestore)\n- Node JS, Android, Angular, MySQL\nINTERESTS\n- Exploring New Technologies \n- Reading blog from meadium, Raywenderlich, freecodecamp, etc\n- Playing sports: football, chess \n- Listening to music\n- Internet surfing\nPERSONALITY\n- Fast learning\n- Sense of responsibility and carefulness\n- Flexible, logical\n- Strong thirst to knowledge, hard-working\n- Gracious, friendly, swift and articulate\nREFERENCES\nKi\u00ea\u0300u Tro\u0323ng Kha\u0301nh\nMaster of Engineer in Computer Science - Supervisor of my capstone project \nFPT University - HCM Campus\nEmail: khanhkt@fe.edu.vn\nMobile: 090 8133304\n\u00a9 topcv.vn\nPowered by TCPDF (www.tcpdf.org)", "educations": [{"id": 5048, "gpa": "7.8", "major": "H\u1ec7 th\u1ed1ng th\u00f4ng tin", "school": "FPT University - Software Engineer", "diploma": "Bachelors", "end_time": "2018-09-01T00:00:00Z", "conf_score": 0.7851615749618549, "start_time": "2014-09-01T00:00:00Z", "picklist_major": "IT - Hardware/Networking", "major_categories": "M\u00e1y t\u00ednh v\u00e0 c\u00f4ng ngh\u1ec7 th\u00f4ng tin", "major_categories_detail": "M\u00e1y t\u00ednh"}, {"id": 5049, "gpa": null, "major": "Khoa h\u1ecdc m\u00e1y t\u00ednh", "school": "Quang Trung High School for the Gifted", "diploma": "Other", "end_time": "2014-05-01T00:00:00Z", "conf_score": 0.9265310240367791, "start_time": "2011-09-01T00:00:00Z", "picklist_major": "IT - Hardware/Networking", "major_categories": "M\u00e1y t\u00ednh v\u00e0 c\u00f4ng ngh\u1ec7 th\u00f4ng tin", "major_categories_detail": "M\u00e1y t\u00ednh"}], "experiences": [{"id": 16888, "detail": "- Develop applications using swift and support other department about iOS issues\n- Develop iOS app project and start-up product of company which is description more detail at below (section Projects)", "company": "GNT Viet Nam", "end_time": "2023-04-13T00:00:00Z", "industry": "Other", "position": "iOS developer", "conf_score": 0.9313320685594104, "start_time": "2018-10-01T00:00:00Z"}, {"id": 16889, "detail": "- Working on IOS projects: using Objective-C language\n- Working on cross platform projects: Hybrid application (Apache Cordova)", "company": "Splus Software JSC", "end_time": "2017-08-31T00:00:00Z", "industry": "High Technology", "position": "Mobile developer internship", "conf_score": 0.9167205923617493, "start_time": "2017-03-01T00:00:00Z"}], "address": "District 2, Hcm City, Vietnam"}