{"skills": ["studio", "java", "css", "git", "agile", "testing", "java technology", "html", "mysql", "oracle", "entity framework", "sqlite", "stores management", "marketing", "sql", "visual studio", "sales", "c#", "payment", "website development", "database", "database design", "mobile application", "react native", "mvc", "bootstrap", "php", "business analyst", "analyst", "postgresql", "management", "medium", "asp"], "fulltext": "TRAN DINH HUNG (Mr.) \nPosition: .Net Developer \nPERSONAL INFORMATION \nDOB \n: 22 Feb 1991 \nGender  \n: male \nMarital Status  \n: Single \nEmail  \n: dinhhung09138@gmail.com \nMobile Phone  \n: 0919.649.242 \nDesired Salary \n: Negotiable \nCareer Objective \n: Seeking a .NET Web-based developer position at Ho Chi Minh \nCity \nTr\u1ea7n \u0110\u00ecnh H\u01b0ng (Mr.) \nPosition: Web Developer \nKEY SKILLS \n- Languages  \n: C#, ASP.NET MVC, ASP.NET Core,  \n  Web API, Entity Framework \n- Application  \n: MS Visual studio \n- Database systems: SQL Server, My SQL, Oracle, PostgreSLQ \n- Front-end \n: HTML, CSS, JS, Bootstrap \n- IT Methodologies : Agile, Git \nWORKING EXPERIENCES \n10-2015 \u2013 05/2019  ARIS VIET NAM \nWeb application developer \n06-2012 \u2013 05-2015 Maple JSC \nWeb application developer \nLASTED PROJECTS \nHospital system  \n- Description     : The system consists of 3 basic modules: \n                          - A system to create schedules for doctors, create an automatic  \n                            examination schedule and allow patients to register for the \n                            examination from the web or mobile application.  \n                          - The API system of payment connection with banks  \n      - The system generates codes for patients \n- Duration         : 4 months \n- Team size      : 8 \n- Main roles     : - Team leader, Business Analyst, database design  \n                          - Web and APIs developer \n                          - Technical and business support for members \n- Technologies : ASP.Net Core, API, PostgreSQL, Bootstrap, JS, React Native \nEmployee tracking system  \n- Description     : - Build the report system, for all marketing staffs can report at the \n        Place they are working (upload file, schedule, location\u2026) \n      - The system also can save stores information, marketing \n        campaigns and related posters, stickers. \n- Duration         : 3 months  \n- Team size      : 5 \n- Main roles     : - Business Analyst, database design \n                         - Web and APIs developer \n                         - Technical and business support for members \n- Technologies : ASP.Net MVC, Web API, MySQL, Bootstrap, JS, React Native  \nKEC System \n- Description     : - Manage the electrical flow of devices in factories \n                     - Synchronize data between factory and server, export and report \n      - Export, report and analyze the performance of devices \n      - Automatically process to reduce direct intervention of people \n- Duration         : 4 Months  \n- Team size      : 5 \n- Main roles     : Coding and testing base on detail design and test-case documents \n- Technologies : Java, Oracle  \nStore management application \n- Description     : - Store information at the database local stores \n                         - Synchronize local data to Oracle server \n       - Information including: staff, customer, visiting and sale history \n- Duration         : 3 months  \n- Team size      : 4 \n- Main roles     : Team leader, Business Analyst, database design, coding and \ntesting \n- Technologies : C#, Windows Form, SQLite \nImprove system performance \n- Description     : Improve system performance by using stored procedure \n- Duration         : 6 months  \n- Team size      : 5 \n- Main roles     : Coding and testing base on detail design and test-case documents \n- Technologies : SQL Server, Stored procedure \nUDI Maps \n- Description     : - Help HCMC residents can avoid flooding when circulation on the  \n        road. Through this application, people will know which areas are  \n        likely to be flooded to find suitable routes to avoid flooding.  \n      - Users can interact with managers, giving information about  \n        flooding points for direction  \n- Duration         : 7 months  \n- Team size      : 6 \n- Main roles     : Web and APIs Developer \n- Technologies : ASP.Net MVC, Web API, SQL Server, Bootstrap, JS \nTravelling website \n- Description     : - Company and tour introduction \n      - Tour booking, payment via third parties.  \n- Duration         : 5 months  \n- Team size      : 6 \n- Main roles     : Business analyst  \n- Technologies : Php, MySql \nMovie web application \n- Description     : - Render a short video from the template by using the resources \n       from the user upload (video, image, text)  \n     - Create an online market, the producers can sale their template, \n       users can buy the templates, upload their resource for rendering \n       a video as they want.  \n      - Many agencies can become a partner by providing server \n        hardware support to render videos. \n- Duration         : 1 year \n- Team size      : 8 \n- Main roles     : - Business analyst, database design \n                         - Web and APIs developer \n- Technologies : ASP.Net MVC, Web API, SQL Server, Bootstrap, JS \n                           Adobe After Effect, Adobe Media Encoder \nBusiness introduction website \n- Description     : - Introduce about the company, hotel and resort, real estate \n      - Admin page. \n- Duration         : 6 months  \n- Team size      : 4 \n- Main roles     : Business analyst, database design \n                         - Web and APIs developer  \n- Technologies : ASP.Net MVC, SQL Server, Bootstrap, JS \n2009-2012 \nBachelor Software Engineer \nInformation technology college \nEDUCATION \nPowered by TCPDF (www.tcpdf.org)", "educations": [{"id": 5057, "gpa": null, "major": "Software Engineer", "school": "Information technology college", "diploma": "Bachelors", "end_time": "2012-01-01T00:00:00Z", "conf_score": 0.8413267261986577, "start_time": "2009-01-01T00:00:00Z", "picklist_major": "Other", "major_categories": "", "major_categories_detail": ""}], "experiences": [{"id": 16919, "detail": "", "company": "ARIS VIET NAM", "end_time": "2019-05-31T00:00:00Z", "industry": "Other", "position": "Web application developer", "conf_score": 0.9050765977702602, "start_time": "2015-10-01T00:00:00Z"}, {"id": 16922, "detail": "", "company": "Maple JSC", "end_time": "2015-05-31T00:00:00Z", "industry": "Other", "position": "Web application developer", "conf_score": 0.9050765977702602, "start_time": "2012-06-01T00:00:00Z"}], "address": null}