{"skills": ["stack", "angular", "css3", "online game", "payment", "javascript", "ams", "c#", "knockoutjs", "mongodb", "rest", "management", "studio", "soapui", "object oriented", "mobile service", "jquery", "git", "elasticsearch", "oracle service bus", "svn", "html5", "redis", "typescript", "rabbitmq", "mysql", "service bus", "insurance", "asp", "cache", "activemq", "kendo ui", "website development", "sql", "mobile communication system", "visual studio", "software development", "mvc", "short message service", "mysql workbench", "oracle", "database", "angular 2", "protocol", "hibernate", "wcf", "communication protocol", "php", "m sql server", "workbench", "html"], "fulltext": "General info\nDate of Birth\nMay 21st, 1989\nGender\nFemale\nEmail\nnnlandai89@gmail.com\nMobile\n0903.886.637\nAddress\nPhan Huy Ich Street, Tan Binh District, HCM City\nNGUYEN NGOC LAN DAI\nAcademic Qualifications\n2007-2011\nGraduate with Engineer Information Technology,\nUniversity of Saigon, career focused software development.\nHi, I am a passionate, highly enthusiastic\nCoding. Have strong desire for\nknowledge and challenges. Actively\ninvolved with the latest technology\nand updates in the web development\nfield. A fast learner who picks up new\nskills quickly. Self-educated and\nself-motivated person.\nThink out of the obvious.\nWorking Experiences\n2018 - Present Work as Seninor .Net developer at AsWhite Global company\n08-2018 - Present\n2017- 2018\nOn site Phnom Penh, Cambodia as Senior Software Engineer\n04-2017 - 05-2018\n2016 - 2017\nWork as Fullstack .Net developer at Haravan company\n02-2016 - 03-2017\n2014 - 2016\nWork as Fullstack .Net developer at Mecorp company\n02-2014 - 02-2016\n2011 - 2014\nWork as Full-stack .Net developer at FPT Online Service Joint\n09-2011 - 07-2014\nStock company.\nInterests and Hobbies\nCoding\nReading\nMusic\nTraveling\nPhotography\nGuitar\nTaken Projects\nPivotal Project: It is the claim management in insurance for the EML client.\nA\nResponsibilities\nCoding and analyzing on each ticket in project with description document related.\nTechnologies used in project\nMS Sql server, .Net framwork, .Net Core 2.0, IdentityServer 4, Kendo UI, Typescript\nSkill\nASP.Net\nO\nPHP\nC#\nCSS3\nHTML5\nJavascript\nO\nJquery\nO\nAngular 2\nNodeJs\nGIT\nSVN\nKnockoutJS\nMS SQL, MySQL, MongoDB,\nElasticsearch, Redis cache\nObject - Oriented Methodology\nMVC, Hibernate, Activemq, Rabbitmq,\nSMPP, OSB\nVisual Studio, Eclipse, NetBean,\nSoapUI, Robomongo, MySQL Workbench\nTaken Projects\nHaravan project: It is a product to provide ecommerce website\nA\nResponsibilities:\nCoding and analyzing assigned modules in projects inventory, harapage, checkout,\nshipment, product, blog, feedback..\nTechnologies used in project\nMySQL, .Net, Rest API, Mongodb, RabbitMQ, Redis cache, Elasticsearch,\nKnockoutJS, NodeJs, Jquery, Facebook API, Google API.\nPayment Gateway project:\nThis project integrates multiple web services into one single line.\nA\nResponsibilities:\nResearching, integrating, developing\nTechnologies used in project\nWeblogic, Oracle Service Bus, Oracle database\nPay.vnexpress.net Project:\n- Selling card services: Mobile, Game online\n- Recharge of mobile, game online\n- Payment of bill: ADSL, electricity, water\nA\nResponsibilities:\nCoding and managing this page (web, services, modules of management).\nA\nTechnologies used in project\n.Net, WCF, MS SQL Server, HTML, Javascript, Jquery\nTienich.senpay.vn project:\n- Recharge of mobile, game online\n- Payment of bill: ADSL, electricity, water\nA\nResponsibilities:\nCoding and managing this page (web, services, modules of management)\nTechnologies used in project\n.Net, WCF, MS SQL Server, HTML, Javascript, Jquery\nSMS project:\nShort Message Service (SMS) is a text messaging service component of phone, Web,\nor mobile communication systems. It uses standardized communication protocols to\nallow fixed line or mobile phone devices to exchange short text\nA\nResponsibilities:\nCoding and analyzing assigned modules in projects inventory, harapage, checkout,\nshipment, product, blog, feedback...\nTechnologies used in project\nMySQL, .Net, Rest API, Mongodb, RabbitMQ, Redis cache, Elasticsearch,\nKnockoutJS, NodeJs, Jquery, Facebook API, Google API.", "educations": [{"id": 5059, "gpa": null, "major": "software development", "school": "University of Saigon", "diploma": "Bachelors", "end_time": "2011-01-01T00:00:00Z", "conf_score": 0.856152147217794, "start_time": "2007-01-01T00:00:00Z", "picklist_major": "Other", "major_categories": "", "major_categories_detail": ""}], "experiences": [{"id": 16925, "detail": "", "company": "AsWhite Global company", "end_time": "2023-04-13T00:00:00Z", "industry": "Other", "position": "Seninor .Net developer", "conf_score": 0.8986552717623872, "start_time": "2018-08-01T00:00:00Z"}, {"id": 16926, "detail": "On site Phnom Penh, Cambodia as S", "company": "AsWhite Global company", "end_time": "2018-05-31T00:00:00Z", "industry": "Other", "position": "Senior Software Engineer", "conf_score": 0.812521686866795, "start_time": "2017-04-01T00:00:00Z"}, {"id": 16927, "detail": "", "company": "Haravan company", "end_time": "2017-01-31T00:00:00Z", "industry": "Other", "position": "Fullstack .Net developer", "conf_score": 0.7851615749618549, "start_time": "2016-02-01T00:00:00Z"}, {"id": 16928, "detail": "", "company": "Mecorp company", "end_time": "2016-01-31T00:00:00Z", "industry": "Other", "position": "Fullstack .Net developer", "conf_score": 0.8455444434232338, "start_time": "2014-02-01T00:00:00Z"}, {"id": 16929, "detail": "", "company": "FPT Online Service Joint", "end_time": "2014-01-31T00:00:00Z", "industry": "High Technology", "position": "Full - stack .Net developer", "conf_score": 0.7851615749618549, "start_time": "2011-09-01T00:00:00Z"}], "address": "Phan Huy Ich Street, Tan Binh District, Hcm City"}