{"skills": ["payment", "graphql", "c#", "machine learning", "rest", "studio", "redux", "xamarin", "io", "object oriented", "mobile service", "git", "investments", "mobile platform", "rm", "react native", "android", "insurance", "cost estimation", "design pattern", "visual studio", "mvvm", "reactjs", "teamwork", "xcode"], "fulltext": "CV \nNguyen Quoc Nam \nQualification highlights \nInterested in making mobile apps. \nKeep myself in continuous process of studying for self-improvement and look \nfor a dynamic working environment, to improve myself and maybe can help \nthe others. \nTitle \nMobile Developer \nLocation \nVietnam office \nLanguage \nVietnamese \nEnglish \nExperience \n12/2016 \u2013 11/2018 \nMobile Developer  using  React Native / Xamarin \nUNICORN LTD.  \n1/2019 \u2013 4/2019 \nMobile Developer  using  React Native ,Team leader of mobile team  at Pixa \nStudio.  \nProject \nGoldTime  \n01/2019 \u2013 4/2019 \nApplication to set up a medical appointment at the hospital, set up \na schedule at the bank and a variety of other shops. Order at the \nassociated stores, view information, transaction history ... \nTechnology: Android, iOS using React native,Redux,map ,push notification , \nchat realtime... \nScope: Team leader, Mobile Developer \n360F-MGIS  \n06/2018 \u2013 1/2018 \nA platform for parents. They can create funds for their children and \ninvite the others to sponsor those funds. Parents can use funds for \ntheir children development and track it. They will be able to manage \nwho they and how much they invested (include parent investments \nand sponsor investment). Children are also be able to track his/her \nfunds if their parents allow it. \nTechnology: Android, iOS using React native,Redux \nScope: Mobile Developer \nBaoMinh  \n5/2017 \u2013 8/2017 \nThe application of mobile insurance compensation insurance for \nmotor vehicles of Bao Minh Corporation will help: \n- Automating the compensation process, especially the assessment \nand cost estimation \n- Digitize, minimize the number of documents and documents to be \nhandled, exchanged between parts \n- Highly effective job notification and coordination system \n- Unified and complete data, allowing faster searching and access \nto information \nTechnology: Android, iOS using C#, Xamarin \nScope: Mobile Developer \nSTARK \u2013 RELATIONSHIP MANAGER (Application for Customers) \n01/2017 \u2013 04/2017 \nThe platform serves as the main communication and transaction tool for \ncustomer and Relationship Manager (RM) to use and perform activities \nrelated to insurance products and services.  \nMobile app for customer: to communicate with RM, view policy (product), \nrequest renewal, request quotation, approve quotation, payment, and \nsubmit claim. \nTechnology: Android, iOS using C#, Xamarin \nScope: Mobile Developer \nEducation & Certificates/Courses \n2017: Studying  at University  of Information \n                                         Technology Tp.HCM \nRelevant skills \n\uf0a7 \nDevelop cross-platform mobile app for iOS/Android with React native and Redux.. \n\uf0a7 \nhave experience working with REST API. \n\uf0a7 \nstudying and researching GraphQL and Machine learning \n\uf0a7 \nhave worked on demo projects about nodeJS, ReactJS \n\uf0a7 \nTeamwork \n\uf0a7 \nknow git and know how to use SmartGit tool. \n\uf0a7 \nDevelop cross-platform mobile app for iOS/Android with Xamarin and C#. \n\uf0a7 \nKnowledge of native iOS/Android apps. \n\uf0a7 \nDesign iOS UI with Xcode, support multiple iOS screen size. \n\uf0a7 \nAlmost task about UI of Android and iOS. \n\uf0a7 \nUsing MVVM architecture and MVVM library (reactiveui, mvvmlight,...) to implement mvvm to mobile \nprojects. \n\uf0a7 \nObject Oriented Programming and Design Pattern. \n\uf0a7 \nA little knowledge of IDEs: Visual Studio, Xamarin Studio, Xcode, Android Studio. ", "educations": [{"id": 5060, "gpa": null, "major": null, "school": "University of Information", "diploma": "Bachelors", "end_time": "2017-04-01T00:00:00Z", "conf_score": 0.8361280643260491, "start_time": "2017-01-01T00:00:00Z", "picklist_major": "Other", "major_categories": "", "major_categories_detail": ""}], "experiences": [{"id": 16930, "detail": "", "company": "Pixa Studio", "end_time": "2019-04-30T00:00:00Z", "industry": "Other", "position": "Team leader of mobile team", "conf_score": 0.8829437234077991, "start_time": "2019-01-01T00:00:00Z"}, {"id": 16931, "detail": "using React Native / Xamarin", "company": "UNICORN LTD.", "end_time": "2018-11-30T00:00:00Z", "industry": "Other", "position": "Mobile Developer", "conf_score": 0.9331571384331322, "start_time": "2016-12-01T00:00:00Z"}], "address": null}