{"skills": ["linux", "snmp", "xpath", "operation system", "internet", "java", "automation", "mongo", "automation testing", "mssql", "javascript", "autoit", "apache", "selenium", "tcp", "c#", "ftp", "dns", "studio", "excel", "project tracking", "proxy", "udp", "jquery", "git", "svn", "dhcp", "tester", "spring", "operating system", "visual source safe", "asp", "communication network", "sql", "css", "php", "nunit", "jira", "visual studio", "testing", "mvc", "database", "smtp", "jsp", "wcf", "bootstrap", "mysql", "qtp", "html"], "fulltext": "PERSONAL DETAILS \nName  \n: NGUYEN THAI THINH \nHome Address                  \n: 254/10/6 TTH07 Street, Tan Thoi Hiep Ward, District 12, HCM City. \nHand phone \n:  \nPersonal Email  \n:  \nGender  \n: Male \nMarital status \n: Married \nEDUCATION \nYear start  \nYear \nend  \nDegree  \nSpecialization  \nUniversity name  \nRate  \n2001 \n2004 \nBachelor of College  Information \nGood  \nTechnology  \nIndustrial College N.4 \n(University of Industry)  \n2005 \nCCNA Certification  Network \nGood  \nAdministrator  \nNhat Nghe Training \nCenter Network  \nInformation Systems  University of Natural \nGood  \n2006 \n2009 \nBachelor of \nUniversity  \nSciences HCM City  \nCAREER SUMMARY \nMore than 6 years of experience in\ufffdautomation\ufffdtesting. \nJanuary 2015 to Present:                  Silver Spring Network Company \n                                                            Tester and Developer \nAugust 2008 to 2014:                         Vietbando Company \n                                                             Developer \nSeptember 2004 to July 2008:           Dolsoft, Vigiland Video Company \n                      Tester and Developer \nPROFESSIONAL EXPERIENCE \nJanuary 2015 to Present:                 Silver Spring Network Company \n                                                           Tester and Developer \nDuties \nProject name: Detectent website \n          (Page 1 of 3) \n\uf0b7 \nCoding to create the automation scripts to test Detectent website. \n\uf0b7 \nPlatform:  Visual Studio 2015, Visual Studio 2017, Visual Studio 2019, MSSQL 2008, \nMSSQL 2012, MySQL, Javascript. \n\uf0b7 \nResearch and apply new technologies for working. \n1. Selenium with programing language C#. \n2. Sikuli tool. \n3. CSS selector, XPath. \n4. MSTest, MbUnit, Gallio nUnit, TestStack White, NUnit. \n5. Jira. \n6. Mailtrap. \n7. AutoIt tool. \nAugust 2008 to 2014:                       Vietbando Company \n       Developer \nDuties \nProject name: Vietbando and Tusachtruongbacan website \n\uf0b7 \nCoding to create module product page of Vietbando. \n\uf0b7 \nCoding to create module Admin page of Vietbando. \n\uf0b7 \nCoding to create module report and export to pdf, excel file of vietbando. \n\uf0b7 \nCoding to create FTP and manage tool for Bus Tracking project. \n\uf0b7 \nCoding to create services (window and web service) of vietbando. \n\uf0b7 \nCoding to create module vietbando store. \n\uf0b7 \nCoding to create project tusachtruongbacan website. \n\uf0b7 \nPlatform:  Visual Studio 2005, Visual Studio 2008, Visual Studio 2010, MSSQL 2000, \nMSSQL 2005, MSSQL 2008, windows, MySQL, Javascript, jquery. \n\uf0b7 \nResearch and apply new technologies for working. \n8. Technologies WCF, WPF, MVC \n9. DotnetNuke open source. \n10. Mongo DB none SQL. \n11. Video Stream \n12. Membership in ASP.NET \nSeptember 2004 to July 2008:        Dolsoft, Vigiland Video Company \n      Tester and Developer \nDuties \nProject name: Cardetector, CamSmartz, LineUp \nWith team leader role, I worked jobs as below: \n\uf0b7 \nCreate test plan for projects as above. \n\uf0b7 \nCreate test cases for projects as above. \n\uf0b7 \nOrganized, breakdown and divided task to team member. \n\uf0b7 \nImplement test cases. \n\uf0b7 \nPost bug to bug tracker system. \n\uf0b7 \nCreate scripts to execute automated test cases. \n\uf0b7 \nUsing QTP for developing automation testing. \n          (Page 2 of 3) \n\uf0b7 \nCreate test report to manage about result testing.  \nImplement and keep system operation for Vietnam office, including following main \nservices: \n1. Internet connection \n2. FTP, DNS, DHCP, PROXY\u2026 \n3. Web server (apache) \n4. Source Control (svn subversion) \n5. Bug tracker \nResearch new features for Work \n13. Mongo DB. \n14. Video Stream \n\uf0b7 \n\uf0b7 \nLANGUAGE SKILLS \n+ English: level B (Good at writing, speaking, reading and listening.) \nPROFESSIONAL DEVELOPMENT \nOperating Systems \n\uf0b7 \nWindows, Linux. \nDatabase \n\uf0b7 \nSQL Server \n\uf0b7 \nMySQL \n\uf0b7 \nMongo DB \nNetwork Communication \n\uf0b7 \nSocket, UDP, TCP/IP, Web Services, HTTP. \n\uf0b7 \nSNMP, SMTP, POP3. \n\uf0b7 \nMCSA Network \nLanguages \n\uf0b7 \nC#, ASP.Net, Jquery, JSP, Java \n\uf0b7 \nJavascript, vbscript \nWeb \n\uf0b7 \nASP.net, PHP, CSS, HTML, Bootstrap. \nSoftware Tools & Applications \n\uf0b7 \nEmail, ftp, web \n\uf0b7 \nBug tracker System \n\uf0b7 \nVisual Source Safe \n\uf0b7 \nGIT \n\uf0b7 \nSVN \nSALARY \n  Expected salary: Negotiable \n          (Page 3 of 3) ", "educations": [{"id": 5088, "gpa": null, "major": "C\u00f4ng ngh\u1ec7 th\u00f4ng tin", "school": "Industrial College N.4\n(University of Industry)", "diploma": "Bachelors", "end_time": "2004-01-01T00:00:00Z", "conf_score": 0.7851615749618549, "start_time": "2001-01-01T00:00:00Z", "picklist_major": "IT - Hardware/Networking", "major_categories": "M\u00e1y t\u00ednh v\u00e0 c\u00f4ng ngh\u1ec7 th\u00f4ng tin", "major_categories_detail": "C\u00f4ng ngh\u1ec7 th\u00f4ng tin"}, {"id": 5089, "gpa": null, "major": "H\u1ec7 th\u1ed1ng th\u00f4ng tin qu\u1ea3n l\u00fd", "school": "University of Natural", "diploma": "Bachelors", "end_time": "2009-01-01T00:00:00Z", "conf_score": 0.7625990117186952, "start_time": "2006-01-01T00:00:00Z", "picklist_major": "Administrative/Clerical", "major_categories": "Kinh doanh v\u00e0 qu\u1ea3n l\u00fd", "major_categories_detail": "Qu\u1ea3n tr\u1ecb \u2013 Qu\u1ea3n l\u00fd"}], "experiences": [{"id": 17018, "detail": "January 2015 to Present: Silver Spr", "company": "Silver Spring Network Company", "end_time": "2014-01-31T00:00:00Z", "industry": "High Technology", "position": "Tester and Developer", "conf_score": 0.8603052222167415, "start_time": "2008-08-01T00:00:00Z"}, {"id": 17019, "detail": "", "company": "Dolsoft, Vigiland Video Company", "end_time": "2008-07-31T00:00:00Z", "industry": "Real Estate", "position": "Tester and Developer", "conf_score": 0.902768374209996, "start_time": "2004-09-01T00:00:00Z"}], "address": "254/10/6 Tth07 Street, Tan Thoi Hiep Ward, District 12, Hcm City."}