{"skills": ["search", "recruiting", "css", "c++", "twitter", "entity framework", "jquery", "microsoft", "unit test", "sql", "uml", "c#", "bug fixing", "javascript", "oop", "microsoft excel", "excel", "mvc", "bootstrap", "buddy", "teamwork", "erp system", "linq", "vuejs", "management", "asp"], "fulltext": "NGOC \nPHAM THI THUY \n\uf051 AUG-04-1993 \nTan Binh district, HCMC  \nPhone  \nLinkedIn Profile  \nTwitter/Blog/Portfolio   \nOBJECTIVE \nI have more than 3.5 years with role .Net developer, I\u2019m interested in learning new technologies, \nI\u2019m building my skill to become fullstack developer Hence I like to learn new front end framework \n(React, VueJs). Besides, I\u2019m able to communicate with client or foreign colleagues that help me to \nknow new culture from them.!  I want to join young and active working environment. \nFor me, I can not work without learning, good experiences, smile, relaxing\u2026 \n EDUCATION \n.Net Fresher certificate | Harvey Nash Vietnam \nAUG 2015 \u2013 NOV 2015 \nJoin to scrum team with size 10 member build small project with QA business. Tech: MVC, Unit \ntest. \nDegree of software engineer | Cantho University \nSEP 2011 \u2013 JUN 2015 \nGPA: 2.98/4.0 \nGlobal Software Talent Certificate | FPT Software \nJUN 2014 \u2013 AUG 2014 \nLearning C/C++, SQL, UML \nTOEIC Certificate | IIG \nOCT 2016 \n635/990 \n EXPERIENCE \n.Nert Fullstack developer | Amaris Global \nJUN 2017 \u2013 MAR 2019 \nOpportunity Management, ERP system \n\uf0b7 \nMy application helps business users manage activties of Opportunity (potential to \nbecome a real project), it linked other applications such as: Legal contract validation, \nMeeting schedule, search reference, source candidate. \n\uf0b7 \nTeam member: multiple countries (Vietnam, France, Austria, Canada, Romania) \n\uf0b7 \nResponsibility \no Clear requirement with PO and challenge PO if requirement is not make sense \no Make the detailed designs for assigned tasks  \no Optimize performance  \no Write code based on detailed designs and Functional/Requirement Specifications \n2 \no Fix issues \no Buddy fresher  \n\uf0b7 \nTechnologies: MVC, EF, SQL server, Javascript/Jquery \nSoftware Engineer | NashTech \nAUG 2015 \u2013 JUN 2017 \nBullhorn \u2013 Scrolling Ticket \n\uf0b7 \nImplementing reporting systems for Harvey Nash USA to support on its recruiting \nservices. \n\uf0b7 \nThe reports designed by SQL Server Reporting Service (SSRS) and Microsoft Excel based. \n\uf0b7 \nIncident and bug fixing \n\uf0b7 \n.NET, C#, SQL Server Reporting Service \nFitness First S&M \n\uf0b7 \nProvide support service to Fitness First using the process from the client side \n\uf0b7 \nImplement new feature and fixing bug \n\uf0b7 \nAsp.net MVC, EPI Server, Asp.net WebForm, Entity Framework, LinQ \n TECHNICAL SKILLS \n\uf0b7 \nSOLID \n\uf0b7 \nOOP \n\uf0b7 \nMVC  \n\uf0b7 \nSQL/ PL \n\uf0b7 \nJavascript/JQuery \n\uf0b7 \nVujs \n\uf0b7 \nCSS Bootstrap \n\uf0b7 \nModular \n SKILLS \n\uf0b7 \nLike to learn new technology \n\uf0b7 \nGood communicate with client/ foreigner \ncolleagues(UK, France, Austria, Romania)  \nover conference  call, emails, chat \n\uf0b7 \nTeamwork  \n\uf0b7 \nCan coach fresher graduate member \n\uf0b7 \nFocus code clean \n INTERESTED \n\uf0b7 \nTraveling to explore new interested experience \n\uf0b7 \nCoffee with friends \n\uf0b7 \nReading Nguyent Nhat Anh\u2019s Book ", "educations": [{"id": 5100, "gpa": "2.98", "major": "software engineer", "school": "Cantho University", "diploma": "Bachelors", "end_time": "2015-06-01T00:00:00Z", "conf_score": 0.9008202262261839, "start_time": "2011-09-01T00:00:00Z", "picklist_major": "Other", "major_categories": "", "major_categories_detail": ""}], "experiences": [{"id": 17071, "detail": "Opportunity Management, ERP system\nMy application helps business users manage activties of Opportunity (potential to become a real project), it linked other applications such as: Legal contract validation,\nMeeting schedule, search reference, source candidate.\nTeam member: multiple countries (Vietnam, France, Austria, Canada, Romania) Responsibility o Clear requirement with PO and challenge PO if requirement is not make sense o Make the detailed designs for assigned tasks o Optimize performance o Write code based on detailed designs and Functional/Requirement Specifications", "company": "Amaris Global", "end_time": "2019-03-31T00:00:00Z", "industry": "Other", "position": "Fullstack developer", "conf_score": 0.9089868123963978, "start_time": "2017-06-01T00:00:00Z"}, {"id": 17074, "detail": "Service (SSRS) and Microsoft Excel based.\nIncident and bug fixing\n.NET, C#, SQL Server Reporting Service Fitness First S&M Provide support service to Fitness First using the process from the client side\nImplement new feature and fixing bug\nAsp.net MVC, EPI Server, Asp.net WebForm, Entity Framework, LinQ", "company": "NashTech", "end_time": "2017-06-30T00:00:00Z", "industry": "High Technology", "position": "Software Engineer", "conf_score": 0.8609096577425304, "start_time": "2015-08-01T00:00:00Z"}], "address": "Tan Binh district, Hcmc"}