{"skills": ["postman", "regression", "payment", "crm", "automation", "analytics", "java", "c++", "automation testing", "javascript", "legacy system", "implementation", "selenium", "risks", "contact point", "management", "sequence diagram", "selenium ide", "uml model", "business analysis", "provide leadership", "automation test", "scrum master", "regression testing", "analysis", "tester", "performance testing", "data analysis", "business analyst", "insurance", "business goal", "desktop", "translator", "class diagram", "sql", "self driven", "accounting", "integration testing", "jira", "manage data", "software development", "writing test plan", "making decision", "testing", "uml", "google analytics", "training users", "localization", "class", "magento", "sql query", "test data", "cdn", "analyst", "teamwork", "erp system", "sdlc", "api testing", "php", "agile", "localization testing"], "fulltext": "CURRICULUM VITAE \nPERSONAL DETAILS \nFull Name: \nTRAN THI HUYEN CHI \nJob Titles: \nTeam Lead + Test Lead + BA + Application Consultant \nDate of Birth: \n08 / 09 / 1983 \nGender:  Female \nPROFESSIONAL SUMMARY  \n\u2756 Deadline-oriented Software Tester with 10 years\u2019 in manual environment, some basic experiences about \nautomation testing as Selenium IDE plugin and TA tool. \n\u2756 Easily collaborate with developers and project managers to accomplish milestones. \n\u2756 An effective leader, skilled in enlisting the support of all team members in aligning with project and \norganizational goals. \n\u2756 Experienced supervisor with a management style that motivates staff productivity. \nEDUCATION HISTORY \n\u2756 \nFrom: 2001 \n\u2756 \nOPEN University, HCM City  \n\u2756 \nTo: 2006 \n\u2756 \nField of Studying: Information Technology \n\u2756 \nBachelor's degree \n\u2756 \nFrom: 2010 \n\u2756 \nUniversity of Economics, HCM City \n\u2756 \nTo: 2014 \n\u2756 \nAccounting  \nACCOMPLISHMENTS \n\u2756 \nFrom: 03/2011 \n\u2756 \nISTQB \u2013 Foundation Level Certificate in FMIT Institute \n\u2756 \nFrom: 05/2009 \n\u2756 \nTKT \u2013 TESOL Certificate in University of Pedagogy, HCM City \n\u2756 \nFrom: 06/2017 \n\u2756 \nFundamental Business Analysis course in  \n\u2756 \nBAC TRAINING AND  CONSULTANCY JOINT STOCK COMPANY \nCV_ Tran Thi Huyen Chi \nPage 1 of 7 \nTran Thi Huyen Chi - Resume \nCV_ Tran Thi Huyen Chi \nPage 2 of 7 \n\u2756 \nFrom: 08/2017 \n\u2756 \nAdvanced Business Analysis course in  \n\u2756 \nBAC TRAINING AND  CONSULTANCY JOINT STOCK COMPANY \nEXPERIENCE REFERENCE AND SKILL SET \n\u2756 \nCompany Name: FPT SOFTWARE HCM \n\u2756 \nFrom: 12/2017 \n\u2756 \nTo: 01/2019 \n\u2756 \nPosition: \nTeam Lead + Test Lead + BA + Application Consultant \n\u2756 \nJob \nDescription: \nProject Descriptions: \n1. M35 web application - ERP system (from 12/2017 to \n02/2018) \nPosition : Test Manager  \n- Create testplan, review testcase, test data \n- Manage team 25 members \n- Provide training courses about testing process for freshers \nand junior testers \n2. BOEING web application (from 03/2018 to 06/2018) \nPosition : Test Lead  \n- Manage team 5 members \n- Analysis requirements and work together with US team \n- Create and review manual and automated testcases  \n3. UQM Sysmex - Healthcare (from 07/2018 - 08/2018) \nPosition: Team Lead + BA in VN team \n- Transfer all documents to developers, testers \n- Write the SOW documents and create product backlogs, \nuser stories \n- Kick off meeting and estimation timeline for tasks  \n- Work together with US team to get infos and support VN \nteam \n4. KPMG - CRM MS Dynamics 365 (from 09/2018 - \n01/2019)  \nPosition: Test Lead + BA + Application Consultant \n- Create/Review testplan, testcases, test strategy  \n- Create/Update FDD, FRD, BRL and implement new \nsoftware programs and applications to meet specific \nbusiness goals and customer needs \n- Manage and troubleshoot existing software applications \nand programs, finding and implementing solutions to existing \nand potential problems \n- Provide live technical support to customers using \napplication programs via web or phone communication \n- Create training materials and gives verbal training \ninstructions to customers and other staff members, advising \nthem on the best ways to use applications and software to \nmeet their desired goals and complete tasks. \nPosition: Team Lead with team size 10 members   \n- Provide leadership to the project teams on both the \ncustomer and vendor side.  \n- Prepare and management of iteration plans, budget, \ndependencies, risks and issues.  \n- Manage and lead key teams and personnel in order to \nsuccessfully deliver projects on time and according to the \nTran Thi Huyen Chi - Resume \nCV_ Tran Thi Huyen Chi \nPage 3 of 7 \nquality requirements.  \n- Monitor and control each phase and sprints of the project \nimplementation according to the approved project schedule. \n- Identify and report project issues and project risks to the \nrelevant managers and committees.  \n\u2756 \nCompany Name: STUDIO60 GROUP \n\u2756 \nFrom: 06/2012 \n\u2756 \nPosition: \nQC/QA Lead + Team Lead and acting as Agile Scrum \nMaster/PM/BA \n\u2756 \nTo: 11/2017 \n\u2756 \nJob \nDescription: \no QC/QA Lead \n\u25cf Managing team size included 30 members both Manual + \nAutomation Test \no Manual Test Analyst: \n\u25cf Creating testcase and estimate test effort \n\u25cf Testing execution (Functional and System Integration \nTesting) on Sitecore / Umbraco / Salesforces and checking \nwith SEO, social links as Google Analytics / Rakuten / Criteo \n/ Listrak.  \n\u25cf Collaborating with producer in White Sydney team and \ndevelopment teams in White Sydney team and S60 VN \n\u25cf 3 years experiences for testing on Ecommerce sites with \nplatforms as Demandware / EPI  \ncreating test data in CMS and checking payment methods in \nAdyen, Cybersource, Paypal and Afterpay. \n\u25cf API testing using Postman plugin on Chrome and using \nsome SQL queries  \n\u25cf Raising bugs/defects on Jira \n\u25cf Browser UI Compatibility, Localization testing  \no Automation Test: \n\u25cf Writing some basic scripts in Selenium for regression \ntesting \no Team Lead and acting as Agile Scrum Master/PM/BA: \n\u2022 Managing 3 projects with team size included 7-10 \nmembers in each project \n\u2022 Managing a scrum team of business analysts, tech leads, \nsoftware developers and testers to elicit and analyse \nrequirements, design, build and deploy software solutions to \nagreed schedule, quality and budgets.  \n- Coordinating daily stand-ups and retrospectives, tracking \nand reporting progress, help scrum teams to refine and \nstreamline the delivery process, identifying and resolving \nissues and risks that impact sprint execution. \n\u2022 Defining gaps and promoting/enforcing standards, \nmethods, processes and tools to enable best practice \nsoftware development and support. \n\u2022 Balancing the customer needs, business needs and \ntechnical needs to enable successful delivery of strategic \noutcomes. \n\u2022 Scoping, estimating and planning new iterations using \nformalized processes and methods.  \n\u2022 Helping the team to estimate stories based on prior \nknowledge and experience and improving the accuracy of \nthose estimates over time.  \n\u2022 Providing thought leadership and insight to new and \nTran Thi Huyen Chi - Resume \nCV_ Tran Thi Huyen Chi \nPage 4 of 7 \nemerging trends and best practices.  \n\u2022 Building and maintaining strong and positive working \nrelationships with internal and external stakeholders.  \n\u2022 Taking ownership for the development of project brief, \nproject initiation documents or equivalent and contributing to \nbusiness cases among other documents.  \n\u2022 Determining and managing risks to the projects.  \n\u2022 Coordinating and fostering teamwork.  \n\u2022 Developing self-motivated and self-driven teams.  \n\u2022 Establishing formal reporting arrangements for project \nprogress.  \n\u2022 Providing leadership that fosters a continuous \nimprovement and innovation culture.  \n\u2022 Effectively coach, develop and mentor employees to adapt \nagile practices.  \n\u2022 Ensuring continuous productivity improvement measures \nare adopted by the team which is measurable with respect to \nvelocity per sprint. \n\u2756 \nCompany Name: OFFICIENCE VIETNAM \n\u2756 \nFrom: 06/2011 \n\u2756 \nTo: 05/2012 \n\u2756 \nPosition: \nSenior Software Tester  \n\u2756 \nJob \nDescription: \no Manual Test Analyst: \n\u25cf Design testcase and test data \n\u25cf Testing Custom WebParts \n\u25cf Test execution (Functional and System Integration \nTesting). \n\u25cf Attending daily meetings and standup to discuss the work \nstatus with business, testers \n\u25cf Raising bugs/defects on Jira \n\u25cf Using browser matrix on desktop and mobile \no Project descriptions: \nFVHOPISTAL.com is a website application in SharePoint \nOnline and SharePoint Server \n\u2756 \nCompany Name: EXENTSOURCE VIETNAM \n\u2756 \nFrom: 06/2009 \n\u2756 \nTo: 04/2011 \n\u2756 \n Position: \nTest Lead \n\u2756 \nJob \nDescription: \no Manual Test Analyst: \n- Contact point with client \n- Assign task to other members \n- Performing Functional / Logical / UI Testing \n- Defect reporting on Jira \n- Planning working schedule for team base on Sprint \nschedule \no Team Lead: \n\u2022 Liaised with business, functional owner and other 3rd party \nvendors during risk engineering and high-level review \nsessions to derive and execute action plans, meeting \ndeadlines, standards and stakeholders\u2019 expectations. \n\u2022 Elicited requirements with client and prepared detail \nfunctional specification documents and provided necessary \nTran Thi Huyen Chi - Resume \nCV_ Tran Thi Huyen Chi \nPage 5 of 7 \nUML models (Use Cases, Class Diagrams, Sequence \nDiagrams etc.) using MS Visio. \n\u2022 Performed details data analysis, data modelling and \ndefined the solutions and strategies for migration of data \nfrom legacy systems to new web based system. Designed \ndetail financial reconciliation process for insurance \naccounting. \n\u2022 Audited business & functional necessity documents and \nidentified test strategies. Carried out End to End, Functional, \nIntegration, Regression and Performance Testing. Actively \ninvolved in entry and exit criteria decision making process. \nProvided user training and guided UAT process. \n\u2022 Prepared the detail execution plan for the team of up to 8 \npersonnel, monitored outputs to ensure that delivery was \nattained on time, within budgeted costs complied with \ncorporate SDLC Policies and guidelines. \no Project descriptions: \nCDN Cocacola is Ads Network Web application \n- Allow Advertiser is able to control their campaigns \ncompletely and scientifically \n- Allow Publisher is able to submit website to get revenue \nfrom Advertiser \nWine.com is an ecommerce website to promote the wine \nlifestyle, through innovation and buy wine \n\u2756 \nCompany Name: LOGIGEAR VIETNAM \n\u2756 \nFrom: 05/2007 \n\u2756 \nTo: 06/2009 \n\u2756 \nPosition: \nSoftware Tester  \n\u2756 \nJob \nDescription: \no Manual Test Analyst: \n\u25cf Install Leapfrog mini game package \n\u25cf Participating in code reviews and requirement analysis. \n\u25cf Writing test plans and giving test plan walkthroughs to \nbusiness and development team. \n\u25cf Involve in peer review of test planning of other team \nmembers. \n\u25cf Test execution (Functional and System Integration \nTesting). \n\u25cf Attending daily meetings and standup to discuss the work \nstatus with business, testers \n\u25cf Raising bugs/defects on TestTrack Pro \no Automation Tester: \n\u25cf 1 years - Writing VB scripts on TA tool based on testcases \nthen run scripts to debug \no Core Tester: \n\u25cf Defect management, daily defect status calls with client & \ndevelopment team. \n\u25cf Ensuring timely preparation and execution of project \ndeliverable like Test cases & test scripts Use case & Test \nscenarios. \n\u25cf Defect reporting. \n\u25cf Attending walk through & creating detailed test status \nreports. \nTran Thi Huyen Chi - Resume \nCV_ Tran Thi Huyen Chi \nPage 6 of 7 \no Project descriptions: \nLeapfrog mini games and ecommerce site integrates with \ndevices to service education \nTran Thi Huyen Chi - Resume \nCV_ Tran Thi Huyen Chi \nPage 7 of 7 \nINFORMATION TECHNOLOGY SKILLS \nExperiences: \n0:  0 month \n2:  6 \u2013 12 months \n4:  2 \u2013 5 years \n1:  1 \u2013 6 months \n3:  1 \u2013 2 years \n5:  > 5 years \nLast used: \nLast year used \nExpert level: \n1:  Beginner Level \n3:  Sometimes have to use \nmanuals \n5:  Expert Level \n2:  Always have to use manuals \n4:  Can solve problems \nExperiences \nLast used \nExpert level \n1 \n2 \n3 \n4 \n5 \nPlatform \nEcommerce  \n- Magento  \n- Demandware \n- EPI \nMagento, Demandware \n5 \n2017 \nx \nSharePoint  \n1 \nx \nProgramming \nJava \n3 \n2017 \nx \nJavaScript \n5 \n2017 \nx \nC++ \n1 \n2015 \nx \nPHP \n1 \n2012 \nx \nTools \nJmeter  \n1 \n2017 \nx \nPostman  \n1 \n2017 \nx \nFOREIGN LANGUAGE \nExperiences: \n0:  0 month \n2:  6 \u2013 12 months \n4:  2 \u2013 5 years \n1:  1 \u2013 6 months \n3:  1 \u2013 2 years \n5:  > 5 years \nLast used: \nLast year used \nExpert level: \n1:  Beginner \n3:  Fluent \n5:  Translator \n2:  Conversational \n4:  Expert \nExperiences \nLast used \nExpert level \n1 \n2 \n3 \n4 \nLanguages \nEnglish \n10 \n2017 \nx \n5 ", "educations": [{"id": 5103, "gpa": null, "major": "C\u00f4ng ngh\u1ec7 th\u00f4ng tin", "school": "OPEN University", "diploma": "Bachelors", "end_time": "2006-01-01T00:00:00Z", "conf_score": 0.7982161229421119, "start_time": "2001-01-01T00:00:00Z", "picklist_major": "IT - Hardware/Networking", "major_categories": "M\u00e1y t\u00ednh v\u00e0 c\u00f4ng ngh\u1ec7 th\u00f4ng tin", "major_categories_detail": "C\u00f4ng ngh\u1ec7 th\u00f4ng tin"}, {"id": 5104, "gpa": null, "major": "K\u1ebf to\u00e1n", "school": "University of Economics", "diploma": "Bachelors", "end_time": "2014-01-01T00:00:00Z", "conf_score": 0.9253959312962393, "start_time": "2010-01-01T00:00:00Z", "picklist_major": "Accounting", "major_categories": "Kinh doanh v\u00e0 qu\u1ea3n l\u00fd", "major_categories_detail": "T\u00e0i ch\u00ednh \u2013 Ng\u00e2n h\u00e0ng \u2013 B\u1ea3o hi\u1ec3m"}], "experiences": [{"id": 17082, "detail": "", "company": "OFFICIENCE VIETNAM", "end_time": "2012-12-31T00:00:00Z", "industry": "Other", "position": "Test Lead", "conf_score": 0.7800555148948757, "start_time": "2012-06-01T00:00:00Z"}, {"id": 17083, "detail": "UML models (Use Cases, Class Diagrams, Sequence Diagrams etc.) using MS Visio. \u2022 Performed details data analysis, data modelling and defined the solutions and strategies for migration of data from legacy systems to new web based system. Designed detail financial reconciliation process for insurance accounting.\n\u2022 Audited business & functional necessity documents and identified test strategies. Carried out End to End, Functional, Integration, Regression and Performance Testing. Actively involved in entry and exit criteria decision making process.\nProvided user training and guided UAT process.\n\u2022 Prepared the detail execution plan for the team of up to 8 personnel, monitored outputs to ensure that delivery was attained on time, within budgeted costs complied with corporate SDLC Policies and guidelines. o Project descriptions:\nCDN Cocacola is Ads Network Web application\n- Allow Advertiser is able to control their campaigns completely and scientifically\n- Allow Publisher is able to submit website to get revenue from Advertiser Wine.com is an ecommerce website to promote the wine lifestyle, through innovation and buy wine", "company": "EXENTSOURCE VIETNAM", "end_time": "2011-06-30T00:00:00Z", "industry": "Other", "position": "Senior Software Tester", "conf_score": 0.7988896812656926, "start_time": "2011-04-01T00:00:00Z"}, {"id": 17084, "detail": ": \u25cf Install Leapfrog mini game package\n\u25cf Participating in code reviews and requirement analysis.\n\u25cf Writing test plans and giving test plan walkthroughs to business and development team.\n\u25cf Involve in peer review of test planning of other team members.\n\u25cf Test execution (Functional and System Integration Testing). \u25cf Attending daily meetings and standup to discuss the work status with business, testers\n\u25cf Raising bugs/defects on TestTrack Pro o o Project descriptions:\nLeapfrog mini games and ecommerce site integrates with devices to service education", "company": "LOGIGEAR VIETNAM", "end_time": "2009-06-30T00:00:00Z", "industry": "Other", "position": "Software Tester", "conf_score": 0.7951781563417549, "start_time": "2007-05-01T00:00:00Z"}], "address": null}