{"skills": ["java", "css", "c++", "git", "optimal system", "jira", "html", "j2ee", "linux", "ajax", "advanced java", "css3", "ubuntu", "mysql", "jquery", "angular", "sql", "sales", "magento", "html5", "oop", "strut", "javascript", "database", "window xp", "ubuntu linux", "jsp", "laravel", "enterprise", "php", "operating system", "restful"], "fulltext": "CURRICULUM VITAE\nPERSONAL INFORMATION:\nFull Name : TRAN HOANG QUAN\nGender : Male \nBirthday : 08/02/1991.\nAddress: 8B , Ao Sen 5, Mo Lao ,Ha Dong district, Ha \nNoi.\nHometown : Binh Luc \u2013 Ha Nam. \nPhone : 0349635273\nEmail :hoangquannit@gmail.com\nEDUCATION:\n9/2009 \u2013 12/2013 :\nThesis grade :Fair\nStudent\nPosts &Telecommunications Instituteof\nTechnology\nFaculty InformationTechnology\nSpecialized SoftwareTechnology\nStudentCourse Advanced Java Programming - Ipmac\nEXPERIENCES :\nMay 20th, 2013\u2013September 10th, 2013\nCompany ShineTheme\nRole\nPHP Developer\nResults\n- Php programming experience : Joomla , OOP\n-Experience using jQuery and other supportlibraries.\n-Ability to cuthtml\n-Knowledge of software developmentprocesses\nFebuary 18th, 2014 \u2013 June 17th, 2016\nCompany SmartOsc\nRole\nPhp Developer\nResults\n- Php programming experience : Magento,Concrete5\n+ Create new module , customize extension .\n+ Create new template, customize layout.\n+ Optimal system.\n-Experience mysql query, css , jQuery, prototype\n-Experience Git,Jira\n-Experienceserver.\n-Experience join in project base and projectsupport.\n-Team work , teambulding.\n-Knowledge of software developmentprocesses.\nAugust 15th, 2016 \u2013 the present\nCompany\nCo-well Asia\nRole\nPhp developer\nResults\n- Php programming experience : laravel 5.3, 5.4\n+ Build RESTful API\n+ Integration angular 1 and api\n+ using vue js with laravel\n-DBdesign\n-Experience working in JapanEnvironment\nRead: Good\nListen: Normal\nWrite: Normal\nSpeak: Normal\nForeign language : English\nProject base :\n1.Bendon ( Top ecommerce website in Australia and NewZealand)\n-Description :Build ecommerce website with magento enterprise.\n-Role :Customize extension ,layout frontend, config backend.\n-Live :bendonlingerie.com.au,bendonlingerie.co.nz\n2.Lizandez\n-Description :Build ecommerce website with magento cummunity.\n-Role :Customize extension ,frontend.\n-Live :lizandez.com \n3.RiverCapital\n-Description :Customize module in Silver Stripe , build newwebsite.\n-Role :Build home page, our page, customize admin managepage.\n-Technologies :SilverStripe cms php,jQuery,sql.\n-Live :rivercapital.com.au \n4.Sportnahrung\n-Description :Customize Xpos extension use gift voucher extension inmagento \ncommunity.\n-Role :Customize Xpos extension use gift voucher extension inmagento \ncommunity.\n-Technologies :Magento 1 php, jQuery, sqlquery.\n5.TPL\n-Live :goguru.com.sg\n-Technologies :Magento 1 php, Concrete5, SSO,\n6.TMS\n-Description :Build RESTful API using laravel to connect Gvido device and \nbuild music Market to sale musicproducts.\n-Role :DB design, Phpdeveloper.\n-Technologies :Laravel 5.4 framework, jQuery, Angular 1, vue 1mysql.\n-Live :https://www.gvidostore.com/ \nProject Support :\n1.Radio-rentals (Top ecommerce website in Australia)radio-rentals.com.au \n2.Aldi Liquoraldiliquor.com.au\n-Description: Support client follow requirement updatedeveryday.\n-Role :Create new module, customize layout and extension, optimalsystem.\nInformation technology skills\nProgramming\nPhp (Magento, laravel)\nGood\nJava (J2SE/J2ME)\nGood\nJava (J2EE )\nGood (JSP/Servlet ; Struts 1; JSTL)\nC/C++ Normal\nHTML/CSS Good\nHTML5/CSS3 Normal\nJavaScript  jQuery  Ajax\nNormal Good  Normal\nDatabase\nMySQL Good\nOperating System\nWork experience with Windows XP/7/8,linux(Ubuntu).\nCAREER ORIENTATION\n\uf0fcBecome a profestional programmer within the 6-7years.\n\uf0fcDevelopers semantic webcontent.\n\uf0fcProduct development marked itsown.\nExpectation job\n\uf0fcPhp Programmer\n\uf0fcTo participate in the web developmentproject\n\uf0fcTo learn and exchange experiences.", "educations": [{"id": 5116, "gpa": null, "major": "InformationTechnology", "school": "Posts &Telecommunications Instituteof Technology", "diploma": "Other", "end_time": "2013-12-01T00:00:00Z", "conf_score": 0.8167547004921527, "start_time": "2009-09-01T00:00:00Z", "picklist_major": "Other", "major_categories": "", "major_categories_detail": ""}], "experiences": [{"id": 17119, "detail": "esults\n- Php programming experience : laravel 5.3, 5.4 + Build RESTful API + Integration angular 1 and api\n+ using vue js with laravel\n-DBdesign -Experience working in JapanEnvironment Read: Good Listen: Normal Write: Normal Speak: Normal Foreign language : English", "company": "Co - well Asia", "end_time": "2023-04-13T00:00:00Z", "industry": "Other", "position": "Php developer", "conf_score": 0.8897446937692582, "start_time": "2016-08-15T00:00:00Z"}, {"id": 17121, "detail": "Results - Php programming experience : Magento,Concrete5 + Create new module , customize extension . + Create new template, customize layout.\n+ Optimal system.\n-Experience mysql query, css , jQuery, prototype\n-Experience Git,Jira -Experienceserver. -Experience join in project base and projectsupport.\n-Team work , teambulding.\n-Knowledge of software developmentprocesses.", "company": "SmartOsc", "end_time": "2016-12-31T00:00:00Z", "industry": "High Technology", "position": "Php Developer", "conf_score": 0.9057868248189686, "start_time": "2016-06-17T00:00:00Z"}, {"id": 17123, "detail": "esults\n- Php programming experience : Joomla , OOP -Experience using jQuery and other supportlibraries.\n-Ability to cuthtml\n-Knowledge of software developmentprocesses", "company": "Company ShineTheme", "end_time": "2013-09-30T00:00:00Z", "industry": "Other", "position": "PHP Developer", "conf_score": 0.8275107295019075, "start_time": "2013-05-20T00:00:00Z"}], "address": "8b , Ao Sen 5, Mo Lao ,ha Dong district, Ha Noi"}