{"skills": ["java", "automation", "automation testing", "c++", "selenium", "c#", "management", "studio", "automation testing tool", "unit test", "security", "object oriented", "git", "analysis", "service management", "android", "visual studio", "microsoft visual studio", "unit testing", "it service management", "testing", "microsoft", "communication skill", "networking", "teamwork", "manual testing", "user interface", "software testing tool"], "fulltext": "Tr\u01b0\u01a1ng V\u0129nh L\u1ed9c\nSOFTWARE QUALITY CONTROL ENGINEER\nObjective\nTake advantages of IT skills & experience and understanding of testing to become a\nprofessional Quality Control Engineer and bring a lot value to company.\n\uf0eb Education\nTROY UNIVERSITY\n01/2012 - 01/2016\nBachelor of Computer Science\nMobile Programming\nApplied Networking\nSystems Analysis and Design\nComputer Security\nObject Oriented\n\uf073Sep 16, 1993\n\uf007 Male\n\uf095 0908890321\n\uf199 tvloc1993@gmail.com\nHo Chi Minh City, Vietnam\n\uf0c0Work Experience\nGYM\n01/2015 - 01/2016\nPart-time job\nGuiding customer when they come to the gym, how to use the devices.Be available to answer\nmember questions.\nDXC TECHNOLOGY (FORMER CSC VIETNAM)\n6/2016 - NOW\nSoftware Quality Control Engineer (Automation)\n- Build, develop and maintain automation software testing tool, product about ServiceNow\nproduct (IT Service Management).\n- Manual testing, use user story and create test case manual and run by auto script.\n- Make reports of automation testing every week. \n- Daily meeting with scrum team for discuss about testing process (demo to product owner\nevery 2 weeks).\nAchievements and skills gained: \n- Experience in automation testing with Selenium Webdriver, Git (Web application).\n- Experience in automation testing tool by Microsoft Visual Studio\n- Understand deeply about testing (unit test, integration test, white-box test, black-box\ntest...e).\n- Guiding for new members join to team (Mentor 1 on 1).\n- Improve English Communication Skill. \n\uf041\nSKILLS\nC#/C++\nJava,\nManual/Automation Testing\nSelenium Webdriver/Git\nActive\nTeamwork\nCreative\nINTERESTS\nSoccer\nMusic\nGym\n\uf005 Activities\nSTUDENT ASSOCIATION TROY UNIVERSITY\n01/2013 - 01/2014\nStaff\nAdvertise activities, provide information from the university to the students.\nANDROID APPLICATION PROJECT\n2015\nTeam\nBuild some simple android application, for example: news reading, dictionary,\nmusicplayer...and design user interface.\nCUCUMBER FRAMEWORK TESTING\n2016\nIndependence\nResearch, build and develop framework by using Cucumber and Java programming language.\nAUTOMATION TESTING TEAM\n2016\nTeam\nTest member\nSCRUM TEAM\n2017 - NOW\nTeam\nTest Lead\n\uf0f6 Certifications\nIELTS Certificate (5.5)\n2015\nJapanese Language Proficiency Test (JLPT N5)\n2016\nServiceNow Certified System Administrator\n2017\nTOEIC 725\n2017\nBULATS Reading and Listening Test 81\n2017\nBULATS Speaking (Upper-Intermediate B2)\n2017\n\uf091Honors & Awards\nScholarship in 2nd semester 2012-2013 and 1st semester 2013-\n2014.\n2013-2014\n\u00a9 topcv.vn\nPowered by TCPDF (www.tcpdf.org)", "educations": [{"id": 5115, "gpa": null, "major": "Khoa h\u1ecdc m\u00e1y t\u00ednh", "school": "TROY UNIVERSITY", "diploma": "Bachelors", "end_time": "2016-01-01T00:00:00Z", "conf_score": 0.8491898147274514, "start_time": "2012-01-01T00:00:00Z", "picklist_major": "IT - Hardware/Networking", "major_categories": "M\u00e1y t\u00ednh v\u00e0 c\u00f4ng ngh\u1ec7 th\u00f4ng tin", "major_categories_detail": "M\u00e1y t\u00ednh"}], "experiences": [{"id": 17117, "detail": "- Build, develop and maintain automation software testing tool, product about ServiceNow product (IT Service Management). - Manual testing, use user story and create test case manual and run by auto script.\n- Make reports of automation testing every week.\n- Daily meeting with scrum team for discuss about testing process (demo to product owner every 2 weeks).\nAchievements and skills gained:\n- Experience in automation testing with Selenium Webdriver, Git (Web application).\n- Experience in automation testing tool by Microsoft Visual Studio - Understand deeply about testing (unit test, integration test, white-box test, black-box test...e).\n- Guiding for new members join to team (Mentor 1 on 1). - Improve English Communication Skill.", "company": "DXC TECHNOLOGY (FORMER CSC VIETNAM)", "end_time": "2023-04-13T00:00:00Z", "industry": "High Technology", "position": "Software Quality Control Engineer (Automation)", "conf_score": 0.8044357220536977, "start_time": "2016-06-01T00:00:00Z"}, {"id": 17118, "detail": "Part-time job\nGuiding customer when they come to the gym, how to use the devices.Be available to answer member questions.", "company": "GYM", "end_time": "2016-01-31T00:00:00Z", "industry": "Other", "position": null, "conf_score": 0.7050867654707917, "start_time": "2015-01-01T00:00:00Z"}], "address": "Ho Chi Minh City, Vietnam"}