{"skills": ["networking", "java", "agile", "analysis", "parsing", "mysql", "compute", "project management", "telecom system", "elasticsearch", "bug fixing", "apache", "database", "implementation", "docker", "jenkins", "angularjs", "maintenance", "management", "problem solving"], "fulltext": "Phan Quoc Trung\n135/27 Dinh Phong Phu, 9 District, Ho Chi Minh, Vietnam.\n\uf095 0385917707 \uf0e0 trungpq999@gmail.com \uf0c1 DoB: 03/13/1995\nZalo Group(20 months)\n10/2017 - 06/2019\nDEK Technologies(6 months)\n04/2017 - 10/2017\nWORK EXPERIENCE\nJava Backend\n- Analysis, design and development webgames (CCU ~7000 per game): \n  + Games: Tien Lenh Mien Nam ZingPlay(Poker Game), Ta La (Poker Game), iCa (Shooting Fish - core\nmember)\n  + Analysis, design, implementation, deployment and maintenance of available backends for live games. \n  + Work on bug fixing and improving game performance.\n- ZWebQos(Tool check quality of services : Zalo Chat, Zalo Food, Zalo Shop, ...)\n   + Compute Parsing and Painting Web time.\n   + Use Prophet(a forecasting tool - Facebook) to detect and alert anormal quality of service.\n- Maintenance ZaloPayment System:\n  + Problems: bug in-app purchase, move Database(MySQL) to another instance.\n  + Add user-id in purchase-processing for tracking.\n  + Add partition and re-indexing Database.\n  + Create cron job collect and write to Database.\n- DCC website(tool manage room)\n  + Base on AngularJS, NodeJs.\n  + CRUD training, meeting event and noti attendees.\n- Maintenance MTAS(telecom system)\n  + Research system, fix bug and write test case.\nHo chi minh University of Science\n2014 - 2018\nEDUCATION\nMajor: Software Engineer\nSKILLS\n- There is a passionate spirit of learning and progress.\n- Good research skill, logical thinking, problem-solving.\n- Passionate and knowledgeable about games, especially servers, backend, Realtime process.\n- Strong Java foundation.\n- Have knowledge about blocking & non blocking, socket, Networking, ElasticSearch, Caching, DataBase\nDocker, Apache Thrift.\n- Familiar with CI Jenkins, Agile Project Management.\n\u00a9 topcv.vn\nPowered by TCPDF (www.tcpdf.org)", "educations": [{"id": 5125, "gpa": null, "major": "Software Engineer", "school": "Ho chi minh University of Science", "diploma": "Bachelors", "end_time": "2018-01-01T00:00:00Z", "conf_score": 0.9162385206282713, "start_time": "2014-01-01T00:00:00Z", "picklist_major": "Other", "major_categories": "", "major_categories_detail": ""}], "experiences": [{"id": 17145, "detail": "- Analysis, design and development webgames (CCU ~7000 per game):\n+ Games: Tien Lenh Mien Nam ZingPlay(Poker Game), Ta La (Poker Game), iCa (Shooting Fish - core member)\n+ Analysis, design, implementation, deployment and maintenance of available backends for live games.\n+ Work on bug fixing and improving game performance.\n- ZWebQos(Tool check quality of services : Zalo Chat, Zalo Food, Zalo Shop, ...) + Compute Parsing and Painting Web time.\n+ Use Prophet(a forecasting tool - Facebook) to detect and alert anormal quality of service.\n- Maintenance ZaloPayment System: + Problems: bug in-app purchase, move Database(MySQL) to another instance.\n+ Add user-id in purchase-processing for tracking.\n+ Add partition and re-indexing Database. + Create cron job collect and write to Database.", "company": "Zalo Group", "end_time": "2019-06-30T00:00:00Z", "industry": "High Technology", "position": "Java Backend", "conf_score": 0.9594567825084462, "start_time": "2017-10-01T00:00:00Z"}, {"id": 17147, "detail": "- DCC website(tool manage room)\n+ Base on AngularJS, NodeJs. + CRUD training, meeting event and noti attendees.\n- Maintenance MTAS(telecom system)\n+ Research system, fix bug and write test case.", "company": "DEK Technologies", "end_time": "2017-10-31T00:00:00Z", "industry": "High Technology", "position": null, "conf_score": 0.8086621310791741, "start_time": "2017-04-01T00:00:00Z"}], "address": "135/27 Dinh Phong Phu, 9 District, Ho Chi Minh, Vietnam"}