{"skills": ["zoho", "hard working", "budgeting", "analysis", "mysql", "product management", "protocol", "laravel", "bootstrap", "ams", "cobol", "angularjs", "maintenance", "problem solving", "agile", "python", "dba", "security", "project management", "sales", "google analytics", "html5", "apache", "ibm", "atlassian jira", "content marketing", "plesk", "digital strategy", "php", "fortran", "hotjar", "xcode", "management", "kotlin", "networking", "investments", "team management", "administration", "internet", "jira", "vendor development", "django", "cpanel", "clarify", "c#", "zoho crm", "swift", "website development", "recruitment", "software development", "android", "mongodb", "wireframes", "quality assurance", "business processing", "postgresql", "trello", "restful", "salesforce", "microsoft ii", "linux", "css3", "kanban", "mssql", "accounting", "microsoft", "marketing", "sql", "javascript", "analytics", "pascal", "digital marketing", "excel", "sales and marketing", "crm", "project scoping", "analyst", "social media marketing", "medium", "asp"], "fulltext": "MOBILE\n+84 932 924 523 \nEMAIL\ntrevorza@gmail.com\nTREVOR LEWIS\nSKYPE trevor-lewis S\nProduct Manager / BDM\nZALO trevor_lewis Z\nCOVER LETTER\nTO\nRAPBANK\nTong 7, 27 Ph\u00f3 \u0110oc Ch\u00ednh, Quon 1, \nTP.HCM, Vietnam.\nI hereby wish to submit my resume for your consideration for the position \nyou recently advertised for Product Manager / Business Development.\nThis position is the perfect fit for me as I have a unique skill set \nthat combines my love for both internet technology and business \ndevelopment covering product management, architectural planning, \nteam leadership, and customer engagement. \nMy entire career has been focused around IT Tech with particular focus on \nWeb and App Production, Business and Digital Strategies, Development, \nMarketing and Support within the online ecosystem. I have a deep \nunderstanding and of the startup environment having experience as a co-\nfounder. I am hard-working, good  tempered and optimistic.\nI am 100% capable and delivering on all the responsibilities you specified \nand some. My skills summary are as follows:\nl 20 years\u2019 working experience in the internet field as a Solution\u2019s \n     Architect, Product Manager, Software Developer, and a Digital Marketer \n     skilled in analyzing, conceptualizing, and prototyping, project scoping, \n     road-mapping and project budgeting, UI/UX design, modeling, \n     integration, deployment as well as DBA, online security, customer \n     support and training \nl 15 years\u2019 project and team leadership using Waterfall, Kanban and \n      Agile methodology approaches (iterative development)\nl 10 years business processing, budgeting, IT policies and protocol \n      creation, product requirements and specifications.\nl 5 years at a corporate leadership level and Startup experience \nl Strong business development skills, strategy and execution with high \n      CSAT levels\nl In-depth knowledge of digital marketing, SEO, SMM, Google PPC, \n      Facebook Ads, and Audience Insights, content marketing and \n      production\nl Highly capable of driving deals end to end from closure to execution \n      and maintain key relationships at senior level\nl Understanding of tools such as GA, Woopra, MS Office, Adobe, InVision, \n      Sketch, Jira, Slack, Trello, etc.\nMy strong points include building and engineering IT systems with \nspecial focus on aesthetics, discussing and presenting technical functions \nto stakeholders, investors, and partners as well as supporting the \ndevelopment and marketing teams for which I am extremely comfortable \nwith and am able to successfully execute upon.\nI am passionate about building B2B and B2C products (especially in the \nFinTech Field) and have the knowledge and experience of many years of \nbeing in the digital environment. I am an out-the-box thinker, with the \nability to innovate and create effective solutions with actionable results. I \nam an experienced team leader and manager.\nFurthermore, I am based in Vietnam and have both a valid residence and \nworking visa. I also have an excellent understanding of the Vietnamese \nmarket and culture and thus well-suited to work with Vietnamese \ncompanies and engineers. \nI trust my interest in this position allows me an opportunity to connect \nand engage with you further and I sincerely look forward to hearing back \nfrom you soon.\nDATE\n2 JULY 2019\nFROM\nTrevor Lewis\nCHECKLIST\nl Total Engineers managed at one time: \n      40 people \nl Team Communication and Collaboration: \n      International \nl Project Accountability: \n      Extensive Experience\nl  Innovate-after-completion: \n      Solid Experience\nl Reporting and Tracking: \n      Highly Experienced \nl  Language: \n      Native English \nl Second Language: \n      Afrikaans / Dutch \nl  Mindset: \n      Confident, Business-minded, \n      Self-Organised\nl Project Management: \n      Over 15 years experience \nl Software Engineering: \n      20 years experience\nKind Regards,\nTREVOR LEWIS\nMOBILE\n+84 932 924 523 \nEMAIL\ntrevorza@gmail.com\nTREVOR LEWIS\nSKYPE trevor-lewis S\nProduct Manager / BDM\nZALO trevor_lewis Z\nKEY ACHIEVEMENTS\n1. I have been actively involved in the online / internet industry since 1995 \n2. Created my first website for a small accounting firm in 1996\n3. Secured my first big NGO project in 1997 where I worked closely with \n    the client to clarify their needs and define product sitemap. This was \n    the first time I provided Solution Architectural services on a large scale \n4. Defined, Designed, Developed, Marketed and Maintained 5 websites \n    for local Real Estate Agencies by the year 1999\n5. Won my first big-budget Government project in 2000 were sat with a \n    a panel of department heads to define their needs and requirements \n    and then developed all designs. wireframes, mockups, and plans to \n    ensure project and solution would satisfy those needs\n6. Worked with several governmental departments to produce large \n    online websites, intranets and internal software to service their needs. \n    Here I worked with and collaborated with their project managers and \n    team members (2001 to 2003)\n7. Firmly established my own Digital Solutions and Media firm by 2004, \n    hired and managed a team of 10+ engineers, product managers, and \n    designers. Prepared quotes, project scope and deliverables for clients\n8. Worked with international teams, delivering on international projects \n    to over 24 countries, calculated budgets for various projects including \n    time frames, and ensured adherence to deliverables were implemented\n8. By 2009, I designed, developed and marketed the leading UAE portal; \n    Dubizzle.com which later sold for $40m to OLX\n9. From 2010 to 2013 I worked in several countries on several projects as \n    a Project Manager and interim CTO. I provided the needed engineering, \n    architectural guidance, team management which ensured all processes \n    and teams were in place and all tasks were being executed correctly\n10. Moved to Singapore as Head of IT for an International Investment \n      company where I managed all their online development, design, \n      digital marketing, and project management needs, often delegating \n      responsibilities and prioritising assignments to our development staff\n11. 2015 to 2017 entered the startup Tech World where I provided \n     leadership and management for several businesses in the PropTech, \n     EduTech, Recruitment, and FinTech world\n12. In 2018, I raised $100k in VC for my own RealTech startup with a staff \n     count of 40 engineers\nMANAGEMENT AND PROCESS SERVICES  \nl IT Project Management and Business Setup, \n      Administration and Operations\nl Technical Lead, Team Building and Team Management  \nl Business and Client Analyses, Strategic Technical \n      Planning & Development \nl Solutions Architecture, Solution\u2019s Development \n      and Road Map Planning \nl Project Engineering and Software Development, \n      Vendor Selection  \nl Quality Assurance, sales and marketing team \n      management & collaboration  \nl Waterfall, Kanban, and Agile Methodologies  \nl Technical Writing, Spec Sheets, Scoping, Help \n      Documentation \nl Presentation Development and Delivery, \n      Technical Solutions Development \nl Skills Transfer, Training and Teaching, Technical \n      Support, Business Processes \nl Networking, Strategic Partnership, and \n      Relationship Building \nl Technical architecture planning and maintenance \n      and IT Skill Management \nl Customer and Investor Communications, \n      Development Processes\nl Financial Planning, Strategy Development and \n      Communications\nl Recruitment, Skills Acquisition, IT Outsource \n      Execution, Staff Recruitment\nl Business Meetings, Investor Relations, Start-up \n      Setup, and Execution \nSOFTWARE SKILLS  \nl Adobe Photoshop, Illustrator, InDesign, Premiere, \n      Dreamweaver, Flash, Audition, XD\nl Microsoft Word, Excel, PowerPoint, Publisher, Project, \n      Outlook\nl InVision, Sketch\nl Slack, Trello, Atlassian Jira\nl Nibbler, Google Analytics, Hotjar, CrazyEgg, Woopra\nl Zoho CRM, Freshdesk, Salesforce, Pipedrive, Highrise\nl Help desk support, knowledge base upkeep, \n       ticketing system (ZenDesk, FreshDesk, Atlassian, \n       Interkom, Drift, etc.)\nPROGRAMMING SKILLS\nl Cobol, RPG, Fortran\nl Basic, Turbo Pascal, Visual Basic, .NET, C#\nl JavaScript,  HTML5, CSS3, AngularJS\nl ASP, PHP, Python, MS-SQL, MySQL, MongoDB, PostgreSQL\nl Laravel, Bootstrap, Django \nl React, Node.js, Xcode Swift, Android Kotlin & RESTful API\nl Microsoft IIS, Linux Apache, CPanel, Plesk, MySQL, MSSQL \nDIGITAL MARKETING SKILLS  \nl SEO, SEM, Social Media Marketing\nl Content and Video Creation\nl E-marketing & Lead Management\nTREVOR LEWIS\nMOBILE\nEMAIL\nSKYPE\n+84 932 924 523\ntrevorza@gmail.com\ntrevor-lewis\nRESUME\nPROFILE SKILL\nI have over 20 years of international working and industry experience in the \nfield of Information Technology within the Internet field with excellent \nProduct Management and Business Development skills. I combined these \nskills with the love of IT and passion for Web / App Production by devel-\noping and designing several online systems with a proven track record in \nmanaging, engineering, and implementing projects with a variety of teams.\nREFERENCES\nMr. Xavier Wiggins\nManaging Director of Portfolio Spotlight\nTel: +44 (0) 7818 432865\nEmail: xavierwiggins@portfoliospotlight.com\nMr. Ben Crabb\nFinancial Manager at Chase Belgrave\nTel: +44 (0) 731 419 42740\nEmail: ben@crabb.com\nMr. Richard Soo\nWORK EXPERIENCE\nBROWZIO (start-up) \n1TIME  MEDIA\nGROUP  NET\nIBM \nS. AFRICA\n2017 - 2018\n2009 - 2016\n2003 - 2008\n1997 - 2002\nCTO AND CO-FOUNDER (SOLUTION ARCHITECT) \nResponsible for the technical & marketing architecture \nof a PropTech startup including product development, \ntalent hiring,  management, CSat and Investor Relations.  \nIT CONSULTANT, PM, SOLUTION ARCHITECT\nConsultancy, Project Management, Technical Lead, Web \nDesign and Development, Lead Generation, CRM Design \nand Integration, Digital Marketing, Budget Management.\nFOUNDER AND MANAGING DIRECTOR (WEB)\nBusiness Development, Web Design, Programming, \nOnline Marketing. Project Management, SEO, SEM, \nContent Production, IT Lecturer and Training.\nSYSTEM\u2019S ENGINEER\nTechnical proficiency across complete IBM products. \nHardware, software, network support, installation, \ndiagnostic and repair services. Account Manager, Client \nSupport Services and Help Desk Specialist. \nEDUCATION\nUniversity of South Africa (UNISA)\nPort Elizabeth Technikon\n1996 \u2013 2000\n1992 \u2013 1995\nCOMPUTER SCIENCE\nINFORMATION TECHNOLOGY \nBachelor of Science Degree in Computer Science \nNational Diploma in Information Technology \nACHIEVEMENTS \n2001\n1996\nIBM & DELL\nCOMPTIA \nMICROSOFT \nIBM Certified Systems Engineer & Dell Certified Professional\nCompTIA\u2019s A+ and N+ Certificates  \nMicrosoft Certified Professional & Certified Systems Engineer\nPROFESSIONAL SKILLS\nu  Product Manager \nu  Information Architect\nu  Project Management & Business Development\nu  Business Systems Analyst\nu  Software Engineer\nu  Design, modelling (Ui/Ux) and integration\nu  Digital Marketing\nu  SEO, SEM, SMM\nu  Content Production and Delivery\nu  User Insights and Analytics\nu  QA Specialist\nu  Growth Hacker\nu  Technical Support\nPERSONAL SKILLS\nu   Leadership\nu  Problem Solving \nu   Multi-tasking \nu  Creative Thinker\nu   Patience\nu   Creativity\nu   Communication \nu   Adaptability \nLANGUAGE SKILLS\nBorn in South African to a British Father and a Polish \nMother. English is my native-tongue and Afrikaans / \nDutch is my second language. I am learning  Vietnamese. \nENGLISH 100%\nAFRIKAANS\n/ DUTCH\n90%\nVIETNAMESE\n10%\nManaging Director\nTel: +65 (0) 9856 7468\nEmail: richardsoo@urban8.sg\ntrevor_lewis Z\nZALO", "educations": [{"id": 5140, "gpa": null, "major": "C\u00f4ng ngh\u1ec7 th\u00f4ng tin", "school": "INFORMATION TECHNOLOGY", "diploma": "Other", "end_time": "1995-01-01T00:00:00Z", "conf_score": 0.8363126073448006, "start_time": "1992-01-01T00:00:00Z", "picklist_major": "IT - Hardware/Networking", "major_categories": "M\u00e1y t\u00ednh v\u00e0 c\u00f4ng ngh\u1ec7 th\u00f4ng tin", "major_categories_detail": "C\u00f4ng ngh\u1ec7 th\u00f4ng tin"}, {"id": 5139, "gpa": null, "major": "Khoa h\u1ecdc m\u00e1y t\u00ednh", "school": "University of South Africa (UNISA)", "diploma": "Bachelors", "end_time": "2000-01-01T00:00:00Z", "conf_score": 0.7982161229421119, "start_time": "1996-01-01T00:00:00Z", "picklist_major": "IT - Hardware/Networking", "major_categories": "M\u00e1y t\u00ednh v\u00e0 c\u00f4ng ngh\u1ec7 th\u00f4ng tin", "major_categories_detail": "M\u00e1y t\u00ednh"}], "experiences": [{"id": 17189, "detail": "ponsible for the technical & marketing architecture of a PropTech startup including product development, talent hiring, management, CSat and Investor Relations.", "company": "BROWZIO (start - up)", "end_time": "2018-01-31T00:00:00Z", "industry": "Other", "position": "CTO AND CO - FOUNDER", "conf_score": 0.903928513426524, "start_time": "2017-01-01T00:00:00Z"}, {"id": 17191, "detail": "Consultancy, Project Management, Technical Lead, Web Design and Development, Lead Generation, CRM Design and Integration, Digital Marketing, Budget Management.", "company": "1TIME MEDIA", "end_time": "2016-01-31T00:00:00Z", "industry": "Other", "position": "IT CONSULTANT, PM, SOLUTION ARCHITECT", "conf_score": 0.9181269048441778, "start_time": "2009-01-01T00:00:00Z"}, {"id": 17193, "detail": "Business Development, Web Design, Programming, Online Marketing. Project Management, SEO, SEM, Content Production, IT Lecturer and Training.", "company": "GROUP NET", "end_time": "2008-01-31T00:00:00Z", "industry": "Other", "position": "FOUNDER AND MANAGING DIRECTOR (WEB)", "conf_score": 0.9181269048441778, "start_time": "2003-01-01T00:00:00Z"}, {"id": 17194, "detail": "Technical proficiency across complete IBM products.\nHardware, software, network support, installation, diagnostic and repair services. Account Manager, Client Support Services and Help Desk Specialist.", "company": "IBM S. AFRICA", "end_time": "2002-01-31T00:00:00Z", "industry": "Other", "position": "SYSTEM\u2019S ENGINEER", "conf_score": 0.9181269048441778, "start_time": "1997-01-01T00:00:00Z"}], "address": "Tong 7, 27 Ph\u00f3 \u0110oc Ch\u00ednh, Quon 1, Tp.hcm, Vietnam"}