{"skills": ["resharper", "sourcetree", "amazon workspace", "development testing", "javascript", "c#", "management", "studio", "enterprise", "entity framework", "git", "project management", "teamcity", "website development", "design pattern", "sql", "css", "jira", "nunit", "visual studio", "le", "unit testing", "testing", "microsoft", "dependency injection", "backend development", "oracle", "continuous integration", "bitbucket", "agile", "project management software", "html"], "fulltext": "EXPERIENCE\nTECHNOLOGY ONE - TMA SOLUTIONS\nBackend Developer\n2016- 2019 \nI worked for the TechnologyOne team - a comprehensive \nplatform providing Enterprise Software solutions and \nservices that transform business and make life simple \nfor the customers.\n- 3+ years practical experience on a web-based \napplication.\n- Good understanding and experience in working in an \nagile team. \n- Experience in project management software: JIRA.\n- Experience in version control system such as Git, TFS.\n- Experience in working with CI system such as TeamCity.\n- Experience in communication with client in English.\n- Ability to mentoring newcomers and do code review for \nteam members. \n- Ability to follow, maintain and lead the team on strict \ncoding standards.\nTIN NGUYEN\nBACKEND DEVELOPER\nABOUT ME\nI\u2019m an experienced backend developer \nwith a solid background in web \ndevelopment using .Net framework. My \nbusiness domain is mainly in enterprise \nsoftware (Student management, property \nand rating...).\nResponsible, passionate and able to work \nunder pressure. I\u2019m looking forward to \nhoning and develop my skills in order to \nbecome more complete and can utlize my \nknowledge efficiently for the growth of \nthe organization.\nTECHNICAL SKILLS\nMicrosoft technologies\nProficient in use of C#, .Net Framework, Entity \nFramework.\nIntermediate level of HTML, CSS, Javascript, ...\nFrontend technologies\nSQL Server and Oracle.\nRelational databases\nVisual Studio, Visual Studio Code, JetBrain Rider\nIDE\nTools\nCommand Shell, Bitbucket, SourceTree, TeamCity, Jira, \nConfluence, - Amazon Workspace, Resharper, OneNote...\nMsTest, NUnit.\nUnit tests\nPractices\nDesign Patterns, Dependency Injection, Continuous \nIntegration, Unit Testing, Code Review\nCONTACT\nAddress: \n24/7 Le Thi Hong, Go Vap, HCMC\nPhone: \n(+84) 386 596 455\nEmail: \n hoangtin1514 @gmail.com\nEDUCATION\nUniversity of Science\nBACHELOR OF INFORMATION TECHNOLOGY \nSPECIALIZED SOFTWARE ENGINEERING\n2013 - 2017\nGPA 7.5\nACHIEVEMENTS\nPERFORMANCE APPRAISAL LEVEL 5\n2017\nIt's the highest level of the yearly employee \nassessment at TMA. \nINTERNAL HACKDAY FIRST FRIZE\n2017\nThe event held by the customer\nto collect innovation ideas \nto improve the product.\nTMA QUARTERLY STAR PERFORMER\n2019\nHOBBIES\nMusic\nBowling pins\nCycling\nPhotography", "educations": [{"id": 5150, "gpa": "7.5", "major": "K\u1ef9 thu\u1eadt ph\u1ea7n m\u1ec1m", "school": "University of Science", "diploma": "Bachelors", "end_time": "2017-01-01T00:00:00Z", "conf_score": 0.7625990117186952, "start_time": "2013-01-01T00:00:00Z", "picklist_major": "IT - Hardware/Networking", "major_categories": "M\u00e1y t\u00ednh v\u00e0 c\u00f4ng ngh\u1ec7 th\u00f4ng tin", "major_categories_detail": "M\u00e1y t\u00ednh"}], "experiences": [{"id": 17225, "detail": "I worked for the TechnologyOne team - a comprehensive platform providing Enterprise Software solutions and services that transform business and make life simple for the customers.\n- 3+ years practical experience on a web-based application.\n- Good understanding and experience in working in an agile team.\n- Experience in project management software: JIRA. - Experience in version control system such as Git, TFS. - Experience in working with CI system such as TeamCity. - Experience in communication with client in English. - Ability to mentoring newcomers and do code review for team members.\n- Ability to follow, maintain and lead the team on strict coding standards.", "company": "TECHNOLOGY ONE - TMA SOLUTIONS", "end_time": "2019-01-31T00:00:00Z", "industry": "High Technology", "position": "Backend Developer", "conf_score": 0.9125776658202421, "start_time": "2016-01-01T00:00:00Z"}], "address": "24/7 Le Thi Hong, Go Vap, Hcmc"}