{"skills": ["machine learning", "microservices", "css", "git", "agile", "typescript", "svn", "python", "self learning", "html", "system software", "full stack development", "mysql", "azure", "insurance", "peer to peer", "angular", "azure devops", "django", "microsoft", "sql", "microservices architecture", "c#", "sql query", "elasticsearch", "stack", "javascript", "payment", "devops", "website development", "hubspot", "rabbitmq", "mvc", "ams", "teamwork", "angularjs", "mongodb", "management", "aws", "asp"], "fulltext": "EXPERIENCE\nSENIOR SOFTWARE ENGINEER\nORIENT SOFTWARE  |  FEB 2020 - PRESENT\nPROJECT: BRAVOSUITE | FEB 2020 - PRESENT\nBravo is a job marketplace website to help recruiters find\nsuitable candidates.\nTechnologies: \nASP.NET Core 3.1, Web API, Angular 7, RabbitMQ,\nMicroservices architecture, MongoDB, Elasticsearch.\nResponsibilities: \nImplement main functions of the system.\nEstimate task\nOptimize, review, refactor code. Help other team\nmembers to follow coding conventions, patterns.\nSOFTWARE ENGINEER\nGROOVE TECHNOLOGY  |  JAN 2019 - FEB 2020\nPROJECT: ADJUNO | JAN 2019 - PRESENT\nProviding goods management system, the process of ordering,\ninspection, shipping, quality checking, network supplier\nmanagement.\nTechnologies: \nASP.NET Core, Web Api, ASP.NET MVC, Angular 7\nResponsibilities: \nOptimize SQL query, code, maintain the system.\nSOFTWARE ENGINEER\nFUTURIFY CO., LTD  |  APRIL 2017 - JAN 2019\nPROJECT: RVEZY.COM | APRIL 2017 - JAN 2019\nA peer to peer sharing marketplace website for listing and\nrenting RVs across Canada\nTechnologies: ASP.NET Core, Microservices architecture, Web\nApi, AngularJS, Stripe, AWS Services(S3, EC2, Lambda,...),\nRabbitMq, Hubspot, Integrate Payment Gateway (Stripe).\nResponsibilities: \nDevelop booking system, insurance claim module and\nother priority features of the whole system.\nIntegrate the website with other 3rd party platforms\nOptimize the code to improve website performance.\nFix bugs, maintain system, code review, refactor code,\ndeploy. \nPROJECT: HOOZING.COM | MAY 2018 - AUG 2018\nHoozing is a marketplace website helping foreigners rent\nhouses and apartments in Vietnam. \nTechnologies: \nASP.NET MVC5, AngularJS.\nAWS ElasticSearch\nResponsibilities: \nDevelop main functions of the system. \nIntegrate the website with other 3rd party platforms.\nFix bugs, code review, deploy. \nPROJECT: PHIBIOUS | DEC 2018 - APR 2019\nPhibious is a fashion marketplace website that helps users\ncontact with the sellers easier.\nTechnologies: \nUsing Machine Learning to build a recommendation\nsystem.\nDjango framework.\nResponsibilities: \nCode, research more about Machine Learning. \nHA THE\nHOANG\nFULL-STACK DEVELOPER\nCONTACT\nPhone: 0963 225 084\nEmail: hathehoanghayen@gmail.com\nPROFILE\nI am a full-stack developer with 4 years\nexperience in web development. I used\nto work on the various types of mission-\ncritical applications using Microsoft\ntechnologies, Python and other latest\nframeworks. I believe what I have gained\nin the previous works that can help me\nbe able to adapt your company\nrequirements for the opening job.\nSKILL SETS\nC# .NET\nPython\nJavascript, Typescript\nHTML, CSS, SCSS\nAngularJS, Angular 2+\nASP.NET MVC, Web API, .NET Core\nDjango framework\nMS SQL Server, MySQL, MongoDb\nAWS Services: RDS, EC2, S3,\nCloudfront, Elasticsearch, ...\nAzure DevOps Pipelines\nGit, SVN\nAgile development method\nSoft skills: self-learning, teamwork,\ntime management\nEDUCATION\nBACHELOR OF INFORMATION\nTECHNOLOGY\nUNIVERSITY OF SCIENCE  |  2013 - 2017", "educations": [{"id": 5173, "gpa": null, "major": "C\u00f4ng ngh\u1ec7 th\u00f4ng tin", "school": "UNIVERSITY OF SCIENCE", "diploma": "Bachelors", "end_time": "2017-01-01T00:00:00Z", "conf_score": 0.8263227818945743, "start_time": "2013-01-01T00:00:00Z", "picklist_major": "IT - Hardware/Networking", "major_categories": "M\u00e1y t\u00ednh v\u00e0 c\u00f4ng ngh\u1ec7 th\u00f4ng tin", "major_categories_detail": "C\u00f4ng ngh\u1ec7 th\u00f4ng tin"}], "experiences": [{"id": 17304, "detail": "Bravo is a job marketplace website to help recruiters find suitable candidates.\nTechnologies: ASP.NET Core 3.1, Web API, Angular 7, RabbitMQ, Microservices architecture, MongoDB, Elasticsearch. Responsibilities: Implement main functions of the system.\nEstimate task\nOptimize, review, refactor code. Help other team members to follow coding conventions, patterns.", "company": "ORIENT SOFTWARE", "end_time": "2023-04-13T00:00:00Z", "industry": "High Technology", "position": "SENIOR SOFTWARE ENGINEER", "conf_score": 0.8986552717623872, "start_time": "2020-02-01T00:00:00Z"}, {"id": 17305, "detail": "Providing goods management system, the process of ordering, inspection, shipping, quality checking, network supplier management.\nTechnologies: ASP.NET Core, Web Api, ASP.NET MVC, Angular 7 Responsibilities: Optimize SQL query, code, maintain the system.", "company": "GROOVE TECHNOLOGY", "end_time": "2020-02-29T00:00:00Z", "industry": "High Technology", "position": "SOFTWARE ENGINEER", "conf_score": 0.9023262852737323, "start_time": "2019-01-01T00:00:00Z"}, {"id": 17306, "detail": "A peer to peer sharing marketplace website for listing and renting RVs across Canada Technologies: ASP.NET Core, Microservices architecture, Web Api, AngularJS, Stripe, AWS Services(S3, EC2, Lambda,...), RabbitMq, Hubspot, Integrate Payment Gateway (Stripe). Responsibilities: Develop booking system, insurance claim module and other priority features of the whole system.\nIntegrate the website with other 3rd party platforms\nOptimize the code to improve website performance.\nFix bugs, maintain system, code review, refactor code, deploy.", "company": "FUTURIFY CO., LTD", "end_time": "2019-01-31T00:00:00Z", "industry": "Other", "position": "SOFTWARE ENGINEER", "conf_score": 0.8986552717623872, "start_time": "2017-04-01T00:00:00Z"}], "address": null}