{"skills": ["search", "sourcetree", "css", "git", "analysis", "extjs", "mysql workbench", "angular 2", "golang", "reactjs", "linux", "redis", "search engine", "education technology", "design pattern", "mysql", "symfony", "wordpress", "io", "jquery", "angular", "electronics engineering", "swagger", "unit test", "sql", "sell", "window server", "bug fixing", "javascript", "oop", "website development", "database", "excel", "crm", "laravel", "mvc", "bootstrap", "docker", "php", "backend development", "erp system", "problem solving skill", "mongodb", "vuejs", "workbench", "management", "aws", "problem solving"], "fulltext": "NGUYEN ANH DUC\nDate of birth\n May 05, 1991\nGender  Male\nPhone\n 0963 988 388\nEmail  doanduc.love@gmail.com\nAddress\n Hanoi, Vietnam\nWebsite  https://www.facebook.com/nguyenanhduc0505\nOBJECTIVE\nI\u2019m a senior Backend developer with 10 year experience on Web development. My core skills are: - PHP\n- Mysql - NodeJS - Golang - Jquery - Reactjs - ExtJS \u2013 VueJs.I have problem solving skill, focus on how\nto make your application should work as well. Besides I can learn new things fast when needed and the\nlast lets my job history speak about the client satisfaction.\nEDUCATION\n2009 - 2013\nVinh university of technology education\nMajor: Telecommunication - Electronics Engineering Technology\nWORK EXPERIENCE\n05/2018 - Current\nNEXUS FRONTIER TECH\nFullstack Developer\n09/2016 - 05/2018\nNextech group\nFullstack Developer\n06/2014 - 09/2016\nVMODEV\nPHP Developer\n2009 - 06/2014\nFreelancer\nPHP Developer\nSKILLS\nProgramming\n- PHP, Laravel, Yii2, Symfony, CodeIgniter\n- Mysql, MongoDB, Redis\n- Javascript, Vuejs, Reactjs, Jquery and other libraly\n- Css, Bootstrap, Wave..\n- Proficient use of PHP MVC, OOP, Design Pattern, Unit Test\nDatabase\nMySql, MongoDB, Redis\nServer\n- Linux Enviroment\n- AWS (EC2, EB, SES, RDS .... )\n- Docker\nSource code management\nGIT\nOther skill\nCan work with Photoshop, Word, Excel, search engines...\nTool supports\n- Mysql workbench\n- Swagger\n- Docker\n- SourceTree\n- IDE and Editor for coding\nManagement\n- Can support members for resove problems, support PM for update\nprogress.\nPROJECTS\nvntechpedia.com (Nexusfrontier)\n(06/2019 - 07/2019)\nCustomer Vntechpedia\nDescription\n- This is the startup portal website.\nTeam size\n6\nMy position\nDeveloper\nMy responsibilities\n- Analysis and design\n- Development\n- Review code\n- Optimize code\n- Bug Fixing\n- Deploy\nTechnologies used\n- Wordpress\n- Docker\n- AWS (elasticbeanstalk, RDS)\nWASHA  (Nexusfrontier)\n(01/2019 - 06/2019)\nCustomer JAPAN\nDescription\n- ERP System - Energy manager at Africa.\nTeam size\n12\nMy position\nDeveloper\nMy responsibilities\n- Analysis and design\n- Development\n- Review code\n- Optimize code\n- Bug Fixing\n- Deploy\n- Suport members\n- Integrate CI/CD\nTechnologies used\n- Laravel, ReactJs, MySql, Redis, Aws, Docker\nNexty 2  (Nexusfrontier)\n(08/2018 - 12/2019)\nCustomer Thailan\nDescription\nLogictics backend \u2013 frontend version 2 for GRAB\nTeam size\n10\nMy position\nDeveloper\nMy responsibilities\n- Analysis and design\n- Development\n- Review code\n- Optimize code\n- Bug Fixing\n- Deploy\n- Suport members\n- Integrate CI/CD\nTechnologies used\n- Nodejs, ReactJs, MySql, Redis, Aws, Docker\nNexty 1   (Nexusfrontier)\n(06/2018 - 08/2018)\nCustomer Thailan\nDescription\nLogictics backend - frontend\nTeam size\n11\nMy position\nDeveloper\nMy responsibilities\n- Analysis and design\n- Development\n- Review code\n- Optimize code\n- Bug Fixing\n- Deploy\n- Suport members\n- Integrate CI/CD\nTechnologies used\n- Nodejs, ReactJs, MySql, Redis, Aws, Docker\nNexusfrontier   (Nexusfrontier)\n(05/2018 - 06/2018)\nCustomer Nexusfrontier\nDescription\nCMS manament\nTeam size\n2\nMy position\nDeveloper\nMy responsibilities\n- Analysis and design\n- Development\n- Review code\n- Optimize code\n- Bug Fixing\n- Deploy\n- Suport members\n- Integrate CI/CD\nTechnologies used\n- Laravel, ReactJs, MySql, Redis, Aws, Docker\nMonterhunt    (Nexusfrontier)\n(05/2018 - 01/2019)\nCustomer Singapore\nDescription\nAPI logic for game\nTeam size\n2\nMy position\nDeveloper\nMy responsibilities\n- Analysis and design\n- Development\n- Review code\n- Optimize code\n- Bug Fixing\n- Deploy\n- Suport members\n- Integrate CI/CD\n- Maintain\nTechnologies used\n- Lumen, AWS\nWetrade.global    (Nextech GROUP)\n(2016 - 2018)\nCustomer\nProduct of company\nDescription\nCrypto exchanges\nTeam size\n2\nMy position\nDeveloper\nMy responsibilities\n- Analysis and design\n- Development\n- Review code\n- Optimize code\n- Bug Fixing\n- Deploy\n- Suport members\n- Integrate CI/CD\n- Maintain\nTechnologies used\n- Laravel, Vuejs, Nodejs, MySql, Mongodb, Redis, AWS\nverime.io (Nextech GROUP)\n(2017 - 2018)\nCustomer\nProduct of company\nDescription Crypto\nTeam size\n4\nMy position\nDeveloper\nMy responsibilities\n- Analysis and design\n- Development\n- Review code\n- Optimize code\n- Bug Fixing\n- Deploy\n- Suport members\n- Integrate CI/CD\n- Maintain\nTechnologies used\n- Laravel, Vuejs, Nodejs, MySql, Mongodb, Redis, AWS\nLolly-admin-manage   (VMODEV)\n(2015 - 2016)\nCustomer Singapore\nDescription\nAdmin manage and api for app dating\nTeam size\n9\nMy position\nDeveloper\nMy responsibilities\n- Analysis and design\n- Development\n- Review code\n- Optimize code\n- Bug Fixing\n- Deploy\n- Suport members\n- Maintain\nTechnologies used\n- Codeigniter, Vuejs, MySql, AWS\n3BD-CRM    (VMODEV)\n(2015 - 2016)\nCustomer Singapore\nDescription CRM\nTeam size\n6\nMy position\nDeveloper\nMy responsibilities\n- Analysis and design\n- Development\n- Review code\n- Optimize code\n- Bug Fixing\n- Deploy\n- Suport members\n- Maintain\nTechnologies used\n- Codeigniter, JQuery, MySql, AWS\nEMO.LI (VMODEV)\n(2015 - 2016)\nCustomer Singapore\nDescription CRM\nTeam size\n6\nMy position\nDeveloper\nMy responsibilities\n- Analysis and design\n- Development\n- Review code\n- Optimize code\n- Bug Fixing\n- Deploy\n- Suport members\n- Maintain\nTechnologies used\n- Laravel, Angular 2, MySql, AWS\nmyjobsshop (VMODEV)\n(2017 - 2017)\nCustomer Singapore\nDescription CRM\nTeam size\n15\nMy position\nDeveloper\n- Analysis and design\n- Development\n- Optimize code\nMy responsibilities\n- Bug Fixing\n- Deploy\n- Suport members\n- Maintain\nTechnologies used\n- Codeigniter, JQuery, MySql, AWS\nmechanicsmarketplace (VMODEV)\n(2015 - 2016)\nCustomer USA\nDescription c2c\nTeam size\n8\nMy position\nDeveloper\nMy responsibilities\n- Analysis and design\n- Development\n- Optimize code\n- Bug Fixing\n- Deploy\n- Suport members\n- Maintain\nTechnologies used\n- Codeigniter, JQuery, MySql, AWS\nWeb sell sim (Freelancer)\n(2010 - 2014)\nCustomer Vietnam\nDescription Ecommerce\nTeam size\n1\nMy position\nDeveloper\nMy responsibilities\n- Analysis and design\n- Development\n- Optimize code\n- Bug Fixing\n- Deploy\n- Maintain\nTechnologies used\n- Codeigniter, JQuery, MySql, Linux server\nWeb game crm  (Freelancer)\n(2009 - 2014)\nCustomer Vietnam\nDescription\nCRM \n- Share source code in:\nhttp://www.clbgamesvn.com/diendan/showthread.php?t=221704\nTeam size\n1\nMy position\nDeveloper\nMy responsibilities\n- Analysis and design\n- Development\n- Optimize code\n- Bug Fixing\n- Deploy\n- Maintain\nTechnologies used\n- Codeigniter, JQuery, MySql, SQL, MongoDB, Linux server, Window server,\nAngular 1,\nOze.vn  (Startup)\n(2012 - 2014)\nCustomer\nMy project\nDescription Dating\nTeam size\n1\nMy position\nDeveloper\nMy responsibilities\n- Analysis and design\n- Development\n- Optimize code\n- Bug Fixing\n- Deploy\n- Maintain\nTechnologies used\n- Codeigniter, JQuery, MySql, SQL, MongoDB, Linux server, Window server,\nAngular 1\nINTERESTS\nI like games, music..\n\u00a9 topcv.vn", "educations": [{"id": 5181, "gpa": null, "major": "C\u00f4ng ngh\u1ec7 k\u1ef9 thu\u1eadt \u0111i\u1ec7n t\u1eed \u2013 vi\u1ec5n th\u00f4ng", "school": "Vinh university of technology education", "diploma": "Bachelors", "end_time": "2013-01-01T00:00:00Z", "conf_score": 0.902768374209996, "start_time": "2009-01-01T00:00:00Z", "picklist_major": "Technical", "major_categories": "C\u00f4ng ngh\u1ec7 k\u1ef9 thu\u1eadt", "major_categories_detail": "C\u00f4ng ngh\u1ec7 k\u1ef9 thu\u1eadt \u0111i\u1ec7n, \u0111i\u1ec7n t\u1eed v\u00e0 vi\u1ec5n th\u00f4ng"}], "experiences": [{"id": 17326, "detail": "", "company": "NEXUS FRONTIER TECH", "end_time": "2023-04-13T00:00:00Z", "industry": "High Technology", "position": "Fullstack Developer", "conf_score": 0.8631704815300311, "start_time": "2018-05-01T00:00:00Z"}, {"id": 17329, "detail": "", "company": "Nextech group", "end_time": "2018-05-31T00:00:00Z", "industry": "High Technology", "position": "Fullstack Developer", "conf_score": 0.9404253900297244, "start_time": "2016-09-01T00:00:00Z"}, {"id": 17332, "detail": "", "company": "VMODEV", "end_time": "2016-09-30T00:00:00Z", "industry": "Other", "position": "PHP Developer", "conf_score": 0.9404253900297244, "start_time": "2014-06-01T00:00:00Z"}, {"id": 17334, "detail": "", "company": "VMODEV", "end_time": "2014-06-30T00:00:00Z", "industry": "Other", "position": "Freelancer\nPHP Developer", "conf_score": 0.703054895247018, "start_time": "2009-01-01T00:00:00Z"}], "address": "Hanoi, Vietnam"}