{"skills": ["management tool", "manual testing", "sourcetree", "css", "testing", "automation", "angular 2", "automation test", "jira", "html", "mai", "education technology", "bitbucket", "mysql", "wordpress", "io", "angular", "writing test case", "selenium", "postman", "test data", "macos", "javascript", "database", "elixir", "laravel", "frontend development", "php", "android", "angularjs", "tester", "postgresql", "management", "waste management"], "fulltext": "Pham Mai My \nEnglish name: Bell Pham \nEmail:  phammaimy1994@gmail.com \nPhone number: 0909 581 520 \nGender: Female \nAddress: District 9, HCM city, Viet Nam \nPosition Applied: QA/Tester \nOverview \n\u25cf\n2.5 years in IT industry, 1 years in developer, 1.5 years in QA \n\u25cf\nExperience in working with English and Australian partners in current job \n\u25cf\nExperience in working with many management tools: Bitbucket, Sourcetree, FileZilla, \nJIRA, . . . \n\u25cf\nExperience in working with outsourcing environment \n\u25cf\nExperience in working with foreigner \n\u25cf\nAbility to build websites \n\u25cf\nCan communicate in English  \n\u25cf\nReason for leaving: everything is at stable stage \n\u25cf\nTherefore, I looks out for challenges in another environment. \n\u25cf\nExpected salary: from $800 Net \n\u25cf\nNotice period: at least 30 days \nSummary \n\u25cf\n2.5 years using Bitbucket, Jira, sourcetree, . . . \n\u25cf\n1 year of experience in JavaScript, CSS, and HTML programming language using \nframework AngularJS, Angular 2 \n\u25cf\n6 months of experience in Php using framework Laravel \n\u25cf\n1 year of experience in Wordpress  \n\u25cf\n1 year of experience in testing manual test & automation test using Selenium \n\u25cf\nSupport team to find out bugs \n\u25cf\n2.5 years working with English documents \n\u25cf\nUnderstanding requirement from clients \nCareer summary \nApril 2016 - October 2016:\nKerofrog \nFresher Backend PHP Developer  \nOctober 2016 - Feb 2018:\nZentech \nFrontend Developer \nMarch 2018 - Now:\nThe App Team Viet Nam \nTester & Administrator  \nExperience \nTester: \nProject: Go Team \nProject description: \n-\nGo Team app features a unique follow arrow that helps guide teams to their waypoints. \nOnce members arrive at their destination, GPS-triggered challenges are issued to the \nteams in the form of questions, clues, and pictures that they will work on together to \ncomplete. Updates, feedback and scores are kept in real-time as teams progress \nthrough their amazing race. Back at home base, each team is monitored and can receive \nbonus missions at key points in their adventure. \nPosition: Tester \nMy Responsibility:  \n-\nUnderstanding requirements of project \n-\nWriting test cases, test results \n-\nCheck data from backend using Postman \n-\nWriting test cases to test data from backend by Postman \n-\nTest manual: \n-\n Website admin \n-\nApp of customer on mobile & tablet (iOS & android) \n-\nAutomation test: \n-\nWriting functional test cases using framework Selenium \n-\nReport bugs using Jira \n-\nRestore functions test into Bitbucket \n-\nUsing Sourcetree to pull automation test code \nProject: Handel\nProject description:  \nHandel-Driver: a service sharing app for waste management, providing quick and quality \nservice, and on-demand delivery \nHandel-Customer: Bringing waste management into the digital age, the handel: App is the \nsimplest way to purchase a waste removal service. \nPosition: Tester \nMy Responsibility:  \n-\nUnderstanding requirements of project \n-\nWriting test cases, test results \n-\nCheck data from backend using Postman \n-\nWriting test cases to test data from backend by Postman \n-\nTest manual: \n-\n Website admin contractor \n-\nWebsite admin customer \n-\nApp for customer on mobile (iOS & android) \n-\nApp for driver on mobile (iOS & android) \n-\nAutomation test: \n-\nWriting functional test cases for web admin contractor & customer using \nframework Selenium \n-\nReport bugs using Jira \n-\nRestore functions test into Bitbucket \n-\nUsing Sourcetree to pull automation test code \nProject: Dementia \nProject description: this is app to help someone improve their memory, help dementia patient. \nPosition: Tester \nMy Responsibility:  \n-\nUnderstanding requirements of project \n-\nWriting test cases, test results \n-\nTest manual: \n-\nApp on tablet (iOS & android) \n-\nReport bugs using Jira \nProject: VisitorPoint \nProject description:  \nVisitorPoint is New Zealand\u2019s only national distributor of tourism information, having distributed \nbrochures throughout New Zealand for more than 30 years. \nPosition: Tester \nMy Responsibility:  \n-\nUnderstanding requirements of project \n-\nWriting test cases, test results \n-\nCheck data from backend using Postman \n-\nTest manual: \n-\nWebsite admin \n-\nApp for customer on tablet (iOS & android) \n-\nAutomation test: \n-\nWriting functional test cases for web admin using framework Selenium \n-\nReport bugs using Jira \n-\nRestore functions test into Bitbucket \n-\nUsing Sourcetree to pull automation test code \nAcademic Background \n2012-2016: \nInformation Technology Major \nHCMC University of Technology & Education \nTECHNICAL SKILLS \n\u2022 OS: Win7/Win8/Win10, MacOS \n\u2022 Languages: Php, Elixir, JavaScript, CSS, HTML \n\u2022 Databases: MySQL, PostgreSQL \n\u2022 Packages: Google tools as Docs, Sheets, Calendar, G-drive; Wordpress ", "educations": [{"id": 5184, "gpa": null, "major": "C\u00f4ng ngh\u1ec7 th\u00f4ng tin", "school": "HCMC University of Technology & Education", "diploma": "Bachelors", "end_time": "2016-01-01T00:00:00Z", "conf_score": 0.9260889292191576, "start_time": "2012-01-01T00:00:00Z", "picklist_major": "IT - Hardware/Networking", "major_categories": "M\u00e1y t\u00ednh v\u00e0 c\u00f4ng ngh\u1ec7 th\u00f4ng tin", "major_categories_detail": "C\u00f4ng ngh\u1ec7 th\u00f4ng tin"}], "experiences": [{"id": 17336, "detail": "", "company": "The App Team Viet Nam", "end_time": "2023-04-13T00:00:00Z", "industry": "Other", "position": "Tester & Administrator", "conf_score": 0.902768374209996, "start_time": "2018-03-01T00:00:00Z"}, {"id": 17337, "detail": "", "company": "Zentech", "end_time": "2018-02-28T00:00:00Z", "industry": "High Technology", "position": "Frontend Developer", "conf_score": 0.7851615749618549, "start_time": "2016-10-01T00:00:00Z"}, {"id": 17338, "detail": "", "company": "Kerofrog", "end_time": "2016-10-31T00:00:00Z", "industry": "Other", "position": "Fresher Backend PHP Developer", "conf_score": 0.7851615749618549, "start_time": "2016-04-01T00:00:00Z"}], "address": "District 9, Hcm city, Viet Nam"}