{"skills": ["search", "management tool", "management", "multitasking", "css", "json", "java", "git", "analysis", "jira", "process development", "structure", "reactjs", "html", "linux", "ajax", "kibana", "redis", "ubuntu", "xhtml", "mysql", "bitbucket", "scrum master", "kubernetes", "jquery", "class", "sql", "c#", "xampp", "logstash", "oop", "javascript", "apache", "database", "database design", "cisco", "project control", "laravel", "mvc", "object oriented", "docker", "operation system", "php", "software development", "teamwork", "recruitment", "centos", "unix", "medium"], "fulltext": "CURRICULUM VITAE \nPERSONAL INFORMATION   \n\u2022 Full name: Diep Van Hao \n\u2022 Date of Birth: 28/4/1984 at Dong Thap Province. \n\u2022 Email: diepvanhao@gmail.com \n\u2022 Phone: 0933 49 29 89 \n\u2022 Current Address: 20/10 Street 77, Tan Quy Ward, Dist 7, HCM City. \n EDUCATION AND TRAINING \nYear  Degree  Rank  University \n12/2010 \nBachelor of Science in Information  \nTechnology - specialized in Software \nEngineering \nGood \nVietnam National University \n\u2013 Ho Chi Minh City - \nUniversity of Science \n2005 \nCCNA (Cisco Certified Network \nAssociate) \nSaigon City \n2018 \nCertified Middle Management \nPACE \nFOREIGN LANGUAGES (ENGLISH) \nSkills  Level \nReading  Good \nWriting  Good \nSpeaking  Moderate \nListening  Moderate \nOBJECTIVE: \n\u00a7 Working in a professional, active and fairly competitive environment and having \nopportunities to get promotion. \n\u00a7 Becoming a CTO in coming 2 years. \nSKILLS \nv Technical skills: \no Basic knowledge \n\u00a7 Software development process \n\u00a7 Object Oriented Programming \n\u00a7 MVC model, 3-layer model \n\u00a7 Web/win form application developing \n\u00a7 Analyzing and designing database. \n\u00a7 Linux \no Programming languages: \n\u00a7 PHP programing language and related technology: \n\u2022 OOP Programing, CSS/HTML/XHTML \n\u2022 Javascript: Ajax, Json, Jquery, Motools \n\u2022 Frameworks: Zend Framework, Smarty, Cake PHP, Laravel, CI \n\u2022  Tools: Xamp, Wamp,  Appserv,CentOS \n\u2022 Database: Mysql, Ms SQL \n\u00a7 Other programing languages:  \n\u2022 C, C#, Java \n\u00a7 Operation system: Unix/Linux \nv Soft skills: \n\u00a7 Good team work  \n\u00a7 Good at presentation \n\u00a7 Capable of working and functioning independently  \n\u00a7 Fast learning, quick to adapt, capable of multitasking, high performance \nteamwork, self-motivated, having confidence in communication and full \nawareness of responsibility  \n\u00a7 Excellent communication, especially in human relations \nWORK EXPERIENCE \nv YouNet Company (Neerly 3 years)  \nParticipated in various projects, applied a wide knowledge base in building websites \nand web-plugins:  \n\u00a7 Position: Developer \n\u00a7 Task:  \nAnalyzing client\u2019s request include back-end, front-end and \nimplementing one by using multiple technologies such as : PHP, \nMySQL, Javascript (MooTools and jQuery), Apache, Linux, \nXampp/Wamp etc., developing front-end using CSS and \nHTML/XHTML  \n\u00a7  Framework using : Zend, Smarty \nSome of project joined:  \nwww.360guanxi.com, \n www.ibook21.com \n http://www.phpfoxdev.thecarcommunity.net/ \nwww.studentozdoc.com.au \nwww.droober.com \u2026 \nv Audience Media Company (1 year)  \n\u00a7 Position: Senior Developer \n\u00a7 Task: Analyzing client\u2019s request include back-end, front-end and \nimplementing code new features/functions and fix bugs for cms system \nof company \n\u00a7 Framework: ezPublish (cms) \nSome of project joined:  \nwww.udon.es \nhttp://www.demo-africa.com/ \nv Evolable Asia Company (2 years) \n\u00a7 Position: Project leader \n\u00a7 Task: Receive requests directly from the boss (text or meeting \ndiscussion), I\u2019ll analysis and design structure of project, design database, \nclass, interface (main page ,subpage) . Device task for members to \nimplement it. \n\u00a7  I also joined to write code for project, control project \u2026I have been \nsuccess for 2 projects. \n\u00a7 Framework: Smarty,CI \nv 24h.com.vn (3 months) \n\u00a7 Position: Senior Developer \n\u00a7 Task: Implement to write API to refactor old system. \n\u00a7 Framework: 24h.com.vn \n\u00a7 Project: deca.vn (closed) \nv Rebus Technologies (9/2016 \u2013 present) \n\u00a7 Position: Team Leader. \n\u00a7 Task: Manage team members, Control projects, Devide and Assign tasks \nto members, Scrum master, Support technical for team, Support issues \ninvolve to server with sys-admin. Decide technical/technologies for \nproject/task. Design structure, Plan, Refactor project by Microservice \nArchitecture. Participate in recruitment, interview and training \ncandidates. \n\u00a7 Technologies: Kubernetes, Docker, ELK(Elastic Search, Logstash, \nKibana), KONG gateway, Redis \u2026 \n\u00a7 Framework: Laravel Lumen, ReactJs \n\u00a7 Environment: Ubuntu \n\u00a7 Management tool: Jira, Bitbucket, Git \n\u00a7 Projects: About betting, online casino. \nPowered by TCPDF (www.tcpdf.org)", "educations": [{"id": 5194, "gpa": null, "major": "K\u1ef9 thu\u1eadt ph\u1ea7n m\u1ec1m", "school": "Vietnam National University", "diploma": "Bachelors", "end_time": "2010-12-01T00:00:00Z", "conf_score": 0.8122392616024098, "start_time": null, "picklist_major": "IT - Hardware/Networking", "major_categories": "M\u00e1y t\u00ednh v\u00e0 c\u00f4ng ngh\u1ec7 th\u00f4ng tin", "major_categories_detail": "M\u00e1y t\u00ednh"}], "experiences": [{"id": 17376, "detail": "in recruitment, interview and training candidates.\n\u00a7 Technologies: Kubernetes, Docker, ELK(Elastic Search, Logstash, Kibana), KONG gateway, Redis ... \u00a7 Framework: Laravel Lumen, ReactJs \u00a7 Environment: Ubuntu \u00a7 Management tool: Jira, Bitbucket, Git \u00a7 Projects: About betting, online casino.", "company": "Rebus Technologies", "end_time": "2023-04-13T00:00:00Z", "industry": "High Technology", "position": "Team Leader", "conf_score": 0.8102286400108711, "start_time": "2016-09-01T00:00:00Z"}], "address": "20/10 Street 77, Tan Quy Ward, Dist 7, Hcm City"}