{"skills": ["javascript", "c#", "management", "studio", "microsoft azure", "self learning", "entity framework", "elasticsearch", "analysis", "html", "redis", "sell", "rabbitmq", "asp", "sql", "css", "restful", "visual studio", "github", "bug fixing", "microsoft", "mvc", "reactjs", "oracle", "wcf", "gms", "azure", "problem solving", "jquery"], "fulltext": "Male\nMay 21, 1998\n0394563707\n16521309@gm.uit.edu.vn\nHo Chi Minh, Vietnam\nfb.com/trung.dq98\n\u0110\u1eb7ng Qu\u1ed1c Trung\nJunior .NET Developer\n//WORK EXPERIENCE\nC\u00d4NG TY TH\u1ebe GI\u1edaI DI \u0110\u1ed8NG\nMay 2019 - July 2019\nBack-end fresher (.NET)\nMain responsibilities:\n- Using HTML, CSS, jQuery, Javascript, C# to write ASP.NET\nweb applications\n- Studying to work with Elasticsearch, Redis, RabbitMQ \n- Writing APIs and RESTful Web Services (WCF and ASMX\nservices) in ASP.NET\n- Working with IIS\n//SCHOOL PROJECTS\nE-COMMERCE WEBSITE (April 2019 - June 2019)\nCustomer undefined\nDescription\n- Url: https://soushop.azurewebsites.net/\n- Source code: https://github.com/quoctrung98/onlineshop\n- An e-commerce website to sell electronic products.\n- Website's CMS\nTeam size\n1\nMy position\nDeveloper\nMy responsibilities\n- Analysis and design\n- Development\n- Bug Fixing\nTechnologies used\n- .NET Framework\n- Visual Studio 2019, SQL Server Management 2014\n- ASP.NET MVC 5, Entity Framework\n- Microsoft Azure Hosting (Student Account)\n- IIS\nBOOKSTORE MANAGEMENT APPLICATION (November 2018 - December 2018)\nCustomer undefined\nDescription\n- Source code:\nhttps://github.com/quoctrung98/book_store_management\n- An application to management a bookstore.\nTeam size\n3\nMy position\nDeveloper\nMy responsibilities\n- Analysis and design\n- Development\n- Bug Fixing\nTechnologies used\n- .NET Framework\n- Visual Studio 2017, SQL Server Management 2014, \nEntity Framework, WPF\nEnglish (Reading and Listening)\nEnglish (Writing and Speaking)\nLogical thinking and creative\nSelf-learning\nProblem solving\n//SKILLS\n- C#\n- SQL Server, Oracle\n- HTML, CSS, jQuery, Javascript\n- ReactJS (Learning...)\n//PROGRAMMING \"LANGUAGE\"\nSeptember 2016 - September 2020\nUniversity of Information and\nTechnology - Viet Nam National\nUniversity\nMajor: System Information\nGPA: 3.5/4 (7.8/10)\n//EDUCATION\n\u00a9 topcv.vn", "educations": [{"id": 5201, "gpa": "3.5", "major": "H\u1ec7 th\u1ed1ng th\u00f4ng tin", "school": "University of Information and Technology - Viet Nam National University", "diploma": "Bachelors", "end_time": "2020-09-01T00:00:00Z", "conf_score": 0.8716506015196835, "start_time": "2016-09-01T00:00:00Z", "picklist_major": "IT - Hardware/Networking", "major_categories": "M\u00e1y t\u00ednh v\u00e0 c\u00f4ng ngh\u1ec7 th\u00f4ng tin", "major_categories_detail": "M\u00e1y t\u00ednh"}], "experiences": [{"id": 17396, "detail": "ain responsibilities:\n- Using HTML, CSS, jQuery, Javascript, C# to write ASP.NET web applications\n- Studying to work with Elasticsearch, Redis, RabbitMQ - Writing APIs and RESTful Web Services (WCF and ASMX services) in ASP.NET - Working with IIS", "company": "C\u00d4NG TY TH\u1ebe GI\u1edaI DI \u0110\u1ed8NG", "end_time": "2019-07-31T00:00:00Z", "industry": "Other", "position": "Back - end fresher (.NET)", "conf_score": 0.8280054682797672, "start_time": "2019-05-01T00:00:00Z"}], "address": "Ho Chi Minh, Vietnam"}