{"skills": ["linux", "internet", "java", "json", "futures", "ams", "rest", "studio", "unit test", "git", "retrofit", "mvp", "medium", "android", "design pattern", "oop", "github", "bug fixing", "database", "parsing", "macos", "php", "singleton"], "fulltext": "TRAN VAN TUAN\nDate of birth:\n June 13, 1997\nGender:  Male\nPhone:  0339488996\nEmail:  tuantran.dev97@gmail.com\nAddress:\n Nha Trang, Vietnam\nWebsite:  https://github.com/TuanHarry\nOBJECTIVE\nI am Software Engineer has 6-month experience in mobile application development using Android technology. I\nthink I can complete all task the company assigned for me and I want to learn more skill technical and soft skill\ncan become senior in the future.\nEDUCATION\nSep 2015 - Aug 2019\nNha Trang University\nMajor: Software Engineer\nGPA: 6.7/10\nWORK EXPERIENCE\nFeb 2018 - Sep 2018\nHamado LTD\nFresher Android Developer\nMain responsibilities:\n- Develop the application of music app\n- Working/parsing with JSON \n- Working with REST API\n- Create design\n- Using Git to follow and manage working progress\nSKILLS\nProgramming\n- Android development\n- Having knowledge basic PHP\n- Knowledge Thread, Handler\n- Knowledge REST API working with Retrofit, Volley\n- Knowledge OOP and design pattern as Singleton \n- Using GIT\n- Using programming tools like Android Studio\nSoft Skill\n- Team working\n- Honesty, eager to learn new things, progressive\nOperating\n- Linux, Window, MacOS\nLanguage\n- English: Able to read document in English\nINTERESTS\nI like music, technological products\nPROJECTS\nBANG B2\n(Apr 2018 - May 2018)\nCustomer\nViet Nam\nDescription\n- This application helps user learning license driving and made a test on your\nphone.\nTeam size\n4\nMy position\nAndroid Developer\nMy responsibilities\n- Development\n- Bug Fixing\n- Execute system test\nTechnologies used\n- Android Studio 2.3, Java, support Android 5.0 and over\n- Realm database\nPODY TUNES\n(May 2018 - Jul 2018)\nCustomer\nViet Nam\nDescription\n- This application listens to podcast from the internet.\nTeam size\n2\nMy position\nAndroid Developer\nMy responsibilities\n- Development\n- Bug Fixing\n- Optimize code\n- Create Units test\nTechnologies used\n- Android Studio 2.3, Java, support Android 5.0 and over\n- Realm database\n- REST API with Retrofit\n- Using model MVP \n- Download Manager \n- Thread \nKATRINA MUSIC\n(Aug 2018 - Sep 2018)\nCustomer\nViet Nam\nDescription\n- This application listen music with like data from Spotify, Youtube, ...\nTeam size\n4\nMy position\nAndroid Developer\nMy responsibilities\n- Development\n- Bug Fixing\n- Execute system test\nTechnologies used\n- Android Studio 2.3, Java, support Android 5.0 and over\n- Realm database\n- REST API with Retrofit\n- Using model MVP \n- Download Manager\n- Notification Manager\n- Media Store, Service", "educations": [{"id": 5213, "gpa": "6.7", "major": "Software Engineer", "school": "Nha Trang University", "diploma": "Bachelors", "end_time": "2019-08-01T00:00:00Z", "conf_score": 0.9008202262261839, "start_time": "2015-09-01T00:00:00Z", "picklist_major": "Other", "major_categories": "", "major_categories_detail": ""}], "experiences": [{"id": 17446, "detail": "Main responsibilities:\n- Develop the application of music app\n- Working/parsing with JSON - Working with REST API - Create design\n- Using Git to follow and manage working progress", "company": "Hamado LTD", "end_time": "2018-09-30T00:00:00Z", "industry": "Other", "position": "Fresher Android Developer", "conf_score": 0.7897513794629749, "start_time": "2018-02-01T00:00:00Z"}], "address": "Nha Trang, Vietnam"}