{"skills": ["stack", "sc", "angular", "css3", "internet", "java", "javascript", "rxjs", "ams", "gitlab", "redux", "frontend development", "git", "html5", "typescript", "css", "oop", "github", "styled component", "reactjs", "communication skill", "twitter", "database", "game development", "teamwork", "bootstrap", "lua", "mysql", "jquery"], "fulltext": "BUI ANH HUY \n Front-end Developer \nPhone: (+84) 933 255 110 \nEmail: anhhhuydayne@gmail.com \nSUMMARY \nI learned Front-end developer at Cybersoft Academy about building web \napplication (ReactJS, Angular), with good knowledge of Reactive Programming. \nI am studying at FPT University HCMC for bachelor degree of IT (From 09/2018). \nI love learning new technologies and building valuable application that helps \nothers with their work. I\u2019m considered a team-player because I like to help other \nand tend to work well within the group. \nTECHNICAL SKILLS \n\uf0b7 Programming Languages:  \n- HTML5, CSS3, SCSS \n- JavaScript, TypeScript \n- Java, OOP \n\uf0b7 Frameworks / Platforms: \n- ReactJS, Angular \n- Redux, RxJS \n- Angular Material, Twitter \nBootstrap, styled-\ncomponent \n-  jQuery \n\uf0b7 Foreign Languages: \nEnglish (listening, reading, \nwriting, speaking) \n\uf0b7 Version Control: \n- Git, GitHub, GitLab \n\uf0b7 Soft Skills: \n- Teamwork \n- Technical communication \n- Highly adaptable \n\uf0b7 Others: \n- Good communication skills \n- Can read Document and Requirements fast and efficiently \n- Always has an urge in researching and learning efficient ways to \napproach the problems. \nPERSONAL EXPERIENCE \nMay 22 2019 \u2013 June 30 2019: \nProject: GTA V ROLEPLAY FIVEM SERVER  \n- Position: CTV full-stack game developer \n- Description: This was the first reality project i have done. It used \nmySQL for database and my job was full stack from interact with server \nto client function. It was hard for a fresher like me to do a full-stack job \nwith technologies i have never used before (Lua, mySQL, Gitlab). But i \nstill try to learn so that from 1 - 2 weeks and then i can work better and \nbetter to done this project. \n- Technologies Used: Lua, MySQL, Gitlab, HTML5, CSS, Javascript \n- Team Size: 5 \nPASTIMES ACTIVITIES \n\uf0b7 I have made some projects about front end web and some stuff that I have \nstudied from academy and university ( https://github.com/huydwayne ). \n\uf0b7 I read a lot news and skill from the internet like techtalk.vn and blogger \ntoidicodedao so that I have learned some soft skill in programming and \nimprove my programming skills. \n\uf0b7 I took part in ACM Contest for 12th grade students whole city and ranked 3. \n\uf0b7 I took part in ACM Contest at my university and ranked 11/30. ", "educations": [{"id": 5223, "gpa": null, "major": null, "school": "FPT University HCMC", "diploma": "Bachelors", "end_time": "2018-09-01T00:00:00Z", "conf_score": 0.8735553425188407, "start_time": null, "picklist_major": "Other", "major_categories": "", "major_categories_detail": ""}], "experiences": [{"id": 17467, "detail": "Description: This was the first reality project i have done. It used\nmySQL for database and my job was full stack from interact with server to client function. It was hard for a fresher like me to do a full-stack job with technologies i have never used before (Lua, mySQL, Gitlab). But i still try to learn so that from 1 - 2 weeks and then i can work better and better to done this project.\n- Technologies Used: Lua, MySQL, Gitlab, HTML5, CSS, Javascript - Team Size: 5", "company": "GTA V ROLEPLAY FIVEM SERVER", "end_time": "2019-06-30T00:00:00Z", "industry": "Other", "position": "CTV full - stack game developer", "conf_score": 0.9432855236286497, "start_time": "2019-05-22T00:00:00Z"}], "address": null}