{"skills": ["vehicle routing", "java", "microservices", "git", "c++", "analysis", "blackberry", "golang", "internet", "visualization", "fusioncharts", "highcharts", "google chart", "structure", "reactjs", "linux", "google cloud function", "redis", "es6", "scrum master", "cloud sql", "redux", "compute", "cloud function", "nosql", "unit test", "sql", "le", "sql query", "jest", "responsive", "javascript", "database", "compute engine", "cloud service", "many core", "object oriented", "bootstrap", "docker", "cloud", "sequelize", "workflow", "frontend development", "data visualization", "rethinkdb", "teamwork", "tdd", "android", "operating system", "angularjs", "graphql", "mongodb", "orm", "google cloud", "problem solving"], "fulltext": "Nguyen Binh Nguyen\nSoftware Engineer\nEXPERIENCE\nRingblaze, Texas, US ( Full-time remote)\n- Software Engineer\nJAN 2018 - PRESENT\n- Building the profes sional phone system for business. Implemented 40%\nfunctionals of the system, includes :\nBackend APIs using NodeJS, Sequelize ORM on PostgresDB.\nFrontend using React JS /Graphql.\nMobile app Android andioS using ReactNative.\n- Interview candidates to build the dev team of 3.\n- Adopt the TDD process which covered the tested code to 95 %.\n- Write tools which currently helps to save more than 20 minutes of each\ndeveloper/day.\n- Do the code review on every pullrequests.\nAgencyRevolution, HCM, VN - Software Engineer\nJAN 2017 - JAN 2018\nFamiliar working with Google Cloud services: Kubernertes, Cloud\nFunction, Pub/Sub, Logging.\n- Implement the parts of a high scale Microservices system, includes:\nDesign the APls, the microservices workflow then implement in\nGolang and Nodejs.\nFrontend development using ReactJS/ Redux/ FlowJS/ ImmutableJs.\nAdopted DraftJS to build the WYsiwYG postcard builder within a\nrequest queue.\nWrite reusable NosQL query on RethinkDB and Redis.\nWrite code for the monitoring service, collecting the logs and send\nto InfluxDB or Slack.\nImplement 2 public webhooks by Google Cloud Function.\nWrite the unit test; integration test follows the TDD process.\n- On call for any incident may happen during the night.\n- Develop and maintain 2/6 open APIs written in Golang which were\nreceiving hundreds of thousands of requests every day from the\npartners.\n- Identifying and resolving performance and scalability issues.\n- In the role of a cross-functional developer in a Scrum team\n- Do the code review, mob programming and pair programming.\n- Were developing many core soft skils under the high working pressure:\nteamwork, negotiating, problem -solving, helpful code review.\nTECHNICAL SKILLS\n- Languages: Javascript ES6 with\nNodeJS/ ReactJS/ Redux/ Flow/ Jest,\nReactNative, AngularJS 1. Golang.\n- Google Cloud services:\nKubemetes, Pub/Sub, SQL, Cloud\nFunction, Compute Engine,\nLogging, Storage.\n- Databases: Sequelize ORM\n(Postgres), Waterline ORM\n(MongoDB), RethinkDB, InfluxDB,\nRedis.\n- Dev tools: Docker, Git, Vim editor,\nDebuggers, Mac/Linux CLIS\nAWARDS\nBuild a practical Vehicle Routing\nSolver, hosted by Honestbee - Nov\n2016. As a team of 3, we won the ist\nprize in this hackathon.\nREFERENCES\nMr. Le Thanh Thuong - Former\nData Architecture & Analysis Manager\nat ME Corporation\nhttps://vn.linkedin.com/in/th\u01b0\u01a1ng\n-l\u00ea-thanh-a8938567\nMr. Victor Andres Aguirre\nFernandez - Former Product\nDevelopment Manager at Memeapp\nhttps://tw.linkedin.com/in/victorag\nuirref/en\nSonice.vn, HCM, VN - Lead Developer\nJAN 2016 - JAN 2017\nHiring the dev team of 5, learning Scrum and apply to the product\ndevelopment.\nAs a Scrum Master, training team member to able to work.\nJoin \"The design sprint\" (http://www.gv.com/sprint/) to defining\nthe product.\nResponsible for the development of 2 company products: a market place\n- memeapp.co and an e-commerce site - sonice.vn, includes:\nImplement backend APIs using NodeJS, Waterline ORM on\nMongoDB.\nImplement Frontend Progressive Web Apps using Google Polymer.\nME Corporation, HCM, VN - Software Engineer\nSEP 2013 - DEC 2015\nLead the frontend team, work with the backend team to define the data\nmodel and build the APIs, monitor the app and optimizing.\n- Creating complex, responsive UI with JS and Bootstrap\n- Adopt AngularJS 1.0 to create the app running on Chrome, Firefox and\nInternet Explorer.\n- Implement the real-time data visualization with Highcharts,\nFusioncharts, Google charts over Socketio.\nNCT Corporation, HCM, VN - Mobile Application Developer\nJAN 2013 - AUG 2013\nCreated a music application on BlackBery 1o.\n- Write in C++ on Cascade framework.\n- Design the app structure follows the object-oriented programming.\nReference: https://appworld.blackberry.com/webstore/content/2897089o\nFPT Software, Da Nang, VN - Inte rnship Java Developer\nJUL 2012 - DEC 2012\nIntern Java developer in a Japan outsourcing project.\nCreate the business diagram for 2 assigned pages in the site.\n- Write SQL query and Java code to implement the features.\nEDUCATION\nVietnam Korea Friendship Infomation Technology College, Da Nang -\nAssociate's degree in Computer Science - Distinction\nSEP 2009 - JUN 2012\n- Leam the solid foundation of programming, operating system concepts,\nLinux usage, and mobile development.\nDevelop soft skills by voluntary being a leader of the university school\nforum and other voluntary activities.", "educations": [{"id": 5234, "gpa": null, "major": "Khoa h\u1ecdc m\u00e1y t\u00ednh", "school": "Vietnam Korea Friendship Infomation Technology College", "diploma": "Colleges", "end_time": "2012-06-01T00:00:00Z", "conf_score": 0.9210476336005856, "start_time": "2009-09-01T00:00:00Z", "picklist_major": "IT - Hardware/Networking", "major_categories": "M\u00e1y t\u00ednh v\u00e0 c\u00f4ng ngh\u1ec7 th\u00f4ng tin", "major_categories_detail": "M\u00e1y t\u00ednh"}], "experiences": [{"id": 17512, "detail": "Building the profes sional phone system for business. Implemented 40% functionals of the system, includes : Backend APIs using NodeJS, Sequelize ORM on PostgresDB. Frontend using React JS /Graphql. Mobile app Android andioS using ReactNative. - Interview candidates to build the dev team of 3. - Adopt the TDD process which covered the tested code to 95 %. - Write tools which currently helps to save more than 20 minutes of each developer/day.\n- Do the code review on every pullrequests.", "company": null, "end_time": "2023-04-13T00:00:00Z", "industry": "Other", "position": "Software Engineer", "conf_score": 0.8086621310791741, "start_time": "2018-01-01T00:00:00Z"}, {"id": 17513, "detail": "Familiar working with Google Cloud services: Kubernertes, Cloud Function, Pub/Sub, Logging. - Implement the parts of a high scale Microservices system, includes:\nDesign the APls, the microservices workflow then implement in\nGolang and Nodejs. Frontend development using ReactJS/ Redux/ FlowJS/ ImmutableJs. Adopted DraftJS to build the WYsiwYG postcard builder within a request queue.\nWrite reusable NosQL query on RethinkDB and Redis. Write code for the monitoring service, collecting the logs and send to InfluxDB or Slack. Implement 2 public webhooks by Google Cloud Function. Write the unit test; integration test follows the TDD process.\n- On call for any incident may happen during the night.\n- Develop and maintain 2/6 open APIs written in Golang which were receiving hundreds of thousands of requests every day from the partners.\n- Identifying and resolving performance and scalability issues.\n- In the role of a cross-functional developer in a Scrum team\n- Do the code review, mob programming and pair programming.\n- Were developing many core soft skils under the high working pressure: teamwork, negotiating, problem -solving, helpful code review.", "company": "AgencyRevolution", "end_time": "2018-01-31T00:00:00Z", "industry": "Other", "position": "Software Engineer", "conf_score": 0.9513532378178006, "start_time": "2017-01-01T00:00:00Z"}, {"id": 17514, "detail": "Hiring the dev team of 5, learning Scrum and apply to the product development.\nAs a Scrum Master, training team member to able to work.\nJoin \"The design sprint\" (http://www.gv.com/sprint/) to defining the product.\nResponsible for the development of 2 company products: a market place\n- memeapp.co and an e-commerce site - sonice.vn, includes:\nImplement backend APIs using NodeJS, Waterline ORM on\nMongoDB. Implement Frontend Progressive Web Apps using Google Polymer.", "company": "Sonice.vn", "end_time": "2017-01-31T00:00:00Z", "industry": "Other", "position": "Lead Developer", "conf_score": 0.9513532378178006, "start_time": "2016-01-01T00:00:00Z"}, {"id": 17515, "detail": "Lead the frontend team, work with the backend team to define the data model and build the APIs, monitor the app and optimizing.\n- Creating complex, responsive UI with JS and Bootstrap - Adopt AngularJS 1.0 to create the app running on Chrome, Firefox and\nInternet Explorer. - Implement the real-time data visualization with Highcharts, Fusioncharts, Google charts over Socketio.", "company": "ME Corporation", "end_time": "2015-12-31T00:00:00Z", "industry": "Other", "position": "Software Engineer", "conf_score": 0.9543433629168562, "start_time": "2013-09-01T00:00:00Z"}, {"id": 17516, "detail": "Created a music application on BlackBery 1o.\n- Write in C++ on Cascade framework.\n- Design the app structure follows the object-oriented programming.\nReference: https://appworld.blackberry.com/webstore/content/2897089o", "company": "NCT Corporation", "end_time": "2013-08-31T00:00:00Z", "industry": "Other", "position": "Mobile Application Developer", "conf_score": 0.9543433629168562, "start_time": "2013-01-01T00:00:00Z"}, {"id": 17517, "detail": "in a Japan outsourcing project.\nCreate the business diagram for 2 assigned pages in the site.\n- Write SQL query and Java code to implement the features.", "company": "FPT Software", "end_time": "2012-12-31T00:00:00Z", "industry": "High Technology", "position": "Inte rnship Java Developer", "conf_score": 0.9169619151380858, "start_time": "2012-07-01T00:00:00Z"}], "address": null}