{"skills": ["studio", "java", "css", "git", "c++", "algorithm", "analytical thinking", "structure", "html", "rxjava", "c#", "oop", "blockchain", "mvvm", "constraint layout", "data binding", "glide", "android", "retrofit", "data structure", "kotlin"], "fulltext": "EDUCATION\n2014 - 2018\nUniversity of Science\nInfomation Technology\nCollege\nSKILLS AND EXPERIENCE\n2018 - 2019\nwork\n- Good at team work and individually.\n- Reading English Document and English communication\nrather good.\n- Basic Knowledge about programming language: C/C++,\nC#, VB , HTML, CSS. \n- Listenable and work hard, logical thinking, analytical\nability well.\n- Knowlegde about OOP, Data Structures, Algorithms,\nProgramming Techniques.\n- Responsible and good attitude at work.\n- use Android Studio, Smart-Git to clone and build\nproject.\n- Projects in Dirox company:\n + Dirox presentation app (Tablet): \n  - Create left side menu, each tab is a fragment.\n  - Intent and passing data between activity and fragment\n  - Use Retrofit to call data from API service.\n  - Create some animation and load image with Glide.\n  - Use fluently Linear, Relative,... and Constraint Layout.\n  + Unikey app ( about Blockchain):\n  - Use design partern MVVM with data binding.\n  - Create many layout in app flow.\n  - Use gif image.\n  + Chairity For Point app:\n  - Use MVVM with RxJava.\n  - Create login, sign-in, sign up layout,...\n  - Use Retrofit2 to call data from API.\n  - Take a photo or import from gallery to show in app.\n  + Research to learn new library, new feature from\nandroid.\nGi\u1ea3ng Th\u00e0nh T\u00edn\nJunior Android Developer\nCONTACT INFORMATION\n18/08/1996 \uf073\nMale \uf007\n0363625752 \uf095\nthanhtingiang@gmail.com \uf199\nHoChiMinh, Vietnam\n\uf041\nOBJECTIVE\n- become Android Developer in Company .\nSKILLS\nJava, Kotlin\nINTERESTS\n- cinema, play guitar,\ntravel,...\nWORK EXPERIENCE\n8/2018 - 8/2019\nDirox Company ( outsourcing company )\nAndroid Developer\n- Join with mobile team to complete some project and\nrequirement from client.\n- Complete task assign from PM, and Team Lead.\n\u00a9 topcv.vn", "educations": [{"id": 5245, "gpa": null, "major": "C\u00f4ng ngh\u1ec7 truy\u1ec1n th\u00f4ng", "school": "University of Science", "diploma": "Bachelors", "end_time": "2018-01-01T00:00:00Z", "conf_score": 0.8728927738906489, "start_time": "2014-01-01T00:00:00Z", "picklist_major": "Advertising/Promotion/PR", "major_categories": "B\u00e1o ch\u00ed v\u00e0 th\u00f4ng tin", "major_categories_detail": "B\u00e1o ch\u00ed v\u00e0 truy\u1ec1n th\u00f4ng"}], "experiences": [{"id": 17559, "detail": "- Join with mobile team to complete some project and requirement from client.\n- Complete task assign from PM, and Team Lead.", "company": "Dirox Company", "end_time": "2019-08-31T00:00:00Z", "industry": "Other", "position": "Android Developer", "conf_score": 0.926025711211617, "start_time": "2018-08-01T00:00:00Z"}], "address": "Hochiminh, Vietnam"}