{"skills": ["robot", "git", "css", "github", "analysis", "tcp", "angular 2", "ionic", "svn", "firebase", "python", "solution design", "html", "reactjs", "linux", "product review", "html page", "pyramid", "ajax", "mysql", "voip", "es6", "human resources", "redux", "io", "angular", "unit test", "log management", "macos", "javascript", "database", "database design", "hl", "excel", "xml", "wifi", "laravel", "react native", "file storage", "docker", "jenkins", "heroku", "php", "recruitment", "android", "communication skill", "angularjs", "socket io", "system design", "meteorjs", "mongodb", "ip network", "maintenance", "postgresql", "management", "medium", "aws", "system architecture", "restful"], "fulltext": "Name \nD\u01b0\u01a1ng \u0110\u1ee9c Ki\u00ean \nRole \nSenior Software Engineer \nAvatar \nBirthday  07/05/1990 \nPlace of birth \nNam Dinh City \nAddress \nHoang Hoa Tham str, Ba Dinh, Hanoi, Vietnam \nMobile phone \n0934 299 871 \nEmail   ddk0705@gmail.com \nOverview \nPersonal \nName: Duong Duc Kien \nEnglish: Medium \nYears of Experiences: 07 years \nStatement and Achievements \n\u2022 \n07 years experiencing in programming. \n\u2022 \nStrong knowledges of JavaScript, ES6, NodeJS. \n\u2022 \nStrong knowledges of PHP, CI & Laravel Framework. \n\u2022 \nGood knowledges about ReactJS, React Native, Angular2+, Ionic2+. \n\u2022 \nGood knowledges about Redux \u2013 Saga. \n\u2022 \nGood knowledges about Docker, Jenkins. \n\u2022 \nStrong knowledges MySQL, MongoDB. \n\u2022 \nAnalysis and design system. \n\u2022 \nDesign database. \n\u2022 \nDesign solutions for projects. \n\u2022 \nGood ability of self-studying and learning new technologies quickly \n\u2022 \nGood interpersonal and communication skills \nCurriculum Vitae \n\u2022 \nBe able to read, write and translate in English \nEducation, Qualifications  \n2008 \u2013 2012 \nFaculty of Electronics & Informatics, Hanoi Open University \nGrade: Good \n2012 \u2013 2013 \nAptech Education \nGrade: Good \nTechnical Skills \nOS \nLinux, MacOS \nLanguages \nPHP, Javascript, Python \nDatabases \nMySQL, MongoDB \nComms & Networks \nServer platform (Linux), LAN, TCP/IP Network \nPackages \nPHP Storm, Visual Code  \nMethodologies & Tools \nMS Project, Git & GitHub, SVN \nPROJECTS \nProject  YMacau \nLink  application \nhttps://apps.apple.com/vn/app/%E6%BE%B3%E9%96%80%E6%8C%87%E5%8D%97-\nmacau-central/id888217440?l=vi \nhttps://play.google.com/store/apps/details?id=com.centraltech.macaucentral&hl=en_US \nCompany  name \nPowerGate Software \nDuration \nMay 2019 \u2013  Present \nPosition \nTeam leader \nProject  Description \nMacau Central Guide travel city app tourisum Discount parking doctors medical center \nrestaurants shopping baby pet movie business weather yellow page jobs cars medical \ndoctors home beauty wedding education tour hotels food Macau FREE WIFI Map bank \nyellow page recruitment job hello jobs CTM daily ifood news newspapaer business \nsecond hand home property real estate mice exhibition conference arts cluture \ndecoration course learning schools university coupon \nMy \nResponsibility \n\u2022 \nMaintennance API \n\u2022 \nCreate new functions on the mobile app \n\u2022 \nCreate the app builder to custom the mobile app \nTechnology \nEnvironment:  Linux \nDevelopment Language: MySQL, Laravel, Ionic 4 \nProject  FeedBands \nLink  application \nhttps://apps.apple.com/us/app/feedbands/id578146828 \nhttps://play.google.com/store/apps/details?id=com.feedbands.feedbandsapp&hl=vi \nCompany  name \nPowerGate Software \nDuration \nApr 2018 \u2013  Present \nPosition \nTeam member \nProject  Description \nFeedbands streams commercial-free independent music and a daily radio show. \nMy \nResponsibility \n\u2022 \nCreate some endpoints of API \n\u2022 \nCreate & maintenance some functions in the mobile app about playlists, play \naudio,  \nTechnology \nEnvironment:  Linux \nDevelopment Language: MySQL, Laravel, React Native \nProject  Beam \nLink application \nhttps://apps.apple.com/us/app/beam-escooter-sharing/id1427114484 \nhttps://play.google.com/store/apps/details?id=com.escooterapp&hl=vi \nCompany name \nPowerGate Software \nDuration \nMay 2018 \u2013  Apr 2019 \nPosition \nTeam member \nProject Description \nGetting people out of their cars and onto our scooters is just the \nbeginning. Riding a Beam is affordable, convenient and much better \nfor the environment. \nMy Responsibility \n\u2022 \nLogic on the mobile app & unit test \nTechnology \nEnvironment:  Linux \nDevelopment Language: PostgreSQL, NodeJS, React Native \nProject  Fuse5 \nLink application \nCompany name \nPowerGate Software \nDuration \nApr 2018 \u2013  Apr 2019 \nPosition \nTeam lead group \nProject Description \nAutomotive ERP Software  \nMy Responsibility \n\u2022 \nMaintaine system with new tickets  \n\u2022 \nOptimize system (RDS, MySQL, Indexing)  \n\u2022 \nSupport team member  \nTechnology \nEnvironment:  Linux \nDevelopment Language: MySQL, PHP, Javascript \nProject \nJReview (https://www.jreviews.com/directory-and-reviews-mobile-app-for-ios-and-\nandroid) \nLink  application \nhttps://apps.apple.com/us/app/jreviews/id1378399095 \nCompany  name \nPowerGate Software \nDuration \nAug 2017 \u2013  Apr 2018 \nPosition \nTeam Leader \nProject  Description \nReview product (Hotel, Restaurant, Art, \u2026) \nMy \nResponsibility \n\u2022 \nMaintenance and development new functions of API using Laravel \n\u2022 \nMaintenance and development new functions mobile app using Ionic 2+ \n\u2022 \nCreate tool manage App (create pages, edit pages, change stype, manage \nmodule,\u2026) \n- Backend: API Restful NodeJS (Express) \n- Frontend: Angular 4 + Redux  \n\u2022 \nSupport team member \nTechnology \nEnvironment:  Linux \nDevelopment Language: MySQL, Laravel, Ionic 2+, NodeJS, Angular 4 \nProject  DriveELD \nLink  application \nhttps://apps.apple.com/us/app/drive-eld/id1311895622 \nhttps://play.google.com/store/apps/details?id=com.driveeld.android.DriveELDApp&hl=vi \nCompany  name \nPowerGate Software \nDuration \nJune 2017 \u2013 Sep 2017 \nPosition \nTeam Leader \nProject  Description \nLog management system of container trucks use API Python (Pyramid) & mobile app \nReact Native \nMy \nResponsibility \n\u2022 \nLogic for mobile app. \n\u2022 \nSupport team member: solution about API & PostgreSQL \nTechnology \nEnvironment:  Linux \nDevelopment Language: Python, ReactNative & PostgreSQL \nProject  Afterschool \nLink  application \nhttps://apps.apple.com/vn/app/smart-school-101-english/id1447849144?l=vi \nCompany  name \nPowerGate Software \nDuration \nJune 2017 \u2013 Aug 2017 \nPosition \nTeam Leader \nProject  Description \nStudent's time management system (checkin, checkout) \nMy \nResponsibility \n\u2022 \nDesign Architecture System & Database \n\u2022 \nSupport team member: scan QR Code, management logs on mobile app use \nIonic 2 \n\u2022 \nSupport team member: management all logs on web admin & export data to excel \nfile use Angular 2 \nTechnology \nEnvironment:  Linux \nDevelopment Language: Angular2, Ionic2 & Firebase \nProject \nIce BlackBox \nCompany  name \nPowerGate Software \nDuration \nApr 2017 \u2013 May 2017 \nPosition \nTeam Leader \nProject  Description \nIncidents Management System (crime, maltreatment of animals). The system is used \nby the police US \nMy  Responsibility \n\u2022 \nDesign Architecture System & Database \n\u2022 \nSolution realtime video with coordinate of incidents use Socket IO  \n\u2022 \nSupport team member: management all incidents real-time on website Admin \nLaw Portal  \nTechnology \nEnvironment:  Heroku \nDevelopment Language: NodeJS (Express), Javascript, ArrowDB \nProject \nPPC Entourage \nCompany  name \nPowerGate Software \nDuration \nMarch 2017 \u2013  May 2017 \nPosition \nSenior Developer \nProject  Description \nManagement system: get data from Amazon Web Service \nMy  Responsibility \n\u2022 \nMigrate big data from PostgreSQL to RedShift \n\u2022 \nMaintain robots get data from AWS (PHP script cronjob)  \n\u2022 \nWorking on website use API NodeJS & AngularJS \nTechnology \nEnvironment:  Linux. \nDevelopment Language: NodeJS (Sails), AngularJS, PHP \nProject \nData Rentention \nCompany \nname \nPowerGate Software \nDuration \nFeb 2017 \u2013 Apr 2017 \nPosition \nSenior Developer \nProject \nDescription \nAustralian Government's Voip call management system \nMy  Responsibility \n\u2022 \nMigrate database MySQL \n\u2022 \nScript PHP cronjob \n\u2022 \nScript PHP get data from XML (born of VoIP calls) & insert to database \n\u2022 \nScript PHP export data from management website to PDF invoice \nTechnology \nEnvironment:  Linux \nDevelopment Language: PHP, MySQL \nProject \nE-commerce System \nCompany name \nDidong Express \nDuration \nOct 2016 \u2013 Jan 2017 \nPosition \nSenior Developer \nProject Description \nE-commerce website & system management  \nMy Responsibility \n\u2022 \nSystem management in ordering real-time use MeteorJS \n\u2022 \nWorking on website & landing page (HTML, CSS, Javascript, \nAjax)  \nTechnology \nEnvironment:  Linux \nDevelopment Language:  NodeJS, MeteorJS, ReactJS, MongoDB \nProject \nFile Storage & Share file \nCompany name \nStartup \nDuration \nJan 2016 \u2013 Oct 2016 \nPosition  Developer \nProject Description \nUsers can create account, upload file free (video, document,\u2026),  watch \nvideo uploaded on website, share & embed link to another site. \nMy Responsibility \n\u2022 \nLogic account management \n\u2022 \nLogic of uploading to Google Drive & backup file to server \nTechnology \nEnvironment:  Linux \nDevelopment language: NodeJS (Express), ReactJS & MySQL \nProject \nBackOffice System \nCompany name \nVietnam National Chemical Group \nDuration \nJan 2012 \u2013 Dec 2015 \nPosition  Developer \nProject Description \nAn office management system.  \nMy Responsibility \n\u2022 \nDocument Management \n\u2022 \nReporting & Dashboard \n\u2022 \nHuman Resource \n\u2022 \nStock Management \nTechnology \nEnvironment: Linux \nDevelopment language: PHP, AngularJS, MySQL \nPowered by TCPDF (www.tcpdf.org)", "educations": [{"id": 5281, "gpa": null, "major": null, "school": "Aptech Education", "diploma": "Other", "end_time": "2013-01-01T00:00:00Z", "conf_score": 0.6905021871308187, "start_time": "2012-01-01T00:00:00Z", "picklist_major": "Other", "major_categories": "", "major_categories_detail": ""}, {"id": 5280, "gpa": null, "major": "Kinh t\u1ebf qu\u1ed1c t\u1ebf", "school": "Hanoi Open University", "diploma": "Bachelors", "end_time": "2012-01-01T00:00:00Z", "conf_score": 0.8967290006738793, "start_time": "2008-01-01T00:00:00Z", "picklist_major": "Economical", "major_categories": "Khoa h\u1ecdc x\u00e3 h\u1ed9i v\u00e0 h\u00e0nh vi", "major_categories_detail": "Kinh t\u1ebf h\u1ecdc"}], "experiences": [{"id": 17682, "detail": "Project Description Feedbands streams commercial-free independent music and a daily radio show.\nMy Responsibility \u2022 Create some endpoints of API \u2022 Create & maintenance some functions in the mobile app about playlists, play audio,\nTechnology Environment: Linux Development Language: MySQL, Laravel, React Native", "company": "PowerGate Software", "end_time": "2023-04-13T00:00:00Z", "industry": "High Technology", "position": "Team member", "conf_score": 0.9015919502229335, "start_time": "2018-04-01T00:00:00Z"}, {"id": 17683, "detail": "Project Description Automotive ERP Software My Responsibility \u2022 Maintaine system with new tickets\n\u2022 Optimize system (RDS, MySQL, Indexing) \u2022 Support team member\nTechnology Environment: Linux Development Language: MySQL, PHP, Javascript", "company": "PowerGate Software", "end_time": "2019-04-30T00:00:00Z", "industry": "High Technology", "position": "Team lead group", "conf_score": 0.9322515131200048, "start_time": "2018-04-01T00:00:00Z"}, {"id": 17684, "detail": "ption\nReview product (Hotel, Restaurant, Art, ...) My Responsibility \u2022 Maintenance and development new functions of API using Laravel \u2022 Maintenance and development new functions mobile app using Ionic 2+ \u2022 Create tool manage App (create pages, edit pages, change stype, manage module,...)\n- Backend: API Restful NodeJS (Express) - Frontend: Angular 4 + Redux \u2022 Support team member", "company": "PowerGate Software", "end_time": "2018-04-30T00:00:00Z", "industry": "High Technology", "position": "Team Leader", "conf_score": 0.8027138895414391, "start_time": "2017-08-01T00:00:00Z"}], "address": "City\nAddress\nHoang Hoa Tham str, Ba Dinh, Hanoi, Vietnam"}