{"skills": ["linux", "marketing", "babel", "javascript", "graphql", "vuepress", "cli", "mongodb", "postgresql", "frontend development", "mongoose", "vuejs", "ubuntu", "sequelize", "typescript", "php", "css", "reactjs", "database", "leveldb", "apollo", "python", "sqlite", "mocha", "angularjs", "bootstrap", "jest", "mysql", "html"], "fulltext": "Loc Duc An\nEmail: ancmsvn@gmail.com\nMobile: +84 974 240 252\nExperience\n\u2022 Gugo\nJan. 2019 \u2013 Present\nPart-time Software Engineer\n\u25e6 Developing websites utilizing the Uno\ufb03cal Facebook API.\n\u25e6 Language/Technologies: Node.JS, React.JS, PKG, Javascript.\n\u2022 GRAPHVN\nApr. 2016 \u2013 Dec. 2018\nSoftware Engineer\n\u25e6 Developing commercial website utilizing the Facebook Graph API.\n\u25e6 Managed over 50 Linux servers that helps to balancing system.\n\u25e6 Developing a system for thousands of active users for marketing reasons.\n\u25e6 Managed a very large database, at least 500 million entries recorded.\n\u25e6 Building a system that providing workers to executing task coherently.\n\u25e6 Language/Technologies: Ubuntu, Node.JS, Vue.js, React.js, MongoDB, MySQL, Javascript, AngularJS.\n\u2022 SAT Coding\nDec. 2014 \u2013 Apr. 2016\nFrontend Developer\n\u25e6 Building interface of website.\n\u25e6 Language/Technologies: Bootstrap, Javascript, MySQL, CSS, AngularJS.\nActivities\n\u2022 Administrator at ancms Live Stream\nJun. 2015 \u2013 Apr. 2016\n\u25e6 Provide a platform helps live stream to Facebook.\n\u25e6 Managing Live Stream Facebook Group for discussions with 70,000 members.\n\u2022 Administrator at ancms Inbox Manager\nFeb. 2015 \u2013 Apr. 2016\n\u25e6 A application helps to read messages FB via access token.\nLanguages And Technologies\n\u25e6 Languages: Pro\ufb01cient in javascript 4 years, HTML, CSS. Familiar with Python, PHP, GraphQL, Typescript.\n\u25e6 Frameworks: VueJS, ReactJS, NodeJS, Sequelize, ExpressJS, Fastify, AngularJS, Mongoose, Apollo,\nTypeGraphQL, Flow. Known how to build a framework.\n\u25e6 Database systems: MongoDB, MySQL, PostgreSQL, SQLite, LevelDB.\n\u25e6 Technologies: Stackshare.\nPersonal Projects\n\u2022  Methor Framework\n\u25e6 A \ufb02exible framework NodeJS helps fast create a backend. Inspired from FB API v1. Built at 2017\n\u25e6 100k active users\n\u25e6 Languages Technologies: Flow, Javascript, Lerna, Babel, Vuepress, Mocha (test).\n\u2022 Just\nCLI Framework\n\u25e6 A replacement, global command line react-script. Extended with react-app-rewired.\n\u25e6 Languages Technologies: Typescript, Jest (test).\n\u2022 ancms Live Stream\nProject\n\u25e6 Provide a platform helps live stream to Facebook.\n\u25e6 Languages Technologies: Javascript, Bootstrap, PHP.\nEducation\nQue Phong High School (2015 \u2013 2018).", "educations": [{"id": 5277, "gpa": null, "major": null, "school": "Que Phong High School", "diploma": "Other", "end_time": "2018-01-01T00:00:00Z", "conf_score": 0.6981244904084882, "start_time": "2015-01-01T00:00:00Z", "picklist_major": "Other", "major_categories": "", "major_categories_detail": ""}], "experiences": [{"id": 17671, "detail": "Developing websites utilizing the Unoffical Facebook API. \u25e6 Language/Technologies: Node.JS, React.JS, PKG, Javascript.", "company": "Gugo", "end_time": "2023-04-13T00:00:00Z", "industry": "Other", "position": "Software Engineer", "conf_score": 0.9309791790920914, "start_time": "2019-01-01T00:00:00Z"}, {"id": 17672, "detail": "\u25e6 Developing commercial website utilizing the Facebook Graph API. \u25e6 Managed over 50 Linux servers that helps to balancing system.\n\u25e6 Developing a system for thousands of active users for marketing reasons.\n\u25e6 Managed a very large database, at least 500 million entries recorded.\n\u25e6 Building a system that providing workers to executing task coherently.\n\u25e6 Language/Technologies: Ubuntu, Node.JS, Vue.js, React.js, MongoDB, MySQL, Javascript, AngularJS.", "company": "GRAPHVN", "end_time": "2018-12-31T00:00:00Z", "industry": "Other", "position": "Software Engineer", "conf_score": 0.9264139694127339, "start_time": "2016-04-01T00:00:00Z"}, {"id": 17673, "detail": "\u25e6 Building a system that providing workers to executing task coherently.\n\u25e6 Language/Technologies: Ubuntu, Node.JS, Vue.js, React.js, MongoDB, MySQL, Javascript, AngularJS. \u2022", "company": "SAT Coding", "end_time": "2016-04-30T00:00:00Z", "industry": "Other", "position": "Frontend Developer", "conf_score": 0.9219483572670066, "start_time": "2014-12-01T00:00:00Z"}], "address": null}