{"skills": ["postman", "regression", "automation", "selenium", "life insurance", "rest", "management", "automation test", "performance testing", "structure", "tester", "acceptance testing", "regression testing", "user acceptance testing", "insurance", "sql", "jira", "le", "regression test", "testing", "clarify", "sql query", "teamwork", "api testing", "problem solving"], "fulltext": "Nguyen Duy Tan \n49/7 Dang Minh Tru Street, Tan \nBinh District, Ho Chi Minh  \n0769847942 \ntannguyen16694@gmail.com \nlinkedin.com/in/tannguyen166 \nfacebook.com/duy.tan16694 \nMy name is Nguyen Duy Tan Tan25 years old. I have two years of experience in software testing at DXC \nTechnology Company. My work focuses on automated software testing, software performance testing, \ntest planning and currently a software testing team leader. \nSkills \nTop Skills (Technical/ Non-Technical Skills) \n\u2022 \nDesign Test Case \n\u2022 \nBlack Box \n\u2022 \nAutomation Web Testing \n\u2022 \nRest API Testing \n\u2022 \nPerformance Testing \n\u2022 \nDerive Test Case from Requirement \n\u2022 \nAnalytical  \n\u2022 \nSoftware Testing Life Cycle \n\u2022 \nDocument Management \n\u2022 \nScrum \n\u2022 \nLeadership \n\u2022 \nCommunication \n\u2022 \nTeamwork \n\u2022 \nProblem Solving \nTool and Technologies  \n\u2022 \nSelenium \n\u2022 \nFitnesse  \n\u2022 \nJira \n\u2022 \nJMeter \n\u2022 \nPostman  \nKey Role Performed \n\u2022 \nSoftware Quality Control Engineer \u2013 2 years \nIndustry Experience \n\u2022 \nInsurance Domain \u2013 2 years \nProfessional Work Experience \n02/2018 \u2013 05/2019 \nBRI LIFE INSURANCE / DXC Technology Vietnam \nOverview: This is a life insurance project working with Indonesian customers. In this project, I assumed \nthe role of Test Leader. Main Responsibilities:  \n2 \n Reference \n\u2022 \nWrote test plans and test cases based on software requirements specifications. \n\u2022 \nWalkthrough requirement with tester team, analyze requirement assign task for team \nmember. \n\u2022 \nReported and tracked bugs, replicated reported customer bugs, verified bug fixes and new \nfunctionalities, regression tested new releases, supported developers by examining logs and \ndebug files \n\u2022 \nWrote SQL queries to validate data of scanned business documents, folders and images, set \nup data and retrieve data for tests. \n\u2022 \nDeveloped and executed performance test script scenarios based on the business \nrequirements and specifications. \n\u2022 \nAnalyzed the performance test results and provided recommendation to the performance \ntuning team. \n\u2022 \nWork closely with onshore team clarify requirement, analyze test result and report. \n06/2017 \u2013 02/2018 \nAVIVA INSURANCE / DXC Technology Vietnam \nOverview: This is a life insurance project working with Singapore customers. In this project, I assumed \nthe role tester. Main Responsibilities: \n\u2022 \nWrote Test Cases (Including Regression, Performance, Benchmark, Stress and Functionality \nTesting). \n\u2022 \nPerformed system, functional, black box, user acceptance testing and regression testing. \n\u2022 \nDeveloped and executed performance test script scenarios based on the business \nrequirements and specifications. \n02/2018 \u2013 05/2019 \nITS AUTOMATION TEAM / DXC Technology Vietnam \nOverview: This is an automation test tool of domain Insurance in DXC Technology Vietnam. In this team \nI assumed member of team build framework. Main Responsibilities:  \n\u2022 \nImprove ITS automation framework. \n\u2022 \nLed and mentored junior automation and manual QA engineers to execute and analyze \nautomation smoke and regression tests. \n\u2022 \nMentored and provided guidance for QA automation team member. \n\u2022 \nOrganized and structure test case, test suite. \n\u2022 \nTraining ITS automation test tool for QC, BA and Developer. \n\u2022 \nPresentation ITS automation test tool for Customer. \nEducation \n09/2012-07/2018 \nBachelor / Van Lang University, Ho Chi Minh \nMajor: Software Engineering. \n3 \n\u2022 \nName: Trinh Van Ly Vu \nTitle: Supervisor Service Delivery \nEmail: vtrinh2@dxc.com \nMobile:  0902882226 \nName: Le Quang Tuyen \nTitle: Supervisor Service Delivery \nEmail: tle242@dxc.com \nMobile: 0966290658 \n\u2022 \n\u2022 \n\u2022 ", "educations": [{"id": 5284, "gpa": null, "major": "K\u1ef9 thu\u1eadt ph\u1ea7n m\u1ec1m", "school": "Van Lang University", "diploma": "Bachelors", "end_time": "2018-07-01T00:00:00Z", "conf_score": 0.8816606736829975, "start_time": "2012-09-01T00:00:00Z", "picklist_major": "IT - Hardware/Networking", "major_categories": "M\u00e1y t\u00ednh v\u00e0 c\u00f4ng ngh\u1ec7 th\u00f4ng tin", "major_categories_detail": "M\u00e1y t\u00ednh"}], "experiences": [{"id": 17697, "detail": "Overview: This is a life insurance project working with Indonesian customers. In this project, I assumed the role of\nWrote test plans and test cases based on software requirements specifications.\nWalkthrough requirement with tester team, analyze requirement assign task for team member.\nReported and tracked bugs, replicated reported customer bugs, verified bug fixes and new functionalities, regression tested new releases, supported developers by examining logs and debug files\nWrote SQL queries to validate data of scanned business documents, folders and images, set up data and retrieve data for tests.\nDeveloped and executed performance test script scenarios based on the business requirements and specifications.\nAnalyzed the performance test results and provided recommendation to the performance tuning team.\nWork closely with onshore team clarify requirement, analyze test result and report.", "company": "BRI LIFE INSURANCE / DXC Technology Vietnam", "end_time": "2019-05-31T00:00:00Z", "industry": "Insurance", "position": "Test Leader", "conf_score": 0.924694351231781, "start_time": "2018-02-01T00:00:00Z"}, {"id": 17698, "detail": ". Main Responsibilities: \u2022 Wrote Test Cases (Including Regression, Performance, Benchmark, Stress and Functionality Testing). \u2022 Performed system, functional, black box, user acceptance testing and regression testing.\n\u2022 Developed and executed performance test script scenarios based on the business requirements and specifications.", "company": "AVIVA INSURANCE / DXC Technology Vietnam", "end_time": "2018-02-28T00:00:00Z", "industry": "Insurance", "position": "tester", "conf_score": 0.898930808914175, "start_time": "2017-06-01T00:00:00Z"}], "address": "49/7 Dang Minh Tru Street, Tan Binh District, Ho Chi Minh"}