{"skills": ["stores management", "trust relationship", "angular", "mongo", "automation", "automation testing", "cloud", "management", "redux", "karma", "tool support", "vuejs", "human resources", "git", "svn", "linq", "firebase", "investments", "search", "asp", "nosql", "sql", "signalr", "nunit", "jira", "software development", "testing", "mvc", "reactjs", "senior management", "npm", "communication skill", "quality assurance", "database", "gulp", "wcf", "user interface", "mocha", "bitbucket", "bootstrap", "jest", "splunk", "jquery", "facilitation skill"], "fulltext": "TRUNG DO THANH\nSENIOR SOFTWARE DEVELOPER\nAddress\n229/50 Tan Ky Tan Quy street, Tan Son \nNhi ward, Tan Phu district, Ho Chi Minh \ncity.\nContact\ntrungtayninh@gmail.com\n+84 937 322 607\nWORK EXPERIENCE\nData Entry\nSenior Software Developer,  Feb 2017 - Now  (12 members)\n    The Data entry application allows users input paper data to digital \ndata. That will help company easy controls the information. Widget \napproaching that is flexible for user interface.\n    Technologies: Angular 6; ReactJs; VueJs, Store Management \n(Redux); Web API; Bootstrap; SQL Server 2016; Elastic Search.\nProject Direct-Hit & Direct-Shop at Identifix\nSenior .Net Developer, Apr 2015 - Jan 2017 (20 members)\n    Direct-Hit delivers all data, tools and information necessary to help \nautomotive repair professionals run their shops as efficiently, \naccurately and profitably as possible, by allowing them to save shop \ntime\u2013every day and on every car. \n    Direct-Shop offers small and mid-sized repair shops a solution for \nmanaging core business processes. Based in the cloud, Direct-Shop \ncan be deployed quickly and provides a streamlined set of services so \nyou aren\u2019t paying for extra features that you don\u2019t need or won\u2019t use.\n    Technologies: .Net Core; MS SQL 2008; Node JS; Angular 1.2;  \nSplunk; JQuery; Bootstrap; Bitbucket; Karma; NUnit; Jira.\nhttp://www.identifix.com\nPROFILE SUMMARY - OBJECTIVE\n    Software Development professional with more than 10 years \nexperience programming in .Net. Highly skilled in specifications \ngathering, troubleshooting, and quality assurance testing using .NET,  \nand more than 5 years in Single Page Application.\n    An organized, detail-oriented, and conscientious self-starter, able \nto strategize and prioritize effectively to accomplish multiple tasks \nand stay calm under pressure. Highly organized and independent; \nable to effectively coordinate tasks to accomplish projects with \ntimeliness and creativity.\n    Decisive, efficient team approach; outstanding communication \nskills. Strong planning and facilitation skills; able to communicate \neffectively with all organizational levels, build relationships of trust \nand enlist the participation of team members.\n    With a good experience I will adapt in Software Development of \nproductivity and successful project outcomes. We are together to \ndevelop much further.\nNow | 2015\n2015 | 2014\nTECHNOLOGY SKILLS\nASP.Net Web Form/MVC\nWindow Form;WPF\nMS SQL Server;NoSQL;Mongo\nWeb/Window Service;WCF\nMicro Service\nEF;NHibernate;Data Objects\n.NetNuke;Umbraco;SharePoint\nAngular;React;Vue;Node\nGulp;Webpack;NPM\nElastic Search;Splunk\nTelerik;Bootstrap;Wijmo;JQuery\nLocalDB(Intergration test)\nNUnit Testing\nAutomation Testing\nKarma;Jest;Mocha\nSingalR;Firebase;Websocket\nAutofac;Automapper\nSVN;TFS;Bitbucket;SS;Git\nLinQ;CAML...\nCivica Housing Management\nSenior .Net Developer,  July 2013 - Aug 2014 (50 members)\n    A leading partner in social housing, Civica provides a flexible \nIT-based platform to help organizations deliver improved tenant \nservices with greater efficiency.\n    Technologies: Single page; ASP .Net MVC 4; MS SQL 2008; SignalR; \nSQL Dependcy; Autofact; Automapper; JQuery; KendoUI; Local DB; \nFluent NHibernate; NUnit; Moq.\n2014 | 2013\nhttp://www.civica.co.uk/housing\n2013 | 2009\nSOFT SKILLS\nSuccessful Negotiation\nTime Management\nPositive Thinking\nEffective Training, Coaching\nEffective Communication\nProblem Resolving\nOther Projects\n.Net Developer,  Sep 2009 - June 2013\n    - US GroupM Pitch Database report (2 months)\n          https://apac-portal.insidegroupm.com/APTradingPitchDatabase/SitePages/Home.aspx\n    - Harveynash Internal Tool Support (7 months)\n    - Investment Management (14 months)\n          http://kcn.binhduong.gov.vn            \n    - FIA-Portal (4 months)\n          http://fia.mpi.gov.vn\n    - Human Resource Management of Government (6 months)\n    - R1Concept (in Freelance) (5 months)\n          http://www.r1concepts.com\n    - 53 degrees Kurching (in Freelance) (3 months)\n    - Sentosa (in Freelance) (6 months)\n          http://www.sentosa.com.sg\n    - Zignsec (in Freelance) (9 months)\n          http://zignsec.com\n* Technologies: ASP .Net WebFrom; DotNetNuke 4-5; Sharepoint \n2007-2010; Umbraco 7; AspDotNetStorefront 9; Stone Edge; MS SQL \nMy Project Responsibility  \n    It is ultimately my responsibility that all of the developers in my \nteam are adhering to the software quality standards agreed by my \nteam and the wider development team so that work is done to the \nhighest possible quality.\n    To act as example to all the developers on my team by advocating \nlearning and taking the time to do so myself so that they feel \ncomfortable.\nEDUCATION\nBACHELOR OF INFORMATION TECHNOLOGY\nVan Lang University, 2005-2009\nLANGUAGES\nVietnamese English Japanese\nHOBBIES AND ACTIVITIES\nPowered by TCPDF (www.tcpdf.org)", "educations": [{"id": 5289, "gpa": null, "major": "C\u00f4ng ngh\u1ec7 th\u00f4ng tin", "school": "Van Lang University", "diploma": "Bachelors", "end_time": "2009-01-01T00:00:00Z", "conf_score": 0.8268558147053681, "start_time": "2005-01-01T00:00:00Z", "picklist_major": "IT - Hardware/Networking", "major_categories": "M\u00e1y t\u00ednh v\u00e0 c\u00f4ng ngh\u1ec7 th\u00f4ng tin", "major_categories_detail": "C\u00f4ng ngh\u1ec7 th\u00f4ng tin"}], "experiences": [{"id": 17711, "detail": "(12 members)\nThe Data entry application allows users input paper data to digital data. That will help company easy controls the information. Widget approaching that is flexible for user interface.\nTechnologies: Angular 6; ReactJs; VueJs, Store Management (Redux); Web API; Bootstrap; SQL Server 2016; Elastic Search.", "company": null, "end_time": "2023-04-13T00:00:00Z", "industry": "Other", "position": "Data Entry\nSenior Software Developer", "conf_score": 0.6981244904084882, "start_time": "2017-02-01T00:00:00Z"}, {"id": 17712, "detail": "members)\nDirect-Hit delivers all data, tools and information necessary to help automotive repair professionals run their shops as efficiently, accurately and profitably as possible, by allowing them to save shop time-every day and on every car.\nDirect-Shop offers small and mid-sized repair shops a solution for managing core business processes. Based in the cloud, Direct-Shop can be deployed quickly and provides a streamlined set of services so you aren\u2019t paying for extra features that you don\u2019t need or won\u2019t use.\nTechnologies: .Net Core; MS SQL 2008; Node JS; Angular 1.2; Splunk; JQuery; Bootstrap; Bitbucket; Karma; NUnit; Jira. http://www.identifix.com", "company": "Direct - Hit & Direct - Shop at Identifix", "end_time": "2017-01-31T00:00:00Z", "industry": "High Technology", "position": "Senior .Net Developer", "conf_score": 0.8384022261982151, "start_time": "2015-04-01T00:00:00Z"}, {"id": 17713, "detail": "(50 members)\nA leading partner in social housing, Civica provides a flexible\nIT-based platform to help organizations deliver improved tenant services with greater efficiency.\nTechnologies: Single page; ASP .Net MVC 4; MS SQL 2008; SignalR; SQL Dependcy; Autofact; Automapper; JQuery; KendoUI; Local DB; Fluent NHibernate; NUnit; Moq.", "company": "Civica Housing Management", "end_time": "2014-08-31T00:00:00Z", "industry": "Other", "position": "Senior .Net Developer", "conf_score": 0.830738895005311, "start_time": "2013-07-01T00:00:00Z"}], "address": "229/50 Tan Ky Tan Quy street, Tan Son Nhi ward, Tan Phu district, Ho Chi Minh city"}