{"skills": ["linux", "aws", "sourcetree", "docker", "payment", "symfony", "task management", "crm", "marketing", "java", "wordpress", "javascript", "c#", "database management", "bootstrap", "mongodb", "management", "search engine", "excel", "crm system", "unit test", "jquery", "vuejs", "elasticsearch", "git", "analysis", "mobile application", "redis", "team management", "mysql", "database development", "database management system", "search", "revenue analysis", "design pattern", "css", "oop", "software development", "bug fixing", "mvc", "reactjs", "laravel", "mysql workbench", "database", "database design", "erp system", "swagger", "angularjs", "appannie", "php", "workbench", "ada"], "fulltext": "LY NGOC HOI\nDate of birth\n 22/04/1995\nGender  Male\nPhone  01676485538\nEmail  lyhoi.2204@gmail.com\nAddress\n Hanoi, Vietnam\nOBJECTIVE\nSeeking position of a PHP Developer where I would be able to put to use the knowledge gained in the\nsoftware development cycle and technical aptitude\nEDUCATION\n04/2010 - 10/2014\nAPTECH EDUCATION\nMajor: Software Engineer\n8/2013 - 8/2016\nHACTECT EDUCATION\nMajor: Software Engineer\nWORK EXPERIENCE\n06/2015 - 10/2016\nQSOFT VIET NAM\nDEVELOPER\n11/2016 - 10/2017\nHBLAB\nDEVELOPER\n10/2017 - 04/2018\nNEXTTECH GROUP\nDEVELOPER\n04/2018 - present\nNEXUS FRONTIER TECH\nDEVELOPER\nCERTIFICATIONS\n2014\nCertificated of PHP & MySQL\nSKILLS\nProgramming\n- PHP, Laravel, Yii2, Symfony, CodeIgniter \n- Mysql, MongoDB, Redis\n- Javascript, Vuejs, Reactjs, Jquery and other libraly \n- Css, Bootstrap, Wave..\n- Proficient use of PHP MVC, OOP, Design Pattern, Unit Test\nDatabase management\nsystems\nMySql, MongoDB, Redis\nSearch Engine\n- Fulltext search\n- Elasticsearch\nServer\n - Linux Enviroment\n - AWS (EC2, EB, SES, RDS .... )\n - Docker\nSource code management\nGit\nLanguage English\nOther skill\nCan work with Photoshop, Word, Excel, search engines...\nTool supports\n- Mysql workbench\n- Swagger\n- Docker \n- SourceTree\n- IDE and Editor for coding\nManagement\n- Can management team members, support members for resove\nproblems,  support PM for update progress.\nPROJECTS\nQuanjian system\n(2018 - 2019)\nCustomer Chinese\nDescription\nMulti-Level Marketing system\nTeam size\n9\nMy position\nDeveloper\nMy responsibilities\n- Support members solve problems\n- Analysis and design database\n- Development\n- Review code\nTechnologies used\n- Laravel, MySql, Redis, Aws, Docker\nDSVN\n(2018 - 2019)\nCustomer Vietnamese\nDescription\nWeb portal\nTeam size\n7\nMy position\nDeveloper\nMy responsibilities\n- Support members solve problems\n- Analysis and design database\n- Development\n- Review code\nTechnologies used\n- Laravel, ReactJs, MySql, Redis, Aws, Docker, Elasticsearch\nINIS\n(2018 - 2019)\nCustomer\nInternal projects\nDescription\nCRM System\nTeam size\n8\nMy position\nDeveloper\nMy responsibilities\n- Support PM for team management\n- Support members solve problems\n- Analysis and design database\n- Development\n- Review code\n- Optimize code\n- Bug Fixing\nTechnologies used\n- Laravel, ReactJs, MySql, Redis, Aws, Docker, Elasticsearch\nWassha\n(2018 - 2019)\nCustomer JAPAN\nDescription\nERP System - Energy manager at Africa\nTeam size\n12\nMy position\nDeveloper\nMy responsibilities\n- Analysis and design database\n- Development\n- Review code\n- Optimize code\n- Bug Fixing\n- Suport members\nTechnologies used\n- Laravel, ReactJs, MySql, SqlServer, Redis, Aws, Docker\nAda\n(2018 - 2018)\nCustomer\nProject of Company\nDescription\nERP +  CRM Application\nTeam size\n12\nMy position\nDeveloper\nMy responsibilities\n- Analysis and design database \n- Development\n- Optimize code\n- Review code\n- Bug Fixing\n- Write Unit test\nTechnologies used\n- Laravel, Vuejs, MySql, Redis, MongoDB\nTMS\n(2017 - 2018)\nCustomer VtvDigital\nDescription\nTask management system\nTeam size\n2\nMy position\nDeveloper\nMy responsibilities\n- Analysis and design database\n- Development\n- Optimize code\n- Review code\n- Bug Fixing\n- Write Unit test\nTechnologies used\n- Codeigniter, MySql\nDAR544\n(2015 - 2016)\nCustomer\nAustralian customers\nDescription\n- CRM application\nTeam size\n5\nMy position\nDeveloper\nMy responsibilities\n- Development\n- Review code\n- Optimize code\n- Bug Fixing\n- Support Customer\nTechnologies used\n- Wordpress, Query, MySql, Other Plugin and Library ( Paypal, Xero v.v... )\nShowtimes\n(2016 - 2016)\nCustomer\nProduct of company\nDescription\nReal-time entertainment applications\nTeam size\n6\nMy position\nDeveloper\nMy responsibilities\n- Project support \n- Development \n- Bug Fixing\nTechnologies used\n- Codeigniter, MySql, JQuery\nDMM\n(2017 - 2017)\nCustomer\nJapanese customers\nDescription\nApplication of mobile application revenue analysis\nTeam size\n3\nMy position\nDeveloper\nMy responsibilities\n- Analysis and design database\n- Development\n- Optimize code\n- Review code \n- Bug Fixing\nTechnologies used\n- Laravel, MySql, JQuery, AngularJs, Redis\n- Api from Appannie.com\nCARD STORAGE\n(2017 - 2018)\nCustomer\nProduct of company\nDescription\ncard storage\nTeam size\n5\nMy position\nDeveloper\nMy responsibilities\n- Analysis and development \n- Development \n- Optimize code \n- Bug Fixing \n- Deploy product \n- Optimize server\n- Support Customer\n- Write Unit test\nTechnologies used\n- PHP, Yii2, Java, NodeJs, C# , JavaScript\n- MongoDB, MySql, Redis\nTTOL\n(2017 - 2018)\nCustomer\nProduct of company\nDescription\npayment application\nTeam size\n4\nMy position\nDeveloper\nMy responsibilities\n- Maintain the system\n- Support Customer\nTechnologies used\n- PHP, Yii2, JavaScript\n- MongoDB, MySql\nACC\n(2017 - 2018)\nCustomer\nProduct of company\nDescription\nExchange card to real money\nTeam size\n1\nMy position\nDeveloper\nMy responsibilities\n- Analysis and development\n- Development\n- Optimize code\n- Bug Fixing\n- Deploy product\n- Optimize server\nTechnologies used\n- Laravel, MySql, MongoDB, Redis, JavaScript\nButterfly\n(2017 - 2017)\nCustomer\nJapanese customers\nDescription\nreal estate management application\nTeam size\n2\nMy position\nDeveloper\nMy responsibilities\n- Analysis and development\n- Development\n- Optimize code\n- Bug Fixing\nTechnologies used\n- Symfony, MySql, JQuery, Redis\nTOQUOCTV.VN\n(2017 - 2017)\nCustomer\nVietnamese customer\nDescription\nSharing video website\nTeam size\n2\nMy position\nDeveloper\nMy responsibilities\n- Develop website use Laravel\n- Review code\n- Optimize code\n- Bug Fixing\nTechnologies used\n- Laravel, JQuery \nHEC\n(2016 - 2016)\nCustomer\nProduct of company\nDescription\nFootball website\nTeam size\n2\nMy position\nPHP Developer\nMy responsibilities\n- Analysis and design database\n- Development\n- Review code\n- Optimize code\n- Bug Fixing\nTechnologies used\n- Codeigniter, MySql, JQuery\nINTERESTS\nI like soccer, music, film, trip..\nREFERENCES\nMs. Nguyen Phuong Lan\nMs. An ThaoHR of HBLAB \nHR of QSOFT VIET NAM \nEmail: thaoan.tlu93@gmail.com \nEmail: hr@qsoftvietnam.com \n\u00a9 topcv.vn", "educations": [{"id": 5285, "gpa": null, "major": "Software Engineer", "school": "APTECH EDUCATION", "diploma": "Other", "end_time": "2014-10-01T00:00:00Z", "conf_score": 0.9404253900297244, "start_time": "2010-04-01T00:00:00Z", "picklist_major": "Other", "major_categories": "", "major_categories_detail": ""}, {"id": 5286, "gpa": null, "major": "Software Engineer", "school": "HACTECT EDUCATION", "diploma": "Other", "end_time": "2016-08-01T00:00:00Z", "conf_score": 0.9404253900297244, "start_time": "2013-08-01T00:00:00Z", "picklist_major": "Other", "major_categories": "", "major_categories_detail": ""}], "experiences": [{"id": 17699, "detail": "", "company": "NEXUS FRONTIER TECH", "end_time": "2023-04-13T00:00:00Z", "industry": "High Technology", "position": "DEVELOPER", "conf_score": 0.9404253900297244, "start_time": "2018-04-01T00:00:00Z"}, {"id": 17700, "detail": "", "company": "NEXTTECH GROUP", "end_time": "2018-04-30T00:00:00Z", "industry": "High Technology", "position": "DEVELOPER", "conf_score": 0.9404253900297244, "start_time": "2017-10-01T00:00:00Z"}, {"id": 17701, "detail": "", "company": "HBLAB", "end_time": "2017-10-31T00:00:00Z", "industry": "Other", "position": "DEVELOPER", "conf_score": 0.9404253900297244, "start_time": "2016-11-01T00:00:00Z"}, {"id": 17702, "detail": "My responsibilities\n- Develop website use Laravel - Review code\n- Optimize code\n- Bug Fixing Technologies used\n- Laravel, JQuery", "company": "TOQUOCTV.VN", "end_time": "2017-01-31T00:00:00Z", "industry": "Other", "position": "Developer", "conf_score": 0.8366433756272724, "start_time": "2017-01-01T00:00:00Z"}, {"id": 17703, "detail": "", "company": "QSOFT VIET NAM", "end_time": "2016-10-31T00:00:00Z", "industry": "Other", "position": "DEVELOPER", "conf_score": 0.9404253900297244, "start_time": "2015-06-01T00:00:00Z"}, {"id": 17704, "detail": "My responsibilities\n- Analysis and design database\n- Development - Review code\n- Optimize code\n- Bug Fixing Technologies used\n- Codeigniter, MySql, JQuery", "company": "HEC", "end_time": "2016-01-31T00:00:00Z", "industry": "Other", "position": "PHP Developer", "conf_score": 0.8366433756272724, "start_time": "2016-01-01T00:00:00Z"}], "address": "Hanoi, Vietnam"}