{"skills": ["roi", "analysis", "automation", "mixpanel", "database management", "tableau", "internet", "python", "finance", "qlik", "structure", "rss", "linux", "google ads", "digital content", "mysql", "mobile user", "io", "data analytics", "dash", "data mining", "database management system", "sisense", "facebook pixel", "class", "facebook analytics", "marketing", "sql", "marketing strategy", "sales", "google analytics", "online education", "payment", "ibm", "database", "analytics", "banking", "business intelligence system", "business intelligence", "metabase", "sales and marketing", "talend", "crm", "product marketing", "ams", "matomo", "operations management", "pentaho", "market analysis", "analyst", "hadoop", "google tag manager", "mongodb", "postgresql", "management", "medium", "data structure", "etl"], "fulltext": "TR\u1ea6N QUANG C\u01af\u01a0NG (CHARLIE) \nABOUT ME \nI am a Marketing & Business data developer & analyst who specialized in developing \nBusiness Intelligence systems, Marketing & CRM Data Analytics systems and \noptimization processes. \nI have solid knowledge and experience in marketing (10 years) and business data (5 \nyears). The latest \nsystem I built (mainly by myself) is the Business Intelligence System which integrate \nFacebook Ads, \nGoogle Ads and other advertising platforms data with my company CRM to generate \nmeaningful and \nactionable reports in different levels. \nI am familiar with Facebook Marketing API, Google Ads API and other advertising \nplatforms. Besides, I have knowledge and experience with: \n- ETL software (Pentaho, Talend, Stitchdata, Singer.io, etc) and been using them for my \njob. \n- Different database management systems: PostgreSQL, MongoDB, MySQL, Hadoop \nand the others \n- Data mining & visualizer: Metabase, Re:dash, KNIME, Tableau, Looker, Sisense, Power \nBI, Qlik, etc \n- Programming & analytical languages: R, Python, SQL, Javacript, Linux \n- Web & app analytics tools: Google Analytics, Facebook Pixel, Facebook Offline \nConversion, Mixpanel (for apps), Google Tag Manager, Matomo, etc. \n- Marketing automation systems \n- Marketing technologies, practices, strategies and activities \nWORK HISTORY \nTrainer for Topica Edu \u2013 Social \nMedia Course  \nTeacher at FPT University - \nMarketing data analytics Course \nEDUCA CORPORATION \nNOV 2018 \u2013 MAY 2019 \nMARKETING MANAGER \n- Plan and deploy the Business Intelligence System, focusing on Marketing \u2013 \nSales Optimization purposes \n- Consult the BOM on data structure and data enrichment processes \n- Supervise & optimize data flows \nACHIEVEMENTS \n- Successfully integrate Facebook Marketing API, Google Ads API, Google \nAnalytics and other advertising platforms\u2019 APIs with CRM to create \ndifferent levels of performance reports \n(account, campaign, ads, ad contents, landing pages, keywords with ROAs, \nROI) \nAQUOZ SOLUTIONS \nNOV 2016 \u2013 JAN 2018 \nMARKETING MANAGER \n- Develop Marketing strategy & management system \n- Setup new performance tracking & analytics system which integrated all \nadvertising platforms and CRM. \n- Develop user behaviors descriptive & predictive reports \n- Supervise daily activities \n- Report Business results to higher Management on daily basis \nACHIEVEMENTS \n- Marketing strategy which emphasizes mobile user acquisition \n- Successfully integrate new anonymous payment methods \n- Monthly active users increase 15% - 20% each month after optimized \n- Conversion rate (registration/traffic sessions) increases 100% - 200% each \nmonth \n- Reduce the season effect during the last low season \n- Increase monthly affiliate registration up to 200% \nPEACESOFT GROUP \nMAR 2015 \u2013 OCT 2016 \nPRODUCT & MARKETING MANAGER @NG\u00c2N L\u01af\u1ee2NG DIGITAL PAYMENT \u2013 \nPEACESOFT GROUP   Mar 2015 \u2013 Oct 2016 \n- Develop Marketing & Sales strategies \n- Analyze & develop new version of Ng\u00e2n L\u01b0\u1ee3ng \n- Develop new digital payment tools which applied cutting-edge technologies in \nthe world \n- Co-operate with Banks & Payment card brands (Visa, Mastercard, JCB) to \ndeliver discount campaigns to merchants & buyers \n- Supervise daily activities \n- Report Business results to higher Management on monthly basis \nACHIEVEMENTS \n- Marketing & Sales 6-month plan \n- Ng\u00e2n L\u01b0\u1ee3ng\u2019s new frontend \n- New payment tool for Games & Digital Content (Interactive mockups, \nProcess Flowcharts & Detailed technical requirements) \n- New E-commerce Advanced Payment tool (Interactive mockups, Process \nFlowcharts & Detailed technical requirements) \nCOUNTRY MANAGER @WESHOP VI\u1ec6T NAM \u2013 PEACESOFT GROUP \nMar 2015 \u2013 Sep 2015 \n- Develop Marketing, Sales and Operation strategies \n- Build tracking & reporting system (Marketing, CRM & Operation \nManagement) \n- Supervised daily activities \n- Report Business results to higher Management on monthly basis \n- Consult Weshop Indonesia & Malaysia on Marketing & Sales \nACHIEVEMENTS \n- Revenue growth rate was more than 70% - 6 months in a row \n- Marketing & Sales plans are proven effective \n- Designed the UX of the new Operation Management system \n                         TOPICA EDTECH GROUP             FEB 2014 \u2013 MAR 2015 \nMANAGEMENT TRAINER @TOPICA NATIVE THAILAND \u2013 TOPICA EDTECH GROUP \nNov 2014 \u2013 Mar 2015 \n- Operation management trainer \n- Back - office supporter (Legal issues, Logistics, Partners, etc.) \nACHIEVEMENTS \n- Successfully trained 2 Operation staffs who can monitor 5 online classes at \nthe same time, 10 hours of monitoring every day. \n- New Operation procedure to merge Thailand classes with Vietnam classes, \nwhich reduced half of operation cost \n- Detailed reports on Thailand Business laws, suggestion of practical business \nforms, lists of partners, top suitable business locations, etc. \nHEAD OF SOCIAL MEDIA @TOPICA PHILIPPINES - TOPICA EDTECH GROUP \nJune 2014 \u2013 Nov 2014 \n- Developed Content & Branding plans \n- Analyzed Philippines Online Education market segments \n- Developed Marketing & Sales budget plans \n- Report Marketing results to higher Management on monthly basis \n- Supervised daily activities \nACHIEVEMENTS \n- The Philippines market analysis: Education, Labor, Internet usage, \nOnline marketing activities \n- Marketing budget plans \n- The official site of AMA - TOPICA Programs \nFINANCIAL ANALYST @IBM VI\u1ec6T NAM \nMay 2011 - Nov 2011 \n- Reviewed new contracts regarding to budget details \n- Reported weekly budget & cash flow of existing projects \n- Adjusted projects' budget allocations according to Project Managers' \nfeedbacks \nSKILLS \n- Marketing APIs: Facebook, Google, Ad networks \n- ETL softwares (Pentaho, Talend, Stitchdata, Singer.io, etc) and been using \nthem for my job. \n- CRM, ERP, Ad servers \n-- ETL software (Pentaho, Talend, Stitchdata, Singer.io, etc) and been using \nthem for my job. \n- Different database management systems: PostgreSQL, MongoDB, MySQL, \nHadoop and the others \n- Data mining & visualizer: Metabase, Re:dash, KNIME, Tableau, Looker, \nSisense, Power BI, Qlik, etc \n- Programming & analytical languages: R, Python, SQL, Javacript, Linux \n- Web & app analytics tools: Google Analytics, Facebook Pixel, Facebook \nOffline Conversion, Mixpanel (for apps), Google Tag Manager, Matomo, \netc. \n- Marketing automation systems \n- Marketing technologies, practices, strategies and activities \n- Data mining & visualizer: Metabase, Re:dash, KNIME, Tableau \n- Programming & analytical languages: R, Python, SQL, Javacript, Linux \n- Tracking systems: Google Analytics, Facebook Pixel, Facebook Offline \nConversion, Mixpanel (for apps), Google Tag Manager, Matomo, etc. \n- Marketing automation systems \n- Marketing technologies, practices, strategies and activities \nEDUCATION \nBACHELOR OF FINANCE & BANKING @H\u00c0 N\u1ed8I UNIVERSITY \nPage | 2 \nTR\u1ea6N QUANG C\u01af\u01a0NG (CHARLIE) \nPage | 3 \nTR\u1ea6N QUANG C\u01af\u01a0NG (CHARLIE) \nPage | 4 \nTR\u1ea6N QUANG C\u01af\u01a0NG (CHARLIE) ", "educations": [{"id": 5310, "gpa": null, "major": "T\u00e0i ch\u00ednh \u2013 Ng\u00e2n h\u00e0ng", "school": "H\u00c0 N\u1ed8I UNIVERSITY", "diploma": "Bachelors", "end_time": null, "conf_score": 0.7425892496252853, "start_time": null, "picklist_major": "Finance/Investment", "major_categories": "Kinh doanh v\u00e0 qu\u1ea3n l\u00fd", "major_categories_detail": "T\u00e0i ch\u00ednh \u2013 Ng\u00e2n h\u00e0ng \u2013 B\u1ea3o hi\u1ec3m"}], "experiences": [{"id": 17774, "detail": "- Plan and deploy the Business Intelligence System, focusing on Marketing - Sales Optimization purposes\n- Consult the BOM on data structure and data enrichment processes\n- Supervise & optimize data flows\nACHIEVEMENTS - Successfully integrate Facebook Marketing API, Google Ads API, Google Analytics and other advertising platforms\u2019 APIs with CRM to create different levels of performance reports (account, campaign, ads, ad contents, landing pages, keywords with ROAs, ROI)", "company": "EDUCA CORPORATION", "end_time": "2019-05-31T00:00:00Z", "industry": "Other", "position": "MARKETING MANAGER", "conf_score": 0.807605089001321, "start_time": "2018-11-01T00:00:00Z"}, {"id": 17776, "detail": "- Develop Marketing strategy & management system\n- Setup new performance tracking & analytics system which integrated all advertising platforms and CRM. - Develop user behaviors descriptive & predictive reports\n- Supervise daily activities\n- Report Business results to higher Management on daily basis\nACHIEVEMENTS - Marketing strategy which emphasizes mobile user acquisition\n- Successfully integrate new anonymous payment methods\n- Monthly active users increase 15% - 20% each month after optimized\n- Conversion rate (registration/traffic sessions) increases 100% - 200% each month\n- Reduce the season effect during the last low season\n- Increase monthly affiliate registration up to 200%", "company": "AQUOZ SOLUTIONS", "end_time": "2018-01-31T00:00:00Z", "industry": "High Technology", "position": "MARKETING MANAGER", "conf_score": 0.9089868123963978, "start_time": "2016-11-01T00:00:00Z"}, {"id": 17778, "detail": "", "company": "PEACESOFT GROUP", "end_time": "2016-10-31T00:00:00Z", "industry": "Other", "position": "PRODUCT & MARKETING MANAGER", "conf_score": 0.8878736814268848, "start_time": "2015-03-01T00:00:00Z"}, {"id": 17780, "detail": "- Develop Marketing, Sales and Operation strategies\n- Build tracking & reporting system (Marketing, CRM & Operation Management) - Supervised daily activities\n- Report Business results to higher Management on monthly basis\n- Consult Weshop Indonesia & Malaysia on Marketing & Sales ACHIEVEMENTS - Revenue growth rate was more than 70% - 6 months in a row\n- Marketing & Sales plans are proven effective\n- Designed the UX of the new Operation Management system", "company": "WESHOP VI\u1ec6T NAM - PEACESOFT GROUP", "end_time": "2015-09-30T00:00:00Z", "industry": "Other", "position": "COUNTRY MANAGER", "conf_score": 0.9089868123963978, "start_time": "2015-03-01T00:00:00Z"}, {"id": 17781, "detail": "- Operation management trainer\n- Back - office supporter (Legal issues, Logistics, Partners, etc.)\nACHIEVEMENTS - Successfully trained 2 Operation staffs who can monitor 5 online classes at the same time, 10 hours of monitoring every day.\n- New Operation procedure to merge Thailand classes with Vietnam classes, which reduced half of operation cost\n- Detailed reports on Thailand Business laws, suggestion of practical business forms, lists of partners, top suitable business locations, etc.", "company": "TOPICA NATIVE THAILAND - TOPICA EDTECH GROUP", "end_time": "2015-03-31T00:00:00Z", "industry": "Education", "position": null, "conf_score": 0.7445781313151084, "start_time": "2014-11-01T00:00:00Z"}, {"id": 17782, "detail": "", "company": "TOPICA EDTECH GROUP", "end_time": "2015-03-31T00:00:00Z", "industry": "Education", "position": "MANAGEMENT TRAINER", "conf_score": 0.8878736814268848, "start_time": "2014-02-01T00:00:00Z"}, {"id": 17783, "detail": "- Developed Content & Branding plans\n- Analyzed Philippines Online Education market segments\n- Developed Marketing & Sales budget plans\n- Report Marketing results to higher Management on monthly basis\n- Supervised daily activities\nACHIEVEMENTS - The Philippines market analysis: Education, Labor, Internet usage,\nOnline marketing activities\n- Marketing budget plans\n- The official site of AMA - TOPICA Programs", "company": "TOPICA PHILIPPINES - TOPICA EDTECH GROUP", "end_time": "2014-11-30T00:00:00Z", "industry": "Education", "position": "HEAD OF SOCIAL MEDIA", "conf_score": 0.7460834643392837, "start_time": "2014-06-01T00:00:00Z"}, {"id": 17784, "detail": "- Reviewed new contracts regarding to budget details\n- Reported weekly budget & cash flow of existing projects\n- Adjusted projects' budget allocations according to Project Managers' feedbacks\nTR\u1ea6N QUANG C\u01af\u01a0NG (CHARLIE) TR\u1ea6N QUANG C\u01af\u01a0NG (CHARLIE)", "company": "IBM VI\u1ec6T NAM", "end_time": "2011-11-30T00:00:00Z", "industry": "Other", "position": "FINANCIAL ANALYST", "conf_score": 0.9089868123963978, "start_time": "2011-05-01T00:00:00Z"}], "address": null}