{"skills": ["nunit", "cluster computing", "analysis", "microsoft project", "algorithm", "configuration management", "resource management system", "process management", "design pattern", "azure", "mysql", "human resources", "mvc", "lifecycle", "angularjs", "configuration management tool", "unit testing", "redmine", "studio", "scala", "testing", "agile", "apache spark", "eauthentication", "selenium", "visual studio", "netbeans", "window server", "apache", "database", "object oriented", "cloud", "librarian", "php", "test driven development", "management", "java language", "management tool", "machine learning", "azure machine learning", "jbuilder", "java", "git", "service oriented architecture", "finance", "data analytics", "procurement", "c#", "bug fixing", "moat", "banking", "data management", "recruitment", "software development", "computing platform", "erp system", "hadoop", "postgresql", "data structure", "restful", "salesforce", "data integration", "github", "automation", "svn", "automation test", "tomcat", "structure", "linux", "oracle", "insurance", "entity framework", "ftp", "angular", "mssql", "microsoft", "jboss", "unit test", "marketing", "sql", "analytics", "enterprise", "teamwork", "solaris", "asp"], "fulltext": "R\u00c9SUM\u00c9 \nName: \nMINH NGUYEN (Mr.) \nEXPERIENCE & SKILL SUMMARY \n\uf0b7 \n8 years of experience in software development  \no \n7 years of experience working on C# for both WinForm and WebForm \no \n1 year of experience working in Java, PHP  \n\uf0b7 \nExperienced in Data Structures.  \n\uf0b7 \nFairly good at Design Patterns. \n\uf0b7 \nExperience in developing new features, bug fixing \n\uf0b7 \nTeam lead in multiple projects. Well adapt to keep up with new technologies  \n\uf0b7 \nGood knowledge in Service-oriented architecture: Restful API, Web Service \n\uf0b7 \nExperience on Human Resource Management (HRM) software development \n\uf0b7 \nGood at .NET Framework \n\uf0b7 \nGood at Object Oriented Programming. \n\uf0b7 \nOverseas working experiences: \no 2013: Malaysia (6 months) \no 2016 : United Kingdom (1 month) \nTECHNICAL  SKILLS \n\uf0b7 \nProgramming languages:  \no \n.NET Framework 3, 4 & 4.5 \n\uf0a7 \nC# \n\uf0a7 \nASP.NET, ASP.NET MVC \n\uf0a7 \nEntity Framework \no \nAngularJS \no \nJava \no \nPHP \no \nSQL \no \nWindow Azure \n\uf0b7 \nIDE/CASE tools: MS Visual Studio .NET, JBuilder, NetBeans, Eclipse \n\uf0b7 \nApplication/Web servers: IIS, Apache/Tomcat , JBoss \n\uf0b7 \nDatabase: MS SQL, PostgreSQL, MySQL, Oracle \n\uf0b7 \nPlatform: Windows, Linux, Solaris  \n\uf0b7 \nConfiguration management tools: Subversion, GitHub \n\uf0b7 \nBug tracking and source control tools: Microsoft TFS, GitHub, Subversion \n\uf0b7 \nTesting tools: MSUnit, NUnit, Moq \n\uf0b7 \nAutomation test: Selenium  \n\uf0b7 \nWorking in multiple platforms: Windows, Linux \nCOMPANIES \nPage 1 of 3 \n07-July-2008 \n28-July-2009 \nNhat Viet Co.Ltd \n03-Aug-2009 \n25-Dec-2010 \nDigital Zen Joint Stock Company \n03-Jan-2011 \n01-July-2013 \nAsia Soft Game Co.Ltd \n01- July-2013 \n01- November-2014 \nUnit Corp Co.Ltd \n01- December-2014 \n30- June-2017 \nTMA \n01- July-2017 \nUp To Present \nNashTech \nPage 2 of 3 \nRELEVANT PROJECTS \nPROJECTS  TECHNOLOGIES  Company \nThird-Quadrant \n\uf0a7 \nBusiness: \nHorse \nRacing \nNashTech \nPrediction - This is complicate \nbusiness \nwith \nmultiple \nformulas,  calculation, \nalgorithms \n\uf0a7 \nTechnique:  \no .Net Core \no Data Integration: MSSQL \nServer 2017, MySQL \no Predict Algorithms with \nAzure Machine Learning, \no Build \nand \napply \nAsynchronous \narchitecture as well as \non-time system (live) \no Working with Dapper \no Unit Test with NUnit and \nFluentAssertion \n\uf0a7 \nWork Roles:  \no Build Framework, \nAPI \nproject  with \nauthentication, set up \nSQL Data Tool for Data \nManagement \no Work out prediction with \ndifferent  logic  and \ncalculation : Use Azure \nMachine Learning APIs \no Provide review for team \nmembers \nMyBiz \nNashTech \n\uf0a7 \nBusiness: This is ERP system \nincluding multiple fields such as \nSpending \nAnalysis, \nTender \nProcess, Auction Contract, and \nProcurement  \n\uf0a7 \nWork Roles:  \na. MySpendNet \nb. MyProcureNet \nc. MySupplierNet \nd. MyTenderNet \ne. MyAuctionNet \nf. MyContractNet \no Build Framework, set up \nsystem: (Web, Api, SQL \nData Tool, DbUp) \nPage 3 of 3 \no Improve system \nGroupM \n\uf0a7 \nBusiness: Marketing \nNashTech \n\uf0a7 \nTechnique: Usage of Database \nIntegration with 8 different \nresources: AppNexus - S3 - API, \nSizmek \u2013 S3 \u2013 FTP, MOAT - FTP, \nTradeDesk, \nSalesforce, \nDataMart, Videology \n\uf0a7 \nDBMS: MS SQL 2008 - 2014, \nMySQL \n\uf0a7 \nSource Control: Subversion \nSVN \nTMA \n\uf0a7 \nSpark Solution: A big data \nanalytics \ncluster-computing \nframework written in Scala. In-\nMemory analytics which is \nfaster than Hadoop/Hive (up to \n100x). \n\uf0a7 \nDBMS: MS SQL 2014 \n\uf0a7 \nManagement process: TFS \n\uf0a7 \nSource \nControl: \nSubversion \nMoney3 \n(October 2016 \u2013 December 2016) \nMoney3 is a system that serves for \nloan service. This project is applied \nbig data approach with Apache \nSpark for searching duplicate clients \nPosition: Consultant \nDuties:  \nSVN, TFS \n\uf0b7 \nDocumenting \ntechnical \nspecification  for  many \nfeatures \n\uf0b7 \nDesigning and \nimplementing features \nwith the team. \n\uf0b7 \nDoing code review for \nteam members \n\uf0b7 \nBuilding web framework. \nWorking with Web API, etc.\u2026 \n\uf0a7 \nLanguage: C# \nTMA \n\uf0a7 \nEnterprise application \nframework: .NET Framework \n4.5.2 \n\uf0a7 \nDBMS: MS SQL 2014 \nInteractive \n(July 2016 - October 2016) \nInteractive is a web system that \nserves for cleaning service. This \nsystem \nis \napplied \nnotification \n\uf0a7 \nManagement process: TFS \n\uf0a7 \nPlatforms: Windows \n\uf0a7 \nTest automation tools: \nSelenium  \n\uf0a7 \nSource Control: Subversion \nSVN, TFS \nincluding mail template, SMS and \nothers. \nPosition: Consultant \nDuties:  \n\uf0b7 \nDocumenting \ntechnical \nspecification  for  many \nfeatures \nPage 4 of 3 \n\uf0b7 \nDesigning and \nimplementing features \nwith the team. \n\uf0b7 \nDoing code review for \nteam members \n\uf0b7 \nBuilding web framework. \n\uf0a7 \nLanguage: C# \nTMA \n\uf0a7 \nEnterprise application \nframework: .NET Framework \n4.5 \n\uf0a7 \nDBMS: MS SQL 2014 \n\uf0a7 \nWeb server: Window Azure \n\uf0a7 \nManagement process: Microsoft \nProject, TFS \nWorking with Web API, etc.\u2026 \nSherpa \n(March. 2015 \u2013 June 2016) \nSherpa is an integrated web platform \nthat combines all the tools shift-based \nteams need to manage their daily work \nlife more effectively. Sherpa manages \nthe complete employee lifecycle from \nrecruitment, \nonboarding, \ntraining, \n\uf0a7 \nPlatforms: Windows \ncommunications,  document \n\uf0a7 \nTest automation tools: \nSelenium  \nSource Control: Subversion \nSVN, Git \nmanagement, rostering and time & \nattendance in one powerful, seamlessly \nintegrated platform. Sherpa puts people \nin control of their work lives and \nprovides real time visibility and control \nacross entire workforces. \nPosition: Consultant \nDuties:  \n\uf0b7 \nDocumenting \ntechnical \nspecification  for  many \nfeatures \n\uf0b7 \nDesigning and \nimplementing features \nwith the team. \n\uf0b7 \nDoing code review for \nteam members \n\uf0b7 \nBugs fixing. \n\uf0b7 \nWorking with Web API, \nWindow Azure, Angular JS, \netc.\u2026 \nUNITCORP \n\uf0a7 \nLanguage: C# \n\uf0a7 \nEnterprise application \nframework: .NET Framework \n\uf0a7 \nDBMS: MS SQL \n\uf0a7 \nWeb server: IIS \n\uf0a7 \nManagement process: \nMicrosoft Project \n\uf0a7 \nPlatforms: Windows \n\uf0a7 \nTest automation tools: \nRedmine, Selenium  \n\uf0a7 \nSource Control: Subversion \nX-Talent HRM  \n(January. 2014 \u2013 December 2014) \nX-Talent HRM is a human resource \nmanagement system including \nemployee recruitment, interview, \ntraining, salary, overtime pay due, \nsocial insurance, discipline as well as \nrewarding \u2026 \nPosition: Team Leader \nDuties:  \n\uf0b7 \nCoordinating with \ncustomer to collect and \nPage 5 of 3 \nmake requirements for \nnew features \n\uf0b7 \nDoing estimate and \nmaking development plan \nfor new features \n\uf0b7 \nDesigning and \nimplementing features \nwith the team. \n\uf0b7 \nDocumenting design \nspecification for the \nfeatures \n\uf0b7 \nDoing code review for \nteam members \n\uf0b7 \nDoing feature demo to the \ncustomer \nTQS \n\uf0a7 \nLanguage: C# \n\uf0a7 \nDBMS: MS SQL \n\uf0a7 \nPlatforms: Windows \n\uf0a7 \nSource Control: Subversion \nHBF \n(Jan. 2013 \u2013 Dec 2013) \nHBF is a software that focus on \nmanagement for housing, banking, \nand finance for restaurants, hotels and \nbanks. \nPosition: Developer \nDuties:  \n\uf0b7 \nCoordinating with \ncustomer to collect and \nmake requirements for \nnew features \n\uf0b7 \nDoing estimate and \nmaking development plan \nfor new features \n\uf0b7 \nDesigning and \nimplementing features \nwith the team. \n\uf0b7 \nDocumenting design \nspecification for the \nfeatures \n\uf0b7 \nDoing code review for \nteam members \n\uf0b7 \nDoing feature demo to the \ncustomer \nVASS \n\uf0a7 \nLanguage: Java \n\uf0a7 \nDBMS: Oracle \n\uf0a7 \nWeb server: Tomcat/Apache \n\uf0a7 \nPlatforms: Windows, Linux \n\uf0a7 \nSource Control: Subversion \nAlfresco \n(Jan. 2012 \u2013 Dec 2012) \nThis web project is to management \nfiles and documents \nPosition: Team Lead \nDuties:  \n\uf0b7 \nCollecting and \ndocumenting requirement \nspecifications \nPage 6 of 3 \n\uf0b7 \nAnalyzing the \nrequirements and \ndesigning the software \n\uf0b7 \nWriting codes and testing \nit \nVASS \n\uf0a7 \nLanguage: C# \n\uf0a7 \nEnterprise application \nframework: .NET Framework \n\uf0a7 \nDBMS: MS SQL \n\uf0a7 \nWeb server: IIS \n\uf0a7 \nManagement process: Xmind, \nMicrosoft Project \n\uf0a7 \nPlatforms: Windows \ne-Commerce \n(Jan. 2011 \u2013 Dec 2011) \nThis web project is a commerce \nsolution together with the Content \nManagement System. \nPosition: Developer \nDuties:  \n\uf0a7 \nTest automation tools: \nSelenium  \nSource Control: Subversion \n\uf0b7 \nCollecting and \ndocumenting requirement \nspecifications \n\uf0b7 \nAnalyzing the \nrequirements and \ndesigning the software \n\uf0b7 \nWriting codes and testing \nit \n\uf0a7 \nLanguage: C#  \n\uf0a7 \nDBMS: MS SQL \n\uf0a7 \nPlatforms: Windows  \nLibrary Management System \n(July. 2008 \u2013 Dec. 2009) \nThis project is to develop a software \nthat provides solutions for library \nmanagement process and library \nusage: \n- \nMaintain the details of books and \nlibrary members. \n- \nAllow members to query \navailability of books and maximum \nlimit for borrowing and to borrow \nbooks. \n- \nAllow librarian to make statistical \nreports \n- \nManage books, book borrowing, \ninsertion and monitoring \nPosition: Developer \nDuties: \n\uf0b7 \nCollecting and \ndocumenting requirement \nspecifications \n\uf0b7 \nAnalyzing the \nrequirements and \ndesigning the software \n\uf0b7 \nWriting codes and testing \nit \nPage 7 of 3 \nPERSONALITY \n- \nHonest, trustworthy, enthusiastic,self-motivated \n- \nHigh responsibility \n- \nTeamwork \n- \nWork under pressure \nEDUCATION \n\uf0b7 \n2001 \u2013 2005 \nBachelor of English \nV\u0103n Lang University \n\uf0b7 \n2005 \u2013 2007 \nDiploma of Vocational Training Information Technology in Graphics and \nMultimedia Art Design \nUniversity of Science, HCMC, Vietnam \n\uf0b7 \n2005 \u2013 2007 \nBachelor Degree in Computer Science (DISM, HISM) \nFPT-APTECH HCM, Vietnam \nCOURSES/WORKSHOPS ATTENDED \nYear \nTitle \nOrganized By \n2015 \nAzure - Microsoft's Cloud Computing Platform  \nTMA Solutions \n2015 \nSharePoint \nTMA Solutions \n2015 \nAngular \nTMA Solutions \n2015 \nEntity Framework \u2013 Code First \nTMA Solutions \n2015 \nUnit Testing (MSUnit / NUnit, Moq) \nTMA Solutions \n2015 \nAgile \nTMA Solutions \n2015 \nTest Driven Development \nTMA Solutions \n2015 \nAdvanced Web API \nTMA Solutions \nPage 8 of 3 ", "educations": [{"id": 5336, "gpa": null, "major": "C\u00f4ng ngh\u1ec7 k\u1ef9 thu\u1eadt v\u1eadt li\u1ec7u x\u00e2y d\u1ef1ng", "school": "University of Science", "diploma": "Bachelors", "end_time": "2007-01-01T00:00:00Z", "conf_score": 0.7897513794629749, "start_time": "2005-01-01T00:00:00Z", "picklist_major": "Technical", "major_categories": "C\u00f4ng ngh\u1ec7 k\u1ef9 thu\u1eadt", "major_categories_detail": "C\u00f4ng ngh\u1ec7 k\u1ef9 thu\u1eadt ki\u1ebfn tr\u00fac v\u00e0 c\u00f4ng tr\u00ecnh x\u00e2y d\u1ef1ng"}, {"id": 5335, "gpa": null, "major": "English", "school": "V\u0103n Lang University", "diploma": "Bachelors", "end_time": "2005-01-01T00:00:00Z", "conf_score": 0.8413267261986577, "start_time": "2001-01-01T00:00:00Z", "picklist_major": "Other", "major_categories": "", "major_categories_detail": ""}], "experiences": [{"id": 17848, "detail": "", "company": "Nhat Viet Co.Ltd", "end_time": "2028-04-30T00:00:00Z", "industry": "Other", "position": null, "conf_score": 0.7464532525524961, "start_time": "2009-07-01T00:00:00Z"}, {"id": 17850, "detail": "", "company": "Digital Zen Joint Stock Company", "end_time": "2025-04-30T00:00:00Z", "industry": "High Technology", "position": null, "conf_score": 0.7464532525524961, "start_time": "2010-12-01T00:00:00Z"}, {"id": 17852, "detail": "Sherpa is an integrated web platform that combines all the tools shift-based teams need to manage their daily work life more effectively. Sherpa manages the complete employee lifecycle from recruitment, onboarding, training,\nPlatforms: Windows communications, document\nTest automation tools:\nSelenium Source Control: Subversion SVN, Git management, rostering and time & attendance in one powerful, seamlessly integrated platform. Sherpa puts people in control of their work lives and provides real time visibility and control across entire workforces.\nPosition: Co", "company": null, "end_time": "2016-06-30T00:00:00Z", "industry": "Other", "position": "Consultant", "conf_score": 0.7411424838253973, "start_time": "2015-03-01T00:00:00Z"}, {"id": 17854, "detail": "o\n7 years of experience working on C# for both WinForm and WebForm o\n1 year of experience working in Java, PHP Experienced in Data Structures. Fairly good at Design Patterns. Experience in developing new features, bug fixing\nTeam lead in multiple projects. Well adapt to keep up with new technologies\nGood knowledge in Service-oriented architecture: Restful API, Web Service Experience on Human Resource Management (HRM) software development\nGood at .NET Framework Good at Object Oriented Programming. Overseas working experiences: o 20", "company": null, "end_time": "2016-01-31T00:00:00Z", "industry": "Other", "position": "software development", "conf_score": 0.8086621310791741, "start_time": "2013-01-01T00:00:00Z"}, {"id": 17855, "detail": "Language: C# Enterprise application framework: .NET Framework DBMS: MS SQL Web server: IIS Management process:\nMicrosoft Project Platforms: Windows Test automation tools:\nRedmine, Selenium Source Control: Subversion make requirements for new features\nDoing estimate and making development plan for new features\nDesigning and implementing features with the team.\nDocumenting design specification for the features\nDoing code review for team members\nDoing feature demo to the customer", "company": "X - Talent HRM", "end_time": "2014-12-31T00:00:00Z", "industry": "Other", "position": "Team Leader", "conf_score": 0.8087261703987104, "start_time": "2014-01-01T00:00:00Z"}, {"id": 17856, "detail": "Duties: Coordinating with customer to collect and make requirements for new features\nDoing estimate and making development plan for new features\nDesigning and implementing features with the team.\nDocumenting design specification for the features\nDoing code review for team members\nDoing feature demo to the customer", "company": "HBF", "end_time": "2013-12-31T00:00:00Z", "industry": "Other", "position": "Developer", "conf_score": 0.8087261703987104, "start_time": "2013-01-01T00:00:00Z"}, {"id": 17857, "detail": "", "company": "Asia Soft Game Co.Ltd", "end_time": "2013-07-31T00:00:00Z", "industry": "High Technology", "position": null, "conf_score": 0.7464532525524961, "start_time": "2001-04-13T00:00:00Z"}, {"id": 17858, "detail": "VASS Language: Java DBMS: Oracle Web server: Tomcat/Apache Platforms: Windows, Linux Source Control: Subversion Alfresco ( Analyzing the requirements and designing the software\nWriting codes and testing it", "company": "HBF", "end_time": "2012-12-31T00:00:00Z", "industry": "Other", "position": "Team Lead", "conf_score": 0.7151136457677363, "start_time": "2012-01-01T00:00:00Z"}, {"id": 17859, "detail": "This project is to develop a software that provides solutions for library management process and library usage:\n- Maintain the details of books and library members.\n- Allow members to query availability of books and maximum limit for borrowing and to borrow books.\n- Allow librarian to make statistical reports\n- Manage books, book borrowing, insertion and monitoring\nPosition:", "company": "HBF", "end_time": "2009-12-31T00:00:00Z", "industry": "Other", "position": "Library", "conf_score": 0.7974278851898919, "start_time": "2008-07-01T00:00:00Z"}], "address": null}