{"skills": ["customer service skill", "streaming", "java", "css", "administration", "analysis", "cdc", "internet", "desktop", "html", "mysql", "oracle", "tizen", "jquery", "angular", "making decision", "marketing", "sql", "sales", "management information system", "magento", "html5", "lua", "database", "ping", "sales and marketing", "oracle development", "ams", "database administration", "php", "software development", "operating system", "information management", "management", "communication skill"], "fulltext": "Beshoy Fares Zaki \nExperience (more 8 Years) \n Personal information:  \nCountry \n: Egypt \nMobile \n: (002)  01272215230 - 01007449501 \nEmail \n: besho_all@hotmail.com \nSkype_Id \nbeshoy_fares \nNationality \n: Egyptian \nMarital Status \n: Single. \nMilitary Status \n: Exempted. \nGradational Year :2006 \nJob Objective: \nI' am seeking a challenging position with a reputable organization in the field of \nSoftware Development that enables me to further develop and enhance my \nsoftware experience and become an active participant in the organization \nSuccess. \nEducation: \n\uf0b7 \n2002: 2006:Bachelor\u2019s degree in Computer Science, Faculty of \nComputersand Information technology - Assiut \nUniversity - July 2006\uf020\n\uf020\n\uf0b7 \nGeneral Evaluation:  Good (71.8 %)\uf020\n\uf0b7 \nGraduation Project: Graduation Project grade: \"Excellent\". \nWork Experience \nE-Commerce Developer and Administration  \n  - Magento Developer \n    Upwork  \n    Dec 2015 \u2013 Present \n   Expert e-commerce developer \"Magento \" (Backend and frontend )  \n   Develop and Support E-commerce stores  \n   Certified Trainee - Magento 2 development  \n- Shopify Developer \n   Freelancer \n  2018 \u2013 Present \n   Work as Ecommerce developer \"Shopify\" for Matsmall site \n   - Building site from scratch  \n   - Support and Administration  \n   - Work with Marketing and Sales team SEO requirements to increase sales \nSmart TVs App Developer  \n   Freelancer.com \n  Jan 2013 \u2013 Present \n  Egypt \n  - Samsung Smart TV Developer  \n  - Lg Smart TV app developer  \n   Streaming video apps \nSenior System admin (GIS) \n  Esri \n  Jun 2008 \u2013 Dec 2013 \nAbout five years experience at ESRI (QS4IT) - Senior Technical Database Administrator -System \nAdministrator for GIS project. \nWork Profiles  \nLinkedIn Account:  \nhttps://www.linkedin.com/in/beshoy-fares-02427542/ \nFreelancer Account : \nhttps://www.freelancer.com/u/beshoyfares.html \nUpwork Account:  \nhttps://www.upwork.com/freelancers/~01a244e155ab40adce \nCertificates: \n\uf0b7 \nMangento 2 Certified Trainee Development\uf020\n\uf0b7 \nORACLE internet Application Developer Certified Professional (OCP).\uf020\n\uf0b7 \nORACLE Database 10g Administrator Certified Professional (OCP).\uf020\n\uf0b7 \nCertification from CDC Career Development Consultant Academy, March \n2007. For Business English course, upper intermediate level\uf020\n\uf0b7 \nCertification from CDC Career Development Consultant Academy, March \n2007. For Managerial Courses ( management skills, Communication skills,\uf020\nPresentation skills, Decision Making, Team Work \nskills, Marketing Skills, Customer Service skills). \n\uf020\n\uf020\nProfessional Training and Qualification: \n\uf045 Magento 2 development course:    Nov 2017 from official www.magento.com\uf020\n\uf045Oracle courses: \nApr 07-Oct 07 Orascom Training & Technology (OTT) \n\uf0a7 \nOracle Database 10g: Introduction to SQL.\uf020\n\uf020\n\uf0a7 \nOracle Database 10g: Program with PL/SQL.\uf020\n\uf020\n\uf0a7 \nOracle Forms Developer 10g: Build Internet Applications.\uf020\n\uf020\n\uf0a7 \nOracle Reports Developer: Build Internet Reports\uf020\n\uf020\n\uf0a7 \nOracle Database Administration (Workshop I)\uf020\n\uf020\n\uf0a7 \nOracle Database Administration (Workshop ||)\uf020\n\uf020\n\uf0a7 \nOracle 10G Application Server.\uf020\n\uf0a7 \n\uf020\n\uf045GIS courses (ESRI): \n\uf0a7 \nArcGIS Desktop I\uf020\n\uf020\n\uf0a7 \nArcGIS Desktop II\uf020\n\uf020\n\uf0a7 \nArcGIS Server\uf020\n\uf020\n\uf0a7 \nMultiuser Geodatabase\uf020\n\uf020\n\uf0a7 \nACTO\uf020\nTechnical Skills \nEssential Topics: \n\uf0b7 \nE-commerce \n\uf0b7 \nAlgorithms \n\uf0b7 \nDatabase \n\uf0b7 \nInformation Engineering \n\uf0b7 \nSystem Analysis \n\uf0b7 \nNetwork \n\uf0b7 \nComputer Organization. \n\uf0b7 \nGIS \n\uf0b7 \nSoftware Engineering \n\uf0b7 \nOperating Systems \nTechnology: \n\uf0b7 \nOracle Developer 10g Database Engines (SQL, PL\\SQL).\uf020\n\uf0b7 \nOracle Developer with Developer suite 10g (Forms, Report).\uf020\n\uf0b7 \nOracle Administration (Workshop I, Workshop II).\uf020\n\uf0b7 \nOracle Application server (Good knowledge).\uf020\n\uf0b7 \nArcGIS Desktop\uf020\n\uf0b7 \nPHP \n\uf0b7 \nMySQL \n\uf0b7 \nPowershell \n\uf0b7    Java Script & JQuery \n\uf0b7 \nSamsung TV \n\uf0b7 \nInstaller Deployment \u201cNSIS,Inno\u201d \n\uf0b7 \nAngular \n\uf0b7 \nNodeJs \n\uf0b7 \nLiquid \n\uf0b7 \nLUA \n\uf0b7 \nCSS \n\uf0b7 \nHTML5 \n\uf0b7 \nJava Script \n\uf0b7 \nTizen framwork \n\uf020\n\uf020\n\uf020\n\uf020\n\uf0b7\n\uf020 \n\uf020\nOracle Experience \nTCMIS project \nTeam member of TCMIS project (Training center management information system) \nthat is done in OTT (Orascom Training and Technology) \nCompany as a gradational project for MCIT scholarship. \nAdditional Information: (other skills and interests) \nLanguage Skills: \nArabic: Excellent command of Arabic as the mother tongue. \nEnglish: Very Good command of English. \nInterests: \no \nReading in information technology. \no Playing ping-pong and football. \nManagement & Other skills \no Work in a Team spirit. \no Flexibility to learn and work outside normal working \nhours. o Efficient in working under pressure. \no Capable to deal and work with people from various cultures. \no Fast learner for any tool in the Developing Field. \nReferences are upon request\u2026 \nPowered by TCPDF (www.tcpdf.org)", "educations": [{"id": 5334, "gpa": null, "major": "Khoa h\u1ecdc m\u00e1y t\u00ednh", "school": "Computersand Information technology - Assiut\nUniversity", "diploma": "Bachelors", "end_time": "2006-07-01T00:00:00Z", "conf_score": 0.7696199437739497, "start_time": "2006-01-01T00:00:00Z", "picklist_major": "IT - Hardware/Networking", "major_categories": "M\u00e1y t\u00ednh v\u00e0 c\u00f4ng ngh\u1ec7 th\u00f4ng tin", "major_categories_detail": "M\u00e1y t\u00ednh"}], "experiences": [{"id": 17846, "detail": "\"Shopify\" for Matsmall site\n- Building site from scratch\n- Support and Administration - Work with Marketing and Sales team SEO requirements to increase sales", "company": "Upwork", "end_time": "2023-04-13T00:00:00Z", "industry": "Other", "position": "Shopify Developer\nFreelance", "conf_score": 0.8044329014146352, "start_time": "2018-01-01T00:00:00Z"}, {"id": 17849, "detail": "xpert e-commerce developer \"Magento \" (Backend and frontend ) Develop and Support E-commerce stores\nCertified Trainee - Magento 2 development", "company": "Upwork", "end_time": "2023-04-13T00:00:00Z", "industry": "Other", "position": "E - Commerce Developer and Administration\n - Magento Develope", "conf_score": 0.9062039189695287, "start_time": "2015-12-01T00:00:00Z"}, {"id": 17851, "detail": "Egypt - Samsung Smart TV Developer - Lg Smart TV app developer\nStreaming video apps", "company": "Upwork", "end_time": "2023-04-13T00:00:00Z", "industry": "Other", "position": "Smart TVs App Developer", "conf_score": 0.6981244904084882, "start_time": "2013-01-01T00:00:00Z"}, {"id": 17853, "detail": "About five years experience at", "company": "Esri", "end_time": "2013-12-31T00:00:00Z", "industry": "Other", "position": "Senior System admin (GIS)", "conf_score": 0.7800434575764302, "start_time": "2008-06-01T00:00:00Z"}], "address": null}