{"skills": ["kafka", "aws", "angular", "docker", "symfony", "agile", "cloud", "management", "search engine", "studio", "blockchain", "postgresql", "io", "kubernetes", "heroku", "elasticsearch", "git", "project management", "rail", "ruby", "rabbitmq", "scaleway", "microservices", "search", "rspec", "design pattern", "forex", "backend development", "angular 2", "time tracking", "neo", "distributed system", "compute"], "fulltext": "Pham Van Phuc\nBackend Developer\n04/1994 \uf073 \uf073 Male \uf007 \uf007\n(+84) 399 346 949\n\uf095\nphuc.pham.itf@gmail.com\n\uf0e0\n\uf0c1 \uf0c1\nGo Vap - Ho Chi Minh - Viet Nam\n\uf041\uf041\nhttps://www.linkedin.com/in/phuc-\npham-itf/\nEDUCATION\nDa nang university of technology and sciences (8/2012 > 08/2017)\nMajor: Information of Technology.\nDegree: IT engineer\nOBJECTIVE\n- Seeking for a challenging workplace\nthat welcomes innovative ideas and\noffers growth opportunities and a\npositive environment for accomplishing\nprojects.\n- Earn experience, improve personal skill\nto be an expert and achieve tech leaders\nposition.\nEXPERIENCES\nCode Engine Studio (11/2016 > 6/2018)\nFullStack developer\n* Time tracker\n- Build a time tracker application like Toggl. \n- Implement backend APIs for user tracking time, project\nmanagement, leave management.\n- Implement Front-end for leave management.\n- Technologies used: Ruby on Rails and Angular 2.\n* Zilly (Tellus for now http://www.zillyhome.com/)\n- Join to build a rental home management application.\n- Implement backend APIs, lease management, properties\nmanagement.\n- Implement chat using SendBird and internal web socket. \n- Implement APIs documentations using SwaggerUI.\n- Join to build data searchable by search engine Elasticsearch.\n- Technologies used: Ruby on Rails, Postgresql, Elasticsearch.\n* Sitetheory (https://sitetheory.io/)\n- Develop and maintain CMS websites from US client for dynamic\ncreating a web site without the need of code knowledge.\n- Technologies used: Symfony and Angular 1.\nSKILLS\nRuby on rails\nBlockchain\nKafka Confluent\nSchema-registry\nZookeeper\nPostgreSQL\nDocker vs Kubernetes\nAWS EC2, Scaleway\nCloud Platform,\nHeroku\nMicroservices and\nMonolithic\narchitecture\nDesign patterns\nElasticSearch\nGit\nRspec Test\n- Accumulated skills: Rails, Angular 1 - 2, Elasticsearch,\nPostgresql, Pusher, Heroku, Stripe and Dwolla,  SendBird - Chat\nplatform, Rspec, Cucumber.\n- Working in an Agile Scrum team with 25 members around the\nworld.\nIpcoin exchange (8/2018 > Ongoing)\nBackend developer\n- Join to build a crypto exchange like forex exchange.\n- Join to build a trading platform, order machine engine.\n- Integrate crypto wallet, BTC, NEO ... \n- Build and run a system using Docker and Kubernetes.\n- Build a distributed system, follow close to the microservice\narchitecture using event-sourcing with Kafka, RabbitMQ.\n- Apply much design pattern on implementing the system.\n- Technologies used: Ruby on rails, blockchain, docker.\n- Accumulated skills: ruby on rails, PostgreSQL, blockchain,\nconfluent Kafka, microservice, docker, Kubenetes, Rspec ...\nLANGUAGES\nENGLISH ( Intermediate )\nVIETNAMESE ( Native )\nHOBBIES-PERSONALITY\n* Love to join social\nactivities and\ncommunity.\n* Curious about\ntechnology and\ncompute science.\n* Creative and\nhumorous mind.\n* Love reading book,\nPlay football,\nvolleyball, travel.\n\u00a9 topcv.vn\nPowered by TCPDF (www.tcpdf.org)", "educations": [{"id": 5321, "gpa": null, "major": "C\u00f4ng ngh\u1ec7 th\u00f4ng tin", "school": "Da nang university of technology and sciences", "diploma": "Engineer", "end_time": "2017-08-01T00:00:00Z", "conf_score": 0.9324595069918105, "start_time": "2012-08-01T00:00:00Z", "picklist_major": "IT - Hardware/Networking", "major_categories": "M\u00e1y t\u00ednh v\u00e0 c\u00f4ng ngh\u1ec7 th\u00f4ng tin", "major_categories_detail": "C\u00f4ng ngh\u1ec7 th\u00f4ng tin"}], "experiences": [{"id": 17821, "detail": "- Join to build a crypto exchange like forex exchange.\n- Join to build a trading platform, order machine engine.\n- Integrate crypto wallet, BTC, NEO ... - Build and run a system using Docker and Kubernetes. - Build a distributed system, follow close to the microservice architecture using event-sourcing with Kafka, RabbitMQ. - Apply much design pattern on implementing the system.\n- Technologies used: Ruby on rails, blockchain, docker.\n- Accumulated skills: ruby on rails, PostgreSQL, blockchain, confluent Kafka, microservice, docker, Kubenetes, Rspec ...", "company": "Ipcoin exchange", "end_time": "2018-12-31T00:00:00Z", "industry": "Other", "position": "Backend developer", "conf_score": 0.9210587272719128, "start_time": "2018-08-01T00:00:00Z"}, {"id": 17822, "detail": "* Time tracker\n- Build a time tracker application like Toggl. - Implement backend APIs for user tracking time, project management, leave management.\n- Implement Front-end for leave management.\n- Technologies used: Ruby on Rails and Angular 2. * Zilly (Tellus for now http://www.zillyhome.com/)\n- Join to build a rental home management application.\n- Implement backend APIs, lease management, properties management.\n- Implement chat using SendBird and internal web socket.\n- Implement APIs documentations using SwaggerUI. - Join to build data searchable by search engine Elasticsearch. - Technologies used: Ruby on Rails, Postgresql, Elasticsearch. * Sitetheory (https://sitetheory.io/)\n- Develop and maintain CMS websites from US client for dynamic creating a web site without the need of code knowledge.\n- Technologies used: Symfony and Angular 1. - Accumulated skills: Rails, Angular 1 - 2, Elasticsearch, Postgresql, Pusher, Heroku, Stripe and Dwolla, SendBird - Chat platform, Rspec, Cucumber. - Working in an Agile Scrum team with 25 members around the world.", "company": "Code Engine Studio", "end_time": "2018-06-30T00:00:00Z", "industry": "High Technology", "position": "FullStack developer", "conf_score": 0.9125776658202421, "start_time": "2016-11-01T00:00:00Z"}], "address": "Go Vap - Ho Chi Minh - Viet Nam"}