{"skills": ["stack", "sc", "css3", "docker", "payment", "operation system", "java", "analytics", "json", "babel", "responsive", "javascript", "bootstrap", "es6", "data format", "mongodb", "management", "java core", "blockchain", "object oriented", "vuejs", "jquery", "hard working", "html5", "analysis", "typescript", "asp", "website development", "sql", "css", "restful", "oop", "signalr", "grunt", "react hook", "reactjs", "twitter", "database", "python", "gulp", "angularjs", "operations management", "material ui", "mysql", "html"], "fulltext": "PROFILE\nExtremely motivated to constantly develop my skills and grow \nprofessionally. As an ambitious and hard-working individual, I handle \nmultiple tasks on a daily basis competently, working well under the \npressure. More than 6 years working on online industry as a web \ndeveloper, I've learned & got experiences at web development \nenvironments, program languages, database, and management operation \nsystem. I'm confident in my ability with frontend skill which to come up \nwith professional, interesting ideas for project.  \nNguyen Nhut Trinh\nFontend Web Developer\nCONTACT\n01656 033 621 \n0356 033 621 \nSkype: mrnhuttrinh \nSKILLS\nmrnhuttrinh@gmail.com \nwww.github.com/mrnhuttrinh \nFRONT END                                                                                   \nReactjs \nJavascript (ES5, ES6, CommonJs, RequiredJs) \nTypescript \nHTML/CSS3/SCSS \nWorkpress \nWebpack, Gulp, Grunt, Babel \nSocketIO, WebSocket \nJquery, AngularJs, VueJs \nUi Design: Bootstrap, PureCSS, Material-UI, Flat-UI \nBRIEF PROFESSIONAL SKILLS\nREACTJS \nJAVASCRIPT/ES6 \nTYPESCRIPT \nHTML5/CSS3 \nSCSS/SASS \nWEBPACK/BABEL \nUX/UI \nOOP \nNODE JS \nJAVA \nPYTHON \nPOSTGRES \nREDSHIFT \nSQL SERVER \nENGLISH \nMANAGEMENT \nANALYSIS \nDOCKER\nBACK END                                                                                      \nJava (Core, SpringBoot) \nAsp.net \nNodejs \nPython\nOBJECT-ORIENTED PROGRAMMING (OOP)                              \nDATABASE                                                                                     \nPostgres, Redshift, MySql, Sql Server, MongoDb \nCOMMUNICATION                                                \nEnglish \nOTHER SKILL                                                                                \nLead \nAnalytics \nDev-op: Docker, CI/CD\nSOCIAL MEDIA\nTWITTER: @MRNHUTTRINH \nFACEBOOK: /MRNHUTTRINH \nWORK EXPERIENCE \nFrontend Web Developer \nPositioin: 80% Frontend - 20% Backend \nThe App Team | JUL 2018 - Present \nReactJs, react-hook, Material-ui, Nodejs, css, web responsive \nUsing typescript on react project\nApply CI/CD to build/distribute web application \nBuild web for logistics and provide medical service.\nIntergrate payment gateway in project: stripe, paypal\nFull Stack Web Developer \nPositioin: 70% Frontend - 30% Backend\nFREELANCE TEAM | OCT 2017 - JUN 2018 (2 PROJECTS) \nDevelop web application with JAVA, Javascript, ReactJs and\nMaterial UI \nDevelop RESTful API providing JSON data format for mobile and\nweb application.\nBuild Centralized Blockchain Network and education.\nFull Stack Web Developer \nPositioin: 70% Frontend - 30% Backend \nTMA SOLUTIONS  | JAN 2015 - JUL 2018 (+4 PROJECTS) \nDevelop web application with JAVA, NodeJS, Websocket,\nExpressJS, Jesmine, Babel, Springboot, Python, Javascript,\nTypescript, ReactJs and Material UI, Bootstrap, Jquery,\nPostgres, RedShift.\nDevelop RESTful API providing JSON data format for\nmobile and web application\nFull Stack Web Developer \nPositioin: 70% Frontend - 30% Backend \nKIEN NHAN JSC  | JUL 2013 - DEC 2014 (2 PROJECTS) \nDevelop web application with .NET, MVC5 , SignalR,  Javascript, \nAngularJS, Bootstrap, Jquery, SQLSERVER.\nEDUCATION \nOPEN UNIVERSITY | 2009 - 2013 \nCOMPUTER SCIENTIST", "educations": [{"id": 5322, "gpa": null, "major": "Khoa h\u1ecdc m\u00e1y t\u00ednh", "school": "OPEN UNIVERSITY", "diploma": "Bachelors", "end_time": "2013-01-01T00:00:00Z", "conf_score": 0.9299204431562893, "start_time": "2009-01-01T00:00:00Z", "picklist_major": "IT - Hardware/Networking", "major_categories": "M\u00e1y t\u00ednh v\u00e0 c\u00f4ng ngh\u1ec7 th\u00f4ng tin", "major_categories_detail": "M\u00e1y t\u00ednh"}], "experiences": [{"id": 17823, "detail": "ReactJs, react-hook, Material-ui, Nodejs, css, web responsive\nUsing typescript on react project\nApply CI/CD to build/distribute web application\nBuild web for logistics and provide medical service.\nIntergrate payment gateway in project: stripe, paypal", "company": "The App Team", "end_time": "2023-04-13T00:00:00Z", "industry": "Other", "position": "Frontend Web Developer", "conf_score": 0.9538370608867096, "start_time": "2018-07-01T00:00:00Z"}, {"id": 17824, "detail": "(+4 PROJECTS) Develop web application with JAVA, NodeJS, Websocket, ExpressJS, Jesmine, Babel, Springboot, Python, Javascript, Typescript, ReactJs and Material UI, Bootstrap, Jquery, Postgres, RedShift. Develop RESTful API providing JSON data format for mobile and web application", "company": "TMA SOLUTIONS", "end_time": "2018-07-31T00:00:00Z", "industry": "High Technology", "position": "Full Stack Web Developer", "conf_score": 0.8966549920361057, "start_time": "2015-01-01T00:00:00Z"}, {"id": 17825, "detail": "(2 PROJECTS) Develop web application with JAVA, Javascript, ReactJs and\nMaterial UI Develop RESTful API providing JSON data format for mobile and web application.\nBuild Centralized Blockchain Network and education.", "company": "FREELANCE TEAM", "end_time": "2018-06-30T00:00:00Z", "industry": "Other", "position": "Full Stack Web Developer", "conf_score": 0.8966549920361057, "start_time": "2017-10-01T00:00:00Z"}, {"id": 17826, "detail": "(2 PROJECTS) Develop web application with .NET, MVC5 , SignalR, Javascript, AngularJS, Bootstrap, Jquery, SQLSERVER.", "company": "KIEN NHAN JSC", "end_time": "2014-12-31T00:00:00Z", "industry": "Other", "position": "Full Stack Web Developer", "conf_score": 0.8966549920361057, "start_time": "2013-07-01T00:00:00Z"}], "address": null}