{"skills": ["scala", "stack", "java", "management", "business communication", "io", "vuejs", "git", "html5", "kotlin", "structure", "react native", "android", "css", "github", "software development", "reactjs", "golang", "backend development", "database", "process development", "game development", "teamwork", "networking", "firestore", "agile", "mysql", "html"], "fulltext": "Name: L\u01afU TH\u1ebe L\u00c2M\nAddress: 8A V\u0169 Th\u1ea1nh - H\u00e0 N\u1ed9i\nPlace of Birth: \u0110\u00f4ng Tri\u1ec1u -  Qu\u1ea3ng Ninh\nDate of birth: 09/11/1994\nPhone: 0356819599\nEmail: luulam0911@gmail.com\nGitHub: https://github.com/luulam\nINTRODUCTION \nI'm a Half-Stack Developer The reason I'm claiming to be a Half-Stack is that I only \nknow half of the Stack (half easy), and the hard half is too hard, so I ignored it :D\nOBJECTIVE \nApplication of technology to improve the value of life\nEDUCATION\nHa Noi University Of Business And Technology\n-Time: 2012 - 2016\n-Diplomats: IT\nTECHNICAL\nSKILLS \nProgramming: Java, JavaScrip, Kotlin, HTML5, CSS, ActionScrip3, Scala\nFrameworks/ Platforms: React-native, ReactJS, VueJS, NodeJS\nDatabase : realm, MySql, SqlLite, FireStore\nVersion Control: Git\nSoft Skills: Time management, Business communication, Teamwork\nOthers: \n-Experience with Agile and Scrum development process\n- Intermediate Photoshop skill. Can do simple design: logo, banner, poster\u2026.\nWORK EXPERIENCE\nNewWave Solution https://newwave.vn/ (02/2016 - 06/2017)\nResponsibilities:\n\u00b7\nAndroid Software developer,\n\u00b7\nThe leader of React-native development in the company\n\u00b7\nBack-End Developer\nOhze (Sandinh) http://ohze.net/ (07/2017 - 10/2019)\nResponsibilities:\n\u00b7\nFull Stask Developer,\n\u00b7\nTeam Leader\n\u00b7\nProduct Owner\nPERSONAL  PRODUCT\nAndroid App\n- Pest HUBT http://bit.ly/2mDNFqB\nIs a product that converts a .txt file into revision questions before exams\n-Bookmark http://bit.ly/2mDpgRZ\nSave bookmarks with Tag tags for easy searching\n-Dog Breed http://bit.ly/2mDqZ9V\nEntertainment application that shows Images of dog breeds\n-Memorize http://bit.ly/2mD04eo\nEnglish Vocabulary Learning Application\n-React-Native-Start-Kit \nan Instagram / UX UI simulation application using React-native\nPERSONAL  PROJECT\n- Lavi Fruits http://bit.ly/2nvMz0z\napplication for a chain of stores that provide fresh fruit, allowing users to order and buy \nfruits by phone\n-Matching Platform \u2013 ADONG Customer http://bit.ly/2oiJBMM\nIs a platform that helps connect service providers and service users, including a variety of\nservices: house cleaning, electrical repair, child transportation .etc\n-2Way http://bit.ly/2nxXOFH\nThe transport and transport support application connects people who need to move, are \nabout to move and need to move with each other \nSOFTWARE PROJECTS EXPERIENCES\nOrganization\nSandinh SJC\nPosition\nProduct Owner\nProject description\nPh\u1ecfm , Ti\u1ebfn l\u00ean Mi\u1ec1n Nam\nIs a simulation game sure most similar to real life\nProject size\n\u00d6\n7 \nman-month\ninformation \u00d6 Agil\ne\n\u00d6 Scru\nm\nTasks & responsibilities\nGiving game development directions\nOrganization\nSandinh SJC\nPosition\nSoftware developer\nProject description\nChan4 \nIs a simulation game sure most similar to real life\nProject size\n\u00d6\n2 \nman-month\nTechnical information\n\u00d6\nHtml\n5 (frameword PixiS)\n\u00d6 Css\n\u00d6 Typ\nescrip\nTasks & responsibilities\nGiving game development directions\nOrganization\nSandinh SJC\nPosition\nSoftware developer\nProject description\nChan2\nIs a simulation game sure most similar to real life\nProject size\n\u00d6\n2 \nman-month\nTechnical information\n\u00d6\nActi\nonscrip3\n\u00d6 Fire\nBase\n\u00d6 Soci\nal network connect and sharing\n\u00d6 Scal\na\n\u00d6 Doc\nker\nTasks & responsibilities\nMaintain and Update function new attractive customer\nOrganization\nNewWave Solutions JSC\nPosition\nAndroid Software developer\nProject description\nWiido \nservice clean for home\niOS:  https://apple.co/2nIeydo\nAndroid:  http://bit.ly/2mQSSeW\nApp For collaborators\nAndroid:  http://bit.ly/2mMbXie\nProject size\n\u00d6\n1 \nman-month\nTechnical information\n\u00d6\nRea\nct native\n\u00d6 Fire\nbase\n\u00d6 Verif\ny account\nTasks & responsibilities\nMain App developer Create wireframe, specs, schedule plan, coding structure.\n+ All of mobile developer task\nOrganization\nNewWave Solutions JSC\nPosition\nAndroid Software developer\nProject description\nBeatChat\nIt is a social network have call , videocall, chat, timeline add friend\u2026\u2026.\nProject size\n\u00d6\n2 \nman-month\nTechnical information\n\u00d6\nSky\nWave\n\u00d6 Fire\nBase\n\u00d6 Real\nm\n\u00d6 Notif\nication\n\u00d6 Soci\nal network connect and sharing\nTasks & responsibilities\nMain Android developer Create wireframe, specs, schedule plan, coding structure.\nOrganization\nNewWave Solutions JSC\nPosition\nAndroid Software developer\nProject description\nTraxy\nThis is iOS application on IPhone, which helps people, who are travelling in Japan can catch \nthe drivers are nearest by them. And they can filter drivers by sex, same languages with us\u2026\nProject size\n\u00d6\n3 \nman-month\nTechnical information\n\u00d6\nLang\nuage Golang\n\u00d6 notif\nication\n\u00d6 AF \nNetworking\nTasks & responsibilities\nbuild server and API\nOrganization\nNewWave Solutions JSC\nPosition\nAndroid Software developer\nProject description\nLoveGolf\nIt is a social network of golfers.\nGolfers can create event,join even, see info\u2026..\nProject size\n\u00d6\n1 \nman-month\nTechnical information\n\u00d6\nSoci\nal network connect and sharing\n\u00d6 AF \nNetwoking\nTasks & responsibilities\nMain Android developer and make good product quality \nOrganization\nNewWave Solutions JSC\nPosition\nAndroid Software developer\nProject description\nMenmix\nCreate social network community\nProject size\n\u00d6\n1 \nman-month\nTechnical information\n\u00d6\nSqlit\ne\n\u00d6 Goo\ngle map\nTasks & responsibilities\nDeveloper app and have good comment from customer.\n Mange Task:\n+ Specs analyze\n+ create new design scene home, timeline \u2026..", "educations": [{"id": 5360, "gpa": null, "major": null, "school": "Ha Noi University Of Business And Technology", "diploma": "Bachelors", "end_time": "2016-01-01T00:00:00Z", "conf_score": 0.7151136457677363, "start_time": "2012-01-01T00:00:00Z", "picklist_major": "Other", "major_categories": "", "major_categories_detail": ""}], "experiences": [{"id": 17940, "detail": "", "company": "Ohze (Sandinh) http://ohze.net/", "end_time": "2019-10-31T00:00:00Z", "industry": "Other", "position": "Full Stask Developer,\n\u00b7\nTeam Leader\n\u00b7\nProduct Owner", "conf_score": 0.8897482258197899, "start_time": "2017-07-01T00:00:00Z"}, {"id": 17941, "detail": ", \u00b7 The leader of React-native development in the company\n\u00b7 Ba", "company": "NewWave Solution", "end_time": "2017-06-30T00:00:00Z", "industry": "High Technology", "position": "Android Software developer", "conf_score": 0.9278757518959408, "start_time": "2016-02-01T00:00:00Z"}], "address": "8a V\u0169 Th\u1ea1nh - H\u00e0 N\u1ed9i"}