{"skills": ["java", "futures", "javascript", "ams", "cli", "mongodb", "studio", "redux", "io", "frontend development", "git", "svn", "compass", "html", "sell", "react native", "android", "website development", "sql", "css", "visual studio", "github", "software development", "bug fixing", "reactjs", "backend development", "oracle", "database", "sqlite", "problem solving", "angularjs", "bootstrap", "material ui", "mysql", "jquery"], "fulltext": "\u0110\u1ed6 H\u1eeeU LINH \nDate of birth \nGender  Male \nPhone \nEmail  d \nAddress \nHanoi, Vietnam \nWebsite  https://github.com/lincdh \nOBJECTIVE \nEverything changes so fast day to day therefore I always want to learn and improve myself by every \nchance so i can truly become successful at my web, app developer career. And with the skills, the \npassion, I will contribute to development of the Company. \nSkills: \nFrontend: HTML, CSS, Javascript, ReactJS, React Native \nBackend: NodeJS, ExpressJS \nDatabase: MySQL, MongoDB, SQLite \nSource control: Git, SVN \nCareer goals: \nBecoming an expert of what i am doing \nImproving my soft and hard skill \nImproving my problem solving and creativity \nSeveral years in the future, i want to become a senior programmer \nEDUCATION \nSEP 2014 - May 2019 \nElectric Power University \nMajor: Software Technology \nGPA: 2.67 \nWORK EXPERIENCE \nJan 2018 - March 2019 \nNextg Solutions \nWeb Developer \n- Working and learning many programming languages and \ntechnologies \n- Create APIs and do frontend works \n- Maintain existing web system \nADDITIONAL INFORMATION \nFacebook: https://www.facebook.com/linhdo959x \nGithub: https://github.com/lincdh \nPROJECTS \nWeb Nghe nh\u1ea1c \n(Jan 2017 - Feb 2017) \nCustomer \nElectric Power University \nDescription \nWeb Nghe nh\u1ea1c \nDemo: https://fathomless-brook-49475.herokuapp.com/ \nTeam size \n1 \nMy position \nBackend Developer, Frontend Developer \nMy responsibilities \nDevelop functions, develop web interface \nTechnologies used \nNodeJS, ,HTML, CSS, Javascript, ExpressJS, MongoDB \nVisual Studio Code \nChia s\u1ebb \u1ea3nh \n(November 2017 - December 2017) \nCustomer \nElectric Power University \nDescription \nUpload v\u00e0 chia s\u1ebb \u1ea3nh \nTeam size \n1 \nMy position \nBackend Developer, Frontend Developer \nMy responsibilities \nDevelop api, develop web interface \nTechnologies used \nNodeJS, ,ReactJS, ExpressJS, MongoDB, Bootstrap, Redux \nVisual Studio Code \nSimple Live Video \n(October 2018 - Jan 2019) \nCustomer \nElectric Power University \nDescription \nSimple Live Video \nDemo: https://livebroadcasting.herokuapp.com \nTeam size \n1 \nMy position \nBackend Developer, Frontend Developer \nMy responsibilities \nDevelop api, develop web interface \nTechnologies used \nNodeJS, ,ReactJS, ExpressJS, MongoDB, Material-UI, Redux, Webrtc \nVisual Studio Code \nGit \nCryptoPlus \n(Jan 2018 - March 2018) \nCustomer \nPM Plus \nBuy and sell cryptocurrencies through many existing exchanges like Binance, \nCoinbase,... \nDescription \nDemo: http://cryptoplus.herokuapp.com \nAdmin acc: pmadmin \nAdmin pass: 12345678 \nUser acc: test2@test.com \nUser pass: 12345678 \nTeam size \n2 \nMy position \nBackend Developer \nMy responsibilities \nProgramming the system based on required documents \nLearn how to use exchanges' APIs \nCreate APIs for frontend use \nTechnologies used \nNodeJS, AngularJS, ExpressJS, MongoDB \nVisual Studio Code, MongoDB Compass, SVN \nPMPLUS \n(March 2018 - March 2019) \nCustomer \nPM PLUS \nDescription \nMaintain the web system \nTeam size \n7 \nMy position \nJava, Frontend Developer \nMy responsibilities \nFixing bugs \nTechnologies used \nJava, Javascript, CSS, JQuery, SQL \nOracle ADF, Oracle SQL \nJDeveloper, SVN \nJob Seeker \n(March 2019 - Present) \nCustomer  Me \nDescription \nFind jobs online on ios and android \nTeam size \n1 \nMy position \nReact Native Developer \nMy responsibilities \nDevelop functions, interface \nTechnologies used \nReact Native, Redux, Expo Cli, \nSQLite \n\u00a9 topcv.vn ", "educations": [{"id": 5363, "gpa": "2.67", "major": "Software Technology", "school": "Electric Power University", "diploma": "Bachelors", "end_time": "2019-05-01T00:00:00Z", "conf_score": 0.8413267261986577, "start_time": "2014-09-01T00:00:00Z", "picklist_major": "Other", "major_categories": "", "major_categories_detail": ""}], "experiences": [{"id": 17951, "detail": "- Working and learning many programming languages and technologies\n- Create APIs and do frontend works\n- Maintain existing web system", "company": "Nextg Solutions", "end_time": "2019-03-31T00:00:00Z", "industry": "High Technology", "position": "Web Developer", "conf_score": 0.9062039189695287, "start_time": "2018-01-01T00:00:00Z"}], "address": "Hanoi, Vietnam"}