{"skills": ["memcached", "apache httpd", "networking", "streaming", "c++", "testing", "infrastructure service", "vmware esxi", "cloud system", "internet", "virtualizations", "linux", "virtualization", "ftp", "network service", "window server", "honeynet", "zimbra", "apache", "database", "ibm", "protocol", "cisco", "physic", "dns", "failover", "load balancing", "disaster recovery", "dhcp", "file server", "cloud cdn", "wifi", "nginx", "vod", "cache", "object oriented", "cloud", "reverse proxy", "rtmp", "srm", "cdn", "router", "php", "hp", "unix", "medium", "load balancer", "proxy"], "fulltext": "1 \nCURRICULUM VITAE \nPERSONAL INFORMATION \nFull name \n: TRAN Anh Dung \nDate of birth \n: 04th October, 1991 \nPlace of birth \n: Thai Binh City \nMaterial status \n: Single \nMobile phone \nEmail \nAddress \n: (+84)379 979 357 \n: anhdung410@gmail.com \n: H\u2019Bong Ward, Chu Se District, Gia Lai Province \nEDUCATION \n2009 -2014 \n2012 \nBachelor, University of Natural Science - VNUHCMC, Department \nof Physics and Computer Science. \nCertificate in Object Oriented  Programming with C++ \nEXPERIENCES RECORD \nAug 2017 - Present \nWorking at DongA Bank \n- Manage over 400 servers both physical and virtual servers, \ninclude : \n* Linux : \n- Participate in installing, configuring, maintaining, operating \nand troubleshooting infrastructure service such as : DNS, \nDHCP, LDAP, Apache HTTPD as reverse proxy, Internet \nProxy, Zimbra Mail, IM chat OpenFire, NFS, Samba, FTP, \nRedHat Satellite.  \n* Windows : \n- Manage Active Directory server, CA server, IIS server, \nWSUS server, File Server. \n* VMware : \n- Deploy VMware ESXi on most physical servers and manage \nthem by vCenter server \n- Participate in project to build a disaster recovery datacenter \nusing VMware SRM solution. \n- Provide OS platform and server resources for requirements of \ndatabase team and developing team on Testing/UAT, Staging \nand Product enviroment. \n- Monitor and troubleshoot system errors by using VMware \nOperation Manager; resolve problems on VMware system. \n* Others: \n- Manage backup & restore system using EMC Networker \nsolution, EMC Data Domain, HP LTO6 Tape Library, IBM \nLTO4 Tape Library. \n- Competent in working with mainframe server and blade \nserver of HP, Dell or Cisco manufacturers. \n- Maintain and monitor APC\u2019s UPS, Cooling, FM200 system in \ndatacenter. \nFeb 2017 \u2013 Aug 2017  \nWorking at FORIX LLC \n- Deploying networking system for company: Swich, Router, Load \nBalancing, WiFi, \u2026 \n- \nManaging server, mail system and network services (basic). \n- Technical support to each team at company (Level 1). \nOct 2013 \u2013 Dec 2016 \nWorking at HONEYNET Company and R&D at VNU-HCM \n- Researching and developing in CDN, Cloud system \n2 \n- Managing VMWARE, CDN, UNIX system \nBuilt the farm servers for Yeu The Thao company \n- Deployed a virtualization system (includes: websites, databases, \napache/nginx, varnish-cache, memcached, \u2026) \n- Optimized for this system that adapt over 10,000 CCU \n- Built the backup/restore system \nOptimization website system at Sun Flower Media company \n- \nBuild a web system for 5,000 connections concurrent \n- \nDeployed the RTMP protocol to streaming a video (Replace HTTP \nstandard protocol) \n- \nOptimized database with Master-Slave replication model \nInternship at Network Department - Viet Nam National \nJun 2012 \u2013 Sep 2013  \nUniversity HCMC (VNU-HCM) \n- \nR&D at VNU-HCM (Unix, Network, Services and Open Source) \nSKILLS \nGood English in speaking and writing \nGood team work abilities \nExperienced in VMware virtualization, Unix OS, Windows Server and Streaming (VoD, \nLive), Load balancer, FailOver, Open source, Troubleshooting. \nAbility to program with C #, C++, PHP, Shell scripts (bash, sh, csh)  \nHOBBIES \nMusic \nSports \nTravel \n3 \nPowered by TCPDF (www.tcpdf.org)", "educations": [{"id": 5404, "gpa": null, "major": "Khoa h\u1ecdc m\u00e1y t\u00ednh", "school": "University of Natural Science - VNUHCMC", "diploma": "Bachelors", "end_time": "2014-01-01T00:00:00Z", "conf_score": 0.7625990117186952, "start_time": "2012-01-01T00:00:00Z", "picklist_major": "IT - Hardware/Networking", "major_categories": "M\u00e1y t\u00ednh v\u00e0 c\u00f4ng ngh\u1ec7 th\u00f4ng tin", "major_categories_detail": "M\u00e1y t\u00ednh"}], "experiences": [{"id": 18072, "detail": "- Manage over 400 servers both physical and virtual servers, include : * Linux : - Participate in installing, configuring, maintaining, operating and troubleshooting infrastructure service such as : DNS, DHCP, LDAP, Apache HTTPD as reverse proxy, Internet Proxy, Zimbra Mail, IM chat OpenFire, NFS, Samba, FTP, RedHat Satellite. * Windows : - Manage Active Directory server, CA server, IIS server,\nWSUS server, File Server. * VMware : - Deploy VMware ESXi on most physical servers and manage them by vCenter server\n- Participate in project to build a disaster recovery datacenter using VMware SRM solution.\n- Provide OS platform and server resources for requirements of database team and developing team on Testing/UAT, Staging and Product enviroment.\n- Monitor and troubleshoot system errors by using VMware Operation Manager; resolve problems on VMware system.\n* Others: - Manage backup & restore system using EMC Networker solution, EMC Data Domain, HP LTO6 Tape Library, IBM LTO4 Tape Library. - Competent in working with mainframe server and blade server of HP, Dell or Cisco manufacturers.\n- Maintain and monitor APC\u2019s UPS, Cooling, FM200 system in datacenter.", "company": "DongA Bank", "end_time": "2023-04-13T00:00:00Z", "industry": "Banking", "position": null, "conf_score": 0.8086621310791741, "start_time": "2017-08-01T00:00:00Z"}, {"id": 18076, "detail": "- Deploying networking system for company: Swich, Router, Load Balancing, WiFi, ... - Managing server, mail system and network services (basic).\n- Technical support to each team at company (Level 1).", "company": "FORIX LLC", "end_time": "2017-08-31T00:00:00Z", "industry": "Other", "position": null, "conf_score": 0.8086621310791741, "start_time": "2017-02-01T00:00:00Z"}, {"id": 18079, "detail": "and R&D at VNU-HCM - Researching and developing in CDN, Cloud system", "company": "HONEYNET Company", "end_time": "2016-12-31T00:00:00Z", "industry": "Other", "position": null, "conf_score": 0.8086621310791741, "start_time": "2013-10-01T00:00:00Z"}, {"id": 18081, "detail": "HCMC (VNU-HCM) - R&D at VNU-HCM (Unix, Network, Services and Open Source)", "company": "Yeu The Thao company", "end_time": "2013-09-30T00:00:00Z", "industry": "Other", "position": "Internship at Network Department", "conf_score": 0.9150718542033498, "start_time": "2012-06-01T00:00:00Z"}], "address": "H\u2019bong Ward, Chu Se District, Gia Lai Province"}