{"skills": ["elastic stack", "investments", "java", "css", "git", "agile", "analysis", "api gateway", "cloud system", "firewall", "svn", "firebase", "jira", "virtualizations", "html", "linux", "virtualization", "vmware vsphere", "design pattern", "ubuntu", "mysql", "azure", "tool support", "oracle", "bitbucket", "version management", "jquery", "eauthentication", "mssql", "distribution system", "marketing", "le", "marketing strategy", "c#", "proxy", "stack", "oop", "javascript", "payment", "database", "crm system", "event promotion", "rabbitmq", "crm", "bamboo", "mvc", "bootstrap", "ams", "cloud", "enterprise", "workflow", "agile development methodology", "php", "software development", "android", "router", "identity", "mongodb", "postgresql", "management", "asp", "serilog", "problem solving"], "fulltext": "1  \n      Resume \nTUYN DOAN \nFullName:      \u0110o\u00e0n V\u0103n Tuyn \nDate of Birth: November 11,1987 \nPhone:            098 385 8781 \nFb.me/Latineccentricus \nEmail: admin@tuyn.info \nAddress : KB5, KP3, Tan Thuan Tay, Dist 7, HCM \nI am an industrious and ambitious person and I always try to work creatively. I draw a line \nbetween work and pleasure, working hours and leisure time. I do not have much free time, \nbut if I have, I prefer to spend it with my family. My favorite way of spending time is \nswimming & watch movie. In computer space, my true passion is new technology. \nOBJECTIVES \n\u2022 Deep knowledge of software development. \n\u2022 Using foreign language as mother language.  \n\u2022 Develop my skills with the growth of company and I want to prove myself.  \n\u2022 Become a Project Manager or CIO.  \nPROFESSIONAL SUMMARY \n\u2022 9 years experience in the field of Software Development \n\u2022 3 years experience in agile development methodologies and leading a team in an \nAgile/SCRUM environment \n\u2022 2 years experience working with .NET Core \n\u2022 2 years experience in Technical Leader \n\u2022 1 year experience in Product Manager \n\u2022 Have skills programing language with .NET framework \n\u2022 Have skills of back-end languages and front-end framework \n\u2022 Have knowledge of OOP & design patterns \n2  \nEDUCATIONAL BACKGROUND \n\u2022 2006 \u2013 2009: Institute Of Informatic Technology & Management    \nPractical Software Engineering  \n- Professional Web Application Expert          \u2013 2006 \n- Professional Software Arrhiterture Expert  \u2013 2007 \n- Advance Software Developer Expert           \u2013 2008 \n- Enterprise Application Intergrate Expert     \u2013 2009 \n\u2022 03/2013 \u2013 07/2013: VTC Academy Specialist Official Certification \nAndroid Development (High Distinction/A+) \nTECHNICAL SKILLS \n\u2022 Databases: MongoDB, MSSQL, PostgreSQL, MySQL, Oracle \n\u2022 Languages: C#, .NET Core, ASP.NET, VB, Java, PHP, JavaScript \n\u2022 Back-end Frameworks: ASP.NET MVC, Entites Framework, Kong API Gateway & \nMicroservice, Devexpress, Syncfusion,\u2026 \n\u2022 Front-end Frameworks: HTML, CSS, Javascript, Bootstrap, Jquery  \n\u2022 Cloud System: Google, Amazon, Azure,\u2026 \n\u2022 Support Tools : Jira, Bitbucket, Confluence, Bamboo (CI), Git, SVN \nEMPLOYMENT HISTORY \n\u2022 05/2010 \u2013 08/2013: Senior Developer at VIETMAP CO., LTD \n\u2022 10/2013 \u2013 11/2014: Product Manager at FELIX TECHNOLOGY JSC., \n\u2022 01/2015 \u2013 07/2017: Senior Technical Assistant at VIETMAP CO., LTD (BU MAPS) \n\u2022 07/2017 \u2013 07/2019: Technical Leader at XTRIP TRAVEL JSC., (VIETMAP GROUP) \n3  \nPROFESSIONAL EXPERIENCE \n07/2017 \u2013 07/2019: Technical Leader at XTRIP TRAVEL JSC., (VIETMAP GROUP) \nXtrip is a Startup Company invested by VietMap Group with the mission of becoming an \nOnline Travel Agent (OTA) in the travel marketplace. We together built a travel platform that \nprovides a wide range of travel needs, enabling customers to create moments together with \ntheir loved ones. Xtrip offers flights, hotels, tour packages, attractions & activities. \nIn the beginning, I involved in the team to build a working environment that was effective \nand friendly. \n\u2022 Setting up developing and productive environments. \n\u2022 Using microservice architecture for developments and independently deployments. \n\u2022 Development with Agile Method and Scrum. \n\u2022 Solution for managing source codes (management of branches).  \n\u2022 Integration of payment gateways (NAPAS, PAYOO, CyberSource) \n\u2022 Analyzing, designing and realizing the business of tourism/flight/hotel/activities \nbookings. \n\u2022 Interacted and integrated with the supplier who provided the API of hotel/ flight /  \nactivities connectivity. \n\u2022 Analyzing, designing and developing a CRM system (promotion codes, vouchers, gift \ncodes, rewarding points) based on the marketing strategies created by Marketing \nManager to launch Xtrip successfully to OTA Market. \n\u2022 Provides some of useful tools and applications to Customer Service Team for serving \nour customers effectively : Slack notifications/Email sender/SMS sender. \nTechnologies and Tools Used: C# .NET Core, ASP.NET MVC, MongoDB, Elastic Stack, \nRabbitMQ, Hangfire, Serilog, Seq, IdentityServer, Firebase, Slack, Odoo, Bamboo (CI), \nSyncfusion. \nKong API Gateway for Microservice  \nAtlassian Product (Jira, Bitbucket, Confluence, Bamboo (CI)) \nPfSense is firewall/router system \nVirtualization infrastructure : VMware vSphere/VMware vCenter Server Appliance \n4  \n01/2015 \u2013 07/2017: Senior Technical Assistant at VIETMAP CO., LTD (BU MAPS) \n\u2022 Settup CRM Tracking System (SuiteCRM, Asterisk, Custom API, Billing, Workflow & \nBPMS (Processmaker)) \n\u2022 License Management System \n- Website ASP.NET MVC : Account/Customer/Order/License/Device/Version \nManagement, History, Report  \n- App version windows C# : Register/Recover \nLicense \n- App version linux Java (Ubuntu) : Register License from SD card Serial Number \n\u2022 Construction Company Website \n- Build site using Kentico EMS \n- License Check/Warranty \n\u2022 Digital Mapping Projects \n- ESRI ArcMap Add-in \n- TileMap Proxy \n- POI Editor \n- Image Recognition \n10/2013 \u2013 11/2014: Product Manager at FELIX TECHNOLOGY JSC., \nFelix is one of the pioneer company in Vietnam providing Smart technology application  \nsolution system in online service and authentication management, look up the  products \norigin, E-warranty authentication, distribution system management,  brands promotion and \ncustomer care for the enterprises. Help enterprises reduce  the investment cost, easy to \nadministrate with new trend. \n\u2022 App FelixVN \n- Description # application development on mobile; brand identity; authentic goods; \nadvertising the brand, product introduction; promotions, customer management, customer \ncare \n- In the beginning, I involved in the team to build a working environment that was effective \nand friendly \n- Development with Agile Method and Scrum. \n5  \n05/2010 \u2013 08/2013: Senior Developer at VIETMAP CO., LTD \nDevelopment of LBS & Maps related projects \n\u2022 App Duahau \n- Description # Provide promotions, events of suppliers around users \n- App Android  \n- Web ASP.NET MVC + jQuery Mobile \n\u2022 App SaigonBus \n- Description # The guide is based on all the bus transfers managed by SaigonBus \n- App Android  \n- Web ASP.NET MVC + jQuery Mobile \nSOFT SKILL \n\u2022 Database analysis & designing \n\u2022 Team working /leading  \n\u2022 Logical thinking  \n\u2022 Independently working \n\u2022 Study Quickly \n\u2022 Problem-solving \nREFERENCES \nCompany's name & address \nReferee  \nTitle \nTelephone \nVIETMAP CO., LTD \n3 Tran Nhan Ton Str, Ward. 3,  \nDist. 5, HCMC. \nhttps://vietmap.vn \nPhone : (84-28) 3620.2055 \nHuynh Buu Ky \nDirector \n0908.613.191 \nLe Quoc Thai \nDirector \n0908.012.950 \nFELIX TECHNOLOGY JSC \nYOCO Tuoi Tre Building - 5th Floor, 41 \nNguyen Thi Minh Khai St.,  \nDist. 1, HCMC. \nhttp://felixvn.com  \nPhone : (84-28) 3822.0500 \nLe Quang Hung \nDirector \n0916.28.0001 \nXTRIP TRAVE JSC \n136 Nguyen Duy Duong St., Ward 9, \nDist. 5, HCMC. \nhttps://xtrip.vn \nPhone : (84-28) 7300.6001 \nLe Kim Bang \nDirector \n0908.414.599 ", "educations": [{"id": 5412, "gpa": null, "major": "Bi\u1ec3u di\u1ec5n nh\u1ea1c c\u1ee5 ph\u01b0\u01a1ng t\u00e2y", "school": "Institute Of Informatic Technology & Management", "diploma": "Other", "end_time": "2009-01-01T00:00:00Z", "conf_score": 0.8179831156416223, "start_time": "2006-01-01T00:00:00Z", "picklist_major": "Art/Design", "major_categories": "Ngh\u1ec7 thu\u1eadt", "major_categories_detail": "Ngh\u1ec7 thu\u1eadt tr\u00ecnh di\u1ec5n"}], "experiences": [{"id": 18099, "detail": "", "company": "XTRIP TRAVEL JSC., (VIETMAP GROUP)", "end_time": "2019-07-31T00:00:00Z", "industry": "Other", "position": "Technical Leader", "conf_score": 0.9162385206282713, "start_time": "2017-07-01T00:00:00Z"}, {"id": 18100, "detail": "", "company": "VIETMAP CO., LTD (BU MAPS)", "end_time": "2017-07-31T00:00:00Z", "industry": "Other", "position": "Senior Technical Assistant", "conf_score": 0.9245293243845362, "start_time": "2015-01-01T00:00:00Z"}, {"id": 18101, "detail": "", "company": "FELIX TECHNOLOGY JSC.,", "end_time": "2014-11-30T00:00:00Z", "industry": "High Technology", "position": "Product Manager", "conf_score": 0.7779983516018747, "start_time": "2013-10-01T00:00:00Z"}, {"id": 18102, "detail": "", "company": "VIETMAP CO., LTD", "end_time": "2013-08-31T00:00:00Z", "industry": "Other", "position": "Senior Developer", "conf_score": 0.9235910392469074, "start_time": "2010-05-01T00:00:00Z"}, {"id": 18103, "detail": "Expert - 2007 - Advance Software Developer Expert - 2008 - Enterprise Application Intergrate Expert - 2009", "company": null, "end_time": "2009-01-31T00:00:00Z", "industry": "Other", "position": "Software Arrhiterture", "conf_score": 0.7717988535735757, "start_time": "2006-01-01T00:00:00Z"}], "address": "Kb5, Kp3, Tan Thuan Tay, Dist 7, Hcm"}