{"skills": ["stack", "angular", "java", "marketing", "energetic", "wordpress", "javascript", "c#", "mongodb", "management", "postgresql", "xamarin", "framework7", "frontend development", "scrum master", "git", "analysis", "react native", "medium", "invoicing", "css", "restful", "jira", "influencer marketing", "bug fixing", "phonegap", "manage database", "database", "nestjs", "teamwork", "azure", "full stack development", "bitbucket", "php", "html", "relationship management"], "fulltext": "Nguyen Trong Thang\nSenior Front End Developer\nDate of birth:\n Nov 28, 1993\nGender:  Male\nPhone:\n 0797 680 657\nEmail:  thang1164113@gmail.com\nAddress:\n HCM, Vietnam\nWebsite:  https://www.linkedin.com/in/thang-nguyen-832667148/\nOBJECTIVE\nI have great passion with Website designing which I have almost 5 years of experiences such as HTML, CSS,\nJava script, CMS, C#, Nodejs, PHP, Postgresql , Angular, MongoDB, NestJS. I\u2019m very willing to learn new\nthings as well as work under pressure to develop my career as website designer because this is my passion. I\nhave experienced to work with great teams before who have energetic and enthusiastic attitude and inspired\nand creative ideas. These are very valuable experiences that I got so that I truly believe that I\u2019m able to be\nsuccessful at this field and also I won\u2019t stop trying my best at any time.\nEDUCATION\nJune 2011 - May 2014\nVietnam National University HCMC\nMajor: Information Technology\nGPA: 7.8/10\nWORK EXPERIENCE\nFed 2019 - Present\nINFINITE SOFTWARE\nSenior Full Stack Developer\nMain responsibilities:\n- Using Angular 8 to build platform about manage jobs, resources,\nprocess of works. Already running in AU\n- Using Xamarin to build application for mobile \n- Using MongoDB, NestJS, Node to manage database \n- Git, Jira, Bitbucket, Scrum, English communicate everyday\nMay 2017 - Feb 2019\nAnymind Group\nSenior Front End Developer\nMain responsibilities:\n- Using Angular to build platform about social media, ads and human\nresources \n- Using React Native to build application for mobile \n- Using Postgresql to manage database \n- Git, Jira, Bitbucket, Scrum, English communicate everyday\nApril 2016 - May 2014\nIt\u2019s a Beautiful Way\nFront End Developer\n- Develop web, mobile app using Phonegap and Framework7  \n- Make API by PHP\nApril 2015 - April 2016\nFounder Coffee Shop and Freelancer Website\nFreelancer\n- Work about front end path  \n- Use Wordpress to make website \n- Open coffee shop\nJuly 2014 - July 2015\nInnoxoft Techology Company\nFront End Developer\n- Well Knowledged about HTML Layout, CSS, Javascript, CMS, API \n- Skills to follow up and fulfill the work and strong experience to solve\nunexpected issues happening at work \n- Get used to work with the team and new system here \n- Learned how to catch up new things as well as new knowledge when\nrequired\n2011-2013\nVietnam National University: Won a scholarship in the second year and\nthird year\nHONORS & AWARDS\nLanguage English\nFront End\n\u2022 Angular, HTML/CSS, JAVASCRIPT, SASS, React, Restful\nAPI, Teamwork, Leader\nSKILLS\nACTIVITIES\n- Blood donation\n- Performing magic for children in SOS\n- Outdoor activities in the park\n- Jogging, playing sports regularly\n- Part time job\n- Volunteering for cleaning\nPROJECTS\nWorkBuddy\n(2019 - Now)\nCustomer Australia\nDescription\nJob management software for trades and service businesses\n1. Reduce paperwork: Store & access job documents online\n2. Real time job tracking: Track, book & dispatch staff and jobs\n3. Seamless invoicing: Quote & invoice from any device\n4. Teams stay compliant: Track OHS or WHS checklists\nTeam size\n7 (1 PM, 1 Scrum Master, 4 Full Stack, 1 Mobile)\nMy position\nFull Stack\n- Analysis and design\n- Development UI\n- Development API\nMy responsibilities\n- Discusion about ideal\n- Review code\n- Optimize code\n- Bug Fixing\nTechnologies used\n- Angular 8, MongoDB, NodeJs, NestJs, Sketch, Azure\n- Git, Bitbucket, Jira.\nCastingAsia\n(2017 - 2018)\nCustomer\n9 Countries\nDescription\nI. CastingAsia Platform: Influencer marketing platform that drives smart matching,\nengaging, influencer relationship management and reporting.\nII. CastingAsia Marketplace: Efficient, scalable and trustable performance-based\nmarketplace that connects micro-influencers to brands that matter.\nIII. CastingAsia Engagement: Leverage on proven influencer marketing and social\nmedia specialists to optimize your campaigns.\nTeam size\n6 (1PM, 2 Back-end, 1 Front-end, 1 QC, 1 Mobile)\nMy position\nFront End\nMy responsibilities\n- Analysis and design\n- Development UI\n- Discusion about ideal\n- Review code\n- Optimize code\n- Bug Fixing\nTechnologies used\n- Angular 5, Postgres, Lambda, S3, Sketch\n- Git, Bitbucket, Jira.\nTalentMind\n(2018 - 2018)\nCustomer\nThailand, Vietnam, Japan\nDescription\n\u30fb TalentMind provides an objective data-driven candidate alignment score\n\u30fbValuable resources and time are spent on reaching an optimized candidate\npipeline\n\u30fbBoost your time to hire, lessen candidate drop-out rate\n\u30fbTalentMind provides a user friendly experience for HR, recruiters and candidates\nTeam size\n6 (1PM, 2 Back-end, 2 Front-end, 1 QC)\nMy position\nFront End\nMy responsibilities\n- Analysis and design\n- Development UI\n- Discusion about ideal\n- Review code\n- Optimize code\n- Bug Fixing\nTechnologies used\n- Angular 5, Postgres, Lambda, S3, Sketch\n- Git, Bitbucket, Jira.\nTo see or not to see\n(2016 - 2017)\nCustomer France\nDescription\nLovers of cultural outings, this free application organizes the shows according to\nyour desires. Ideal to find yourself in all possible outings and find the \"good show\",\nthe one that corresponds to your appetite of the moment, the emotions you want to\nfeel. Because one day you can have a taste for a committed and serious play and\nanother day for a cheerful musical show.\nTeam size\n4 (1PM, 2 Back-end, 1 Front-end)\nMy position\nFront End\nMy responsibilities\n- Analysis and design\n- Development UI\n- Discusion about ideal\n- Optimize code\n- Bug Fixing\n- QC App\nTechnologies used\n- Framework7, Phonegap, Sketch\n- Git, Bitbucket, Jira.\n\u00a9 topcv.vn", "educations": [{"id": 5402, "gpa": "7.8", "major": "C\u00f4ng ngh\u1ec7 th\u00f4ng tin", "school": "Vietnam National University HCMC", "diploma": "Bachelors", "end_time": "2014-05-01T00:00:00Z", "conf_score": 0.9008202262261839, "start_time": "2011-06-01T00:00:00Z", "picklist_major": "IT - Hardware/Networking", "major_categories": "M\u00e1y t\u00ednh v\u00e0 c\u00f4ng ngh\u1ec7 th\u00f4ng tin", "major_categories_detail": "C\u00f4ng ngh\u1ec7 th\u00f4ng tin"}], "experiences": [{"id": 18066, "detail": "Main responsibilities:\n- Using Angular 8 to build platform about manage jobs, resources, process of works. Already running in AU - Using Xamarin to build application for mobile\n- Using MongoDB, NestJS, Node to manage database\n- Git, Jira, Bitbucket, Scrum, English communicate everyday", "company": "INFINITE SOFTWARE", "end_time": "2023-04-13T00:00:00Z", "industry": "High Technology", "position": "Senior Full Stack Developer", "conf_score": 0.9283402044765778, "start_time": "2019-01-01T00:00:00Z"}, {"id": 18067, "detail": "Main responsibilities:\n- Using Angular to build platform about social media, ads and human resources\n- Using React Native to build application for mobile\n- Using Postgresql to manage database\n- Git, Jira, Bitbucket, Scrum, English communicate everyday", "company": "Anymind Group", "end_time": "2019-02-28T00:00:00Z", "industry": "Other", "position": "Senior Front End Developer", "conf_score": 0.9522414576104914, "start_time": "2017-05-01T00:00:00Z"}, {"id": 18068, "detail": "Freelancer - Work about front end path\n- Use Wordpress to make website\n- Open coffee shop", "company": "Coffee Shop and Freelancer Website", "end_time": "2016-04-30T00:00:00Z", "industry": "Other", "position": "Founder", "conf_score": 0.8948419004195385, "start_time": "2015-04-01T00:00:00Z"}, {"id": 18069, "detail": "- Develop web, mobile app using Phonegap and Framework7 - Make API by PHP", "company": "It\u2019s a Beautiful Way", "end_time": "2016-04-30T00:00:00Z", "industry": "Other", "position": "Front End Developer", "conf_score": 0.9522414576104914, "start_time": "2014-05-01T00:00:00Z"}, {"id": 18070, "detail": "- Well Knowledged about HTML Layout, CSS, Javascript, CMS, API - Skills to follow up and fulfill the work and strong experience to solve unexpected issues happening at work\n- Get used to work with the team and new system here\n- Learned how to catch up new things as well as new knowledge when required", "company": "Innoxoft Techology Company", "end_time": "2015-07-31T00:00:00Z", "industry": "High Technology", "position": "Front End Developer", "conf_score": 0.9522414576104914, "start_time": "2014-07-01T00:00:00Z"}], "address": "Hcm, Vietnam"}