{"skills": ["workflow", "automation", "responsive", "ams", "implementation", "c#", "azure service bus", "object oriented", "entity framework", "hard working", "linq", "analysis", "mobile application", "data modeling", "microservices", "maintenance", "service bus", "insurance", "asp", "design pattern", "relational database", "sql", "integration testing", "oop", "jira", "unit testing", "testing", "mvc", "microsoft", "dynamodb", "performance optimization", "database", "process development", "jenkins", "problem solving skill", "azure service", "teamwork", "azure", "azure function", "problem solving", "bootstrap", "agile", "jquery"], "fulltext": "L\u00ea V\u0103n Ho\u00e0ng \nSenior Software engineer \n20-10-1992 \n\u3161 \nSummary \nI am a software engineer with 5 years of experience in .NET \ntechnologies, with knowledge of Object-Oriented programming. \nI am a hard-working, responsive and enthusiastic person. I am \nwell-organized and work well under pressure. I really enjoy working \nwith teamwork and I can also work on my own very effectively.  \nEager to learn new technologies is what I am passionate about. \n\u3161 \nSkills \nI have 5 years of experiences in C#, .NET, building window \napplications, web applications with ASP.NET MVC, include front end \nframework like jquery, knockout js.  \nExperiences of logical and physical data modeling and relational \ndatabase technologies( i.e SQL stored procedures, Entity \nFramework, LINQ).  \nExperiences in database performance optimization. \nExperiences working with Amazon web services(DynamoDB, S3, \nEC2,...), Azure(WebJobs, Azure Functions, ...). \nExperiences with Agile and Scrum development process. \nGood analysis, logic thinking, problem-solving skills. \nHard-working, well-organized and high sense of responsibility. \nHigh learning spirit, and eager to learn the new technologies. \n\u3161 \nExperiences \nJobLogic - Senior .NET Software engineer \nFeb 2019 - PRESENT \nDevelop new features, and maintain web applications. \nResponsibility for deploy LIVE every Monday. \nDeploy and monitor the system to catch up on the issues. \nWorking with Azure technologies, research the new \ntechnologies applied to project, like using Azure functions \ninstead of WebJobs.  \nMonitor the junior engineer, review the code for other \nmembers. \nTechnologies: \n\u25cf\nASP.NET MVC, ASP.NET Web API, .NET Core, \nMicroservices. \n\u25cf\nAzure WebJob, Azure Functions, Azure service bus, \u2026 \n\u25cf\nEntity Framework, SQL, Stored procedures. \n\u25cf\nNinject, Unit testing, Integration testing. \n\u25cf\nTFS, CICD, Jira \nPoeta Digital - Senior Software engineer \nApril 2017 - Feb 2019 \nDevelop, upgrade, deploy, and maintain the education web \napplication. \nCoordinate the design and implementation of various applications, \nincluding collaboration with project managers, client representative, \nand development team. \nMonitor the system to catch up on the issues and fixed the \nproblems. \nIncrease the system performance by detecting the slow, bad SQL \nqueries, stored procedures, and optimized those. \nCollaborate with team to define and improve the team\u2019s workflow. \nDecrease 40% time to deploy by using Jenkins for automation \nbuilding and deploying project.  \nMonitor the junior engineer, review code for other team members \nand share my knowledge with the team. \nTechnologies: \n\u25cf\nASP.NET MVC, ASP.NET Web API, Window services, \nWindows applications. \n\u25cf\nAmazon web services, S3, DynamoDB, EC2 \n\u25cf\nSQL Server, Stored procedures, Entity framework. \nAswig Solutions - Software engineer \nAugust 2015 - April 2017 \nHas 3 months working with Microsoft Biztalk server. \nDevelop and maintain the web application to manage the claim \ninsurance.  \nGet familiar to follow the Agile and Scrum development process. \nTechnologies: \n\u25cf\nASP.NET MVC, ASP.NET Web API. \n\u25cf\nOOP, SOLID principle, design pattern. \n\u25cf\nEntity Framework, SQL Server. \nABCV - Junior engineer \nJuly 2014 - August 2015 \nMaintenance the ASP.NET Web Form application, detect and correct \nerrors, improve performance  \nWork on a team to build the internal web application from the \nground up to release, using ASP.NET MVC, Entity framework, \nBootstrap, and Jquery. \nResearch and build the backend server system using ASP.NET Web \nAPI 2, integrated with a mobile application. \n\u3161 \nEducation \nHo Chi Minh University of Science \n2010 \u2013 2014  Major: Information Technology / Engineering. ", "educations": [{"id": 5425, "gpa": null, "major": "C\u00f4ng ngh\u1ec7 th\u00f4ng tin", "school": "Ho Chi Minh University of Science", "diploma": "Bachelors", "end_time": "2014-01-01T00:00:00Z", "conf_score": 0.8275107295019075, "start_time": "2010-01-01T00:00:00Z", "picklist_major": "IT - Hardware/Networking", "major_categories": "M\u00e1y t\u00ednh v\u00e0 c\u00f4ng ngh\u1ec7 th\u00f4ng tin", "major_categories_detail": "C\u00f4ng ngh\u1ec7 th\u00f4ng tin"}], "experiences": [{"id": 18137, "detail": "Develop new features, and maintain web applications.\nResponsibility for deploy LIVE every Monday. Deploy and monitor the system to catch up on the issues.\nWorking with Azure technologies, research the new technologies applied to project, like using Azure functions instead of WebJobs. Monitor the junior engineer, review the code for other members.\nTechnologies: \u25cf ASP.NET MVC, ASP.NET Web API, .NET Core, Microservices. \u25cf Azure WebJob, Azure Functions, Azure service bus, ... \u25cf Entity Framework, SQL, Stored procedures.\n\u25cf Ninject, Unit testing, Integration testing.\n\u25cf TFS, CICD, Jira", "company": "JobLogic", "end_time": "2023-04-13T00:00:00Z", "industry": "Other", "position": "Senior .NET Software engineer", "conf_score": 0.9242175468478587, "start_time": "2019-02-01T00:00:00Z"}, {"id": 18138, "detail": "Develop, upgrade, deploy, and maintain the education web application.\nCoordinate the design and implementation of various applications, including collaboration with project managers, client representative, and development team.\nMonitor the system to catch up on the issues and fixed the problems.\nIncrease the system performance by detecting the slow, bad SQL queries, stored procedures, and optimized those.\nCollaborate with team to define and improve the team\u2019s workflow.\nDecrease 40% time to deploy by using Jenkins for automation building and deploying project.\nMonitor the junior engineer, review code for other team members and share my knowledge with the team.\nTechnologies: \u25cf ASP.NET MVC, ASP.NET Web API, Window services,\nWindows applications.\n\u25cf Amazon web services, S3, DynamoDB, EC2 \u25cf SQL Server, Stored procedures, Entity framework.", "company": "Poeta Digital", "end_time": "2019-02-28T00:00:00Z", "industry": "High Technology", "position": "Senior Software engineer", "conf_score": 0.9257372771525854, "start_time": "2017-04-01T00:00:00Z"}, {"id": 18139, "detail": "Has 3 months working with Microsoft Biztalk server.\nDevelop and maintain the web application to manage the claim insurance.\nGet familiar to follow the Agile and Scrum development process.\nTechnologies: \u25cf ASP.NET MVC, ASP.NET Web API. \u25cf OOP, SOLID principle, design pattern.\n\u25cf Entity Framework, SQL Server.", "company": "Aswig Solutions", "end_time": "2017-04-30T00:00:00Z", "industry": "High Technology", "position": "Software engineer", "conf_score": 0.9240662279911389, "start_time": "2015-08-01T00:00:00Z"}, {"id": 18140, "detail": "Maintenance the ASP.NET Web Form application, detect and correct errors, improve performance\nWork on a team to build the internal web application from the ground up to release, using ASP.NET MVC, Entity framework,\nBootstrap, and Jquery. Research and build the backend server system using ASP.NET Web API 2, integrated with a mobile application.", "company": "ABCV", "end_time": "2015-08-31T00:00:00Z", "industry": "Other", "position": "Junior engineer", "conf_score": 0.9257372771525854, "start_time": "2014-07-01T00:00:00Z"}], "address": null}