{"skills": ["machine learning", "apache hadoop", "networking", "scala", "streaming", "intrusion detection", "analysis", "kafka", "firewall", "maven", "apache spark", "python", "spark sql", "visualization", "flask", "data warehouse", "rss", "linux", "digital content", "apache oozie", "redis", "tensorflow", "anomaly detection", "matplotlib", "mysql", "online analytical processing", "data analytics", "dash", "security", "data capture", "task management", "gunicorn", "marketing", "sql", "numpy", "malware", "sensitive data", "apache", "database", "analytics", "mongo", "business intelligence", "metabase", "business requirement", "grafana", "e learning technology", "apache kafka", "nginx", "intrusion detection system", "implementation", "docker", "data visualization", "streaming data", "hadoop", "mongodb", "relational database", "olap", "postgresql", "management", "restful"], "fulltext": "PHAN KI\u1ebeN TH\u1ee8C \nSENIOR DATA ENGINEER \n4 years\u2019 practical experience on Data \nEmail: kienthuc.phan@gmail.com \nPhone: (+84) 932 870 505 \nAddress: no. 112, 47 street, District 07, HCMC \nEDUCATION \nUniversity of Science, Vietnam National University Ho Chi Minh City \nB.S., Knowledge Engineering, September 2015 \nGPA: 7.6/10 \nThesis: Building an Intrusion Detection System for Database \nEXPERIENCE \nSendo Joint Stock Company (Jul 2019 - Present) \nSendo Joint Stock Company is a Vietnamese e-commerce retailer and online commerce \nplatform \nData engineer (Jul 2019 - Present) \nBuilding Data Framework (Jul 2019 - Present) \nObjective: Build a framework that users (BI and RaD) do not need to understand the \ninternal architecture that can mining and exploit data. \nTask: \n-\nBuilding data lake, streaming log-based change capture data (SQL Server, Mongo, \nMySQL) \n-\nBuilding online analytical processing (OLAP) \n-\nSupported by high-level business intelligence and analytics data exploration and \nvisualization tools \nTechnical: Kafka, Hadoop, Airflow, Spark, SQL Server, Mongo, MySQL, Druid, Metabase \nVNG Corporation (Jan 2015 \u2013 Jul 2019) \nVNG Corporation (VNG) is a Vietnamese technology company, founded in 2004, \nspecializing in digital content and online entertainment, social networking, and e- \ncommerce. The company has about 100 million online users \nSenior Data engineer ( Apr 2019 \u2013 Jul 2019) \nMigrate data warehouse(Jan 2019 \u2013 Jul 2019) \nObjective: Replace old technology with new technology, support streaming data. \nTask: \n-\nPreliminary discussion and assessment of current status \n-\nMigrate oozie job to airflow job, pig job to spark job \n-\nUnderstand business and support BI, marketing ad-hoc task \n-\nR&D Kafka Streaming \nTechnical: Spark, Hadoop, Airflow, Ozzie, Pig, Hive, CrateDB, PostgresDB, Redis, \nGrafana, Kafka  \nData engineer ( Apr 2017 \u2013 Apr 2019) \nBuild Masking Sensitive Data System (Oct 2017 - Jan 2019) \nObject: Building data platform, where departments in VNG corp that can share \nvaluable data for another that masking sensitive data. \nTask: \n-\nCreate data pipeline architecture \n-\nBuild the metadata for schedule task management \n-\nIdentify, design, and implement internal process improvements: automating manual \nprocesses, optimizing data delivery, re-designing infrastructure for greater \nscalability, etc \n-\nBuild the infrastructure required for optimal extraction, transformation, and loading of \ndata from a wide variety of data sources using Spark and Hadoop ecosystem. \n-\nReviewed  log  trading  audit  trails  and  effectively explained any missing data to \nensure all required elements were captured \n-\nSend email alert for new issues \n-\nAssemble large, complex data sets that meet functional / non-functional \nbusiness requirements \n-\nLoaded the aggregate data into a relational database/API for reporting, \ndash boarding and Ad-hoc analyses \n-\nReviews all data fields for accuracy with customer requirement \n-\nIdentify and resolve data issues \nTechnical: Spark, Hadoop, Airflow, Hive, PostgresDB, Redis \nBuild Farmer & Fraud Detection System (Oct 2018 - Present) \nObject: detect farming promotion zalopay, fraud detection zalopay \nTask: \n-\nSupported maintained code, improve performance \n-\nPerform parameters tuning for machine learning model \n-\nSupported deploy data visualization and reporting daily \n-\nDeploy RESTful API using Docker \nFraud Detection (Apr 2017 \u2013 Oct 2018) \nObject: R&D fraud detection zalopay \nTask: \n-\nExtract information and analyze transactions and active user logs \n-\nDesign and Implementation of a Fraud Detection API \nSecurity engineer (Jan 2015 \u2013 Apr 2017) \nAnomaly-based intrusion detection system (Jan 2015 - Apr 2017) \nObject: R&D anomaly detection in system log for security \nTask: \n-\nResearch Machine Learning technology for Anomaly Detection. \n-\nAnalyze security events (for example: server logs, firewall logs, \u2026), visualize \nand classify data to detect outliers (for example: attacking, fraudulent \nbehavior, compromised servers, malware traffic, ...) \n-\nBuild predictive models to detect abnormal events automatically \n-\nBuild dashboard monitor logs \nSKILLS: \nProgramming language: Python, Scala, R, Bash \nPlatform: GNU/Linux \nDatabase: PostgreSQL, Redis, Hive, MongoDB, CrateDB, MySQL \nFramework and libraries: Apache Spark, Apache Hadoop, Apache Airflow, Apache \nKafka, Apache Oozie, Nginx, Gunicorn, Flask, Numpy, TensorFlow, Matplotlib \nTools: Docker, Maven \nHOBBIES: Travel, Music, Running\nPowered by TCPDF (www.tcpdf.org)", "educations": [{"id": 5448, "gpa": null, "major": "Knowledge Engineering", "school": "University of Science, Vietnam National University Ho Chi Minh City", "diploma": "Bachelors", "end_time": "2015-09-01T00:00:00Z", "conf_score": 0.8881411380643149, "start_time": null, "picklist_major": "Other", "major_categories": "", "major_categories_detail": ""}], "experiences": [{"id": 18218, "detail": ") Sendo Joint Stock Company is a Vietnamese e-commerce retailer and online commerce platform", "company": "Sendo Joint Stock Company", "end_time": "2023-04-13T00:00:00Z", "industry": "High Technology", "position": null, "conf_score": 0.7498570186400335, "start_time": "2019-07-01T00:00:00Z"}, {"id": 18219, "detail": "ct: detect farming promotion zalopay, fraud detection zalopay\nTask: - Supported maintained code, improve performance\n- Perform parameters tuning for machine learning model\n- Supported deploy data visualization and reporting daily\n- Deploy RESTful API using Docker", "company": "VNG Corporation", "end_time": "2023-04-13T00:00:00Z", "industry": "High Technology", "position": ", PostgresDB, Redis\nBuild Farmer & Fr", "conf_score": 0.8378624319741883, "start_time": "2018-10-01T00:00:00Z"}, {"id": 18220, "detail": ") Objective: Replace old technology with new technology, support streaming data.\nTask: - Preliminary discussion and assessment of current status\n- Migrate oozie job to airflow job, pig job to spark job\n- Understand business and support BI, marketing ad-hoc task\n- R&D Kafka Streaming Technical: Spark, Hadoop, Airflow, Ozzie, Pig, Hive, CrateDB, PostgresDB, Redis, Grafana, Kafka", "company": "VNG Corporation", "end_time": "2019-07-31T00:00:00Z", "industry": "High Technology", "position": "Senior Data engineer", "conf_score": 0.8833157381494662, "start_time": "2019-04-01T00:00:00Z"}, {"id": 18221, "detail": "(VNG) is a Vietnamese technology company, founded in 2004, specializing in digital content and online entertainment, social networking, and e- commerce. The company has about 100 million online users", "company": "VNG Corporation", "end_time": "2019-07-31T00:00:00Z", "industry": "High Technology", "position": null, "conf_score": 0.9179476744221623, "start_time": "2015-01-01T00:00:00Z"}, {"id": 18222, "detail": "", "company": "VNG Corporation", "end_time": "2019-04-30T00:00:00Z", "industry": "High Technology", "position": "Data engineer", "conf_score": 0.8512024169315395, "start_time": "2017-04-01T00:00:00Z"}, {"id": 18223, "detail": "Object: R&D fraud detection zalopay\nTask: - Extract information and analyze transactions and active user logs\n- Design and Implementation of a Fraud Detection API", "company": "VNG Corporation", "end_time": "2018-10-31T00:00:00Z", "industry": "High Technology", "position": "Fraud Detection", "conf_score": 0.724021521843711, "start_time": "2017-04-01T00:00:00Z"}, {"id": 18224, "detail": "bject: R&D anomaly detection in system log for security\nTask: - Research Machine Learning technology for Anomaly Detection. - Analyze security events (for example: server logs, firewall logs, ...), visualize and classify data to detect outliers (for example: attacking, fraudulent behavior, compromised servers, malware traffic, ...) - Build predictive models to detect abnormal events automatically\n- Build dashboard monitor logs", "company": "VNG Corporation", "end_time": "2017-04-30T00:00:00Z", "industry": "High Technology", "position": "Security engineer", "conf_score": 0.8893773164248345, "start_time": "2015-01-01T00:00:00Z"}], "address": "no. 112, 47 street, District 07, Hcmc"}