{"skills": ["machine learning", "studio", "sourcetree", "java", "git", "uikit", "c++", "hue", "svn", "objective c", "firebase", "jira", "structure", "linux", "cocoapods", "iot", "io", "redux", "sqlite", "eauthentication", "security", "core data", "localization", "uml", "le", "c#", "redux persist", "macos", "javascript", "swift", "xamarin", "redux saga", "xml", "react native", "google map", "cloud", "data security", "teamwork", "operating system", "android", "problem solving skill", "mongodb", "gcd", "microcontroller", "management", "aws", "restful", "problem solving"], "fulltext": "CURRICULUM VITAE \nL\u00ca C\u00c1T B\u00ccNH \nEmail: catbinhle@gmail.com \nMobile: 0379.777.126 \nPERSONAL DETAILS \n\u2022 Name : \nL\u00ca C\u00c1T B\u00ccNH \n\u2022 Nationality:   \nVietnamese \n\u2022 Date of Birth: \nAugust, 20th 1989 \n\u2022 Date of Birth:  \nHue City \n\u2022 Sex:  \nMale \n\u2022 Marital status: \nSingle \n\u2022 Phone No.:  \n(+84) 379 777 126 \n\u2022 Email:  \ncatbinhle@gmail.com \n\u2022 Resident Address: 132, Truong Chinh Street, Hue City, Vietnam \n\u2022 Temporary residence: 129, Tran Van Du Street, Tan Binh District, HCM City \nEDUCATIONAL BACKGROUND \n\u2022 Electronics and Telecommunication Engineer \u2013 Hue University of Sciences \u2013 \nVietnam \nPROFESSIONAL SUMMARY \n\u2022 Over 7 years experience about native iOS. \n\u2022 Over 1 year experience about Android. \n\u2022 About 2 years experience about React Native. \n\u2022 About 9 months experience about native Xamarin (iOS). \n\u2022 Over 3 years experience with team leader and technical leader role. \n\u2022 Training and working with junior/fresher developers. \n\u2022 Be able to read, write, communicate and understand English well. \n\u2022 Planning and problem-solving skill. \n\u2022 Ambition, passion, organization and responsibility \n\u2022 Having ability to work well under pressure, teamwork or individual \n\u2022 Strong analytical skills and research. \nLe Cat Binh\u2019s CV - Confidential \n1 \nSOFTWARE \n\u2022 Having experience in Objective-C programming (for Xcode 10) \n\u2022 Having experience in Swift 4 programming (for Xcode 10) \n\u2022 Having experience in programming with Java (for Android) \n\u2022 Having experience in programming with C# (for Xamarin) \n\u2022 Having experience in programming with React Native (Javascript) \n\u2022 Having basic knowledge in programming with C/C++ (for KeilC) \n\u2022 Having basic knowledge about Nodejs, mongoDB, AWS. \n\u2022 Having good skills in using SourceTree, GIT and SVN. \n\u2022 Having good skills in applying Cocoapods. \n\u2022 Having good skills in UML, detail design. \nHARDWARE \n\u2022 Having basic knowledge about embedded system with ARM microprocessor \n\u2022 Having basic knowledge about IC design \nOPERATING SYSTEMS \n\u2022 MacOS \n\u2022 Windows, Linux \nWORK EXPERIENCE \n FPT Software: from Oct/2016 \u2013 Present \n\u27a2 React Native Projects: \n\u2022 Team Size: 5 \n\u2022 Role: Technical Leader \n\u2022 Responsibilities: \n- Training, assign tasks and support for members. \n- Implement my tasks, structure code management, resolve issues and \nresearch the new technology. \n\u2022 Technologies Used:  \n- React Native with Visual Code (Javascript programming) \n- Using Redux and Redux Saga for working with API and management \nstate of the app. \n- Offline mode (using Redux Persist and React-Native-Offline). \n- Calendars, Charts UI \n- Upload/Download data with server. \n- Processing background, multi-threads and multi-tasks. \nLe Cat Binh\u2019s CV - Confidential \n2 \n- Resolve performance of the app (smoother, speed app\u2026) \n\u27a2 IOS Projects: \n\u2022 Company: FPT Software (HCM office) \n\u2022 Team Size: 6 \n\u2022 Role: Technical Leader \n\u2022 Responsibilities: \n- Training, assign tasks and support for members. \n- Implement my tasks, structure code management, resolve issues and \nresearch the new technology. \n\u2022 Technologies Used:  \n- Objective-C/Swift 4.0 for XCode 10, MacOS (10.13 version). \n- Using AWS (Cognito to authentication) and Firebase (for Push \nNotification). \n- Processing background, processing from back ground to foreground. \n- Multi-Threads with GCD. \n- Save data to SQLite/Core Data and back up data. \n- Security data with Keychain. \n- IoT technology: remote sensors by iPhone (via clouds with notification \nevents). \n- Others: network, NSNotificationCenter, localization (languages), \nencrypt/decrypt, UIKit/Foundation Framwork, Google Map. \n\u2022 Reference (Apple Store) \n- https://itunes.apple.com/pk/app/pill-reminder-app-\npk/id1251504692?mt=8 \n- https://itunes.apple.com/us/app/nfl-sunday-ticket/id327243363 \n-  \n\u27a2 MacOSX Project: \n\u2022 Company: FPT Software (HCM office) \n\u2022 Team Size: 6 \n\u2022 Role: Technical Leader \n\u2022 Responsibilities: \n- Training, assign tasks and support for members. \n- Implement my tasks, structure code management, resolve issues and \nresearch the new technology. \n\u2022 Technologies Used:  \n- Swift 3.0 for XCode, MacOS (10.12.6 version). \n- Network, GCD (multi-download), localization (languages), \nNSNotificationCenter. \n- Encrypt/decrypt with data and files (get from API). \nLe Cat Binh\u2019s CV - Confidential \n3 \n- Core data, save files to the system (using NSFileManager). \n- Using Foxit/PDF Kit for: draw, hightlight, bookmark \n\u27a2 IoT Projects: \n\u2022 Company: FPT Software (HCM office) \n\u2022 Team Size: 6 \n\u2022 Role: Technical Leader \n\u2022 Responsibilities: \n- Training, assign tasks and support for members. \n- Implement my tasks, structure code management, resolve issues and \nresearch the new technology. \n\u2022 Technologies Used:  \n- Objective-C/Swift 4.0 for XCode 10, MacOS (10.13 version). \n- Using AWS (Cognito to authentication) and Firebase (for Push \nNotification). \n- Save data to CoreData. \n- Multi-Threads with GCD. \n- Security data with Keychain \n- Others: encrypt/decrypt, network\u2026 \n\u27a2 Xamarin Projects: \n\u2022 Company: FPT Software (HCM office) \n\u2022 Team Size: 4 \n\u2022 Role: Team Lead \n\u2022 Responsibilities: \n- Training, assign tasks and support for members. \n- Implement my tasks, structure code management, resolve issues and \nresearch the new technology. \n\u2022 Technologies Used:  \n- C# for Xamarin iOS (Native). \n- Network, mapkit. \n- Localization (languages). \n- Others: Animation, GCD\u2026 \n TREK2000 (Singapore company): from Aug/2012 \u2013 Sep/2016 \n\u27a2 iOS Projects: \n\u2022 Company: TREK2000 \n\u2022 Team Size: 3 \n\u2022 Responsibilities: \n- Study, research, implement my tasks.  \n- Structure code management.  \nLe Cat Binh\u2019s CV - Confidential \n4 \n- Resolve issues and research the new technology. \n- Support for members. \n\u2022 Technologies Used:  \n- Objective-C for XCode. \n- IoT technology: connect with devices via BLE Network (using \nCoreBluetooth). \n- Display the parameters of patients (ECG, heart beat) to UI Graphics. \n- Send data to server (using RESTful service). \n- Save data to Core Data. \n- Register/login with Facebook, Google. \n- Create QR Barcode. \n\u2022 Reference (Apple Store) \n- https://itunes.apple.com/sg/app/cloud-stringers/id717070985?mt=8 \n- https://itunes.apple.com/sg/app/patient-alert-assistant/id1071786060 \n\u27a2 MACOSX Projects: \n\u2022 Company: TREK2000 \n\u2022 Team Size: 3 \n\u2022 Responsibilities:  \n- Study, research, implement my tasks. \n- Structure code management.  \n- Resolve issues and research the new technology. \n- Support for members. \n\u2022 Technologies Used:  \n- Objective-C for XCode. \n- IoT technology: connect with devices via BLE Network (using \nCoreBluetooth). \n- Register/Login with Facebook, Google and Linkin \n- Working with JIRA and Atlassian. \n\u27a2 Android Projects:  \n\u2022 Company: TREK2000 \n\u2022 Team Size: 3 \n\u2022 Responsibilities:  \n- Study, research and implement my task. \n- Support Android team some tasks. \n\u2022 Technologies Used:  \n- Java for Android, using Android Studio. \n- XML for create UI. \n- Network and process background, multi-threads. \nLe Cat Binh\u2019s CV - Confidential \n5 \n OTHERS:  \n\u27a2 Project:  Jokes Story App \n\u2022 Company: Owner (push to Apple Store, links: \nhttps://itunes.apple.com/vn/app/jokes-story/id1303140660?mt=8 ) \n\u2022 Team Size: 2 \n\u2022 Responsibilities: \n- Support and guide for members \n- Create and implement all functions and features for app: connect with \nserver to get data, using UIKit and Foundation Framework to show data \n(TableView and CollectionView).  \n- Beside, I also using Push Notifcation Local for latest jokes story.  \n- The app also display advertising of Google/Facebook (at bottom app). \n\u2022 Technologies Used:  \n- Swift 3.0 for XCode 9.1, MacOS (10.12.6 version). \n- Network, GCD, UIKit/Foundation Framwork. \n- Facebook Audience Network, Google SDK. \n- Push Notification (Local). \n\u27a2 Embedded System Engineer (C/C++): (From: 2011 \u2013 Jul/2012) \n\u2022 Team Size: 4 \n\u2022 Responsibilities:  \n- Study, research and practice the projects at my University. \n- Support my team. \n\u2022 Technologies Used:  \n- C/C++ Programming with KeilC. \n- PIC microcontroller, ARM microprocessor. \n- Convert ADC/DAC. \n- Processing Image (Machine Learning). \nLe Cat Binh\u2019s CV - Confidential \n6 ", "educations": [{"id": 5464, "gpa": null, "major": "Kinh t\u1ebf c\u00f4ng nghi\u1ec7p", "school": "Hue University of Sciences", "diploma": "Bachelors", "end_time": null, "conf_score": 0.8316410973592406, "start_time": null, "picklist_major": "Technical", "major_categories": "C\u00f4ng ngh\u1ec7 k\u1ef9 thu\u1eadt", "major_categories_detail": "Qu\u1ea3n l\u00fd c\u00f4ng nghi\u1ec7p"}], "experiences": [{"id": 18274, "detail": "\u2022 Responsibilities: - Training, assign tasks and support for members.\n- Implement my tasks, structure code management, resolve issues and research the new technology.\n\u2022 Technologies Used: - React Native with Visual Code (Javascript programming)\n- Using Redux and Redux Saga for working with API and management state of the app.\n- Offline mode (using Redux Persist and React-Native-Offline). - Calendars, Charts UI - Upload/Download data with server.\n- Processing background, multi-threads and multi-tasks.", "company": "FPT Software", "end_time": "2023-04-13T00:00:00Z", "industry": "High Technology", "position": "Technical Leader", "conf_score": 0.907376830062581, "start_time": "2016-10-01T00:00:00Z"}, {"id": 18275, "detail": "\u2022 Team Size: 3 \u2022 Responsibilities: - Study, research, implement my tasks.\n- Structure code management.\n- Resolve issues and research the new technology.\n- Support for members.\n\u2022 Technologies Used: - Objective-C for XCode. - IoT technology: connect with devices via BLE Network (using\nCoreBluetooth). - Display the parameters of patients (ECG, heart beat) to UI Graphics. - Send data to server (using RESTful service).\n- Save data to Core Data. - Register/login with Facebook, Google. - Create QR Barcode. \u2022 Reference (Apple Store) - https://itunes.apple.com/sg/app/cloud-stringers/id717070985?mt=8\n- https://itunes.apple.com/sg/app/patient-alert-assistant/id1071786060", "company": "TREK2000", "end_time": "2016-09-30T00:00:00Z", "industry": "Other", "position": null, "conf_score": 0.8361663933013492, "start_time": "2012-08-01T00:00:00Z"}, {"id": 18276, "detail": ") \u2022 Team Size: 4 \u2022 Responsibilities: - Study, research and practice the projects at my University. - Support my team.\n\u2022 Technologies Used: - C/C++ Programming with KeilC. - PIC microcontroller, ARM microprocessor.\n- Convert ADC/DAC. - Processing Image (Machine Learning).", "company": null, "end_time": "2012-07-31T00:00:00Z", "industry": "Other", "position": "Embedded System Engineer", "conf_score": 0.6925429707670153, "start_time": "2011-01-01T00:00:00Z"}], "address": "132, Truong Chinh Street, Hue City, Vietnam"}