{"skills": ["aws", "java", "client server", "javascript", "database management", "bootstrap", "machine learning", "management", "yeoman", "postgresql", "git", "project management", "design pattern", "sql", "oop", "mvc", "reactjs", "npm", "laravel", "uml", "database", "database design", "analyst", "sqlite", "yarn", "junit", "package manager", "php", "agile", "mysql", "jquery"], "fulltext": "Steven CIBAMBO\nProgrammer Analyst\nII MY Dinh\nHano\u00ef, Viet Nam\n\ufffd +84- 356456309\n\ufffd stevencibambo@gmail.com\n\ufffd https://stevencibambo.blogspot.com/\nKeys competencies and Skills\n\ufffd Have long time working experience (over \ufb01ve years)\n\ufffd Have strong knowledge of Java, PHP, MVC standard, OOP, conding convention\n\ufffd Have working with PHP framework Laravel\n\ufffd Have experience of using JavaScript libraries, frameworks: Jquery, ReactJS\n\ufffd Have experience working with some tools, package manager for frontend or backend such as : composer, npm,\nyarn, yeoman\n\ufffd Experience of using design patterns, bootstrap, MDB React\n\ufffd Experience of database management : able to work with MySQL, PostgreSQL, SQLite, MS SQL. Know how\nto design database, optmize database, writing best query, functions store procedure etc.\n\ufffd Experience of using UML for modeling system\n\ufffd Able to admnistrate Lunix / Winddow server and experience with client-server archicteture\n\ufffd Experience of using some services of AWS such as : EC2, RDS, S3\nOther skills and knowledge\n\ufffd Able to working under some method of project management such as : Agile, Scrum, Planing Poker\n\ufffd Always ready to learn new trends technological\n\ufffd Autonomous and able to propose a good solution to solve the problem\n\ufffd Experience with using Git for manager and share source code\n\ufffd Machine learning & AI: Scikit, Gaml, Jade\nWork Experience\nJune 2016 \u2013\nSept 2018\nNet-Telcoms ,  Burundi .\n\ufffd Working as team leader and main Java/PHP developer\n\ufffd Design and optimize database\n\ufffd Write speci\ufb01cations specifying the technical solutions\n\ufffd Writing Unitest(JUnit)\n\ufffd Review source code\n\ufffd Training for other member\n\ufffd Maintain and update product\n\ufffd Write user manuals and user guides\nApril 2015 \u2013\nJune 2016\nPactoma Ltd, Burundi.\n\ufffd Working as PHP developer\n\ufffd Making daily report\n\ufffd Optimize the UI\n\ufffd Receive task from team leader\n\ufffd Cross preview with other developer\nEducation\n2018\u20132020 Vietnam National University, Master\u2019s degree, Computer Science, Intelligent System and\nMultimedia.\n1/2", "educations": [{"id": 5470, "gpa": null, "major": "V\u1eadt l\u00fd nguy\u00ean t\u1eed v\u00e0 h\u1ea1t nh\u00e2n", "school": "Vietnam National University", "diploma": "Masters", "end_time": "2020-01-01T00:00:00Z", "conf_score": 0.8169468421241411, "start_time": "2018-01-01T00:00:00Z", "picklist_major": "Other", "major_categories": "Khoa h\u1ecdc t\u1ef1 nhi\u00ean", "major_categories_detail": "Khoa h\u1ecdc v\u1eadt ch\u1ea5t"}], "experiences": [{"id": 18287, "detail": "esign and optimize database\nWrite specifications specifying the technical solutions\nWriting Unitest(JUnit) Review source code\nTraining for other member\nMaintain and update product\nWrite user manuals and user guides", "company": "Net - Telcoms", "end_time": "2018-09-30T00:00:00Z", "industry": "Other", "position": "team leader and main Java/PHP developer", "conf_score": 0.8966549920361057, "start_time": "2016-06-01T00:00:00Z"}, {"id": 18289, "detail": "Making daily report\nOptimize the UI Receive task from team leader\nCross preview with other developer", "company": "Pactoma Ltd,", "end_time": "2016-06-30T00:00:00Z", "industry": "Other", "position": "PHP developer", "conf_score": 0.912446606303612, "start_time": "2015-04-01T00:00:00Z"}], "address": "o\u00ef, Viet Nam"}