{"skills": ["hard working", "application migration", "studio", "application testing", "css", "bem", "git", "typescript", "testing", "window 10", "object model", "automation", "automation test", "jira", "structure", "html", "dart", "ubuntu", "mysql", "bitbucket", "wordpress", "javascript framework", "rxjs", "eauthentication", "jquery", "angular", "unit test", "linters", "sql", "selenium", "c#", "visual studio", "package manager", "javascript", "cli", "website development", "database", "npm", "sc", "bulma", "bootstrap", "mvc", "docker", "css framework", "window 7", "css architecture", "frontend development", "smacss", "php", "tdd", "m sql server", "browserstack", "angularjs", "mongodb", "management", "gitlab", "asp"], "fulltext": "Nguyen Van Nam \nSUMMARY \n- \nHave consistently contributed to company\u2019s growth and profitability by combining technical, \nmanagement knowledge and with a dedicated proactive approach. \n- \nCooperative and able to perform within a team-oriented atmosphere. \n- \nMore than 5 years experienced working at web developer. \n- \nMore than 2 years remote job Angular/ASP.NET core MVC. \n- \nCan presentation and training. \n- \nHard working, eager to learn. \n- \nCan work well under pressure. \n- \nHobbies: information technology, films, games and travel. \nTECHNICAL SKILLS \n1.   Frontends: \n- \nHTML/CSS. \n- \nBasic for JavaScript. \n- \nPackage manager: npm. \n- \nCSS Pre-processors: SCSS. \n- \nLangulage: TypeScript, Javascript, Dart. \n- \nFramework: Angular, ngrx, RxJS. \n- \nExperiences implement best practice in frontend. \n- \nCSS Framework: Devextreme, Bootstrap, Angular Material, Bulma. \n- \nCSS Architecture: SMACSS, BEM \n- \nPixel Perfect Frontend Development: Perfect Pixel addon, Ruler, BrowserStack. \n- \nBuild tool: Task runner, linters and formatters \n- \nTesting. \n2.   Backend Languages: \n- \nExperience implement ASP.Net Core. \n- \nExperience implement Entityframework. \n- \nExperience implement IdentityServer4, Implements with Google, Facebook service provider \nauthentication. \n- \nExperience implement databases like MS SQL Server, Mysql, Postgres, MongoDB. \n- \nExperience used with Nodejs, Express, TypeORM \n- \nExperience used with TDD for Automation test (use Gherkin). \n3.   Others \n- \nHTTP/HTTPS and API. \n- \nSOLID, CQRS. \n- \nSercurity Code \n- \nGit version. \n2/5 \n- \nWork with scrum, Jira tools. \nEDUCATION & CERTIFICATIONS. \n- \n2009 \u2013 2014, Software engineering \u2013 Vietnam Agricultural Institute \u2013 Vietnam. \n- \n2014, Intern, Web Application Developer in Techmaster Vietnam \nPROJECTS \n1. July 2015 \u2013 July 2016 \nWeb Developer \nCustomer: Viet Nam \nRole: Web Developer \nProject Description: \n- \nDevelop the company\u2019s products for healthcare, portal application. \nTeam size: 5 peoples \nResponsibilities: \n- \nDefine structure object model \n- \nDefine solution for project \n- \nCoding \n- \nReport Design \n- \nBreak down user stories into tasks \n- \nEnhance performance of application \n- \nTesting. \nTechnologies Used: \n- \nHardware environment: PC \u2013 Sam sung 21 inch \n- \nSoftware environment: Windows 7 \n- \nDevelopment tools: Visual studio 2013, Nodepad++, subline text 3, Visio. \n- \nProgramming language: C#, Javascript, .NET Framework - MVC4, Bootstrap 3 \n2. July 2016 \u2013 May 2017 \nRole: Web developer \nCustomer: Viet Nam \nRole: Fullstack Web developer \nProject Description: \n- \nDevelop the opensource's products \nTeam size: 5 peoples \nResponsibilities: \n3/5 \n- \nCoding/Development \n- \nReview Code \n- \nBackup database \n- \nDeploy application \n- \nBreak down user stories into tasks \n- \nEnhance performance of application \nTechnologies Used: \n- \nHardware environment: PC, Laptop \n- \nSoftware environment: Windows 10, Ubuntu, GIT, Bitbucket \n- \nDevelopment tools: Visual studio 2015, Nodepad++, subline text 3, baqsomid, paint.net. \n- \nProgramming language: C#, Javascript, php. \n- \nFramework: ASP.NET MVC, Bootstrap 3, AngularJS, Wordpress, Jquery \n3. May 2017 \u2013 May 2019 \nFullstack Web developer ASP.NET \nProject 1: Aventis \nCustomer: Switzerland \nRole: Fullstack Web developer \nDescription: \n- \nMigration Application from Window Application into Web Application. \nTeam size: 10 people \nResponsibilities: \n- \nCoding. \n- \nResearch and Build Architecture project. \n- \nReview Code. \n- \nUnit Test. \n- \nAutomation UI test \n- \nBreak down user stories into tasks \n- \nEnhance performance of application \n- \nSupport team member. \n- \nCI/CD Developer plan. \n- \nOnsite. \nTechnologies Used: \n- \nHardware environment: PC, Laptop \n- \nSoftware environment: Windows 10, Ubuntu \n- \nDevelopment tools: Visual studio 2015, VSTS team services, Jira, Confurenc, GIT, GITLAB, MS \nSQL Server. \n- \nProgramming language: C#, Javascript, Typescript. \n- \nFramework: .NET Core 2.0, Bootstrap, Angular5+, Selenium, Docker composer, Devextreme. \nEntityframework, Dapper, Gherkin, WebDAV. \nProject 2: Application Portal \nCustomer: Switzerland \n4/5 \nRole: Fullstack Web developer \nDescription: \n- \nUsed .Net Core 2.0 to develop portal for intranet system, includes PinNet.Chat, PinNet.Portal, \nPinNet.Admin \nTeam size:  3 people \nResponsibilities: \n- \nCoding \n- \nReview Code \n- \nUnit Test \n- \nBreak down user stories into tasks \n- \nEnhance performance of application \n- \nRefactor for quality code \nTechnologies Used: \n- \nHardware environment: PC, Laptop \n- \nSoftware environment: Windows 10 \n- \nDevelopment tools: Visual studio 2015, VSTS team services, GIT, SQL Lite. \n- \nProgramming language: C#, Javascript. \n- \nFramework: .NET Core 2.0, Bootstrap, Jquery, Entityframework, Gherkin, WebDAV, WebRTC, \nWebsocket. \nProject 3: Rethink Calendar \nCustomer: Switzerland \nRole: Fullstack Web developer \nDescription: \n- \nDevelop Web Application Rethink like google calendar. \nTeam size: 5 people \nResponsibilities: \n- \nDeveloper. \n- \nReview Code \n- \nUnit Test. \n- \nBreak down user stories into tasks \n- \nEnhance performance of application \nTechnologies Used: \n- \nHardware environment: PC, Laptop \n- \nSoftware environment: Windows 10 \n- \nDevelopment tools: Visual studio 2015, VSTS team services, GIT, MS SQL Server. \n- \nProgramming language: C#, Javascript. \n- \nFramework: .NET Core 2.0, Bootstrap, Jquery, Entityframework, AngularJS \nMay 2019 \u2013 1/10/2019 \nSenior Frontend Developer \n5/5 \nCustomer: Sysmex, KPMG \nRole: Senior Frontend Developer \nResponsibilities: \n- \nDeveloper \n- \nReview code. \n- \nSupport for member. \n- \nUnit test \n- \nBuild framework structure for project. \n- \nTraining technical angular for member \nTechnologies Used: \n- \nHardware environment: PC Core i5 \u2013 RAM 8gb, 1 monitor screen 21 inch. \n- \nSoftware environment: Window 10, Jira, Confurence. \n- \nDevelopment tools: Visual code studio, Postgres, npm, NodeJS, CLI, etc. \n- \nProgramming Language: Typescript, HTML/CSS, Javascript, Sass \n- \nFramework: Angular7+, Matterial, Bootstrap. ", "educations": [{"id": 5478, "gpa": null, "major": "K\u1ef9 thu\u1eadt ph\u1ea7n m\u1ec1m", "school": "Vietnam Agricultural Institute", "diploma": "Other", "end_time": "2014-01-01T00:00:00Z", "conf_score": 0.8515220555192423, "start_time": "2009-01-01T00:00:00Z", "picklist_major": "IT - Hardware/Networking", "major_categories": "M\u00e1y t\u00ednh v\u00e0 c\u00f4ng ngh\u1ec7 th\u00f4ng tin", "major_categories_detail": "M\u00e1y t\u00ednh"}], "experiences": [{"id": 18315, "detail": "", "company": "Techmaster Vietnam", "end_time": "2014-12-31T00:00:00Z", "industry": "High Technology", "position": "Intern, Web Application Developer", "conf_score": 0.8573139835697601, "start_time": "2014-01-01T00:00:00Z"}, {"id": 18317, "detail": "", "company": "Vietnam Agricultural Institute", "end_time": "2014-01-31T00:00:00Z", "industry": "Agriculture", "position": "Software engineering", "conf_score": 0.874687733450848, "start_time": "2009-01-01T00:00:00Z"}], "address": null}