{"skills": ["docker", "cnn", "knn", "java", "analytics", "c++", "c#", "bot", "machine learning", "kera", "flask", "management", "studio", "kubernetes", "object oriented", "k mean", "git", "svn", "structure", "medium", "data structure", "algorithm", "visual studio", "numpy", "rnn", "backend development", "python", "perforce", "decision tree", "auditing", "lstm"], "fulltext": "L\u00ea H\u1ed3ng Hi\u1ebfu \nGraduated from University of science \nGender: Male \nDate of birth: 12/15/1996                 Address: 617/36A Ba \u0110\u00ecnh, ward 9, district 8, Ho Chi Minh city \nPhone number: 033 8919 426          Email: lehonghieu1412159@gmail.com \n                                                    Medium channel \nWork Experience \nDuring colledge: \n\u2022 \nLearned programming. \n\u2022 \nSpecialized in Machine learning on the second half of college period \n\u2022 \nMost prideful projects: Eng-Viet dictinary written in C#, Phone price predictor based on phone\u2019s configuration, a \nsmall chatbot using Doc2Vec. \nActual Work \n\u2022 \n2/2018 \u2013 11/2018: Vice technical supervisor at Glass Egg for the following projects: \no Real racing 4: Electronic Art \no Darwin: Frontier \no Elite Dangerous: Frontier \n\u2022 \n12/2018 \u2013 1/2019: Data scientist at Momo \no Support automating auditing process \n\u2022 \n2/2019 \u2013 present: Backend developer at ChatQ \no Maintain backend system for chat app \no Create a healthcheck in the form of micro service to make sure that all stock exchanges are running \nproperly \no Validating trading bot configuration by using Mako recursively \no Also got my first NLP related medium blog pulished by Analytics Vidhya. Read it here \nEducation \nDegree / Diploma \nUniversity of science- Computer science \n2014 \u2013 2018 \nGPA: 7.67/10 \nSkills \n\u2022 \nData structure and algorithms, object-oriented programming \n\u2022 \nAble to use Kubernetes, docker, google pubsub, git. \n\u2022 \nQuite deep understanding in Machine learning and Data science (Neuron net, CNN, RNN, LSTM, decision tree, k-means, \nknn, xgboost). \nProgramming language \nC/C++, Python (2 years), java,..v..v (willing to learn if necessary) \nTechnologies \nFramework: Mqtt, Keras, numpy, flask, restapi. \nIDEs and text editors: Visual studio, anaconda, pycharm, visual code, sublime text, nodepad++, intelliJ \nSource controls: perforce, svn, git \nSoft skills \n\u2022 \nAble to work under pressure. Good at time management \n\u2022 \nAble to use any skills in English including reading, writing, listening and speaking \n\u2022 \nCan communicate and deliver presentations in English \nPlus: I also got 307 in Toeic for 2 other skills (speaking and writing), the test was conducted in the cooperation between \nmy university and IIG to slash the costs for students. In detail, speaking and writing are 131/200 and 176/200 respectively. \nForeign language ", "educations": [{"id": 5477, "gpa": "7.67", "major": null, "school": "University of science -", "diploma": "Bachelors", "end_time": "2018-01-01T00:00:00Z", "conf_score": 0.8200383793961525, "start_time": "2014-01-01T00:00:00Z", "picklist_major": "Other", "major_categories": "", "major_categories_detail": ""}], "experiences": [{"id": 18312, "detail": "Maintain backend system for chat app o Create a healthcheck in the form of micro service to make sure that all stock exchanges are running properly o Validating trading bot configuration by using Mako recursively o Also got my first NLP related medium blog pulished by Analytics Vidhya. Read it here", "company": "ChatQ", "end_time": "2023-04-13T00:00:00Z", "industry": "Other", "position": "Backend developer", "conf_score": 0.9242015051317842, "start_time": "2019-02-01T00:00:00Z"}, {"id": 18313, "detail": "Support automating auditing process\n\u2022 2/", "company": "Momo", "end_time": "2019-01-31T00:00:00Z", "industry": "Other", "position": "Data scientist", "conf_score": 0.9242015051317842, "start_time": "2018-12-01T00:00:00Z"}, {"id": 18314, "detail": "or the following projects: o Real racing 4: Electronic Art o Darwin: Frontier o Elite Dangerous: Frontier \u2022 12", "company": "Glass Egg", "end_time": "2018-11-30T00:00:00Z", "industry": "Other", "position": "Vice technical supervisor", "conf_score": 0.8591899871563561, "start_time": "2018-02-01T00:00:00Z"}], "address": "617/36a Ba \u0110\u00ecnh, ward 9, district 8, Ho Chi Minh city"}