{"skills": ["kafka", "css3", "payment", "java", "jboss", "javascript", "cloud", "jdbc", "management", "search engine", "excel", "gitlab", "java core", "gitlab ci", "security", "spring boot", "elasticsearch", "positive attitude", "html5", "structure", "spring cloud", "spring", "microservices", "database development", "search", "spring security", "scheduling", "business service", "sql", "css", "restful", "oop", "business process management", "uml", "oracle", "database", "hibernate", "angularjs", "process management", "bootstrap", "mysql", "jquery"], "fulltext": "CURRICULUM VITAE \nPERSONAL DETAILS \nFull Name: H\u00e0 Huy V\u0169 \nPosition: Senior Java Developer \nDate of birth: Oct 7th, 1992 \nPhone: 0393675365 \nEmail: hahuyvu0710@gmail.com \nAddress: 15A 48 St, Ward 16, District 8, Ho Chi Minh City, Viet Nam \nOBJECTIVE: To have a good opportunity to work independently or as a part of a dynamic team where I \ncould make a significant contribution and develop as well as improve myself in both technical and soft skills. \nSUMMARY \n\u25cf Java programming capabilities well with more than 4 years' experience.  \n\u25cf Good experience on Java Core, Spring boot, Spring Microservice, Spring Cloud, Spring Security, \nSpring Data JPA, Hibernate \n\u25cf Good experience with Frontend: HTML5, CSS, Javascript, jQuery, AngularJS \n\u25cf Good knowledge of Search Engine as ElasticSearch \n\u25cf Good knowledge of Message Queue as Kafka \n\u25cf Good knowledge of Keycloak, JBPM, JBOSS server \n\u25cf Have experience in GitLab CI/CD \n\u25cf Passionate about computer programming, willing to learn new technology. \nSKILLS \nTechnology: \n\u25cf JAVA, JDBC, Thymeleaf \n\u25cf HTML5, CSS3, Bootstrap \n\u25cf Javascript, Jquery, AngularJS \n\u25cf UML, OOAD, OOP, SQL \nFramework: \n\u25cf Spring Boot, Spring Data JPA, SpringMVC, Spring Security, \nSpring Cloud Eureka - Microservice, Hibernate \n\u25cf Keycloak, JBPM (Jboss Business Process Management) \n\u25cf Vert.x \nSoft skills: \n\u25cf Research and solve problem quickly. \n\u25cf Work independently. \n\u25cf Have positive attitude in team working, work and time \norganization. \n\u25cf Prefer supporting team member. \nResume of Ha Huy Vu \nPage 1 of 3 \nForeign Languages: \n\u25cf English (intermediate) \n\u25cf Vietnamese (native) \nOthers: \n\u25cf WebService: RESTful \n\u25cf Database: MySQL, Oracle \n\u25cf Search Engine: ElasticSearch \n\u25cf Message Queue: Kafka \n\u25cf GitLab CI/CD \nEDUCATION \nTime \nInstitution and Degree \nFrom 2011 to 2015 \n\u25cf University: Ho Chi Minh City University of Education \n\u25cf Faculty: B.S of Information Technology \n\u25cf Diploma: IT Engineering \n\u25cf Grade: Good \nWORKING EXPERIENCE \nJobHop (11/2018 - Present) - Software Backend Engineer \nProject Name: \nJobHop Backend Service \nFrom: 11/2018 \nTo: Present \nProject Description: \nJobHop automatically \u201cscore\u201d your profile and recommend \nsuitable jobs. With AI, we developed a new smart job \nsearching to help you finding the best hop \nProject size: \n2 developers \n- Database Structure and Design for system \n- Building a microservices with Spring Boot and Spring \nCloud \n- Authenticate using Facebook Login and Google Login \n- Implementing logging with custom Spring AOP Annotation \nResponsibilities: \n- Sending email with Mailgun \n- Integrate payment gateway with NganLuong \n- Integrate ElasticSearch for system \n- Scheduling with google calendar api java \n- Deploy application with GitLab CI/CD \nVietcapital Bank (04/2017 - 11/2018) - Senior Java Developer \nProject Name: \nBusiness Service Desk \nFrom: 04/2017 \nTo: 07/2017 \nProject Description: \nProject manage ticket process for departments \nResume of Ha Huy Vu \nPage 2 of 3 \nProject size: \n1 developer \n- Build project use Spring Boot, AngularJS, Keycloak, JBPM \n- Authorize user with Keycloak \nResponsibilities: \n- Management ticket process page \nProject Name: \nApp Printing \nFrom: 08/2017 \nTo: 03/2018 \nProject Description: \nDocument management system \nProject size: \n1 developer \n- Document management, export more file types from .jasper \nfile with iReport \nResponsibilities: \n- Handles dynamic data retrieved from multiple databases \n- User authorization for reporting \nProject Name: \nScore Card \nFrom: 03/2018 \nTo: 11/2018 \nProject Description: \nScoring system customers have achieved qualify for the loan \nProject size: \n1 developer \n- Manage scoring for customer, Corporation and Retail \n- Manage report approval processes \nResponsibilities: \n- Handles dynamic data from excel file template \n- Scoring on Excel file (push input to excel file and get \noutput) \nMoMo (05/2015 - 04/2017) - Java Developer \nProject Name: \nMoMo Backend Service \nFrom: 05/2015 \nTo: 04/2017 \nProject Description: \nMoMo e-wallet is a financial application that allows to \nreceive and receive money Super fast, easy to use and \nabsolutely safe \nProject size: \n5 developers \n- Develop API for Mobile team \n- Upgrade, develop, manage Backend Server \n- Build ElasticSearch, clone data from old server to new \nserver \nResponsibilities: \n- Build tool noti to manage schedule push noti to user \n- Write function sync data MIS oracle to data ElasticSearch \nto manage POS,  \n- Use ElasticSearch to get POS, search location POS \nResume of Ha Huy Vu \nPage 3 of 3 ", "educations": [{"id": 5483, "gpa": null, "major": "C\u00f4ng ngh\u1ec7 th\u00f4ng tin", "school": "Ho Chi Minh City University of Education", "diploma": "Bachelors", "end_time": "2015-01-01T00:00:00Z", "conf_score": 0.8225550773200425, "start_time": "2011-01-01T00:00:00Z", "picklist_major": "IT - Hardware/Networking", "major_categories": "M\u00e1y t\u00ednh v\u00e0 c\u00f4ng ngh\u1ec7 th\u00f4ng tin", "major_categories_detail": "C\u00f4ng ngh\u1ec7 th\u00f4ng tin"}], "experiences": [{"id": 18336, "detail": "", "company": "JobHop", "end_time": "2023-04-13T00:00:00Z", "industry": "Other", "position": "Software Backend Engineer", "conf_score": 0.9089868123963978, "start_time": "2018-11-01T00:00:00Z"}, {"id": 18337, "detail": "", "company": "Vietcapital Bank", "end_time": "2018-11-30T00:00:00Z", "industry": "Banking", "position": "Senior Java Developer", "conf_score": 0.793670456519237, "start_time": "2017-04-01T00:00:00Z"}, {"id": 18338, "detail": "Project Description: Project manage ticket process for departments\nProject size:\n1 developer\n- Build project use Spring Boot, AngularJS, Keycloak, JBPM - Authorize user with Keycloak Responsibilities: - Management ticket process page", "company": "Vietcapital Bank", "end_time": "2017-07-31T00:00:00Z", "industry": "Banking", "position": "Business Service Desk", "conf_score": 0.6981244904084882, "start_time": "2017-04-01T00:00:00Z"}, {"id": 18339, "detail": "roject Description: Scoring system customers have achieved qualify for the loan\nProject size:\n1 developer\n- Manage scoring for customer, Corporation and Retail - Manage report approval processes\nResponsibilities: - Handles dynamic data from excel file template\n- Scoring on Excel file (push input to excel file and get output)\nMoMo (05/2015 - 04/2017) - Java Developer", "company": "MoMo", "end_time": "2017-04-30T00:00:00Z", "industry": "Other", "position": "Java Developer", "conf_score": 0.823654495990365, "start_time": "2015-05-01T00:00:00Z"}], "address": "15a 48 St, Ward 16, District 8, Ho Chi Minh City, Viet Nam"}