{"skills": ["stack", "aws", "workflow", "docker", "payment", "agile", "analytics", "futures", "javascript", "ams", "cloud", "bootstrap", "sidekiq", "amazon s3", "machine learning", "gitlab", "redux", "heroku", "postgresql", "kubernetes", "security", "io", "container registry", "git", "devops", "analysis", "rail", "redis", "leasing", "ruby", "redux saga", "amazon ec2", "docker compose", "business analyst", "verbal communication", "javascript framework", "nosql", "business intelligence", "rspec", "nginx", "website development", "restful", "le", "github", "microsoft", "continuous integration", "database", "clustering", "analyst", "redmine", "api gateway", "capistrano", "distributed system", "php", "material ui", "docker swarm", "mysql", "gke", "jquery", "google map"], "fulltext": "Le Van Khai \nFull-stack Web Developer \nPERSONAL INFORMATION\nYear of Birth: 1994 \nGithub: github.com/khaile \nOVERALL ASSESSMENT\nI am a full-stack web developer with 3 years of experience. I have done everything from the most \nbasic refactoring to set up and deploy web apps to production. And have experience in building \nRESTful APIs with Rails, implementing modern web UI with React. Also, I am interested in \nwriting clean and beautiful code. \nE DUCATION  H ISTORY\n2012 \u2013 2015 \nFPT Polytechnic Colleges \nDiploma in Computer Programming \nS KILLS\n\u2022\nTechnical Skills:\no\nHave 3 years of experience Ruby on Rails framework\no\nHave experience in TBD with RSpec\no\nHave experience in front-end stack like React, Redux, React-Redux, Redux-Saga, and UI frameworks\nlike Bootstrap, Material-UI\no\nHave knowledge of relational and NoSQL databases: MySQL, PostgreSQL, Redis\no\nHave experience in DevOps skills: Docker, Docker-Compose, Kubernetes, AWS EC2, GCP GKE\no\nHave experience in designing multilingual applications\no\nHave experience in manage microservice with Kong API gateway\no\nStrong git workflow, GitHub Pull Request, GitLab Merge Request and CI\no\nFamiliar with Refactoring and Continuous Integration\no\nFamiliar with Agile process\n\u2022\nSoft Skills:\no\nSelf-awareness tasks priority.\no\nCan-do attitude.\no\nSelf-manage tasks.\no\nAbility to work independently or on a team.\no\nStrong written and verbal communication in English.\nWORKING HISTORY \nJul 2018 \u2013 present \nSkyLab Innogram - Full-stack Web Developer  \nNov 2016 \u2013 Jun 2018 \nNUS Technology - Full-stack Ruby on Rails Developer  \nJul 2015 \u2013 Oct 2016 \nTranscosmos Technologies - Junior Software Engineer \nPROFESSIONAL EXPERIENCE \nJul 2018 \u2013 present \nFull-stack Web  Developer - SkyLab Innogram \nProject #2: DLC (Data Logistics Cloud) \nAn end to end ecosystem driving synergies and network effects through improved Security, Latency and \nScalability, across multi-generations of control systems over a large-scale network. \nRole: Developer \nTeam size: 1 product manager, 1 team leader, 3 developers \nDuties: \no \nDeveloped a Docker image Security Check feature used to evaluate the vulnerabilities of a \nDocker image before it will be pushed to production registry. \no \nDeveloped an ACL feature used to grant permissions for each user/user group to perform some \nactions on a device. \no \nDeveloped a deployment feature which allows the user to deploy an application from a private \ncontainer registry to a selected worker node on Kubernetes cluster. \no \nDeveloped some grouping features like Device Group which allows the user to group all related \ndevices together. Also, SLA Group which allows setting the time range and total messages to be \nsent per hour that tied to devices. \nTechnologies used: \n- \nLanguages: Ruby, JavaScript \n- \nFramework: Ruby on Rails \n- \nDatabase: MySQL, Redis \n- \nFront-end stack: React, Redux, React-Redux, Redux-Saga, Material-UI \n- \nDeployment: Docker Swarm \n- \nBackground job: Sidekiq \n- \nSource control: Git \nProject #3: SolarPVX \nThis is a monitoring portal, the aim of this portal is allowing solar leasing companies and owners of solar \nPV systems to monitor remotely the energy and power production of their solar plants. This platform \nfunctions as a business intelligence tool, by allowing users to conduct an in-depth analysis of the \nperformance of solar plants and compare the production of their solar plants. \nRole: Developer \nTeam size: 1 product manager, 2 developers \nDuties: \no \nDeveloped a reporting dashboard where to track and monitor the energy generated data for each \nunit like meter. \no \nDevelop an alarm rule feature which allows the monitoring assistant to create a specific rule to \ncompare the generated data in a period of time to send an alert email when the comparison has \nmatched the rule. \nTechnologies used: \n- \nLanguages: Ruby, JavaScript \n- \nFramework: Ruby on Rails \n- \nFront-end stack: C3JS \n- \nDatabase: MySQL, Redis \n- \nDeployment: Docker Swarm \n- \nBackground job: Sidekiq \n- \nSource control: Git \nNov 2016 \u2013 Jun 2018 \nFull-stack Ruby on Rails Developer - NUS Technology \nProject #1: Welligence.com \nThis project is an independent oil and gas analytics firm focused on the Latin America upstream sector. \nTheir application of machine learning to proprietary exploration and production data represents a paradigm \nshift within upstream analytics. \nRole: Key Developer \nTeam size: 1 project manager, 1 developer \nDuties: \no \nSetting up EC2 instances as a distributed system to parallelize run analytics code. \no \nUsing Google Maps API to create a map to represent field, block, and well view as point or \npolygon. Also, apply clustering to make the map much friendlier. \no \nWriting a bunch of scripts to scrape petroleum historical data from countries in Latin America \nwhich are datasets for Data Scientist to predict oil and gas reserves in future. \no \nIntegrate Microsoft Graph API and RubyXL library to writing a script that generate an asset report \ndynamically for clients to download. \nTechnologies used: \n- \nLanguages: Ruby, JavaScript \n- \nFramework: Ruby on Rails \n- \nDatabase: PostgreSQL, Redis \n- \nHosting: Amazon EC2 and Amazon S3 \n- \nWeb server: Nginx \n- \nApplication server: Puma \n- \nFront-end stack: jQuery, Bootstrap, Handsontable, ChartJS \n- \nDeployment: Capistrano \n- \nBackground job: Sidekiq \n- \nMonitoring: NewRelic\n- \nThird-party APIs: Microsoft Graph API, Google Maps API \n- \nSource control: Git \nProject #2: Plantribe.io \nThis project is a marketplace to help architects, home designers, builders, and industry \nprofessionals to selling their house plan. \nRole: Developer \nTeam size: 1 project manager, 1 business analyst, 1 quality control, 4 developers \nDuties: \no \nDeveloped a storefront for the architects and home designers where they can post \ntheir design which has done before to show to customers. \no \nIntegrated the Stripe API to develop a payment and a subscription module for a \nmarketplace web app. \nTechnologies used: \n- Languages: Ruby, JavaScript \n- Framework: Ruby on Rails + Sharetribe \n- Database: MySQL \n- Hosting: Heroku \n- Image hosting: Amazon S3 \n- Front-end stack: jQuery, Bootstrap \n- Deployment: Mina \n- Third-party APIs: Stripe API \n- Source control: Git \nJul 2015 \u2013 Oct 2016 \nJunior Software Engineer - Transcosmos Technologies \nProject #1: Company\u2019s Redmine \nDeveloping a Redmine chart plugin for the company\u2019s external used only. \nTechnologies used: \n- \nLanguages: Ruby, JavaScript \n- \nFramework: Ruby on Rails \n- \nDatabase: MySQL \nProject #2: Company\u2019s Portal \nCustomizing the Joomla framework to create a payment and a timesheet module for the \ncompany\u2019s portal. \nTechnologies used: \n- \nLanguages: PHP, JavaScript \n- \nFramework: Joomla \n- \nDatabase: MySQL ", "educations": [{"id": 5493, "gpa": null, "major": "K\u1ef9 thu\u1eadt m\u00e1y t\u00ednh", "school": "FPT Polytechnic Colleges", "diploma": "Colleges", "end_time": "2015-01-01T00:00:00Z", "conf_score": 0.9151367454834639, "start_time": "2012-01-01T00:00:00Z", "picklist_major": "IT - Hardware/Networking", "major_categories": "M\u00e1y t\u00ednh v\u00e0 c\u00f4ng ngh\u1ec7 th\u00f4ng tin", "major_categories_detail": "M\u00e1y t\u00ednh"}], "experiences": [{"id": 18360, "detail": "", "company": "SkyLab Innogram", "end_time": "2023-04-13T00:00:00Z", "industry": "Other", "position": "Full - stack Web Developer", "conf_score": 0.7551834254203837, "start_time": "2018-07-01T00:00:00Z"}, {"id": 18361, "detail": "", "company": "NUS Technology", "end_time": "2018-06-30T00:00:00Z", "industry": "High Technology", "position": "Ruby on Rails Developer", "conf_score": 0.7968341985623422, "start_time": "2016-11-01T00:00:00Z"}, {"id": 18362, "detail": "", "company": "Transcosmos Technologies", "end_time": "2016-10-31T00:00:00Z", "industry": "High Technology", "position": "Junior Software Engineer", "conf_score": 0.9162385206282713, "start_time": "2015-07-01T00:00:00Z"}], "address": null}