{"skills": ["linux", "aws", "docker", "payment", "java", "marketing", "payment management", "c++", "javascript", "graphql", "wi fi", "cloud", "c#", "cloud service", "mongodb", "management", "uml diagram", "studio", "heroku", "sequence diagram", "object oriented", "git", "html5", "analysis", "typescript", "android", "trello", "wifi", "mobx", "class diagram", "website development", "css", "restful", "oop", "visual studio", "software development", "bug fixing", "language modeling", "reactjs", "uml", "system design", "database", "class", "apollo", "game development", "nestjs", "software development methodology", "activity diagram", "angularjs", "agile", "mysql", "query language"], "fulltext": "L\u00ea Xu\u00e2n Nam\nTP.HCM, Vietnam\n University Of Information Technology\nAug 2012 - Jan 2017\nEDUCATION\nMajor: Software Engineer\nMinor: Web developer, Android developer\nGPA: 6.59/10\nMegaNet\nJan 2018 - Now\nStartup\nJan 2017 - Jan 2018\nUniversity Of Information Technology\nAug 2012 - Jan 2017\nWORK EXPERIENCE\nFull-time\nAnalysis of system design with team and use UML summarize the details of MegaNet system's users\nUse scrum management method\nLeader project MegaNet Internal Management Software:Analysis system and task division for team members\nDesign UI and UX\nLearn and training technology for teams\nCode features for MegaNet Internal Management Software and ADS Platform\nReview Code and Fix Bug\nMerge Code of other members in the team\nPart-time\nSystem design analysis with team\nDesign UI and UX\nCode some features of order food app: book, payment, management menu\nReview Code and Fix Bug\nLearn\nComplete the school subjects\nLearn the skills needed for programming: \n-Analysis of system design, use UML diagram draw : Class Diagram, Object Diagram, Use Cases\nDiagram, Sequence Diagram, Activity Diagram\n-OOP\n-Mobile programming\n-Programming game\nUniversity Of Information Technology\nJan 2013 - Feb 2015\nACTIVITIES\nMember of academic training club UIT\n-Trainning C++, OOP\n-Volunteer for Blood Donation Organizations\nFront-end\nLanguages/Frameworks\nReactjs, Angularjs, Mobx, HTML5, CSS,  Javascript,Typescript\nBack-end\nLanguages/Frameworks\nNodeJS, LoopBack, NestJS\nCloud service\nAWS, Heroku\nSKILLS\nDatabase\nMySQL, MongoDB\nAPIs/Query Language/Platforms\nRESTful, Graphql, Apollo, Linux\nModeling Language\nUML\nProgramming Methodologies\nObject-oriented Programming, Functional Programming\nSoftware Development\nMethodologies\nAgile, Scrum\nSoftwareDevelopment tools\nGit, Trello, Visual Code, Visual Studio, Android Studio\nLanguage English\nPROJECTS\nMegaNet: ADS Platform\n(2019 - Now)\nCustomer MegaNet\nDescription\n- This is the app can give wi-fi marketing solutions with features: run ads of\ncustomers at site have equipment was provided by MegaNet, Report click and\nimpression for customers.\n- The system is a platform providing advertising solutions for customers wishing to\nadvertise on their wi-fi device with MegaPlus\n- Customer can book advertising\n- Portal can device management and WiFi configuration\nTeam size\n5\nMy position\nDeveloper\nMy responsibilities\n- Analysis and design\n- Development\n- Review code\n- Optimize code\n- Bug Fixing\nTechnologies used\n- AngularJS, MongoDB, RESTful API,  Loopback, HTLM5, CSS\n- Visual Code, Git, Trello\n- Software Development Methodologies: Scrum\n- Docker\nMegaNet: MegaNet Internal Management Software\n(2018 - 2019)\nCustomer MegaNet\nDescription\n- This is the app with management features :  employee, equipment, site, inventory,\nreport\nTeam size\n4\nMy position\nDeveloper\nMy responsibilities\n- Leader\n- Analysis and design\n- Development\n- Review code\n- Optimize code\n- Bug Fixing\nTechnologies used\n-  ReactJS, MongoDB, Graphql, Apollo, NestJS, NodeJS, HTLM5, CSS\n- Visual Code, Git, Trello\n- Software Development Methodologies: Scrum\nStarup:App Order Food\n(2017 - 2018)\nCustomer Startup\nDescription\n- This is the app can book the table, order food, and management system:  menu,\npayment, service, employee.\nTeam size\n4\nMy position\nDeveloper\nMy responsibilities\n- Analysis and design\n- Development\n- Review code\n- Optimize code\n- Bug Fixing\nTechnologies used\n-  Java\n- Android Studio, Git, Trello\nUIT Projects: Restaurant manager, Air ticket management, Order Food, Game Contra, Image\nManagement\n(2012 - 2017)\nCustomer\nUniversity Of Information Technology\nDescription\n- This is the project in my school\nTeam size\n2-3\nMy position\nDeveloper\nMy responsibilities\n- Analysis and design\n- Development\n- Review code\n- Optimize code\n- Bug Fixing\nTechnologies used\n-  C#, C++, Java\n- Android Studio , Visual Studio, Git, Trello", "educations": [{"id": 5494, "gpa": "6.59", "major": "Software Engineer\nMinor: Web developer, Android developer", "school": "University Of Information Technology", "diploma": "Bachelors", "end_time": "2017-01-01T00:00:00Z", "conf_score": 0.8116617718100324, "start_time": "2012-08-01T00:00:00Z", "picklist_major": "Other", "major_categories": "", "major_categories_detail": ""}], "experiences": [{"id": 18363, "detail": "Full-time Analysis of system design with team and use UML summarize the details of MegaNet system's users\nUse scrum management method\nLeader project MegaNet Internal Management Software:Analysis system and task division for team members\nDesign UI and UX Learn and training technology for teams\nCode features for MegaNet Internal Management Software and ADS Platform Review Code and Fix Bug Merge Code of other members in the team", "company": "MegaNet", "end_time": "2023-04-13T00:00:00Z", "industry": "Other", "position": null, "conf_score": 0.8086621310791741, "start_time": "2018-01-01T00:00:00Z"}, {"id": 18364, "detail": "Part-time System design analysis with team\nDesign UI and UX Code some features of order food app: book, payment, management menu\nReview Code and Fix Bug", "company": "Startup", "end_time": "2018-01-31T00:00:00Z", "industry": "Other", "position": null, "conf_score": 0.8086621310791741, "start_time": "2017-01-01T00:00:00Z"}], "address": "Tp.hcm, Vietnam"}