{"skills": ["linux", "stack", "unix", "aws", "docker", "payment", "wordpress", "json", "development testing", "adobe dreamweaver", "javascript", "scripting language", "implementation", "apache", "cloud", "futures", "ams", "ftp", "window xp", "xml", "management", "excel", "search engine", "cpanel", "enterprise", "cakephp", "object oriented", "jquery", "basecamp", "bigcommerce", "svn", "analysis", "project management", "mvc architecture", "ajax", "operating system", "search", "asp", "linux system", "website development", "scripting", "restful", "css", "integration testing", "linux operating system", "jira", "search engine optimization", "github", "software development", "testing", "mvc", "microsoft", "laravel", "woocommerce", "oracle", "magento", "sdlc", "sqlyog", "full stack development", "bitbucket", "php", "agile", "mysql", "html", "google map"], "fulltext": "Tejas Soni \nWeb Developer with 9+ years of Experience \nEmail   : tejas.soni2@gmail.com \nCareer Objective \nI am having 9+ years of Information Technology experience. all of his experience are relevant in object-\noriented, web based applications software design and software development using PHP and I am a diligent \nhard worker who always tries to add value to every project I am involved in. \nMajor Strengths: \n\uf0b7 \nOver 9+ Years of experience in Web Development including Analysis, Design, Development, Testing  and  \nImplementation using PHP and other hosted solutions Technologies. \n\uf0b7 \nMy main area of experience has been application design, application development, unit & integration  \ntesting, production support & enhancement of various size projects. \n\uf0b7 \nExpertise in  programming skills and development experience of multi-tier web applications, enterprise  \nApplications in languages/technologies like PHP, Codeigniter, CakePHP, Laravel, Magento, WordPress,          \nDrupal, Shopify, Volusion, 3dcart, Web services, RestFul APIs that ensures clear separation of layers \nand rapid application development. \n\uf0b7 \nExtensive experience in developing web application using Codeigniter, Laravel, CakePHP Framework,  \nModel View Controller (MVC) Architecture. \n\uf0b7 \nDeveloping Front-End using HTML, XML, CSS, jQuery, JSON, XML, JavaScript, AJAX. \n\uf0b7 \nExperience in Service Oriented Applications using RESTFUL. \n\uf0b7 \nExperience with Version control systems such as SVN and GitHub. \n\uf0b7 \nExperience in preparing project related documents using Microsoft Office Suite like MS-Office, MS-Excel,  \nMS-PowerPoint and etc.  \n\uf0b7 \nExperience in Windows XP/ Vista, Windows7, Unix \n\uf0b7 \nIntegration with Paypal, Google Map and Facebook using API. \n\uf0b7 \nExperience with Search Engine Optimization (SEO). \n\uf0b7 \nDetails knowledge of cron jobs, high traffic website performance tuning. \n\uf0b7 \nI have worked on many projects on eCommerce like Shopify, Volusion, Magento, 3dcart, Drupal, \nWoocommerce. I have shared very few over here. \nEducation \nMasters in Computer Application [ M.C.A ], Gujarat University, Ahmedabad, India, May 2009 \nBachelors in Commerce [ B.Com. ], Gujarat University, Ahmadabad, India, May 2005 \nTejas Soni \nPage 1 of 4 \nTechnical Summary \nProgramming \nPHP, ASP Classic. \nlanguages \nShopify, Magento, Drupal, WordPress, WooCommerce, Joomla, Volusion, 3dcart, \nTechnologies \nBigCommerce. \nFrameworks \nCodeigniter, Laravel, CakePHP, Smarty  \nScripting Languages  \nHTML, CSS, Ajax, JavaScript, JQuery, XML, Restful Web services, Facebook API \nDatabases \nOracle, MySQL, Web Servers (Apache) \nOperating Systems \nLinux, Windows \nIDE/ Building Tools \nEclipse, Adobe Dreamweaver, SQLyog, Notepad++ \nSource Control \nSVN, GitHub, BitBucket, FTP, Putty, Magento Cloud, Docker \nProject Management \nBaseCamp, Jira  \nSoftware Engineering \nMethod \nAgile, SDLC, Water-flow \nDocumentation \nMS-Office , Open-Office \nPayment Method \nPaypal, Authorize.Net, Stripe \nDeployment \nAWS, WHM, cPanel, Digital Ocean \nProfessional Experience \n\uf0fc Working as Full Stack Developer at Ahmedabad from June 2014 to Current. \nJob Type: Full Time Freelancer \n\uf0fc Worked as Developer / Team Leader at SigmaSolve LLC, Ahmedabad from Jan 2011 to May 2014. \nJob Type: Permanent/Full Time \n\uf0fc Worked as Web Developer at Versatile Infosys, Ahmedabad from Jan 2010 to Dec 2010. \nJob Type: Permanent/Full Time \n\uf0fc Worked as Web Developer at Attune Infocom, Ahmedabad from March 2009 to Dec 2009. \nJob Type: Permanent/ Full Time \nTejas Soni \nPage 2 of 4 \nProject Experience \nShopify CMS based Projects \nExit Warehouse \nProject description: eCommerce site \nRole:  Web Developer, Setup complete store, Template from scratch, Liquid and jQuery code customization, app \ninstallation and customization, Migrate store from Miva Merchant. \nTechnologies: Shopify Liquid, Shopify App \nHand Dryers And More \nProject description: eCommerce site \nRole:  Web Developer, Setup complete store, Template from scratch, Liquid and jQuery code customization, app \ninstallation and customization.  \nTechnologies: Shopify Liquid, Shopify App \nCircuit Breaker Wholesale \nProject description: eCommerce site \nRole:  Web Developer. Setup complete store, Template from scratch, Liquid and jQuery code customization, 50K plus \nupload uploads, custom blog code, app installation and customization. \nTechnologies: Shopify Liquid \nMagento CMS based Projects  \nStarlight  \nProject description: This is eCommerce site. I have setup entire site from start to end including design, custom \ncoding, products setup, backend setup, payment/shipping setup, Migration from magento 1.9 to Magento 2.3.1 \nRole:  Web  Developer/Designer \nTechnologies: Magento 2.3.1, PHP, MySQL, Apache \nNewsPower \nProject description: This is eCommerce site. I have setup entire site from start to end including design, custom \ncoding, products setup, backend setup, payment/shipping setup, created module for selling books per students. \nRole:  Web Developer/Designer \nTechnologies: Magento 2.x, PHP 7, MySQL, Apache \nCodeigniter CMS based Projects \nArt Galaxie \nProject description: This is a big site related to artist. There are many backend functionality as well as front \ndevelopment. \nRole:  Web Developer/Designer \nTechnologies: Codeigniter, PHP, MySQL, Apache \nTejas Soni \nPage 3 of 4 \nCakePHP CMS based Projects \nMorningCME \nProject description: This project is related to hostpital and other accreditor user. It also uses video API. \nRole:  Web Developer \nTechnologies: CakePHP, PHP, MySQL, Apache \nWordPress CMS based Projects \nGenucel \nProject description: Created many eCommerce projects using woocommerce. There are lots of projects in \nwoocommerce I have completed. I have created theme from scratch and done code customization. Then start to end \nsetup. \nRole:  Web Developer \nTechnologies: WordPress, WooCommerce, PHP, MySQL, Apache \nDesired Baby \nProject description: Created informative site as well as predict baby future with payment. There are lots of projects \nin woocommerce I have completed. I have created theme from scratch and done code customization. \nRole:  Web Developer \nTechnologies: WordPress, PHP, MySQL, Apache \nDrupal CMS based Projects \nMistral Classics \nProject description: Informative site, Ubercart \nRole:  Web  Developer \nTechnologies: Drupal8, PHP, MySQL, Apache \nVolusion CMS based Projects \nXtremek \nProject description: eCommerce site \nRole:  Web  Developer \nTechnologies: Volusion, ASP And API \n3dcart CMS based Projects \nWholesale Knives \nProject description: eCommerce site \nRole:  Web  Developer \nTechnologies: 3dcart, ASP \nTejas Soni \nPage 4 of 4 ", "educations": [{"id": 5519, "gpa": null, "major": "Commerce", "school": "Gujarat University", "diploma": "Other", "end_time": "2005-05-01T00:00:00Z", "conf_score": 0.8143796794362937, "start_time": null, "picklist_major": "Other", "major_categories": "", "major_categories_detail": ""}, {"id": 5518, "gpa": null, "major": "Quan h\u1ec7 c\u00f4ng ch\u00fang", "school": "Gujarat University", "diploma": "Bachelors", "end_time": "2009-05-01T00:00:00Z", "conf_score": 0.765625693723132, "start_time": null, "picklist_major": "Advertising/Promotion/PR", "major_categories": "B\u00e1o ch\u00ed v\u00e0 th\u00f4ng tin", "major_categories_detail": "B\u00e1o ch\u00ed v\u00e0 truy\u1ec1n th\u00f4ng"}], "experiences": [{"id": 18440, "detail": ". Job Type: Full Time Freelancer", "company": "Ahmedabad", "end_time": "2023-04-13T00:00:00Z", "industry": "Other", "position": "Full Stack Developer", "conf_score": 0.8220891600515511, "start_time": "2014-06-01T00:00:00Z"}, {"id": 18441, "detail": "", "company": "SigmaSolve LLC", "end_time": "2014-05-31T00:00:00Z", "industry": "Other", "position": "Developer / Team Leader", "conf_score": 0.9299204431562893, "start_time": "2011-01-01T00:00:00Z"}, {"id": 18442, "detail": "", "company": "Versatile Infosys", "end_time": "2010-12-31T00:00:00Z", "industry": "Other", "position": "Web Developer", "conf_score": 0.9162385206282713, "start_time": "2010-01-01T00:00:00Z"}, {"id": 18443, "detail": "Job Type: Permanent/ Full Time", "company": "Attune Infocom", "end_time": "2009-12-31T00:00:00Z", "industry": "Other", "position": "Web Developer", "conf_score": 0.9162385206282713, "start_time": "2009-03-01T00:00:00Z"}], "address": null}