{"skills": ["angular", "phpunit", "operation system", "docker", "computer vision", "sales", "machine learning", "ubuntu", "etl", "redis", "design thinking", "rabbitmq", "search", "data communication", "algorithm", "centos", "design pattern", "data handling", "uml", "communication skill", "database", "magento", "memcached", "jenkins", "csv", "angularjs", "php", "agile", "mysql", "jquery"], "fulltext": "CURRICULUM VITAE \nFull name:             Ly Minh Tri \nGender:                 Male \nDate of birth:        January 6, 1992 \nNationality:           Viet Nam \nEmail:                    lmtkg1992@gmail.com \nPhone:                   (+84)0327942863 \nAddress:                01 Phu Hoa Street, Tan Binh District, HCMC \nUniversity:            Bach Khoa University ( BKU) \nEnglish:                 Read and write fluently, intermediate communication skill. \nEXPERIENCE:  \n\u25aa  5 years+ experience PHP Programming.   \n\u25aa  Framework: Magento 1, Magento 2, Phpfox, AngularJS \n\u25aa  Software: MySQL, RabbitMQ ,Redis, Memcached, Solr Search, Jenkins, \nDocker. \n\u25aa  Ability : Strong background in algorithm, logic thinking, design pattern. \n\u25aa  Other skills : Coding Review, Refactoring Exist Code, PHPUnit Test, UML \nDesign, Agile Methodology. \n\u25aa  Research: Machine Learning and Computer Vision. \n\u25aa  OS: Ubuntu, Centos. \nI have finished so many projects in a variety of subject.  I\u2019m always eager to learn new \nthings ,willing to confess my mistake and do my best to improve what I did.  \nI would love to work in a young, professional environment. My goal is to become a \ngood engineer with strategic vision and innovative solutions. \nWORKS: HIGHLIGHT PROJECTS \n  Working in University \nThesis: Bus Finder Map Website \nProject description:        Bus Finder Map website is a website that help user can \nsearch routes for bus by keyword location in HCM city.  \nThe map shows street, name location and gives many \nsolutions so user can select proper routes for them.  \nTeam size:                      2 \nSkills:                              CodeIgniter framework,  KineticJS, MySQL. \nResponsibilities:              - Develop a part of core structural database and system. \n- Implement main task. \n         - Tutor and assign task to member. \n. \nWorking in YouNet         March 2014 \u2013 October 2015 \nProject: Business Directory \nProject description:         Business Directory provides Yelp-like features for niche \nsocial network. Members can create a business or claim a \nbusiness created by other members. \nRoles:                             Developer. \nTeam size:                      2 \nSkills:                             PHPFOX, JQuery, Smarty. \n  Responsibilities:             Implement main task. \nProject: Auction \nProject description:        Auction is an Ebay-like module which allows members on \nyour community to put up items for sale and have other \nusers place bids to win, or make offer, buy now to directly \nbuy the items \nRoles:                             Developer. \nTeam size:                      2 \nSkills:                             PHPFOX, JQuery, Smarty. \n  Responsibilities:             Implement main task. \nWorking in Bluecom         October 2015 - November 2017 \nProject: Lapp Japan \nProject description:        Lapp Japan is eCommerce site selling products in field of \ncable and connectivity. \nRoles:                             Developer. \nTeam size:                      3 \nSkills:                             Magento 1, Prototype js, MySQL. \n  Responsibilities:            - Implement main function. \n       - Develop, integrate calculation shipping fee system by SOAP \nservice. \n       - Extract and migrate over 20000 products from CSV file. \nProject: All World Shop Shop \nProject description:        All World Shop Shop  is multiple site-ecommerce in \nmulti-country selling various product based on Framework \nMagento 1 \nRoles:                             Developer. \nTeam size:                      3 \nSkills:                             Magento1, Prototype js, MySQL, SOAP. \nResponsibilities:             - Implement main function. \n       - Extract ,transform and migrate (ETL) product data from 3 \nsites Drupal Ecommerce and 6 site Oscommerce into Magento 1 \nsystem. \nProject: Riki Ecommerce \nProject description:        Riki Ecommerce  is big site-ecommerce selling \nfood,drinking for Nestle Corporation based on Framework \nMagento 2. \nTeam size:                      18 \nRoles:                             Senior Developer. \nSkills:                             Magento2, Knockout JS, MySQL, RabbitMQ, SOAP. \nResponsibilities:           - Implement main function for subscription product system. \n-\nImplement customer system for synchronous data from \nother system via SOAP service. \n-\nImplement and improve for shipping function \n      -\nImplement function exporting file for BI System \n      -\nImplement message queue system for handling \nasynchronous data \n      -\nImplement multi-process for handling data in parallel for \nbetter performance. \nWorking in Lotte Data Communication Company     November 2017 - Present \nProject:  Lotte E-commerce \nProject description:        Lotte E-commerce is project for Lotte.vn that is member of \nLotte Corporation. Lotte.vn provides e-commerce services \nin VietNam. \nTeam size:                      20 \nRoles:                             Senior Developer. \nSkills:                             Magento2, Angular JS, MySQL, RabbitMQ. \nResponsibilities:           - Maintain , monitor and keep stable system. \n-\nDevelop new feature, take in charge in checkout-order \nsystem, shipping system, operation system. \n-\nOptimize and refactor code. \nEducation: \nUniversity: University of Technology Ho Chi Minh City \nDegree : Bachelor of Engineering. \nMajor: Computer Science.  \nGPA: 7.4 \n Hobbies : Playing games, do exercise, reading books. ", "educations": [{"id": 5527, "gpa": null, "major": null, "school": "Bach Khoa University ( BKU)", "diploma": "Bachelors", "end_time": null, "conf_score": 0.786029430240466, "start_time": null, "picklist_major": "Other", "major_categories": "", "major_categories_detail": ""}, {"id": 5528, "gpa": "7.4", "major": "Khoa h\u1ecdc m\u00e1y t\u00ednh", "school": "University of Technology Ho Chi Minh City", "diploma": "Bachelors", "end_time": null, "conf_score": 0.7989045198754983, "start_time": null, "picklist_major": "IT - Hardware/Networking", "major_categories": "M\u00e1y t\u00ednh v\u00e0 c\u00f4ng ngh\u1ec7 th\u00f4ng tin", "major_categories_detail": "M\u00e1y t\u00ednh"}], "experiences": [{"id": 18470, "detail": "ommunication Company November 2017 - Present Project: Lotte E-commerce Project description: Lotte E-commerce is project for Lotte.vn that is member of\nLotte", "company": "Riki Ecommerce", "end_time": "2023-04-13T00:00:00Z", "industry": "Trade", "position": "Senior Developer", "conf_score": 0.8364998206801405, "start_time": "2017-11-01T00:00:00Z"}, {"id": 18471, "detail": "Working in Bluecom October 2015 - November 2017 Project: Lapp Japan Project description: Lapp Japan is eCommerce site selling products in field of cable and connectivity.\nRoles: Developer. Team size: 3 Skills: Magento 1, Prototype", "company": "Bluecom", "end_time": "2017-11-30T00:00:00Z", "industry": "Other", "position": "Developer", "conf_score": 0.8388609013064433, "start_time": "2015-10-01T00:00:00Z"}, {"id": 18472, "detail": "Finder Map Website Project description: Bus Finder Map website is a website that help user can search routes for bus by keyword location in HCM city.\nThe map shows street, name location and gives many solutions so user can select proper routes for them.\nTeam size: 2 Skills: CodeIgniter framework, KineticJS, MySQL. Responsibilities: - Develop a part of core structural database and system.\n- Implement main task.\n- Tutor and assign task to member.\n. Working in", "company": "YouNet", "end_time": "2015-10-31T00:00:00Z", "industry": "Other", "position": "Bus", "conf_score": 0.865193996305421, "start_time": "2014-03-01T00:00:00Z"}], "address": "01 Phu Hoa Street, Tan Binh District, Hcmc"}