{"skills": ["css", "ant design", "c++", "dom", "rtos", "python", "ant", "mongoose", "html", "reactjs", "css3", "ubuntu", "redux", "io", "jquery", "class", "c#", "html5", "responsive", "embedded c", "javascript", "oop", "sc", "pwa", "bootstrap", "docker", "jwt", "frontend development", "switch", "socket io", "mongodb", "vuejs", "restful", "proxy"], "fulltext": "Nguy\u1ec5n \u0110\u1ee9c L\u01b0\u01a1ng Ph\u00e1t\nREACTJS DEVELOPER\n\uf040 Summary\n- Looking for more opportunities in Frontend developer\n- Self - study and ability to look for information quickly \n- Problem \u2013 solving skills and ability to work under high pressure\n- Ability to work with system, server, mobile\n- All my time for developing\n\uf0eb Education\nHCM UNIVERSITY OF TECHNOLOGY\n2013 - 2018\nMajor: Mechantronic Engineering\nGPA: 8.08/10\n\uf073 29/01/1995\n\uf007 Male\n\uf095 0378306893\n\uf199 nguyenducluongphat7049@g\nmail.com\nHo Chi Minh, Vietnam\n\uf0c0Work Experience\nSTYL SOLUTIONS\n12/2017 - 3/2019\nEmbedded\nC/C++/C#/Python(Free RTOS, Script, App)\nHTML5/CSS3/Javascript Developer - ReactJs\n- Building Back Office for manage account (Token), build, monitor and simulation sensor 3D...\n- Building templates using Webpack or create-react-app, configuration runtime for\ndevelop/production environments,\n- Reactjs for developing single page application\n- HTML5/CSS3 ( style, animation...)/React/Redux for developing UI from PSD.\nFPT TELECOM\n4/2019 - NOW\nHTML5/CSS3/Javascript Developer - Vuejs\n- Voice Detector (web speech api) on web (chrome, firefox..), on smart tivi (samsung)\n- Experience in using Javascript/Jquery to build library\n- HTML5/CSS3 ( style, animation...) for developing UI from PSD (fptplay's project).\n- Vuejs for developing single page application\n- for developing library applied on web, smart tivi.\n- Build javascript/jquery library base on attribute, event (trigger, on), dom element for interact\nwith application as: notification, preview-thumbnails, scroll, switch control library.\n- Build Vuejs component for reuse\n- Developing decorator and OOP in javascript(proxy, prototype, function, class)\n- Using XmlHttpRequest for catching the request\n- Nodejs (Buffer, Stream, EventEmitter, Restful, Crawl...)\nCERTIFICATIONS\n05/01/2019 - 02/03/2019\n- Certification of ReactJS at Nordic Coder\nSKILL\n+ HTML5/CSS3 (cross browser / responsive), SCSS/CSS, Adobe XD, Bootstrap, Socket IO,\nReact-Bootstrap, Ant Design \n+ Javascript(Proxy, prototype...), Jquery(animate, class, attribute, query dom, trigger...),\nReactjs (context, redux, lazy Loading, middleware...), Redux (logger, thunk ...), Vuejs (mixins,\ndirectives...), NodeJS (ExpressJS, JWT, CRUD, sort, paginate..), MongoDB (Mongoose),\nWebpack (alias, chunk...), Restful, PWA, Voice Detector on web\n+ Docker, Vagrant, Ubuntu, Window\n\uf041\nSKILLS\nJavascript\nJquery\nReactJS\nVueJS\nHTML/CSS3\nNodeJS\nLogical thinking and creative\nSketch\n\u00a9 topcv.vn", "educations": [{"id": 5551, "gpa": "8.08", "major": "C\u00f4ng ngh\u1ec7 k\u1ef9 thu\u1eadt c\u01a1 kh\u00ed", "school": "HCM UNIVERSITY OF TECHNOLOGY", "diploma": "Bachelors", "end_time": "2018-01-01T00:00:00Z", "conf_score": 0.8413267261986577, "start_time": "2013-01-01T00:00:00Z", "picklist_major": "Technical", "major_categories": "C\u00f4ng ngh\u1ec7 k\u1ef9 thu\u1eadt", "major_categories_detail": "C\u00f4ng ngh\u1ec7 k\u1ef9 thu\u1eadt c\u01a1 kh\u00ed"}], "experiences": [{"id": 18534, "detail": "- Voice Detector (web speech api) on web (chrome, firefox..), on smart tivi (samsung)\n- Experience in using Javascript/Jquery to build library\n- HTML5/CSS3 ( style, animation...) for developing UI from PSD (fptplay's project).\n- Vuejs for developing single page application\n- for developing library applied on web, smart tivi.\n- Build javascript/jquery library base on attribute, event (trigger, on), dom element for interact with application as: notification, preview-thumbnails, scroll, switch control library.\n- Build Vuejs component for reuse\n- Developing decorator and OOP in javascript(proxy, prototype, function, class)\n- Using XmlHttpRequest for catching the request\n- Nodejs (Buffer, Stream, EventEmitter, Restful, Crawl...)", "company": "FPT TELECOM", "end_time": "2023-04-13T00:00:00Z", "industry": "High Technology", "position": "HTML5/CSS3/Javascript Developer - Vuejs", "conf_score": 0.905449349642689, "start_time": "2019-04-01T00:00:00Z"}, {"id": 18535, "detail": "- Building Back Office for manage account (Token), build, monitor and simulation sensor 3D... - Building templates using Webpack or create-react-app, configuration runtime for develop/production environments,\n- Reactjs for developing single page application\n- HTML5/CSS3 ( style, animation...)/React/Redux for developing UI from PSD.", "company": "STYL SOLUTIONS", "end_time": "2019-03-31T00:00:00Z", "industry": "High Technology", "position": "HTML5/CSS3/Javascript Developer - ReactJs", "conf_score": 0.8760915295747093, "start_time": "2017-12-01T00:00:00Z"}], "address": "Ho Chi Minh, Vietnam"}