{"skills": ["strut", "internet", "css3", "docker", "tomcat", "java", "groovy", "oauth2", "javascript", "apache solr", "implementation", "apache", "jdbc", "c#", "oracle development", "xml", "management", "studio", "banking", "security", "spring boot", "enterprise", "git", "finance", "svn", "html5", "analysis", "project management", "html", "spring", "ajax", "operating system", "spring mvc", "configuration management tool", "spring security", "maintenance", "management tool", "recruitment", "sql", "css", "restful", "oop", "configuration management", "jira", "php", "visual studio", "css framework", "mvc", "reactjs", "oracle", "jsp", "hibernate", "information system development", "bootstrap", "mysql", "jquery"], "fulltext": "1\nTR\u1ea6N ANH S\u01a0N\nPERSONAL PARTICULARS\n\uf0b7\nName\nTr\u1ea7n AnhS\u01a1n\n\uf0b7 Designation Developer\n\uf0b7 Gender Male\n\uf0b7 Citizenship Vietnamese\n\uf0b7\nCountry of Residence\nVietNam\n\uf0b7 Phone 0918218691\n\uf0b7 Email sontrananhmta@gmail.com\n\uf0b7\nExpected Salary                          28.000.000 vnd\nLANGUAGES\n\uf0b7 Vietnamese Mothertongue\n\uf0b7 English Good\nEDUCATION\nPeriod Institution Degree\n2009-2014\nMilitary Technical Academy\nEngineer of Information\nand Technology\nPROFESSIONAL QUALIFICATIONS\nEMPLOYMENT HISTORY\nPeriod\nCompany\nJob Title\n06/2014 -02/2015\nVietsoftware International \nDeveloper\n02/2015 \u2013 03/2016\nFPT Information System\nDeveloper\n04/2016 -06/2017\nTinh van outsourcing\nSenior Developer\n06/2017 - Now\nFPT Information System\nSenior Developer, \nTeam leader\n2\nPROFESSIONAL SUMMARY\n\uf0b7\nGood skills in IT with 4 years-experience including application development, \nimplementation,deployment,internalandcustomersupport.\n\uf0b7\nHave strong experience in programming languages such as Java, HTML/CSS; frameworks \nsuch as Struts, Spring, Hibernate, JPA, MVC1.0\n\uf0b7 Abilityinworkingindependentlyandinteam-workapproaches\n\uf0b7\nAdapt with new working styleseasily\n\uf0b7\nWork with high responsibility andenthusiast\nSOFTWARE\n\uf0b7\nOOP: Oriented ObjectProgramming\n\uf0b7\nProgramming Languages/Tools: Java, JavaScript, HTML, XML, AJAX, Eclipse, NetBean, \nApacheMaven, PHP, C#\n\uf0b7\nDatabases: MySQL, Oracle, SQLServer.\n\uf0b7\nConfiguration Management tools: Tortoise SVN,Git\n\uf0b7\nIDE Tools: Netbean, intellJ,eclipse\n\uf0b7\nOthers: docker\nOPERATING SYSTEMS\n\uf0b7\nWindows XP/7/10\n\uf0b7 CentOS7.0\nP ROFESS IONAL / TE C HNIC ALEX P ERIEN C E S\nFPT Digital Platform\n06/2017 - Now\nProject Name\nFPT Digital Platform\nObjectives\nCreate Cx-studio tool, which support design screen of website by drag \nand drop.\nMaintain and develop Fpt Digital Platform\nDemo and develop FPT digital Platform for customer of FPT Information\nSystem\nCustomer Name\nFpt Information System\nCustomer DescriptionFpt Information System\nCustomer Location\n22 Floor, Landmark 72 tower, Ph\u1ea1m H\u00f9ng Street, Nam T\u1eeb Li\u00eam District, \nH\u00e0 N\u1ed9i city \nProject Duration\nJun/2017 - Now\nTeam Size\n5 people\nTaken Role\nSenior Developer\nTasks\n\uf0b7\nStudy and create some based services (like users, systemconfigs) by \nspring boot and docker\n\uf0b7\nStudy and edit liferay porlet for login   \n\uf0b7\nCreate Cx-studio tool, which support design screen of website by drag \nand drop.\n\uf0b7\nMaintain and develop Fpt Digital Platform\nTechnology\n\uf0b7\nSpring boot, Spring security, Spring oauth2, Spring MVC, JPA, Groovy\nScript, ReactJs, Html5, Css3, Jquery\n\uf0b7\nEclipse, Oracle Sql developer, docker, Visual studio Code, \nSHB corporate \nBanking\n10/2017 - Now\nProject Name\nSHB corporate banking\nObjectives\nCreate Website internet banking for corporate customer of SHB use FPT \nDigital Platform\nCustomer Name\nSHB\nCustomer DescriptionSHB\nProject Duration\nOct/2017 - Now\nTeam Size\n12 people\nTaken Role\nSenior Developer, Configuration Manager, Teamleader\nTasks\n\uf0b7\nAnalysis & Design: Analysis Customer\u2019s requirements\n\uf0b7\nTechnical Support: Support technique for team. Troubleshoot, \nliaise with other vendors to resolve all issues and develop all \nenhancements.\n\uf0b7\nManage team and make detail plain for development an \napplication\n\uf0b7\nDevelop: develop applications based on FPT Digital Platform and \ncustomer\u2019s requirements.\nTechnology\n\uf0b7\nSpring boot, Spring security, Spring oauth2, Spring quartz, Spring \nMVC, JPA, JDBC template, Axis2, Groovy Script, ReactJs, Html5, \nCss3, Jquery, bootstrap3\n\uf0b7\nEclipse, Oracle Sql developer, docker, Visual studio Code, Soap UI\nECM-next system\n09/2016 \u2013 6/2017\nProject Name\nECM-next system\nObjectives\nCreate Enterprise content management next system base on old project.\nCustomer Name\nNissho\nCustomer Description\nNissho\nCustomer Location\nJapan\nProject Duration\nSep 2016 \u2013 Now\nTeam Size\n7 people\nTaken Role\nSenior Developer\nTasks \uf0b7 Analysis&Design:AnalysisCustomer\u2019srequirements\n\uf0b7\nTechnical Support: Support technique for team. Troubleshoot, \nliaisewithothervendorstoresolveallissuesanddevelopall \nenhancements.\n\uf0b7 Manageteamandmakedetailplainfordevelopmentan  application\n\uf0b7 Develop:developapplicationsbasedontransferredrequirement packages.\nTechnology \uf0b7 OracleMVC1.0,Hibernate,SpringAOP,SpringSecurity,Jquery,.\n\uf0b7 Eclipse,OracleSQLDeveloper,Oracle11g,Tomcat.\nRecruitment website\n05/2016\u2013\n09/2016\nProject Name\nRecruitment website\nObjectives\nCreate the recruitment website for tinhvan group\nCustomer Name\nTinhvan\nCustomer Description\nTinhvan\nCustomer Location\nVietnam\nProject Duration\nJun 2016 \u2013 Sep 2016\nTeam Size\n3 people\nTaken Role\nSenior Developer\nTasks \uf0b7 Analysis&Design:AnalysisCustomer\u2019srequirements\n\uf0b7\nDevelop:createframework&developapplicationsbasedon \ntransferred requirementpackages.\nTechnology\n\uf0b7\nJSP, Spring MVC, Spring security, Spring AOP, Hibernate, jQuery. \n\uf0b7\nEclipse, MySQL, Apache tomcat.\nCMS 12/2015\u2013 03/2016\nProject Name\nCMS\nObjectives\nCreate new module for financial departments and related units,\nmaintenance and update old module follow a new circular. Create web\nservice with purpose connect two system together. Support and answer\ncustomer\u2019s question, maintenance two system\nCustomer Name\nMinistry of Finance\nCustomer Description\nMinistry of Finance\nCustomer Location\nViet Nam\nProject Duration\nDec 2015 \u2013 Apr 2016\nTeam Size\n7 people\nTaken Role\nDeveloper\nTasks \uf0b7 Develop:developapplicationsbasedontransferredrequirement  packages.\n\uf0b7 Customersupport:supportingrelatedunitsaboutCMS\u2019ssystem\nTechnology\n\uf0b7\nStruts 2, Struts 1, Active Object, Jdbc template, bootstrap, jquery.\n\uf0b7\nEclipse, Oracle SQL Developer, Apache Tomcat.\nJira\n06/2015 \u201312/2015\nProject Name\nJira\nObjectives\nCreate project management system for fpt information system base on Jira.\nCustomer Name\nFPT Information System\nCustomer Description\nFPT Information System\nProject Duration\nJun/2015 \u2013 Dec/2015\nTeam Size\n10 people\nTaken Role\nDeveloper\nTasks\n\uf0b7\nAnalysis & Design: Analysis Customer\u2019s requirements\n\uf0b7\nDevelop: develop applications based on FPT Digital Platform and \ncustomer\u2019s requirements.\nTechnology\n\uf0b7\nSpring MVC, Spring RESTful Web Service, Active Object, Jira core.\n\uf0b7\n Eclipse, MySQL.\nOCB\n02/2015 \u2013 6/2015\nProject Name\nOCB\nObjectives\nFix bugs and create new module for OCB project of techcombank like\nInternal transfer, batch transfer.\nCustomer Name\nTechcombank\nCustomer Description\nTechcombank\nCustomer Location\nVietname\nProject Duration\nFeb/2015 \u2013 Jun/2015\nTeam Size\n20 people\nTaken Role\nDeveloper\nTasks\n\uf0b7\nAnalysis & Design: Analysis Customer\u2019s requirements\n\uf0b7\nDevelop: develop applications based on transferred requirement\npackages.\nTechnology\n\uf0b7\nSpring MVC, Spring JDBC, Oracle Store Procedure.\n\uf0b7\nEclipse, Oracle SQL Developer, Oracle Weblogic, JQuery\nTTXVN-Support  \nDetecting Event\n08/2014 \u2013 01/2015\nProject Name\nTTXVN-Support DetectingEvent\nObjectives\nDevelop software to find an event related to a given keyword and make\nremarkable warning to attract end users. The event must be found as soon\nas possible.\nCustomer Name\nVietnam News Agency\nCustomer Description\nVietnam News Agency\nCustomer Location\nVietnam\nProject Duration\nAug/2014 \u2013 Jan/2015\nTeam Size\n3 people\nTaken Role\nDeveloper\nTasks\n\uf0b7\nAnalysis & Design: Analysis Customer\u2019s requirements\n\uf0b7\nDevelop: create framework & develop applications based on \ntransferred requirement packages.\nTechnology\n\uf0b7\nApache Lucene, Apache Nutch, Apache Solr\n\uf0b7\nSpring MVC, Spring RESTful Web Service, Spring Security, Spring DI\nHibernate, Bootstrap, JQuery\n\uf0b7\nEclipse, MySQL, Apache Tomcat.", "educations": [{"id": 5542, "gpa": null, "major": "C\u00f4ng ngh\u1ec7 th\u00f4ng tin", "school": "Military Technical Academy", "diploma": "Bachelors", "end_time": "2014-01-01T00:00:00Z", "conf_score": 0.8011740356834262, "start_time": "2009-01-01T00:00:00Z", "picklist_major": "IT - Hardware/Networking", "major_categories": "M\u00e1y t\u00ednh v\u00e0 c\u00f4ng ngh\u1ec7 th\u00f4ng tin", "major_categories_detail": "C\u00f4ng ngh\u1ec7 th\u00f4ng tin"}], "experiences": [{"id": 18514, "detail": "", "company": "FPT Information System", "end_time": "2023-04-13T00:00:00Z", "industry": "High Technology", "position": "Senior Developer, Team leader", "conf_score": 0.9162385206282713, "start_time": "2017-06-01T00:00:00Z"}, {"id": 18515, "detail": "Tasks Analysis & Design: Analysis Customer\u2019s requirements\nTechnical Support: Support technique for team. Troubleshoot, liaise with other vendors to resolve all issues and develop all enhancements.\nManage team and make detail plain for development an application\nDevelop: develop applications based on FPT Digital Platform and customer\u2019s requirements.\nTechnology Spring boot, Spring security, Spring oauth2, Spring quartz, Spring MVC, JPA, JDBC template, Axis2, Groovy Script, ReactJs, Html5, Css3, Jquery, bootstrap3\nEclipse, Oracle Sql developer, docker, Visual studio Code, Soap UI", "company": "SHB corporate\nBanking", "end_time": "2017-10-31T00:00:00Z", "industry": "Banking", "position": "Senior Developer, Configuration Manager, Teamleader", "conf_score": 0.8049536052150557, "start_time": "2017-10-01T00:00:00Z"}, {"id": 18516, "detail": "Project Name FPT Digital Platform Objectives Create Cx-studio tool, which support design screen of website by drag and drop.\nMaintain and develop Fpt Digital Platform Demo and develop FPT digital Platform for customer of FPT Information System Customer Name Fpt Information System Customer DescriptionFpt Information System Customer Location 22 Floor, Landmark 72 tower, Ph\u1ea1m H\u00f9ng Street, Nam T\u1eeb Li\u00eam District, H\u00e0 N\u1ed9i city\nProject Duration Ju", "company": "FPT Digital Platform", "end_time": "2017-06-30T00:00:00Z", "industry": "High Technology", "position": "Senior Developer", "conf_score": 0.8049536052150557, "start_time": "2017-06-01T00:00:00Z"}, {"id": 18517, "detail": "ks Analysis&Design:AnalysisCustomer\u2019srequirements Technical Support: Support technique for team. Troubleshoot, liaisewithothervendorstoresolveallissuesanddevelopall enhancements.\nManageteamandmakedetailplainfordevelopmentan application\nDevelop:developapplicationsbasedontransferredrequirement packages.\nTechnology OracleMVC1.0,Hibernate,SpringAOP,SpringSecurity,Jquery,. Eclipse,OracleSQLDeveloper,Oracle11g,Tomcat.", "company": "ECM - next system", "end_time": "2017-06-30T00:00:00Z", "industry": "Other", "position": "Senior Developer", "conf_score": 0.8557936817904112, "start_time": "2016-09-01T00:00:00Z"}, {"id": 18518, "detail": "", "company": "Tinh van outsourcing", "end_time": "2017-06-30T00:00:00Z", "industry": "Other", "position": "Senior Developer", "conf_score": 0.9050765977702602, "start_time": "2016-04-01T00:00:00Z"}, {"id": 18519, "detail": "Project Name CMS Objectives Create new module for financial departments and related units, maintenance and update old module follow a new circular. Create web service with purpose connect two system together. Support and answer customer\u2019s question, maintenance two system\nCustomer Name Ministry of Finance Customer Description Ministry of Finance Customer Location Viet Nam Project Duration D", "company": null, "end_time": "2016-04-30T00:00:00Z", "industry": "Other", "position": "Developer", "conf_score": 0.8242379454375255, "start_time": "2015-12-01T00:00:00Z"}, {"id": 18520, "detail": "", "company": "FPT Information System", "end_time": "2016-03-31T00:00:00Z", "industry": "High Technology", "position": "Developer", "conf_score": 0.9050765977702602, "start_time": "2015-02-01T00:00:00Z"}, {"id": 18521, "detail": "PROFESSIONAL QUALIFICATIONS EMPLOYMENT HISTORY Period Company Job Title", "company": "Vietsoftware International", "end_time": "2015-02-28T00:00:00Z", "industry": "High Technology", "position": "Developer", "conf_score": 0.9162385206282713, "start_time": "2014-06-01T00:00:00Z"}, {"id": 18522, "detail": "roject Name TTXVN-Support DetectingEvent Objectives Develop software to find an event related to a given keyword and make remarkable warning to attract end users. The event must be found as soon as possible.\nCustomer Name Vietnam News Agency Customer Description Vietnam News Agency Customer Location Vietnam Project Duration Aug/", "company": "TTXVN", "end_time": "2015-01-31T00:00:00Z", "industry": "Other", "position": "Support Detecting Event", "conf_score": 0.7685271210777048, "start_time": "2014-08-01T00:00:00Z"}], "address": null}