{"skills": ["linux", "angular", "css3", "postman", "java", "mongo", "automation", "automation testing", "futures", "javascript", "selenium", "eauthentication", "ftp", "dns", "studio", "io", "selenium ide", "automation test", "git", "html5", "analysis", "tester", "acceptance testing", "sell", "router", "functional testing", "android", "search", "system testing", "scheduling", "smoke test", "vod", "log4j", "sql", "restful", "firmware", "integration testing", "data parallel", "maven", "github", "writing test case", "business rule", "bug fixing", "testing", "protractor", "eclipse ide", "localization", "database", "angular 2", "clarify", "ip address", "intellij idea", "manual testing", "blackberry"], "fulltext": " PERSONAL INFORMATION \nFull name             : TRAN VAN HIEU \nGender \n             : Male \nMaterial status     : Single  \nBirthday                : 09/08/1989 \nAddress                : Da Nang City, Son Tra District, Phuoc My Ward,36 Group \nEmail \n            : hieutrandn9889@gmail.com \nMobile \n            : +84-934204911 \nLanguage             : English, Vietnamese \nCAREER OBJECTIVE \n\u2022 \nLearn more things when working in professional environment in multinational companies to \naccumulate more and more experience for future promotion \n\u2022 \nGet a job that challenges my skills as a tester, a IT engineer and professional \nEDUCATION BACKGROUND \n\u2022 \nGraduated from Education of University, The University of Da Nang, \n(4 years Course: 2007 \u2013 2011) \n\u2022 \nMajor subject: Information Technology \n\u2022 \nRate: Good \nCERTIFICATE AND AWARD \n\u2022 \n Award for Certificate in Gameloft company \nEMPLOYMENT HISTORY \nFrom \nTo \nCompany \nLocation \nTitle \n05/2017 \nToday \nEnouvo IT \nDa Nang City, \nViet Nam \nSoftware Engineer \n07/2013 \n05/2017 \nF-soft corporation \nDa Nang City, \nViet Nam \nSoftware Engineer \n10/2011 \n06/2013 \nGameloft company \nDa Nang City, \nViet Nam \nSoftware Engineer \nPRODUCTS (as a developer) \n\u2022 \nhttps://github.com/hieutrandn9889 \n\u2022 \nchungkhoanblog.com \nSKILLS \nv Soft Skills:  \n\u2022 \nTeam work \n\u2022 \nEnglish: Can communicate to the customer in project context effectively \nv Programming Skills \n\u2022 \nHTML5, CSS3, SQL, Java, Linux command, JavaScript \nv  Software \n\u2022 \nTest tools: Selenium IDE, Eclipse (add some libraries), SOAP UI, PostMan \n\u2022 \nDatabases: phpAdmin, mongo DB \n\u2022 \nOthers: Notepad ++, Photoshop, sublime-text, visual code, GIT, Source tree, Intellij idea \n\u2022 \nPlatforms: Windows, Linux, MAC \nEXPERIENCE SUMMARY \n\u2022 \nI read requirements, creating test case and discuss product owner (PO) to analysis this \ndocument from Client sent. Good communication Client and PO to resolve issue. Suggest \nsolution and develop software. And have an experience discuss with developer to fixing \nbug and resolve big issue \n\u2022 \nA lot of experience in managing team during some projects \n\u2022 \nSpend more than 4 years making apps, game on mobile, 3 years working as a software \ntester \n\u2022 \nBroad understanding of testing processes, creating test case, smoke test, integration \ntesting, system testing, acceptance testing and checking GUI. \nIn Automation: \n\u2022 \nI created a framework to run automation by protractor in javaScript that can run all browser \non website. It writes cucumber and report format cucumber report \n\u2022 \nBroad understanding of Selenium IDE (create test case and test suite: record and play \nback), checking UI of module function. Have an experience cucumber  \n\u2022 \nKnowledge about Selenium WebDriver: API, Maven. Creating a framework (try catch, log4j, \ntest NG, run some browsers), run API by JavaScript, run groups test case, parallel, data \nprovider, parameters \u2026  by Test NG  \n\u2022 \nRun automation on app and web mobile via (APPIUM, Android studio, X-code) \nPROFESSIONAL EXPERIENCE \nAutomation testing and manual testing (Front End and Back End): \n10/2018\u2013 Now check manual and automation \nProject Description:  \n\u2022 \nThis project is manual testing and automation for website. The project name is MyDTI \n\u2022 \nCreate test case and test plan which are checked testcase for this project. Then I write script \nto automation testing by protractor that is cover 80% testcase manual. And find bug quickly \nwhen running automation. \nResponsibilities : \n\u2022 \nAnalyze manual test cases and write automation \n\u2022 \nCheck API and response from request to server  \n-------------- \n02/2018\u2013 09/2018 \nProject Description:  \n\u2022 \nThis project is manual testing and automation for backend server. The project name is Bank \n\u2022 \nGet document from developer then create database push to server and created Request API \nfollow this document by Postman and SOAP UI \nResponsibilities : \n\u2022 \nAnalyze manual test cases and write automation \n\u2022 \nCheck API and response from request to server  \n-------------- \n07/2017\u2013 01/2018 \nProject Description:  \n\u2022 \nThis project is manual testing for app Android mobile, IOS mobile, website. The project name \nis AppyGuide, ESPM which Story records to sharing for everyone. Storyteller will create story \nand review location. We will sell it for who wants it \n\u2022 \nResearch run protractor with Angular to run website. I can care some test cases and write \nautomation format protractor by JavaScript \nResponsibilities : \n\u2022 \nAnalyze manual test cases and write automation \n\u2022 \nIntegration and System testing \n-------------- \n01/2017\u2013 06/2017 \nProject Description:  \n\u2022 \nThis project is manual testing for app Android mobile, IOS mobile. The project name is SEKIO \nthat runs android mobile, IOS. Executing some devices with other resolution (480*1200) and \nOS (5.11, 6x, 7.0, 7.1) and creating 355 test cases for testing. After automation testing app by \nAPPIUM to run 355 test cases for Android and IOS \n\u2022 \nBTW, another project about website: Writing test case and run automation with selenium \nusing cucumber framework (run multi browser Firefox, Chrome, IE). \n\u2022 \nResearch run protractor with Angular-2 and coding with visual code (ng serve, ng e2e) \nthat is a new feature for automation \nResponsibilities : \n\u2022 \nAnalyze manual test cases and automation test  \n\u2022 \nCreate test case and create package to automation test \n\u2022 \nIntegration and System testing \n-------------- \n07/2016 \u2013 01/2017 \nProject Description:  \n\u2022 \nThis project is manual testing for device (Panasonic project). Panasonic project is executing \nthe testing on device and applying testing for door phone following business rules, test case \nlist. \nResponsibilities : \n\u2022 \nAnalyze manual test cases \n\u2022 \nCreate test case \n\u2022 \nIntegration and System testing \n-------------- \n04/2016 \u201307/2016 \nProject Description: \n\u2022 \nThis project is to automate all manual TCs for DLS project. DLS is the system receiving Guide \nData from various sources (Scheduling System, Gracenote, \u2026) and publishing the Guide data \nto downstream systems (PGWS, \u2026) following business rules \nResponsibilities:  \n\u2022 \nAnalyze manual test cases \n\u2022 \nCreate sub-process in LISA \n\u2022 \nAutomate TCs by LISA\u2019s tool  \n-------------- \n12/2015 - 04/2016, Manual Web service tester \nProject Description: \n\u2022 \nProgram Guide RESTful Web Services (PGWS) shall provide the clients with the up to date \nprogram guide information that matches the client\u2019s search request on Mobile/dotcom \n\u2022 \nProgram Data Service (PDS) web service is the system which provides data for specific \nsettopbox UI screen. The data, which is provided by PDS, includes Content metadata \n(Movies/Show with scheduled program details or VOD information), Celebrity and Provider \ninformation. The service allows more than 100.000 titles metadata and real time updated \ninformation to be delivered to customer. \nResponsibilities: \n\u2022 \nIntegration and System testing \n\u2022 \nAnalyze/Create bug report \n-------------- \n10/2014 - 11/2015, Mobile application tester \nProject Description:  \n\u2022 \nDevelop and verify software for IVI system which will be deployed on electric cars or hybrid \ncars. This software provides lots of features, such as: multimedia, radio, apple car plays, \nmirror link, climate, and lots of settings...   \nResponsibilities: \n\u2022 \nAnalyze requirement to develop test cases \n\u2022 \nSet up simulator for device (car) and install application on mobile by ITunes \n\u2022 \nFunctional/Integration/Free testing for application on simulator and on mobile \n\u2022 \nTesting the interaction between 2 applications on simulator and mobile  \n\u2022 \nBug reporting and tracking \n\u2022 \nDevelop test to complete report for each build \n----------- \n10/2014 - 11/2015, Manual Tester \nProject Description: \n DLS is the system receiving Guide Data from various sources (Scheduling System, Gracenote, \n\u2026) and publishing the Guide data to downstream systems (PGWS, PDS \u2026) following \nbusiness rules \nResponsibilities: \n\u2022 \nFunctional Testing \n\u2022 \nBug reporting and tracking \nTechnologies Used: Web Services, FTP \n------------------ \n06/2014\u2013 10/2014, Manual Tester \nProject Description: This project is for router firmware testing \n\u2022 \nCheck authentication of system, limitation about access users into one website \n\u2022 \nConfigure DNS, IP address, domain and sub-domain \nResponsibilities: \n\u2022 \nAnalyze requirement to develop test plan/test cases \n\u2022 \nFunctional testing \n\u2022 \nCommunicate with QA manager in US to clarify Q&A, log and track bugs \n\u2022 \nCreate test report after each release \n----------------- \n3/2012\u2013 08/2014, Manual Tester \nProject description: Testing some game apps for mobile such as Green farm, Little Big City, Littlest \nPet Shop, Wonder Zoo and Dragon Mania\u2026 \n\u2022 \nIt must be free of bugs, correctly localization display and IAP (In-App-Purchase) buy item and \nreceive item is correct  \n\u2022 \n Compatibility with more than 300 mobiles and tablet devices. Testing game on platform IOS, \nAndroid, Blackberry, Nokia \nResponsibilities: \n\u2022 \nWrite test case, create project plan \n\u2022 \nExecute testing game, log and track bugs ", "educations": [{"id": 5566, "gpa": null, "major": "C\u00f4ng ngh\u1ec7 th\u00f4ng tin", "school": "The University of Da Nang", "diploma": "Bachelors", "end_time": "2011-01-01T00:00:00Z", "conf_score": 0.9147829841061427, "start_time": "2007-01-01T00:00:00Z", "picklist_major": "IT - Hardware/Networking", "major_categories": "M\u00e1y t\u00ednh v\u00e0 c\u00f4ng ngh\u1ec7 th\u00f4ng tin", "major_categories_detail": "C\u00f4ng ngh\u1ec7 th\u00f4ng tin"}], "experiences": [{"id": 18582, "detail": "From To Company Location Title", "company": "Enouvo IT", "end_time": "2023-04-30T11:25:54.749256Z", "industry": "Other", "position": "Software Engineer", "conf_score": 0.7676018956121812, "start_time": "2017-05-01T00:00:00Z"}, {"id": 18583, "detail": "a Nang City, Viet Nam So", "company": "F - soft corporation", "end_time": "2017-05-31T00:00:00Z", "industry": "Other", "position": "Software Engineer", "conf_score": 0.8994817994166205, "start_time": "2013-07-01T00:00:00Z"}, {"id": 18584, "detail": "-------------- 12/2015 - 04/2016, Manual Web service tester\nProject Description: \u2022 Program Guide RESTful Web Services (PGWS) shall provide the clients with the up to date program guide information that matches the client\u2019s search request on Mobile/dotcom \u2022 Program Data Service (PDS) web service is the system which provides data for specific settopbox UI screen. The data, which is provided by PDS, includes Content metadata\n(Movie", "company": null, "end_time": "2016-04-30T00:00:00Z", "industry": "Other", "position": "Manual Web service tester", "conf_score": 0.724021521843711, "start_time": "2015-12-01T00:00:00Z"}, {"id": 18585, "detail": "ription:\n\u2022 Develop and verify software for IVI system which will be deployed on electric cars or hybrid cars. This software provides lots of features, such as: multimedia, radio, apple car plays, mirror link, climate, and lots of settings...\nResponsibilities: \u2022 Analyze requirement to develop test cases\n\u2022 Set up simulator for device (car) and install application on mobile by ITunes \u2022 Functional/Integration/Free testing for application on simulator and on mobile\n\u2022 Testing the interaction between 2 applications on simulator and mobile\nBug reporting and tracking\nDevelop test to complete report for each build\n-----------", "company": null, "end_time": "2015-11-30T00:00:00Z", "industry": "Other", "position": "Mobile application tester", "conf_score": 0.7050867654707917, "start_time": "2014-10-01T00:00:00Z"}, {"id": 18586, "detail": "Da Nang City, Viet Nam", "company": "Gameloft company", "end_time": "2013-06-30T00:00:00Z", "industry": "High Technology", "position": "Software Engineer", "conf_score": 0.8994817994166205, "start_time": "2011-10-01T00:00:00Z"}], "address": "Da Nang City, Son Tra District, Phuoc My Ward,36 Group"}