{"skills": ["search", "elastic stack", "css", "git", "testing", "analysis", "automation", "api gateway", "desktop application development", "golang", "svn", "automation test", "desktop", "process development", "signalr", "scheduling", "oracle", "data analysis", "entity framework", "security", "data mining", "jquery", "angular", "dataflow", "microsoft", "marketing", "sql", "retrieval", "sales", "c#", "stack", "sql database", "javascript", "website development", "database", "user activity", "rabbitmq", "mobile commerce", "wcf", "xml", "implementation", "mvc", "bootstrap", "cache", "frontend development", "lifecycle", "software development", "tdd", "cell phone", "rest", "management", "altium designer", "desktop application", "asp"], "fulltext": "RESUME \nPERSONAL DETAILS \nName  \n: Vo Hoang Loc \nDate of Birth  \n: 19/08/1982 \nHome Address \n: 29/262 Song H\u00e0nh QL22, Tan Hung Thuan ward, 12 district, Ho Chi Minh City. \nCell phone \n: (+84) 0974515741 \nPersonal Email \n: locvo.work@gmail.com  \nSkype \n: loc_vh \nGender   \n: Male \nMarital Status  \n: Married \nCitizen of  \n: VietNam \nOVERVIEW \nExperiences \nOver 14 years of experience in the entire software development life cycle \nExperience in web/desktop application development. \nFamiliar with Microsoft technologies \nWilling to learn and acquire new knowledge \nTechnologies \nC#.NET (4 - 4.5 - .Net Core), GoLang, Akka.NET \nPattern and Practices \nTDD, REST, MVC, SOA, SOLID, DDD -CQRS-EventSourcing, Reactive & dataflow programming. \nFront End \nCSS, jQuery, Javascript, Angular, Vue, Bootstrap. \nStrong points \nGood team working smart working, good communication, open minded and highly responsible to \nachieve objectives/goals effectively. Very keen to learn new technologies and new business domains/markets. I work well with \nor without supervision. \nCAREER SUMMARY \nAug 2017 to Present \nAltium VietNam \nSenior Software Engineer \nFeb 2016 to April 2017  \nDevinition \nTechnical Leader \nMay 2013 to Feb 2016  \nAbsolute Software  \nSenior Developer \nOct 2012 to May 2013  \nInnotech Technology \nSenior Developer  \n          (Page 1 of 3) \nJan 2009 to Oct 2012 \nNetBlue Vietnam \nSenior Developer  \nFeb 2006 to Jan 2009 \nInfinian  \nSenior Developer/ Technical Team Leader \nPROFESSIONAL EXPERIENCE \nAug 2017 to Present \nAltium VietNam \nDuties: Senior Software Engineer. \n\uf0b7 \nDevelop and maintain backend services of Ciiva team. \n\uf0b7 \nIn charge of the integration of Ciiva Api, a center API gateway that is used by multiple external \nprograms, with million users access. \nMain Technologies: C# (.Net 4.5 and Core), Go, Service Stack, Elastic Search, RabbitMQ. WebSockets. \nPowerShell \nProject involved:  \n1/ Ciiva website: www.ciiva.com  \n- \nSupport to search millions of electronic components from Ciiva and Octopart\u2019s parts database. \n- \nProvide historical lifecycle data, pricing, and availability for every Ciiva part. \n2/ Ciiva Api Gateway. \n- \nExpose API endpoint that access Ciiva products such as: SmartParts, BOM Management. \n- \nKeep component libraries standardized and organized. \n- \nQuickly access electronic components from multiple largest distributors in the world. \n- \nIntegrated in Altium Designer \nFeb 2016 to Aug 2017 \nDevinition \nDuties : Technical Leader \n\u25cf \nProgramming, maintain working products, support customer requests. \n\u25cf \nManage team: work with customer and then make planning, analysis, develop plans \nProject involved:   \n1/ TheGreenery: www.thegreenery.com  \n- \nMake a system to manage agriculture products and processes, provide multiple value chain: Growers, \nProducts, Logistics, Marketing, Retailers, Consumers \n2/ Van GanseWinkel - TheChainNeverStops \n- \nMake a white-label version of the TheGreenery system to support Van Ganse Winkel customer \n3/ Delphy Greenery \n- \nMake a white-label version of TheGreenery system to support Delphy customer. \nMay 2013 to Feb 2016 \nAbsolute \nDuties: Senior .Net Developer \n\u25cf \nWeb Programming with C#/ASP.NET and tools. \n\u25cf \nManage a SCRUM team. \n\u25cf \nInvolving in planning, analysis, developing, testing processes. \n\u25cf \nMake automation  tests and automation build to control the entire building and development process. \nProject involved:   \n1/ Project: Absolute Customer Center \n- \nCustomer Care System for Theft Reporting, Device Locking, Device Locate \u2026etc\u2026  \n2/ Project: Absolute Product White Labeling \n- \nMake all Absolute products support White Label strategy. \n3/ Other projects: 3a Offer, Absolute Data Protect, Absolute Notifier, Absolute Reminder, Consumer \nInstallShieldInstallerV2 \u2026 \nOct 2012 to May 2013 \nInnotech Technology \nDuties: Developer \n\u25cf \nIn charge of building and maintaining services, websites for stock ordering system for securities \ncompany such as SSI, Kim Eng, VBS\u2026 \n          (Page 2 of 3) \n\u25cf \nBuild core system for Intelligent Ordering System (TCO, ST, TS, PRO orders) \n\u25cf \nMake automation build to control the entire building and development process.  \n\u25cf \nTechnologies: C#, ASP.NET \n\u25cf \nDatabase: SQL server, DB2, Oracle \n\u25cf \nPosition: .NET developer \nJan 2009 to Oct 2012 \nNetBlue \u2013 Flipside LLC \nDuties: Developer \n\uf0b7 \nDevelop and enhance domain parking product that serviced \n\uf0b7 \nWeb Programming with C#/ASP.NET and tools. \n\uf0b7 \nInvolving in SCRUM team working process in making projects \nProject involved:   \n\uf0b7 \nSearch Retrieval Service: Used abstract factory pattern to manage calls to various provider \nadvertising feeds, provide testability, and allow for custom implementations for use by various \napplications \n\uf0b7 \nCache generator service: Central caching service which synchronize cache files on all web servers. \nWeb servers then use data as local cache files, don\u2019t need to make any expensive calls to elsewhere. \n\uf0b7 \nLog parser service: Service which monitors and collects all user actions from all web servers and \ndoing bulk import to database. This information is analyzed and used for optimization user \nexperience, monetization as well as crosscheck with partners. \n\uf0b7 \nOptimization service: Service which helps optimize user experiences and monetization. It bases on \nuser activities and revenue generated, then suggests different optimized behavior next: should show \nfeed on our page or forward traffic to partners, which template (in over 2k templates in system) \nshould be shown, which feed partners is best to show. \n\uf0b7 \nDevelop CI projects using CruiseControl.NET \n\uf0b7 \nTechnologies and Tools ASP.NET MVC, Web API, WCF .NET 4.0, AngualarJS, SignalR, \nNHibernate, Entity Framework, Bootstrap, Git, SVN \nFeb 2006 to Jan 2009 \nInfinian Corporation (US). \nDuties: Developer \n\u25cf \nWeb Programming with C#/ASP.NET, XML, Neodynamic. \n\u25cf \nDevelop mobile solutions, ticket generation, scheduling processing. \n\u25cf \nDevelop Data Mining/Predictive Model, provide data analysis and give analytical advice. \n\u25cf \nWorking for some out-sourcing projects of the company partners. \n\u25cf \nMaster of developing applications running and support for Point-Of-Sales system. \n\u25cf \nLeader in RFID, Loyalty Card integrating systems. \n\u25cf \nProject involved:   \n1/ Project: Infinian Mobile Commerce System. \n- \nProvide Mobile Commerce Fulfillment and Advanced Mobile Marketing solutions. \n2/ Project: BOSC-PLUS stock ordering system. \n- \nA stock ordering system and transaction management. \n- \nPartner: BeeNext, HoChiMinh Stock Center (HSC). \n3/ Project: OTC stock ordering. \n- \nProvide stock ordering, dealing and management for OTC stocks. \n- \nPartner: BeeNext, HoChiMinh Stock Center (HSC) \nDEGREE \n2005 \nBachelor Degree of Network System. \nVan Hien University, Ho Chi Minh city, Viet Nam. \n2012 \nMCPD - Web Developer certification.  \n          (Page 3 of 3) \nPowered by TCPDF (www.tcpdf.org)", "educations": [{"id": 5580, "gpa": null, "major": null, "school": "Van Hien University", "diploma": "Bachelors", "end_time": "2012-01-01T00:00:00Z", "conf_score": 0.7050867654707917, "start_time": null, "picklist_major": "Other", "major_categories": "", "major_categories_detail": ""}], "experiences": [{"id": 18629, "detail": "", "company": "Altium VietNam", "end_time": "2023-04-13T00:00:00Z", "industry": "Other", "position": "Senior Software Engineer", "conf_score": 0.9242015051317842, "start_time": "2017-08-01T00:00:00Z"}, {"id": 18630, "detail": "", "company": "Devinition", "end_time": "2017-04-30T00:00:00Z", "industry": "Other", "position": "Technical Leader", "conf_score": 0.9242015051317842, "start_time": "2016-02-01T00:00:00Z"}, {"id": 18631, "detail": "", "company": "Absolute Software", "end_time": "2016-02-29T00:00:00Z", "industry": "High Technology", "position": "Senior Developer", "conf_score": 0.9242015051317842, "start_time": "2013-05-01T00:00:00Z"}, {"id": 18632, "detail": "", "company": "Innotech Technology", "end_time": "2013-05-31T00:00:00Z", "industry": "High Technology", "position": "Senior Developer", "conf_score": 0.9242015051317842, "start_time": "2012-10-01T00:00:00Z"}, {"id": 18633, "detail": "", "company": "NetBlue Vietnam", "end_time": "2012-10-31T00:00:00Z", "industry": "Other", "position": "Senior Developer", "conf_score": 0.9242015051317842, "start_time": "2009-01-01T00:00:00Z"}, {"id": 18634, "detail": "", "company": "Infinian", "end_time": "2009-01-31T00:00:00Z", "industry": "Other", "position": "Senior Developer/ Technical Team Leader", "conf_score": 0.9242015051317842, "start_time": "2006-02-01T00:00:00Z"}], "address": "29/262 Song H\u00e0nh Ql22, Tan Hung Thuan ward, 12 district, Ho Chi Minh City"}