{"skills": ["studio", "application testing", "java", "git", "css", "typescript", "testing", "c++", "kafka", "automation", "angular 2", "mercurial", "svn", "j2ee", "reactjs", "process management", "redis", "design pattern", "azure", "mysql", "oracle", "entity framework", "project management", "eauthentication", "jquery", "angular", "mobx", "unit test", "sql", "c#", "elasticsearch", "html5", "javascript", "data format", "material ui", "database", "protocol", "smtp", "mobile application", "crm", "sftp", "cpp", "mvc", "bootstrap", "cloud", "android", "product feature", "oauth2", "identity", "rest", "user management", "mongodb", "management", "asp", "aws", "proxy"], "fulltext": "1 \nCURRICULUM VIATE \nFull Name:   \nGender: \nDate of Birth: \nAddress: \nEmail: \nTUYEN PHAM VAN (PH\u1ea0M V\u0102N TUY\u00caN) \nMale \nJuly 3, 1984 \nPhuc Dien ward, Bac Tu Liem district, Hanoi city \nonlinexanh@outlook.com \nPERSIONAL SUMMARY \n\uf0a7 Have 6 years of experience in some programming languages: C#/.Net, JAVA, C++ and \nJavaScript. \n\uf0a7 Have experience with some databases: Oracle, MS SqlServer, MongoDb, BTDB \n\uf0a7 Have experience with some modern JavaScript technologies: TypeScript, BobrilJs, \nReactJs, Angular 2+. \n\uf0a7 Strong with clean code, good understanding of  SOLID and Design Patterns. \n\uf0a7 Good understanding with authentication, Oauth2 and IdentityServer. \n\uf0a7 Experienced with cloud platforms: Azure, AWS. \n\uf0a7 Experienced with distributed message queuing services: Kafka, AWS SQS.  \nEDUCATION \nYears  University  Classification \nHanoi University of Science and Technology \nNot yet graduated \n2009 - 2014 \nPosts and Telecommunications Institute of \nTechnology \nGood \nTECHNICAL SKILLS \nCategory \nSkill \nExperience (years) \nProgramming languages \nC++  1.5 \nJAVA  1 \n.NET  2.5 \n.NET Core \n2 \nBobrilJs  2.5 \nReactJs  2 \nAngular 2+ \n0.5 \n2 \nDatabases \nSQL Server \n2 \nOracle  1 \nMySQL  0.5 \nBTDB  2.5 \nMongoDb  2 \nApplication Domains \nWeb application \n5 \nWindow application \n2 \nMobile application \n1 \nVersion Control Systems \nTortoise SVN \n1 \nMercurial  1 \nGit  4 \nEnglish \nCommunicate  Basic \nRead / write \nGood \nPROFESSIONAL EXPERIENCE \nCompany  Technology \nGameloft \nNovember 2013 \u2013 August 2014 \n- C/C++ \n- OpenGL \n- Java Android \n- SVN \nFPT Software \nSep 2014 \u2013 August 2015 \n- C / C++ \n- C# Console / Windows Forms \n- ASP.NET MVC \n- SQL Server \n- Git \nIsora Soft \nStep 2015 \u2013 July 2016 \n- J2EE \n- Oracle DB, PL/SQL \n- JavaScript, CSS \n- JasperReport \n- Git \nFPT Software \nAugust 2016 \u2013 Present \n- C# / .NET / ASP.NET Core \n- BTDB database, MySQL, Entity Framework \n- Identity Server \n- TypeScript, BobrilJs, Angular 6+ \n- SQRS / EventSourcing \n- Azure, AWS \n- Kafka, ElasticSearch \n- Mercurial & Git \n3 \nPROJECTS \nProject 7 \nTeam size: 12 \nDomain: Web application \nTechnology: C#, ASP.NET Core, Angular 6+, MySQL, AWS, ElasticSearch \nRole:  Developer \nResponsibilities: Add new features, fix bug, code unit test. \nFeature: Allow to view statistic report of used franked machines in multiple \ndata format and charts \nProject 6 \nCompany: FPT Software \nCustomer: Neopost (Europe) \nTeam size: 20 \nDomain: Web application, windows application \nTechnology: C#, BTDB, BobrilJs, EventSourcing \nRole:  Developer \nResponsibilities: Add new features, fix bug, code unit test. \nFeature: CMP is a web site allow manage and process licenses of OMS-500 \nproduct, include features: \n\uf0b7 Support many licenses with difference product features \n\uf0b7 License can be use offline or only online \n\uf0b7 Support roles for salesman, technician, accountant, supporter and admin \n\uf0b7 License order management \n\uf0b7 License management \n\uf0b7 Customer management \n\uf0b7 User management \nProject 5 \nCompany: FPT Software \nCustomer: Neopost (Europe) \nTeam size: 20 \nDomain: Web application, windows application \nTechnology: C#, BTDB, BobrilJs, EventSourcing \nRole:  Developer \nResponsibilities: Add new features, fix bug, code unit test. \nFeature: OMS-500 is a web-based system for multichannel management of \ncustomer communications, includes: \n\uf0b7 End-to-end process management and automation \n\uf0b7 Supports standard input and output data formats: pdf, PCL5, TNO, \n4 \nPostScript \n\uf0b7 Multi-lingual document management \n\uf0b7 Delivers info through multiple channels: web, email, printers and more \n\uf0b7 Supports integrity barcodes: OMR, BCR, 2D \n\uf0b7 Postal savings with grouping, batch printing , sorting and merging \n\uf0b7 Allows changes in real-time without IT involvement \n\uf0b7 ERP/CRM business process interfaces \nProject 4 \nCompany: FPT Software \nCustomer: Hitachi Solution (Japan) \nTeam size: 12 \nDomain: Web application, windows application \nTechnology: ASP.NET MVC, ASP.NET API, JavaScript, jQuery, Bootstrap, SQL \nServer PL/SQL, Windows Console, WPF, SMTP Protocol, SFTP Protocol. \nRole:  Developer \nResponsibilities: Add new features, fix bug and write detail design. \nFeature: F-IMG is a web-based system use to manage documents. Feature \nincludes: \n\uf0b7 Support multiple languages, multiple user roles \n\uf0b7 Manage users \n\uf0b7 Manage files / folders \n\uf0b7 Support zip / unzip documents \n\uf0b7 Editing images, merging images \n\uf0b7 Send log via email with custom template \n\uf0b7 Import documents from other system via SFTP protocol. \n\uf0b7 Backup data automatically \nProject 3 \nCompany: FPT Software \nCustomer: Hitachi Solution (Japan) \nTeam size: 10 \nDomain: Web application, windows application \nTechnology:  C++ MFC,  C# Windows Forms, ASP.NET MVC / API \nRole:  Developer \nResponsibilities: Add new features, fix bug and write detail design. \nFeature: A system includes windows application, mobile application, web \napplication for protecting documents: \n\uf0b7 Windows application for encrypting file and sending file information to \nserver. \n5 \n\uf0b7 Windows application for authentication, decrypting and view file if it is \ndocument file. \n\uf0b7 Windows application for auto updating \n\uf0b7 Server proxy processing \n\uf0b7 Locking file when authentication problem \n\uf0b7 Web service for authentication \nWeb site for view information of file, log of file and position of file on global \nmap \nProject 2 \nCompany: FPT Software \nCustomer: Hitachi Solution (Japan) \nTeam size: 50 \nDomain: Web application, windows application \nTechnology:  C++ MFC,  C# Windows Forms, ASP.NET MVC / API \nRole:  Developer \nResponsibilities: Add new features, fix bug and write detail design. \nFeature: A system includes windows application, mobile application, web \napplication for protecting documents: \n\uf0b7 Windows application for encrypting file and sending file information to \nserver. \n\uf0b7 Windows application for authentication, decrypting and view file if it is \ndocument file. \n\uf0b7 Windows application for auto updating \n\uf0b7 Server proxy processing \n\uf0b7 Locking file when authentication problem \n\uf0b7 Web service for authentication \n\uf0b7 Web site for view information of file, log of file and position of file on \nglobal map \nProject 1 \nCompany: Gameloft Hanoi Studio \nCustomer: Gameloft (Europe) \nTeam size: 10 \nDomain: Mobile application \nTechnology: C/C++, OpenGL, CPP Rest, Android \nRole:  Developer \nResponsibilities: Add new features, fix bug. \nFeature: Game UNO & Friends is a 3D game can play in multiple devices like: \niOS, Android and HTML5 browsers. UNO Android game is made by porting \nfrom C/C++ UNO game. Game features: \n6 \n\uf0b7 Visual 3D Android game \n\uf0b7 Support many languages \n\uf0b7 Play with machine \n\uf0b7 Play with social users (Facebook, Google+) \n\uf0b7 Play with friends by invitation \n\uf0b7 Play in Tournaments \n\uf0b7 Leaderboard / Achievement \n\uf0b7 CRM process \n\uf0b7 Notifications \nPERSONAL PROJECTS \nProject 1 \nCompany: Personal \nCustomer:  None \nTeam size: 1 \nDomain: Web application \nTechnology: C#, ASP .NET Core, MongoDb, ReactJs, Typescript, Material-UI, \nMobx, SQRS, EventSourcing, Host in Azure, Message Queue with Kafka, Caching \nwith Redis, Push notification, Git \nRole: Developer, architect \nResponsibilities: Write framework for both backend and frontend; Write \nwhole application, testing. ", "educations": [{"id": 5592, "gpa": null, "major": null, "school": "Posts and Telecommunications Institute of Technology", "diploma": "Other", "end_time": "2014-01-01T00:00:00Z", "conf_score": 0.7532646542832604, "start_time": "2009-01-01T00:00:00Z", "picklist_major": "Other", "major_categories": "", "major_categories_detail": ""}], "experiences": [{"id": 18670, "detail": "- J2EE - Oracle DB, PL/SQL - JavaScript, CSS - JasperReport - Git", "company": "Isora Soft", "end_time": "2016-07-31T00:00:00Z", "industry": "Other", "position": null, "conf_score": 0.7050867654707917, "start_time": "2015-01-01T00:00:00Z"}, {"id": 18671, "detail": "- C / C++ - C# Console / Windows Forms - ASP.NET MVC - SQL Server - Git", "company": "FPT Software", "end_time": "2015-08-31T00:00:00Z", "industry": "High Technology", "position": null, "conf_score": 0.7050867654707917, "start_time": "2014-09-01T00:00:00Z"}, {"id": 18672, "detail": "- C/C++ - OpenGL - Java Android - SVN", "company": "Gameloft", "end_time": "2014-08-31T00:00:00Z", "industry": "High Technology", "position": null, "conf_score": 0.7050867654707917, "start_time": "2013-11-01T00:00:00Z"}], "address": "Phuc Dien ward, Bac Tu Liem district, Hanoi city"}