{"skills": ["stack", "java", "marketing", "automation", "futures", "sales", "management", "event marketing", "postgresql", "frontend development", "rail", "html", "ruby", "react native", "reacjs", "ionic", "social software", "website development", "css", "reactjs", "laravel", "full stack development", "public speaking", "php", "mysql", "owl", "jquery"], "fulltext": "Ng\u00f4 Ti\u1ebfn D\u0169ng\nCareer Goals\n- Working in a dynamic, professional environment\n- Becoming full-stack developer and having opportunities to challenge and fulfill myself\n\uf0eb Education\nUNIVERSITY OF SCIENCE, VNU-HCM\n10/2015 - 05-2019\nMajor: Information Technology\n\uf073 15/06/1997\n\uf005Work Experience\nGOLDEN OWL CONSULTING\n5/2018 - PRESENT\nFullStack developer\n- Frontend ReactJS/React Native\n- Backend RubyOnRails\n\uf007 Male\n\uf095 0981543897\n\uf199 Dung_NgoTien@outlook.com\n\uf041\n1/10 Nguy\u1ec5n V\u0103n V\u0129nh,\nPh\u01b0\u1eddng 4, Qu\u1eadn T\u00e2n B\u00ecnh, TP.\nH\u1ed3 Ch\u00ed Minh\n\uf0c0 Project\nGOLDEN OWL CONSULTING\n1. Web developer\n- Bid4Skill/Bid4Agency:\n+ BID4SKILL is a selective network of experienced trainers and coaches covering a wide\nrange of specialties including Leadership, Management, Communication, Sales, Public\nSpeaking, Team Building and more, etc.\n+ ReacJS Frontend + Ruby On Rails/PostgreSQL Backend\n- FutureAssembly:\n+ Future Assembly build beautiful, experience-focused web & mobile applications for event\nmarketing, admin automation, and stakeholder management on Multi-tenancy platform.\n+ FullStack RubyOnRails + PostgreSQL\n2. Mobile Developer\n- MyWork:\n+ Optimised for both employees and employers, mywork \u2013 an application under MyWork\nGlobal - provides an easy-to-use, transparent and interactive platform for all the shift-based\nsourcing needs\n+ Mobile App Ionic + Admin ROR + Api PHP/Laravel\n- Hitract App:\n+ Social network for university in Sweden\n+ Mobile App React Native\n\uf129 https://www.facebook.com/N goDung15697\nSKILL\nJava Script\nReactJS/ReactNative\nRuby On Rails\nHTML/CSS/JQUERY\nMySQL/PostgreSQL\nEnglish skill\n\uf040More Information\n- Vietnamese (mother tongue)\n- English (Intermediate)\n\u00a9 topcv.vn", "educations": [{"id": 5587, "gpa": null, "major": "C\u00f4ng ngh\u1ec7 th\u00f4ng tin", "school": "UNIVERSITY OF SCIENCE, VNU - HCM", "diploma": "Bachelors", "end_time": "2019-05-01T00:00:00Z", "conf_score": 0.9192536033612259, "start_time": "2015-10-01T00:00:00Z", "picklist_major": "IT - Hardware/Networking", "major_categories": "M\u00e1y t\u00ednh v\u00e0 c\u00f4ng ngh\u1ec7 th\u00f4ng tin", "major_categories_detail": "C\u00f4ng ngh\u1ec7 th\u00f4ng tin"}], "experiences": [{"id": 18658, "detail": "- Frontend ReactJS/React Native - Backend RubyOnRails", "company": "GOLDEN OWL CONSULTING", "end_time": "2023-04-13T00:00:00Z", "industry": "Other", "position": "FullStack developer", "conf_score": 0.8881411380643149, "start_time": "2018-05-01T00:00:00Z"}], "address": "1/10 Nguy\u1ec5n V\u0103n V\u0129nh, Ph\u01b0\u1eddng 4, Qu\u1eadn T\u00e2n B\u00ecnh, Tp. H\u1ed3 Ch\u00ed Minh"}