{"skills": ["angular", "css3", "task management", "payment", "zxing", "storage management", "object oriented design", "marketing", "javascript", "implementation", "c#", "sales", "bootstrap", "window xp", "management", "studio", "gitlab", "ood", "window 8", "window 10", "object oriented", "entity framework", "human resources", "jquery", "window 7", "svn", "html5", "analysis", "tester", "project management", "linq", "operating system", "configuration management tool", "search", "maintenance", "management tool", "asp", "wifi", "unified modeling language", "sql", "css", "oop", "configuration management", "crs", "visual studio", "le", "unit testing", "software development", "testing", "microsoft", "mvc", "identity", "entity framework core", "uml", "language modeling", "oracle", "database", "class", "database design", "microsoft ii", "wcf", "crystal report", "m sql server", "agile", "mysql", "html"], "fulltext": "Tran Duc Manh\nPERSONAL DETAILS\n\uf0b7\nName\nTran Duc Manh\n\uf0b7 Nationality  Vietnamese\n\uf0b7\nDate of Birth \nSeptember, 20th 1987\n\uf0b7 Sex Male\n\uf0b7\nMarital status\nSingle\n\uf0b7 \uf0b7 \uf0b7 \uf0b7 \uf0b7 \uf0b7 Stackoverflow:  https://stackoverflow.com/users/3753686/tomato32\nEDUCATIONAL BACKGROUND\n\uf0b7\n(2006 \u2013 2011) Bachelor of Computer Science \u2013 Thang Long University \n\uf0b7\nLanguages\nEnglish: Intermediate.\nJapanese: Basic.\nPROFESSIONAL SUMMARY\n\uf0b7\nHighly skilled IT professional with over seven years of professional experience including application\ndevelopment, implementation, deployment, internal and customer support.\n\uf0b7\nPerformed role as developer.\n\uf0b7\nCooperative and able to perform within a team-oriented atmosphere\n\uf0b7\nInterest and willingness in developing related job knowledge and skills.\n\uf0b7\nHave a high sense of responsibility, careful, frequently provides high quality of work.\nSOFTWARE\n\uf0b7\nDatabases: MS SQL Server, Oracle 11, MySQL.\n\uf0b7\nProgramming Languages: C#, ASP.Net (MVC 4+5+6), ASP .NET Core MVC, JavaScript, T-SQL, \nPL/SQL, HTML, CSS, JQuery.\n\uf0b7\nProgramming Tools: Visual Studio 2010, 2012, 2013, 2015, 2017, 2019.\n\uf0b7\nApp server / Middleware: Microsoft IIS.\n\uf0b7\nFramework: .NET, Ext.Net, DevExpress, TwitterBootstrapMVC2, .NET Core.\n\uf0b7\nConfiguration Management tools: Visual SVN, TFS, Visual Sourcesafe, Gitlab.\n\uf0b7\nBrowsers: Firefox, Chrome.\n\uf0b7\nOOAD/OOP: Object Oriented Analysis (OOA), Object Oriented Design (OOD), Object Oriented\nProgramming (OOP), Unified Modeling Language (UML).\n\uf0b7\nExperience and knowledge with: Web Service, WCF, Web API, KoGrid, SPA, Angular JS,\nKnockout JS, Vue JS, Bootstrap 4, Datatables.net, Dapper, EPPlus, HangFire, Solr, HTML5, CSS3 \u2026\nOPERATING SYSTEMS\n1\nWindows (Xp + 7 + 8 + 10).\nWORKING HISTORY\nFrom To Company Title\n08/2016 Now           IPay88      Developer\n05/2015\n07/2016\n          Harvey Nash\n     Developer\n07/2014\n05/2015\n          FPT Software\n     Developer\n02/2012\n06/2014\nVacom Joint-stock company\n     Developer\n09/2011\n01/2012\n          Gameloft\nQA Game Tester\n05/2011\n08/2011\n           HTsoft\n     Technical Staff\nPROFESSIONAL EXPERIENCE\nI.\n2016/08\u2013 Until Now\nDeveloper IPay88\nProject 1: Vinaphone Wifi marketing  \nProject Description: \nThe web app to manage Vinaphone customer type when they use free wifi from Vina. There are three\ncustomer type in the system: Vip, Vina and others. Depend on customer type that allows using free wifi\ndifferent time. Using Api for identity Vina or not Vina customer.\nTeam size:  1 people\nProject size: \nResponsibilities :\n\uf0b7\nCoding and unit testing\nTechnologies Used:\nHardware environment\n\uf0b7         Window 10\nSoftware environment\n\uf0b7        .NET Core (MVC .Net core 2.2)\nDevelopment tools \n\uf0b7        Visual Studio 2019\n\uf0b7\nEntity Framework Core\n\uf0b7\nWeb API 2\n\uf0b7 EPPlus\n\uf0b7 Datatables.net\n\uf0b7\nBootstrap 4\n\uf0b7 MySQL \nBrower\n\uf0b7\nFirefox, Chrome and on devices\nAgile Methodology\n2\nProject 2: Core Payment \nProject Description: \nUse the application to manage the transactions.  Convert from ASP Classic to .NET MVC Core.\nTeam size:  6 people\nProject size: \nResponsibilities :\n\uf0b7\nCoding and unit testing\nTechnologies Used:\nHardware environment\n\uf0b7         Window 10\nSoftware environment\n\uf0b7         MVC .NET Core\nDevelopment tools \n\uf0b7        Visual Studio 2017\n\uf0b7\nEntity Framework Core\n\uf0b7\nBootstrap 3.2\n\uf0b7\nSQL Server 2012\nBrower\n\uf0b7\nFirefox, Chrome\nAgile Methodology\nProject 3: Admin Portal and Merchant Portal \nProject Description: \nMaintenance the features in the system (include fix bugs, CR, develop new some features). \nTeam size:  6 people\nProject size: \nResponsibilities :\n\uf0b7\nCoding and unit testing\nTechnologies Used:\nHardware environment\n\uf0b7         Window 10\nSoftware environment\n\uf0b7         MVC .NET 4\nDevelopment tools \n\uf0b7        Visual Studio 2017\n\uf0b7\nEntity Framework Core\n\uf0b7\nBootstrap 3.2\n\uf0b7\nSQL Server 2012\n\uf0b7 EPPlus\nBrower\n\uf0b7\nFirefox, Chrome\nAgile Methodology\nII.\nVaCom Joint Stock Company\nProject 1: Task Management\n3\nCustomer: \nProject Description: \nUse the application to manage the Task.  \nTeam size:  6 people\nProject size: \nResponsibilities :\n\uf0b7\nCoding and unit testing\nTechnologies Used:\nHardware environment\n\uf0b7         Window 8\nSoftware environment\n\uf0b7         .NET Framework\nDevelopment tools \n\uf0b7        Visual Studio 2013\n\uf0b7\nKnockout JS\n\uf0b7\nMVC 5\n\uf0b7\nEntity Framework 6\n\uf0b7\nBootstrap 3.2\n\uf0b7\nWeb API\n\uf0b7\nCrystal Report \n\uf0b7\nSQL Server 2012\n\uf0b7 EPPlus\nBrower\n\uf0b7\nFirefox, Chrome\nAgile Methodology\nProject 2: Storage Management\nCustomer: \nProject Description: \nUse the application to manage the profile, documents.  \nTeam size:  7 people\nProject size: \nResponsibilities :\n\uf0b7\nAnalyze the requirement\n\uf0b7\nDesign database and Prototype\n\uf0b7\nCoding and unit testing\n\uf0b7\nSupport customers\nTechnologies Used:\nHardware environment\n\uf0b7         Window 7\nSoftware environment\n\uf0b7         .NET Framework\nDevelopment tools \n\uf0b7        Visual Studio 2012\n4\n\uf0b7 TwitterBootstrapMVC2\n\uf0b7 Datatables.net\nEntity Framework\nCrystal Report \nOracle database, ODAC\n\uf0b7 Zxing.net\n\uf0b7 EPPlus\n\uf0b7 LinQToExcel\n\uf0b7 AutoMapper\nSolr Search\n\uf0b7\n\uf0b7\n\uf0b7\n\uf0b7\nBrower\n\uf0b7\nFirefox, Chrome\nProgramming Language\n\uf0b7\nASP.Net (MVC 4)\n\uf0b7 LinQ\n\uf0b7\nJavaScript, JQuery (using Firebug to debug)\nScrum Methodology\nProject 3: Production Management\nCustomer: Van Xuan Packaging Joint-stock Company \u2013 Hai Duong\nProject Description: \nUse the application to manage the production process.\nTeam size: 2 people.\nProject size:\nResponsibilities :\n\uf0b7\nAnalyze the requirement\n\uf0b7\nDesign database and Prototype\n\uf0b7\nCoding and unit testing\n\uf0b7\nSupport customers\nTechnologies Used:\nHardware environment\n\uf0b7         Window 7\nSoftware environment\n\uf0b7         .NET Framework\nDevelopment tools \n\uf0b7         Visual Studio 2012\n\uf0b7\nExt.Net\n\uf0b7\nCrystal Report \n\uf0b7\nVisual Assist X\n\uf0b7\nSQL Prompt 5\nBrower\n\uf0b7\nFirefox, Chrome\nProgramming Language:\n\uf0b7\nASP.Net (MVC 3)\n\uf0b7 PL/SQL\n\uf0b7 LinQ\n\uf0b7\nJavascript (using Firebug to debug)\n5\nProject 4: School Fee Management\nCustomer: Tri Duc school, WellSpring International Bilingual school, Le Quy Don Elementary and Second\nSchool\u2026 \nProject Description: \nUse the application to manage the school fee. It includes: manage school year, class, receivables from\nstudents, students list and reports to statistics details.\nTeam size: 2 people.\nProject size:\nResponsibilities :\n\uf0b7\nCoding and unit testing\n\uf0b7\nSupport customers\nTechnologies Used:\nHardware environment\n\uf0b7         Window Xp\nSoftware environment\n\uf0b7         .NET Framework, DevExpress\nDevelopment tools \n\uf0b7         Visual Studio 2010\n\uf0b7\nDevExpress\n\uf0b7 XtraReport \n\uf0b7\nVisual Assist X\n\uf0b7\nSQL Prompt 5\nProgramming Language:\n\uf0b7\nC# (Winform)\n\uf0b7 PL/SQL\nAnd the other management projects: Prize Calculation management, Treasure management, Human \nResource Management\u2026\n2011/09\u2013 2011/12\nMobile Game Tester\nGameloft\nJob duties: \n\uf0b7\nPlay the game on the mobile, find the bugs. Write the description about these bugs.\n2011/05\u2013 2011/08\nSalesman + Technical Staff\nHTSoft Company\nJob duties:\n6\n\uf0b7\nSale online the software HTSoft BizMan.Net.\nSupport customers using the software.\nCreate and edit the reports (Crystal Report) in the software.\n\uf0b7\n\uf0b7\n7", "educations": [{"id": 5595, "gpa": null, "major": "Khoa h\u1ecdc m\u00e1y t\u00ednh", "school": "Thang Long University", "diploma": "Bachelors", "end_time": "2011-01-01T00:00:00Z", "conf_score": 0.8141298764232529, "start_time": "2006-01-01T00:00:00Z", "picklist_major": "IT - Hardware/Networking", "major_categories": "M\u00e1y t\u00ednh v\u00e0 c\u00f4ng ngh\u1ec7 th\u00f4ng tin", "major_categories_detail": "M\u00e1y t\u00ednh"}], "experiences": [{"id": 18699, "detail": "", "company": "IPay88", "end_time": "2023-04-13T00:00:00Z", "industry": "Other", "position": "Developer", "conf_score": 0.8862986107442546, "start_time": "2016-08-01T00:00:00Z"}, {"id": 18700, "detail": "", "company": "Harvey Nash", "end_time": "2016-07-31T00:00:00Z", "industry": "Other", "position": "Developer", "conf_score": 0.9242015051317842, "start_time": "2015-05-01T00:00:00Z"}, {"id": 18701, "detail": "", "company": "FPT Software", "end_time": "2015-05-31T00:00:00Z", "industry": "High Technology", "position": "Developer", "conf_score": 0.9242015051317842, "start_time": "2014-07-01T00:00:00Z"}, {"id": 18702, "detail": "", "company": "Vacom Joint - stock company", "end_time": "2014-06-30T00:00:00Z", "industry": "Other", "position": "Developer", "conf_score": 0.9242015051317842, "start_time": "2012-02-01T00:00:00Z"}, {"id": 18703, "detail": "", "company": "Gameloft", "end_time": "2012-01-31T00:00:00Z", "industry": "High Technology", "position": "QA Game Tester", "conf_score": 0.9242015051317842, "start_time": "2011-09-01T00:00:00Z"}, {"id": 18704, "detail": "Job duties:\nPlay the game on the mobile, find the bugs. Write the description about these bugs.", "company": "Gameloft", "end_time": "2011-12-31T00:00:00Z", "industry": "High Technology", "position": "Mobile Game Tester", "conf_score": 0.8275107295019075, "start_time": "2011-09-01T00:00:00Z"}, {"id": 18705, "detail": "", "company": "HTsoft", "end_time": "2011-08-31T00:00:00Z", "industry": "Other", "position": "Technical Staff", "conf_score": 0.9242015051317842, "start_time": "2011-05-01T00:00:00Z"}], "address": null}