{"skills": ["linux", "stack", "strut", "couchdb", "docker", "payment", "load balancing", "tomcat", "java", "json", "jboss", "c++", "javascript", "jwt", "java language", "management", "mobile project", "banking", "java core", "postgresql", "project planning", "sql database", "jquery", "human resources", "swing", "git", "hard working", "j2ee", "svn", "analysis", "redis", "message broker", "spring", "rabbitmq", "microservices", "ajax", "education technology", "android", "cache", "nginx", "linux system", "website development", "sql", "lifecycle", "css", "electronic control", "restful", "php", "teaching and learning", "ejb", "github", "software development", "reactjs", "meteorjs", "laravel", "advanced java", "system design", "oracle", "database", "orm", "class", "jsp", "hibernate", "problem solving", "full stack development", "process management", "bootstrap", "angularjs", "mysql", "html"], "fulltext": "           Nguy\u1ec5n Ph\u1ea1m Ti\u1ebfn Thanh \n              Senior Full-Stack Developer  \n                  Aipacific VN  \nExperience \n7 years of total experience \nFeb 2018 - \nPresent \nSenior Full-Stack Developer \nAipacific Vn Co.Ltd., | Ho Chi Minh City, Vietnam \nSpecialization \nIT/Computer - Software \nRole \nSenior Full-Stack Developer  \n1. Building HIS , HR (Human Resource) Website with React. (Join in \nanalysis , design , coding \u2026)  in 6 month  with Reactjs. \n2. Take control and develop new features for Backend Core (using \nPure PHP , laravel framwork). \n- \nThis core building follow microservices parttern (JWT, SSO, \nGATEWAY, \u2026.) \n- \nUsing Message Broker (RabbitMq) handling message between \nservices. \n- \nUsing Redis for logging cache, JWT token. \n- \nNginx for load balancing. \nOther study tech trends  \n     (Graphsq, docker,..) \nJan 2016 \u2013 Jan \n2018 \nFull Stack Developer \nSprite Communication Co.Ltd., | Ho Chi Minh City, Vietnam \nIndustry \nComputer / Information Technology \n(Software) \nSpecialization \nIT/Computer - Software \nRole \nSoftware Engineer/Programmer \n1. Mobile Project: \nAndroid App \nMQS (Medical  Question System) \n   + Help customer  and employee fill patient info and send data \nto server. \nIOS App \nHTA (Health-Track-Application) \n    + Extract data from Apple Health app and sync data to server. \nhttps://itunes.apple.com/us/developer/sprite-inc/id1215161225 \nDuties and Responsibilities: \n    + Analysis requirements and join in design system. \n    + Project configurations \n    + Develop core modules, common functions \n    + Plan, schedule, technical problem solving and process \nmanagement \n    + Extract data from Apple Health app and sync data to server. \n2. MHS (Mewca Health System) : Java web application  for upload \nand control application in Medical) \nDuties and Responsibilities: \n+ Contribute in all phases of software development lifecycle. \n+ Ensure design are in compliance with specifications. \n+ Ensure the best possible performance quantity and \nresponsiveness of the applications. \n+ Support continuous improvement by investigation alternative \nand technologies and presenting these for architectural review. \n+ Project configurations \n + Project planning and process management \n + Build test plan, test case \n + Support members \n + Transfer business of project to other members \n + Configuration environment development \n + Build test case \nSkills: \n- Client web technologies: HTML, CSS, Jquery, AJax, \nBootstrap, CanJs, AngulaJs \n-  Bath Job Using Quartz. \n-  Java web frameworks: Spring, Struts, ZK \n-  Java core, J2EE (JSP, JSTL, EJB, JPA), Swing \n-  ORM: Hibernate, iBatis \n-  SQL databases: Oracle, MySQL, Postgresql, MS SQL \n-  Report tools: Jasper Reports \n-  Experience in configure web server: Tomcat, Jboss \n- Experience in working web service (Restful service, SOAP \nservice) \n-  Source control: SVN, Git \n- \nMeteorJS (JavaScript web framework) \n- \nStrong problem-solving and analytical skills. \n3. Open source Project: \n+ OHIF Viewer (Open Health Imaging) : customise and build software \nfor medical imaging applications. \n- \nhttps://github.com/OHIF/Viewers/wiki \n4. More Skills: \n- \nNodejs (Intermediate), Laravel (php) framework (Intermediate). \n- \nLinux system (intermediate). \nMay 2015 - \nJan 2016 \nJava Developer \nKomtek Joint Stock Company | Ho Chi Minh City, Vi | Ho Chi Minh City, \nVietnam \nIndustry \nComputer / Information Technology \n(Software) \nSpecialization \nIT/Computer - Software \nRole \nSoftware Engineer/Programmer \n1.MOR \u2013 Mobile Order System \nDuties and Responsibilities: \n  + Analysis requirement and join in design system \n  + Project configurations \n  + Develop core modules, common functions \n  + Planning, schedule , technical problem solving and process   \nmanagement \n2.  SmartTag System: (Payment without money just using card) for \npupil and student. \nIn this Project my works are: \n+Java web developer \n+ Issues and give solution \n+ Build test plan, test case \n+ Support members \n+ Transfer business of project to other members \n+ Configuration environment development \n+ Contact with Japan team \n+ Build test case \n+ Report to leader \n+ Project configurations \n+ Project planning and process management \nSkills: \n- Java web frameworks: Spring, Struts, ZK \n- Java core, J2EE (JSP, JSTL, EJB, JPA), Swing \n-  ORM: Hibernate, iBatis \n- SQL databases: Oracle, MySQL, Postgresql, MS SQL \n- BI tools: Jasper Reports \n- Experience in configure web server: Tomcat, Jboss \n- source control with: SVN \n- Client web technologies: HTML, CSS, Jquery, AJax, Bootstrap, CanJs, \nAngulaJs \n- Bath Job Using Quartz. \nJan 2014 - \nApr 2015 \nJava Developer \nFPT Software | Ho Chi Minh City, Vietnam \nIndustry \nComputer / Information Technology \n(Software) \nSpecialization \nIT/Computer - Software \nRole \nSoftware Engineer/Programmer \nPosition Level \nJunior Staff \nFPT Software developer : From February-2014 until Now: Java Developer \nin electronical Japan project. - At this Position I have experience with \nstudy Component design, Detail design, knowledge about Oracle \nDatabase and using it for my work. \nProject Join In: \nElectronic Control System: (Create web Service and Web Base for \nJapanese Electronic System)  \nIn this Project my works are: \n+Java web developer \n+Issues and give solution \n+Build test plan, test case \n+Transfer business of project to other members \n+Configuration environment development \n+Contact with Japan team \nSKILL: \nJAVA \nWeb Programming: Servlet, Jsp.Strut, Hibernate, Tile Framework. \nWeb Design: \nHtml, Css, JavaScript, Jquery,Ajax, Jackson Json Web. \nDATABASE: \nOracle Database \nNov 2012 - \nNov 2013 \nC/C++ . Net debug and support Error in ATM System \nMicrotec VietNam \nIndustry \nComputer / Information Technology \n(Software) \nSpecialization \nIT/Computer - Software \nRole \nSoftware Architect \nPosition Level \nJunior Staff \n-Support bank in operating and developing application. \nC/C++ . Net debug and support Error in ATM System. \n- At this Position I have a change to learn more about Banking system, \ntransactions.  \n- Get Requirements and analysis customer needs for new products. \nEducation \n2012 \nTechnology Education University \nBachelor's Degree in Computer Science/Information Technology | \nVietnam \nMajor \nSoftware \nGrade \nGrade B/2nd Class Upper \nSkills \nAdvanced \nJava Language \nIntermediate \nC/C++, Nodejs, AngularJS, CouchDB \nLanguages \nProficiency level: 0 - Poor, 10 - Excellent \nLanguage  Spoken   Written \nEnglish  8      8 \nAdditional Info \nPreferred Work \nLocation \nHo Chi Minh City \nOther \nInformation \nThrough training in good teaching and learning environment (High Quality Center of \nTechnology Education University). I\u2019m very self-confident that my skills and hard-working \nattitude will make a valuable contribution into profitability of the company. Besides, I\u2019m \nalways willing to encounter the challenging because I strongly believe: \u201cThere is nothing \nimpossible for those who have strong will\u201d. \nAbout Me \nAge \n29 years \nTelephone Number (+84) 0935520696 \nAddress \nHCM, Ho Chi Minh City, Vietnam \nNationality  Vietnam \nREFERENCE \n1. T\u1eeb Tuy\u1ebft H\u1ed3ng Major Teacher - HCM University of Industry Phone: 01683241452 \nEmail: hongts@gmail.com \n2. \u0110\u1ed7 Ch\u00ed linh Senior Sofware - Microtec VN Phone:0908408685 \nEmail:  linhdc@microtecweb.com \n3. Nguy\u1ec5n Th\u1ecb B\u00edch Ng\u1ecdc Project Manager - Paytek VN Phone:0983468450 \nEmail:  ngocnt@paytek.com.vn ", "educations": [{"id": 5600, "gpa": null, "major": "C\u00f4ng ngh\u1ec7 k\u1ef9 thu\u1eadt m\u00e1y t\u00ednh", "school": "Technology Education University", "diploma": "Bachelors", "end_time": "2012-01-01T00:00:00Z", "conf_score": 0.8629995177138599, "start_time": null, "picklist_major": "IT - Hardware/Networking", "major_categories": "M\u00e1y t\u00ednh v\u00e0 c\u00f4ng ngh\u1ec7 th\u00f4ng tin", "major_categories_detail": "M\u00e1y t\u00ednh"}], "experiences": [{"id": 18718, "detail": "Building HIS , HR (Human Resource) Website with React. (Join in analysis , design , coding ...) in 6 month with Reactjs. 2. Take control and develop new features for Backend Core (using\nPure PHP , laravel framwork).\n- This core building follow microservices parttern (JWT, SSO, GATEWAY, ....) - Using Message Broker (RabbitMq) handling message between services.\n- Using Redis for logging cache, JWT token.\n- Nginx for load balancing.\nOther study tech trends\n(Graphsq, docker,..)", "company": "Aipacific Vn Co.Ltd.,", "end_time": "2023-04-13T00:00:00Z", "industry": "Other", "position": "Senior Full - Stack Developer", "conf_score": 0.8017746558750214, "start_time": "2018-02-01T00:00:00Z"}, {"id": 18719, "detail": "| Ho Chi Minh City, Vietnam Industry Computer / Information Technology (Software) Specialization IT/Computer - Software Role Software Engineer/Programmer 1. Mobile Project: Android App MQS (Medical Question System) + Help customer and employee fill patient info and send data to server.", "company": "Sprite Communication Co.Ltd.,", "end_time": "2018-01-31T00:00:00Z", "industry": "Other", "position": "Full Stack Developer", "conf_score": 0.8280054682797672, "start_time": "2016-01-01T00:00:00Z"}, {"id": 18720, "detail": "1.MOR - Mobile Order System Duties and Responsibilities: + Analysis requirement and join in design system\n+ Project configurations\n+ Develop core modules, common functions\n+ Planning, schedule , technical problem solving and process management\n2. SmartTag System: (Payment without money just using card) for pupil and student.\nIn this Project my works are:\n+Java web developer\n+ Issues and give solution\n+ Build test plan, test case\n+ Support members\n+ Transfer business of project to other members\n+ Configuration environment development\n+ Contact with Japan team\n+ Build test case\n+ Report to leader\n+ Project configurations\n+ Project planning and process management\nSkills: - Java web frameworks: Spring, Struts, ZK - Java core, J2EE (JSP, JSTL, EJB, JPA), Swing - ORM: Hibernate, iBatis - SQL databases: Oracle, MySQL, Postgresql, MS SQL - BI tools: Jasper Reports - Experience in configure web server: Tomcat, Jboss - source control with: SVN - Client web technologies: HTML, CSS, Jquery, AJax, Bootstrap, CanJs, AngulaJs - Bath Job Using Quartz.", "company": "Komtek Joint Stock Company", "end_time": "2016-01-31T00:00:00Z", "industry": "Other", "position": "Java Developer", "conf_score": 0.8674269736457648, "start_time": "2015-05-01T00:00:00Z"}, {"id": 18721, "detail": "Computer - Software Role Software Engineer/Programmer Position Level Junior Staff", "company": "FPT Software", "end_time": "2015-04-30T00:00:00Z", "industry": "High Technology", "position": "Java Developer", "conf_score": 0.7819953080416622, "start_time": "2014-01-01T00:00:00Z"}, {"id": 18722, "detail": "-Support bank in operating and developing application.\nC/C++ . Net debug and support Error in ATM System. - At this Position I have a change to learn more about Banking system, transactions.\n- Get Requirements and analysis customer needs for new products.", "company": "Microtec VietNam", "end_time": "2013-11-30T00:00:00Z", "industry": "Other", "position": "Software", "conf_score": 0.8674269736457648, "start_time": "2012-11-01T00:00:00Z"}], "address": "Hcm, Ho Chi Minh City, Vietnam"}