{"skills": ["linux", "stack", "aws", "angular", "flutter", "docker", "mongo", "javascript", "graphql", "cloud", "c#", "mongodb", "search engine", "gitlab", "unit test", "security", "elasticsearch", "git", "svn", "analysis", "html", "typescript", "search", "asp", "kendo ui", "website development", "sql", "css", "nunit", "software development", "mvc", "reactjs", "database", "dart", "apollo", "problem solving", "jest", "mysql", "jquery"], "fulltext": "L\u00e2m \u0110\u1ea1o C\u01b0\u1eddng - Senior Software Developer  \n|\n | Ho Chi Minh City, Viet Nam \nSummary  \nPassionate Software Engineer with 8+ years of experience, especially in .NET, NodeJS stack and Web \nDevelopment. Able to work with team or myself perfectly to develop features and resolve problems. \nWilling to learn and adapt new technology to the work and sharing with others is my happiness. \nSkills & Abilities  \n# Languages: C#, HTML, CSS, JavaScript, TypeScript, Dart, NodeJS. \n# Databases: MS SQL, MySQL, Mongo DB. \n# Unit test: Jest, Nunit, Xunit. \n# Cloud: AWS (S3, CloudFront, Lambda, EC2, Elasticsearch ...). \n# Source Control: GIT, SVN. \n# Business: Ecommerce, Search Engine, Logistics. \n# Security thinking, problem solving, debugging. \n# Independent and team working.  \nExperience  \nECOE, Ho Chi Minh City, January \u2013 2019 - present. \nSenior software engineer  \nECOE is start-up company provide a website and  platform for realstate brokers. \nActivities:  Analysis requirement, code feature search utilities, set up CI/CD for NodeJS (Backend - \nServer), research and trainning team about GraphQL Apollo (Server \u2013 Client).  \nAchievements: Learn about ReactJS, GraphQL Apollo. \nMain technologies:  NodeJS, ReactJS. \nEsilicon Corporation, Ho Chi Minh City, March 2016 \u2013 2019. \nSenior software engineer  \nActivities:  Worked as Full Stack Engineer, maintained and resolved performance Web application using \nNodeJS, Angular 7, React JS, MySQL, MongoDB. Setup CI/CD using GitLab. \nAchievements: Learn about Flutter, Linux, Node JS, React JS, Docker. \nMain technologies: NodeJS, ReactJS, Flutter. \nSilicon Prime, 2012 \u2013 2016 \nSenior Full-stack Web Developer  \nActivities: Develop company and customer website. \nAchievements: ASP.Net MVC (3-4-5), HTML, JavaScript, Kendo UI, jQuery. \nMain technologies: ASP.Net MVC, SQL, jQuery. \nEducation : \nSai Gon Technology University: Bachelor of Software Engineering 2007 \u2013 2011. \nAptech Academy Certificate: 2010 \u2013 2012. \nLanguages:  \nEnglish, Vietnamese. ", "educations": [{"id": 5601, "gpa": null, "major": "K\u1ef9 thu\u1eadt ph\u1ea7n m\u1ec1m", "school": "Sai Gon Technology University", "diploma": "Bachelors", "end_time": "2011-01-01T00:00:00Z", "conf_score": 0.8211412546833458, "start_time": "2007-01-01T00:00:00Z", "picklist_major": "IT - Hardware/Networking", "major_categories": "M\u00e1y t\u00ednh v\u00e0 c\u00f4ng ngh\u1ec7 th\u00f4ng tin", "major_categories_detail": "M\u00e1y t\u00ednh"}], "experiences": [{"id": 18723, "detail": "ECOE is start-up company provide a website and platform for realstate brokers.\nActivities: Analysis requirement, code feature search utilities, set up CI/CD for NodeJS (Backend - Server), research and trainning team about GraphQL Apollo (Server - Client). Achievements: Learn about ReactJS, GraphQL Apollo. Main technologies: NodeJS, ReactJS.", "company": "ECOE", "end_time": "2023-04-13T00:00:00Z", "industry": "Other", "position": "Senior software engineer", "conf_score": 0.9330320967770662, "start_time": "2019-01-01T00:00:00Z"}, {"id": 18724, "detail": "Activities: Worked as Full Stack Engineer, maintained and resolved performance Web application using\nNodeJS, Angular 7, React JS, MySQL, MongoDB. Setup CI/CD using GitLab. Achievements: Learn about Flutter, Linux, Node JS, React JS, Docker. Main technologies: NodeJS, ReactJS, Flutter.", "company": "Esilicon Corporation", "end_time": "2019-01-31T00:00:00Z", "industry": "Other", "position": "Senior software engineer", "conf_score": 0.9330320967770662, "start_time": "2016-03-01T00:00:00Z"}, {"id": 18725, "detail": "ctivities: Develop company and customer website.\nAchievements: ASP.Net MVC (3-4-5), HTML, JavaScript, Kendo UI, jQuery. Main technologies: ASP.Net MVC, SQL, jQuery.", "company": "Silicon Prime", "end_time": "2016-01-31T00:00:00Z", "industry": "Other", "position": "Senior Full - stack Web Developer", "conf_score": 0.8166249114202191, "start_time": "2012-01-01T00:00:00Z"}], "address": "Ho Chi Minh City, Viet Nam"}