{"skills": ["java", "testing", "kafka", "internet", "spring mvc", "ejb", "mysql", "business rule", "oracle", "redux", "io", "angular", "sql", "clarify", "elasticsearch", "strut", "banking", "spring boot", "mobile testing", "react native", "mvc", "ams", "enterprise", "hibernate", "software development", "android", "rest", "spring"], "fulltext": "HOANG XUAN HUONG\nQuan 2, TP.HCM, Viet Nam\nWORK EXPERIENCE\nINNOTECH VIETNAM\nSENIOR SOFTWARE ENGINEER\n2018 - NOW\nProject Name: Tyme Digital Banking\nClient From: South Africa\nDescription: Build application for Internet and Mobile Banking\nTechnical\n-Web Service, Microservice\n-Spring boot, JPA, Elasticsearch,Kafka\n-MySQL,Oracle\nMain responsibilities:\n- Developing and maintaining the back-end functionality of system.\n- Participating in discussions with Po,BA to clarify what they want.\n- Designing patterns for project if required.\n- Contacting external team to confirm info of requirement.\n- Coding review.\n- Document Service.\nOMART VIETNAM\nBACKEND TEAM LEADER\n2017 - 2018\nProject Name: e-commerce\nClient From: Vietnam\nDescription: application for e-commerce, Web,Mobile\nTechnical\n-Web Service\n-Spring boot.JPA,Twilio, Fire Base,Elasticsearch,Google API Services\n-My SQL\nMain responsibilities:\n-I am responsible a development REST API backend.\n- Document API for integrate with Front-end Web and Mobile.\n-Testing Service\n-Code review\n-Make sure deliver on time to production.\nCSC VIETNAM (DXC VIETNAM)\nSENIOR SOFTWARE ENGINEER\n2014 - 2017\nProject Name: SAP Portal Java\nClient From: Canada\nDescription: enterprise portal for aircraft manufacturing industry\nTechnical:\n- Web Dynpro Java 7.4\n- Hibernate, JPA, EJB\n- DB: Oracle\nMain responsibilities:\n-Upgrade to new version base on available application\n-Interaction and Communication with onshore team\n-Help other members to keep up with the software development\nprogress\nProject Name: TLS\nClient From: Singapore\nDescription: Telecoms licensing system of Singapore government\nTechnical:\n-Struts 1,2\n-IBatis\n-Server: Weblogic\n-DB: Oracle\nMain responsibilities:\n-Development and enhancement from existing application\n-Maintain application after release.\n-Help other members fix bug.\n- Working with QC team and report task to project manager.\nProject Name: MOH\nClient From: Singapore\nDescription: Ministry of Health Singapore government\nTechnical:\n-Spring Boot Web Service Restfull API, JPA, Hibernate.\n-Angular 1 (front-end)\n-Server: Weblogic\n-DB: Oracle,H2 for dev\nMain responsibilities:\n-Development from Scratch base on requirements from QA.\n- Working with BA,QC to clarify requirement from onshore team.\n-Receive feedback from QC,QA to update requirement, fix bug if\nneeded\n- Review business rules from other member after completed\n- Reporting task to project manager\nProject Name: FROG ASIA\nClient From: Malaysia\nDescription: Building Highly Education Application\nTechnical:\n-React Native\n-Redux\n-Run on IOS and Android device\nMain responsibilities:\n- Development from Scratch base on requirements from onshore.\n- Working directly onshore team to clarify requirements\n-Report task to onshore leader.\nEWI VIETNAM\nJAVA DEVELOPER\n2013 - 2014\nProject Name: PTUS\nClient From: US\nDescription: enterprise portal for plastic industry\nTechnical\n- Restfull Web Service Spring, MVC\n- Hibernate\n- Sencha Ext JS (front-end)\nMain responsibilities:\n-implement task assigned from team leader.\n-fix bug and remain the existing source.\n-reporting task to leader.\nEDUCATION\nBINH DUONG UNIVERSITY\nMAJOR: SOFTWARE ENGINEER\n2019 - 2013\nCERTIFICATIONS\n2014\nTOEIC Certificate at IIG", "educations": [{"id": 5605, "gpa": null, "major": "SOFTWARE ENGINEER", "school": "BINH DUONG UNIVERSITY", "diploma": "Bachelors", "end_time": "2019-01-01T00:00:00Z", "conf_score": 0.9210088910403198, "start_time": "2013-01-01T00:00:00Z", "picklist_major": "Other", "major_categories": "", "major_categories_detail": ""}], "experiences": [{"id": 18737, "detail": "Project Name: Tyme Digital Banking Client From: South Africa Description: Build application for Internet and Mobile Banking Technical -Web Service, Microservice -Spring boot, JPA, Elasticsearch,Kafka -MySQL,Oracle Main responsibilities:\n- Developing and maintaining the back-end functionality of system.\n- Participating in discussions with Po,BA to clarify what they want.\n- Designing patterns for project if required.\n- Contacting external team to confirm info of requirement.\n- Coding review.\n- Document Service.", "company": "INNOTECH VIETNAM", "end_time": "2023-04-13T00:00:00Z", "industry": "High Technology", "position": "SENIOR SOFTWARE ENGINEER", "conf_score": 0.8721008510829966, "start_time": "2018-01-01T00:00:00Z"}, {"id": 18738, "detail": "Project Name: e-commerce\nClient From: Vietnam Description: application for e-commerce, Web,Mobile Technical -Web Service -Spring boot.JPA,Twilio, Fire Base,Elasticsearch,Google API Services -My SQL Main responsibilities:\n-I am responsible a development REST API backend.\n- Document API for integrate with Front-end Web and Mobile. -Testing Service -Code review\n-Make sure deliver on time to production.", "company": "OMART VIETNAM", "end_time": "2018-01-31T00:00:00Z", "industry": "Other", "position": "BACKEND TEAM LEADER", "conf_score": 0.8721008510829966, "start_time": "2017-01-01T00:00:00Z"}, {"id": 18739, "detail": "Project Name: SAP Portal Java Client From: Canada Description: enterprise portal for aircraft manufacturing industry\nTechnical: - Web Dynpro Java 7.4 - Hibernate, JPA, EJB - DB: Oracle Main responsibilities:\n-Upgrade to new version base on available application\n-Interaction and Communication with onshore team\n-Help other members to keep up with the software development progress\nProject Name: TLS Client From: Singapore Description: Telecoms licensing system of Singapore government\nTechnical: -Struts 1,2 -IBatis -Server: Weblogic -DB: Oracle Main responsibilities:\n-Development and enhancement from existing application\n-Maintain application after release.\n-Help other members fix bug.\n- Working with QC team and report task to project manager.\nProject Name: MOH Client From: Singapore Description: Ministry of Health Singapore government\nTechnical: -Spring Boot Web Service Restfull API, JPA, Hibernate. -Angular 1 (front-end)\n-Server: Weblogic -DB: Oracle,H2 for dev\nMain responsibilities:\n-Development from Scratch base on requirements from QA. - Working with BA,QC to clarify requirement from onshore team.\n-Receive feedback from QC,QA to update requirement, fix bug if needed\n- Review business rules from other member after completed\n- Reporting task to project manager\nProject Name: FROG ASIA Client From: Malaysia Description: Building Highly Education Application Technical: -React Native -Redux -Run on IOS and Android device\nMain responsibilities:\n- Development from Scratch base on requirements from onshore.\n- Working directly onshore team to clarify requirements\n-Report task to onshore leader.", "company": "CSC VIETNAM (DXC VIETNAM)", "end_time": "2017-01-31T00:00:00Z", "industry": "Other", "position": "SENIOR SOFTWARE ENGINEER", "conf_score": 0.9242175468478587, "start_time": "2014-01-01T00:00:00Z"}, {"id": 18740, "detail": "Project Name: PTUS Client From: US Description: enterprise portal for plastic industry\nTechnical - Restfull Web Service Spring, MVC - Hibernate - Sencha Ext JS (front-end)\nMain responsibilities: -implement task assigned from team leader.", "company": "EWI VIETNAM", "end_time": "2014-01-31T00:00:00Z", "industry": "Other", "position": "JAVA DEVELOPER", "conf_score": 0.9019817427519886, "start_time": "2013-01-01T00:00:00Z"}], "address": "Quan 2, Tp.hcm, Viet Nam"}