{"skills": ["window nt", "java", "ant design", "css", "c++", "git", "real time application", "finance", "credential", "firebase", "highcharts", "ant", "html", "reactjs", "linux", "mysql", "redux", "emberjs", "swing", "jquery", "window operating system", "selenium", "le", "sales", "java application", "macos", "javascript", "database", "mongo", "jdbc", "xml", "implementation", "react native", "bootstrap", "php", "operating system", "mongodb", "management", "trac"], "fulltext": "Hu\u1ef3nh Tr\u1ecdng Tho\u1ea1i\nEmail : huynhtrongthoai1997@gmail.com\n290C/50/40 Duong Ba Trac Street, Ward 1, District 8,\nMobile : +84366069945\nHo Chi Minh City, Vietnam\nEducation\n\u2022 HCMC University of Science\nHo Chi Minh City, Vietnam\nBachelor of Software Engineering - GPA: 7.9\nSep. 2015 \u2013 Sep. 2019\nSkills and Proficiencies\n\u2022 Languages: JavaScript, basic - Java, basic - PHP.\n\u2022 Web Frontend: ReactJS, Redux, React-Native, Front-end General, CSS/Less/Sass, Bootstrap, JQuery,\nEmberJS, Webpack, Highcharts, SVG.\n\u2022 Web backend: NodeJS, ExpressJS, SocketIO.\n\u2022 Databases: MySQL, MongoDB, Firebase.\n\u2022 Operating Systems: Windows NT, Linux, MacOS.\n\u2022 Source control:: Git, Bicbucket.\nExperience\n\u2022 KMS Technology\nHo Chi Minh City, Vietnam\nSoftware Engineer\nJune 2018 - Present\n\u25e6 Revegy: EmberJS, Java\nProject about the customer service sale for US clients.\nTeam size: 10\nResponsibilities:\n- Developed project\u2019s architecture and framework for implementation.\n- Completed the task assigned quickly and before the deadline.\n- Motivated and counseled project associates to develop skills and ensure positive performance\noutcomes.\n\u25e6 Ceterus: ReactJS, Redux, Ant design, SASS, PHP\nProject about the statistics in the field of finance for AU clients.\nTeam size: 5\nResponsibilities:\n- Be able to finish assigned tasks independently or with less guidance.\n- Stand out to be responsible for difficult and complex tasks.\n- Completed the task assigned quickly and before the deadline.\n- Help my teammates resolve their problems or questions.\nProjects\n\u2022 Comparison screenshot tool\nHTML, CSS, JavaScript, JQuery, Bootstrap, NodeJS, Selenium\n\u25e6 The goal of these tool is check the change of code as any so with previous version. This project is a Node\nJS project.\n\u2022\nPopulate Credentials Extension\nChrome extension JavaScript\n\u25e6 The goal of these tool is check username and password and automatically fill in the form on the\ncustomer\u2019s website list. This project is a JavaScript Chrome Extension project.\n\u2022 Grab Bike\nReactJS, NodeJS, Mongo\nhello@recruitery.co | 0886 006 304\n\u25e6 Apps to support users to book a motorbike and includes 4 main applications: users, drivers, locators,\nadministrators.\n\u25e6 Real-time applications when booking through socketIO library and mongoDB database.\n\u25e6 Link Demo: https://www.facebook.com/tieunais/videos/2135480920101423/\n\u2022 Currency Transactions Web\nReactJS, Redux, Ant Design, NodeJS, MongoDB\n\u25e6 The application supports users with the ability to trade currencies.\n\u2022 TOEIC admin web\nReactJS, Redux, Ant design\n\u25e6 The application supports the management of user accounts as well as TOEIC lessons and exams.\n\u2022  Others\n\u25e6 Television shop website: HandlebarsJS, NodeJS\n\u25e6 Bookstore website: HTML, CSS, Javascript, XML.\n\u25e6 Household registration book management application: Java Swing, Java JDBC.\n\u25e6 QuickLaunch: Win32 C++.\nAward\n\u2022 THACH THUC 2018\nUniversity of Science\nRunner up\nApril. 2018\n\u2022 KMS Hackathon\nKMS\nTop 3\nNovember. 2019\nhello@recruitery.co | 0886 006 304", "educations": [{"id": 5606, "gpa": "7.9", "major": "K\u1ef9 thu\u1eadt ph\u1ea7n m\u1ec1m", "school": "HCMC University of Science", "diploma": "Bachelors", "end_time": "2019-09-01T00:00:00Z", "conf_score": 0.8276224652027222, "start_time": "2015-09-01T00:00:00Z", "picklist_major": "IT - Hardware/Networking", "major_categories": "M\u00e1y t\u00ednh v\u00e0 c\u00f4ng ngh\u1ec7 th\u00f4ng tin", "major_categories_detail": "M\u00e1y t\u00ednh"}], "experiences": [{"id": 18741, "detail": "\u25e6 Revegy: EmberJS, Java Project about the customer service sale for US clients.\nTeam size: 10 Responsibilities: - Developed project\u2019s architecture and framework for implementation.\n- Completed the task assigned quickly and before the deadline.\n- Motivated and counseled project associates to develop skills and ensure positive performance outcomes.\n\u25e6 Ceterus: ReactJS, Redux, Ant design, SASS, PHP Project about the statistics in the field of finance for AU clients.\nTeam size: 5 Responsibilities: - Be able to finish assigned tasks independently or with less guidance.\n- Stand out to be responsible for difficult and complex tasks.\n- Completed the task assigned quickly and before the deadline.\n- Help my teammates resolve their problems or questions.\nProjects \u2022 Comparison screenshot tool\nHTML, CSS, JavaScript, JQuery, Bootstrap, NodeJS, Selenium \u25e6 The goal of these tool is check the change of code as any so with previous version. This project is a Node JS project.\n\u2022 Populate Credentials Extension Chrome extension JavaScript \u25e6 The goal of these tool is check username and password and automatically fill in the form on the customer\u2019s website list. This project is a JavaScript Chrome Extension project.\n\u2022 Grab Bike ReactJS, NodeJS, Mongo", "company": "KMS Technology", "end_time": "2023-04-13T00:00:00Z", "industry": "High Technology", "position": "Software Engineer", "conf_score": 0.8994817994166205, "start_time": "2018-06-01T00:00:00Z"}], "address": "290c/50/40 Duong Ba Trac Street, Ward 1, District 8,"}