{"skills": ["sourcetree", "java", "git", "json", "testing", "github", "firebase", "reactjs", "es6", "sqlite", "sql", "c#", "bug fixing", "javascript", "oop", "database", "math", "react native", "ams", "teamwork", "php", "android", "mongodb", "management", "restful"], "fulltext": "Vu Viet Hoang \n Github: https://github.com/\nhoangvv511 \nSUMMARY \nI am a 4th year student at UIT (University of Information Technology), my hobby is watching \nmovies and coding, I have a passion for moblie programming, especially with android because I \nalways want to be able to create close applications and help my friends and relatives in daily life. \nI also often find out about new languages and technologies, my ability to work in a team is \ngood and I also regularly help my teammates. \nTECHNICAL SKILLS \n\u2022Programming Languages:\n-\nJavaScript (ES6)\n- C#\n- Java\n\u2022Frameworks/ Platforms:\n-\nReact-Native / Reactjs / Nodejs\n-\nRestful API / JSON\n\u2022Database :\n-\nMS SQL\n- Firebase\n- MongoDB\n\u2022Others :\n-\nUnderstand OOP architecture\n-\nBasic Photoshop skill. Can do simple design: logo, banner\u2026\n\u2022Version Control:\n- Git\n- SourceTree\n\u2022Foreign Languages: English\n-\nDocument reading comprehension\n-\nBasic communication\n\u2022Soft Skills:\n-\nTime management\n- Teamwork\nEDUCATION \n  University of Information Technology (UIT)\nFrom 09/2015 to Now \n\uf0b7\nStudying Software Engineering.\uf020\n\uf0b7\nGPA : 7.43\uf020\nPROJECT AT UNIVERSITY \nHo Chi Minh City Blood Donation Center \n\uf0b7\nProject Description : A mobile application that helps people in Ho Chi Minh City keep up\nwith the latest blood donation news and help them register for blood donation.\n\uf0b7\nTeam Size : 3\n\uf0b7 Responsibilities:\n-\nDesign UI\n-\nBuild API get data from server\n-\nDevelop and bug fixing\nE-Math \n\uf0b7 Project Description : An application that helps students prepare for college mathematics \nexams efficiently, analyzes and evaluates exam results, and issues topics that need \nimprovement. \n\uf0b7 Team Size : 3 \n\uf0b7 Responsibilities: \n- \nBuild database with firebase and sqlite \n- \nAnalyze the exam data and return result statistics \n- \nDevelop and bug fixing \nMovie247 \n\uf0b7 Project Description : The mobile app helps people watch movies for free \n\uf0b7 Team Size : 3 \n\uf0b7 Responsibilities: \n- \nDesign UI \n- \nBuild API server using PHP \n- \nDevelop and testing \nEXPERIENCES \nUHOUSE                                                                                                                        From 03/2019 to Now \nPosition: Fresher \nProject: Dinogo \n\uf0b7 Project Description: Dinogo is an innovative, cutting-edge english learning app \nfocused on improving user\u2019s communicative english speaking and listening skill. \n\uf0b7 Team Size: 7 \n\uf0b7 Responsibilities:  \n- \nDesign UX/UI and implement the solution (both back-end and front-end) based \non the requirements  \n- \nDevelop game modules for learning skill \n- \nDevelop admin page to connect with API server \n \uf020\n\uf020", "educations": [{"id": 5612, "gpa": "7.43", "major": "K\u1ef9 thu\u1eadt ph\u1ea7n m\u1ec1m", "school": "University of Information Technology (UIT)", "diploma": "Bachelors", "end_time": "2023-04-01T00:00:00Z", "conf_score": 0.7625990117186952, "start_time": "2015-09-01T00:00:00Z", "picklist_major": "IT - Hardware/Networking", "major_categories": "M\u00e1y t\u00ednh v\u00e0 c\u00f4ng ngh\u1ec7 th\u00f4ng tin", "major_categories_detail": "M\u00e1y t\u00ednh"}], "experiences": [{"id": 18765, "detail": "Project: Dinogo Project Description: Dinogo is an innovative, cutting-edge english learning app focused on improving user\u2019s communicative english speaking and listening skill.\nTeam Size: 7 Responsibilities: - Design UX/UI and implement the solution (both back-end and front-end) based on the requirements\n- Develop game modules for learning skill\n- Develop admin page to connect with API server", "company": "UHOUSE", "end_time": "2023-04-13T00:00:00Z", "industry": "Other", "position": "Fresher", "conf_score": 0.9114124613063752, "start_time": "2019-03-01T00:00:00Z"}], "address": null}