{"skills": ["search", "java", "css", "git", "agile", "c++", "algorithm", "svn", "spring cloud", "tomcat", "structure", "j2ee", "provisioning", "reactjs", "using sap", "linux", "pyramid", "spring mvc", "mysql", "oracle", "log4j", "compute", "security", "eauthentication", "jquery", "nosql", "microsoft visio", "apache http server", "window operating system", "microsoft", "mobile device", "jboss", "activemq", "sql", "sell", "sap development", "c#", "strut", "javascript", "pki", "payment", "apache solr", "apache", "database", "spring boot", "ehcache", "xml", "nginx", "aws", "mvc", "docker", "cloud", "enterprise", "hibernate", "jenkins", "security solution", "programmatic buying", "operating system", "software development", "problem solving skill", "mongodb", "spring", "glassfish", "postgresql", "management", "data structure", "restful", "problem solving"], "fulltext": "Technical\nLead\nDAU NGOC\nNHAT\nCONTACTS\nOBJECTIVE\nNhat has gained the SAP Hybris certificate and has around 12 years of\nexperience in software development including experience with\ncomplex SAP Hybris framework projects enterprise e-commerce\nplatform, web technology of Java (J2EE), and web java frameworks:\nSpring (Spring MVC, Spring Boot, Spring Cloud), Struts (1,2), Tapestry. \nHe also has solid foundation in computer sciences: data structure,\nalgorithm and experience in working with many database systems\n(SQL, NoSQL), application servers. Moreover, being strong in problem-\nsolving skill and experience in researching and applying new\ntechnologies. He also can support and guide team members in\ntechnical parts of project.\ndaungocnhat@gmail.com\n +84 916801567\nHo Chi Minh city, VietNam\nEDUCATION\nUniversity of Natural Sciences\n2001-2006\n Bachelor of Information Technology\nTECHNICAL SKILLS\nLanguages            : Java, C#, C++ (Visual C++), JavaScript, XML,\nTML, CSS, NodeJs, ReactJs.\nDatabases            : Oracle, SQL Server, MySQL, PostgreSQL,\nMongoDB.\nTools                     : Eclipse, Atom, Microsoft Visio, iReport,\nDocker, JMeter, VisualVM, Wrk, SVN, Git.\nFrameworks /Libraries    : SAP Hybris, Spring (Spring MVC,\nSpring Boot, Spring Cloud), Struts (1,2), Tapestry, Liferay,\nHibernate, iBatis, Velocity, Apache Solr, Axis2, Jasper Report,\nQuartz, Log4J, Apache ActiveMQ, Ehcache, Vertx.\nWeb Servers              : Apache Http Server, Nginx, IIS.\nApplication Servers    : Tomcat Server, JBoss, Oracle Weblogic,\nlassfish.\nOperating Systems    :  Windows, Linux, Mac OS.\nCloud technologies    : AWS.\nMethodologies: Waterfall, RUP, Agile (Scrum).\nQUALIFICATIONS\nSAP Hybris Core Certified Developer\nSAP Hybris Commerce Certified\nDeveloper\nDau Ngoc Nhat - Technical Lead\nWORK EXPERIENCE\nApr 2019 \u2013 Present:        Knorex, HCMC, Vietnam \n     Technical Lead\nDec 2017 \u2013 Mar 2019      Engineer V-key HCMC, Vietnam \n     Senior Software \nJun 2012 \u2013 Dec 2017       Sequent Asia IT (SAI Digital), HCMC, Vietnam \n     Senior Java developer, Technical Lead\nSep 2011 \u2013 May 2012     Pyramid Consulting VN, HCMC, Vietnam \n     Senior Java developer\nDec 2008 \u2013 Jun 2011       NetBlue VN, HCMC, Vietnam \n     Senior Java developer\nMar 2008 \u2013 Nov 2008      Officience, HCMC, Vietnam  \n     Software developer\nOct 2006 \u2013 Feb 2008        FCGV, HCMC, Vietnam \n     Software engineer\nCareer Summary\nProfessional Experience\nProject: Adserving\nTechnical Lead\n Knorex\nSkill Set:\nJava/J2EE, Stripes, Wrk Vertx,\nJavaScript, AWS, AliCloud (Funcion\nCompute), Glassfish, MongoDB.\n Project Description\n Knorex\n       XPO as a demand-side platform (DSP) enables you to reach billions of\n       devices worldwide instantly. You can choose to target your audience\n       whether globally or locally, all via programmatic buying from private\n       marketplace and open ad exchanges in real-time. \n  Nhat\n       Leads on component \u201cAdserving\u201d. Receive request from any source to \n       render the ad and display for customer. Main tasks: \n  \u25e6     Planning, estimation for tasks in project.\n  \u25e6     Support  team member in technical. Responsible for technical part in\nproject.\n  \u25e6     Research and implement the solution for handling tracking restriction\nfrom ITP2 using browser fingerprint.\nProject Team Size: 5\n Project Description\n V-key\n     builds V-OS app is embedded in mobile devices so that it can protect\n     required mobile applications. And V-key based on V-OS in order to provide\n     security solutions (OTP, PKI, eKYC) for organizations (banks,\n     governments). \n Nhat\n     works in server components (authentication, provisioning, secured\n     messaging, eKYC dashboard, \u2026) of V-Key solutions. Main tasks: \n\u25e6     Fix bugs and resolve client\u2019s issues.\n\u25e6     Implement and research enhancements, new components and features\nfor company\u2019s product.\n\u25e6     Deploy server components to many different environments (application\nservers, databases).  And go to customer\u2019s place (data center) for troubleshoot,\nresolve production issues.\nProject Team Size: 10\nProject : Server Components\nSenior Software Engineer\nV-key\nSkill Set:\nJava/J2EE Spring (Spring MVC,\nSpring Boot, Spring Cloud),\nReactJs, Git, Jenkins, Linux,\nMac OS, Apache Http server,\nNginx, Apache Tomcat, Jboss,\nOracle Weblogic, Docker, Oracle,\nSQL server, MySQL\nDau Ngoc Nhat - Technical Lead\nSai Digital\nProject: Beauty Garage\nProject Team Size: 25\nTechnical Leader\n Project Description\n Build\nSkill Set:\n     e-commerce solution for Beauty Garage client using SAP Hybris platform\nJava/J2EE, Spring, SAP Hybris,\n (www.beautygarage.jp).This e-commerce is for spa industry and integrates\nApache Solr, Git, Jenkins, Linux,\n  with SAP ERP. It also has another site (Eyelash Garage) for making beauty\nApache Http server, Apache\n  with glasses.\nTomcat, AWS, MySQL.\n Nhat\n     Technical support, review code, assign tasks for members.\n\u25e6     Estimate, research, implement complex tasks in the project.\n\u25e6     And SAP ERP integration.\nSai Digital\nProject Team Size: 20\nProject: Razer\nTechnical Leader\n Project Description\n Build\nSkill Set:\n     e-commerce solution for Razer client using SAP Hybris platform. Focus in\nJava/J2EE, Spring Integration,\nintegration between Hybris and SAP ERP. Using Data Hub technology of\nRestful web services,\nHybris.\nHybris (Data hub, order process),\nGit, Linux.\nSai Digital\nAIL\nProject Team Size: 6-10\nSenior Developer\n Project Description\n Arvind\nSkill Set:\n     Limited (formerly Arvind Mills) is a textile manufacturer and the\nJava/J2EE, Spring (MVC)\nflagship company of the Arvind Group. Now Arvind want to leverage Hybris\nFramework, Hybris (ASM,\nplatform\u2019s capability to build an Omnichannel solution for their\nCSCockpit, payment gateway,\ne-commerce business.\nOCC), JQuery, Git, Message queue.\n Nhat\n\u25e6     Build message queue for Data Hub.\n\u25e6     Implement some steps in ASM mode, integrate with payment gateway.\n\u25e6     Modify features in CSCockpit.\nSai Digital\nEssilor\nProject Team Size: 25\nSenior Developer\n Project Description\n Essilor\nSkill Set:\n     has requested that SAI develop a Hybris B2C portal/website for their\nJava/J2EE, Spring (MVC)\ncustomer\nFramework, Hybris (Search,\nProvision. Provision wants to provide Australian Eye Care Professionals\nPrice, Tax, Checkout process,\n(ECPs) with an online channel to sell their products.\nEmailing, Order process), Apache\n Nhat\nSolr, Velocity, JQuery, SVN.\n\u25e6     Build solr search, customize checkout process, customize cart, customize\nprice and tax.\n\u25e6     Implement all email features, build order management module.\n\u25e6     And generate receipts and reports.\nDau Ngoc Nhat - Technical Lead\nSai Digital\nProject: Bookworld\nTechnical Leader\nSkill Set:\nHybris (CS Cockpit, Storefront UI),\nJava/J2EE Spring MVC Framework,\nJasper Report, GIT.\nProject Team Size: 6-10\n Project Description\n Build\n     wishes to move their current  sites (www.bookworld.com.au and\nwww.angusandrobertson.com.au) over into Hybris. There has been a platform\nRFP performed, where Hybris was chosen as the platform of choice.\n Nhat\n \u25e6     Implementing new features in CS Cockpit, customizing CS Cockpit to\nsupport many sites, customize Order tab in CS cockpit.\n\u25e6     Implement searching (product, customer, order) and voucher\nfunctionality in CS cockpit.\n\u25e6     Implement some features on storefront and export invoice for web site.\nDau Ngoc Nhat - Technical Lead", "educations": [{"id": 5614, "gpa": null, "major": "C\u00f4ng ngh\u1ec7 th\u00f4ng tin", "school": "University of Natural Sciences", "diploma": "Bachelors", "end_time": "2006-01-01T00:00:00Z", "conf_score": 0.9070453815216075, "start_time": "2001-01-01T00:00:00Z", "picklist_major": "IT - Hardware/Networking", "major_categories": "M\u00e1y t\u00ednh v\u00e0 c\u00f4ng ngh\u1ec7 th\u00f4ng tin", "major_categories_detail": "C\u00f4ng ngh\u1ec7 th\u00f4ng tin"}], "experiences": [{"id": 18771, "detail": "", "company": "Knorex", "end_time": "2023-04-13T00:00:00Z", "industry": "Other", "position": "Technical Lead", "conf_score": 0.9337469946298932, "start_time": "2019-04-01T00:00:00Z"}, {"id": 18772, "detail": "", "company": "Engineer V -", "end_time": "2019-03-31T00:00:00Z", "industry": "Other", "position": "Senior Software", "conf_score": 0.8037355716910508, "start_time": "2017-12-01T00:00:00Z"}, {"id": 18773, "detail": "", "company": "Sequent Asia IT (SAI Digital),", "end_time": "2017-12-31T00:00:00Z", "industry": "High Technology", "position": "Senior Java developer, Technical Lead", "conf_score": 0.8726327511848111, "start_time": "2012-06-01T00:00:00Z"}, {"id": 18774, "detail": "", "company": "Pyramid Consulting VN", "end_time": "2012-05-31T00:00:00Z", "industry": "Other", "position": "Senior Java developer", "conf_score": 0.8726327511848111, "start_time": "2011-09-01T00:00:00Z"}, {"id": 18775, "detail": "", "company": "NetBlue VN", "end_time": "2011-06-30T00:00:00Z", "industry": "Other", "position": "Senior Java developer", "conf_score": 0.8244845671362849, "start_time": "2008-12-01T00:00:00Z"}, {"id": 18776, "detail": "", "company": "Officience", "end_time": "2008-11-30T00:00:00Z", "industry": "High Technology", "position": "Software developer", "conf_score": 0.8244845671362849, "start_time": "2008-03-01T00:00:00Z"}, {"id": 18777, "detail": "", "company": "FCGV", "end_time": "2008-02-29T00:00:00Z", "industry": "Other", "position": "Software engineer", "conf_score": 0.8510267439550635, "start_time": "2006-10-01T00:00:00Z"}], "address": "Ho Chi Minh city, Vietnam"}