{"skills": ["linux", "aws", "tdd", "docker", "payment", "online teaching", "java", "c++", "implementation", "cloud", "c#", "sales", "mongodb", "linux administration", "management", "term loans", "banking", "unit test", "io", "kubernetes", "administration", "cakephp", "enterprise", "elasticsearch", "git", "svn", "html5", "project management", "redis", "mvc architecture", "enterprise sales", "medium", "android", "kanban", "switch", "management tool", "nosql", "website development", "sql", "restful", "accounting", "oop", "couchbase", "software development", "bug fixing", "mvc", "sphinx", "online education", "laravel", "golang", "database", "memcached", "sql query", "database design", "time tracking", "software development methodology", "streaming", "azure", "php", "agile", "mysql", "process description", "jquery", "accounting softwares"], "fulltext": "CURRICULUM VITAE \nPERSONAL DETAILS \n\u2022\nName: B\u00f9i \u0110\u00ecnh \u0110\u00e0n \n\u2022\nNationality: Viet Nam \n\u2022\nDate of Birth: 05-03-1989 \n\u2022\nSex: Male \n\u2022\nEmail: buidan.infotech@gmail.com                  \n\u2022\nAddress:  27B, 187/3 Phan Trong Tue Ward, Thanh Tri District, Ha Noi  \n\u2022\nMobile:  038 280 4344 \nEDUCATIONAL BACKGROUND \n\u2022\n8/2012 - Graduated with excellent level at Faculty of Information Technology, Ho Chi Minh City \nUniversity of Transport \n\u2022\nRepeatedly got scholarship in the academic years at the University \nPROFESSIONAL SUMMARY \n\u2022\nOver 10 years experience in web development and management. \n\u2022\nExperience in manage team around 5 - 12 members. \n\u2022\nGood communication in both English and Vietnamese. \n\u2022\nExperience in providing solution and architectural blueprints to team from requirements. \n\u2022\nExperience with web management tools: mockups, project managements. \n\u2022\nPractical experience building micro-service system \n\u2022\nPractical experience with CI/CD  \n\u2022\nGreat practical experience with cloud (AWS, GCP, Azure) \n\u2022\nExperience with big data and big traffic system. \n\u2022\nPractical experience with containers (Docker, Kubernetes, ...) \n\u2022\nPractical experience in review code of team members and make comment to improve quality. \n\u2022\nSolid knowledge of end-to-end web development using PHP, OOP and MVC architecture and \nMySQL, NoSQL.  \n\u2022\nExperience with service-oriented backend architectures (SOA) \n\u2022\nExperience with almost Php frameworks (Laravel, Yii, Ci, Cakephp, Zend, Phalcon, Kohana\u2026) \n\u2022\nPractical experience with Nodejs, websocket, WebRTC \n\u2022\nPractical experience with TDD, Unit Test \n\u2022\nExperience with Linux administration \n\u2022\nNoSql Expert such as (Mongodb, Redis, Couchbase) \n\u2022\nPractical experience building api using Restful web service or SOAP \n\u2022\nExperience working with payment, banking system. \n\u2022\nPractical experience with searching technology such as Elasticsearch, sphinx. \n\u2022\nExperience with agile software development methodologies like Scrum, Kanban \n\u2022\nDatabase design and optimize mysql sql queries to improve performance  \n\u2022\nSource control systems such as SVN, CVS, GIT \n\u2022\nClient and server-side performance optimisation techniques \n\u2022\nSolid knowledge of standards-based, accessible, cross-browser web development \n\u2022\nE-commerce / Payment Gateway integration \n\u2022\nExperience of development throughout the product life cycle from a performance point of view \n\u2022\nFront-end basic skills \n\u2022\nWriting clear documentation \n\u2022\nGood understand about other languages like Java, C#, C++, Golang \n\u2022\nGood understand about Android/iOS applications \n\u2022\nFast in troubleshooting/Bug fixing \n\u2022\nWilling to explore and learn new things and a good attitude \nWORKING HISTORY \n\u2022\n05/2010 - 05/2012: \nCompany: Netbiz \nPosition: Php Developer \nNetbiz is a company working in the outsourcing field. Consulting and implementation of systems for \ncustomers from the US, Europe, Australia, Singapore, Japan ... \n\u2022\n05/2012 - 09/2013:  \nCompany: VATGIA.COM  \nPosition: Team leader \nVatgia's top e-commerce system at that time.  \n\u2022\n09/2013 - 10/2016: \nCompany: HOCMAI.VN \n            Position: Head of the R&D department \n            HOCMAI is the leading enterprise sales in online education segment in Vietnam. \n\u2022\n10/2016 - 6/2017: \nCompany: OnOnPay \n            Position: Technical Leader \n            Ononpay is payment service application, provide an easy way to recharge, transfer money. \n\u2022\n6/2017 - Now: \n Company: HOTTAB \n            Position: Technical Leader \n            HOTTAB is focusing on F&B market. HOTTAB provide POS system with fully feature and reporting \nreal time. Beside that it also provide an online order platform for restaurants. \nPROJECTS \n\u2022\nMoneypenny - https://moneypenny.me  \nScope of project (Team Size: 8, time: 6 months) \nRole: Php Developer  \nTechnologies: Yii framework, jQuery, QueryUI, Payment Gateway Integration (Paypal,  Stripe) \n     Description:  \nIt is a combination of online accounting software for small and medium sized enterprises. \nIncluding online billing, project time tracking, storing customer information, online payment \nsupport. \n\u2022\nNetwork of free credit broker loans in the UK, US, AUS \nScope of project (Team Size: 4, time: 2 years) \nRole: Php Developer  \nTechnologies: Yii2, Restful Web-service, Soap Web-service, Third party Api integration, Jquery  \nIncluding pages: \nhttp://www.heartpaydays.com \nhttp://www.vivaloans.co.uk \nhttp://www.southfinance.co.uk \nhttp://www.loansumo.com \nhttp://www.vivapaydayloans.com.au \nhttp://www.bluesealoans.co.uk \nhttp://www.pinkyloans.com \nhttp://www.junglefinance.com \nhttp://www.verymerryloans.com \nhttp://www.prontopaydays.com \nhttp://www.cosmicloans.co.uk \nhttp://www.wisecarfinance.co.uk \nhttp://www.loankite.co.uk \nhttp://www.instantaneocredito.es \nhttp://www.fieryloans.co.uk \nDescription : \n      They are a series of websites for short-term loans in the UK. All user requests are handled by \none server and when receive a request the API has to find suitable sites to give loans and move \nuser to the site. Database systems with extremely large amounts. \nWearshare - http://wearshare.us/ \nScope of project (Team Size: 2, time: 6 months) \nRole: Php Developer  \nTechnologies: CodeIgniter, Facebook APIs,  Instagram APIs, Jquery, Back-ground process. \nDescription: \nIt is a website dedicated to taking pictures from a user's Facebook and Instagram combined with \nthe availability of user photos, which use technology to help users to edit their photos and then \ncombine them with together to create beautiful bracelets to share for everyone or for sale. \nChickisslove - http://chickisslove.com/ \nScope of project (Team Size: 3, time: 8 months) \nRole: Php Developer  \nTechnologies: CodeIgniter, MongoDb, Jquery. \nDescription: \nAn e-commerce project in the two markets are Malaysia and Singapore. \nLeemarine - http://www.leemarine.com \nScope of project (Team Size: 3, time: 8 months) \n\u2022\n\u2022\n\u2022\nRole: Php Developer  \nTechnologies: CodeIgniter, Jquery. \nDescription: \nThe website dedicated to the promotion, sale of vessels.  \nLoveoffice  - http://loveoffice.vn (Business Social Network) \nScope of project (Team Size: 8, time: 2 years) \nRole: Senior PHP Developer  \nTechnologies: Yii, Jquery, NodeJS, MongoDb, Couchbase, Memcached \nDescription : \nLoveOffice is a social network for the enterprise, helps managers can convey an idea, a direction \nto all staff quickly and efficiently. Help for internal communications, a company constantly go up \nand build company culture stronger. \nLoveOffice is a major project in both size and technology, however, are unfortunately it was not \nreally successful in Vietnam. After a test run time in Vietnam failed, VNT has decided to stop \nproviding services and switch to a different direction. \nNhanh http://nhanh.vn (Logistics system) \nScope of project (Team Size: 10, time: 2 years) \nRole: Senior PHP Developer \nTechnologies: Zend, Jquery, Memcached  \nDescription: \nRapid logistics system for the pricing of such sites: \nhttp://cucre.vn, http: //siki.vn,http: //iki.vn \nIn additional it is a product of warehouse management software available, with the ability to \nmeasure the amount of survival time, real-time transactions. Express really is a useful tool for \ncompanies that want to manage the size and logistics, money clearly. \nHocmai - hocmai.vn and Apps  \nScope of project (Team Size: 5, time: 2 years) \nRole: Technical Lead  \nTechnologies: Phalcon, Moodle, Jquery, Memcached, Video Streaming , Sphinx \nSpeakup.vn \nProject name: Speakup \nScope of project (Team Size: 4, time: 1 year) \nRole: Technical Lead  \n      Technologies: Yii, Redis, WebRTC, NodeJS, Jquery, Memcached, HTML5  \n     Speakup.vn is a platform for online teaching. It allows teacher and students interactive together         \n     via video conference, audio and white-board, where you can draw many objects or upload  \n     document. \nONONPAY System ( Web, Apps) \nProject name: ONONPAY \n\u2022\n\u2022\n\u2022\n\u2022\n\u2022\nScope of project (Team Size: 10, time: 2 year) \nRole: Technical Lead   \nTechnologies: Laravel, Memcached, Payment integration, Restful API \n\u2022\nHOTTAB System ( Web, Apps) \nProject name: HOTTAB \nScope of project (Team Size: 10, time: 3 year) \nRole: Technical Lead   \nTechnologies: Laravel, NodeJS, Memcached, Docker, Elasticsearch, Google Data Store, Micro \nservices.", "educations": [{"id": 5621, "gpa": null, "major": "C\u00f4ng ngh\u1ec7 th\u00f4ng tin", "school": "Ho Chi Minh City University of Transport", "diploma": "Bachelors", "end_time": "2012-08-01T00:00:00Z", "conf_score": 0.7202628000086111, "start_time": null, "picklist_major": "IT - Hardware/Networking", "major_categories": "M\u00e1y t\u00ednh v\u00e0 c\u00f4ng ngh\u1ec7 th\u00f4ng tin", "major_categories_detail": "C\u00f4ng ngh\u1ec7 th\u00f4ng tin"}], "experiences": [{"id": 18787, "detail": "HOTTAB is focusing on F&B market. HOTTAB provide POS system with fully feature and reporting real time. Beside that it also provide an online order platform for restaurants.", "company": "HOTTAB", "end_time": "2023-04-13T00:00:00Z", "industry": "Other", "position": "Technical Leader", "conf_score": 0.9378036466490914, "start_time": "2017-06-01T00:00:00Z"}, {"id": 18788, "detail": "Ononpay is payment service application, provide an easy way to recharge, transfer money.\n\u2022", "company": "OnOnPay", "end_time": "2017-06-30T00:00:00Z", "industry": "Other", "position": "Technical Leader", "conf_score": 0.9378036466490914, "start_time": "2016-10-01T00:00:00Z"}, {"id": 18789, "detail": "HOCMAI is the leading enterprise sales in online education segment in Vietnam.", "company": "HOCMAI.VN", "end_time": "2016-10-31T00:00:00Z", "industry": "Other", "position": "Head of the R&D department", "conf_score": 0.9378036466490914, "start_time": "2013-09-01T00:00:00Z"}, {"id": 18790, "detail": "Vatgia's top e-commerce system at that time.", "company": "VATGIA.COM", "end_time": "2013-09-30T00:00:00Z", "industry": "Other", "position": "Team leader", "conf_score": 0.9378036466490914, "start_time": "2012-05-01T00:00:00Z"}, {"id": 18791, "detail": "Netbiz is a company working in the outsourcing field. Consulting and implementation of systems for customers from the US, Europe, Australia, Singapore, Japan ...", "company": "Netbiz", "end_time": "2012-05-31T00:00:00Z", "industry": "Other", "position": "Php Developer", "conf_score": 0.937689568747385, "start_time": "2010-05-01T00:00:00Z"}], "address": "27b, 187/3 Phan Trong Tue Ward, Thanh Tri District, Ha Noi"}