{"skills": ["search", "serverless", "java", "css", "git", "typescript", "aws ec", "firebase", "desktop", "guidance system", "reactjs", "html", "kotlin", "redis", "dart", "signalr", "mysql", "metasploit", "io", "redux", "sqlite", "cloud messaging", "nosql", "sql", "sell", "elasticsearch", "c#", "javascript", "xamarin", "mongo", "laravel", "ecs", "react native", "mvc", "bootstrap", "docker", "flutter", "dynamodb", "cloud", "css framework", "php", "software development", "android", "computer science education", "socket io", "aws lambda", "aws", "restful"], "fulltext": "DINH TRUONG THAO NGUYEN\nSoftware Developer\nProfile\nWork with 5+ years experience in Computer Science\nLearn from others, improve and improve my skills\nEducation\nComputer Science | HCMC University of Technology\n09/2010 - 04/2015\nExperience\nFresher Developer | Techlove\n08/2015 - 12/2017\nMobile Developer | Beeknights\n01/2018 - 12/2018\nSoftware Developer | Devblock\n01/2019 - Present\nLanguages\nVietnamese - Native\nEnglish - Intermediate\nInterests\nMusic, Soccer\nSkill\nKotlin\nSocket io/ Signalr\nJava\nkkxL\nRestful API\nFirebase\nK\nredis\nxamarin android Y\nnosql\nReact native\nkXX\nredux\nNode.js\nXXu\nphp laravel\nGit\nk\nC/C+\nC#\ntkw\naws\nhtml\nxposed framework\ncss\nbootstrap\njavascript\nkttkt\ngoogle analytic\nreactivex\ntttuk\n.NET MVC\nsql\nKKXEL\nrealm/sqlite/room\nElastic Search\nKkkk*\nreactjs\nDocker\nKXLUG\ndart\ntypescript\nxkkk*\nFlutter\nttk\u1eadh\nkkkkt\nkkkk\nKKtK\ntKtLL\nXXLK\nKK\u1eee\u1eeeA\nKXLLL\nXXtt\ntkkt\nkKXUA\nKXLL\ntkttt\nKkAK\nttttt\nkktk\nProject\nProject\nPlatform/Technical\nDescription\nMetasploit Simulator\nC# Windows Form\nVisualize the Metasploit Console API\niTest\nHTML/CSS/Javascript/\nMultiple choice Test Online\nPHP/MySQL\nTopTrader\nAndroid Native\nTrading Contest\nWallet\nAndroid Native\nDownload Offer app and earn money\nNightingales\nXamarin Android\nThe app like Uber with same feature\n(For doctor and patient)\nAlarm App\nAndroid Native\nSet your morning alarm and wake up every day\nwith Manny Pacquiao calling you in the\nmorning! Fight with Manny Pacquiao to turn\nthe alarm off!\nhttps://play.google.com/store/apps/detail2id\n=sg.megapixel.manny.alarm\nVietnamworks\nAndroid Native\nJob Search\nhttps://lay.google.com/store/apps/details?.id\n=com.vietnamworks.vietnamworks\nStrawberry\nAndroid Native\nJob Search In Singapore\nDriver Guidance System\nAndroid Native\nAssist taxi drivers to locate the current demand\nof passengers near them\nhttps://play.google.com/store/apps/details2id\n=sg.edu.smu.dgs\nSony Demo App\nAndroid Native\nBuild utility with sensor for Sony device\nFake Device Info\nXposed Framework/C/C+\nHook everything in Android OS to fake device\ninformation.\nE-commerce Website\nHTML/CS/Javascript/Botstrap/Fi\nView and order shop's products easily within 3\nsteps without account.\nrebase/Algolia/\nSupport Desktop/Mobile/Tablet\nNodejs/Redis/AWS\nWebsite: htps://doraeshop.vn/\nDynamoDB/One Signal/TawkTo/\nMinify/Lazy\nLoading/GoogleAnalytic\nLuxstay\nReact Native\nSearch hotels & book easily\nedyzo\nNodeJS/Typescript/Docker/Mongo\nAn e-commerce system that help admin,\nDB/Redis/ElasticSearch/AWS\ncompany and user connecting easily\nEC2/AWS S3/Firebase Cloud\nMessaging\nERP app\nAndroid Native\nFul ERP Solution\nStark CI\nReact Native\nManage the worker and report daily\nOrigins\nNodeJS/Typescript/Docker/MySQL\nBuy/Sell medicine\n/AWS ECS/AWS Lambda Function\n(Serverless)", "educations": [{"id": 5620, "gpa": null, "major": "Khoa h\u1ecdc m\u00e1y t\u00ednh", "school": "HCMC University of Technology", "diploma": "Bachelors", "end_time": "2015-04-01T00:00:00Z", "conf_score": 0.9333149135004584, "start_time": "2010-09-01T00:00:00Z", "picklist_major": "IT - Hardware/Networking", "major_categories": "M\u00e1y t\u00ednh v\u00e0 c\u00f4ng ngh\u1ec7 th\u00f4ng tin", "major_categories_detail": "M\u00e1y t\u00ednh"}], "experiences": [{"id": 18784, "detail": "", "company": "Beeknights", "end_time": "2023-04-13T00:00:00Z", "industry": "Other", "position": "Software Developer | Devblock", "conf_score": 0.7130919161122453, "start_time": "2019-01-01T00:00:00Z"}, {"id": 18785, "detail": "", "company": "Beeknights", "end_time": "2018-12-31T00:00:00Z", "industry": "Other", "position": "Mobile Developer", "conf_score": 0.8967422729948165, "start_time": "2018-01-01T00:00:00Z"}, {"id": 18786, "detail": "", "company": "Techlove", "end_time": "2017-12-31T00:00:00Z", "industry": "High Technology", "position": "Fresher Developer", "conf_score": 0.8967422729948165, "start_time": "2015-08-01T00:00:00Z"}], "address": null}