{"skills": ["linux", "aws", "docker", "saltstack", "tomcat", "java", "chef", "cloud environment", "security policy", "iot", "json", "cloudformation", "apache", "cloud", "cli", "disaster recovery", "sysops", "eauthentication", "java language", "management", "database management", "bash scripting", "gitlab", "infrastructure service", "proxy", "aqua", "security", "salesforce", "administration", "window server 2012", "sql database", "provisioning", "git", "elasticsearch", "hard working", "svn", "version management", "devops", "birst", "redis", "cloudwatch", "operating system", "database management system", "ecs", "nosql", "nginx", "sql", "dba", "crs", "aws batch", "microsoft power bi", "auto scaling", "microsoft", "aws iam", "reactjs", "powerbi", "nagios", "laravel", "communication skill", "dynamodb", "database", "rhel", "jenkins", "problem solving skill", "python", "teamwork", "kibana", "sonarqube", "window server", "swagger", "api gateway", "problem solving", "php", "m sql server", "mysql", "scripting"], "fulltext": "RESUME \nAWS DevOps Engineer \nPERSONAL DETAILS \n\u25cf Name \nVu Van Cuong \n\u25cf Sex \nMale \n\u25cf Email \n\u25cf Phone \nEDUCATIONAL BACKGROUND \n\u25cf Information Technology \u2013 Ports and Telecommunications Institute of Technology, Hanoi. \n\u25cf Cumulative GPA: \n8.25/10 \nCERTIFICATES \n\u25cf Axway API Gateway Certified Associate \n\u25cf AWS Certified Solutions Architect \u2013 Associate Level \n\u25cf AWS Certified Solutions Architect \u2013 Professional Level \n\u25cf AWS Certified SysOps Administrator \u2013 Associate Level \nPROFESSIONAL SUMMARY \n\u25cf Can work independently, have faculty for work in teams and work under pressure well. \n\u25cf Team-oriented Cloud engineer with 5 years\u2019 experience in system and network \nadministration, managing server infrastructures and datacenter operations across \nmultiple platforms (Linux, Windows). \n\u25cf Deep experience with many AWS services such as EC2, S3, DynamoDB, RDS, IAM, \nCloudFormation, SQS, SNS, CloudWatch, and other AWS components as Elastic IPs, \nEBS, ELB, Security Groups, . \n\u25cf Architected, Designed and Developed the Backup and Archiving, Disaster Recovery in \nAWS Cloud. \n\u25cf Hands on experience in development of utilities using Bash scripting and Python \nscripting to automate processes. \n\u25cf Good English communication. \n\u25cf Soft skills: communication skills, problem-solving skills, time management abilities, \nteamwork skills. \n\u25cf Hard working, eager to learn. \n\u25cf Hobbies: Traveling, watching movies, listening to music, loving sports, especially \nfootball. \nVu Van Cuong\u2019s CV \nQualifications \n\u25cf Programming Languages: Java, Python, Shell script. \n\u25cf Programming Tools: Jetbrains IntelliJ, Jetbrains PyCharm, AWS CLI. \n\u25cf Database Management Systems: MS SQL Server, MySQL, NoSQL. \n\u25cf SVN, PuTTY, WinSCP, Git Bash, NginX, Apache Tomcat. \n\u25cf CloudWatch, Nagios, SaltStack, Chef, Jenkins. \nOPERATING SYSTEMS \n\u25cf Windows, RHEL, Amazon Linux \nPROFESSIONAL EXPERIENCE \nBA - Kakeibo \n2019/05 - Present \nObjectives \nDevelop web application for personal/family financial management likes \"Money \nlover\". We are responsible for building the application in AWS. \no Create High level design of application. \no Create Dockerfile to build application. \no Setup Jenkins server, Jenkins jobs. \no Use CI/CD to build, deploy Docker images to ECS clusters for backend. \nIntegrating Gitlab with AWS S3 and CodeCommit. \no Setup static web front end in S3 with source code is written in ReactJS. \no Centralize application logs to ElasticSearch, analyze logs and setup alert in \nKibana. \no Manage and configure CI/CD processes in AWS. \nCustomers \nFujinnotomo, Japan. \nTaken Role \nSolution Architect | DevOps Engineer \nTechnology \nEC2, ECS, Lambda, RDS Aurora \nGitLab, CodeCommit, CodeBuild, CodePipeline \nLaravel, PHP, Swagger, React \nCloudFormation \nElasticSearch, Kibana \nDocker \nInventory App \n2018/11 - 2019/02 \nObjectives \nConnected Car is global service, ECR/ECS versions, Lambda function's specs and \napp versions management is complicated among many AWS regions. Therefore \nwe need a tool to manage the information after every releasing app. \nVu Van Cuong\u2019s CV \no Build up a DynamoDB table to store data. \no Create Lambda function to trigger DynamoDB table stream then put data to \nElasticsearch. \no Secure Elasticsearch/Kibana authentication by using AWS Cognito. \no Integrating code to AWS CodePipeline, after every releasing code the \ninformation of ECR/ECS, Lambda function, app version will be updated to \na DynamoDB table. Then user can access to Kibana endpoint to check the \ninformation. \nCustomers \nHonda, Japan. \nTaken Role \nSolution Architect | DevOps Engineer  \nTechnology \nECR, ECS \nLambda \nDynamoDB, AWS ElasticSearch, AWS Cognito \nCloudFormation \nDocker \nMy Honda \u2013 Connected Car \n2018/07 - 2019/04 \nObjectives \nHonda has various IoT systems for their cars. We are responsible for \nproviding/provision AWS resources for collecting and processing data of IoT \ndevices. \no Use CI/CD (CodePipeline, CodeCommit, CodeBuild, S3) to provisioning \nAWS resources such as EC2 instances, ALB, SSM Parameters, AWS \nBatch, Lambda functions, RDS, ECR, ECS... in multiple AWS regions. \no Use CI/CD to build, deploy Docker images to ECS clusters (EC2 or \nFargate). \no Integrating Aqua MicroScanner to CI/CD process for Docker image \nvulnerability scanning. \no Create High level design and build up many applications on Cloud. \no Manage and configure CI/CD processes on AWS. \nCustomers \nHonda, Japan. \nTaken Role \nSolution Architect | DevOps Engineer  \nTechnology \nEC2, ECS \nCodePipeline, CodeCommit, CodeBuild \nBatch, Lambda \nCloudWatch, CloudFormation, CloudTrail, SNS \nAqua MicroScanner \nDocker \nEssent \n2015/05 - 2018/05 \nProjects \nAWS Manage Services \nVu Van Cuong\u2019s CV \nObjectives \nEssent is the largest energy company in Netherlands. They have many application \nvendors as well as applications running on multiple Cloud environments and on \npremise. Essent Infrastructure team is responsible to provide infrastructure service \nto many teams/vendors inside and outside Essent. \no Solving technical incidents/requests regarding to AWS Cloud and \napplication. \no Manage and configure web applications. \no Configure Squid proxy to whitelist urls. \no Create High level design, build up and migrate many applications on \nCloud: SDS, CRS, GDS, WUS, SonarQube \no Provision AWS resources: EC2, RDS, S3 buckets, IAM accounts, \nDynamoDB tables. \no Manage many RDS MySQL instances that stores energy data as a DBA: \ninsert, delete data, copy data between multiple RDS instances, manage \naccounts in databases. \no Manage SDS application that processes and stores energy data with many \ntechnologies: ELB, Auto Scaling Groups for EC2 instances, SQS, Redis, \nDynamoDB. Setup Data pipeline for backing up DynamoDB tables daily. \no Use SaltStack to configure, manage EC2 servers in Auto Scaling Groups. \no Write Python scripts to get data from DynamoDB tables as customer\u2019s \nrequest. \no Configure CloudFront with S3 bucket and Route53 for static content of \napplication. \no Monitor system 24x7, using CloudWatch combine with SNS to send \nnotifications of system. Setup Nagios to monitor multiple server\u2019s metrics: \nmemory, cpu, disk space, services\u2026 \nCustomers \nEssent, Netherlands. \nTeam size \n11 people \nTaken Role \nSolution Architect | Technical Support Engineer \nTechnology \nEC2 \nRDS, DynamoDB, ElastiCache, Data Pipeline \nS3 \nCloudWatch, CloudFormation, CloudTrail \nSQS, SNS \nRoute53 \nTrusted Advisor \nMytour \n2017/01 \u2013 2018/01 \nProjects \nMytour \nObjectives \nManage web applications on AWS that includes web servers, databases for \nmultiple environments. \nVu Van Cuong\u2019s CV \no Manage IAM accounts: create, delete, grant permissions\u2026 \no Manage VPN accounts with security policy for developers of Mytour \no Manage web servers: configure apache, write scripts to stop/start the \nservers as schedule based on demand. Provision new servers as \ncustomer\u2019s requirement. \no Manage Route53 records, AWS S3 buckets, RDS, use CloudFront to \nhost static files. \no Apply multi AZ for production DB to enhance availability and durability, \nuse Read Replica to enhance DB performance. \no Backup the databases manually/automatically. \no Copy tables, database among environments. \no Monitor system 24x7, using CloudWatch combine with SNS to send \nnotifications of system. \nCustomers \nMytour, Vietnam \nTeam size \n8 people \nTaken Role \nSolution Architect | Technical Support Engineer \nTechnology \nEC2 \nCloudWatch, SNS \nCloudFormation \nRDS MySQL \nS3 \nPavaso \n2016/01 \u2013 2017/07 \nProjects \nPavaso \nObjectives \nManage services for applications that runs in Windows platform, security \nmanagements. \no Manage AWS IAM accounts. \no Manage EC2 instances with Windows Server 2012 OS, IIS for web \nservers, ELB. Backup EC2 by creating AMI. \no Create Python scripts to check free disk space and send notifications \nfor servers. \no Manage RDS MS SQL databases, copy data between environments by \nusing RDS MS SQL native backup and restore. Create Python scripts \nfor checking free space of database. \no Manage Cloud HSM. \no Monitor system 24x7, using CloudWatch combine with SNS to send \nnotifications of system. \nCustomers \nPavaso, USA \nVu Van Cuong\u2019s CV \nTeam size \n8 people \nTaken Role \nSolution Architect | Technical Support Engineer \nTechnology \nEC2 \nCloudWatch, SNS \nCloudFormation \nS3, RDS MS SQL \nBI Reports \n2014/11 \u2013 2015/05 \nProjects \nBI Reports \nObjectives \nUsing Birst framework to create business intelligent reports with data source is \nretrieved from Salesforce. Write queries likes SQL statement in the reports. \nMigrate the reports from one framework to another one. \nAlso use Microsoft Power BI to build reports. \nCustomers \nCorSource, USA. \nTeam size \n5 people \nTaken Role \nDeveloper \nTechnology \nBirst framework, MS PowerBI \nSQL statements, JSON \nVu Van Cuong\u2019s CV ", "educations": [{"id": 5628, "gpa": "8.25", "major": "Technology", "school": "- Ports and Telecommunications Institute of Technology", "diploma": "Other", "end_time": null, "conf_score": 0.9034360976675423, "start_time": null, "picklist_major": "Other", "major_categories": "", "major_categories_detail": ""}], "experiences": [{"id": 18811, "detail": "Objectives Develop web application for personal/family financial management likes \"Money lover\". We are responsible for building the application in AWS. o Create High level design of application. o Create Dockerfile to build application. o Setup Jenkins server, Jenkins jobs. o Use CI/CD to build, deploy Docker images to ECS clusters for backend.\nIntegrating Gitlab with AWS S3 and CodeCommit. o Setup static web front end in S3 with source code is written in ReactJS. o Centralize application logs to ElasticSearch, analyze logs and setup alert in\nKibana. o Manage and configure CI/CD processes in AWS.", "company": "Kakeibo", "end_time": "2023-04-13T00:00:00Z", "industry": "Other", "position": null, "conf_score": 0.7206368052989944, "start_time": "2019-05-01T00:00:00Z"}, {"id": 18812, "detail": "ctions, RDS, ECR, ECS... in multiple AWS regions. o Use CI/CD to build, deploy Docker images to ECS clusters (EC2 or\nFargate). o Integrating Aqua MicroScanner to CI/CD process for Docker image vulnerability scanning. o Create High level design and build up many applications on Cloud. o Manage and configure CI/CD processes on AWS. Customers Honda, Japan.", "company": "My Honda - Connected Car", "end_time": "2019-04-30T00:00:00Z", "industry": "Other", "position": "Solution Architect", "conf_score": 0.8390147654104677, "start_time": "2018-07-01T00:00:00Z"}, {"id": 18813, "detail": "Technology EC2, ECS, Lambda, RDS Aurora GitLab, CodeCommit, CodeBuild, CodePipeline Laravel, PHP, Swagger, React CloudFormation ElasticSearch, Kibana Docker Inventory App", "company": "Kakeibo", "end_time": "2019-02-28T00:00:00Z", "industry": "Other", "position": "Solution Architect | DevOps Engineer", "conf_score": 0.6981244904084882, "start_time": "2018-11-01T00:00:00Z"}, {"id": 18814, "detail": "Technology EC2, ECS CodePipeline, CodeCommit, CodeBuild Batch, Lambda CloudWatch, CloudFormation, CloudTrail, SNS Aqua MicroScanner Docker Essent", "company": "My Honda - Connected Car", "end_time": "2018-05-31T00:00:00Z", "industry": "Other", "position": "Solution Architect | DevOps Engineer", "conf_score": 0.6981244904084882, "start_time": "2015-05-01T00:00:00Z"}, {"id": 18815, "detail": "Projects Mytour Objectives Manage web applications on AWS that includes web servers, databases for multiple environments.", "company": "Mytour", "end_time": "2018-01-31T00:00:00Z", "industry": "Other", "position": null, "conf_score": 0.6925429707670153, "start_time": "2017-01-01T00:00:00Z"}, {"id": 18816, "detail": "C2 by creating AMI. o Create Python scripts to check free disk space and send notifications for servers. o Manage RDS MS SQL databases, copy data between environments by using RDS MS SQL native backup and restore. Create Python scripts for checking free space of database. o Manage Cloud HSM. o Monitor system 24x7, using CloudWatch combine with SNS to send notifications of system.\nCustomers Pavaso, USA", "company": "Pavaso", "end_time": "2017-07-31T00:00:00Z", "industry": "Other", "position": "Solution Architect | Technical Support Engineer", "conf_score": 0.8366433756272724, "start_time": "2016-01-01T00:00:00Z"}, {"id": 18817, "detail": "Projects BI Reports Objectives Using Birst framework to create business intelligent reports with data source is retrieved from Salesforce. Write queries likes SQL statement in the reports.\nMigrate the reports from one framework to another one.\nAlso use Microsoft Power BI to build reports.\nCustomers CorSource, USA. Team size\n5 people\nTaken Role", "company": null, "end_time": "2015-05-31T00:00:00Z", "industry": "Other", "position": "BI Reports", "conf_score": 0.8482863380139747, "start_time": "2014-11-01T00:00:00Z"}], "address": null}