{"skills": ["linux", "stack", "aws", "angular", "css3", "internet", "symfony", "cryptocurrency", "wordpress", "json", "javascript", "phpstorm", "apache", "implementation", "bootstrap", "eauthentication", "mongodb", "xml", "management", "studio", "search engine", "banking", "blockchain", "io", "frontend development", "jquery", "vuejs", "git", "elasticsearch", "finance", "analysis", "mobile application", "redis", "online banking", "ajax", "operating system", "database development", "revenue analysis", "search", "maintenance", "javascript framework", "nginx", "sql", "css", "restful", "oop", "visual studio", "bug fixing", "mvc", "laravel", "system design", "socket io", "database", "orm", "database design", "teamwork", "appannie", "window operating system", "php", "mysql", "html", "system architecture"], "fulltext": "**************\nPHP DEVELOPER\nDate of birth:\n*******\nGender:  Male\nPhone:\n***********\nEmail:\n************.dh@gmail.com\nAddress:\n Hanoi, Vietnam\nWebsite:\nhttp://facebook.com/***111\nOBJECTIVE\nSeeking position of a PHP Developer where I can apply all of my knowledege I have gained during my\nsoftwave developing history and my passion aptitude.\nEDUCATION\nOct 2013 - May 2017\nITPLUS academy\nMajor: Software Engineer\nUniversity of Engineering and Technology(UET)\nMajor: Software Engineer\nSKILLS\nTechnical Skills:\n- PHP Framework:  Laravel, Codeigniter.. \n- PHP CMS: Wordpresss \n- Database: Mongodb, Mysql, Postgress, Sql, Redis.. \n- Javascript framework: JQuery, Nodejs, Express JS , Libary(Socket.IO , javascript .etc).\n- CSS: CSS, CSS3, SASS, Bootstrap \n- Web server: AWS, Apache, Nginx..\n- Operating Systems: Windows, Linux \n- Version control: Git- Tool / software: PhpStorm, Sublime text, Visual studio ... \n- Social API: Facebook, Goolge, Search engine elasticsearch...\nKey Skills:\n- I have almost 4 years experience as php developer.\n- Hands on experience in using Laravel / Codeigniter to develop aweb\napplication. \n- Good Work with HTML, CSS, JavaScript (Jquery, Ajax),\nBootstrap,JSON, XML \n- Understanding MVC Framework, ORM, RESTful,OOP, DesignPattern. \n- Hands on experience in developing the Restful API system. \n- Implementation / Maintenance Support in PHP and MySQL, Mongodb\n - Have knowledge,experience and master the MYSQL database. \n- Have knowledge about web server, can use nginxproficiency, apache. \n- Good in teamwork. \n- Database design suitable for requirements,optimized for performance. \n- Proficient in source code manage tools: GIT.\nWORK EXPERIENCE\nSeptember 2016 -\nNovember 2017\nHBLAB JSC\nPHP DEVELOP\n- Develop the Web Application based on PHP( Framework Laravel &\nSymfony ) & Mysql\n- Communicate directly to client for required\nNovember 2017 - Present\nNEXTTECH GROUP OF TECHNOPRENEURS (WETRADE\nCOMPANY )\nFULL STACK DEVELOP\n- Develop the Web Application based on PHP(Framework Laravel &\nCodeigniter ) & Mongodb , JS(Vuejs), Blockchain\n- Communicate directly to client for required\nDecember 2016 -\nNovember 2017\nweb application Butterfly\nPOSITION: PHP Developper\nCustomer: Japanese customers\nDescription: Real estate management application\nTeam size:2\nMy responsibilities: \n-Analysis and development\n-Development\n-Optimize code\n-Bug fixing\nTechnologies used: Symfony, Mysql, Jquery, Redis\nMarch  2017 - August 2017\nappannie spicemart(DMM)\nPOSITION: PHP Developper\nCustomer: Japanese customers\nDescription: Application of mobile application revenue analysis\nTeam size: 3\nMy responsibilities: \n-Analysis and design database\n-Development Frontend and Backend\n-Optimize code\n-Review code\n-Bug fixing\nTechnologies used: \n-Laravel, Mysql, Jquery, Angular Js, Redis\n-API from Appannie.com\nSeptember 2017 -\nNovember 2017\nHOMEPAGE COMPANY\nPOSITION: Wordpress Developper\nDescription: Homepage intro\nACTIVITIES\nTeam size:1\nMy responsibilities: \n-Analysis and development\n-Development\n-Optimize code\n-Bug fixing\nTechnologies used: Wordpress, PHP, Mysql, Jquery, Redis\n November 2017 - October 2018WEB application WETRADE.GLOBAL\nPOSITION: VUEJS and LARAVEL and CODEIGINTER Developper\n(Version 2 , 3 , 4(doing)), Nodejs, Socket.Io, Express JS ...\nDescription: Cryptocurrency trading platform\nTeam size:2\nMy responsibilities: \n-Systems architecture (Support)\n-Analysis and development\n-Development Frontend and Backend\n-Optimize code\n-Bug fixing\nTechnologies used: Vuejs, PHP, Codeigniter, Laravel , Mongodb,\nBlockchain, Socket io, Nodejs ...\nDetail demo product: https://wetrade.global\nNovember 2017 - Present\nWEB application VeRIME\nPOSITION: VUEJS and LARAVEL Developper(Version 1, 2))\nDescription: VeriME is a blockchain based Verification-as-a-Service that\nfacilitates easy and fast user authentication for merchants\nTeam size: 1\nMy responsibilities: \n-Analysis and development\n-Development Frontend and Backend\n-Optimize code\n-Bug fixing\nBlockchain\nDetail demo product: https://www.verime.mobi/\nFebruary 2018 - May 2018\nWEB application EGATE\nPOSITION: CODEIGINTER Developper\nDescription: Comprehensive solutions and services for Cryptocurrency.\nTeam size: 2\nMy responsibilities: \n-Analysis and development\n-Development Frontend and Backend\n-Optimize code\n-Bug fixing\nTechnologies used: Vuejs, PHP, Codeigniter, Laravel , Mongodb ,\nTechnologies used: PHP, Codeigniter, Mongodb, Blockchain\nDetail demo product: https://egate.global/\nMarch 2018 - June 2018\nWEB application INternet Banking LIVe\nPOSITION: CODEIGINTER Developper\nDescription: The online banking system will typically connect to or be\npart of the core banking system operated by a bank and is in contrast to\nbranch banking which was the traditional way customers accessed\nbanking services.\nTeam size: 3\nMy responsibilities: \n-BA Design Systems architecture\n-Analysis and development\n-Development Frontend and Backend\n-Optimize code\n-Bug fixing\nTechnologies used: PHP, Codeigniter, Mongodb\n October 2018 - Present\nWEB application Vay Muon version 3\nPOSITION: PHP Developper\nDescription: Lendmo is not a bank, not a finance company. We use\ntechnology to connect the needs of borrowers and investors by\nproviding borrowers with the best rates, the highest return investors.\nTeam size: 1\nMy responsibilities: \n-Analysis and development\n-Development Frontend and Backend\n-Optimize code\n-Bug fixing\n-Maintance\n October 2018 - Present\nWEB application Vay Muon version 4\nPOSITION: PHP Developper\nDescription: Lendmo is not a bank, not a finance company. We use\ntechnology to connect the needs of borrowers and investors by\nproviding borrowers with the best rates, the highest return investors.\nTeam size: 8\nMy responsibilities: \n-Analysis and development\n-Design database\n-Development Frontend and Backend\n-Optimize code\n-Bug fixing\nTechnologies used: Laravel, Mysql, ElasticSearch ... \nTechnologies used: Laravel, Mysql,  ElasticSearch  ... \nHR of HBLAB\nHR of NEXTTECH GROUP\nREFERENCES\n***** *****h\nEmail: *******@gmail.com\n******@peacesoft.net\nINTERESTS\nI like travel\n\u00a9 topcv.vn", "educations": [{"id": 5626, "gpa": null, "major": "Software Engineer", "school": "ITPLUS academy", "diploma": "Bachelors", "end_time": "2017-05-01T00:00:00Z", "conf_score": 0.8895892790548479, "start_time": "2013-10-01T00:00:00Z", "picklist_major": "Other", "major_categories": "", "major_categories_detail": ""}], "experiences": [{"id": 18807, "detail": "- Develop the Web Application based on PHP(Framework Laravel & Codeigniter ) & Mongodb , JS(Vuejs), Blockchain - Communicate directly to client for required", "company": "NEXTTECH GROUP OF TECHNOPRENEURS (WETRADE COMPANY )", "end_time": "2023-04-13T00:00:00Z", "industry": "High Technology", "position": "FULL STACK DEVELOP", "conf_score": 0.9171087048027518, "start_time": "2017-11-01T00:00:00Z"}, {"id": 18808, "detail": "- Develop the Web Application based on PHP( Framework Laravel & Symfony ) & Mysql - Communicate directly to client for required", "company": "HBLAB JSC", "end_time": "2017-11-30T00:00:00Z", "industry": "Other", "position": "PHP DEVELOP", "conf_score": 0.9171087048027518, "start_time": "2016-09-01T00:00:00Z"}], "address": "Hanoi, Vietnam"}