{"skills": ["java", "git", "c++", "testing", "github", "rtos", "automation", "analysis", "golang", "automation test", "python", "reactjs", "arduino", "full stack development", "mysql", "wordpress", "unit test", "sell", "c#", "stack", "bug fixing", "database", "excel", "development testing", "laravel", "docker", "cloud", "frontend development", "php", "android", "angularjs", "mongodb", "vuejs", "manage member", "unit testing", "aws", "communication skill", "asp"], "fulltext": "Nguy\u00ea\u0303n \u0110inh B\u0103\u0301c \nha nam, Vietnam \n https://github.com/NortonBen \nEDUCATION \nThe Thai Nguyen University of Information And Communication \nTechnology \nMajor: Enginner of Software Technology \nGPA: 2.3/4 \n2013 - Present \nWORK EXPERIENCE \nExp Solutions Inc \nMarch 2016 - December 2016 \nDeveloper - Support \nMain responsibilities: \n- Support and fix error of product Forum. \n- Developer plugin wordpress., laravel. \nAchievements and skills gained: \n- Developer laravel, wordpress. \n- Developer Front-end with framework java script \n- Team work with git \nFPT Software \nJuly 2017 - Jan 2018 \nDeveloper \nMain responsibilities \n- Full Stack Developer. \n- Testing with unit test, review code. \n- Make reports work every day. \nAchievements and skills gained: \n- Team work in the Scrum. \n- Improve code \n- Unit test, review code. \n- Team work with git standard. \n- Improve English Communication Skill. \nSKILLS \nLanguage \nEnglish Base \nComputer \nWord, Excel, Powerpoint \nLanguage Programming \njava script 2 year, java 9 month, php 2 year, c# 1 year, c, c++, golang, \npython, nodejs \nExperience Framework \nReact, Vuejs, Angularjs, Adonisjs,Feathersjs, ExpressJs, Laravel, ASP.net \nCore, Android \nGit \nTeam work \nTesting \nUnit test, Automation Test Base \nDatabase \nMongoDB, MySQL \nEmbedded \nArduino, avr, stm32, free-rtos \nPROJECTS \nExp Solutions Inc \n(3/2016 - 8/2016) \nCustomer \nThang Long Group \nDescription \n- This is the application website manage member multilevel. \nTeam size \n7 \nMy position \nDeveloper \nMy responsibilities \n- Developer \nTechnologies used \n- Php, laravel, git \nFPT Software \n(7/2017 - 1/2018) \nCustomer \nCompany japan \nDescription \n- This is the app attendance, publicity \nTeam size \n8 \nMy position \nFull Stack Developer \nMy responsibilities \n- Full Stack Developer \n- Review code \n- Bug Fixing \nTechnologies used \n- Nodejs, Feathersjs, React \n- AWS cloud, Docker, CodePush, MongoDB, git \nFreelancer \n(8/2017 - 10/2017) \nCustomer \nOTVINA company. \nDescription \n- This is the website stock information \nTeam size \n2 \nMy position \nDeveloper \nMy responsibilities \n- Developer \n- Review code \n- Bug Fixing \nTechnologies used \n- Php, Laravel, mysql, git \nFreelancer \n(8/2018 - 10/2018) \nCustomer \nFreelancer user \nDescription \n- This is the website ecommerce. \nTeam size \n3 \nMy position \nDeveloper, Internship \nMy responsibilities \n- Developer \n- Research Golang \nTechnologies used \n- Reactjs, Golang, mysql, git \nFreelancer \n(10/2018 - 11/2018) \nCustomer \nFreelancer user \nDescription \n- This is the website sell \nTeam size \n1 \nMy position \nDeveloper \nMy responsibilities \n- Full Stack Developer \n- Review code \n- Bug Fixing \nTechnologies used \n- Nodejs, Adonisjs, Mysql, git \nFreelancer \n(12/2018 - 1/2019) \nCustomer \nNgo\u1ea1i ng\u1eef Harvard \nDescription \n- This is the website test and exercises \nTeam size \n3 \nMy position \nDeveloper, Architectural Design \nMy responsibilities \n- Design analysis \n- Architectural design \n- Full Stack Developer \n- Bug Fixing \nTechnologies used \n- C#, Asp.net core 2, riotjs, mysql, git \nOBJECTIVE \n- There is a good chance to get promoted in my job. \n- Learn to develop yourself in the hardware and software segments. \n- Develop my skills with the development of the company, I want to prove myself \nADDITIONAL INFORMATION \n- Always share knowledge with every one. \n- I like play game. \n\u00a9 topcv.vn ", "educations": [{"id": 5634, "gpa": "2.3", "major": "C\u00f4ng ngh\u1ec7 th\u00f4ng tin", "school": "The Thai Nguyen University of Information And Communication Technology", "diploma": "Bachelors", "end_time": "2023-04-01T00:00:00Z", "conf_score": 0.7851615749618549, "start_time": "2013-01-01T00:00:00Z", "picklist_major": "IT - Hardware/Networking", "major_categories": "M\u00e1y t\u00ednh v\u00e0 c\u00f4ng ngh\u1ec7 th\u00f4ng tin", "major_categories_detail": "C\u00f4ng ngh\u1ec7 th\u00f4ng tin"}], "experiences": [{"id": 18835, "detail": "Main responsibilities\n- Full Stack Developer. - Testing with unit test, review code.\n- Make reports work every day.\nAchievements and skills gained:\n- Team work in the Scrum. - Improve code\n- Unit test, review code.\n- Team work with git standard.\n- Improve English Communication Skill.", "company": "FPT Software", "end_time": "2018-01-31T00:00:00Z", "industry": "High Technology", "position": "Developer", "conf_score": 0.9512303155325736, "start_time": "2017-07-01T00:00:00Z"}, {"id": 18836, "detail": "Main responsibilities:\n- Support and fix error of product Forum. - Developer plugin wordpress., laravel.\nAchievements and skills gained:\n- Developer laravel, wordpress.\n- Developer Front-end with framework java script\n- Team work with git", "company": "Exp Solutions Inc", "end_time": "2016-12-31T00:00:00Z", "industry": "High Technology", "position": "Developer - Support", "conf_score": 0.9512303155325736, "start_time": "2016-03-01T00:00:00Z"}], "address": "ha nam, Vietnam"}