{"skills": ["networking", "salesforce", "java", "css", "git", "agile", "github", "c++", "internet", "objective c", "python", "jira", "structure", "html", "linux", "cocoapods", "internet architecture", "bitbucket", "insurance", "wordpress", "io", "data analytics", "call center", "jquery", "eauthentication", "sql", "life insurance", "stack", "javascript", "swift", "analytics", "excel", "mobile application", "mobile application development", "bootstrap", "enterprise", "memory leak", "software development", "php", "android", "mongodb", "spring", "microcontroller", "management", "scrum master", "data structure", "raw"], "fulltext": "Trung  Do\nhttps://www.linkedin.com/in/trungdo1993\ndoquoctrung93@gmail.com | +84947054293\nEXPERIENCE\nPRUDENTIAL LIFE INSURANCE | PROJECT MANAGER\nAugust 2018 \u2013 Present | Ho Chi Minh City, Vietnam\n\u2022 Manage two key projects with 10-15 headcounts each\n\u2022 First project: ChatBot to handle claim policy service automatically, reduce\nworkload of call center by 30 percents and increase customer satisfaction by\n30 percents\n\u2022 Second project: Data Analytics to investigate and predict potential fraud\npatterns coming from past data\nCOC COC CO., LTD | SOFTWARE DEVELOPER\nOct 2017 \u2013 July 2018 | Hanoi, Vietnam\n\u2022 Process raw data from system and extract requested information using Bash\nshell command line\n\u2022 Help our client supporters solve client issues and requests which are related to\nsystem\n\u2022 Develop internal tools using Java\nBARCLAYS BANK US | SOFTWARE DEVELOPER\nMarch 2017 \u2013 Oct 2017 | Wilmington, DE\n\u2022 Developed full stack web applications using Node.js, MongoDB, Java\n\u2022 Coordinated with other developers and scrum masters in full Agile cycle\n\u2022 Manually tested \ufb01nancial cases, created test strategy in Excel and updated data\nin TSYS\nENGINE ROOM TECHNOLOGY | APPLICATION DEVELOPER\nOctober 2016 \u2013 March 2017 | Philadelphia, PA\n\u2022 Customized web applications using different kinds of CMS (LAMP, Drupal,\nWordpress and Salesforce) with focus on front-end design (HTML, CSS,\nJavaScript, jQuery, Sass, PHP)\n\u2022 Cooperated with other developers and project managers following Agile\nmethodology\n\u2022 Constantly updated the projects through Jira and stored the code through\nBitbucket\nSOFTWARE MERCHANT INC | MOBILE APPLICATION DEVELOPER\nJuly 2016 \u2013 October 2016 | Wayne, PA\n\u2022 Provided enterprise-level iOS application consulting and development service\nusing both Swift and Objective C\n\u2022 Followed Spring/Agile methodology and constantly gave updates to project\nmanagers for review\nSOCIALLADDER | SOFTWARE DEVELOPER\nMarch 2015 \u2013 Sep 2015 | Philadelphia, PA\n\u2022 Fixed memory leaks issue of the application on Android devices\n\u2022 Improved layout of application by converting from TextView to WebView\n\u2022 Connected Spotify user authentication to the applications\n\u2022 Deployed feed entries, challenges, campaigns and rewards for users\nEDUCATION\nDREXEL UNIVERSITY\nBS IN COMPUTER ENGINEERING\nGraduated in June 2016\nLINKS\nGithub:// Trung Do\nLinkedIn:// Trung Do\nQuora:// Trung Do\nSKILLS\nPROGRAMMING LANGUAGES\nJava \u2022 Swift \u2022 C++ \u2022 Python \u2022 Objective C\n\u2022 PHP \u2022 SQL \u2022 JavaScipt\u2022 HTML\u2022 CSS \u2022\njQuery \u2022 Sass\nFRAMEWORK/PLATFORM\nJava EE \u2022 Bootstrap \u2022 Cocoapods \u2022\nAndroid \u2022 iOS\nOTHERS\nLinux \u2022 Git\nAWARDS\n2011\nDean\u2019s Scholarship\n2010\nDU Endowed Award\n2010\nCerti\ufb01cate of Merit\nCOURSEWORK\nAdv Programming Techniques\nData Structures and Algorithms\nSystem Programming\nDigital System Projects\nDesign With Microcontroller\nComputer Architecture\nComputer Networking\nTransform Methods\nProbability for Engineers\nParallel Comp Architecture\nInternet Arch and Protocols\nComputer Arithmetic\nDigital Logic Design\nEngineering Management\nDigital Signal Processing\n1", "educations": [{"id": 5665, "gpa": null, "major": "K\u1ef9 thu\u1eadt m\u00e1y t\u00ednh", "school": "DREXEL UNIVERSITY", "diploma": "Bachelors", "end_time": "2016-06-01T00:00:00Z", "conf_score": 0.8157291707562553, "start_time": null, "picklist_major": "IT - Hardware/Networking", "major_categories": "M\u00e1y t\u00ednh v\u00e0 c\u00f4ng ngh\u1ec7 th\u00f4ng tin", "major_categories_detail": "M\u00e1y t\u00ednh"}], "experiences": [{"id": 18923, "detail": "| Ho Chi Minh City, Vietnam \u2022 Manage two key projects with 10-15 headcounts each\n\u2022 First project: ChatBot to handle claim policy service automatically, reduce workload of call center by 30 percents and increase customer satisfaction by\n30 percents\n\u2022 Second project: Data Analytics to investigate and predict potential fraud patterns coming from past data", "company": "PRUDENTIAL LIFE INSURANCE", "end_time": "2023-04-13T00:00:00Z", "industry": "Insurance", "position": "PROJECT MANAGER", "conf_score": 0.9542271074073599, "start_time": "2018-08-01T00:00:00Z"}, {"id": 18924, "detail": "| Hanoi, Vietnam \u2022 Process raw data from system and extract requested information using Bash shell command line\n\u2022 Help our client supporters solve client issues and requests which are related to system\n\u2022 Develop internal tools using Java", "company": "COC COC CO., LTD", "end_time": "2018-07-31T00:00:00Z", "industry": "Other", "position": "SOFTWARE DEVELOPER", "conf_score": 0.9542271074073599, "start_time": "2017-10-01T00:00:00Z"}, {"id": 18925, "detail": "| Wilmington, DE \u2022 Developed full stack web applications using Node.js, MongoDB, Java \u2022 Coordinated with other developers and scrum masters in full Agile cycle\n\u2022 Manually tested financial cases, created test strategy in Excel and updated data in TSYS", "company": "BARCLAYS BANK US", "end_time": "2017-10-31T00:00:00Z", "industry": "Banking", "position": "SOFTWARE DEVELOPER", "conf_score": 0.9542271074073599, "start_time": "2017-03-01T00:00:00Z"}, {"id": 18926, "detail": "| Philadelphia, PA \u2022 Customized web applications using different kinds of CMS (LAMP, Drupal, Wordpress and Salesforce) with focus on front-end design (HTML, CSS, JavaScript, jQuery, Sass, PHP) \u2022 Cooperated with other developers and project managers following Agile methodology\n\u2022 Constantly updated the projects through Jira and stored the code through\nBitbucket", "company": "ENGINE ROOM TECHNOLOGY", "end_time": "2017-03-31T00:00:00Z", "industry": "High Technology", "position": "APPLICATION DEVELOPER", "conf_score": 0.9436608569184953, "start_time": "2016-10-01T00:00:00Z"}, {"id": 18927, "detail": "| Wayne, PA \u2022 Provided enterprise-level iOS application consulting and development service using both Swift and Objective C \u2022 Followed Spring/Agile methodology and constantly gave updates to project managers for review", "company": "SOFTWARE MERCHANT INC", "end_time": "2016-10-31T00:00:00Z", "industry": "High Technology", "position": "MOBILE APPLICATION DEVELOPER", "conf_score": 0.9283402044765778, "start_time": "2016-07-01T00:00:00Z"}, {"id": 18928, "detail": "| Philadelphia, PA \u2022 Fixed memory leaks issue of the application on Android devices\n\u2022 Improved layout of application by converting from TextView to WebView \u2022 Connected Spotify user authentication to the applications\n\u2022 Deployed feed entries, challenges, campaigns and rewards for users", "company": "SOCIALLADDER", "end_time": "2015-09-30T00:00:00Z", "industry": "Other", "position": "SOFTWARE DEVELOPER", "conf_score": 0.9512303155325736, "start_time": "2015-03-01T00:00:00Z"}], "address": null}