{"skills": ["studio", "css", "github", "html", "linux", "redis", "iot", "mysql", "symfony", "wordpress", "cakephp", "class", "le", "netbeans", "sell", "visual studio", "magento", "javascript", "payment", "laravel", "ams", "enterprise", "php", "cdn", "operating system", "linux operating system", "aws"], "fulltext": "Nhan Le\nDetails\nProfile\nMy name is Le Quang Nhan and I work as a Technical Leader. I began as a\nprogrammer in \ufffd\ufffd\ufffd\ufffd a\ufffder graduating from the University of Technology in Ho\nChi Minh City. I have gained valuable experience in various programming\nlanguages such as PHP, Javascipt, MySQL and HTML. I am also experienced with\nthe Windows and Linux operating systems as well as other programs including\neClipse, Netbeans, Macromedia DreamWeaver, Photoshop, Zend Studio, and\nVisual Studio. \nHaving worked closely on Drupal over the last \ufffd\ufffd years and Magento \ufffd years. I\ncan appreciate its unique qualities over other web application frameworks.\nThough similar to Wordpress, CakePHP, Laravel, Symfony \ufffd, Zen Framework \ufffd\npossesses its own intricacies that always keep me coming back for more. \nI also have experienced with AWS system, Ocean Digital, AlibabaCloud\n\ufffd\ufffd\ufffd/\ufffd Street \ufffd, Ward \ufffd, Go Vap,\nHo Chi Minh, \ufffd\ufffd\ufffd\ufffd\ufffd\ufffd, Viet Nam,\n\ufffd\ufffd\ufffd\ufffd\ufffd\ufffd\ufffd\ufffd\ufffd\ufffd\nnhanlq@outlook.com\nDate / Place of birth\n\ufffd\ufffd\ufffd\ufffd-\ufffd\ufffd-\ufffd\ufffd\nHo Chi Minh\nNationality\nViet Nam\nLinks\nLinkedin\nGithub\nDrupal Profile\nEmployment History\nTechnical Leader at Smartosc, Ho Chi Minh\nFebruary \ufffd\ufffd\ufffd\ufffd  \u2013  Present\nProjects\nUrbanfox\nUrl:  https://urbanfox.store\nRole: Technical Leader \nDescription: Urbanfox is ecommerce system, it is a marketplace system and\nallow seller register the sell their product on Urbanfox.\nThis system integrate with Lazada, Shopee, Qoo\ufffd\ufffd, Zalora.\nThe system have multi country and build on multiwebsite from Magento \ufffd\nEnterprise\nTechnical: Magento \ufffd Enterprise, Mysql, Redis, CDN, AWS, Loadbalancing, EFS\nMembers:  \ufffd\nWineconnection\nUrl:  https://wineconnection.com\nRole: Technical Leader \nDescription: Wineconnection is a ecommerce website. It sell the wine and gi\ufffd. It\nwas integrated with OCBC Bank.  This is multiwebsite and base on Magento\n\ufffd.\ufffd.x\nTechnical: Magento \ufffd.\ufffd.x, Mysql, Redis, CDN, AWS, Loadbalancing\nMembers:  \ufffd\nSkills\nPHP\nDrupal\nMysql\nLinux\nHTML\nCSS\nJavascript\nMagento\nMykingdom\nUrl:  https://www.mykingdom.com.vn  \nRole: Technical Leader \nDescription: Mykingdom is a ecommerce website. It sell the toys for kid. It was\nintegrated with ANZ Delivery, Viettel Post, Onepay Getway and Microso\ufffd\nDynamic NAV. \nTechnical: Magento \ufffd, Mysql, Redis, CDN\nMembers:  \ufffd\nLeidos\nUrl: https://leidos.com \nRole: Technical Leader\nDescription: Leidos is a website talking about Job Career. It show information\nabout company and jobs.\nTechnical: Drupal \ufffd, Mysql, Acquia Site Factory service, Redis, CDN\nMembers: \ufffd\nTechnical Leader at Intergreat Vietnam, Ha Noi\nNovember \ufffd\ufffd\ufffd\ufffd  \u2013  June \ufffd\ufffd\ufffd\ufffd\nProjects \nIELTS Online Test - IOT\nUrl:  https://ieltsonlinetests.com  \nRole: Technical Leader \nDescription: IOT is a website talking about practice test IELTS online. It have tool\nfor test and have buy Practice test with teacher and have Webinar. It have apply\ndrupal commerce which integrate with Stripe payment, Paypal and Wechat. \nTechnical: Drupal \ufffd, Mysql, Redis, CDN \nMembers:  \ufffd\nCampusmate - CM\nUrl:  https://campusmate.com  \nRole: Technical Leader \nDescription: CM is a website talking about sell class online with teachers. It sell\nthe course with classes and webinar. It have apply Drupal commerce which\nintegrate with Stripe payment, Paypal and Wechat. \nTechnical: Drupal \ufffd, Mysql, Redis, CDN \nMembers:  \ufffd\nTechnical Leader at Splash interactive Vietnam, Ho Chi Minh\nApril \ufffd\ufffd\ufffd\ufffd  \u2013  February \ufffd\ufffd\ufffd\ufffd\nSenior PHP Developer at Pycogroup, Ho Chi Minh\nFebruary \ufffd\ufffd\ufffd\ufffd  \u2013  September \ufffd\ufffd\ufffd\ufffd\nSenior Drupal Developer at Go1 Pty Ltd, Brisbane, Australia\nApril \ufffd\ufffd\ufffd\ufffd  \u2013  January \ufffd\ufffd\ufffd\ufffd\nBachelor of Engineering, HUTECH, Ho Chi Minh\nSeptember \ufffd\ufffd\ufffd\ufffd  \u2013  October \ufffd\ufffd\ufffd\ufffd\nOther Certificate\nCertificate in Udemy https://www.udemy.com/certificate/UC-Q\ufffd\ufffd\ufffdAICV/\nhttps://www.udemy.com/certificate/UC-\ufffd\ufffdFSSWSU/\nhttps://www.udemy.com/certificate/UC-Z\ufffdDZHT\ufffdW/ \nCertificate in Aquia\nhttps://community.acquiacademy.com/user/downloadcertification/id:\ufffd\ufffd\ufffd\ufffd \nEducation\nPowered by TCPDF (www.tcpdf.org)", "educations": [{"id": 5671, "gpa": null, "major": null, "school": "University of Technology in Ho Chi Minh City", "diploma": "Bachelors", "end_time": null, "conf_score": 0.8689692803656918, "start_time": null, "picklist_major": "Other", "major_categories": "", "major_categories_detail": ""}], "experiences": [{"id": 18954, "detail": "Description: Urbanfox is ecommerce system, it is a marketplace system and allow seller register the sell their product on Urbanfox. This system integrate with Lazada, Shopee, Qoo , Zalora. The system have multi country and build on multiwebsite from Magento Enterprise Technical: Magento Enterprise, Mysql, Redis, CDN, AWS, Loadbalancing, EFS Members: Wineconnection Url: https://wineconnection.com\nRole:", "company": "Smartosc", "end_time": "2023-12-31T00:00:00Z", "industry": "High Technology", "position": "Technical Leader", "conf_score": 0.851734717643533, "start_time": "2023-04-01T00:00:00Z"}], "address": "Ho Chi Minh"}