{"skills": ["aws", "angular", "css3", "backbone", "marketing", "json", "responsive", "javascript", "phpstorm", "ams", "mongodb", "eauthentication", "search engine", "redux", "frontend development", "git", "svn", "html5", "firebase", "html", "microservices", "search", "website development", "php", "css", "oop", "bower", "search engine optimization", "le", "github", "oauth", "microsoft", "gulp", "firestore", "azure", "bitbucket", "bootstrap", "mysql", "jquery"], "fulltext": "NGHIA TRAN (JOHN)\nFRONT END ENGINEER\nI am seeking a position within the Information Technology department, possibly with an\ninternational perspective (special interest in Western Europe, North America and Japan).\nlam an experienced Website Developer looking to continue my career within agency\nside development.\n6/\nWEB DEVELOPMENT SKILLS\nWorking knowledge of HTML5 / CSS3.\nBuilding Responsive Website and Mobile Website.\nCross-browser coding experience with understanding of code optimization.\nAbility to take PSD designs and build in HTML/CSs to W3C standards.\nA working knowledge of Photoshop, Sketch.\nKnowledge of SEO or semantic mark-up is desirable.\nKnowledge of HTML email best practice desirable.\nExperience with Bootstrap, Angular 2+, React, Node.js, PHP.\nWORK EXPERIENCE\nWTH! | May 2016 - July 2019\nSenior Front-End Engineer\nBuilding a frontend web application that integrates seamlessly with\nmicroservices backend.\nCreating Progressive Web Apps Using Angular 2+.\nCreating Web Applications with Reactive Programming and Redux.\nBuilding a chat, note, contact, social, fle manager apps.\nINTERESTMARKETINGINC | April 2015-May 2016\nSenior Front-End Developer\nWeb development using Less/Sass, Gruntjs/Gulp, Bower and Backbone\nthrough Git-flow.\nImade the website faster and full responsive, the member's area uses a\nREST+JSON API and OAuth authentication.\nWorked with back-end team using PHP and Smarty templating engine.\nOrganic Search Engine Optimization.\nPROSTAGE CO.LTD | March 2014 - March 2015\nSenior Front-End Developer\nI was in charge of the Front-end/Ul of the company websites, working with\nthe Creative team to deliver a great User Experience.\nFul website development using HTML5/CSS3, Bootstrap, a custom\nMV* /OOP JavaScript.\nImade the website Xx faster and fullyresponsive.\nPINETECH MULTIMEDIA JSC | May 2011- March 2014\nFront End Developer\nI built the company's website as well as the front-end of a wide range of new\nwebsites from zero to launch including hyper-optimised landing pages.\nAlso trained the Creative Team weekly, provided feedback and ideas for new\nventures and worked closely with the UI/UX and Marketing teams to achieve\nmaximum results.\nKEY SKILLS\nHTML5, CSS3, SASS, LESS\nBootstrap\njQuery\nAngular 2+\nReact\nNode.js, PHP\nFirestore, MongoDB, MySQL, Postgre\nGitHub, Bitbucket, SVN\nSublime Text, PHPStorm\nPhotoshop, Sketch, Ilustrator\nFirebase, Azure, AWS\nLANGUAGE SKILLS\nVietnamese\nEnglish\nINTERESTS\nRunning: to unwind and clear my\nmind for the day ahead, I try to run\nat least 3 km each weekday.\nListening to music: Music is a large\npart of my life, and I listen to\neverything from hip-hop to jungle\nto classical.\nReading: I lke reading newspapers\nand my interest is in learning new\nstuff every day. Especially new\ntechnology applied in web\ndevelopment and other fields. My\nfavorite is\"Smashingmagazine.com\"\nand\"Tympanus.net/codrops\"> as\nmentioned above. Sometimes it\ndoes link to some very helpful\ntutorials.\nEDUCATION AND CERTIFICATION\nELECTRONICS & TELECOMMUNICATIONS ENGINEERING | 2011\nHo Chi Minh City University of Transport\nWEBDEVELOPERI2011\nNhat Nghe ICT Training Center\nMICROSOFT CERTIFIED SOLUTIONS ASSOCIATE (MCSA) | 2011\nNhat Nghe ICT Training Center\nCISCOCERTIFIEDNETWORKASSOCIATE(CCNA) | 2010\nVietnamese Professional (VnPro) Training Center\nRECENT WORKS\nyeah1.com\nmnewsvn.com\nchuthi.com.vn\nING3\nDURZLLE\nplayeverwing.com\nfast.com.vn\nblendedlearning.edu.au\nWEMAK\nHRAPPY\nLIENTS\nT\nohmnilabs.com\nhearinglife.com.au\nvavmedias.com\nTun \nAS\nTBATTAN\nMSOE\nhdonline.vn\ntapchisao.vn\nthuanviettv.vn\nFLOG\nsutarepi.net\nflog-golf.net/app/howto\ndcine.live\nREFERENCES\nMr. Tran Minh Vu\nCEO -TMVSolution\nPhone: 090 743 6956.\nEmail: vu.tran@tmvsolution.com\nRelationship: Works.\nMr. Nguyen Quan\nTechnical Manager - Prostage.\nPhone: 093 220 9239.\nEmail: n_quan@stagegroup.jp\nRelationship: Works.", "educations": [{"id": 5684, "gpa": null, "major": "Kinh t\u1ebf n\u00f4ng nghi\u1ec7p", "school": "Ho Chi Minh City University of Transport", "diploma": "Bachelors", "end_time": "2011-01-01T00:00:00Z", "conf_score": 0.8011899823109764, "start_time": null, "picklist_major": "Agriculture / Forestry", "major_categories": "N\u00f4ng, l\u00e2m nghi\u1ec7p v\u00e0 th\u1ee7y s\u1ea3n", "major_categories_detail": "N\u00f4ng nghi\u1ec7p"}], "experiences": [{"id": 19006, "detail": "uilding a frontend web application that integrates seamlessly with microservices backend.\nCreating Progressive Web Apps Using Angular 2+. Creating Web Applications with Reactive Programming and Redux. Building a chat, note, contact, social, fle manager apps.", "company": "WTH!", "end_time": "2019-07-31T00:00:00Z", "industry": "Other", "position": "Senior Front - End Engineer", "conf_score": 0.9338341297122752, "start_time": "2016-05-01T00:00:00Z"}, {"id": 19007, "detail": "development using Less/Sass, Gruntjs/Gulp, Bower and Backbone through Git-flow. Imade the website faster and full responsive, the member's area uses a\nREST+JSON API and OAuth authentication.\nWorked with back-end team using PHP and Smarty templating engine.\nOrganic Search Engine Optimization.", "company": "INTERESTMARKETINGINC", "end_time": "2016-05-31T00:00:00Z", "industry": "Other", "position": "Senior Front - End Developer", "conf_score": 0.9436608569184953, "start_time": "2015-04-01T00:00:00Z"}, {"id": 19008, "detail": "was in charge of the Front-end/Ul of the company websites, working with the Creative team to deliver a great User Experience. Ful website development using HTML5/CSS3, Bootstrap, a custom\nMV* /OOP JavaScript. Imade the website Xx faster and fullyresponsive.", "company": "PROSTAGE CO.LTD", "end_time": "2015-03-31T00:00:00Z", "industry": "Other", "position": "Senior Front - End Developer", "conf_score": 0.9338341297122752, "start_time": "2014-03-01T00:00:00Z"}, {"id": 19009, "detail": "I built the company's website as well as the front-end of a wide range of new websites from zero to launch including hyper-optimised landing pages.\nAlso trained the Creative Team weekly, provided feedback and ideas for new ventures and worked closely with the UI/UX and Marketing teams to achieve maximum results.", "company": "PINETECH MULTIMEDIA JSC", "end_time": "2014-03-31T00:00:00Z", "industry": "High Technology", "position": "Front End Developer", "conf_score": 0.9522414576104914, "start_time": "2011-05-01T00:00:00Z"}], "address": null}