{"skills": ["scala", "investments", "java", "git", "css", "agile", "named entity recognition", "analysis", "python", "visualization", "html", "bdd", "tensorflow", "redis", "azure", "kubernetes", "circleci", "point to analysis", "django", "panda", "selenium", "elasticsearch", "theano", "numpy", "deep learning", "javascript", "lstm", "nltk", "object oriented", "ansible", "ams", "docker", "cloud", "tdd", "rest", "hadoop", "mongodb", "named entity", "google cloud", "ence", "aws", "bot"], "fulltext": "Vu Quang Vinh\nvuquangvinh0412@ gmail.com\n(+84) 906391712\nGender Male\nNationality Vietnamese\nDate of Birth\nDec 04, 1991\nVu Quang Vinh\nSoftware/Data Engineer\nAbout Me I am known as outspoken, easygoing man. I love natural sci-\nence and natural landscape.\nObjective Become a software tech lead and a senior data engineer\nExperiences\n[Sep 2017 - Now] Senior fullstack developer at Eastagile\n\u2022 Explore Chicago police complaint dataset and make visualizations\n\u2022 Develop a website about complaints and polices in Chicago (and\nother cities in US)\n\u2022 Technologies I used:\n\u25e6 Django\n\u25e6 REST framework\n\u25e6 Elasticsearch\n\u25e6 Postgre\n\u25e6  React \u25e6  Selenium/Nightwatch \u25e6  Enzyme \u25e6  D3\n\u25e6 Agile\n\u25e6 TDD & BDD\n\u25e6 Git Flow\n\u25e6  Kubernetes \u25e6  CircleCI \u25e6  Docker \u25e6  Ansible\n\u25e6 Google Cloud\n\u25e6 AWS\n\u25e6 Azure\n\u25e6  Python \u25e6  JavaScript \u25e6  CSS/SASS \u25e6  HTML\n[Mar 2017 - Sep 2017] Data Scientist at De\ufb01de\n\u2022 Working on NLP and Deep learning to develop a Japanese chat bot\n\u2022 Technologies I used:\n\u25e6  TensorFlow \u25e6  Pandas \u25e6  Numpy\n\u25e6 Deep Leaning\n\u25e6 LSTM attention\n\u25e6 Named Entity Recognition\n\u25e6  AWS \u25e6  Python\n[Sep 2016 - Mar 2017] Software Engineer at PL lab, POSTECH\n\u2022 Develop a Hadoop engine named MR3\n\u2022 What I have learned:\n\u25e6 Scala\n\u25e6 Java\n\u25e6 Bash Shell\n\u25e6  Hadoop \u25e6  Tez \u25e6  Spark\n\u25e6 Multi-thread Programming\n\u25e6 Git\n\u25e6 Clean Code\n[Oct 2014 - Sep 2015] Researcher at R&D department - TMA Solutions\n\u2022 Research on ML and NLP for various potential problems\n\u2022 Develop a demo Hadoop system for social network investment\n\u2022 What I have learned:\n\u25e6  Theano \u25e6  Pandas \u25e6  Numpy\n\u25e6  MongoDB \u25e6  Redis \u25e6  Git\n\u25e6 NLTK\n\u25e6 Deep Learning\nEducation\n2014 - 2016, Japan Advanced Institute of Science and Technology(JAIST)\nM.Eng. in Information Science\nThesis title: Counterexample-guided abstraction re\ufb01nement for points-to\nanalysis of object-oriented programs\n2009 - 2014, Ho Chi Minh City University of Technology\nB.Eng. in Computer Science - Honor Program - GPA: 8.06/10.0\nLanguages\nEnglish - Toeic 810", "educations": [{"id": 5696, "gpa": "8.06", "major": "Khoa h\u1ecdc m\u00e1y t\u00ednh", "school": "Ho Chi Minh City University of Technology", "diploma": "Other", "end_time": "2014-01-01T00:00:00Z", "conf_score": 0.8505486136941875, "start_time": "2009-01-01T00:00:00Z", "picklist_major": "IT - Hardware/Networking", "major_categories": "M\u00e1y t\u00ednh v\u00e0 c\u00f4ng ngh\u1ec7 th\u00f4ng tin", "major_categories_detail": "M\u00e1y t\u00ednh"}, {"id": 5695, "gpa": null, "major": "An to\u00e0n th\u00f4ng tin", "school": "Japan Advanced Institute of Science and Technology(JAIST)", "diploma": "Other", "end_time": "2016-01-01T00:00:00Z", "conf_score": 0.8141298764232529, "start_time": "2014-01-01T00:00:00Z", "picklist_major": "IT - Hardware/Networking", "major_categories": "M\u00e1y t\u00ednh v\u00e0 c\u00f4ng ngh\u1ec7 th\u00f4ng tin", "major_categories_detail": "C\u00f4ng ngh\u1ec7 th\u00f4ng tin"}], "experiences": [{"id": 19039, "detail": "\u2022 Explore Chicago police complaint dataset and make visualizations\n\u2022 Develop a website about complaints and polices in Chicago (and other cities in US) \u2022 Technologies I used:\n\u25e6 Django \u25e6 REST framework\n\u25e6 Elasticsearch \u25e6 Postgre \u25e6 React \u25e6 Selenium/Nightwatch \u25e6 Enzyme \u25e6 D3 \u25e6 Agile \u25e6 TDD & BDD \u25e6 Git Flow \u25e6 Kubernetes \u25e6 CircleCI \u25e6 Docker \u25e6 Ansible \u25e6 Google Cloud \u25e6 AWS \u25e6 Azure \u25e6 Python \u25e6 JavaScript \u25e6 CSS/SASS \u25e6 HTML", "company": "Eastagile", "end_time": "2023-04-13T00:00:00Z", "industry": "Other", "position": "Senior fullstack developer", "conf_score": 0.9125515786070235, "start_time": "2017-09-01T00:00:00Z"}, {"id": 19040, "detail": "\u2022 Working on NLP and Deep learning to develop a Japanese chat bot\n\u2022 Technologies I used:\n\u25e6 TensorFlow \u25e6 Pandas \u25e6 Numpy \u25e6 Deep Leaning \u25e6 LSTM attention\n\u25e6 Named Entity Recognition \u25e6 AWS \u25e6 Python", "company": "Defide", "end_time": "2017-09-30T00:00:00Z", "industry": "Other", "position": "Data Scientist", "conf_score": 0.9125515786070235, "start_time": "2017-03-01T00:00:00Z"}, {"id": 19041, "detail": "\u2022 Develop a Hadoop engine named MR3 \u2022 What I have learned:\n\u25e6 Scala \u25e6 Java \u25e6 Bash Shell \u25e6 Hadoop \u25e6 Tez \u25e6 Spark \u25e6 Multi-thread Programming \u25e6 Git \u25e6 Clean Code", "company": "PL lab, POSTECH", "end_time": "2017-03-31T00:00:00Z", "industry": "Transportation & Logistics", "position": "Software Engineer", "conf_score": 0.9125515786070235, "start_time": "2016-09-01T00:00:00Z"}, {"id": 19042, "detail": "\u2022 Research on ML and NLP for various potential problems\n\u2022 Develop a demo Hadoop system for social network investment\n\u2022 What I have learned:\n\u25e6 Theano \u25e6 Pandas \u25e6 Numpy \u25e6 MongoDB \u25e6 Redis \u25e6 Git \u25e6 NLTK \u25e6 Deep Learning", "company": "R&D department - TMA Solutions", "end_time": "2015-09-30T00:00:00Z", "industry": "High Technology", "position": "Researcher", "conf_score": 0.7707675877424722, "start_time": "2014-10-01T00:00:00Z"}], "address": null}