{"skills": ["regression", "java", "automation", "wordpress", "automation testing", "selenium", "sales", "java language", "studio", "sanity testing", "administration", "jquery", "hard working", "regression testing", "analysis", "appointments booking", "functional testing", "system testing", "interface testing", "sql", "css", "accounting", "maven", "testing", "quality assurance", "clarify", "testng", "test data", "erp system", "user interface", "sdlc", "katalon", "html"], "fulltext": "AndrewNguyen\nNGUYEN HUYNH VIET DUNG\nCONTACT\nYoB: 1989\nEmail: vietdung.nh@gmail.com\nAddress: 107/3/10, Street 1, Ward 11, Go Vap District, HCM City\nPROFILE\nLooking for a position in QC which have professional and challenging working environment which\nrelated to my knowledge as well as achieved skill from the fied.\nSUMMARY\n4 years of experience in software quality assurance\nO.5 year of experience in Web automation\nExtensive work experience on software testing techniques\nExpertise in Test documentation such as Test Plan, Test Data..\n+_Well yersed in.Defect Iracking & Bug-Reportingusing Defect Tracking tool\nHave general knowledge of methodology followed in the SDLC and STLC\nHaving good knowledge inautomation with Selenium as wellas Katalon tol, building framework with Selenium\nHaving basic knowledge in ERP system\nManual skills\nExtensive work experience on Sanity Testing, Regression Testing,\nFunctional testing, and System Testing, User Interface Testing and Ad-\nhoc testing\nHaving basic knowledge with APl testing\nE\nExpertise in documentation including preparation of Test Plan, Test\nSpecification and Test Procedure, Test Data\nWellversed in Defect Tracking & Bug Reporting using Defect Tracking\ntool\nHave general knowledge of methodology folowed in the SDLC and\nSTLC\nAutomation skills\nHaving basic knowledge with programming language: Java\nBuildingframework with elenium\nHaving good knowledge in automated testing tool: Selenium,\nCucumber\nHaving good knowledge in automation testing framework: TestNG\nHaving good knowledge in automation tool with Selenium as we as\nKatalon Studio\nHaving experience with using IDEs: Eclipse, Intell IDEA\nHaving good knowledge in web technologies: HTML, CSS, Jquery\nSKILLS\nRequirements Analysis\nSoftware testing\nSQL Server basic\nWeb Automation with Katalon, Selenium\nBuilding framework with Selenium\nHave good knowledge with build tools: Maven\nHTML, CSS, Wordpress\nProgramming language: Java\nSOFT SKILLS\nAbility to acquire new knowledge\nWillig to study new technologies\nHard-working\nDynamic, and both team and in-dependency\nEXPERIENCE\nKMS Technology, Inc. - QA Engineer\nOctober 2017 - Present\nProject: ERT\nParticipating in all reviews of the project at offshore\nCreating testig artifacts: test cases, test reports, testscripts, test summary, test outputs..\nReviewing documents testing and estimating testing effort\nManaging and performing develop test scripts\nManaging and performing the testing execution\nCoordinating and communicating with others (including PGH Coordinators and offshore members) in carrying out testing and maintaining test\nschedule\nUsing Katalon Studio tool to implement some parts of the project\nSynova Solutions - QA Engineer\nApril 2017 - October 2017\nProject: VCCI HCM | EDEEL\nExecuted Test, developed Test cases\nPrepared Environment testing\nGathering requirement with the internal team to clarify the requirement\nSupported team leader to trained new team member\nCommunicated and solved the problem with clients\nSolved problem in QA team\nCommGate - QC cum support coordinate Project\nJan 2015 - Mar 2017\nWork with internal teams to obtain an in-depth understanding of the product and the documentation requirements\nAnalyze existing and potential content, focusing on reuse and single-sourcing opportunities\nGathering requirement on internal ERP project about Sales, Accounting, Purchasing, Warehouse..\nDevelop and Execute Test Cases for testing Website, Landing page, Appointment Booking\nSupported team leader to trained new team member\nWriting technical document\nCommunicated between VN team and SG team to clarify and gather requirement\nManage and make sure project go live on-time\nEDUCATION\nISTQB Course - 2016\nTVN - TESTING VN Limited Company\nBachelor in Business Administration - 2015\nFPT - University of Greenwich\no", "educations": [{"id": 5682, "gpa": null, "major": "Qu\u1ea3n l\u00fd \u0111\u00f4 th\u1ecb v\u00e0 c\u00f4ng tr\u00ecnh", "school": "FPT - University of Greenwich", "diploma": "Bachelors", "end_time": "2015-01-01T00:00:00Z", "conf_score": 0.8464256548178335, "start_time": null, "picklist_major": "Architecture / Interior Design", "major_categories": "Ki\u1ebfn tr\u00fac v\u00e0 x\u00e2y d\u1ef1ng", "major_categories_detail": "Ki\u1ebfn tr\u00fac v\u00e0 quy ho\u1ea1ch"}], "experiences": [{"id": 18997, "detail": "Project: ERT Participating in all reviews of the project at offshore\nCreating testig artifacts: test cases, test reports, testscripts, test summary, test outputs..\nReviewing documents testing and estimating testing effort\nManaging and performing develop test scripts\nManaging and performing the testing execution\nCoordinating and communicating with others (including PGH Coordinators and offshore members) in carrying out testing and maintaining test schedule\nUsing Katalon Studio tool to implement some parts of the project", "company": "KMS Technology, Inc.", "end_time": "2023-04-13T00:00:00Z", "industry": "High Technology", "position": "QA Engineer", "conf_score": 0.9192536033612259, "start_time": "2017-10-01T00:00:00Z"}, {"id": 18998, "detail": "Project: VCCI HCM | EDEEL Executed Test, developed Test cases\nPrepared Environment testing\nGathering requirement with the internal team to clarify the requirement\nSupported team leader to trained new team member\nCommunicated and solved the problem with clients\nSolved problem in QA team", "company": "Synova Solutions", "end_time": "2017-10-31T00:00:00Z", "industry": "High Technology", "position": "QA Engineer", "conf_score": 0.9210088910403198, "start_time": "2017-04-01T00:00:00Z"}, {"id": 18999, "detail": "Work with internal teams to obtain an in-depth understanding of the product and the documentation requirements\nAnalyze existing and potential content, focusing on reuse and single-sourcing opportunities\nGathering requirement on internal ERP project about Sales, Accounting, Purchasing, Warehouse.. Develop and Execute Test Cases for testing Website, Landing page, Appointment Booking Supported team leader to trained new team member\nWriting technical document\nCommunicated between VN team and SG team to clarify and gather requirement\nManage and make sure project go live on-time", "company": "CommGate", "end_time": "2017-03-31T00:00:00Z", "industry": "Other", "position": "QC cum support coordinate Project", "conf_score": 0.9192536033612259, "start_time": "2015-01-01T00:00:00Z"}], "address": "107/3/10, Street 1, Ward 11, Go Vap District, Hcm City"}